,0
93,ABFEEDDDDDC AAABBCDEFFF FFEEEDCCBAA FFEEEDCCBAA ECBAABBDEFF AABCDEFFEDB BBBBCCBCEFF AABBCDDEEFF AAACDEEEEEE BBBBBBCDEFF EEFEEDDCBAA AAABCDEFFFE FFEDCCBBBAA EEEEEEECBAA ABEFFEEDCBB FFEDDCCBAAB AAABDEEEFFE BBAABCDEFFF AABCDEEFFDD FFFFEDBAAAA FFFEEDCBAAA AABCDEEEEEF AABBBCDEFFF
94,CAABBCCDEFF AABBCCDEFFF AABCDEEFFED CBAACDFFEDC FFFEDCBBAAA BBBCDEFFEBA FFECBBBBCCC ABBBCCDEEFF CDEEFFECAAA EFFEEEDCBAA BBBBBBCDEFF EFFEEDCBAAA BAABBCDEFFF AABDDEEEEEE DEEEEEDDBAA FFEDCBBBBBB CCDEEFFECAA FFECBBBBBCB BCBAABDEFFF AAABCCDEFFF AABBCCDDEFF ABDEDEDDCDF AABBCBEFFEE
95,ABDFFEEDCBB FFCBBBBBCDE AABBBDDEFFF BBBABCDEEFF FFFEDCBBAAB AAABCDEFFFE FFFECBBBBBB FFECBAABBCD EEEFFEDBAAA AAABCDEEFFF ABBBBCCDEFF FFEEDDCBBAA AAABCDDEEFF FFFECBBBBBB DCDEEFEECAA BAABBCDDFFF FFFEEDCBBAA DCBBBBBCEFF EFFEEDCBAAA CAABBCCEEFF AABBCCDEEFF AABBCDEEEFF AAABBCDEEFF
96,FFEDCCCBBAA AAABBCDEFFF AAABCDDEFFF FEEDDEDDBAA CCBBBABDEFF AABBCDDEFFF FFFEEDCBAAA FFEEDCBBAAA AABBBCDEEFF AABBCDDEEFF AABBBCDEFFF FFEEDDCBBAA CBAABCCDEFF AABCDEEEEEE BCDDEFFEDAA FFEDBAAABDE AAABCDEFFFE FFFEDDCBBAA AABCEFEEEEE AAABCDDEEFF AABBCCDEEFF AABBCDDEEFF AAABBCDEFFF
97,CCEEFFDCBAA FFEDCCBBBBB EEEEEEDCBAA FFEEEDDCBAA BABBBCDEEFF EEFFEDCBAAA DCCBBABDEFF AABCCDDEEFF AAABCDEEEEF EEDDBAABCEF FFFEEDCBAAA AABBCDEEFFF FFEDCCBBBBA ABCDEFFEDBA BBBBABCEFFF FFEDDCBBBAA FFEEDDDCBAA CBBAABCDEFF AABCDEEEEEE EEEFCBBFCBA FFFBBBCBBBB FFEEEEBBAAA BBCDEFCABFE
98,AEFDDECDDCB AAABBCDEFFF DDDEEEEDCAA FFEEDDCBBAA FFEDBAABBCE ACDEFFEDCAA FDCAAABDEFF AABBCDDEEFF FFFDAABBCCD FFFEDCBAAAC DDEEFFECAAA ABCCCBBDEFF AABCDFFFEDC FFEEDDCCBAA CBBBABCDEFF AAABCEFFEEE FFEEDCAAAAE CBBAABDEFFF FFEDCBBBBBB BBBBBBBDEFF AABBBCDEEFF AABBCCDEFFF BBABBDDDEFF
99,AABDEEEEEDE FFEEDCCBBAA FFEEDDCCBAA AACEEEEEEDD FFFEDCCBAAA BAAABCDDEFF AABCDEEEEEE FFEEEDCBBAA FEEEEDDCBAA ACEFFECCCAA BBBBBBCDEFF ABCBBDFFEEE ABAABDEFFFE FFDCBBBDDBA FFEEEDCCBAA AABCDEEEEEE FFEEEDCBBAA FFFEDCBBAAA AAABBCDEFFF AABBCCCDFFF AAABCDEEEFF FFFEEBBBBAA BBBBBBDDEFF
100,CEFEEEDCBAA FFECBBCBBBB AAABCDEFFED FFEEEDDBAAA AABBBCDEFFF FFEDCBBBBBB FFECAABBCDE AABCDDEEEEF AAABCDEEFFF AABBBCCDEFF ABBCEFFFDBA FDBAAABDEFF FFFFDCBBAAA AAABDEFFFEC CCCBBBABEFF FFFEDCBBBAA FFFEDDCBAAA FECABABBCEF AABCCDEEEFF FFEDCCCBBBA BAAACEEEEFF AAABDDEEEFF AABCDEEEFEA
101,AACEEEEDDDD FFEDCCBBBBB AABCDEEEDBF AABCDEEEEEE FFFEDDCBAAA AAABCDDEEFF AABDEFFEEDB FFEEDCBBBAA CBCDDEEEECA FDCCCCCCCBB BBBBBBCDEFF BEDFFEDCAAA BAABBCDDEFF FDBBAABCEFF EEEEEEDCBAA FECBBECBCBB EDCBAACEFEB FFEEDCCBAAA CBAABCDEFFF CCCBBABCEFF AABBCCDEEFF BDEFFEEDBAA BBBBBCDDEFF
102,FFFEEDBBBAA FFEEDCBBBAA ACCCDDEEEEE BBBBBBCCCEF AACDEFFFDCA FDCBAABCDFF AABCDEEEEEE EEEFFEBAAAA AAABDEEEEEF AABBCDEFFFC FFEEDDCBAAA BBBBBCCDEFF FFEDCBBBBBB CDEEFFECAAC BCDCDDFFEBA FFEEDCCBBAA AAABCEEEEEF AACDEFFEDBA BAABCDEEEFF BCDEEFFECAA FFFEDCBBAAA AABBCDDEEFF AAABCDDEFFE
103,FFEDDCBBBAA AAABBCDEFFF AAABDDEEEFE FEEDCDEDCAA FFFDBBBBBBB BBCDEFFEDBA CAAABCDEFFF AABCCCCDEFF FFFDAABBCCD ABBBCCCDEFF CCDDEFFDBAA FFEEECBAABC AABBCDDEEFF FFEEDCCBBAA FFEEEDCBBAA AAABCEEFFED FFFEDCCBBAA AADFFFEEDBB AAAABDEEFFF AABCCCCDEFF BBAABBDEEFF AABBDEEEEEF AAABBCDEFFF
104,FFEEDCBBAAA FFFFECBBBAA FFEEDCBBAAB ABBCDCCCDFF AAABCDEEFFF FFEDCBAABCE AABCDDEEEEE EFFFEBAABCD AABCEFFFEDB FFFEDCCBBAA FFFEDCBBAAA AABCDEFFEDC FFEDCBBBBBB ABBBBCDEFFF DDEFFEDCBAA FFDDDDCBBAA AAABCDEFFFF FECBAABCDEF AABCCDEEEFF AABBCCDEFFF AABBCCDEFFF DDEEEEEDBAA FFECBBBBBCC
105,BBBBBBCDEFF FFEEDCCBBAA FFEEDDCBBAA FFEEDDCBBAA FFFEDCBBABB AAABCCDEFFF FFFEDCBAAAB AABCDEFEEEE AACEFFFEBBC AABBBCDDEFF ABCDEFFECBA FFEEDDCBAAA AAABBCDEFFF FFEDDCCBBAA BBAABBDEFFF BCEFFEDCBAA FFEEDDCBBAA AAACEFEDCDE FFFDCBBBBBB CAAABCDEEFF ABBBBCDEEFF ABEEBFFECBA DDCBAABDDEF
106,AABBBBDEFFF AAABCDEEEFF AABBCDDEEEF AABCDDEEEEE FFFEDDCBBAA FFEDCBAABCD AAABCEDEEFF FFFEDDCBAAA FFEEDDCBBAA FFFDCCCBBAA BBBBBBCDEFF AADEEEEEDED FFEEDCBBBAA CBAABCDEFFF EEEEEEDCBAA FFEDCCBBBAA FFFEDDCBBAA AAAADEEEEEE AABCDEEEEEF FFEEDDDDAAA FFFDBCCBBBB EEEEFECBAAA EEEEEEDDBAA
107,FFFDCBBBBBB AABCDDDEEFF BBBBBBCEFFF EEEEEDDCBAA FFDBAAABCEE AABCCDEFFED AABCEFEEEDD FFFEDCCBBAA EEEEEEDCAAA AABCDEEEEEF BBBBBBCDFFF ABBCEEEEEED EEEFFDCBAAA FECBBBBCEDB FFEEEDDCBAA AEFFEDCCBBA FFEEEDCBBAA FECBAABCCEF AACDDDEEEEE DEFFECABBAB DDDDEEFEBAA AAABCDDEEFF DDDEEEEECAA
108,EFFEDCCCBAA BAAABCDEFFF AABBCEEFFED FFEEDDDCBAA FFEDCCBBBBB CDEEEFEDBAA BAAABCDEFFF AABCCDDEFFF FFCAABBCCDD BEFEDCBAAEF CDDEFFECBAA FFFEEDCBAAA AABBBCDEFFF AEDDDCCDDDD EEEEEDDCBAA CAAABCDEFFF EEEEEEDCBAA FFEEDCBBAAB AABBCDDEFFF AAABCDDDEFF AABBBCDFFFF FEEEECDCAAA BBBBBCCDEFF
109,FFEEDCBAABC AABCCDDEEFF AABBCDEEFFF EEEEEECBCAA AAABCCDEFFF FFFEDCBCBAA CBAABCDEFFF AABBCCDEEFF FFEAABBCCDD ABBBBCCDEFF ABCEFFFECAA CBAABCDEFFF FFEDCCBBBAA FEEEEDDCBAA AACEEEEEDCC FFEDCBABCBB FFEEDDCBAAA AAAABDDEEFF AABCDDEEEEE AAABCCDEFFF AABBBCDEFFF AABBBCDEFFF FFFEDCBAAAB
110,EFEEDDCBBAA FFEDCCBBBBA FFEEEDDCBAA EDCBBBBBCFF ABCDEFFFDBA FFEEDCBBAAA AAABBCDEFFF AAABCDEEFFE FFBABBCCDDE AABBBCDDEFF EEFFEDCBBAA DCBAAABDEFF DEFFFECBAAA FFEEEDCBBAA DDCCBBAACFF ABDFFFEDCBA FFEDCCBBBAA AAABCDDDEFF FFEECCBBABB AAABCDEFFEF BBBBBCCDEFF AABBCDDEEFF AABBBCDDEFF
111,FFEEDCBBBAA FDBAADCCBEF EEEDCEEDDBA FEEEEDDBBAA AABBBCDDEFF FFFEDCBAABB AAABCDEEEFF BABBBBDEFFF FFFEDBBBBBB AABCCDDDEFF AABBCEFFEDB FFEEDDBBBAA AAABCDDEFFF FFEDCCBBBAA FFFEDCBAAAB AAABBCDEFFF FFFEDCBBAAA FFEDBAABBCE AABBCDEEEFF AABBCDDEFFF AABBBCDEEFF ABBBBCDEFFF AABDEEEEEFA
112,FFEEDCCBBAA ECAAABCEEFF FEEEEEDCBAA BBBBBBCDEFF EEFFEECBBAA FFCBBBBBCDD AAABCDEEFFF AABCCEEFFED FCAABCCDDDE AABBBCDDEFF FFFEEDCBBAA BAAABCDEFFF FFFEDCBBAAA FFEEDDCBBAA FFEEDCBAAAC AABDEEFEEDD FFEDCCBBBBA AABBBCDEEFF FFFEDCBBAAA AAABCCDFFFF AABDDCEEEFC BCCCBABDEFF AAABCDDEEFF
113,FEDCCBAABCE AABCCDDEEFF AABBCDEEEFF BCDEEFEECBA AAABBCDEEFF DEFFEDCBAAB AAABCDEEFFF BBBBBCDEFFF FFCBBBCCCCC BBBBBBBCDFF EEEFFEDBAAA AAABBCDEEFF EFFFEDCBAAA FFEEDDCBBAA FDBCDFEBABD FFEEDCCBBAA BBAAEFFEDDB AAABBCDEFFF AABCDDEEEFF AABBCDEEFFF AABBBCDEFFF BBBBBBCDFFF FFFEDCBAABB
114,BBBBBBCEFFF AACDDEEEEED FEEEEEDCBAA FFDBBBBBCCC FFFEDCBBAAB ABBBBBCDEFF FFFEDCBBAAA CAAEFEBCBCF AABCDEFFFEA AABDEEEEEDC BBBBBBCDEFF ACFFFEDCCAA AAACDEFFEDD FFEDDCCBBAA FFEEEDCBAAA AAABCDEEFFF FFEEEDCBAAA CBABDDCBDFF FFFEEDCBAAA FFCCCCCCBBB AABBCCDDEFF ACEEFFFDBAA CBBAABDEEFF
115,FFEEDCBBAAA AABDDCCDEFF AABBBCDEFFF CDEEEEEDBAA AABBCCDEEFF FFEDCBAABCD AAABCDEEEFF DDDEFFECAAA AAABDDEEEEF EEEEEDDCBAA FFFEDCCBAAA AABCDDDEEFF FFFEDCBBBAA FFEEEDCBAAA AABBCDEEFFE FFEDCCBBBBB BBBBBBBCEFF CEFFFECBAAA AABCDDEEEFF AABBCCDEFFF AABBCCDEFFF AABBBCDEFFF FFFEDBBBBBB
116,ACCCEFFEDBA AAABDEEEEEF EEEEEEDCBAA FFEDCCBAABB AABBCCDEFFF FFEEDCCBAAA AAABBCDEFFF AABBCDDEEFF FFFEDAABBBB BBBBBBBCDFF CDEFFEDBAAA CBBAABCEFFF FFEEDCBBBAA FFEEEDCBBAA BAAABCDFFFF FFEEDCBBAAA BBBBBBCDEFF AABCCCDEEFF FFFEDCCBAAA FDEECBAABDE AABBCCDEEFF AABBCDDEEFF AABBBCDDEFF
117,FFEDDCCBBAA AAABBDEEFFF EEEEEEDCBAA FFEEEDCCBAA BAABBCDDEFF DEEFEEDCBAA DCAAABCEEFF AABBCDDEEFF FFEAABBCCDD ABBBCCCCDFF AAABCDFFFED FDCBAAACEFF FFEEDCBBBAA FEEEEEDCBAA AAABCDEFFEE FFEEDCCBBAA EFFEECBAAAD AABDEFFEECB FFEDBBBBBBB AAABDDEEEFE AABBCCCDEFF AAABBCDEFFF AAABCDEEFFE
118,AADDDDDDEEF AABCDDDEEFF ABECBDEEEFC EEEEEEDCBAA CBBBBBCDEFF AABBDEEEEEF AAABCDEEFFF ABBBBCCDEFF AABDEFFEDCB BBBBBBCDEFF FFEDCAAACDF FFFEDDCBAAA FFEDCBBBBBB ABDEFFEECBA FFEEEDCBAAA AAABCDEEEEF AABBBCDEEFF AABBDEEFFEE AAACDDDDEFF FFDBBBBBCCC EEEEEEDCBAA FFEDCBBBBBB DCBAABDEFFE
119,EEEEEEECBAA FECAABCCCDD EEEEEEDDBAA FFEDDCBAAAC AAABCDEEFFE FFEEDCCBBAA AAABBCDEFFF AABBCCDEEFF EEFFEDCAAAA AABBCCDDEFF AAABCEFFEDC FEDCBAAACEF DFFFEDCBAAA FFEEDDCBBAA CBBBBABDEFF FFFEDCCBBAA FFFEDCCBBAA AAABCDEFFFE FFEDCBBBBBB AABBCCDEFFF AABBCCDEEFF AABBCDDEEFF AABBBCDDEFF
120,FFFEDDCBAAA FFEEDCCBAAA FFEEEDCCBAA FFFEEDCBAAA AAABCDDEFFF FFFECCBBBAA FFFDCAAABCD AABBCDDEEFF AAABCDEEEFF AABBBCCDEFF DEFEEDDCBAA AAABBDEFFFE FFEDDCBBBAA FFEEDDCBAAC AABCDEFFEDC FFEEDCBAABB AAABCEEFFEE EDCBAABCEFF AABCDEFFEDC AABCCDDDEFF EEEEEDDCBAA FEBABBCCDDE AAABBCDEFFF
121,FFEEEDCBAAA FFEDDECBAAA FFEEDDCBBAA FFFEEDCBAAA AAABCCDEEFF ACEFFEECBBA FFFEEDCBAAA AABBCDDEEFF AAACDEEEEFE FFEEDBAAABE EEEFFEDCBAA AAAABCDEFFF FFFDCCBBBAA FEEEEECCBAA FFEEEDCBAAA AABCEEEEEEE EDCBBABBDEF AAABCDEEEEE FFEEDCBBAAA BDEEEFFECAA BAABBCDEFFF AABBBDEFFFE AABDEFFCCDD
122,FFFEDDCBBAA FFEDDCCBBAA FEEEEDDCBAA FEEEEDDCBAA AABBBCDEEFF FFFEDDBBBAA AABBCDEEEFF CCDDEEEEDAA AAACDEEEEEF BBCCDEEFFBA FFEDCBBABBC DDEEEEEDBAA FFEDCBBBBBB BBBBBBCDEFF CDEFFEDCBAA FFEEDCCBAAA AAABBCDEEFF EFFEEDCBBAA FCAAABCDEEF AABBCCDEFFF AABBCCDEEFF AABBCCDEEFF BCCDEFEEEAA
123,BBBBBBCDEFF FFFDCCBBBAA DDDFFEDDBAA FFECCCCCBBA FFFEDCBBBAA ABBBBCDEEFF FFFEDCCBAAA AABDEEEEEDD AABCDEFFFEA ACDEFFEECAA BBBBBBCDEFF CEFFEEDCBAA AAABCDEEFFF FFDCBBBBBCC EEEEEEDCBAA AABDFEEEDDD FFEEEDCCBAA FFEEDCCBBAA FCCCCCEEEDA EEEECDEDCAA AABCCEFFFCB EEEEEEDCBAA EDBAAACDEFF
124,ABCCBBBDFFF AABBCDDEEFF BBBBBCCCEFF ABDEEEEEDCB FFFEDCCBBAA AABBCCDEFFF AABCDDEEEFE FFFEDCBBAAA FFEECBBAABB ABBBBCCDEFF AAABBDEEEFF AABAADFFFED FFEEDCBBBAA AAABDEEEFFE EEDDCCBAADF FFEECCBBBAA FFEEEDCBAAA DBCCBAABEFF AABCCDEEEFF CCEEFFECBAA AAABBDEEFFF AAABCCDEFFF EEEEEEDCAAA
125,CDEFFEDCBAA FFEEDCCBBAA FFEEDDCCBAA FFEEEDCBAAA AABBCCDEFFF FFEEDCCBBAA FFFDCBAABBC AABCDDEEEEF AAABCDDEEFF AABBCCDEEFF AAABCDEFFFD FFFECBAAABC ACEFFFECBAA FEBBBBCDDDB FFEEEDDCBAA AABBCDEFFFE EEEEEEDDBAA FFEEDCBBBAA AABBCDEEEFF AACECEEEDEB FFEBCCCBCEA DCBBCBBDDFF AAABCDDDEFF
126,ABDEDCBBDEF AABBCCDEEFF ABBBCCCCDFF ACDEEFEEDBA FFFEDCBBAAA AABBCDDEFFF AABCEEEEEED FFEEDCBBBAA FEEDEEDDBAA BBBBCCCCDFF AAABBCDEFFF AABBCEEFEEE FFFEDCBBAAA BAABBCDEFFF FFEEEDDCBAA FFEDCCBBBAA FFFECBBBABB EDDDCBAABEF AABBCDEEFFF AABCDEEEEEE FFDCCCCCBBA FFFEDCBBAAA EEEEDDDCCBA
127,AAACDDEEEEF AABBCDDEEFF AABBCDEEFFF EEEEEEDDBAA FFFEDCBBAAA AAABBCDEEFF EEDEEEECBAA AABCDDDEEFF AAABDEEEEEF CDDCCBBBBEF DDCBBAACDFF BCDEFFEDCAA FFEDCCBBBBB BBDDEFFECBA AABCEEEEEED FFEDDCBBBAA FFEDCBAABED FFEDCCBAAAB AABCCDEEEFF AAABCDEFFFE CCCBBABDEFF FEEEEEEAAAA BCCDEEFEEBA
128,FFFEDCBAABC AABDDDDEEEF AABBCCDEFFF ABBBBBCDEFF ABCDEFFEDBA FEDBAAABDEF AAABCDEEEFF CDEEFFEAAAA AAABCDEEEFF AABBBCCDEFF FFFEDCBBAAA AAACEEDDDEF FFFEDCBBBAA FFEEEDCBBAA FEDEEDCBAAC FFEEEDCBAAA BBBBBBCDFFF AABCDDDEDFF AABCDEEEEEF AADEFECCEDD AABBBCDEFFF AABBBCDEFFE FFFECBBBBBB
129,FFEEDCCBBAA FFEDDCCBBAA FFEEDDCBBAA FFEEEDDCBAA AAABBCDEFFF ACEFFEDCBAA FFEEEDCBAAA FFDDCCBBBBB AAABBCDEFFF AABCDDEEEFE BBBBBBCDEFF FFEEEDCBAAA AAABCCDEFFF ACDDDDDEEEE EEEEEEDCBAA FEDCBBAAADF AACDDEEEEDC FFFEDBAABBB FFFDDCBBAAA BDFEDDEADCB ABBABCDEFFE AAACDEEDEFF AAABCCDEEFF
130,FFFEDCBBAAA DDEFFECBBAA FEFFDCBBAAB BBBBCCCCDFF AABCEFFFEDB BBABBCDEEFF AABCDEEEEEE FFCBBBBBCDE AABCDEEEEED FFEEDCBBBAA FFFEDCCBAAA FFFEEDCBAAA FEDBBAABCEF AABBDDEFFEE FFEEDDCBBAA AAABBCDEFFF FFFEDCBAABD AABBCDDEEFF BCDEEEFFDAA FFEDCCCBBAA BBAABBDEFFF AABBBCDEFFF FFFFECBAAAB
131,EFFEEDBBAAA FFEDCBAADCC EEEEDDDDCAA FEEEEEDCBAA AAABCCDEEFF FFEEDCBBAAB AAABCDEEEFF AABBCEFFFEA AAABCDEEFFF AABBBCDEEFF FFEEDCCBBAA FEEEEDCBAAA EEFFEDBBAAA BCDDEEDFEBA BAABBCCEFFF FFEEDDCBBAA CCCBBBBBCFF AABCEFFEDCB FEAAABCDEEE AABCCDEEFFE AABBCDDEEFF BCCDCDBACFF DDDDEEEEEBA
132,FFEDCCBBBBB AABBCDDEEFF AABBCDEEFFE FEEEEDDCBAA BBAABCDEFFF AABCEEEEEED FFEEDDCBAAA AABCDDDEEFF EEFFFDBAAAB CEFFFEDBAAA BBBBBBCDEFF FFEEEDCBBAA AACDEFFEDCB CBAABBCEFFF EEEEEDDCBAA FFEDDCCBBAA FFEEDDCBBAA AAABCCDDEFF AABBCDDEEFF ACFFEEDCDCA FFECBABCCCC FFEDBBBABBB DDDEEEEECAA
133,FFEEDCBBBAA BAABBCDEFFF AAABCDEFEFE FEEDCCDECBA CBBAABCDEFF CDEEFFECBAA FFDBBBBBCCC BBBBCBBCDFF FFFFCAABBCD AABBCCDDEFF DDEEFFECBAA FFEDCBAABCD AABBCCDEEFF FFEDDCBBBAA FEEEEDCBAAA AAABCCDEFFF FFFEECCBAAA AAAABDFFFED FEBAABCDEEE AABBCCDEFFF AABBCCDEEFF AABBCDDEEFF AAABCDDEEFF
134,FFEEDDCBBAA FCAAACDEEEF EEEEEEECBAA EDCBBABBDFF AABCDEFFFDB FFEEDCBBBAA AAABBCDEFFF AABBCCDEFFF EEFFEDCAAAA AABCCDDDEFF AAABBCEFFFE FFFEDBAAABC ACDEFFEDBAA FFEEDCCBBAA BBAABCDEFFF FFEEDCCBBAA FFFEECCAAAA AAABCCCDEFF FFEEDCBBBAA CBABABCEFFF AABBBCDEEFF AABBCDDEEFF AABBBCDEEFF
135,FFDDDDCBBAA FFEEDCCBBAA FFEEDDCCBAA CBAAABDEEFF EFFFEDAABCB DBAACFFFECB BAAABCDEFFF AABBBCDEFFF FFFFECAAABB AABBCCDDEFF BBCEFFFDCAA ECBAAACDEFF DEEFFEDCBAA FFEEDDCBBAA EEEDCBAAADF AABCDEEEEEE FFEEDCCBBAA ECBAABCDFFF FEBAABCDDEF AABCCDEEEFF AAABBDDEEFF AABBBCCDEFF AAABCDEFFEF
136,AAABDEEEEEE ADEEDDDDDDD AAABDEFFFDB AABCEEEEEEE FFEEDDCBAAA BAAABCDEEFF AAEDEEEEEBB FFEEEDCBAAA FFEEDDCBAAA AAABCDDDDFF AABBBCDEEFF AABBBCEEFFF EEEEEEDBAAA FBAAACCDEEE FFEEEDDCAAA DFFFEDCBBAA FEFFECCBAAA FFEDDDCCBAA AAABCDEFFFE FFFEDCBBBBB BDDCFFABABF EEEEEEDBAAA DCBAABCDEFF
137,BDFECAADDEE FFEDDCBBBAA BBBBBBCEFFF FFEEDDCCBAA FFFEDCBBAAA AABBCDDEEFF ABEFEFDCCAA FFFEDCCBBBA FFFDDCCAABA FFFDBBBBBBB CCBBBBBCDFF AABCDEEEEEE BAAACBEFFEE BECBBBBDEFF EEEEEEDCBAA CBAAADEFFFF EEEEEEDCBAA FFFEDCBBAAA EBBABBCDEFF AABBDDEEEFF BBAABCDEEFF EBBABBCCEFF AABBBCDDEFF
138,CEFFEDCBBAA BAAABCDEEFF AAABDEEFFED FFEEDDDCBAA AABBCCDEEFF FFFFECBBAAA FFFEDCAABBB AABCDDDEEFF AAABCDEEEFF AABBCCDDEFF ABCDEFFEDBA EDBAAABDEFF EEFFFDCBAAA FFEEDDCBBAA CCCBBBACEFF ADFFEDDCCBA FFEEDCCBBAA ECDFFEDBAAA AABBCDEEEFF AAABCDEFEEE AABBBCDEEFF AAABCDDEEFF AAABCCDEEFF
139,FFDCCDDCBAA FECBAACEEED FFEEEDDCBAA FFEEDCCBBAA FEEEEDDCCBA FFEDBBBBBBC AAABCDEEFFF AABBCDEEFFE FFCBBBBCCCC AABBCCCDEFF DEEFFECBBAA DCBAAABDEFF EEEEFEDBAAA FFEEEDCBBAA EEEDCBBAADF AABCEEFEEDC FFFEDCCBBAA BAAABCDFFFF FFDCBAABCDD AABCCDEEFEF AABBCDEEEFF BBAABCDEEFF AABBCCDEEFF
140,FFEDDCBBBAB AAABCDDEEFF AABCDEEFFED FFEEEDDCBAA BBAABCCEEFF DEFFEEDCBAA FEBAABCDEFF AABCCDDEEFF FFFFCAABBBC ABDEEEEDCCE AAABBCDEFFF FFEEDCBAABD ACDEFFECBAA FDBAABDDDDE CCBBBBBCEFF FFEDCCBBBBA EEEEEDDDDAA FFEDCCBBBBB AABCDDEEEFF AAABBEEFFEE AABBCCDEEFF FFEEEBABBAA BCCEFFFEBAA
141,FEEEEDCBBAA FFEEDCCBBAA FFEEDDCBBAA AAABBCDEEFF FFFEEDCBAAA AABBBCDDEFF AABBCDEEEFF DEEFEEDCBAA AAABCDEEEFF BBBBBBCDFFF FFEEEDCBAAA AAABCDEFFED FFEDCBBBBBB BDDEFFEDCAA BBBAABDEFFF FFEEDCCBBAA FFECBAAABDF AABCDDEEEEE AABCCDDEEFF AAABCDEEFFF FFFFDBCCBAA FFEEDCCBBAA AABBCCCDDFF
142,FFEEEDCBAAA ABCEFFEEDCA FFEEEDCBBAA BBBBBBCDEFF DEEFFEDCBAA CBAABBCDEFF AABBCDEEEFF DDDEEEEECAA AABCEEEEEED CCCDDEEFEBA FFEDDBAAACE DEEEFEDCBAA FFEDCBBBBBB BBBBBBCDEFF FFFEEDCBAAA BAABBCDEEFF AAABCDDDEFF ADFFFEDCBAA AABBCDEEEFF AABBCDDEFFF FFFEDCBBAAA FFEDCBBBBBB AAABBCDEEFF
143,ADEEECBBCEF AACDEDEEEEE AAABDEEEEEE EEEEEEDCBAA BBBBBBCDEFF AABBCCDEEFF AABBDEEEEEE FFDBBAABCDE DDEEFEECBAA EDCBBAABCFF DDCDEFFEDAA FFEEDDCBBAA FFDBBAABCDE ABCEFFFEDCA FFEDCBAAABE AABCDDDDEFF CDDCBAABDFF AAABCCDEFFF EEEEEECBAAA AABBCCDEFFF AAABCCDEFFF FFFEEDCBBAA FFEEDCCBBAA
144,ACBBCEEEEEE AAABCDDEFFF BDDDEFEEDAA FFEDCCBBAAB FFFEEDBBBAA FFEEDCCBAAA BBAABCDEFFF AABCCDEEEFF FFFFDAABBBC EFFEEDCBAAA AABBBCDEFFF FFFEDCBAAAB AABBCDEEFEE FFEDCCBBBAA FFFEEDDCBAA AAAABDEEFFF FFEEEDCBAAA FFECBAABDEC FFEDBAABCCC FFEEDCBBBAA ABBBBCCDEFF AABDEEEEDDE AAABBCDEFFF
145,FFFEDCBBAAA AAABBCDEEFF AAABCEEFFEE FEEEEDDCBAA EDCBAABCEFF AAACDEFEEEE FFEEEDCBAAA AABDEDEEEEF BBCDEFFEEBA ACDEFFEDBAA BBBBBBCDEFF EFFEEDCBAAA DEEFFEDBAAA FFDCCCCCCBA BBBAACDEFFE FFEDCCBBBBA FFECBBCECBA FFEDCBAAACD AABCCDEEEEF CCDEEFECBBA AABBBCDEEFF DEDEEFEDCAA AAABCCDEFFF
146,FEEEFDCBAAA FEEEEDCBBAA FFFEDCCBBAA AAABBCDEEFF AABCEEFFEDC FFEDCCBBBBA FFFEDCBBAAA AABBCDDEEFF AAABCDEEEFF CEEECBABBDF DDEEFFDCBAA FFFEDCBAABC AABBCDEEFFF FFECCBBBBBB EEEEEEDCBAA DCBBBABCEFF AABDEEEEEEE FFFEDBBAABB AACDEFEEECA FFECBABBCCD AABBCDEEEFF AABBBCDEEFF DDDEEEEDDAA
147,FFEEDCBBBAA FFEEDCCBBAA FFEEDDCBBAA FEEDDCBAACF AABBCDDEFFF FFFEDCBBBAA FFFEDDCBAAA FFEDDCBBBAA AAABBCDEEFF AABBCDEEEFF BBBBBCCDEFF FFFEEDCBAAA AAABBCDEFFF ABDDDDDEEEE EEEEEEDCBAA FFEDCBBAABE AABDEEEEEED FFFEDCBAABC EEFFEDCBAAA ABAADEEEEFF AABBBCDEEFF AABBBCDEFFF AABCDEFFECE
148,EBDFEFECAAA AAABCCDEEFF AABBCEEFFEE FFEEEDDCBAA FFFDCBBBBBB EEFFEDCCBAA AAABCDDEFFF AABBCCDEFFF FFECBBBBBBC ABCDDCCCCEF AAABBCDEFFF FFFECBAABCD CEEEEFDDBAA CAAABCDEFFF CCCCBBABEFF FFFDCBBBBAA FFFEDDBBBAA CBBAABDEFFF AAABCEEEEEF FEEEDDDDCAA ABBBBCDDEFF FEEFEDCCBAA AAABCEEDEFE
149,AACEEEEEEDD FFECBBBBBBB EFEEEDCCBAA FFEEDDCBBAA FFECBAABBCD AAABCDEEFFF FFFEDCBBAAA FFEBABBBCCC AAABCDDEFFF BDEFFFDCBAA BBBBBBCEFFF FFFEDBBAABC AABDEFFEDCC FFFEDCCBBAA EEDCBAABCEF AABCDEEEEEE FFEEEDCBAAA CAAACEFEEEE FFEDCBBBBBB BBBCCCBCEFF FDCCBABBCEF AABBCDEEEEF AABBBCDEEFF
150,EDDEFFECBAA FFECBCCCBAA FFEEDDCCBAA CCCBBBBBDFF ABCDEFFEDBA FFFEDCBBAAA AAABBCDEFFF AAABBCDEFFF FFFECBABBBB AABBCCDEEFF FFFEEDCBAAA BBAABCDEFFF DEEEFEDBAAA FFEEDDCBBAA CBBBABCDEFF BCEFFEEDBAA FFEEDDCBBAA ABDFFFECBBA AAABCDDEFFF AAACCDDEFFF AABBCDEEFFF FFCAAABCCEF AAABDEFFECE
151,AABCDDDEFFF AABBCCDEEFF ABBBBCCCEFF BCDDEEFEEBA FFFEDCCBAAA AABBBCDEEFF AACDFFCCDED FFDDDDCBBAA FEBCDCCCBBC FCDDDDCBBBB BBBBBBCDEFF ABBBACEFFFD FFFEDCBBBAA BAABBCDEFFF BBBBBABFFFE FFEDCBBBBBA FEEEEDCBBAA FECCAABBCEF AABBCDEEEFF BCCCBAADFFF EFFEEDCAAAB FFFEDCBBAAA EEDDCCDDDDA
152,AAABEEEEEEE CEFFFECBBAA FFEEDDCCBAA AABDEFEEEDB FFEEDCCBAAA AABBCDEEEFF AABCDEEEEEE FFECCBBBBBC FFFEDCBAAAA BABBBCDDEFF AABBBCCDFFF AABDEFFEEDB FFEEDCBBBAA DDFFEEDCBAA CCCEFFEECAA FFEDCCCBBAA CBBAAADEEFF AAABCDEFFEF AABCCEBCEFF AABCCEDEEFF FFEEEDCBAAA EEEEEECBAAA DCBAAACEEFF
153,BAAABCEFFFF FFEDCCCBBAA FFEEEDCCBAA FFEEDDCCBAA FFECBAAACEF AABBCDEFFEE FFFEDDCBAAA FFDBBBBCCCC AAABCDEFFEE AABCCDEEEFF ABBBBCCDEFF FFEEDCBAABD FFFEDCBBAAA FFEDCCBCBBA DDCBBAABDFF FFEEDCBBAAA EDCCCBBABEF EFFEEDCBAAA FFEDDCBBBBB EEEEEEEBAAA FFFEDDCBBAA AABCDEEEEEE BBBBBBDDEFF
154,AAABDEEEEEE ABCCBBDEEFF BBBCCCDCCEF ABCDDEEEEED FFFEDDCBAAA AABBDCDEFFF AAACDDEFEEE FFEEEDCAAAA DCCDEEEEEBA FFEDDDCBAAA BBBBBCCDFFF AABBCDEEFFE DDDDEFFDBAA CBAAABDEEFF DEEDDCBAACF FFEDCCBBBBA EEEEEEDCBAA FFFECBBBBBB AAABCDEEEFF FDEDDBBAAFE FFFECBBAABC FEEEEDDCCAA FECAAABCDEF
155,ABBBEFFEEDB AAACEEEEEEE DDDDEEEECAA FFEDCBBAABC AABBDEEFFFB FFEEDCBBAAA AAABBCDEFFF AABBCCDEFFF FFFEECAAABB AABBCDDDEFF AAABCDFFFED FEEDBAAACEF DEFFFECBAAA FFEDDCCBBAA EEDDCBBAADF AEFFEDCCBAA FFEEDDCBBAA CBBAABDEFFF FFEEDCBBAAA AAABCDDEFFF AABBBCDDEFF AABCDDEEEEF AAABBCDEFFE
156,ABEFECBBCFF AAABCDEEEFF BBBCCCBBCFF AABDDEEEEEE FFEEEDCBBAA EDBBAABCEFF AAACCDEFEEE FFFEDDCBAAA FFEDCCCCCAA FFFECBBBBBA FEDCBBAABDF AABBCDEEEFF CBAABCCDFFF FFCBAABCDEF CDDEEEEECAA FFEDCCBBBAA EEEEEEDCBAA FFEEDBBBBAA AABBBCEEFFF FDDEFFCBAAA DFEEFDAAABE AABBCDDEEFF CCCDEEEFECA
157,CDEFFDBAACB FFEEDCCBBAA DDCCCCBBBCF AACDEEEEEED FFFEDDCBBAA AAABCCDEEFF AADEFFEDCCB FFEDCCBBBBA EEEEEDEDBAA FDCCDDDCBBA BBBBBBCDEFF AABBCDEEEFF FFEEEDCBAAA FFEDCCCBBBA BBBBBABDFFF FFEDCCBBBAA FEEEEDCCBAA FFFEDBBBBBB AABBCDEEFFF EFFFECBBBAA BAAABCDEFFF AAABBCDEEFF CDDEEEEEDAA
158,FFEEDCBBAAA AAABCCDEFFF ABCDEFFFDBA FFEEEDCCBAA BBBBBBCDEFF EFEEEDCBBAA AAABBCDEFFF AABBCDDEEFF FFFDAABBBCC AABBCCDDEFF BCDEFFEDBAA DCBBBBBCEFF EFFFEDCBAAA FEDBAEDDCBA EDDCCBAABEF FFEDCCBBBAA FFEBAADDDCA AABBCCEEEFF AABCDDEEEEF EEEEFEDBAAA FFFEEDCBAAA AABBCDDEEFF AAABCDDEEFF
159,FFEEDCBBAAA ABEFFDBBDDE ABBBACFFFEE FEEEEDCBAAA AAABCDEEFFF FFDCBAABCDF AABBCDEEEFF DDEEFFECAAA AAABCDEEEFF AABBBCCDEFF FFEEDCCBAAA FFEEDDCBAAA FFEDCBBBBBB ABCCDCCBDFF AABBDEEFFEC FFEEDCBBBBA BBBBBBCDEFF BCEFFEECBAA AAABCDEEEFF AABCCDEEFFF AABBBCDEEFF AAABBCDEFFF EEEEEEECAAA
160,DFFEDCCBBAA AAABBDEEEFF AABDEEFEEDB FFEEEDCCBAA FFEDCCBBBAA BBCDEFFFDBA BAABBCDEFFF AABBCDDEEFF EFFFEDBAAAA ABCCCCBBCEF CDDEFEEDCAA EBDCAABDBEF AABBCDEFFFE FFDBAACDDCC FFEEDDCBAAA BBBBBBCDFFF FFEEDCCBBAA DFFFEDCBAAA AABCCDEEEFF CBAABCEEFFF FFEDCBBBBBC AABBCDDEEFF AAABCDEEEFF
161,AACFFFEDCBB FFEEDCCBBAA DDCCBBBACFF DFFEEDDCBAA FFFEDCBAABB AABCDDEEEEF BEFFEECCCBA FFFDDCCBBAA FFFEEDCBAAA EFFFEDCBBAA DCBBBBBCDFF AABBCDEEEFF AABBBDDEEFF FFFBAACCCDE EEEEEEDCBAA CCBBAABDEFF AAABCEFFEEE FFEEEDCBAAA FFEEDBBBBAA FFDDDBAAACE AAABBCDEEFF ABAABDFFFEE AABBCCDDEFF
162,FEDEDDCBBAA AAABBCDEFFF FEEEEDDCBAA FFEDCBAABCD BCCDEEEEEDA FFECBBCDCBA DCBAABCDEFF AABBCDDEEFF DEEFFECAAAB AABCCDDDDFF AAABBCEFFFD FFEDCAAABDE AABCEFFEDCB FFEDDCBBBAA DDDCCBBABFF CDEFFEDCBAA FFEDDCCBBAA ABCBBBCDEFF FFFEDCBAABB FFDCBBBBCCB AABBBCCDEFF AABBCDDEEFF AAABBCDEEFF
163,DFFFEDCBAAA CCBBBACDEFF DDEEEEEDCAA EEEDCCBAACF AABBBCDEFFF FFEEDCBAAAB AAABCDEEEFF CCDEEEFECAA AAABDEEEEEF ABBBCDEFFEA EEFFEDCBAAA CDEEFFEDCAA FFEDCBBBBBB DDDDDCCBABF CEFFEEDCBAA FEBAABBCDDE AAABCDEEFFF BBBBBBCEFFF AABCCDEEEFF EEEFFECBAAA FFFEDCBABBA FFECBBBBBBB AAABCDFFEEE
164,FFEEDCBBAAA AAABCDDEEFF BCDEEEEEDAA FFEEEDDCBAA BAAABCDEEFF BDEFFEDCBAA FFEDBAABCDD AABCCDDEEFF FFFBAABBCCD AABBCCCDEFF AAABCEFFFED EDBAAABDEFF EEFFEDCBAAA FFEDDCCCBAA BBAABCDFFFF FFEDDCBBBAA FFEDCCEDBAA FFECBBBAACE AABCCDEEEFF AAABCCDEFFF BAABBCDEEFF DEBAAABDFEF AABDEFEDEFA
165,FFFEDCBBAAA BDFFFECCBAA FFEEEDCCBAA FEEEEDDCBAA BAABBCDEEFF AABDEEFEEDB FFEEDCBBBAA AABCDDEEEFF AAABCDDEFFF AABBCDDEEFF BCDEEDEFDBA BBAAABDEFFF DEFFEDCBAAA FECBABBCDDE EEEEEEDCBAA BBBAABDEFFF AAABCEFFFDC BAAAACEFFFE FFFEDCBBAAA BAAAEFFEEDC FFDDCBBBBBB FFEDDCBBBAA CCCDDEEFEAA
166,AACEEEEEDDE EFFFECBBBAA CCCCCCCBBCF AEFEEEEDCBA FFFEDCBBAAA AABBCCDEEFF ABCDEEFFEBA FFCAABBCCDD AAABCDDEEFF FFFCCCBBBBA BBBBBBCDEFF AABBDEEEEEF EEEEEEECBAA FDBAABCCCEF FEEEDDBDDAA FFEDCBBBBBA AABBCCCDEFF DCDCAABCDFF AABCDEEEFEE FFEDBBBBBBB EEEEEFECAAA FFFEECBAAAA BBBABBDEEFF
167,EFFEEDCBBAA FFEEDCBBBAA FFEEEDCBAAA FFEEEDCBAAA AABBCDEEFFF FFFEDCBBBAA FFFEDBAABBC AABBCDDEEFF AAABCDEEEFF AABBBCCDEFF EEFEEDDCBAA AAABBCDEFFF FFEEDCBBBAA FFEEEDCBBAA AAABBCDEFFF FFFEDCCBBAA CBBBABCDEFF FFFEDBBAABC AABBCDEEEFF BDFFEBBBBBD EEEEEDCCBAA FBAABCCDEEF AAABBCDEFFF
168,AAABDEFEEEE FFEEDCBBBAA FFEEEDDCBAA AABDEEEEEED FFFEDDCBBAA AAABCCDEFFF AABDFEEEEDC FFEEEDCBAAA FEEDDDEDBAA FFDCCCCBBBB CCBBBBBCDFF AABCDDEEFFF BAAABCDEEFF ACDCBBCDEFF CDEEEEEDCAA FFEDCBBABBB EEEEEDCBBAA FFFFECBBAAA BBAAABDEFFF FFDDEBCBBBA DDEDEDEECAA BDEFFEEDBAA CBBBBBCDEFF
169,BBAABCDEFFF FDBAABCDEEE AAABCDEFFFE FFCAABCDDDC FFFEDCCBAAA DBAABBCDEFF EEFFEECBAAA AABDDEEEEEE AABCDEEFFEA EDEEEEDCBAA CBBBBBBCEFF ABDFFFEDCBA BAABBCDEFFF FFDCBCCBCBB EEEEEEDCBAA AAAACDEFFFF EEEEEEDCBAA FFEEDDCBBAA FEDDCBCCBBA FFEDCBBBBBB BBCCCCCBBEF EEEEEEDCAAA DDBAAACDDFF
170,CCAACEDDFDD FEEEEECBAAA FFEEDDDCBAA CBBBBBBDEFF DDEEEEECBAA FDBAABCDEFF AAABCDEEEFF DEFEEEDCBAA AAABCDEEFFF AABBCCDEEFF FFEEEDCBBAA AABCDEEEEEE FFEDCBBBBBB ABDEEFFEDBA CBBBABCEFFF CFFFEDCBBAA FFFEDCBBAAA AAABCDEFFFE FFECBAABCCD AABBCDEEFFF AABBCCDEFFF DCBAAAEEFFF AAABCEEFFCD
171,EFEEEDDBAAA CAAABDDEFFF EEEEEDDCBAA FFDCBBAABEF AABCDEFFFDA FFEEDCBBBAA AAABBCDEFFF AABBCDDEFFF FFFEAABBBCC ABBBBCCDEFF DEEFFEDCBAA BBBBBBCEFFF DEFFFECBAAA FFEEDDCBBAA BBBBBBCDEFF CEFFEDCBBAA FFEEDCCBBAA BBAAACEFFED ECBAABCEEFF AABBCDDEFFF FBACEEFDCAB AABBCCDEFFF AAABCDEFFFC
172,FFEEDCCBBAA FFEEDCCBBAA FFEEDDCBBAA FFEEDCBAAAD AABBCDDEFFF FFFEDCBBAAA FFEEEDCBBAA FFECCBBBBBB AAABBCDEFFF AABBCDEEFFF BBBBBBCEFFF FFEEEDCBAAA AAABCDDEFFF ABEEEDDDDDE EEEEEEDCBAA FFEDCBBAABD AAABCDEEEEE FFFEDCBBAAA EFFEEDCCBAA EBAACDCDEFF AAABBCDEEFF AABCDDEEFDE AAABCDDEFFF
173,FFEDDCBBBAA AABCCCDEEFF DEEEEEEDBAA CCCBBBABEFF ABBDFFFDBBB DCEFFFCAABC FFFEDCBBAAA AABCDEEEEEE AAABBCDEFFF FCCDDDDCBBA BBBBBBCCEFF ACFFFEEDCBA AAAABCDEFFF FEBAABCDDEF EEEEEEDCBAA AAACDEEEEEE ABBCDFFEEDA FFFEDCBBAAB FEEDCDDCAAB DAABBCBDEFF AABDDEEEEEC AABBDCDEFFF AAACEFEEEFC
174,FFFEDCCBBAA FFEEDCBBBAA FFEEDCCBBAA CBBBBBBBDFF AABCEFFFECB FFEDCBBBBBB AAABBCDEFFF AABBCCCDEFF DEBAABCDDFF AABBBCDDEFF FFFEDBBBBAA ABBBBCDEFFE AACEFFEDCBB FFEEDDCBBAA FEDBAABDEEE AACEFFEEDCB FFECCCBBBBB AAABCDEEFFE FFEDCBBBBBB AABBCCDEFFF AAABCDEEEFF AAABBCDEFFF AABCDDCDEFF
