,0
0,FFDEDCCBBAA AAABBDDEFFF EEEEEEDDBAA FECBAAABCEF CDEEEEEECAA FFEDCBBBBBB AAABBDDEFFF AAABCDDEFFF FFFEBABBBBB ABBBCCCDEFF AABBDEFFECB FEDCAAACDEF DEFFFECBAAA FFEDDCCBBAA CCCBBBACEFF DFFFEDCBBAA FFEDDCCBBAA BBAABCDFFFF FFECBABBCCD ABABDEEEFFC ABBBBBDEEFF AABBCCCEEFF AAABCDDEFFE
1,AAEFFEEDDCB ECBAABCCEFF AABCEEFFEDA FFEDDDCCBAA FFEECBBABBC AAABCCDEFFF FFFEDCBAAAB AABCDDDEEFF AABCDEFFFEB FFDBBCCBBBB BBBBBBCDEFF FFFDDCCCBAA AAABBCDEFFF FFEDCCCBBAA FFFEDCBAABA DCBCFFEECAA FFEDCCBBBBA AABDEFFEDCB FDAABBCDDDE FECBBAACEFF AABBCCDEEFF AABCDEEEEEE AABBBCDDEFF
2,DFFFEDCBBAA FFDCBBBBBBB EEEEEEEDBAA FFEEEDCCBAA CBBBBBCDEFF CDEFFFDCBAA FECBAAABDEF AABCCDDEEFF AAABCDEEEFF AABBCCDDEFF EFFEEDDBAAA DCBAAABDEFF CEFFFDCBAAA EECCDFEECAA EDDCCBAABEF ACFFEDDCCCB FFEEDDCBBAA DBCFFEDCBAA BAABBCEEFFF AABBCCDEFEE AABBBCDEEFF AABBCDEEFFF AABBCDDCDFF
3,DECBBABCDEF AAABCCDEEFF AABBCDEEFFF FEEDDDEDCAA FFECAAABCDF AABCDEFFEDB FFFDCBBBBBB AABCCCCDEFF DEEFFEBAABB AABCEEDDDEF AABBBCDEFFF FFEDDCBBBAA AABBBCDEFFF FFDCBCBACCC EEEEEEDCBAA CBBBBBCCEFF EFFEEDCBAAA FFDCAAADEED CBAAACDEFFF AAABCCDEFFF AABBCCDEEFF AABBCDDEEFF ABBBCDEFFFA
4,FFEEDDDBAAA AAABBCDEFFF AABCEFFFECA CBBAABCDEFF CDDEEFEDCAA FFECBBBBBBC AAABCDEEFFF ABCDEEEFEDA FAABBCDDEEF AABBCCDDEFF EEFFEDCBAAA CBAAABDEFFF EFFFEDCBAAA FEEDDDDCBAA DDCCBBAADFF BEFFEDCCBAA FFEEDCCBBAA BBAABCDEFFF FECBAABCDEF FFEEDCBBBBA FFFEDCCBAAA FFEEDDCCBAA BBBBBCCDEFF
5,FCCCBAABDFF AABBCDDEEFF ABBCCCCCCEF AACDDEEEEED FFFEDDCBAAA AABBCDDEEFF AABCEFEEEDD FFEDDDCBAAA EEDDDDEDDBA FDCCCCCCBBB BBBBBBCDEFF AAACEEEEEED FFEEEDCBAAA EBAABCCCEFF EEEEEDDCBAA FFEDDCBBBAA FFFEDDCBBAA CBBBBBBCEFF AABBDEEEEEE FFDCFBCCBAB DFFDAABBDEF CBAAABDEFFF EEEEEEEDCAA
6,AACEEEEDDDD FFECCCBBBBB BBBBBBBBEFF FFFEDDCBBAA FFFEDCBBAAA AAABCCDEFFF FFFEDCBBAAB AABDEFFEDDC FCAACDDDDDD EEEEEEDDBAA FFEDCBAAACE AABBCDEEEFF AAABCDEEEFF AAACDDDEEFF AABDEEFFECA FFEDCBBAABE AAACEEEEEED FFEEDDCBAAA FFEDBBBBBBB BAAABDDDEFF EBACDEFFDBB EEEEEEDAAAA CBBABBCDEFF
7,FFEEDCBBBAA AABBCCDEFFF AABCDDFEEED FFEEDDCCBAA EDCBAABBEFF ABCEFFFECBA FFECAABBCCD AABCDDDEEFF DEEFFFCAAAA AABBCDDEEFF AAABBCDFFFE FFEEDCCBBAA AAABBCDEFFF AACEFEEDDDC FFEEEDCBBAA BBAABBDEFFF FFFEDCBBBAA BEFFFECBBAA CAAABCEEFFF EEABAACEEEF AABBCCEEEFF AABCDDEEFFC AABBBCDDEFF
8,FFEEEEDBAAA FFEDDCCBBAA FFEEDDCBBAA FEDCCBAABEF AABCDEFFFDB FFEEDCCBAAA BBAABCDEFFF AABBCCDEEFF EEFFEECAAAA AABBCDEEEFF CDDEEFEDBAA BBBBBBBDEFF ACDFFFECBAA FFEDCCBBBAA FFEEEDCBAAA AAABCDEFFFE FFEEEDBBBAA FFECBABDCBA AAABCDEEFFF AABCCDDEFFF AABBCCDEEFF AABBCCDEEFF AAABCDEFFFD
9,EFFEDCCBAAA BAAABCDEFFF AAABCDEEFFF ECCACEECDEA FFEDCCBAABB EEEEEEDCBAA AAABBCDEFFF ABBBBBCDEFF FEBAABCDEEF AABBBCDEEFF EEFFEDCBAAA FFEEDBAABCE AABBCDEEFFF FFEDDCCBBAA FFEEEDCBAAA AAABCDEFFEE FFFEDBAAABC BBAABCDEFFF FFEDBBBBBCC AABBBDDEEFF AAABCDDEEFF AABBCDEEFFF AABBBCDDEFF
10,FEDDEFDCAAA AABBCCDEEFF AABBCDEFFEE FFEEEDCBAAA AABBBCDEFFF FFFEDCCBAAA FFFEECBBAAA FFEEEDCBAAA AAABBCDEFFF CDEEEEEDBAA CCBBBBBCDFF ABCEFFEDCBB CBBAABDEFFF ABCCCCDEEFF CCDEEEEDCAA FDAAEEDCCCB EEEEEEDCBAA FFFEDCBBAAA AABCDDEEEEF BCBCAADFFFF DDEEFFAAACB AACEFECDDCC BBCDEEFFEBA
11,FFEEDCBBBAA FFEEDCCBBAA FFEEDDCBBAA FFEEEDCCBAA AAABCCDEFFF AACEEFFEDCB FFFEDCCBBAA AAABCDEEEFF AAABCCDEFFF AABCCCCDDFF EEFFEEDBAAA FEDCBBAABDF AABBCDEEEFF FFECBBBBBBB EEEEEEDCBAA FFEDCBBAABF AACDEEEEEDD FFEDCBAABCD EFFEEDCBBAA BBAAABEFFFF AAABCCDEEFF BBBBBBCEFFF AAABDDEEEEF
12,EFFEEDCBAAA FECBBBBCDDD FEEEEEDCBAA FFEEEDDCBAA FECBBAABDFF AABBCDEEFFF FFFEEDCBAAA FEAABBCCCDD AAABCDDEEFF AABBCDDDEFF AAABBCDEFFF FFEDCBAABCD BEFFEEDCBAA FFDCCCBCBBA FFEEEDDCBAA BBBBBBCDFFF EEEEEEDCBAA DBBBBBBDEFF FFFEEDCBAAA BCDEEEFEAAB EEDDDBAACEF AABBCDDEEFF AAABCDDEFFE
13,FFFEDCCBAAA FFEEDDCBBAA FFEEDDCBBAA BBBBBBCDEFF AACDEFFEDCB FFEEDCCBBAA AAABCDEEEFF BCDEFFFDAAA AAABCDEEEFF AABBCCDEFFE FFFEDCBAAAB DDEEFFECBAA FFEDCBBBBBB BBBBBBCDEFF CDEFFEEDBAA FFEDCCCBBBA AAABCCDEFFF FFFEEDCBAAA AABBCDEEEFF FFFEDBBBAAB FFFEEDCBBAA FCAABCDDEFF AABBBCDEEFF
14,AACDDEEEEEE BBAABCDEFFF AABCDEEFEED FFEDDCCCBAA FFEEDCBBBAA AAABBCDEFFF FFEEEDCBAAA AABCCDEEFFF AAABCDEEEFF BDEEEDCAABF AAABCEFFFEB FFFEDCBAAAB AABBCDEFFEE FFEDDCCBBAA EEEEEEDCBAA AAABCCDEFFF EEEEEEDCBAA FFEEDCBBAAA ECAAABCDEFF AAABCDDEFFF AABCCDEEDFF AABCDEEEEEF ABBBCCCCEFF
15,FFEDDCBBBAA AAABBCDEEFF AABCDFFFEDA FFEEEDDCBAA AAABCCDEFFF EFFEEDCBBAA FFFECBAABBB AABCDDEEEFF AAABCDDEEFF AABBCCDDEFF CDDEFEEEBAA FFECBBAABCF AABCDEEEEEE FFDCCCCCBBA FEEEEDDCBAA FEDCBBAABEF EEEEEEDCBAA DBAAABDEFFF FFFEFDBBAAA AABBCCDEFFF AABBCCCEFFF AABBCDEEEFF AAABCCDEEFF
16,CDEFFEDCBAA FFEEDCCBBAA FFEEDDCBBAA FFEEDDCBBAA AAABCDDEEFF FFFEDCCBBAA FFEDBBBBBBC AACDDDEEEEF AABBCEFFFEB AABBBCDEEFF BBCDEEEFDAA FFEEEDCBAAA AAABBCDEEFF ABEEEEEDDCC FFEEDCAABBC AABCFFFEECA FFFEDCBBBAA BAAABCDEFFF FFFEECBAAAA AABBCCDEFFF AAABCCDEEFF AABBCCDEEFF AAABCCDEEFF
17,BAAABCEFFFF FFEDCCBBBBA FEEEEDDCBAA FFEDDCCBBAA DCBBAABDEFF EFFFEDCBBAA EAAABCDEEFF BBBBBBBCEFF FFFCABBBBCC ABBBBCCDEFF AAABDFFEEED FEDEEDBABAA AABCBBEFFED FFEEDCCBBAA EDBAAABEFFF CBCFFFEDCAA FFEEDCBBAAA AABCCCCDEFF DEFFFECBBAA FBBBCCCDDEE AABBCCDDEFF ABDEFFFDCBA CBBAABCDEFF
18,FEEFEDCBAAA FFEEDDCBAAA FFEEDCCBBAA BBBBBBCDEFF BCEFFFECBAA FECBAABCDEF AABBCDEEEFF FFFEBABBBBC AABBCDEEEFF DDDDEEEECAA FFEEDCCBAAA AABCCDDEEFF FFEDCBBBBBB ACDEFFEEDBA DBAABCDEEFF ACEFFEDDBAA DDCBBBBBCFF AABBCDEFFEE FFECBABBBCC AABBCDDEFFF FDCCDDECCBA AAABCCDEEFF AABCDEEEEEA
19,FDDEEEDCBAA FFDBBCCCCBB FFEEDDCCBAA EDCBAABCDFF DEEEEEDDBAA FFEEDCBBBAA AAABBCDEFFF AABCDEEFFEC CAABCDDEEFF AABBCCCDEFF EEFFEDCBAAA BBAABBDEFFF DEFFFDCBAAA FFEEDDCBBAA AAABCDEEEFF CEFFEDCBBAA FFEEEDCBAAA FFEDBBBABCE FFEEEDCBAAA AABCCCCEFFF AABBBCDEEFF AABBCDDEEFF AABBBCDDEFF
20,DCCBBBABEFF ABEFEEDDDCC FFEEDCBBBAA DBAAABCDEFF FFFEDCCBAAA AAABBCDEEFF FFFEEDCBAAA FFEEDCBBAAA AAABCDEFFFE DAABBCDEEFF AABBBCCDEFF FFFEDDCBAAA AABBCDDEEFF FFEDDDCBBAA FFEDCBAABBB DDEFFEDCBAA FEEDCBBAACF AABCDEFFEDC FFEECBBBBBB DDDDEEEEDAA EEDBAAABDFF AACEEEEEDDE BBBBBBDEEFF
21,FFFEDCBBAAB ABBABEEFFED FFFEDCBBAAA ABBBBBCDEFF BDEFFFECBAA AAABBCDEEFF AABCDDEEFEE FDBBBBBBDEF AABCDEEEEED FFFEDCCBAAA FFEDCCBBBAA EEEEEEDBAAA FEDBAAABDEF AAABCDEEEFF EEEFEEDCBAA BBBBBCCCDFF ABEFEEDDDCC AABBCDDEEFF AABCDEEEFEC FFEDCCCBBAA CBAABCDEFFF ABBBBBCDEFF FFFEDCBAAAA
22,AACEEEEEDDD FFDCBCCBBBB EEEEEEDCBAA FFEEDDCBBAA ECBAABBCEFF AABBCDEFFED FFEEDCCBAAA AABBCDDEEFF AAABCDEEEFF ABBBBCCDEFF CCDEFFEDBAA FECBAABCDEF ABDEFFEDCBA FFEEDCCBBAA DCCBBABCEFF BEFFEDCCBAA FFFEDCBBBAA ABCEFFFECBA EDBAABCDEFF AABBCDDEFFE FFDDBBBBBCC AABCCDEFEEE AABBBCDDEFF
23,BCAABCEEFFD ACBBBCCEEFF AABBCDEFFEE FEDDDDCDCAA CBAABBCEEFF DEEFFEDCBAA FBAABBDDEEF FEECDCAAACF FFFFEBAABBB AABCDDDEEEF ABBBBCCEFFF FFEEDCBBBAA AABBBCDEFFF AFFCBDCCCBC EDEEEEEDBAA DBBABBCDEFF FFEEEDCBBAA FFCDEDCBBAA AAABCDEEEFF AABBCDDEEFF AABBCDDEEFF AAABCDEEFFF AAABCCDEFFF
24,AAABCCDEEFF AAABCDDEFFF AABBDDEEFFE FFEDDDCCBAA EDBAABCDEFF DEEEFEDCBAA FFFDCBBBBBB AABCCDDEEFF CCDDEEFEDAA ABDEEFFECBA BBBBBBBCEFF ABCEFFEDCBA BAAABCDEFFF EEFFECBBBAA FFEEEDCBAAA AABCEEEEEEE FFFEEDCBAAA FECBAABDEFD FFECBBBBBBB FDBBBBABDFF AABBBCDEEFF AABBCDDEEFF AAABCDEFFED
25,FFFEEDBBBAA FFFECBBABBB FFEEDCCBAAA BBBBBBCDEFF AACDEFFEDCA FFFEDCBAABB AAABCDEEEFF DEFFFDBAAAA AAABCEEEEFF AABBCCDEEFF FFFEDDCBAAA CAAABCDEFFF CEEFFECBAAA CCDEEFEECAA FFFECBAABBC AABBCCDEEFF FFFEEDCBAAA BAAABCDEFFF FFFEDDCBAAA AABBCDDEEFF AAABCDEEEFF AAAACDEFFEF ABCDEFFEEBA
26,FFEDDCBBBAA AAACDDDEEFF AABBCDFFEDD FEEEEDDCBAA AABBBCDEEFF FFFEDCCBAAA AAABCDEEFFF ABBBBBCDFFF FFEBBBBBBCC AABBCCCDEFF BCCDEFFECAA FEDDCBBBBCE AABCDFFEEDC CCDEEFFECAA FFFECBBBBBA AAABCDEFFEE FFEEDCCBBAA AADFFEEDCBB AAABCDEEFFF AABBCCDEEFF AAABCDDEEFF AABBCCDEEFF AAABCDDEFFF
27,FEBABCCCCDD AABBBCDEEFF AADFEEEEDCB FFEEDDCCBAA FFECBBBBBBD CCEFFFECBAA FEBAAABCDEF AABCCDEEEFF EFFFEAAABCC CEFFFEDBAAA BBBBBBCEFFF FFFEDCBBBAA AABBCCDEEFF AACEEEEEEEE EEEEEEDCBAA FDCBAABBDEF DEEEEEDCBAA FECBAADFEDC FFDCAABCDDD ABBBBCCEFFF EFDBAAACDEF AABBCDDEEFF AABCEEEDDDF
28,FFEDDCBBABB ABCEFFEECBA DAAFFDEDCCC BBBBBBCDEFF ACDEFFECBAA BAABBCDEEFF AABCDEEEEEE FFECBBBBBBC AABCEEEEEED EEEEEEDCAAA FFEDCBABBBB EEFFEDCBAAA FECBAAABDEF AAABBCDEFFF FFFEEDCBBAA BABBBCCDEFF AAABCCDEFFF FFEECBAABCE AABCCDEEEFF FFEEEDCBBAA BAABBCDEEFF AABBBCEEFFF FFFEDCBAAAB
29,FFFEDCCBAAA FFEDCBBBBBB DEEEEEEECAA FEEEEDDCBAA CCBAABCDEFF AAABCDEEFFF FFFEEDCBAAA FFEDBBBBBBB AAABCCDEFFF AABCDEEEEEE BBBBBBCDEFF FFFEEDCBAAA AAABBCDEFFF FDBAAABCDFF EEEEEDDCBAA FFEDCCBBAAB ABEEEFFDCCB FFEEDBAABCC FFEFEBBBBAA AAAABDEFEFF AABBBCCDEFF AABBBCDEEFF AAABCDEEFFE
30,CAABEEFEEDC AAABBCDEFFF AABDEEFFEDB FFEEDDCBBAA AAABBCDEFFF FFEEDCCBBAA CBBAABCDEFF AABCDDEEEFF AABCDEFFFEC FFCCCCCBBBB BBBBBBCDEFF EFEEEDDCBAA BAABCDEFFEE FEDBABBCCDE CCCCCCCBADF FFEDCCBBBAA FEBABCCDEEA BBABEFFEDCB FFECBBBBBBB FFEEDCBBBBA ABBBBCDDEFF CDEEFEECBAA BBBBBCCDEFF
31,AABCCCCDEFF AABBCCDEEFF AAABCDEEFFF AABCDEEEEEE FFFEDDCBBAA CBAABCDEFFF AAABCDEEFEE FFEEEDCBBAA FEEEEEDBAAA FFFEDCBBAAA BBBBBCCDEFF ABDDDEEFEDA FFEDCCBBBAA AAABCDDEFFF EEEEDCBEEBA FFEDCCBBBBA FFFEEDCBBAA DCCBBABCEFF AABCCDEEEFF EFFEDDBBCAA FFFEDBBBBAA FFEEDDCBBAA EEEEEEEDCAA
32,FEEEDDBBAAA AABBCDDEEFF AABCDEFFEDB FFEEEDCBAAA AAABCCDEFFF FFEEEDCBBAA CBAABCDEFFF AABBCDDEFFF FFDAABBCCDD ACEEBBCDEFB AAABBDFFFEE EDBBBAACEFF DEEFFEDCBAA DBAABBCEFFF EEEEEEDCBAA AEEEDDDDCCC FFEEEDDBAAA FEDBAAACDEF AAAACEEFEEE EFEEECCCCAA BBBBBBCDFFF EEFFEDCBBAA BBCDEFFFBBA
33,FFEEDCBBAAA DEFFEEDCAAA FFFDBBAABBD AAABBCDEEFF DEFFEDCBAAA CAABBCCDEFF AAABCDEEEFF CCDDEFFDAAA AAABCDEEEFF BBBBBBCDEFF FFFEDCCBBAA AABCDEEEDEF FFEDCBBBBBB BCDEEFEDCBA AAABCCDEEFF FFEEDCCBBAA BBBBBBCEFFF AACEFFFECBA AABCCDEEEFF AABBCDDEFFF AABBCDDEFFF BBBBBBCEFFF FFFDCBBBBBB
34,AEFFEDCCBBA BBAABBDEFFF AAABCEEEFEE FFEEDDDCBAA BBAABCDEEFF CDEEFFECBAA FDAAABCDDEE DBBABBBCEFF FFEBABBCCDD AABBCCCDEFF AAABBCEFFFE FFEEDCBAABB AAABCEEFFED FFEDDCCBBAA FFFECBAABCD ABBCEFFFDBA FFFEDCBBAAA AABCDEEEEFF FFFEDCBBAAA AAABCDDEEFF AABBCCDEEFF AABBCDDEEFF AAABBCDEFFF
35,AAABCDEEFFF AAABBCDEFFF DCDDEEEEDAA FFECBBAABCF ABCDEEBEEEC FFEEDCCBAAA AAABBCDEFFF AABBCCDEEFF FFFDAABBBCC AABBCCCDEFF AAABCDFFFED DBAAACDEFFF FFEEDCBBBAA FEEEEDCBBAA BBABBBCDEFF FFEEDCCBBAA FFEDCBAABCD AABBBCCEEFF EFFEEDCBAAA FFECBBBBBBB AABBCCDDEFF AABCCCDEEFF AABBBCDEFFF
36,FFFEDCCBAAA FFEEDCCBBAA FFEEDDCBBAA FFEEEDCCBAA AAABBCDEFFF ABDFFFEDCBB FFEEEDCCBAA FFECBBBBBBB AAABBCDEFFF AABBCDDEEFF AABBBCDEFFF FFEEEDCBAAA AAABCDEEFFF EFFECCBBBAA FFEEEDDCBAA CBBAABCDEFF AACDEEEEEED FFFECBABBBB FFDBAABCCEE AAACCCDEFFE BCAABDEFCDF ABCDBBCDEFF AAABCDDDEFF
37,BCCCBBBCEFF BAACDDDDEFF BBBBBBBDEFF EEEEEEDCBAA FFEEDBBAABB AABBCCDEEFF AABCDDEEEEE FEEFDCBBABB EEEFFDBAAAA AABBCDDEEFF AABBBCDEFFF AAABDDEEFFE FFFEDCBBBAA EBAABBCEFFF FFEEDDCDBAA FFEDCCBCBAA FFFDCBABBBB AAABBCDEEFF AABCCDEEEEE AACCDDDEEEF EEFFECBBCBA FFEDBBBBBBB FEBAACFEDEB
38,FFFEDCCBAAA FFEEDCCBBAA FFEEDDCBBAA FFEEEDCCBAA AAABCDDEFFF EFFEEDCBBAA FFFEDCBBAAB AABCCDEEEFF AAABCDDEEFF AABBCCDDEFF FFFEEDCBBAA DCBBBABDEFF AABCDDEFFEE FFEDCCBBBBA FFEEEDDCBAA CCBBBBBCEFF AACEEEEEDCB FFEEDCBBAAB AADEFEEEDCB CAABBCDEEFF AABBBCDEFFF AABBCDDEFFF AABBCCDDEFF
39,EFFFEDCBAAA FFEDCCBBBAA FFEEEDDCBAA FFEEEDCBBAA BBBBBBCDEFF FFFFECBBAAA BBAABCDEFFF AABBCCDEEFF AAACCDEEEFF AABBCCDEFFD FFFEDDCBAAA AABCDEEFFED FFEDCBBBBBB CDEEFEEDBAA AACEEEDCBDF AACEEEEEDDD FFFEDCBBBAA CEFFEDCBAAA AAABCDEEEFF ABBBAAEEEFF AABBBCDEEFF AABBCCDEFFF CBBBBBCDEFF
40,FFEDDCBBAAA DFFFEDCBBAA FFEEDCCBBAA CCCBBBBBDFF AABBCDEFFFE FFEDCBBABBC AAABCDEEEFF DDDDEFEDCAA AAABCCDEEFF AABBCDEEEFE FFEEDDCBAAA EEEEEECBAAA AABEFFEDCDD BCDEEFEECBA AAABCDEEEFF EEFFEDCBBAA FFFEDCBBBAA AABBBCDEFFF FFFECBABBBB AABBCDDEEFF AABBCCDEEFF AAABBCDEFFF AABDEEEEFFB
41,FFEDDCBBBAA FFEEDCBBAAA BAAACEEEEEE CCDDDDCBACF AABBCDEEFFF FFEDCBAABBC AABBCDEEEFF DDEFFECAAAA AAABCDEEEFF AABCCDEFFEA FFEEDDCBAAA AACFFFEDBBD EFFFDCBBAAA CCDEEFEDCAA AAABCDEEEFF FFFEDDCBBAA FEDDCBAABCF AAEFFEDDCCC AAABCDEEFFF AAACCDDEFFF AABBBCDEFFF ABBCCBBCEFF DDEEEEEDAAA
42,FFFDCDDCBAA FFEDCBBBBBB EEEDDEDDCAA FEEEEDDCBAA BBAABBDEEFF AABCEEFFEDD FFFEDCCBAAA CAABCDDEEFF AAABCDDEEFF AABBCCDDEFF CDEEFFECBAA DCBBBBBBDFF AACDEFFEDCB FFEEDCCBBAA FFEEEDCCBAA AACDEEEEEDC FFEEDDCBAAA AABCEFFEEDD FDBAAABDEFF EEEEEFDBAAA FFDCBBBBBCE AABBCDEEEFF AAABBCDEEFF
43,FFFEDCBBAAA FFEEEDCBAAA FFEECCBBBBA BBBBBBBDEFF BCDFFFECBAA FECBAABCDEF AABCDDEEEEE FFFDBAAABDD AAABCDEEFFF CCDDDEEFEBA FFFEDDCBAAA AAABCCDEFFF FFEDCBBBBBB ACDEFFDBAAE AABBCDDEFFE FFEEDDCBAAA BBBAABDEFFF AAABCDEFFFE FDAAABCDEEF ABCEFFFDCBA FFEEDCBAABC AABBCDEEEFF AAACDEEEFFC
44,FFFEDCBAAAA CBDCACFFDCB FFECAABBBCE BBBBBBCDEFF AABCDEFFEDB ECBBAABDEFF AABCDEEEEEE FFFEBBBBBBC AAABDEEEEEE EEEEEEDCBAA FFFEDCBAABB BCDEEFFEBAA FFECBBBBBCC ABBBBBCDEFF ABBCCEFFECA FFEEDCBBBAA BBBBBCDEEFF DFFEDCCDCAA AABCCDEEEFF AABBDCDEFFF AABBCDEEFFF BAABBCCDFFF FFFEDCBAAAB
45,ABBACFEEEEF AABBCCDEEFF AABBCDEEFFF FEEEEDDCBAA BBAABCDEEFF EEFFEDCBBAA FFEDBBAABCD AABCDEEEEEE AAABCDEEEFF FFFEEDCBAAA BBBBBBCDEFF FFFEDDCBBAA AADEFFEDCBB BAAABCDEEFF BBCCBBBBFFF FFEDCCBBBAA FFEEDDDCBAA FFEDCBBAAAD AABCDDEEEEF DEEECBAABDF EFFFECBBBBA FFEEEDCBBAA CBBABCDFFFB
46,EFFEEDCBAAA FFEDCCBBBAA FFEEEDDCBAA FFEEEDDCBAA AAABCCDEFFF FFFEDCCBAAA FFEEEDCBAAA AABCDDEEEEF AAABCDDEEFF AABBCDDEEFF AAABBCDFFFE FFEDCBBAABC ABDEFFEDBBA FFEDDCCBBAA DDCCBBAACFF CFFFEDCBBAA FFFEDCBAAAA DEFFEEDCAAA AAABCDEEFFF AAACDDEEFFE AABBCBDEEFF AAABCCDEEFF AAABCCDEEFF
47,FFEEECBBBAA DBAAABCEEFF AACDDEFFECA FFEEEDDCBAA FFEDCBAABCE AABBCCDEEFF FFFEEDCBAAA FFECBBBBBBB AAABCDDEFFF AABCDEEEEEF BBBBBBCDEFF FFEEEDCBBAA BAAABCDEFFF FCBAAABDEFF EEEEEEDCBAA FEDCBBAABEF FEEEEDDCBAA FFECBBBBBBC AABCCDEEEFF AADFFEEEDBA CCBBAACDEFF AABBCDDEFFF AAABCCDDEFF
48,AAABCEEEEEE ECAAABCDEFF AABCEFFFEDB FFEDDCCCBAA FFFEDCBBAAA AABBBCDEEFF FFFEEDCBAAA BAABCDDEEFF AABBDEEFFEB ABDEFFEDCBA BBBBBBCCEFF ADEEFFEDBAA BCEFFFDCBAA FCBBEDBDDCA DDDCBBAACFF ADFFDCBBCCB FFFEDCBBABA DCBAAACDEFF FFFEDCCBAAA FFEDCCBBBBB AABBCCDDEFF AABCDEEEEEE BBBBBCCDEFF
49,ABEEEDDDDDD AAABBCDEFFF AABBDEFFEED FFEEDDDCBAA FFFEDCBBBBA AAABBCDEFFF FCBCCAABDFF AABCCDDEEFF AAABDEEEEEF CCCCBBBBCEF CDDEFFEDBAA ECBAABBDEFF DEFFFECBAAA FFEEDDCCBAA CBBBBBBCEFF FFFEDCBBBAA FFEEDCBBAAC EFFFEDCBAAA AAABCDEEEFF FFFEDCBAABB FFFEDCCBAAA FEEEEDDBAAA AAABCCDEFDF
50,FEEEEDCBAAA FFEEDCCBBAA FFEEDDCBBAA BAAABCDEFFF FFFEEDCBAAB BBBBBBCDEFF AAABCDEEEFF ABCDEEFFEDA FAABBCDDEEF ABBCBBCDEFF EFFEEDCCBAA AAABCDEEEFF FFEDCCBBBBA CCDEFFEDCAA BBBAABCEFFF FFEEDCCBBAA FFFEDBAAABD AABCBDFFFEE BBAABBDEFFF CBEEDFFDCAA AABBBDEFFFE FDAABBCDEEF AABCDEEFFBB
51,FFDCDCAAACF AABBCDDEEFF AABCDEEFFEE FEEEEDDCBAA BBAABCCDEFF CDEFFEDCBAA FFEEDDBAABC AABCDDEEEEF AAABCDDEEFF AABBCDDEEFF AAABBDEFFEE FFFEDCBAAAB AABCDDEEEEE DBAAABCDEFF DDEEEEEDBAA FFEDCBBBBBB AAABDDDEFFE DFFECBCAABD AABBBDDEFFF EEFEEDCCCAA FFEEDCCBAAA FFFEDCBBBAA DDDDEEEEEAA
52,BFFEEDDCBAA FEBAABBCDEF EDDDCCDEFCA FFEEDDCCBAA CBBAABCDEFF AABCDEEFEEE FFFEDDCBBAA FFEEDCBBAAA AAABBCDEFFF AABCDEEEEED CBBBBBBCEFF AACEFFFEDCB FEDBBAABDEF AABCDDEEEEF FEEEEEDCBAA FFEDCBBAABD AABBCDEEFFE FFFEDCBAAAB AABDEFFEECB FFEEDCBBBBB AABBCCDEEFF AABBCDDEEFF ABBBBCDDEFF
53,ADBCDFFFDBA FCAACEEEDDC FFEEEDCCBAA DCCBBBBBDFF BCCDEEFFEBA FFDBAABCDDC FECAAABCDFF AABBCCDDEFF DEEEEEECBAA AACDEFEEDCB BBBBBBCDEFF FFEEEDCCBAA AAABCDEEFFF FFEDCBBBBBA FFEEEEDBAAA AAACDEFEEED FFFEDDCBBAA FFDCAABCDCB AABBCEEEEEE FFDCBAABDEE AAABCDEEEFF AABBCDEDEFF AAABCDEFFFC
54,ADFFEDDCCCC AAABCDEEFFF AABCDEFFEDB FFEEEDDCBAA CBAABBCDEFF ABCEEFFECBA FECBAABCDEF AABBCDDEEFF AAABDDEEEEF BBBBBBBCDFF AABBCEFFEDB BAABDFFFECB FFEDCBBBBBB CCCCCCBBBEF DFEEEEDCBAA FFEEDCBBAAA ABAACDDEFFF BAABBCDEFFF AABCCDEEEFF EFFFEDCBAAA FFEEEDCBAAA AACDEFEEDDD AAAABCDEFEF
55,FFEDCCBBABA AAABBCDEFFF AABBCDEEEFF FDCBCEEEDCA FFFDCBAAABD EEEFEECBAAA BAAABCDEFFF AABBBCCEEFF FFECABBBBCC ABBCCCCCDFF AAABBDEFFED FFEEDCBAAAB AABBCDEFFEE FFEEDCCBBAA FFFEDCBAAAB AABCDEEEEEE FFEEEDCBAAA FFDCCCCBBAB AAABCDEEEFF AABBCDDEFFF AABBCDDEEFF AABBCDEEEFF AAABCDDEEFF
56,BBBBBBCEFFF FFDBAABCDDD EEEEEEEDBAA FFECCCCCBBA FFFEDCCBAAA CCBBABCDEFF EEFFEDCBBAA AABCDEEEEEF DDDEEFEDBAA BDEEFFEDCAA BBBBBBCDEFF BEFFEEDCBAA AABBCDEEFFF ECBAABCDEFF EEEEEEDCBAA ABEFEDDDDCC EEEEEEDCBAA FFFEDDCBAAA BAAACDEFFFE FFEDCBAAACE FFFEEDCBAAA EEEEEEDCAAA FFECBCDDAAB
57,FEEDBABBBDE AABCCDDEEFF BBBBBBBCEFF EDDEEEEDCAA FFFEDCBBAAA AABBCDDEEFF AABCDFFEEED FFEEDDCBAAA FFEEEDDCAAA EFFEDDCBBAA BBBBBBCDEFF AABCDEEEEEE EFEEEDCBAAA FCAAABDEFEE FFEEEDCBAAA FFFECCBBBAA FFEEDDCCBAA FEDBABABCEF AABCDEEEEEE AAABCCEEFFF AAABBCDEEFF AABBCCDEFFF DDEEEEEDBAA
58,DDDEFFEDBAA FFEDCCBBBBA FFEEEDDCBAA CCBBBBBCEFF BCDEFFFEBAA FFEEDCBBBAA AAABBCDEFFF AAABCDDEFFF FFFECABBBBB AABCCCCDEFF DEEFFEDCBAA CBBAABCEFFF EFFFEDCBAAA FFEDDCCBBAA FEEDDCBAACF AABCEFEEEED FFFEDDCBBAA FFDCBBABBCF DEFFFECBAAA BCDBAACEEEF AAABCDEEEFF DCEEEFBCBBA AABBBCDDEFF
59,FFEEDCCBBAA FFEDDCCBBAA FFEEEDCCBAA DCBBBBBCEFF BCDEFFFDBAA FFEECBBBBAA AAABBCDEFFF AABBCDEEFFE FFDABBBCCCD AABBCCDDEFF DEEFFEDCAAA CBBAABCEFFF EFFFEDCBAAA FFEEDCCBBAA FFEEEDCBAAA AABCDEEEEEE FFFEDCBBBAA BBAABCCEFFF FFEEDCBAABB AABDDDDEFEE BBBBBBDEFFF ABBBCCCDEFF AABBCCDEEFF
60,AFFEDCCCCBB AABBBDDEEFF AABCDEFFEED FFEEDDCBBAA FFEDCBABBBC DDEFFEDCBAA BBAABCDEEFF AABBCCDEEFF CAAABDEEFFF BBBBBBCCDFF DEEFFEDCBAA ABDDBBCDEFF AABCEFFEDDC FFEDCCCBBAA FFEEDCBAABB AAABCCDEFFF FFFEEDCBBAA CBBAABCDEFF FFFEDCBAAAA AAABCCCEFFF AABBCCDEEFF AABCDEEEEEF AABBBCDDEFF
61,AAABCEEEEEE AACCDFFEDDC FFEEEECCBAA CCCBBBABEFF EFFEEDCBBAA FFEDBBAABCE AABCDEEEEED FFEDDDCBAAA FEEDDDDCBAA FFEEDCBBBAA CBBBBBBCEFF AABCDEEFEEE FFFEDCBBBBA FFDBABBCCDD EEEEEEDCBAA FFEDCCBBBAA FFFEDCBBBAA FFECBBABBCE AAABCEEEEEE FFFFDAABBBB EEDDDDEEDAA FFEEEDDCBAA FFDBAABBCDE
62,FFFEDCBBAAA AABBCDDEFFF DDEEEEEDBAA FFEEEDDCBAA FDBAABBCDEF BCDEFFEDCAA BBAABCDEFFF AABCCDDEEFF DEEFFFBAAAB AABCDDDCDEF AAABCDEEFFF FEFFECDCBAA FFEDCCBBBBB BBBBBBBCEFF AACDEEEEEDC FFEDCCBBABB ABBBBCCDFFF FEEECBABCAE EFEEDDCBAAA FEFEDDCBAAA FFFDCCBBBAA FFEEEDCCBAA AAABCCDEFFE
63,FFFEEDCBAAA FFDBBBBCCBB FFEEEDDCBAA CBBBBBBCEFF BDEEFFEDBAA FFEEDCBBBBB AAABBCDEFFF AABBCCDEFFF FFFECABBBBB AABBBCCDEFF EEFFEDCBAAA DCBBBBBBDFF BDEFFEDBBAA FFEEDCCBBAA DDCCBBABDFF ACEFFEDCBAA FFEEDDCBBAA BAAABCDEFFF FFEDCBBBBBB AABBCCDEFFF AABBCCDEEFF AABBCDDEEFF AABBBCDDEFF
64,AAEEDEEDDDC AABBBCDEEFF AABBCDEFFEE FFEEEDDCBAA FFEEDCBBAAB CDDEFFFDBAA BBBBACDEFFF AABCCDDEEFF AAABDDEEEEF BBBBBCCDEFF EEEEEEDCBAA BAAABCDEFFF FFEDCCBBBAA AAABCEEEFFE CCCBBBABDFF FFFEDCBBBAA FFEEDCCCBAA FCCEECBAACD AABBCDEEEFF ABCCCFFCDDB CEBAACECBEF FFEEEEDCBAA AAABCDEEEFF
65,AADDDEEEEEE AABBCCDEEFF BCDEEFEECBA FFEEEDDCBAA CBAAABCEEFF AABCDEFEEED FFFEEDCBAAA FFEDCCBBBAA AAABBCDEFFF CEEEEEEDBAA FEDCBBAABDF AABCDEFEEED CBBBBBBCEFF AABCDDEEEEF AABDEFFFECA FFEDCBBBBBB AAABDEFFFEC FFEDCAAADEE FFFEDCBBBAA EEEDCBAADFB FFEEDCBAABB FFFEEDCBAAA FFEDAAABCEF
66,FFEDCCBBBAA AAABBCDEEFF AABCDDEEEEE FEDEEEEDBAA EEDCBAAACEF AAABDEFFEED FFFEDCBAAAA FFFEDCBBAAB DDEFFFEBAAA AABBCDDDEFF BBCDEFFECAA DABEECBACEF AABBCDEFFEE FFEEDCBBBAA DDBAABCDEFF CCDEFFDCBAA FFFEDCBBAAC CEFFFEDCBAA AABBCDEEEFF AAABCCDEEFF AABBCCDEEFF AABBCDDEEFF AABBCCDEEFF
67,CDCCBBBACFF AACEEEEEDDD FFEEDDCBBAA FFEEDDCBBAA FFFEDCCBAAA BBAABCCDEFF ACEFFEDCBAA FCAAABCDEFF AAABCDEFFFE AABCDEFEEDE DEEFFEDBAAA AAABCDEFFEE FFEDCCBBBBA EDDDDCBBABF AABBCDDEFFF FFFEDCBBBAA FFDCCCCBBAF EFFFEDCBBAA FFEDDCBBBAA FFFDBBCBBBB AACCCBBDEFF AABDDDEEEEE AAABBCEEEFF
68,ABEEEEDDDDC BAABBCDEFFF ABBDEEFFDCA FFEEDDDCBAA FFEEDCBBBAA AAABBCEEFFF CBBBBABDEFF AABBCDDEEFF AAABDEEEEEE CCBBBBBCDFF EEEFEEDCBAA BBAABCDEFFF FFFEECBBAAA FFEEEDCCBAA CCBBBBBCEFF EFFEECCBBAA FFFEDCCBBAA BDEFFFDCBAA AAABCDEEFFF DEFFFDBAAAB FFFEDBBAABB DEEEFDCCCBA AAABBCDEFFF
69,FFEEDCBBBAA FFDBBBCCCBB EEEEEEDCBAA FFEEEDDCBAA CBBAABCEEFF AABDEFFEDCB FFFEDCBBBAA AABCDDEEEFF AAABCDDEEFF AABBCCDEEFF DEEFEEDCBAA FFEDCBAAACF AABBDDEEEFE FFECBBBBBBB FEEEEDDCBAA EDCBBBBBCFF CEEEEEEDCAA FEDCBAACDEE AABACDDDEFF FEFEEDAABCC DFFEFCAAABD AABBCCCEEFF ABCECBDFEBE
70,FFFEDDCBAAA FFEEDCCBBAA FFEEDDCBBAA FFEEEDCBAAA AABBCDDEEFF FFFEDCBBAAA FFEEDDDCBAA FFEEDCBBBAA AAABBCDEFFF AACDEFFEEDB BBBBBBBCEFF BDEFFEEDBAA BAAABCDEFFF AABCDEEEEEE EEEEEEEDBAA FFEDDCBBBAA AABBDEEEEEE FFFEDCCBAAA BDFFFEDCBAA DBBABBCDEFF AABBCCDEEFF AAABCCDEEFF AABBBCDDEFF
71,EEDDCFEDBAA FFEDCCCBBAA FFEEEDCCBAA FEDCBAABCEF DEEEEEEDBAA FFDBBBBBCCD AAABCDEEFFF AABCDEEFFEC FAABBCDDEEF AABBBCCDEFF EEFFEDCBBAA BBAABCDEFFF FFFEDCBBBAA EEEEEEDCBAA BBBAACDEFFF FFEEDCCBBAA FEFFDBAAABD AAABCEFFEEE FDAAABDDEEE ACDDDDDEFEC FFEECCCBAAA FFEEEDCBAAA AABBBCCDEFF
72,AAABDEEEEEE FEBAAACCDEE EEDDEEDDCAA FFEEDDCBBAA FFFEDCBBAAB AABBCCDEFFF FFFEDBBABBB AABCDDEEEEF BBCDEFFEDAA AABDEEEEEEE ABBBCEFFECB AACEEDBBDEF AAABCDEFFFE FFEDDCCBBAA ECCCAABDEFF ABCEFFFDCBA FFEEEDDBBAA AABDEFFEDCB FFCABBCCCCC FFEDDBBABBB AABBBCDDEFF AABCDDEEEEF AAABDEEDDEF
73,FFFEDCBBAAA BDFFFECBBAA FEEBAABBCDF ABBBBCDEEFF DEFFEDCBBAA BAAABCDEEFF AABCCDEEEFF FFFEBAABBBC AAABDDEEEEF EEEEEEDCBAA FFFEDCBBABA DDDDDEEEDAA FFEDCBBBBBB BBBBBBBCEFF BBCDEFFEDAA FFECBBBBBBB AAABBCDEEFF FFFEDCBAABC AABCCDEEEFF ABBCDEFFDBA EEEEEEDCBAA AABBCDDEFFF EEEEEEECAAA
74,BBBAABCEFFF FFEDDCCBBAA FFEEEDDCBAA FFEEDDCCBAA FFEDBBAABCE AABCDEFFEDB FEBAABCDEEF AABBCCDEEFF FFDAABBCDDE ABBBCBCDEFF AABBDFFFEDB FDCAABCDEEF EFFEEDCBAAA FFEEDDCBBAA AAABEFFEEEE FFFEDCBBBAA DDCCBBABDFF DEFFEDCBAAA AABBCDEEEFF AABBCDDEFFF FFEEDCBBBAA FFEDDBBBBBB BBBABBDEEFF
75,FFFEDCBBAAA AACEDBCCEFF AADEDEECCDF ABBBBBCEEFF ABDEFFEDCBA FFFECBBBAAB AAABCDEEFFF AAABCDEFFFC AAABCDEEEFF AABBCDEFFEB FFEEDDCBAAA EFFEEDCBAAA FFFECBBBBBB DDEEEDBAACF ACDEFFEDCAA FFEDCBCCBAA AAABCDEFFFF EDBAAABDEFF AABBCDDEEFF AABBCDDEFFF AABBCCDEFFF FFFEEDCBBAA FCBAABBCDFF
76,FFEEDDCBAAA FFEEEDCBAAA FFEEDCCBBAA BBABBCDEEFF AABCDEEFFEC FFEDCCBBBAA FFFEDCBBAAA AABCCDEEEFF AAABCCDEEFF AABCDDDEEFF CCDEFFEDCAA FFEEDCBAABC AAABCDEEFFF FDCBAABCDEE EEEEEEDCBAA FFEDCBBAABE AABBCCDEFFF FFFEEDCBAAA EACDDDFFDBA AABBCDDEFFF AABBCCDEFFF BBBBBBCEEFF AACEFFFBBCC
77,FFEDDCCBBAA AAABBDDEFFF DEEEEEEEBAA CBBBBBBDEFF BCDEEEEEDAA FFEDDCBBBAA AAABBCDEFFF AABBCDDEFFF FFFECAABBBB ABBBCCCDEFF BBCDEFFECAA FFEDCBAABCF AABCEFFFEDC FFEDDCBBBAA FEDDCBAABDF ABDFFFEDCBA FFEDDCCBBAA BBBBBBCEFFF FFECCBBBBBB AABCDDDEEFF AAABBDEEEFF AABBCDDEEFF AAABCDEFFEE
78,FFFEDCCBBAA FDBAABCDDEE DDDDEEEECAA FFEEDDDCBAA FFDCCBAABCE AABCDEFFEDB FFEECBAABBB AABCDCDEEFF DEFFFDAAABC AABBCCDEEFF CDDEFFECBAA FFEEDCCBBAA AAABBCDEFFF AABDEEEEEDD FFFEEDCBAAA AAABCCDEEFF EEFEEDCBAAA DCBBCEFFDBA FCAAABCEEFF AABBCCDEEFF AABBCCDEEFF AABBCCDEEFF AABBCCDEEFF
79,AAACEEEEEEE FFFEDCBBBAA DDDDEEEECAA AAABCDEEFFF FFFEDDCBAAA DCBAABBDEFF CEEFFEDCBAA FFFEDCBBAAA FFEDCCDCBAA FFFEECBBAAA FFEDCBAAACF AABBCDDEEFF ACEEEEEEEBA FDBAAABCDEF CDDEEEEECAA FFCAADCCCCB EEEEEEDCBAA FFFEDCBBAAA BBBBBBCDFFF ACBBEEEEEDC FEDDCAAABDF AACDDEEEEEE BBBBBBCDEFF
80,FFEDDCBBBAA FFDCCBBBBBB EEEEEEEDCAA FFEEEDDCBAA FEDCBBAABEF EFFFEDBAAAB AAABCDEEEFF BCCCDDEFFCA AAABCDEEFFF BBBCCDEFFEA FFEEDCBBAAA AABBCDEEEFF DEFFEDCBBAA DEFFEDDCBAA CDEEEEDBAAF ABCDEFFEDCB EDCCCBBABEF EFFFEDCBAAA AAABCDEEEFF AABBCCCEFFF AABBCCDEEFF AABBCCDEEFF AABBCCDDEFF
81,ABBCDDDDEFF AABBCCDEEFF AABBCCDDDFF AAABDDEEFFE FFFEDCCBAAA BAAABCDEFFF AABBCEEEEEE FFFEEDCBBAA EEEEEEDDBAA FFCCCCCBBBB BBBBBBCDEFF AACDDEEEEEE FFFEDCBBAAA BAABBCDEFFF EEEEEEECBAA FFEDCCBBBBA FFFEDCCBAAA BBAABCEEFFF AABCDEEEEEE EFEFFABCBAA FFFEEEDBAAA FEDEEEDCBAA EEEEEEEDBAA
82,ABEFEEDDDCB ABBBCEEEFFE CCCBBBBBCFF FFEEEDCBBAA FFEEDCBBAAA AABBBCDEEFF AAABCDEEFFF EEEEEEDCBAA AAABCDDEEFF BFFDBADBBEE BBBBBBCDEFF BDEDDBAADFF FFFEDCBBAAA CAAABCDEFFF FEEEEDDCBAA FFDCBBBBCCD AAABCDEEFFF FFFEEDCBBAA FFEDDCBBBAA FFFEDDCBBAA FFEEDCCBBAA FFEEDCCBBAA BAAABDEEDEF
83,DEFEEEDBAAA FFEDCCBBABB FEEEEDDCBAA FFEEEDCBAAA AAABBCDEFFF FFFEDCBBBAA EEFFEBAABCD AABCDDEEEEF AAABCCDEEFF AABBCCCDEFF EEEFEEDCBAA AAABCDEEFFF FFEDCCBBBBA BCCEEFEEDBA AAABBCDEFFF FFEEDCBBBAA FFEEDDCBBAA EFFFDCBBAAB AABCDDEEEFF AACCCDEEFFA FCBBBBBBDEF CAABEFEDEDD AAABCDDDEFF
84,DFFFEDCBAAA FFFFDBAAABC AABBBCDEFFF ABBBCCCDDFF AABCDEFFFDC EDCBAABCEFF AABCDDEEEEF FFFEBBBBBBC AABCDEEEEEE EEEEEEEDBAA FFFEDCBAAAB BBCDEEFFDAA FFEDCBBBBBB ABBBBBCDEFF BBCDEFFFDBA FFEDBBBBBBB AAABCEEEEEF ABCEFFFECBA AAABCDEEEFF AABBCCDEEFF AAABCCDEFFF AAABCDDEFFF EEFFEDCBAAA
85,ABEEEDEEDDC BAABBCDEEFF AABBCDEFFEE FFEEDDDCBAA FFEECBAABBD AABCEFFFDBB EEEFFECBAAA AABCDDDEEEF AAABCDDEFFF ABBCCDCDDFF AAABBCDEFFF FFFEDCBAABC EFFFEDCBAAA FFEEDDCBBAA BBBBBBCDEFF EFFEEDCBBAA FFEEDDCCBAA EFFEECBAAAB AABCCDEEEFF DEEEEEEBAAA BABCBBCDEFF AABCDEEEEEE AAABBCDEFFF
86,FFEDCCBBBAA AAABBCDEEFF AAABCDEEFFE FFEEDDCCAAA FFEDBBBBBCC CDEEFFECBAA AAAABCEEFFF AABBBCCDEFF FFFDBABBBCC ABBBBCCDEFF CDDEFFEDBAA FFEEEDBBAAA AAABBCDEEFF FFDBBBBBCCD FFEEDDCBAAA BAABBBFFFFE FFEEDCBBAAA ABDFFFEECBA DBAABCDEFFF AAABCCDEFFF AABBCCDEEFF AAABCDDEEFF AABBCCDEEFF
87,FFFEDCCBAAA FFEEDCCBBAA FFEEDDCBBAA CCBBBBBCEFF AABCDEFFEDC FFEEDCCBBAA CBAAACDEFFF AABCDEFFFEB AAABCDEEEFF AABBCDEFFFD FFFEDCBBAAA AAABCDEEFFF FFFEDCBBBAA FFEEEDCBAAA AAABCDEFFFE FFEEDCCBBAA BBBBBBBDEFF CEFFFEDCBAA EBAABCDEEFF DECAACDEEDD AAABBCDEFFF AABBCCDEFFF DDEEEFECAAA
88,EFFEDCBBAAA AABBBCCDEFF AACCDEFEEED FEEEEEDCBAA FFEDCBBBBBC AABBDEFFFEB AAABCDEEFFF AABBBCDDEFF FFFECBBBBBB ABCCDBBBDFF AAABBDEFFEE DDBAAACEFFF FFEDCCBBBAA DDDEEEEDBAA AAACDEFFEED FFEDDCBBBAA CCCCBBBBCFF AABDFFFEDCB AAACDEEEEEE FEFFCBBAADC EFEBABCBBEF EBAABBCDEFF CCDDEEEEEBA
89,EFFEDDCBAAA FFEDDCBBBAA FFEEEDCCBAA FFEEEDCCBAA EDCBAABCDFF AABBCDEEFFF FFFEDDCBBAA FFECBBBBCCC AAABCDDEFFF AABBCDEEEEF BBBBBBDEFFF FFEEEDCBAAA AAABCDDEFFF ABDCCCDDEFF EEEEEEEDBAA FFEDCCBBBAA AACDEEEEEED FFEEDCBAABC FFEEEEDCAAA CCCCCFFECAA DDEDDECDEBA BCCBAACEEFF AAABBCDEEFF
90,BAAABCEFFFF FFEDCCBBBAA FFEEEDCCBAA FFEDDDCCBAA EDCBAABCEFF BDEFFEDCBAA FFEDBBBBBBB ACEFFEEDBAA BCDFFFEAABB AABCEFFEDCD BBBBBBCDEFF FFFEDDCBAAA AAABBCDEEFF FFEDCCCBBAA FEEEEDDCBAA AAABCDEEFFF FFFEEDCBAAA FFDCBAAACDF DEFEEEDBAAA BABACECEFEF AAACCEDDDFF DEEEEEECAAA EDCBAABCDEF
91,AAACCEFEEEE DFFEEEDCBAA FFEDEEDCBAA DDCCBBABCFF AABBCDDEFFF FFFEDCBBAAA FFFEDCBBAAA FFEEEDCBBAA AAABBCDEFFF AABCCDEEEFF BBBBBBCDEFF FFEEEDCBAAA AAABCDEEFFF DBBAABCDEFF EEEEEEDCBAA CBBBABCDEFF ABDDEFFEDBA FFFEDCCBAAA AAABCCEEFFF AABBBCEEFFF BEFFFBABBCD FBBAAEFEDDB AAABCDEFFFE
92,AABCDEEEEEE CFFFEDCBBAA EDDCDEFECAA AAABCDEEFFF FFFEEDCBBAA FEDCAAABDEF AABEEEEEEDC FFFEDCCBAAA FFEDDCCCBAA FFFDCBBBBBA FEDCBBAABEF AABBCDEEFEF BBAABBDEFFF FEBAAABCDEF BCDEEEEECAA FFEDCCBBBAA FFEEDCCBCAA FFEDCBBABBB BAABBCDEEFF FFEEEDBAAAA BAAABDEEEFF EEFEEEDCBAA DCBBBBCCDEF
