,0
0,FFCBCBB FFEDBAA BBBBDFF AACDEFF ABEDBFE FEEDCAA FFDCBAA AABCDFF ABDEFEE EEEECAA FFDCBAA FFEBBAB ABBCDFF AACDEFF ABBCDEF AABDEFF EEEECAA AACDEEF ABCDEEF AABCDFF ABBCDEF EFEDCAA FFEDCAA AABDEEF ABDEFEC FFDCBBA FFDCBBA FEEDCAA FFEDCAA AABCEFF ACEFECB FEEDBAA FFEDBAA FFEDCAA EDBBBCF ABDEEEE FFDCBAA AABCEFF ACCBCFF CCDFFCA AECFDCD ABCCDEF AACDEFF AABDDEF AABCDFF ABCEFDD
1,AACEEEE FFEDBAA FECBBBB AABCEFF AACDDFF DEFDDBA FFDCBBA FEEDCBA FFEDBAA DBABCEF AABCEFF AACEFED FFEDCAA FEBABCD AACDEFF AABCDEF AABCEFF DEEEDBA FFDBBBB FEEDCAA FECBABE AABCDFF FFEDBBA FFFDBAA AABCDFF AABDEFE FEDCBAA FFECBAA FEDECBA FCABEEC CBBABFF FEEDCAA FFDCBBA FEEDDBA AABCEFF FFECBBA FECBBBB AACDEFF FFDCBBA AACDEFF AABDEEF ABBCEFF AACDEFF BECBBDF ABBCDEF ABBCDFF
2,ADFFDBA FFECBAA FFDCBBB EEEEDBA BABCEFE FEEDCAA FFECBAA FFEDCAA FECBBBD AABCDFF AACDEEF FFECBAA FFECBBA AABDEFF AACDEFF AABDEFF AABCEFF AACDEFF AABDEFF ABBCDFF DEEEDBA FFECBBA FFDCBBB AABCDFF ABDFEEC FFDCBBA FECBABF FEEDCBA FFEDBAA BBABDFF ABDEEED FEEDCBA FEEDCBA FFEDBAA CBABFFE FFECBAA DBABEEF ABCDEEF AACCEFF AADFFCD AACDDEF AABCDFF ABCDDEF AACDEEF AABCDFF BBBBCEF
3,DFECBBB AABCDFF ABBCDFF ABBCDFF AABDEFF AACDEFF FEECABB EEEDDBA FEEDBAA AABCDEF AABCEFF EFEDCAA FFEDBAA ABBCEFF AABCEFF AABCDEF AACDFFD FCABCDE ABCDEFF CBBBCEF ABBCDEF AACDFFE FFECBAA EEEECAA ABBCDEF AABDEFF DFDCBBB DBAEEEE CCFFDBA FFEDCAA FCCCBBC ABBCDFF DEEEDBA FFECBAA FFDCBAA AADEEED FFDBABD ABCDEEF AABCEFF AABDEEF AACDEEF ABBCDFF AACDEFF ABBCDFF ABBCDFF CDEEECA
4,FFDBCBA FFDCBAA BBBBDFF AACDEEF AABCEFF EEEECAA FFDCBAB AABCEFF ABBCDFF FEEDCAA FFDCBAA ABBCDEF AABCDFF AACDEFF AACDEFF EEEEDBA FBBBCDD ABBCDFF AACDEFF ABBCDFF ABDEFEA FFECBAA FEDBABD AACDEEF BCEFECA FFDCBAA FECBBBB FEEDCBA FFEDCAA BAACDFF ABEFEDC FEEDBAA FFDCBAA FFEDCBA FDBBBBF AACEFED FEDCBBA ABCDDFF FEDCBBA FEEEDBA EFEDBAA FFEBBBA FFDCBBA FFEDBAA CBBBCEF ABBCDFF
5,FDBCCBB AABCEFF AABDEFF AABCEEF AACDEFF BBBBBEF AACEEEE CEFFDBA FFEDCAA FFECBAA AABDEFF AABCEFF AABCEFF FECCBBA FFDBBBB FECCCBA FFECAAB EEEDDBA FDBBBBB FFEDBAA CBBBCEF AABCDFF AABCEFF DEEEDAA FEDCBBA FFECBAA FEBBBBC ABBCEFF EEEEDBA FFEDCAA FEDCBAA FEEDCAA FFEDCAA FEEDCBA FECBBBC AABCEFF AACDEFF ABCCEFF DEEBBEB EFFCABB DEFEDAA AABCEFF FEDBABC ABDDFEE AABCEFF EEEDCAA
6,AABEEEF FECBCBA FFDCBBB FEDDBAA EEEECBA BABCEFF FFEDCAA FFECCBA FFECBAA FECBBBC ABBCDFF AACDDEF FFEDBAA FEDAACD AACDEFF FFFCBBA FEAABCD ABEBEDF FEEDCBA FFEDCAA FFEDBAA CBBBCEF AABDEFF AACDEFF BBBCDFF ABBBEFF ABBCEFF AABCDFF AACDEFF EEEECBA FFDCBAA CBBBBEF AABCEFF DDFCDDA FFDCBBA FFDCBAA FFECBAA FEDECBA DBBBBEF ABBBEFF FBBBCDE DFFDBAA AABEEEF FEBBBBB FFCBABC ABBCDEF
7,FFECBAA FFDCBBA AABDEFF AACDEEF AABEDFF CFECBDA EEEDCBA FEEDCAA FFECBAB ABBCEFF AABDEFF FFEDBAA FFECBAA AABDEFF AACDEFF AACCEEF AABCEFF FECBBBC AACDEEF ABBCDEF ABBCDEF ABDFFEC FFDCBBA FFEDBAA ABBCDEF AABDEFF AACDEEE FFECBBA FFEDCAA FFEDCAA FDBABDF AACDEFE FFEDCAA FFECBAA ABDFFEC FEDCBBA FDBABDF ABCDEEF FFDBCAB AADEDEF AABDEFF ABBCDEF AACDEFE BCDDEFA ABBCDFF ABBCDFF
8,EFEABBB FFECBAA FFDCBAA FFEDCAA FFEDBAA FFDDCAA FFECBAA BBBBDEF AABDEFF DEFECAA FFECBAA FFDCBBA EDBABCF AABDEFF AACDEFF AABDEFF BDEEEDA FEBBBBC ABCDEFF ABCBDEF ABBCDEF FFECBAA FFDCBAA AABCEFF AACDEFF FFDCBAA FEDCBBA FEEDCBA FFEDCAA FFDCAAB AABCEFF ABEEEDD FEECBBA FEDDCBA FFECBAA AEFEDBA BBABDFF ABCDEEF AABDEFF AACDEFF AACDEEF AACCDFF AABCDFF AABCDFF AABCDFF ABDFFBB
9,DEFECAA FFDCBAA ECABBEF AABDEFF ABBCEFF ABDEEED FECCADC FECCDEA FEECBAA FCAACDE BABCEFE FFEDCAA BBABDFF ABBDEEF AABDEFF AABCEFF FFDBABB AABDEFF AABDEFF AABCEEF CDEFEBA FFDCBAA FEEDDBA BAACDFF AABDEFF AACDEFE FFDCBAA FFEDCAA FFEDCAA FFECBAA AABCDFF ADEFECA FFEDBAA DBBBBFF EDCAACF AACEEEE FFECBAA AABCEFF ABCDDEF AABCDEF AABCDFF AABCEFF ABCDEEF AACEDEF AABCDFF ABBCDFF
10,EFBAACF FFECBAB AABCEFF AABCEFF AABDEEF ACEFFCA FFECBAA FFECBAB AABCEFF AABDEFF EEEECAA FFECBAA FEEDCBA FFDCBBA FEDCCBA FFECBAA ABBCDFF AABDEFF ABCDEEF FFEDCAA FFDCBAA ABBCDFF AACDEFF FFECBAA FEDBAAD AACDEFF ABEEEEE AABCEFF AACDEFF FFEDCBA FECAADE FECDDBA FECBDCA FFEDCBA FFEDBAA FECBBBB AABDEFF ABCDEEF CFDCFCA ABEDEED AABDDFF FBBCDEC AABCEFF AEEDEBA AABCEFF EEEECAA
11,FFECBAA FFDCBAA FFDCBAA FFECBAA FFEDBAA FFEDBAA FEEDCAA FFEDCAA AABCDFF AABDEFF AACDEEF FEECBBA FEEDCAA FFECBAA CAACEFF AACDEEF AABCEFF AABDEFF ABCDEFF BBBBDEF ABDEFDA FFECBAA FFDCBBA BBBBDFF AACDEFF ABCDEEF FEDCBBA AACDDEF FFEDCAA FFEDCAA FFDCBAA CCBBBDF AACDEFF FFEDBAA FFEDBAA CBABDFF AEFECBA FEEDCBA FECBBBB ACEEDDD ABBCEFE ABBCEEF ADDCBEF AACEEEF AABCEFF ABCDECF
12,BEFECBA FFDCBBA FEDCBBB AACDEEF FEDCBBA FEEDCAA FEEDCAA FFEDCAA FFECBAA AABCDFF AABDEFF AACEEEE FEEDCAA FFECBAA FECBBBC AACDEEF AABCEFF AABDEFF AACDEEF ABBCDEF ABBCDEF AACEEFE FEEDBAA BBBCDFF ABDEEDD FFDCBAA FEDBBBB EDEEDBA FFEDCAA FFEDBAA FFDCBAA AACDEFF ADEEEDC FEEDCBA FECBBBB AABDEFF EEEDDBA FFECBAA AABDEEF EFEBABC FEDCCBA BABCEFF AACDDEF AABCEFF AABCDFF ABCEFFC
13,FFEDBAA FFDCBAA FFDCBAA FFECBAA FFEDBAA FFEDBAA FEEDCAA AABCEFF AACDEFF FFEDCAA FFDCBBA FFEDBAA AABCEFF AACDEEF AACDEFF FFEBABB AABCEFF ABCDEEF AABCEFF ABDEFEB FEEDCAA FDBAACF ABCDEFF FFEDBAA FFDCBAA FEBBBCD ABDEFEB AABCDFF ABCEEEE FFEDCAA FFDCBAA FFEDCAA AABCDFF AABDEFF EEEDCBA FFDBABB AACDEFF AABDEFF EFEDCAA FECBBBF EEEECAA FFEDBAA FEBABCD ABBCDFF AABCDEF ABBCDFF
14,AACEEEF AACEFEE FDBABDF AABDEFF ABBCEEF CEFEDBA FFDCBBA FFEDCAA FFECBAA FFDCBBA BBBCDEF AACDEFE FFDCBBA FFECBAB ABBDEFF AABDEEF AABCEFF AACDEFF ABEEDDD DDBABDF ABBCDEF DEEEDBA FEEDBAA FEBABCE AABDEFF ABEEEDD FEDBBBB FEEDCAA CEFEDCA FFEDCAA BAACDFF AABDEFF DBABFFD FFEDCBA FFDCBAA FECCBBA FECBBBB AABDEFF ABBCEFF AACDEEE AABDEFF BBBBCFF AABDEEF BACBCEF ABCCEFF AABCDEF
15,FEDCBBA FFDCBAA BBABDEF AABCEFF AABDEEF EEEDCBA FFDCBBA FFEDCAA AABCDFF AABDEFF CEFEDBA FEEDCAA FFEDCAA CABCDFF AACDEFF AABDEEF AABCEFF AABCEFF ABCDEFF ABBCDFF AABCEFF FEEDCAA FFECBAA BBBBDEF AABDEFF DEFECAA FECBBBB FFEDBAA FEEDCBA FFEDCAA FFDCBAA BBBBDFF ACDEFDB FFEDCAA FECBBBC AACDEEF DEECDEA FEDCBBA ABCDEEF AACDEEF AACDEEF AABDEFF ABCCEFF AABDEEF AABCDFF AABCEFF
16,ABBEFED FFECBAA FFDCBAA FFECBAA FFECBAA FFEDCAA FFECBAA FFEDCAA AABCEFF AABCEFF EFEDBAA FEEDCBA FEDCCAA BBBCDFF AABEEEE ACCCDEF ABBCDEF DDEEEBA ABCEDEF ABBCDEF AABDEFF EEFEBAA FEDCCBA FFDCBBB AABCDFF AABCEFF ABDEEEE FFECBAA FFEDCAA EBACCDF ABBCDFF FEEDCAA FFEDCAA FEEDCAA DCBABFF ABCEFED FEEDCBA FEBBBCC AACCEFF AACDEEF ABBCDFF AABDEFF AABDEFF AABCEFF AABCDFF ABBBDFF
17,ECBBBCF ABDEEEE FFDCBBA FFECBBA FFDCBBA FEEDCBA FFDCBBA FEEDCBA FFECBAA AABCEFF CDEFEBA FFEDCAA FDBBBCD AACDEFF ABCDFFD AABCDFF EEEEBAA AACDEEF ABCDEFF ABBCDFF ABBCDEF FFEDCAA FCBBDDB FDBCCBB BBBDFEC ADFEDBA FFDCBAA FEEDCAA FFECBAA AACEEEE BAACEFF FEEDCAA FFDCBBA FEDBBBB AABDEFE AABCEFF ABDEFEC FFECBAA FCBBCCC AABDEFF AACDEFF ABBCDEF AACDEEF FFECBAA FFECAAB ABBCDEF
18,FDBEECA FFECBAA FEECBBA FFDCBBA FFDCBAA FFECBAA FECCBAD AABCDFF AACDEFF FFECBAA FFECBAA AABCEFF AABDEFF ABCDEEF EEEECAA AABCDFF AABDEFF ABCDEEE ACCBCEF EEEDCAA FFEDBAA FFECBAA AACDEEF ABBCDFF FFDCBAA FDBABCE AABDEFF FEEDCBA FECAACD ABCDEEF AACEFEE FFEDCAA FFEDCAA BBBCDFF AABDEFF ACFFECA FFECBAA AACDEEF AABDEFF AACDEFF FEBBBCC FFDDCBA BBBADFF ABCBDFF AABCEFF DEDDEDA
19,FDABCDD FFEDBAA FEDCBAB EDFEDBA FFFCBAA FFEDCAA FFDCBAA AABCDFF ABDEEEC FEEDCAA FFECBAA FFDCBAA BBBCDEF AACDEFF AABDEFF DEEEEBA FAABCEF AACDEEF AACDEFF ABBCDFF CDEFEBA FFECBAA FEBABCE AACDEFF ABDEFEB FFDCBAA FEDCBBA FEEDCAA BBBBDFF ABBCDFF ABDFEDC FEEDBAA FFECBBA FFECBBA FEEDBAA BBBBCEF FEDBBBA FFECBBA AABEFEF AABDEFF AABDEEF AABCDFF AABDEFF AABCEFF ABBCDFF AABCDFF
20,FFDCBBA AABCEFF ABDEEEE FFECBAA FFDCBBA FFDDBBA FFCBBBC ABBCDEF FEEDCAA FFECBAA BABCDFF AABCDFF EFEDCAA FFECBAA FEDCCBA FFDCBAA ABBCDFF ABDFFDA FBABCDE AABCDFF ABBCDEF AABCEFF EFEDCAA FFECBAA ABCDEEF AABDEFF FEDCBBB FFEDCBA FFEDBAA BAADFFE AAADFFE FFEDBAA FEDCCBA CBBBBEF AABDEFF EEEEDBA FFECBAA FABCDEE ABBDDEF EEEECAA EFEDBAA ABBCDFF AACDEFE EFDAACE DDCBACF ABBCDFF
21,FFEDBAA FFDABBC ADDCBDF BCFFCBA FEDECAA FFDCBAA ABBCDEF AABCEFF ABCCEFF FFEDBAA AABCDEF AABCDFF AABDEFF ABEFFDB FECCBBB AABCEFF AACDEEF EFEDBAA EEEECAA FFDCBAA FFECBAA FEDCBAA BBBDFFB FFECBAA FFDCBBA AABCEFF ABBBDFF ABCCCEF ABCEFEB FFEDBAA EBAACEF BBBBCFF AADEEEE FEDCCAA AABDEFF AABDEFF AACDEEF CDDEFCA FFECBAA FEEDCAA FDBABDE AABDEFF ABDEEDE AABCEFF EEEDCAA FEBBBBC
22,AACEEEE FFEDCAA FEDCBBB FFDDBAA FEDBCBA FFEDCBA FFECBAA FEEDCAA FFDBBBB AABCEFF AACDEFF BDFFEBA FFEDBAA FFECBAA AACDEFF AABDEFF AABCEFF ABCDEEF ABCDEFF ABBCDEF AABCEFF FFEDBAA FFECBAA ABBCDFF ABCDEFF FFECBAA FFDCBBA FEEDCAA FEEDCAA AABCEFF ABEFEDC FEEDCBA FFEDBAA FEEDBAA AABDEFF FFEDBAA FFDCAAC AACDEEF AABDEFF BBCEFFA FECCCBA AABCDFF AACDEEF ACEEDCE ABBCDFF ABBCDFF
23,DEEAADE ADCFFCB ACEDDDE AACCEFF AACDEEF ACDFECC FECBBBC EEEFCAA FECAACD AACDEFF ABCEFFD FFEDCAA FEBBBBC ABBDEFF FEECBBA CBBBCEF DEEEEBA BABCDFF AACDEFF BBBBCEF ABBCDEF AABDEFF FFECBAA FEEDBAA AACCEEF AABDEFF AEFECBC FDDBDAD BAADFEF FFEDCAA FEDCBBB ABBCDFF EFEDCBA FFEDBAA FECABDB FEDCBBA AABCDFF ABCDEFF AABCDFF AACDEFF ABBCEEF AABDDFF AABDEFF ABBDDEF ABBCDFF AABCEEF
24,CABCDEF AACDEEF ABBCDFF AABDEFF AABDEFF ACEEEDB FFDCBAA FEEDCAA FFDBBAB ABBCEFF ABCCEFE FFEDCAA FFEDBAA CBABCEF AABDEFF AABCDEF AABCEFF EEEDCAA ABCDEEF FFEDBAA FFDCBAB ABBCDFF AACDEFF FFEDBAA FDBAADF ABDEFED CCEFEBA FEDECAA FFEDCAA FFECBAB AABDEFF FEDDDBA FEEDCAA FFDCBBA FFDCBAA ABCEFED FFDCBAA AABEEEE FECBBBB AABCEFF AABDDEF AABCEFF AABDEFF ABBCDFF ABBCDFF BDFEECA
25,EEFEBAA FEEDBAA FFEDBAA DBAFFDC FEDCBBA FFECBBA EBABCEF AABCEFF AACDEEF FFEDCAA FEDDBAA FDABBCD AABCEFF ABCDEFF ABDFFEB FDBBBCC AABCDFF BABCDEF AACDEFF ABCCDEF FFEDBAA FFECBAA FDAABEF AABDDEF ABBCFFD FEDCBBA AABDEFF FEEDCBA FFEDCAA BBABDFF AABCEFF AABCEFF FEEDCAA FFECBAA CBBBBEF AABDEFF EFFDBAA FFDCAAB AABDEFF AACCEFF AABCDFF ABBCEFF ABCBCFF ABEECEF AABCEFF EEEEDAA
26,FFDCBAA FFDCBBA BABCEFF AABDEEF ABCCEEF EFDEBBA FFDBBCA FFEDCAA AABCDEF AABCEFF FFEDBAA FFDCBAB ABBCEFF AACDEEF ABCCCFF AABDEFF FFECBAB ABCDDEF ABCDEEF ABBCDEF ABBCDEF FFEDBAA FECCCBA BBBBCEF ABBCDEF FFECBAA BABDEEF FFEDBAA FFEDCAA FEDEDBA AABCEFF ACFEECA FFEDCAA FFEDCAA AABDFFE FFDCBAA AABCEFF ABCDEEF ABBCEEF ABCCEEF AABDEFF AABDDEF AABDEFF ABBCEEF AABCEFF ABCEEFC
27,FECBABC BBCBCEF AABCEEF ABBDDFF ABCEFEE EEEDDAA FFDCBAA FEEDCBA FFECBAA BBCBCEF AABDEFF FFEDCAA FFDBBBB AABCEFF AACDEFF AACCDEF CDEEECA AABDEFF ABDEEEE FFDCBAA BBBBCEF AABDEFE FEEDCAA FEDCCBA AABCDFF AABCEFF AACDEEE ABDDEEE BBCEFEA FFECBAA FFDCBAA AABCDFF ABDEEED FFEDCAA FFDCBAA ACFEECA FFDCCAA ABCEEEE BBFBEDC AACDFCE EFFCBAA AABCDFF AACDEFF ABBCDFF AABCEFF CCBBCCF
28,FEDBBBB FDBABDE ABBCDFF FEEDBBA DCAAFED FFDBBBB ABBCDEF AABCEFF AABDEFF FFDCBAA DBABCEF AABCEFF AACDEFF BDEFECA FFDCBAA AADECEF AABDEFF DEFEDBA FEDBBBA FFECBBA FFECBBA CACCEEE ECEEECA FFECBAA FFDCBBA AABCEFF ABBCDEF AADEFED EFEDCAA FFEDBAA CAABDEF ABBCDEF AABCDFF AABDEFF FFEDCAA CAABDFF AACDEFF AACDEFE FEDBCBA FFEDBAA ECAACDF AACCEFF AACEEEF ABCDEEF EEEECAA FCBBBDD
29,FFECBAA FFDCBAA FFDCBBA EABBCEF ABDDCDF EEEDCBA FFEDBAA FFEDCAA FFDCBAB AABDEFF AABDEFF ABDEEEE FFEDCAA FFDCBAA FFECBAA ABDEDEF AABCDFF AABDEFF ABCDEEF EFEDBAA BBBBCEF AABCDFF EFEDCBA FFECBAA BBBBDFF AABDEFF FFDCBAB AABCDFF EFEDCAA FFEDCAA FFDCBAA FEDBAAF ABDEEEE FFDCBBA FFDCCBA BABDEEF EFCDDCA FEEDBAA BBBCCEF ABEDCEE BAACEFF AABCEFF ABBDDEF AADDDEF AABCDFF ABDEFBB
30,ECAACEF FFEDBAA BBBCDEF AACDEEF ABCDEFF EEEECBA FFECBAA FFEDCAA AABCDFF AABDEFF FFDCBAA FFEDCAA FECBBBC AABDEFF AACDEFF ABBCDEF AABDEFF DEEEDBA FFCBBBB FFEDBAA CBBBCEF AABCDFF CFFDCBA FFEDCAA DBABCEF ADFFDBA FEDCBAB ABBCDFF FFECABA CCBBBEF FFDCBAA FEDDCAA FFCBBBB CCDEFDA CCBACFF FFEDCBA FFDCBAA ABDEEEE FFECBAA FEEDCBA AACEEEF ABBCDFF AACEEEF FFECBAA BBBBCEF ABBCDFF
31,AABDEFF AABCDFF ABCDEEF AABDEFF AABCDFF AACDEEF AABDEFF AACEFED FFEDBAA FFEDBAA FDBABCE AACDEEF ABBCDFF ABDEEED FFDBBBA FEDCCBA FEBBCBB FFDCBAB FFEDCAA FFDBBBB ABBCDEF AABCEFF ABDEEEF EEEEDBA FFDCBAA FFDCBBA BABCDFF AACDEFF FEEDCAA DCFFDBA FEDCBBA FEEDCAA FFEDCAA FFDDCBA FFECBAA AABCEFF AACDEEF ABCDEEF CEFEDAA FDDEEAA EEEDCBA EFFECAA FFEDBAA FFEDBAA FFDCBBA EEEECAA
32,FDDCCBA FEDBBBB AABCEFF AABDEFF AACDEEF EEFECBA FFEDBAA FFEBAAB ABBCEFF AACDEFF FFDCBBA FEEDCAA FEBABCE AACDEFF AACDEFF AACDEFF FFECAAB ABBCEFF ACEFFCA BCCEEFA ABBCDEF BEFECAA FFDBCBA AABCEFF ABDDEEE FFEDBAA FEBBBBD AABDEEF DEEEDBA FFEDBAA ADEDEDD EFECABB FEDDCBA FFECABA FEDCBAA AACDDEF BBBBCEF DEFEBAA DEDBCEA EEEEDAA EECCBBC AABDFEE BBEFFCA FEEDCAA AABCDFF FFFCBBA
33,FFDCBBA FFDCBBB ABDFEDC FFECBAA EEFECAA CBBBCEF ABBCDFF AABCEFF ACDFFDB FFDCBBA FCAABDF AABCDFF AABCEFF ABCDEEF BBBBCFF FFEBABB AABCDFF ABCDEEF CFFBABC AABCDFF FFEDBAA FEEDBAA ABCDEFF CEBABEF FFECBAA FECBBBC AABDEFF FEEDCBA ABBCDFF AABCEFF FFDCBAA FFECBAA FFECBAA AACEEEF AABDEFF FFECBBA AABDEFF ABBCDFF AACDDEF AACDEEF AABDEFF AABDEEF EBBBBEF AABDEFF FFEDCAA DDAACFE
34,ACEEEDC FFDCBAA FCCAACF AACDEFF AABCEEF ACEFEDA FFDCBAA FFEDCBA EDBABEF ABCCEFF AABCDFF FFEDBAA FFCBBBC ABCDEFF FDCCACD AABCDFF FFEDAAA AACDEFF ABCDEFF ABBCDEF ABBCDEF ACEFECA FFDCBAA FEBABCD ABBCDFF CDFFCBA FEDCBAA FEEECAA FEEDCAA BABBDFF AABCDEF FFEDBAA FFEDBAA FFDCBAA AABCEFF BAACDFF FFECBAA FECBBBB AABCEFF AABCEFF AABDEEF ABBCDFF AACDEFF ABBCDFF ABBCDFF AACDEFD
35,ABBBCFF ABCEEEE ABBCDFF AACDEFF CABCCFF EEEECAA FEDCBBA BBBBCEF ABCDDFF CADEEEB FFECBAA FFECBAA BBBBCEF AABDEFF AABDEFF AABCEFF FEEDCAA AABDEFF AACDEFF ABBCDEF ABBCDEF BDFFDBA FEDBABD ABCDEFE FFDCBBA FFDCBAA FDDDCBA FFECCBA ECAADEF AABCDFF FFEDBAA FEEDCAA FFEDCAA BBBBDEF AACEEEF AABDEFF CEEEDCA FFEDBAA FFDCBAA AABCEFF AABCEFF ABBCDFF AACDEFE ABCCDEF ABBCDEF AABDEFF
36,EFEDBAA FFECBAA FFDCBAA FFECBAA FFEDBAA FFEDBAA FFEDBAA FFEDCAA CBABCEF AABDEFF AACDEFE FFDCBBA FEEDCAA FFEDCAA FFDCBAA EFECABC AABCDFF AABDEFF ABCDEEF ABBCDEF ABBCDEF AABDEFF FEEDCAA FFECBBA AABCEFF AACDEEF DEFECAA FEEDCAA FFEDCAA FFEDCAA FEDCBAC AABCDFF AACDEEE DEEEDBA FFEDCAA AACEFED FFECBAA ABBCEFF ABBCEFF AADFFEC CFBBBCE CEFAACF ABDFFCB AABCDEF ABCBDFF ABBCDEF
37,AEDEECB AABCEFF CAACEFF BABBDFF DEFECAA AABDEFF DEFECAA FEEDCAA FFEDBAA EDBABDF ABBCEFF ABCCDFF AACEDEF ACECEED FECDDAA FCEBBCC CCCDEEA FEBBBBC ABCDEFF ABBCDEF ABBCDEF AABDEFF ABBCDFF AADEEED FFECBAA FFDCBAA FEBBBCC AACDEFF FFEDCAA EEEDCAA FEDCBBA EEFECAA FEEDBAA BABCDFE ABBCDFF AABCDFF AABDEEF ADECBDF AACEEEE ABCDEEF BCEFEDA DDDEEDA FFEDBAA FFEDBAA FFEBAAB CFDBDDA
38,EFEDCAA FFDCBAA FFDCBAA FFEDBAA FFEDBAA FEEDCAA FFEDCBA FEEDCAA AABCEFF AABDEFF DEFEDBA FFEDCAA FFEDBAA FECAACD AACDEEF ABBDEFF AABCEFF AABCEFF ABBDEFF ABBCDFF EEEECAA FFEDBAA FFDBBBA AABCEFF ABCDEEF ACEFEBA FEDCBBA FFEDCBA FFEDCAA FFEDCAA FFDCBAA AABCEFF AACDEEE FFEDCAA FFECBAA FECBBBD AACDEEE FEEECAA FDABCCE ABCDEFF ABBDEEF ABCDEFF ABBCDFF AABDEEF AABCEFF AABCDFF
39,BCFFDBA FFECBAA FFDCBAA FFECBAA FEEDBBA FFEDCAA FFECBAA FFEDBAA FECBBBC AABCEFF DEEEEBA FEDCCBA EDBABDF AACDEFF AACDEFF AABCEFF AABCEFF ABCDEEF AABDEFF BBCEFFA FFEDCAA FFDCBAB AABDEFF CDEFEBA FFDCBAA FEBBBBC ABCDEFF FEEDCBA AACDEFE DCBBBEF AACDEFF FEDDCBA FFEDCAA FEEDCAA ABEFEDC FFDCBAA ABBCDFF AACDEEF BCFDFCA AEBBDFD AABDEEF AABDEFF AABCEFF AACDEEF FCBDBCE AABCDFF
40,FFECBAA FFDCBBA ACFFECA FEECCAA FFECBAA FEEDCAA FEDCBAA BBBBDFF AABDEFF ACEEFDA FFECBAA DBABDEF AABCEFF ABCDEEF BBBBCFF FEEECAA AABCEFF ABCDEFF ABBCDEF ACCCEFB FFEDBAA FFECBAA DDDBEEA FFDBABB AABCEFF FFBBBBC AABDEFF FEEDCBA BABCDFF ABCCDFF ACFFECA FEEDBAA FFECBBA FFEDCBA AACCCEF AACDEFE FEEDCAA AACDEFF AACDEEF AABDDEF AABDEEF ABBDEFF ABBCDFF AABDEFF AABCEFF CCDEEEA
41,FFDCBAA FFECBAA FFDCCAA FEDCBAB CCCBBDF EEFDCAA AABDFED DCBBBDF AABCEFF AACDEFD FEDCBAA DBABDFF AABCEFF ABCDEEF AABDEFF FEBBBCC AABCDFF ABCDEEF AABDEEF CDEEEBA FFEDBAA FFDCBAA AABDEFF FEDBABE CDEFEBA FEDCBBB AABDEFF FEEDCBA BABCDFF ABBCDEF EFEDBAA FFEDCAA FEDCBBA BBBBCEF AACEEEE FEDCBAB BBBBDFF ABCDEEF AABCEEF AACDEEF AABDEEF AACDEEF AACDEFD AABCEFF AABCEFF FFECAAB
42,FFEDBAA FFECBAA FFDCBAA AABCDEF FEDDAAC EEEDCAA FEEDBAA FFEDCAA FECBABF AABDEFF AACDEFF EFEDCAA FFEDCAA FFDCBBA EAACDEE AABCEEF AABCEFF AACDEFF ABCDEFF ABBCDFF AABCEFF FFEDBAA FEDCBAA AABCDFF AACDEFF FFEDBAA FEDCBAA FFECBAA FFEDBAA FFEDBAA AABDEFF EEEEDBA FFDDCAA FFECAAB AABDEFF FFDDBAA FECBBBB ABCDEFF AABDEFF FFDBBBB FEDCBBA BABCDFF AACDEEF ABBCDFF BBBCDFF ABBCDEF
43,FFEDBAA FEDCBBA FEDCBBA FFDCBBA FFECBAA FEBCCCA BABBEEF AABCEFF AABDEFF FEECBAA FFECBAA AABCDFF AABDEFF ABCDEEE EEEECAA AABCEFF AABCDFF AACDEEF AACDEEF EEEECAA FFEDBAA FFDCBAA AABCEFF AACDFFD FFDCBAA DBABCEF AACDEFF FECBACF AACDEEF AACEFEC FFDCBAA FFECBAA FEDBAAD AACEFEE BABCDFF ACEFECA FECABBC AACDEFF AABDEFF FEDCCBA FFECBAA FDBABDF AABDEFF ABBCDFF AABCDFF CCDEFCA
44,FFEDCAA FECBBBB EDDFEBA FFECBAA FEEDBAA ABCBDEF AABDEFF AABCDFF AACDDFF EFFDBAA FFECBAA AABCEFF AABDEFF ABDDEEF EEEECAA AABCDEF AABCEFF AACEEFE AACDEEF FFDCBAA FFEDCAA FDABCCC ABBDEEF FFEDBAA FFDCBAA BABCDFF AACDEEE ABBCEFF ABCCEEF EEFECAA FEDCBBA FEDDCAA BBBCCDF AABCEFF BEFEDBA DEEECBA AACDEEF AABCDFF AABCEFF AACDEEF AABDDFF AABDEFF BBABDFF AABDEEF EEEECAA FDBBBCC
45,ABDDCDF EBBABEF AABDEFF AABDEFF AABDEFF ABCEEEE FFECBAA FEEDCAA FDBABCE AABCEFF BDEEECA FFEDCAA FFEDBAA BABCEFF AACDEFF AACDEEF AABCEFF AACDEEF EFFECBA FFDCBAA BBBCDEF AABCEFF EFEDBAA FFEDBAA AACDEFF FFDCBAA FBABBDF AABCDEF ADEEEDB BAADFFE FFDCBAA FFDCBBA FEECBAA FEEDCAA FFEDBAA ECBBADF AACDEFF ABCDDEF CEDFEBA BBBBCEF DDEEDBA DDEDECA FFECBBA FFEDBAA FECBBBC BCDFEDA
46,CDFFDBA FFECBAA FFDCBBA FFECBAA FFECBAA FEEDCAA FFEDBAA FFEDCAA AABCDFF AABDEFF DEEEDAA FFECBAA FEDDCAA FFDCAAB AACDEFF AACDEFF AABCEFF AABDEFF ABCDEEF AABDEEF ABBCDEF ABDFFEC FFECBBA CBBBCEF AACDEFF FFDCBAA FEDCBBA FEEDCBA FFEDCAA BBBBDFF ADFEECB FFEDBAA FEEDBBA FECBBBC ABEFEEC FFECBAA AABCEFF ABBDEFF AABCEFF ACDEEEC ABCEEEE ABCCEFF ABBCDFF AABCEFF AABCDFF AABCEEF
47,FECCCBA FEDDBAA FECBBBC AACDEEF AACDEEF DEFECBA FFDCBAA FFEDCAA FFECBAA BBABDFF AABCEFF AABDEFF EFEDCAA FFECBAA FFDCBAA ABCCDEF AABCDFF AACDEFF ABCDEEF BBBBCFF BBBCCEF AABCEFF FEDDCBA FFEDBAA ECBABDF AACDEEF FEDBBBB AABCEFF EEEECBA FFEDCAA FFDCBAA BBBBDFF EEEECAA FEEDCAA FFDCBAA BBBCCEF AABDEFF AACDEEF AAAEFEE EEEEDBA FFEDBAA AABCDFF AABDDFF AACDEEF AABCDFF ABBCDFF
48,BBBBCFF AEEEDCB FECBBBC AABCEEF ABBCDFF EEEEDBA FFDCBAA FEEDCBA FFEDBAA FFDCBAA AABCDFF AABCDFF DEFECBA FEDCCBA DAACDEF AABDEEF AABCEFF CDEEECA ABCDEEF FEEDCAA FEDBAAC AABCDFF ABDEEEE FFECBAB AACDEFE FFDCBAA FDBBBDD DCEFDCA FFEDBAA BBABDFF ABEFEDC EBBEFDA FEEDCAA FDCBCCB FFECBAA AABDEFF FFEDBAA FFECBAA FFDCBBA FDBABCD AABDEFF ABBCDFF AACDEEF DECAADF CBCBBDF AABCEFF
49,ABEEEED DDFECAA ABBCDFF AABDEEF AABCEFF DFFDCBA FFECBAA FEEDCAA FFDDBAA FEDCCBA AABCDFF AACDEFE FEBBCCB AABDEFF AACDEFF AABDEFF AABCEFF ABDDEEF FFEDBBA BBBBCEF AABCDFF FFECBAA FEDCBAB AABDEFF ABCEFEC FFDCBAA FEDCBAA FFEDCBA FFEDBAA AABCEFF FFEDCAA FEEDCAA FFEDCAA EDCBABF BEFEDCA FFDBBBB AABCEFF ABCDEEF DEFECBA EDBBDEB FEEDBAA FFEBABB FEDDBBA FFECBAA AABCDFF ABDEDBF
50,FDCCCCA FFECBAA FFDCBAA FFECBAA FFEDBAA FFEDBAA DCBBADF AACDDEF EEEDCBA FEDBABC FFEBABC ABBCDFF AABCEFF ABCDEFF AACDEEF EEEEDBA FCBBCCD ABBCDFF AACEFFD ABBCDFF CDEFDBA FEEDCAA BAACDFF ABCDEEE FFECBAA FEDCBBA AABCEFF FFEDCBA FEDCAAD AABDEFF FFECBAA FFEDBAA FEDDCAA CBABDEF ABCEEDE BFFEDBA FFCBABE AACDEFF BABFDDE FFEDBAA BAADDEF ABEEEEC FECBABC AACEEEF AABCEFF DEFFBAA
51,EFDBACB CBBBCEF AABDEFF AABDEFF AACDEFF ADFEECA FFEDCAA FFEDCAA FCBABDF AABCEFF AACEEEE FFEDBAA FFDCBBA FDBABDF AACDEFF ABCDEEF AABCEFF AACDEFF ABCDDEF ABBBDEF ABBCDEF ACFFDCB FEEDCAA FDCBACF AABDEFF AEEEDBA FECBBBC AABDEFF ABCDEEE FFEDCBA FFDCBBA DADFCEB ABBCDFF AADFEEC BFFECBA DEBABEF ABDDCDF AABEFED BDEFDBA FEEECAA FFCCBBA FFDBBBA FEEDDBA FFEDCAA BBBBCFF EEEECAA
52,ADFEDCC FFEDCAA FEDBBBB AABDDFF FEDEDAA CDEFEBA FFEDBAA FFEDCAA FECBABD AABCEFF AACDEFF CEFECBA FFEDCAA FEEDBAA FFECBAA FEDCBBA ABBCCEF AABDEFF AACDEFF EEEEDBA FFDCBAA ABBCDFF AACDEFF FFEDCAA FFDCBAA AABCEFF AABDEFF ABCEEEE FEEECAA FFEDBAA FFDCBAA CBBACEF AABDEFF AADEFED FFEDCAA FECAACD AACDEFF FEEDCAA FFECBAA FDBBBCC AABDEFF AABCDFF AACDEFF ABBCEFF ABCBCEF ABBCDFF
53,AECBCEF FFEDBAA FEBAACE FEEDDAA FEECBBA FEEDCAA FFDCBAA AABCDFF AACDEFF EEEECAA FFDCBAA ABDFFDC FFDCBAA AABCEFF AACDEFF AABCDFF AACDEFF FFEDBAA ABCDEEF FFEDCAA CBBBCEF AABCDFF FFECBAA FFEDCAA AABCDFF AACDEFF FEDCBAA EFEEDAA FFECBBA FFECBAA AABCDFF EFEDCBA FEEDCAA FFEDCAA FFDCBAA ABCFFDC AACCDEF ACEDCEE FFDCBBA AABEEEF ABBCEFF ABBCDFF AABCDEF BCABDEF AABCDFF BCDFFBA
54,ABEEEDD FDCBBBD ABBCCFF ABCDEFF AABDEEF EEEDCBA FFECBAA FFEDCAA FECBBBD AABCDFF AACDEFF FFEDBAA FFECBAA ABBCEFF AACDEFF AABCEFF AABCEFF ABCDEEF ABDCDFF ABBCDEF ABBCDEF EFEECBA CBABDEF EEEECAA FFDCBAA FEDCBBA AADEEFD BBBBCEF AEEEDDC FFEDCAA FFDCCAA FEDCBBA BCCCBEF ABCFEEC DCAACEF AABDEFF AACDEFF AABCDFF DDEEEBA FFDBBBB FFECCBA FFECBAA AACDEEF FFEBABC CBBBCEF ABCEDDF
55,FFECBAA FEDBBBB ABBCDFF AABDEFF AABDEFF AADDEFE FECBABD EEEDDBA FEEEBAA CBABCEF BBCEFEA FEECCAA ECABCEF ABCDEFF ABBCEFF AABCEFF FFEDBAA AACDEFF ABCDEEE BBBBDEF ABBCDEF ADFFEBA FFDCBBA FEBABCE ABCDDEF ACEFECB FFECBAA FEECCBA FEEDCAA FECAACE AABDEFF EFEDCAA FFEDBAA FFECBAA FECBBBB FEECBAB AABCEFF AACDEEF AACDEFF AABDEFF AABDEEF AACDDFF AABDEFF ABBCDEF AABCEFF AABCEFE
56,FECCBBB AABDEFF FFDCBAA AADEEEE FEBABDC FEEDCBA FFDCBAA EEEEDBA FFEDCAA FFDCBAA FFDCBAB AABCDEF BCEFFBA FEEDCAA AACDEFF ABCCDEF AABCEFF FFEDBAA ABCDEEF FFEDCAA FEDBABC AABCDFF ABEEEDD FEEDCAA AABDEEF AACEEFE FEDBBBB AACDEEF BDEFECA FFEDCAA AADEEED FEDCCBA FEDDCBA FFEDCAA FEEDCAA FFDCBAA ECAABEF ABEEEDC FFDCBBA BBBBDEF EFEDBBA FFDAABC CDFFEBA FFECBAA FFECBAA EFECAAD
57,FEDDCBA ACBCDEF AACDEFF ABBCDEF AACDEEE AABCEFF BBACEFF FEEDCBA FFEDCBA FFDCAAB AACDEFF AABDEFF ABCDDEF FEEECAA FEDDCAA FFECCBA FFEDCBA FFECBAA CEFECAA FEDDBAA BBBCCEF AABDEFF AABDEFF ABCFFDC CEEDEDA FFDCBAA FECBBBC ABEFEDC FEEDCAA FFECBAB EFEDBAA FEEDBAA FFEDBBA FEEDCBA FFDCBAA BABCDFF AABDEFF ABCDEEF AABCEFF ABCEEEE ABBCDFF ABBCDEF AABDEFF AACDEFF AABCEFF FFEDBAA
58,BCBACFF FFEDBAA FFDCBBA FEDDBAA FFECBBA FFEDCAA FFDCBAA AABCDFF AACDEFF FFEDBAA FFECBAA FEDCBAA ABBCDFF AACDEFF ABBCDEF AACDEFF FEEDCAA AACDEEF AABDEFF AABCEFF AACEFEC FFEDBAA FFDBABC AABDEFF BCFEECA FFDCBAA FEDCBBA FEEDCBA FFEDCAA CBBACEF ABBCDFF FEEDCAA FFEDCAA FFEDCBA FFDCBAA BBBBCEF ABEEEDE FECBBBB DEFEDAB ABCDDEF ABBCDFF ABBCEEF CABECDF FDECBCA ABBCDFF ABBCDFF
59,FEDCBBA FFECBAA FFDCBBA FFEDCAA FEEDBAA FEEDCAA FFDCBAA AABCDFF AACDEFF FFECBAA FFECBAA FEEDBAA AABCDEF AACDEFF AABDEFF ABDEFDB FFEBABB AACDEFF AABDEFF ABBCDFF AABDEFE FFECBAA FFECAAC AACDEFF CDEFEBA FFDCBAA FEDCBBA FEEDCBA FFEDBAA FEDCAAC AACDEFF DEEEDBA FFEDBAA FEEDCAA EDBAAEF AABEEEF FFECBAA FDBABDE AACDEEF AACEFDE CBBCCDF AABDEFF AABCDFF ABBCDEF AABCDFF AABCEFF
60,AEFEDCC EFFDBAA AACCDEF ABBCEEF ABCCEEF EFFCBBA FFCCCAB FFDDBAA FEDCBBA AABCDEF AABDEFE FEEDCBA FCBABDF AABCEFF AACDEFF AABCEFF EDBABEF ABCDEEF ABCDDFF ABBCDEF AABDEFE FFEDBAA ABDFECC AABCDEF AABCEFF FFDCBAA FFDCBAA FEDDCBA FFECBBA FCABCCE AABCEFF AACEFEE FFEDCAA FEECCBA FFDCBAA AABDEFF FFEDCAA FECBBBB ABBCEFF AABDEFF AACDEFF ABBCDFF AACDEEF BCCBBEF ABBCDFF AABCEFF
61,BBBBDFF AEEEECB AADDDEF FFEDBBA FFDCABB FEEDCAA FFEDCAA AABCEFF DEFECBA FFEDBAA FFEDBAA BBABDEF AACDEFF FFEDCBA FFDCBBA FFDCBBA FECCBBA FFEDBAA FEDCCBA FFDCBBA FFDCBAB ABBCDFF AABDEFF BEFECBA FFEDBAA FEDDDBA FEDCBAB AABDFEE FFEDCAA FFEDCBA FFDCBAA FEEDCAA FFEDBAA FEDEDBA FFDCBAA BBBBCEF ABBCDFF ADFEECA DEEEDBA AACFFED EEFCBAB EEEEDAA FEEDCAA FFEDBAA FFECBAA ABBCDEF
62,EFECBAA FEDBBBB AABDEFF AACDEEF AACEEDE FEEDCAA FFEDCAA FFEDCAA FFDBBBB AABCDEF AACDEFF FEEDBAA FEBAACF AACDEFF AACDEFF AABCEFF AABDEFF FDBBBCC ABCCEFF CBBBCEF ABBCDFF AACEFFE EBCEECA FFEDCBA FFECBAA FEDBBBB AABDEFF AABCDFF ABCDEEF EEDFDBA FFDCBAA FEBAACD AABCEFF AABDEFF FECCDBA CBDECAF CFFBBBB FFDCBBB FDDECAA FECCBBA FEEEBAA FFEDCBA FEDCBBA FEEDBAA BABCDFF ABCDEFC
63,EFEDCBA FFECBAA FEDBBBB CCEFDBA FFECCAA FEEDCAA FFDCBAA AABCEFF AACDEFF FFECBAA FFECBAA FDDCBBB ABBCDFF ABCDEEF AACDEFF AABDEFF EEEEDBA AACDEFF ABBCDFF ABBCDFF ABDFFDA FFECBBA FFDCBBA ABBCDEF ABCEEFD FFDCBAA FEDCBAA FEEDCAA FFEDBAA AABCEFF AACEEEE FEEDBAA FFDCBAA FFEDBAA CBBBBEF AACDEFE FFECBAA FDAABDE ABCCDEF ABCDEFF AABCDFF ABBCDFF AACDEEF ABCCDFF ABBCDFF ABBCDFF
64,AADFEEE FFDBCBA ABCCDEF AABCEFF AABDEFF ACEFEDB FFDCBAA FFEDCAA FFECBAA FEDBBAB AABDEFF FFECBAA CCBDCBF AACDEFF ABCDEEF AABDEFF AABCEFF ABCDEEF ABBCDFF ABBCDEF ABDFFDB FFEDBAA ECBABEF AABDEFF FFECBAA FFDCBBA BBBCDEF BBBEFEB FFEDBAA AABCDFF DFFDCAA FEEDCBA FEEDCAA EEEDCAA FCACDDC DBAACFF AABDEFF ABCCDFF ABCDDEF FFBCCBA EFFBBAC CDBABEF FFECAAB FFEDCAA BBBCDFF BCDADFD
65,AADEEEE FFECBAA AABCDFF AABCDFF AACDEFF FEEDCBA FFECBAA FEEDCAA FECBABD AABDEFF AABDEFF FFEDBAA FEEDCAA FFECBAA FFDCBAA FFDCBAA ABBCDFF AABDEFF ABDEEEE FEEDCAA FFEDBAA BBBBDEF AABDEFF FFEDCAA FECCCBA AABCEFF AACDEEF AABCDFF AABDEFF EEEECBA FFDCBAA FFDCBBA BBBBDFF CEFFDBA FEDCBBA BABDFFE FFEDBAA FFDCBAA EEFEBAA CABDFFB FEDCCAA FCBBBCC FEEECAA FFECBAA EEEECAA ABBCDFF
66,FEDCBBA FFECBAA BBBBCEF AACDDFF AACDEFF BEDCEDA FDABDCC FFECBBA FFEDBAA BABCEFF ABBCEFF EFEDCAA FFEDCAA FECBBBB EEFCBBA CEDBABF AABCEFF FFCBBBC ABCDEEF ABBCDEF ABBCDEF FFECBAA DBACEFD BBABDFF AABDDEF ACFFEBA FEDDCAA FFDDCAA FFECBAB ABCDEEF AABCEFF FEECBAA FFEDCBA FECBABF ABCEFED FFECBAA AABDEFF AACDEEF ABBCDFF AACCEEF AABCEFF AABCEFF AACCEEF AABCDFF AABCDFF AABCEFF
67,EFEDCAA BBBBDFF AACDEFE FFEDBAA FFDCBBA FFEDCAA FFDCBAA FFEDCBA FFEDBAA FFDCBAA FDBAADF AABCDFF AACDEFE FFDCBBA FECBABC AABDEFF AABDEFF ABEEEEB BABCEFF FFECAAC AABDEFE FFDCBBB AABCEFF ADFEDCA FFDCBAA FEDCBBA FFEDCBA CCBBBDF AABDEEF AACDEFF FFEDCAA FFDCBAA FFDBBBB DDCCBBF ADFFECA FFEDCBA FFDCBBA FFEDBAA FEEEBAA DFDBCBC AACEEFE AABDEFF AACDFEE BFBCCDE BBBCCEF ACCCDEF
68,ABDEEEE FEEDCAA DCBBBDF AABDEFF AABCEFF EFFDCBA FFECBAA FEEDCAA FFECBAA FEDCCAA ABBCDFF ABCEFED FCBCDCA AACDEFF AACDEFF AABDEFF AABCEFF ABDDEEF FFECBBA BBBCDEF ABCEFEC FFEDCAA FDBABDF AABDEFF DFEECBA FFDCBAA FFDCBBA FFEDCAA FFECBAA AABCEFF AFFEDBA FEEDCAA FFEDBAA FEEDCBA ABCDEFE FFECBAA AABCEFF AACDEEF ABCEFEC FCCCACE FEDDCBA EEBABEF ACEEDFA EEEDDDA ABBCDFF AACEFEE
69,FFECBAA FFDCBAA FEDCBAB ADFFDBB FEDDCAA FEEDCAA FFEDCAA FFEDCAA FEDBABC ABBCEFF AABDEFF FFEDBAA FEEDCAA FEEDBAA AACDEFF AACDEEF AABCEFF AACDEFF AABDEFF AABCDFF AACEFFD FFEDCAA FFECBBA BBBBCEF AACDDFF ABCEFEC FEDCBBA DFFDDBA FEEDCAA FFEDCAA FEDCBAA BBBCDFF ADDDDEE FEEDCAA FFDCBBA AACDEFE CACCBEF BBBBDEF EBBECBD CACCEEF ADDECEB BABCCFF ABCDEEF AABDEEF ABCEFEB BCEFABE
