,0
0,DDCCBA ABDCDB BBCDDA BAADDC DDCCBA DDDBCA DDCBBA DDCCBA AAABCD AABBDD AABBCD BCDDDA AABABD AABBCD AABBCD AABBCD AABCCD AABBBD AABBCD AABBCD AABBCD AABDDB DDCCBA DDCCBA DDCCBA DDCAAB DDCBBA DDCCCA DDDCCA DDCBAB AABBDD AABCBD AABBCD AABBCD AABBCD CCBAAD DDDDAB DDDCCA DDCCAA DDCCBA DDCCBA DDCCBA DDCCBA DDCCBA DDCBBA AAAABD AABCCD AABCDD AABDDC AABCDD AABBCD DDBAAC AABBDC AABBCD AABBCD AABCCD AAABCD DDCCBA DDCBBA DDCBBA DDCBBA AABBCD AABBBD AABBCD AACDDB DDCCBA AAABCD ACDDAA AABBCD AACDDC AABBCD ABBABD ABBBAD AAABCD AABCCD DDCCBA DDCCBA DDDCCA DCCDCA DDCBAA DDDCBA DDDDBA DDCCBA DDCCBA DDDBAA
1,CCCDDA AABBDD DDCCBA BAAABD AABBCD AABCCD DDDCBA DDCCBA DDDCCA DDCBBA DDDCAA DBAAAD ABBACD AABCCD AABBCD AABBDD DBAAAD AABBCD AAABCD CDDCCA DDBAAC AAABCD AABBCD DDCBBA AAABBD ABCDDA CCCDDA DDCBBA DDCCAA DDCCBA ABCDDB DDCBBA DDCCBA AAAABD DDCCCA DDCCBA DDCBBA DDCBBA AAABDD AAABCD AAAADD AABBCD AABBCD AABCDC DDCCBA DDCCBA AABADD AABBCD AABCCD AABCBD AAABCD DDCBBA AAABBD AAABDD DDCCBA DDCCBA DDCCBA DDDCBA DDCBAA DDCBBA ABCACD AAABDD AABBCD AABBCD AABBCD AABCDC DDCCBA DDCCBA AAABDD AABBCD AABCDC BAAACD AABBCD BCDDCA DDCCBA DDCCBA DDCBBA DDCBAA AAABCD AABBCD DDCCBA DDCBBA DCCAAD AABBCD DBAACC
2,AABBDD AABACD AABBCD AABBDD AABBDD DDDCBA DDCCBA DDDCBA DDCBAA DDCBBA DDCCBA DDCCBA DDCCBA DDDCAA DDCBBA DDCBBA DDCCBA DDDCBA DDCCBA DDCBAB DDCCAA DDCBAB AABBBD AABBCD AABBCD AABBCD AABBCD DCBAAD AAABCD AABBCD AABACD AABBCD AABDCD BCDDBA DCBCDA BAABCD AABBBD AABBCD AABCDD AABBBD DCCADA BCCAAD ABDDCB DDCBAB CAABAD CCCCDA CDDCDA DDCCAA DDCBAA DDDBBA DDCCDA DDDCBA DDCCBA DDCCBA AABCDC AABBCD AABBCD AABBCD BCDDBA AABBBD DDDCCA DDCDAA DDDCAA DDCCBA DDCBAA ABCDDB DDCBBA DDCCCA DDCAAB AABBCD DDCBDA DDCCAB DDCADA DDCBAB AABBBD AABBCD AABBCD AABBCD AABBCD AABCCD AAABCD AABCCD AABBCD BDDABA DDCCCA
3,CDDCCA DCBDAD DDCCAB DDCACB DDDCDA AAAABD AABBCD AABBCD DDCBAA DDCBDA DDDBBA DDCCBA DCBADA AABDDC DDDCAA DDCCBA DDDCBA DDCCCA DDCBAA AAABCD AABCCD AABBCD AAABCD AABCCD AABCCD DDDCBA DDCBAA DDDCBA DDCBCA DDCCBA DDDCBA DDCCCA AABBCD AAABCD AABCDD AABACD AAABDD BCDBDA DDCCAA AABCCD AAACBD ACDCBB BBAABD AABCCD BCDDCA DDCCCA CAAABD AAABCD AABBDD AAACDD AABBBD AAAACD AABBDD DDCBBA DDCBAA DDCCBA DDCABA AABBBD AABBCD AABBCD ABCBAD ABBABD AABCDD DDCCBA DDCCBA DDCCAA DDCCAA AABBCD ABBABD CBABDB CDDBAB DDCCAA DDCCBA AABBCD AAABCD AABCCD AABBCD DDCCBA DDDCCA DDCBCA DDCCBA DDDCCA CBAABD AABBDD AABBCD
4,AABCBD AABCCD CBAAAD ABBADD AABADD ABDDBB DDCBBA DBABAD AABBCD AABBCD AABBCD AABBCD AABBCD AABBCD AABCDD DDCCBA DDCCBA DDCCBA DDCCBA DDCCBA DDCCBA DDCBBA ABBADD DDDCBA AAACCD AABCCD AABCCD DCAABC DDCAAB BCDDDA DCBDBA AAABCD AABCBD AAABCD DDDCAA AABBDD AABBBD DDDCAA AABBCD AAACBD AABCDD DDCCBA DDCCBA DDCCCA DDCBAB DCBDAB AABBDD AABCCD AABCCD ABCDDB DDCAAC AAABCD AABCCD AABCCD AABBCD AABCCD AABCDD DDCCBA DDCCBA DDCBCA DDCCBA BAAABD CDDDCA DDCCBA DDCCBA ACDDCA DDCCBA DDCCBA AABBCD AABBCD AABBCD AABBCD AABCDD DDCCBA DDCCCA CAACDB DDCBBA DDCAAD CDDDCA CCCDDA DDDDCA DDCCBA BAABBD DDDCBA DDDBBA
5,ABDDBC AAAADC DDDBAA CDDDCA CDDCBA DDCBAB AABBCD AABBBD AABBCD CDDCBA AABBCD DDDBAA AABBCD DDCCAA CCDDDA DDCBBA DCAAAD DDDCBA DDCCBA DDDCBA DDCBDA AAABBD AABBCD AABBCD AABBCD AABBCD AABBCD CDDDCA DDCCBA DBAADD DDCCBA DDDCBA DDCBAB ACDDDA DDDCCA DDCCCA DDCCBA AAABCD AABBCD DDCBCA DDCCBA DDBACA DDCCBA CBBAAD BDDDBA DDDCBA DDCCBA DDCCBA AABBDD AABBCD AABBCD AABBCD AABBCD AABBCD AABBCD AABBCD AABBCD CDDCCA DDDCBA DDCCBA DDCCBA DDCCBA DDCDBA DDCCAA DDCCAA DDCCBA DDCCAA AABBCD AABBCD AABBCD AABCDC AAABCD AABBCD CCCAAD AABACD DDDCBA DDCCBA AAABCD AABCCD AABCDD AABCDB DDCBAA CCCBDA DCCCDA ABBBBD
6,AABCDC AABCCD AAACDD DDDCCA DDCCBA DDCCBA DDCCBA DDCBBA DBAAAD AABBCD AABBCD AABBCD AABBCD AABBCD AACDDC DDCCCA DDCCBA AABCDC DDCCBA DDCCBA DDCCBA DDCCBA DDCBBA BBAACD AABBCD AABBCD AABBCD AABCCD BCDDCA DDCCBA DDCBAA DDCBBA DDCDBA DDCCBA DDDBAA AABBCD AABCCD DCCAAD AABBDD CCCDAA AAAACD AABBCD AABBCD AABCDD DDCCBA DDCBAA AABDBD DDCCCA DDCCBA DDCCBA DDCCBA DDDCCA CCDDCA AAABBD DDCBAA AABBCD ABCBBD AABCCD AABCCD AABBCD AABBCD AABBCD AABBCD CCDDCA DDCCBA DDCCBA DDCCBA DDCBBA DDCCBA DCBAAC AABBCD AABBCD AABBCD AABBCD AABBCD AABBCD ABCDDB DDDCCA DDCCBA DDCCBA DBAAAD AABCCD AABCDD ACDDCA DDCCCA
7,DDCCBA DDCCBA DDCCBA AABBCD AABBCD AABBCD AABCDD DCBAAD AABBCD BCDDBA AABBCD AAABCD AABDDB DDCCBA DDCCBA DCBBAC AABCCD DDDCAA AABCBD BCDDCA DDCAAB AABBCD ABCDAD AABCBD AABCDC DDCCBA DDCCBA DDCCBA BCDDDA DDCCBA DDCCBA DDCBAB AABBCD AABBBD BBBBAD AABCDD AABCDC DDCBAB AABBCD AABBCD BBBAAD AABCBD AABBCD DDDCBA DDCCBA DDBABB DDCCBA DDCBAB ACDDDA DDCCBA DDDDCA DDCCBA BBBAAD AABCBD AABBCD AAABBD AABBCD AAABCD AABBCD DDCCBA DDCABA DDCBCA ABCDDA DDCCCA CBAAAD BDDDCA DDCBAB DDCAAB BDDDCA DDCCAA AAABCD AABBCD AABCDD DDCBCA DDDCAA DDCCCA DDCCBA BAAADD DDDBAA DDCCBA DDCCBA DDCBBA DCBAAC AABBCD AABBCD
8,AABBCD AABBCD AABBCD ABCDCC DDDBAA AACDDB DDCBAA DDDCBA DDCCBA DDCCBA DDCCBA DDCCBA DDCCBA DDCCBA DDCBAA AABBBD AABBCD ACDDDA CBAAAD AABBCD ABCDDA DDCCBA DDCCBA DDCCBA DDCCBA DDCCBA DDCBBA DCBAAC AABBCD AABBBD AABBCD AABBCD AABBCD AABBCD AABBCD AABBCD DDCCBA DDCCBA AAABCD AABBCD AABBCD AABBCD AABBBD AABBDD DDCCBA DDCCBA DDCBAB CDDDCA DDCCBA DDCCBA DDCCBA DDCBAA AABBCD AABBCD ABCDDA DDCCBA DDDCBA DDCCBA DDCCBA DDCCBA DDCCBA DDCCBA DDCBAA AABBBD AABBCD AABBCD AABBCD AABBCD AABBCD AABBCD DDCBBA AAAABD DDCCBA DDCCAA DDCCAA BDDDAB AAABCD AABCCD AABBCD AABCDD AAABBD ABCDBB DDCBCA DDDCBA DDCCBA
9,DDCCBA DDCBBA DDCCAA CAABDC AAABCD AABBCD AABBCD AABBCD DDCCBA DDCCBA DDDCCA DDCCCA CBAACD AABCCD AABBCD AABBCD AABBCD AAABCD AABBCD DDDCCA DDCBCA DDCCBA DDCCBA DDCCBA DDCCBA DDCCBA AABCBD AABCDD AABBCD ABBABD AABBCD AABBCD AABBCD CDDCCA DDCCBA DDCCBA DDCCBA DDCCAA AABBCD AABBCD AABCBD ABCDDA DDCBAA AABCCD AABBCD AABCDD DDCCBA DDCCBA DDCCCA DDCCBA DDCCBA AABBBD AAABBD AABBCD AABBCD AABBCD AACDDB DDCBAA AABCCD AABCCD AABBCD ACDDCA DDCCBA DDDCBA DDCBAA AABBCD DDDCBA DDCCBA DDCBAA DDCCAA DDCCBA DDCCBA BAABBD AABBCD AABBCD AABBCD AABBBD AABBCD AABBCD CDDDCA DDCCCA DDCCBA DDDCBA DDCCBA CAAABD
10,DDDCBA DDDCBA DDCCBA DDCCBA DDCBBA AABCCD ACDDDA CAAADD AABCCD BCDDDA DDBAAB AABCDC AABCCD AACDAD AAAADC AAABDD DDCCBA DDCBBA CAAABD ABCACD AAABDD AAABBD AAABCD CDDDCA DDCCBA DDCCAA DDCBAA AABBCD AABCDD ABBABD AABCCD AABCCD DDCBBA DDCCBA DDDCBA DDCAAC AABBCD AAABCD AAABCD DDDCBA DDCCCA DDDCBA DDCCBA AABBCD AABBCD AABBCD AABCCD AABBCD DDCCCA DDCBCA DDCACA DDCCAA DDCCBA AABBCD AABBCD AABBCD AABBCD DDCCBA DDCCAA DDCBBA DCBADB DDCCBA DDCCBA CCDDBA AABBBD AABCCD AABDDC DDCCBA CDDCBA DBADDA DDCCBA DDDCBA BAAADD AABDDB DDDCCA BCDDCA DDCCAA DDCCBA DDDCCA DDCBAC AABCCD AABBCD AABBCD AABBCD AABCDD
11,AAABCD AAABBD AABCCD DDDDCA DDCCBA DDCCBA DDDCCA DDCCBA DDCCBA DDCCBA DDCCBA DDCCBA DDCCBA AABDAD AAACDD BAADAD AAABCD CDDCAA AAACDD AABBCD AABBCD AABBBD DDCBCA DDCCBA DCBAAD AABBCD AABBCD AABBCD AABBCD AABBCD AABBCD CDDCDA DDCCCA DDCCAA AABBCD AABBCD AABCCD AABDBD DDCCBA DDCCBA DDCCBA DDCCBA DDCCBA DDCCBA BAAABD AAABCD AABBCD AABBCD AABCCD DDDCCA DDCCBA DDCCBA DDCCBA DDCCBA DDCCBA DDCCBA DDCBBA DDCCBA DDCCBA DDCBAB AAABDD AABBCD AABBBD AABBCD AABBCD AABCDD DDDCBA DDCCBA DDCCAA DDCCBA DDCCBA DDCCBA DDCBCA DBAAAD AABBBD AABBCD AABBCD AABBCD AABBBD AABBCD AAABCD AABCDD DDCCCA DDCBAA DDDCBA
12,CCCBDA DDDCAA BBAABD DDCCAA DDDCCA AAABCD CDDCBA DDCCBA BAAACD DDCCCA DDCCBA CBAAAD AABBCD CDDDBA BDDDCA DDCAAC DCCDCA DDCCBA DDCCBA DDCBBA DDCCBA AABBAD AAABCD AABCCD AABCDD DDCCBA DDDCBA DDCCBA DDBAAB ABBBAD AABBBD AAABCD AABBCD DDDCAA AABBDD BCCDDA AABCDD BCDDDA DDCCBA DDCCBA AABCBD AAABBD BCDDBA AABCDD ABBBAD DDDDCA AAABCD AABBDD BBAABD AABBCD AABDDC DDCCBA DDCCCA DDCBAA DDDCBA DDCBBA DDCCBA DCBAAC AABCCD AABCDD AAABBD AACDBD AAABCD DDCBBA AABBCD AABBCD CDDBAC AABBBD AABBCD DDDCAA DDCCCA DDDCBA DDCCBA AABBCD DDCCAA DDCBAA DDDCBA DDCCBA DDCBCA BAAABD AABBCD AABBCD CAAABD AABBDD AABBCD
13,DDCBAB DDDDBA AAABDD DDCBBA AAABCD ABDDDA DDCCBA DDCCBA DDCCBA DDCCBA AAABCD AABBCD AABBCD AABBCD AABCDD AABBCD AABBCD DDDCBA DDCBAA DDCCBA BAAABD BCDDDA DDCCBA DDCBBA DDCCBA DDCBBA AABBCD AABBCD AABBCD AABDDC DDCCBA DDCCCA DDCBAA DDCCBA DDCCBA DDCBBA CDDDCA DDCCBA AABBCD AABBCD AABBCD AABBCD AABBCD AABBCD CDDDDA DDCCBA DDCCBA DDCCBA DDCCBA DCBAAD AABDDC AABBBD AABBCD ABCCAD AABBCD AABCDC DDCCBA DDCCBA DDBADB AAABCD AABBCD AABBDD AABBCD ACDDCA CBAABD AABBCD AAABBD AABBCD DDCCBA DDCCBA DDCCBA DDCCCA DDCCBA DDCCBA DDDCBA AAABBD AABBCD AABBCD AABBCD AABBCD ABCDDA DDCBAA AABBCD DDDCAA DDDCAA
14,AABBCD AABBCD AABCCD AABCCD AABCBD AABBCD AABBCD AABBCD AABBCD AABBCD AABBCD AABCCD AABBCD DDDDCA DCBAAD AABBCD AABBCD DDDCBA DDCBAA CCDDDA DDCCBA DDCCBA DDCBBA DDCCBA DDCCBA DDCCBA DDCCBA DDCCBA AABBCD AABBCD AABBCD AABBCD AABCDD DDDCBA DDCCBA DDCCBA DDCBBA DDCCBA DDCCBA DDCCBA DDCCBA DDCBBA DDCBAA DDCBBA DCBAAB AABBCD AABBCD AABBCD AABBCD AABCCD AABBCD BBBAAD AABBCD AAABCD AABBCD AABCCD AABBCD AABBCD DDCCCA DDCBAA AABBCD AABBCD AABBCD AABBCD CDDDDA DDCCBA DDCCBA DDCCBA DDCCBA DDDCBA DDCCCA DDCCCA DDCCBA DDCCBA DDCCAA DDDCBA DDCCCA DDCCBA DDCCBA AABBDC DDCDCA DDCCBA DDDCBA DDCBBA DDCBBA
15,AABCCD DDDCCA AABCDD DDCCBA DDCCBA DDCCBA DDCCBA AAABCD AABBCD AABBCD AABBCD AABBCD AABCDD DDCCBA DDCCBA DDCCBA DDCCBA DDCCBA DDCBAB AABBCD AABBCD AABCCD CBBAAD AABBCD DDCBAA DDCACA BAAAAD AABBCD AABBCD BCDDDA DDCCBA DBAABC DDCCCA DDCBBA DDCBAA ABCDDA DDCCCA DDCCBA DDCCBA DDCCBA AABBBD AABBCD AABAAD AABCCD AABBCD CDDDBA BAABBD AABCDD DDDCBA DDCCBA DDCCBA DDCCBA DDCCBA DDCCBA AABBCD AABBCD AABBCD AABBCD ABCDDA AAABCD AABBCD CDDCCA DDCCBA DDCCBA DDCCBA AAABCD AABBCD AABBCD AABBCD AABBCD AABBDD BAAABD CDDDDA DDCCBA AAABCD CDDDCA DDCCBA DDCCBA DDCCBA DDCCBA DDCCBA AABBCD AABCCD AABCCD AABBCD
16,AAACCD AABBCD AABCDC DDDDCA AAABCD DDDCBA DDDCCA DDCCBA DDCCBA CBBCDA DDCCBA DDCCDA BAAACD AAAABD AABBCD CDDCDA AABCCD AABCCD AAACDB DDCCBA DDCCBA DDCCBA DDCCBA DCBAAD AABBCD AABBCD AABBCD AABBCD AABBCD AABBCD AABBCD AABCDC DDCCCA DDCCBA DDDCBA DCBAAD AABBCD AABBCD AABBCD AABBCD AAABBD DDCCCA DDCCBA DDCCBA BAAABD BDDDCA DDCCBA DDCCBA DDCCBA DDCCBA DDCCBA DDCCBA DDCCBA DDCBAB AABBCD AABBCD AABBCD AABCCD BCDDDA DDCCBA CAAACD DDCCBA DDCBBA DDCCBA DDCCBA DDCCBA DDBBAA DDDCDA AABBCD AABBCD AABBCD AABCCD AABBDD BBAABD AABBCD AACCDB AABBCD AABBCD AABBCD AABCCD DDCCBA AAABCD AABBCD DDCCBA DDCCBA
17,BBBAAD ABCDDA DDDCBA DDCBAA AABBCD AABBCD AABCCD DDCCBA DDCCBA DDCCBA DDCCBA DDCCBA DDCCBA DDCBBA AAABCD AABBCD AABBCD AABBCD AABBCD AAABCD AABBDD DDCCBA DDCBAA ABDCCC DDCCBA DDCCBA DDCCBA DCBBCA AACDDB DDCCAA DDCABB AAABBD AABBCD AABBCD AABBCD AABBCD AABBCD CDDCCA AACDCC DDCBBA DDCCBA DDCCBA DDCCBA DDDCAA AABBCD AAABCD AABCDD DDCCBA DDCCBA DDCCBA DDCCBA DDCCBA DDCCBA DCAAAC AABBBD AABBCD AABBCD AABCDD DDBAAB AABBBD AABBBD DDCCBA DDCCBA DDDCBA DDCCBA DDCCBA DDCCBA DCBBAC AABBCD AABBCD AABBCD AABBCD AABBCD AABBCD BAAABD AABBCD BCDDCA DDCCBA DDCBBA AAAABD AABBCD AABBCD CDDDCA CAABBD DDDCCA
18,AAABDD BBBAAD AABCDD DDCCBA DDCCBA CBAAAD AABBCD AABBCD DDCCBA DDCCAA DDCCBA DDCCBA DDCCBA DDCBBA AAAABD AABBCD AABBCD AABBCD AABCDC DDCCBA DDBAAC DDCCBA DDCCBA DDCCBA DDCAAC AABBCD AABBCD AABBBD AABBDD AAAADD DCBAAC AABBAD AAABCD AABBCD ABCCCC AABBCD AABCCD AABBDD DDCAAC AABBCD CDDDCA DDCCBA DDCBAB ABCDDB DDCCBA AABABD BCDDCA DDDCBA DDCBBA DDCBAA AAABBD AABBCD BCDDCA DDCCBA DDCCBA DDCCBA DDCBBA AAABBD AABBBD AABBCD AAABCD AABBCD AAABCD AABCDC DDCCBA DDCCBA DDCCBA DDCCBA DBAAAD AABBCD AABBCD AABBCD AABBCD AAABBD AABBCD CDDDCA DDCCBA DDCCBA DDCCBA AABBCD AABBCD AABCCD DDCCBA AAABCD DDDAAA
19,DDCCBA DCBCAA DDCCBA AABBCD AABCBD AABCBD AABCDC AABCBD BAABCD AABBBD DDDCBA DDCCBA DDCBBA DDCCBA DDCCCA AABCCD ABCABD AABCCD ABBABD AAABCD DDDCBA DDCCBA DDCBBA DDCCCA DDDCCA DDCCBA AABBCD CBBAAD AABCCD AABBCD CDDCAA DDDCAA DDDCBA DDDBBA CBAABD DCBAAC AABBCD ABBABD AABCCD AAABCD AABCDC DDCBBA DCCDCA DDCCBA BBBDDA BDDCAB DDCACA AABCDC AABBCD AABACD ABCDDB DDCBAA ACCCAD DDCCBA BCDDDA DDDCBA DDCCCA CBAAAD AABBCD AABBCD BCDDCA DDCBAA DDCCBA DDCBAA DCBAAC BCDDDA DDCCBA DDCBDA DCACAC ABCDDA DDDCAA AAABCD BAAABD AABBCD AABBCD AABBCD AAABBD AABCCD AABBCD DDCCBA DDBAAB AABDBD BDDDBA DDCBBA DDCBBA
20,DDCAAC DDCACA DDCCBA DDDCBA DDCBBA DDCCBA DDCCBA DDCBBA AAACAD AABBCD AABBCD AABBDD AABCDD AABBCD AABCDD DBAABD AABBCD AABBDD AABBCD AABCDD DDCCBA DDCCBA DDDCBA DDCCBA DDBAAB AABBCD DDCCBA DDDCBA DDCCBA DDCCBA DDCCBA DDCBCA DDCBAA AABBCD AABBCD AABCCD AABBCD AABBCD AABBCD AABBCD AABBCD DDCCBA DCBCCA AABCDC CDDDBA AABBCD AABCCD DDCBBA DDCCBA DDCCBA DDCCBA DDCCBA DDCCBA AABBCD AABBCD AABBCD AABBCD DDCCBA DDCBAA DDCBAA DDDBAA DDDCCA DDCCBA BAACDC DDCBBA DCCDAA AABCCD AABCDD AABBCD AABBCD AABBCD AABCCD AABBCD ABCDDA DDCCBA DDCCBA DDCBAB AABBCD AABCCD AABCBD DDDCBA DDCBBA DDCDDA DDCCBA DDCBBA
21,DDDCBA AAABDD DDCCBA AABBCD AABBCD AABCCD AAABCD AABBCD AABBCD AABBCD DDCBBA CDDDBA DDCBAA BBAABD AABBCD AABBCD AABCDC DDCCBA AABABD CDDDCA AAABCD AABBCD BCDDDA DDCCBA DDCCBA AABBDD DDCCBA DDCCCA DDCBAA AAABCD AABCCD AABBBD CDDCBA DDCCBA DDCCBA DDCCBA DDCBBA DCBBAD AABBCD AABBCD BCDDCA AABBCD ACDDDA DDCCBA DDCCBA DDCCBA DDCCBA AAABBD AABBCD AABBCD AABBCD AABBCD DCBAAD AABBCD AACDDB DDCBAA DDCCBA DDCCBA AAABBD AABBCD AABBCD AABBCD AAABCD DDCCBA AABBCD CDDDAB BCDDCA DDCCBA DDCBAB AABBCD CDDDCA DCCDDA DDCCBA DDCCBA DDCBBA BAABDB DDCCDA AABDAD DDDCBA DDCCBA DDCCBA DDCBBA AACDCC AABBCD AABBCD
22,AABBCD AABCCD AABCCD CCDDCA DDCCBA DDCCBA DDCCBA DDCCBA DDBBBA DDDDCA DDCCCA DDDCBA DDCBAA DDCCBA DDCCBA DDCBBA DDCCAA AABBCD AABBCD AABBCD AAABCD DDDAAB DDCBBA DDCCBA DDCCBA AAABCD AABBCD AABBCD AABBCD AABBCD AABCCD ABCDDA DDCCBA AAABBD AABBCD AABBCD AABBCD AABCCD DDDCBA AABBCD AABCDD DDCCBA CAAADD DDCCBA DDCCCA DDCBBA AAABCD AABBCD DDDCBA DDCCBA DDCCBA DDCCBA DDCCBA DDCBBA CBAAAD AABBCD AABBCD AABBDD DDCCBA DDCCBA DDCCBA DDCCBA DDCCBA DDCCBA AABBBD AABBCD AABBCD AABBCD DDCCBA DDCCBA DDCABA AABBBD AABBCD AAABBD AABBCD AABBCD AABBCD AABBCD AAABDD AABCCD AABBCD AABBCD AABBDD DDCCBA DDCCBA
23,AAAABD AABBDD DDDCBA AAAABD AABCCD CCCDDA BCCDAA DDCBBA BBBCDA DDCCBA DDCCCA DDCCBA DCBAAC AABBCD AABCCD AABBCD AABBCD BCDDDA DDCCBA DDCCBA DDCCBA DDCCBA DCBAAD AABBCD AABBCD AABBCD AABBCD AABBCD BBCDAB AABBCD AABBCD DDDCBA DDCCBA AAABCD AABBCD AABBCD AAABCD AABCDC DCBAAC AABBCD CCDDCA DDDCBA DDCCBA DDCCBA AAABCD ABDDDA DDCCBA DDDCBA DDCCBA DDCCBA DDCCBA AAABBD AABBCD AABBDD AABBCD DDCCBA DDCCBA DDCBAA DDDCBA DDCCBA DDCCBA DDCCBA DDCBAA AABBBD AABBCD AABBCD AABCDD AABBCD AACDDC AAABDD DDCCBA DDDCBA AABBCD AAABCD AABCCD AABBCD AACDDB AABBBD ABDCBC BBBADD DDCCBA CCCDDA AABBCD DDDCCA DDCBBA
24,AABCBD CDDDDA CCBAAD AABCCD AABCCD AABCCD ABBADD DDCCBA DDCCBA DBABBC AABBDD AABBCD ABCACD AABDCD AABBCD DDDCBA DDCCBA DDCCBA AABBCD AABBCD AABBDD AABCCD AABBCD DDDCBA DDCCCA DDDCBA DDCCCA DDCCBA AAABCD AABBBD AABCDC AABBCD CBAAAD BDDDBA DDCABB DDCCBA CCDDCA DDCBBA DCBAAD AABBCD ABBBAD AABBCD AABBCD BCDDCA DDCBAA DDCAAB DDCCCA CCDDCA DDCBAA AAABCD AABCCD AABBCD AABCCD DDCCAA DDDCBA BCDDDA DDDCCA BCDDCA DDCBBA DDCBAB AABBCD AABBBD AABDDC DDCCCA DCAACD DDCBBA DDCBBA BBAABD AABBCD DDCCBA DCCDDA DDDCAA DDCCBA DDCAAB DDCCBA DDCCBA DDCDBA DDCBAA AABBCD AABBCD AABBCD DDCAAB AABCCD ABCDDB BCCDDA
25,DCBAAD BAABDD BAADDC CAAADC DDDABA DDCCBA AACBDC DDCBCA DDCCBA DDCBAB AABBCD AAABCD AAABCD DDCCBA DDCCAA DDCCBA DDCBBA DDCCBA DDCCBA DDCBAA AABBCD AABCCD AABBCD AABCCD AABBCD AABBCD AABBCD AABBDD DDCCCA DDDCBA DDDCAA CBACDA DDDCBA ABCDDA DDCCCA AAACBD DDCDBA DDCCBA DDCCBA DDCCBA DDCBAB AABBCD AABBCD AABBCD AABBCD AABBCD AABDDD DDDCBA DDCCBA DDCCBA DDCCBA DDCCBA DDBAAC AABBCD AABBCD AABBCD AABCDD DDDDCA BAABCD AABBCD DBAADB CCCDDA AABBCD AAACBD AABBDD ABBDDA DDCBBA DDCCBA DDCCBA DDCBAA AABCCD AAABBD AABCDD DDCCBA DDCBBA AABBCD AABBBD AABBCD DDCDCA AABCBD AABDDB AABCBD DDDCAB DDDDAA DDBAAC
26,DDCCAB DCAADB BBAAAD DCAAAD CBBBAD ACDDCA DDCCBA DDCBAA DDCCBA AABBCD AABBCD DDCBDA DDDCCA BABDDA DDCBAB DDDCBA DDCCBA DDCBBA DDCBCA BAAABD AABBCD AABBCD AABBCD AABBCD AABBCD AABBCD AABBCD DDCCBA DDCCBA DDCCBA DDCCBA DDCCBA DDCCBA DDDCBA DCBAAB AABBCD AABBCD AABDBD CCDDDA AAABCD AABCDC BDDCBA AAAABD BBCDDA BAABBD AABCDD AAABCD AABBCD DDDCAB AABCCD ACDDAC AABBBD AAABCD BCDDDA DDCCBA DDCCBA DDCBAA DDCCBA DDCCBA DCBABB AABBCD ABDDBB AABBCD AABBCD CDDDBA BAAABD AAABCD AABDCC AABBCD AABBCD DDDCBA DDCCCA DDCBDA DDCCAA DDCBAB AABCDD DDCBCA DDCBAA DDCCBA DDCCCA AABBCD AABBCD CAAABD AABCCD AAABCD
27,AAABCD AAABCD AABBCD AABBCD AABBBD AABCCD AABBDD ABCDCB DDCACA CBBAAD AAACCD DBAADA DDDCBA DDCBBA DDDCBA DDCBAA CBAAAD AABCDD AABBBD AABBCD AABBCD AABCCD BAAABD DDDCCA DDCCBA DCBABC AABBCD AAABCD AABBBD CDDDBA DDDCBA DDCCBA DDCCCA DDCCAA DDCBBA DDDCBA DDCCBA DDCCBA DDCCBA DDCCBA DDCCBA DDCBBA DCBDBA AAABCD AABBCD AABBCD AAABCD AABBCD AABBCD AABBCD AAABCD AABBCD AABBCD AABCDD DDCBBA DDCCBA DDCCBA BCDDDA DDCCBA CBAAAD AAABCD AABCCD ABDDDA DDCCBA DDDCBA DDCCBA DDCBBA DDCCBA DDCCBA BBAAAD AABCCD AAABCD DDDBAA BAAAAD DDDCCA DDCCBA DDCCBA DDCACA DDBAAC DDCCBA DDCCBA DDCBAA DDDCDA DDCCBA DDCCBA
28,DDDCAA DDCCBA DDCCAB AABCBD AABBCD AAABCD AAABBD AABBCD DDDCBA DDCCCA DDCBCA DDCBAB AABBBD AABCDD ABCDAB AAADBD DDCCBA DDCCAA DDCCBA ABCCDC DDCCAA AABBDD AABBCD AABBCD AABBCD DDCCBA DDCBBA DDCBBA DCBCAA DDCCBA DDCCCA DDCCAA AAABCD AABBCD AABBCD BDDDCA DDCBAA DDCBBA DDDCBA DDCCBA DCBAAD AAABCD CDDCBA DDCCAC BBBADC DDCDBA DDCBAC AABCDC DDCCCA DDDCBA DDCCBA CBBDDA DDDCBA AAABCD AAABCD AAABCD AAABCD AABBCD AAABCD AABCDC DDCCBA DDCCBA DDCCBA DDCCBA DDCCBA DDCCBA DDDAAB AABCCD AAABCD AABBCD AABBCD AAABCD CDDDCA DDCBBA AABBCD AABCCD AACDDB AABBDD DDCCAA DDCCAA DCBBAD AAABDD DDCBBA DDCBBA AAABBD
29,DDDCBA BBBBAD AABCCD AABBCD AABBCD AABBDD CDDDAB AAABBD AABBDD AABBCD AABBCD AABBCD AABBCD AABBCD AAABDD AABCCD AABCBD AABBBD AABBCD AABBCD AABBCD CCCDDA DDCCBA AAAABD CDDDBA CDDDCA AAABCD AAABCD AABBCD AACCDC DDCCBA DDCACA DDCCCA DDCCBA DDCCCA DDCCBA DDCCBA DDCCBA DDCBBA DDCBCA DDCBAB DDCAAD AABCDC DDCCBA DDCCBA DDCCBA DDCCBA DDCBAA AAAACD AABBCD AABBCD AABBCD AABCCD AABBCD ACDDCA DDCCBA DDCCBA AAABBD AABBBD AABBCD AABBCD AABBCD AABBCD AABCDC AABBCD AABBCD AABBDD DDCCBA DDBAAC DDCCBA DDCCBA DDCBBA AAABCD AABBCD DDDCBA DDCCBA DDDCBA DDCCBA DDCCBA DDCCBA DDCCBA DDCCBA DDDCBA DBAAAD AABBCD
30,AABBCD AABCDD AAABBD AABBCD AABBCD CDDCBA DDCCBA BBCDDA DBAADC DDCBBA BBAAAD DDCCCA DDCCBA DDCCBA AABCDD BAAABD CDDCBA DDCCBA DDCCBA DDCCCA DDCCBA DDCBBA AAABCD AABBCD AABBCD DCAAAD AABBCD CDDDCA DDCCBA DDDCBA DDCCBA DDCCBA DDCBAA AABBBD AABBCD AABBCD AABBCD AABBDD BAAABD AABBCD DDCCBA DDCBAA DCBAAD AABBCD AABBCD AABBCD ACDDDA AAABCD AABCCD DDDCBA DDCCBA AAABCD DDCCBA DDCCBA DDCCBA DDCBBA AAABCD AABBCD AABBCD DDCCBA DDCCBA CDDDCA DDCCBA DDCCBA DDCCBA BAAAAD AABBCD AABBCD AABBCD AAABCD AABDDC DDCCBA ABCDDA DDCCBA DDCCBA DDCBAA AAABCD AABBCD AABBCD AABBCD DDDCCA DDCCBA DDCCCA DDCBAA AAACDC
31,DDCBBA DDCAAA CDDDCA BDDDAA BCCDBA DCBAAD DDCCBA DBAACD AABBCD DDCCBA DDCCBA DDCCBA DDCCCA DDCCBA DDCCBA AAABCD ABDDAC ABBBAD AABBBD AABCCD AABBCD AABBCD AABBCD AABBCD AAABCD AABBCD AACDDB DDCBBA DDDBAA DDCBCA CBAABD DDCBBA DDDCBA DDDCBA DDDCAA DDCDBA DDDCBA DDCBAB AABBCD AABBCD AABBCD AABCCD BDDDCA CCCDBA DDDCCA DDCCBA DDCCBA DDCCAA AABBCD AABBCD AAACBD AAABDD BBCDDA AAACDD BBBDDA AABDBD DDDCAA BAAADD AABCDB ABBABD AABCDB DDCCBA DDDCBA DDCCBA DDCCBA DDCBBA AABCDD AABCCD AABBBD AAABDD AABBCD ABCDDA DDCCBA DDDCBA DDCCBA DCBAAD AABBCD AABCCD AABBDD AABCBD ABCDDB AABBDC ABBCDA BBBCDA BCCAAD
32,CCCADA AABDBD AAAADD DDCCAA AAAABD DDCCBA DDCCBA AACDDB DDCCBA DCBAAD AABBCD AABBCD AABBCD AABBCD AABBCD AABBCD AABBCD ABCDDA DDDCBA DDCCBA DDCCBA DDDCBA DDCCBA DDCCBA DDDCBA DDCCBA AAABCD AABBCD BAAABD AABBCD AACDDC AABCCD AAABCD AABBCD DDCCBA DDCCBA DDCCBA DDCBAA AABBCD AABBCD AABBCD AABBCD AABCDC DDCCBA AAACCD AABCCD AABBCD DDDCBA DDCCBA DDCBAA DDDCBA BAAABD AABBCD AABBCD DDCBAA AABBCD AAAABD AABBCD DDCCBA DDCBAA DDCCBA BAABBD ABCDDA DDCCBA DDCCBA DDCCBA DDCCBA BAAABD AABBCD AABBCD AABBCD AABCBD AABBCD AABBCD AABBCD DDCCBA DDCCBA DDCCBA CBAABD AABBCD DDDCBA DDCCBA DDCCBA BAABCD AABBCD
33,BAABDD AAADDD ABCCDC BBAAAD AABCDD DDCCBA DDCCCA DDCCBA DDCCBA BAABBD AABBCD AABBCD AABBDD DDCCBA DDCCBA DDDCBA DDCCBA DDCCBA DDCCBA AAABCD AAABBD AABBCD AABBCD AABBCD AABBDD AABBBD AABBCD CDDDBA DDDCAA DDCCAA DDCCBA DDCCBA DDCCBA DDCCBA DDCBAA AABBBD AABBCD AABBAD AAABCD AABCCD DDCCBA DDCCBA DDCBBA DCBAAD AABBCD AAACCD AABBCD AABBCD DDDCAA AABBCD AABBCD AAABCD AABCDC DDCCBA DDCCBA DDCCBA DDCCBA DDCCBA DDCCBA DDCCBA DBAAAD AABBCD AAABCD AABBCD AABBCD AABDCD AABBCD AABBCD AABBCD AABCDC DDCCBA DDDCCA DDCBAA CDDDCA DDCCBA DDCCBA DDCCBA DDCCBA BAABBD AABBCD AABBCD AAABCD AABCDD AABBCD AABBCD
34,AABBCD AABBCD AABCCD DDDBBA DDDCBA CBAABD AABCCD DDDCCA DDCBBA DDCCBA DDCCBA DDCCBA DDCCBA DDCCBA DDCCBA DDCCBA AAABCD AABBCD AABCCD AABBDD DDDBBA DDCCAA BAAABD AABCCD AABBDD AAACBD AABBCD AABBCD AABCCD AABCCD AABBBD AABBAD AABBCD AABBCD AABDDC AABCDD DDCCBA DDCAAB AAABDD ABCDDB ACDDAD DDCCCA DDCCBA DDCBAA AABBCD AAABCD AABCDD ABCDAD ACDBDB DDCCBA DDCCBA DDCCBA DDCBAB AABBCD AABCCD CCDDDA DDCCBA DDDCBA DDCCBA DDCCBA DDCCBA DDCCBA DDCBAA AABBCD AABBCD AABBCD AABBCD AABBCD AABBCD AAABCD AABBCD AABCCD AABBCD DDCCBA DDCCBA DDCCBA DDCBAB AABBCD AABBCD AABBCD AABBCD AABBCD DDCCBA DDCCBA DDCCBA
35,DDCCBA CBAAAD DDCBAA BBAABD AABBCD ABCDDB DDCCBA DDCCBA DDDCAA AABBCD AABCCD AABCBD AABCAD AABBCD CBAADD CCDDBA DDCCAA DDBCAB AABDDC DDCABB AABCDD BDDDAB DDCCBA DDCCBA CBAAAD AABBCD CDDCCA CAACDA DDCCCA BCDADA ABCADC CBBBAD AABBCD AABCBD AABCCD DDCCBA DDCCAA DDCBBA DDDCBA DDDBAB BAAACD AABBBD AAABCD AABCCD AABACD AABBBD DDCCBA DDCCBA DDCCBA DDCBBA AAAABD AABBDD DDCCCA AAABCD AABBCD AABBCD AABDDC AABBCD ABCDBC AABCCD BCDDDA DDCCBA DDCCBA DDCBBA DDCCCA CDDCAC AABBCD AABBCD AABCDC DDCCAA DCBBAC AABBCD AABBCD AAABBD AABBCD DDCCBA DDDCBA DDDDBA DDCCBA DDCBBA AAABBD BCDDDA DDCCBA AAABDD AABCCD
36,BBBAAD ACDADC DDDDAA AABBCD DDDCBA DDCCAA DDCCBA DDCCBA DDCCBA DDCCBA AAABCD AABBCD AABBCD AABBCD DDCCBA DDCCCA DDCBDA DDCCBA DDCCBA DDCCBA DDCCBA CBBAAD AABBCD AABBCD AABBCD DDCCBA AAACDB DDCCBA AAAABD AABBCD AABBCD AABCCD AAABCD DDDCBA AABBBD AABDDC DDCCBA DDCBAA AABBCD AABBCD AABBCD AABBCD AABBCD DDCCBA DDCCBA DDCCBA DDCCBA DAAACD ABDDBC DDCCBA DDCBBA BCCAAD DDDCBA AABBBD DDDCBA DDCCBA DDCCBA DDCCBA DDCCBA AAAABD AABCCD AABBCD CCBAAD AABBCD DDCCBA DDCCBA DDCCBA DDCCBA DDBBAB AABBCD AABBCD AABBCD AABBCD AABDCD AABBCD AABCDC DDCCBA DDCCBA AAABCD AABBCD AABBCD AABBCD AABBCD DDCBAA DDCBBA
37,DCCCAD CCBAAD DCBCAD AABDBD DAADDB DCCCDA CBAABD AABCBD ABCDDB DDCCCA BAADDC DDCCBA DDCCAA BDDDBA DDCCBA DDCCBA ACCAAD AAABCD AABBCD AABBCD AABCDC DDCBBA DDCCBA DDCCBA DDCCBA AABBCD AABCCD AAABBD AABBCD AABBBD AABCCD AABCBD DDDCBA DDCBAA DDBADB AAACCD AAABCD AABBDD ACDDBA ABBABD BBAADD DDCCCA DDCBBA DDCCCA DDDCAA AABBDD AABBCD AAABBD BCCAAD AAACCD DDCBAB AACDAD AAABCD BCDDCA DDCBBA DDCBBA DDCCAA DDCCBA DDCBBA AAABCD AABCCD CAAABD AAABCD AAABCD ABCDDA DDCCBA DDCCBA CAACDA DDCCBA DCCDAA AABBCD AABCDD AABBCD AABBDD AABBCD DDCCCA DDCCCA DDCABA CDDCCA CCDDCA DDCCBA DDCCBA AAABCD AABCBD AABBBD
38,DDCCBA DCCAAD DDDCBA BAABAD AABCCD AAABCD AABBAD AABBCD AABBCD AABBCD ABCDDB DDCCBA ACDDCA DDDCBA DDCBAA AAABBD AABBCD AABCDC DDCCBA AAABCD AABBCD AABCCD DDCCDA DDDCBA CBAAAD AABCDC DCBAAC DCCCDA DDCCBA BCCDDA DDCCBA DDCCBA DDCBAA AABBCD AABBBD AABBCD CDDDCA DDCCBA DDCCBA DDCBBA DDCCBA DDCBAA CBAAAD AABBCD AAABCD AABBCD AABBCD AABBCD AABBCD AABBCD DDDCBA DDCAAB DDCCBA DDCCBA DDCBAA AABBBD AABBCD AABBCD AABBCD AABBCD BCCBAD AABBCD DDCBBA DDCCAA AAABCD AABBCD BCDDBA AABCDB DDCDBA DDCCBA DDCCBA BBAABD AABBCD ABCDDA DDCCAA DDCCBA DDCCBA DDCCBA DDCCBA DDCCBA DDCBAA AABBCD AABCCD CCCCDA AABBDD
39,AABBCD AABBCD AABCDD AAAADD BCDDDA DDCCBA DDCCBA DDCBBA BAAABD AABBCD AABBCD ABBABD AABBCD AABBDD CCCDDA DCBAAD AAABCD AABBCD AABBCD AAABCD AABBCD AABBCD AABBCD CDDDAA AABCAD AABBCD AABBCD AABBCD AABCDC DDCCBA DDCCBA DDCCBA DDCCBA DDCCBA DDCBAA CCCCDA DDCCBA DDCCBA DDCCBA DDDCBA DDCCBA DDCCBA DDCBBA BDDCCA DDCCCA DDCCBA DDCBAA AAABBD AABBCD AABBCD AABBCD AABBCD AABBCD AABBCD AABBCD DDCCBA DDCCBA DDCCBA DDCCBA DDCBAB AABBCD AAABCD AABBCD AABBCD AABBCD AABBCD AABBCD DDDDDA DDCBBA AAABCD AABBCD AABDDC DDCCBA DDCBAA ABCDDA DDCCBA DDCCBA DDCCBA DDCCBA DDCCBA DDCBAA AAABCD ABDDDB DDDCBA DDCCBA
40,DBAAAD AAAADD ABCCDC DDCCBA AAAACD AACDDB DDCCBA DDCBBA DDCCBA DDCBCA DCBAAC AAABCD AABBCD AABBCD CDDDCA DDCCBA DDCCBA BAAABD AABBCD AABBCD CDDDCA DDCCBA DDCCBA DDCCBA DDCBAA AAACBD AAABCD AAABCD AABBBD AABBCD DDDCAA DDCCBA BBBBAD AAACCD AABBCD AABBBD AABCCD AAACCD DDCCBA DDCCAA DBABDB AAACCD AABBCD AABBCD AABBCD ABCDDB DDCCBA DDCBAA DDCCBA DDCCBA DCCDCA DDCCBA BAAABD AAABCD AABBCD AABBCD AABBCD AABCCD AABBCD ABCDDA AAABDD AABBCD AAABCD AACDDB DDCCBA DDCCBA DDCBBA BCDDDA DDCCBA DDCCBA DDDCBA DDCCBA DDCCBA DDDCBA DCBADB CBBAAD AABBCD AABBCD AABBCD AABBDD AABBCD AABBCD AABCDD AABBCD AABBCD
41,AABBBD AABBBD DDCAAC DDDCCA DDDCBA DDCBAA CDDDCA DDCCBA DDCCBA DDCCAA DDCAAB AABBDD DDCCBA DDCACA DDCCBA DDBAAC AABACD AABBCD AABBCD AABBCD CDDDDA DDCCBA DDCBBA AABCDD DDCCAA AABBCD AABBCD AABCDC DDDCBA DDCCBA DDCCBA DDCBAA DCBAAC AABCBD AABCCD DDDCBA AABBCD AABBCD AABBCD AABBCD AABCCD AABBCD AABBCD AABCDD DDDCAA DDCBBA AAABBD DDCCBA DDCCBA DDCCCA DDCCBA DDCBAA DDDCBA DDCCBA AABCCD DDCBDA DDBAAB DDDCCA DCCCDA BCDCAD AABBBD AAABDC AABBCD AABBCD CCBAAD AABDDD AABBDD DDCBCA AABBDD DDCCAA BCCAAD BBBACD AABDDC AAABCD ABCBAD AAACCD ACDDDA DDCCBA DDCCBA DDCBAB AABBCD AABBCD AABBCD AACCDC AAABDD
42,AABBCD AABCCD AABBCD AABBCD AABBCD AABBCD AABCDD AABCDA ABCDDA DDCBBA DDDCBA DDCCBA DDCBBA DDCCBA BAAABD CDDDCA DDCCBA DDCCBA DDCCBA DDCBBA DDCBAA AAABCD AABBCD AABCCD AABDDB DDBAAB AABBCD AABCDC DDCCBA DDDCBA DDCCBA DDCCBA DDCCBA DDCBAB AABBCD AABBCD AABBCD AABBCD ACDCAC AABBCD DBAADC DDCBBA DDCBAA AAABCD AABBCD AABBCD AABBCD AABBCD DDCBAA AABBCD AABBCD AAABDD DDCCBA DDCCBA DDCCBA AAABBD CCDDCA DDCCBA DDCCBA DDCCBA DDCCBA AAABCD AABBCD AABBCD AABBCD DDCCBA DDDCBA DDCCBA DDCCBA DDCCBA DDCBAA AAABBD AABBCD AABBCD AABBCD ABCDDB DCBADB DDCCBA DDCCBA DDCCBA DDCCBA BBAABD AABCBD CDDDBA DDCCBA
