,0
0,HGFEDDCBA AADFGGGFF DBADFFGGG GGGHEBBBB BBABEGHGG HFBABDEEE AABCFGHFF GGGABCDDE HCFHCCCCC CCCBCCEHH AABCDEGHH BBCCCDEGH AABCEFGGH DAACDFGGH AADEFFGGH
1,HGGFFDCAA GGFFEEEAA DDBABDFGH ABCDEFGGG FFFFFFEAA HHGGDBBBB HDFEABDDD DDFABDEGH FGGEDGCAA BBBCEEEGH AACEEFGGG DBBBCCEGH AEEEFFFFF ABADEFGGG FGHFEDBBA
2,FFGGFDCBA HHFEDCCBA HHGBBBCCD AABCEGGGG GGGFFECBA DDFHECCCC AABDEFGGG BGGDDGCAG CCDDDDDDH CCCEFCCHF ACBDEDHGG FADDFDBDH ABCCEFGGH BCCDDDDDH EFGFABEEE
3,DGGGFEDBA EEDCCCCBH HHEDCCBBB GFAACEFFF HHGEDCBBA ACDDEFGGG HHGEDBBBB GFHGDCAAB HHFDCBBCD ABCCCCEHH AADFFFFGG ABCDEDEGH HHCBCCCCD ABBDEFGGH AADEFFGFH
4,DGGGFEDBA HHFEDDDBA AHGFEDCCC CEHGBCDDD HHGEDCBBA AABDFGGGG EGHGECCAA HGGFECBAA HFEGGDBAA BBBBCDFGH AABCEGGGG CCCBCDEFH GGGGDBBBB ABBDEFGGH AADEFFGFH
5,GGHFFDCBA HHFEDCCBA HHDBBCCDD AABDFGGGG GGGFFECAA DFHECCCCC GDGDGCCEA AAEDGFGFE CCDDDDHFD EAABFFFGG CCDFDCBHG BEFDBBDFH BBCCDDEEH ABBDEFGGH CFHGFDCBA
6,GFFGGEBAA HGFEEDDCA ACBBCEGHH AACDEFGGG FFFFFEEDA HHGFDBBBB EGHGDEBAA HHEDDDEAA DEFFFACFF BCCCCDEEH AABCFFGHG DBBBBDFGH AAACGGGGG ABACEFGGG FGHFEDBBA
7,GFFGGECBA HGFEEEDAA CCABCEGHH ABCDEFGGG FGGGFECAA HGGFDBBBB EFHGDEFAA DDFABDEGH EFFFFFFAA FGGGCAAFE BBBCCDFHH ABCCDDEGH ABBCEFGGH AEEEFFFFF FGHFEDBBA
8,DGGGFEDBA GHFEEEDBA ADDEFFFFF GGHFBBBBB HHGEDCBBA ABDEFFGGG ABBCEFGGH AACCDEFHH AABDEFFHH BABBDFGHH AABCDFHHG HGFECBBBC AABCEFGGH GGGGEBBBB AADEEFGGH
9,BABCEGGGG HHFEDCBBA HHGEBBBBB ABDEEFGGG GGGFFECAA HDAACFGGF GEDAEEBEH BBDDCFFDH EFABFFFED CDDDCBECH GGGGCBBBB EBCBCCEGH AABCEFGGH ABBDEFGGH ABEEEFEHB
10,DGGGFEDBA EEDCCCCBH HHFDCBBBB EEABDFGGG DDCCCBBHH DBAADGGGG HGGFDCBBA HHGEBBBBD HGEEDBBBC BDECBCCGH AABEFGGGG ACFFFDECH HHHFBBBBB ABBDEFGGH AADEFFGGH
11,GGGGFECAA HHFEDCCBA EHDCCCCCC AABCEGGGG GGGFFDBAA EEGHEBBBB CABFDEGGG AEEEEEEEH ABEFFFFFF AGGGDABEE ABBCEFHGG ECCBBDDGH AABCEFGHH AAEFFFFFF ADHGFEDCB
12,DGGGFEDBA HHFEDDDBA AABDGGGGG EFFGGGBAA HHGEDCBBA BBBBCFGHH AABCEFGGH AABCDFGGH AABDFGGGG ABBCDEGHH AABDDEGHH HHECBBBCC AABCEFGGH HHGCBBBCC AADEFFGGH
13,GHGFEDCBA AADFGGGFF DBADFFGGG GGGHEBBBB BBABEGHGG HDAABEGGG ADACGGHED CEGBEHDCC BEHGGEDAB BCBCCDEHH AABCDEGHH BBCCCDFGH AABCEFGGH HBBBCDEFF AADEFFGGH
14,AHEGFEEDA HGGFEBBBB BCBABGGHG ABBCDEFFH HEEDDCCBB GHGGDBBBB AABDDFGGG ACFEEFFFG FFAABFGGG CCCCCCEFH BBBBDGGGG CACCDEFGH ABBCDEFGH ABADEFGGG DFGEECDAG
15,DGGGFEDBA EEDCCCCBH FBABEFFGG AACDFGGGG EDDDCCCBH EBAADGGGG HCBFEECBD GHFCCCEBB FEDCCBAGH FAEDBBFGH AABCDEGHH GGGGGCAAA AABCEFGGH ABBDEFGGH AADEFFGFH
16,DGGGFEDBA HHFEDDDBA DAADFFGGG HHGBBCCCC HHGEDCBBA AABEFGGGG ABBCDEFHH ABBCDEGHH ABBCEFGHH CEDBBBEHH FFFGGFDAA CBBBCDFGH FFFFFFFAA ABBDEFGGH AADEFFGGH
17,DGGGFEDBA GHFEEEDBA AADGHFFED BCFHHEBBB HHGEDCBBA BBBBDGGHH ACEGHGECB HHGECCCBB HHGDEDCBA HFCBBBEFF ABBCDEGHH ABEDEFFGH AABCDEFHH HHGCBBBCC AACDEFGGH
18,DGGGFEDBA HHFEDDDBA AAEFFFFFF GGGHEBBBB HHGEDCBBA AABDFGGGG AABCEFGGH AABCEFGHH AABDDFFHH AABCEEGHH CCEFGGGEA HFCBBBCDG AABCEFGGH HHCCCCCCC AADEFFGGH
19,DGGGFEDBA GHFEEDDBA GBABDEFGG HHGBBCCCC HHGEDCBBA AEDDEFFFF EAECDDCHE HHGEDDCBA HDCCFEBFB ADCCCCFHH AABCDEGHH ABCCDEFGH FFFFFFFAA ABCDEFGGG GGGFEDBAA
20,GHGFEDCBA AADFGGGFF DAADFFGGG HHGBBCCCC AACEGGGFF HDAACEFFF DCACCFHHF CGFHGCCAD EDCHECDDD FDECBACGH AABCDEGHH FFFFFFFAA AABCEFGGH ABBDEFGGH AADEFFFFH
21,DGGGFEDBA DEDCCCCCH FBABDEFGH HHABCDDDD DDCCCBBHH EBAADGGGG HHBBBBEFG HHDCFEBBB DDEGFHDBB CFBBBBFHH AABCDEGHH ABCCDEFGH HHGBBBCCC ABBDEFGGH AADEFFGGH
22,GGEFGFBBA HHFEDCCBA HHDBBBCDD ABBCCFHHH FGGGFECAA HHGECBBBB CDFHHDBBB HHCBBCCCD GCGEFCCCC GGGEAABFE AABDDEGHH ABBCCFGGH AABCEFGHH CCCCCCCHH ABHGFFEED
23,GFFGGECBA GGFEEEDDA ADDBBEFHH AADEEFGGG FFFFFEEDA HHGFDBBBB GGDFGDCCA CHGDEBCCD DEFFFFFFA BCBCCCFHH BBBBCCGHH BBBBBFHHH AABEEFFGH HHEFEDCBA HGGFECBAA
24,GGGFFDCAA HGFEEEDAA DCAACEGHH AACDEFGGG FFFFFFEBA HHGGDBBBB CFFABDGGG GGGFFFBAA ABEEFFFGG BCCCCDEEH AABEFFGGG BBBCCDEGH AABFFFFGG ABADEFGGG FGHFEDBBA
25,DGGGFEDBA DDCCCCCHH FBABDEFGG HABCDEEEE HHGEDCBBA BCAADGGGG HGDCCCCBC BAGEDFFEE GFFFEGCAA DCBBCCFHH AABCDEGHH ABBCEEFGH HHBCCCCCD ABBDEFGGH AADEFFGGH
26,DGGGFEDBA ABHHGFDCB HHGEEBABB AACDFGGGG BAACGGGGF DBAADGGGG HGGECBBBB HHGEDCBBA AABFEFGGG CCCCCCDGH HGDCBBCDD ABBCEFFGH AABCEFGGH ABBDEFGGH AADEFFGGH
27,GFGFGEBBA HGFEEDDCA ACBBCEGHH AACDEFGGG FFFFFFEDA HHGFDBBBB ABCEFGHCG HDECDDEEA EFGDADGGA EEDBECBEH AACEFFGGG DCCCCBDGH AEEEEFFFF HHEFEDCBA HGGFECBBA
28,DGGGFEDBA HHFEDDDBA AABDGGGGG EFFGGGBAA HHGEDCBBA AABDFGGGG AABCEFGGH AABDEFFGH AABDEFGHG BBBDEDFHH CDEFFGGEA HECBBBCEH AABCEFGGH ABBDEFGGH AADEFFGGH
29,HEFFFFDBA GGFEEDDCA ACBBDFGHH AACDEFGGG FFFFFEEDA HHGFDBBBB HCEFGCBBB GGGFFFBAA BEHDDDDDD BCCCCDDHH AABCFGGGG CCCCCCEGH BBBBEGGGG ABACEFGGG FGHFEDBBA
30,HFGGFDCAA HGFEEDDCA ADCBCEGHH AACDEFGGG FFFFFFEBA HHGGDBBBB BEHFABFFE FFGEEFFAA EEFCACFGG BBBBBCFHH BABCDDGHH CCCCCCGHH ABBCDEFGH ABADEFGGG FGHFEDBBA
31,HGFEDDCBA AADFGGGFF EAADFFFGG GHHFBBBBB AAADFGGGG HFBABEFFF HFABDEBEG CCFHEFDBB ABGDCGFFF AADDDEDHH AABCDEGHH ABCCDDEGH FFFGGGBAA ABBDEFGGH AADEFFGFH
32,FHGGECCBA HHFEDCCBA DFHDCCCCC AABCDFGHH GGGFFEBAA FEEGHDBBB ABHHFCDDD ABFFFFFFF FFFFFFFAA FEACGCBDH AADEEDFHG DBCCECDFH AABCEFGGH BBBBBFHHH ADHGFEDCB
33,DGGGFEDBA CCCCCCCHH DAADFFGGG HABCDDEEE EEDDCCBBH FBAACFGGG AABDEFGGH ABCCDEGHH ACBCDFFHH BCBBCCGHH HHGECBBBB BBBCDDFGH HHHFBBBBC ABBDEFGGH AADEFFGFH
34,DGGGFEDBA HHFEEDDBA AAEFFFFGG FGGHEBBBB HHGEDCBBA AADEFGGGG HDDEDCAEG EEFHGFBAA DDCBBBGHH CCBBCCFHH AABCDEGHH ABCCDEFGH FFFFGGBAA ABBDEFGGH AADEFFGGH
35,GHGFEECBA AADFGGGFF DAADFFGGG HHGBBCCCC AACEGGGGF HEBABEFFF BCEACEGHE HDGGCBBCC BBADCFGGH DDCCDDDHD AACCEFGHH BACCDEFGH GGHGCBBBB AABDEFGGH AADEFFGFH
36,DGGGFEDBA EEDCCCCBH HHFDCBBBB EDABDFGGG EDDCCBBGH CBAADGGGG HHGECCBBA GGHFDDCAA ECABHEDGD AABDEGGGH AAEFFFFGG BBCBDEEGH HHBCCCCCD ABCDEFGGH FFHGFDBAA
37,DGGGGFDAA FFEDDDCHA HHGBABCDD ACDEEFGGG DDDDDCCCH HHGEBBCCA FFECDAFGB AAFFFFFFF EECAFFFFF BCCCCCDHH CCDEFFGHA HCBACEEEG AABCEFGGH BBCCCCGHH FGHFEDCBA
38,DGGGFEDBA DDDCCCCCH GBABDEFGG HHBBCDDDD HHGEDCBBA FBAADFGGG HEACFFDCD HGBGECCBB FEEDHGCBB CCBBDDEGH AABCDFGHH ABCCDEFGH ABBCDFFGH ABBDEFGGH AADEEFGGH
39,DGGGFFDBA HHFEEDDBA GBABDEFGG HHGBBCCCC HHGEDCBBA AADEFFGGG HECBBCECF FAFEEDDHC DEGFFFDBB FBBBDCEHH AABDDEGHH ABBCDEFGH FFFFFFFAA ABBDEFGGH AADEEFGGH
40,DGGGFEDBA GHFEEEDBA ADDEFFFFF GGHFBBBBB HHGEDCBBA ADDEEFFGG AABCEFGGH AABDEFGHH ACDEECCFH ABBCDEGHH BBCEFGHGA HHFDBBBBD AABCEFGGH HHGBBCCCC AADEEFGGH
41,HGFEGECBA HHFEDCCBA ABDCDFGGH AABEFFGGG FFFFFEEEA GHHGDBBBB DFHFCDFFA FGGFFGBAA AABCGGGGG AABCFFFHH BBACEEGHH AEFFFFFFF AABCDEFGH ABADEFGGG EGHFEDCBA
42,DCCCCCDGH HHFEDDCBA FEEFFFGCA BABCCFGHH GGGFFECAA GDAACFGGG GDDBBDHDE HHFFDBBBB BBGGGGFAB CCBBCCFHH FFFGGFBAA DCCBCCEGH AABCEFGGH ABBDEFGGH ABEEEFEHB
43,DGGGFEDBA HHFEDDDBA DAADFFGGG HHGBBCCCC GFEDCBBBH BCAADGGGH ABBCDEGHH AABCDGGGH ABBCFGGGG EEGFEBBFE HHGFCBBBB BBBCDEFGH HHHFBBBBB AABDEFGGH AACDEFGGH
44,GFFFFECAA GGFEEDDCA ADDABEFHH AADEEFGGG FFFFFFECA HHGGDBBBB ABDFGHECC GGHGDABBB HHCCCCCCC CABDDDDGH ABBDEEGHG CCCCCCDDH ABCDEFFGH ABADEFGGG FGHFEDBBA
45,HGGFEDCBA HHFEDCCBA HDAACEFFG AABCEGGGG FGGGFECAA HHHDCBBBB DGFABCFGF DDFABDEGH ABEEFFFGG GCFBBBCGG BBBCDDFHH AACDEFFGH AABCEFGGH AAFFFFFFF AABCEFGHH
46,GHGFEDCBA AADFGGGFF DAADFFGGG FFFGGFBAA CBBBCEGHH HGCABCDDD CBACCFGGG CGHDBBEGC FGFDGGCAA DBBBDDFHH AABCDEGHH BCDCBCEGH ABBCEFGGH FFFFFFFAA AACEEFGGH
47,DGGGFEDBA DDCCCCCHH HHFCBBBCC EEABDFGGG HHGEDCBBA ACDDEFGGG FFGGFEBAA HGFEEEBAA FHHECBCBB DCBBDCDHH AABDGHGFF ABCCDEFGH GGGGGCAAA ABBDEFGGH AADEFFGGH
48,DGGGFEDBA DDCCCCCHH FBABDEFGG HABCDEEEE EDDDCCCBH EBAADGGGG GHFFCAACE DCABEGGGF HGFFEDBAA DCBBCCFHH AABCDEGHH ABCCDEFGH HCCCCDDDE ABBDEFGGH AADEFFGGH
49,HHFFEDCBA AADFGGGFF DAADFFGGG HHCCCCCCC ABCFGGGFF HEAACEFFF ADFCCCEHG FACCDDFHF GCBAFGGDC DCBBBDEHH AACDDEGHH BBBBDDFGH HDBCCDDDE ABBDEFGGH AADEFFGFH
50,DGGGFEDBA HHFEDDDBA AAEFFFFGG EFGGHDAAA HHGEDCBBA AABEFGGGG HCGEDDCAC CHGGDADAD HGFFEDBAA FFECAADGG AABCDEGHH ABCCDEFGH HCCCCDDDE ABBDEFGGH AADEFFGFH
51,CGGGFEDBA GHFEEEDCA AEEEEFFFF FGGHEBBBB HHGEDBBBA AAACGGGGG FCBADDFGH HHDCCBBBG GFFFFFEAA BDBBDDFHH AABCDEGHH ABBCDEFGH AABCDFFGH ABBDEFGGG ABEGGGGDB
52,DGGGFEDBA DDCCCCCHH FBABDFFGG HABCDEEEE CCCBBBGHH EBAADGGGG HFDCCCCBC DBHGGECBB HGFFEDBAA DGBBBBFFH AABCDEGHH EEEFFFFFA AABCEFGGH ABBDEFGGH AADEFFGGH
53,GFFFFECAA HHFEDCCBA HHEBBBCCC AABCFGGGG FGGFFECAA FHFCCCCCC ABDDCEGHG GEBFFFBAG BBBBEHDGH FBBCGDBEH DBBCFCDHH AABCEEFGH AAACGGGGG ABBDEFGGG EGHGEDCBA
54,DGGGFEDBA GHFEEEDBA AACHHFEED BCFHHEBBB HHGEDCBBA BBBBDGGGH ACFGHGEBB HHFECDCBA HHGECBCCA ECCCBBEHH AABCDEGHH ABEEEFFGG AABCDEFGH HHHFBBBBB AADEEFGGH
55,HCFEEDCBA CCCBBBEHH GFFFFFEAA AACDFGGGG ACGGGFFED EBAADGGGG HGFEEECAA CCABCFHHF FGGAADECG CDEEEDGAG FGGGGFBAA FBCBCCEGH AABCEFGGH ABBDEFGGH ABEEEFEHB
56,HGFEDDCBA AADFGGGFF EAADFFFGG HHHEBBBBB AABDFGGGF HEAABEFFF AAGFFFFEF GGFBBEGCB ADDDFHHDC GGDBAACGG AACDEEFHH ABCCDDFGH HHGDBBBBC ABBDEFGGH AADEFFGFH
57,DGGGFEDBA EEDCCCCBH HHECCBBCC EEABCFGGG HHGFDCBBA ACDDEGGGG HHGFCBBBB HGGEDDDAA GDBCBBGFH CCCCCCDFH CHECAADFH FFFFFFFAA AABCEFGGH ABBDEFGGH FGHGFDBAA
58,HFGEFEDBA GGFEEEDDA AEEABDFGH AABEFFGGG FGGFFECAA HGGFDBBBB EGFBCEGGA CDFABDEGH ABDEFFFGG AABDFGFGG AACEEFGHF AAFFFFFFF ABBCDEFGH ABADEFGGG EGHFEDCBA
59,GHGFEDCBA AADFGGGFF DAADFFGGG FFGGGDAAA CBBBCFGHH HFBABEFEE BBBBEEGHH GEACDEEFF AABDFGGGD CCBACDFHG AABCDEGHH BBCCDDEGH ABBCEFGGH HABCDDEFF AADEFFGGH
60,DGGGFEDBA DDDCCCCCH DAADFFGGG HHBBCCDDD FEDDCCBBH ECAADGGGG AABCEFGHH AACDEEGHH AABFGFFGG GECEFFEFA HGCBBCCDD BBBCDEFGH HBBCCDDEE ABBDEFGGH AADEFFGFH
61,DGGGFEDBA DDDCCCCCH DAADFFGGG HHBBCCDDD EEDDCCBBH DBAADGGGG ABCDEEFGH ABCBEFFHH ABBBDGHGF FFFFFFEBA HCBBBCEGG FFFFFGBAA AABCEFGGH ABBDEFGGH AADEFFGFH
62,GFGGFEBBA HHFEDCCBA ACCBDEGHH AABEFFGGG FGGFFECAA HHHDCBBBB GGFFEDCAA GGGDDDBBB HHGBBCCCC BCCCCDDHH BBBCCDGHH ABBDEEEGH AABDEFGGH AEEEFFFFF AABCEFGHH
63,DGGGFEDBA DEDCCCCBH FBABDFFGG HHBBCDDDD HHGEDCBBA FBAADFGGG HFDCCCCCC DCACEGGHB HGFFEDBAA CCBBCCGHG AABCDEGHH ABCCDEFGH HHHFBBBBB ABBDEFGGH AADEFFGGH
64,DGGGFEDBA DDDCCCCCH GCABDEFGH HHBBCDDDD HHGEDCBBA AEDDEFFFF HEBBFEBGC BBCGGGGFA HGGFEDBAA BEBECBEHH AABCDEGHH ABCCDEFGH AABCDFGGH HHHFBBBBB EGHGFDBAA
65,DGGGFEDBA CCCBBBGHH GBABDEFGG HABCDEEEE DDCCCBBHH EBAADGGGG HFABEEDDE FHHDBBCCC FFEDDCBAH CCBBCCFHH AABCDEGHH ABCCDEFGH HHHFBBBBB ABBDEFGGH AADEEFGGH
66,HFGFEDCBA HGFEEDDCA CCBACEGHH AACDEFGGG EFFFEDBAH HGFFDBBBB HEGEBCEEA DDFABDEGH ABEEFFFGG HBBBCCDHH BBBCCDFHH AACDEFFGH AABCEFGHH AAFFFFFFF FGHFEDBBA
67,DGGGFFDBA GHFEEEDBA AAEFFFFGG EFGGHDAAA HHGEDCBBA AAACFGGGG FDFFHEAAE GGFEEEDDA CHGBBAEFF CCBBCCFHH AABCDEGHH ABBCDEFGH AABCDFFGH HHHFBBBBB GGHGEDBAA
68,GFFFFEDAA HHFEDCCBA HEDCCCCDD AABFFFGGG FGGGFECAA GGHDCBBCC DHDEEFBAF BBAEGHGFC AEFFFFHCA CCCCCGEEH BCCGGFGEA HACBDEFDG ABBDEFFGH AEEEFFFFF FGHFEDBBA
69,DGGGFFDBA GHFEEEDBA GBABDEFGG HHGBBCCCC HHGEDCBBA AEDDEFFFF EGEDDDDHA HHHECBBBB FEEDDCBAH CCBBCCFHH AABCDEGHH ABBCDEFGH AABCEFFGH HCCCCDDDD AADEEFGGH
70,EGGGFCBBA HHFEDCCBA HEDCCCCCD AABFFFGGG FGGGFECAA FGHCCCCCC CCEDAEHHE BBDFBFHHC CGEFCGECC HHCCDDDAD CCEGHHCBB BCEBDDCGH AABCEGGGH BBBCCCGHH FGHFEDBBA
71,GFFFFECAA HGFEDDDEA HHGBABCDE AAEEFFGGG DEEEDDCHA HHHFCBBBB HGDCCCBBG ABFDECFGF EAFFCCFDF BFGCCGGBC BBBCDEGHF CBBDCCFHH ABBCDEFGH ABADEFGGG FGHFEDBBA
72,DGGGFEDBA CCCBBBGHH HHFCBBCCC AABDFGGGG DDCCCBBHH DBAADGGGG HGGFDCBAA HHFEDCBBB HHEDECBAC BCCCCDDEH HECBBBDGG AADEEFFFH AABCEFGGH ABBDEFGGH AACDEFGGH
73,DGGGFEDBA FFDCCCCBH DAADFFGGG HHGBBCCCC HHGEDCBBA ACDEFFGGG ABBCEFGHH ABCCDFGGH BBACEGGGH BBBBDEFHH BCDFFGHEA HHFCBBBCE ABBCEFGGH HHGBBCCCC AADEEFGGH
74,DDDDCCCCH ADEFFFFEE DBADFFGGG GGGHEBBBB BBABEGGGG HFBABDEEE BAADEGGGG HHGBBEDBC BGHHEBBBB CCCBCCEHH AABCDEGHH BBCCCDEGH FFFGGGCAA ABBDEFGGH AADEFFGGH
75,DGGGFEDBA GHFEEEDBA GBABDEFGG HHGBBCCCC HHGEDCBBA AABEFGGGG DAEDDDDHE HHGDDDCBA GHCFFEBAD CCBBCCFHH AABCDEGHH ABBCDEFGH ABBCDFGGH HHCCCCCCC AADEEFGGH
76,DGGGFEDBA EEDCCCCBH FBABDFFGG AACDFGGGG BBBBEHGGG EBAADGGGG HFDCCFGCA AAGGGFEDC HGFFEDBAA BFEECADHH AABCDEGHH FFFFFFFAA AABCEFGGH ABBDEFGGH AADEFFGFH
77,DGGGFEDBA DDDCCCCCH DAADFFGGG HHGBBCCCC FEDDCCBBH ECAACFGGG AABCEFGHH AABDEFGGH ABBCDFGHH EBBCCCEHH HHGECBBBB BBBCDDFGH HHHFBBBBB ABBDEFGGH AADEFFGGH
78,GGGGFECAA HHFEDCCBA DFHDCCCCC AABCDFGGH GGGFFDCAA DDDGHDCCC ABCDFHGFE BBADFGGGG ABEFFFFFF CHGBCCDHB ABBEEDFFH BBCCCDEGH AABCEFGGH ADEEFFFFF ACHGFEDCB
79,DGGGFEDBA HHFEDDDBA HHGEDBBBB FGGABCEEE HHGEDCBBA ABBCEGGGG HGFFECBAA HHFECCBBA HGCEFDDAC AACDEFGHH AABDFGGGG AADEFGEFH GGGGDBBBB AABDEFGGH AADEFFGGH
80,GHGFEDCBA AADFGGFFF DAADFFFGG FFFGGGBAA CCBBBDGHH HGBABDEDE BBBBDFFGH HHECCDDAD FFGGCADFA ACCCCCEHH AABCDEGHH BBBCDEFGH AABCEFGGH HDCCCCDDD AADEFFGGH
81,DCCCCCDGH GHGEEDCAA GFFGGEAAA AABDFGGGG GGGFFECAA GCAACFGGG DBBDFGHDB DDGFGCFBC DEGHDBFCB BBBCFFFHC GGGGFBBBB BDBCCCEGH AABCEFGGH ABBDEFGGH ABEEEFEHB
82,DCCCCBDGH GHGEEDCAA GFFGGGBAA AABCEGGGG GGGFFECAA GCAACFGGG BCBCCFHFG EDGCGFCBB EEEGHEDAA FBBBBCGHH GGGGGEBAA DBCBCCEGH AABCEFGGH ABBDEFGGH ABEEEFEHB
83,HCFEEDCBA DDCCCBCHH FEEEFFGCA AACDFGGGG AAEGGFFEE EBAADGGGG HGCDDDBBC HFCCEECAE HGDBEEDAD EGCBBBDFH FFFFFFFBA HADBCCDEH AABCEFGGH ABBDEFGGH ABEEEFEHB
84,HGFEDDCBA AADFGGGFF DAADFFGGG FFGGGDAAA CBBBCFGHH HFBABDEEE EEGHECEAD ABFHHFDDA CHDCCGECC BEECCCBHH AABCDEGHH BBBCCDEGH CCDEFGGHA AABDEFGGH AADEFFGGH
85,HGFEDDCBA AADFGGGFF DAADFFGGG FFFGGGBAA CCBBBDGHH FDBABFGGG ABBBDEGHH BCGFFCEBG BDHFGCCCC BCDBBCEHH AABDDEGHH BBBCDDFGH ABBCEFGGH ABBDEFGGG HDCCCCCCC
86,GGGFEECAA AADFGGGFF DAADFFGGG HHGCBCCCC AACEFGGGF HEAABEFFF FFHFDCDAC HDDBBCGDC AABDGGGFG CCBBCCGHH AABDDEGHH ABCCDDEGH GGGGEBBBB ABBDEFGGH AADEFFGFH
87,DGGGFEDBA EEDCCCCBH HGFDCBBBB EEABDFGGG HHGEDCBBA ABCCEGGGG HHGEDCBBB HGGEDCBAB HGEEFDBAB CBBBBDGHH AABCEGGGG ABBDEEFGH HHGBBCCCC ABBDEFGGH AACDEFGGH
88,DGGGFEDBA HHFEEDDBA AAFHGFEDD BCFHHEBBB HHGEDCBBA ABABFGGGG HHGFECBBA HGFEEDCAA EEEFGGFBA ABCDDDGHH AABCDEFHH ABFGEDEFG AABCDEFHH HDCCCCCDD AADEEFGGH
89,HGFFEDCBA AADFGGGFF DBADFFGGG GGGHEBBBB BBABEGGHG HFBABEFEE BACGEDEEH AABFFFGGG EAFFFFFAE DDDDBACGH AABCDEGHH BBBCDEFGH GGGGDBBBB ABBDEFGGH AADEFFGFH
90,HDFEEDCCA BBBBGHGED HHGFBBBBB BBBCCDFHH FGGGFFCAA DBAADGGGG GGGCAAEDG DACEGHFAD FGGEDFEAA DDDDDCFBH HHDCCCCCC FCCCBBDFH AABCEFGGH ABBDEFGGH GGGFEEBDA
91,DGGGFEDBA HHFEDDDBA AHHFEDCCC CEHGACDEE HHGEDCBBA AABDFGGGG FGHGEEDAA HGGFCBABB HGGGECBAB GFCBACFFG BBBCCEGHH EDDCCBCEH FFFFFFFAA ABBDEFGGH AADEFFGGH
92,GHGFEDCBA AADFGGGFF DAADFFGGG FFGGGDAAA CBBBCFGHH HFBABDEEE CAACFFGGG FFDADEEEE CCDDDDCCH EBABDDEHH AABCDEGHH BBCCDDEGH AABCEFGGH HDCCCCDDD AADEFFGGH
93,DCCCCCDGH HHFEDCCAA EDCEFFFGA ABBCCEGHH FGGGFECAA HDAACFGGF BAEDBEHHE FFHEDEEBA HGEFCCCAE CCCBCCEHH FFFFFFFBA GADBCCDFH AABCEFGGH ABBDEFGGH ABEEEFEHB
94,DGGGFEDBA DDCCCCCHH FBABDFFGG HABCDEEEE DDCCCBBHH EBAADGGGG HHDFDBEBB CDGGGGCAA AHGGFEDBC GFBBBBEHH AABCDEGHH ABCCDEFGH HBCCCDDDE ABBDEFGGH AADEFFGGH
95,DGGGFEDBA HHFEDDDBA ADDEFFFFF GGHFBBBBB HHGEDCBBA AABEFGGGG AABCEFGHH ABBCDEGHH AACDEFGHG ABCDEDFGH DEFFGGFBA GCBBBCEGH EEEEFFFFA ABBDEFGGH AADEFFGGH
96,HGFEDDCBA AADFFGGFF EAADFFGGG HHGCBCCCC AACEFGGGF HEBABEFFE CBCDBCHGG AABEGGGDG GGGEBEGBA EAABFFHGE AABDDEGHH BBBCDEFGH DDEEFFFGA AABDEFGGH AADEFFGGH
97,GGGGEDDBA HGFEEEDAA DDBABDFHH AABDEFGGG FFFFFFEBA HHGFDBBBB EBGDEFCGB HHHEBBBCC BFDFBBBGH EDBBCCEHH AACEFFGGG CCCCCCCHH ABBCDEFGH ABADEFGGG FGHFEDBBA
98,DGGGFEDBA HHFEDDDBA DAADFFGGG HHGBBCCCC HHGEDCBBA BCAADGGGG ABBCDFGHH ABBDDFGGH ABCCDEFGH CDCBCBEHH HHGFDBBBB BBCCCDFGH HHHFBBBBC ABBDEFGGH AADEFFGFH
99,DGGGFEDBA BBBBBFHGG FEDEFFFFA AACDFGGGG DDCCCBBHH EBAADGGGG HGDCCCCBC ABDGGFFFE GHHCCCCBB CCCBCCEHH AABCDEGHH ABBCDEFGH HHHFBBBBB ABBDEFGGH AADEEFGGH
100,GHGFEDCBA AADFGGFFF DAADFFGGG FFFGGGBAA CBBBBEGHH HFBABDEEE ABBCFGFEH FGEABCFFF CDGHDDCCC DDBBBDDHH AABCDEGHH BBBCCDEGH AABCEFGGH EAACDFGGH AADEFFGGH
101,BHFGGEDBA GGGFFDBAA CDCBADGHH ABCDEFFHD GHFFDCBBA GHHGDBBBB ECBCEGCAH EBCBCDCHH DCACGEGFD DDBDGEEBH AAADGGGGG AABCDFGGH AABCDFGGH ABBCEFGGH ABBCEFGGH
102,BHFGGEDBA HGFFEEBAA DDCBBCGHH AABDEFGGH HFDDCCCCB GHGGDBBBB GHEEGCBBB EHGEFEBAA EFGFBCCGA GGFFFEBCA BABBFGGGG ABBCDFGGH AABCDFGGH ABBCEFGGH ABBCEFGGH
103,HDFEEDCBA ABADGGGFF HGGGCBBBB BBCCDDEHH GGGFFECAA DBAADGGGG HGGDCCBBB HGFFEECAA FEEEEFCGA GGGGFBBBB ACBDEEGHH CCCCCCEGH AABCEFGGH ABBDEFGGH ABEFEFEHB
104,BHHGFCBCA HHGFCBBBA ABACGGGGG CCCDDDGHB HGFCDEDBA HHGFDBBBB HEEFDBACG ECDABGFCH GBBBEEEGG CBDCBGDGG AABFFFFGG ABCCDEFGH AABCDFFGH ABBDEFGGG DFGEECDAG
105,GGGGGDCBA HHFEDCCBA HFDAACEFG AABEFFGGG FGGGFFCAA HHFDCBBBB AACDEGGGG DDFABCEGH ABEEFFFGG GGEADDBFE BBBDDEEGH BBBBCEFGH AABCEFGGH BBBBEGGGG BBABDEGHH
106,GEFGGECAA HGFEEEDAA DCBABEGHH ABCDEFGGG FGGFFFCAA HHGGDBBBB DFHGDEGBA FFGEEFFAA ABDEFFFGG CCCCCCCHH ABCEEEGGG CCCCCCDDH ABBCDEFGH ABADEFGGG FGHFEDBBA
107,DGGGFEDBA HHFEDDDBA GBABEFFGG HHGBBCCCC HHGFDCBBA EBAADGGGG HDCBCEDDD CGGGDDEEA GGGFEEBAA ECDCBBFHH AACCDEGHH HHCCCCCCC AABCEFGGH ABBDEFGGH AADEFFFFG
108,FHGGEDCBA HHFEDCCBA HEECBCCDD AABEFFGGG GGGFFDCBA EHECCCCCC CDHGBCBDE ABEBFFFGG GGGEBBBBG ADDDEEEGG DDDBCAEHH CCCCDBEHH BBCCDDEEH ABBEEFGGG BEHGFDCBA
109,GFFFFDCBA HHFEDCCBA HGEAACDEF AABCDEGHH FGGGFECBA HGGGEBBBB HHFCDEBBB HHCBBCCDD EEFFFFAEA BCCCCDDHH BBCDCCEHH AACDEFGGH ABBCEFGGH AABFFFGFG AABCEFGHH
110,DGGGFEDBA DDDCCCCCH DAADFFGGG HHBBCCDDD EDDCCBBGH FCAACFGGG AABCDFGHH ABDDEFGGG ABACGFFHG BBBDEGHHB HGDBBBCDD BBCCDDFGH HHBBCCCDD ABBDEFGGH AADEFFGFH
111,DGGGFEDBA GHFEEEDCA AABFFGGGG FFGGGDAAA HHGEDCBBA ABBBEGGGG AABCEFGGH ABCDDEFGH ABCDEFGGH BBBCDDFHH AABCDEGHH GGGGECBAA AABCDFGGH ABBDEFGGH HHCCCCCCC
112,HFFGGDCBA GGFFEEEAA CDBABDGHH AADEEFGGG FFFFFFDAA HHGGDBBBB CFHFABEEE HHGBBBCCC BBBEHEBGH EBDBBBEHH AACEFGGFF CCBBBCFHH AAFFFFFFF HHEFEDCBA HGGFECBBA
113,DGGGFEDBA EEDCCCCBH FBABDFFGG HHABCDDDD DDCCCBBHH EBAADGGGG HGDCCCFCB DGHGCBBEB DCCEHGGBA DCACCCFGH AABCDEGHH ABBCDEFGH AABCEFGGH ABBDEFGGH AADEFFGGH
114,DGGGFECBA HHFEDDDBA AABFFFGGG EFGGHDAAA HHGEDCBBA AAACFGGGG HAGEEEDBD CGDGGFFBA CDGBAEGFF DDCCBBGGH AABCDEGHH ABCCDEFGH FFFFFFFAA ABBDEFGGH AADEFFGGH
115,BHGFFDEBA HGFFEEBAA DDCBADGHH ABBDEEGFH HDDCDCCCC HHGFCBBBB BBGCCCFGH GACEEEEEF EEBEFBEBH EHFFCDCCB BBBBBFHHH HHGFECBAA HGFEDCBAA HHGFEDBAA HGGFECBBA
116,DGGGFEDBA HHFEEDDBA AEDEEFFFF GGHFBBBBB HHGEDCBBA AAACFGGGG BCABGGGFG FHEDDCCBB FFEEEDDGA CCBBCCFHH AABCDEGHH ABBCEEFGH AABCDFGGH ABBDEFGGH AADEEFGGH
117,BBBBDFGHH HHFEDCBAA FEEFFFFAA ABBCDDGHH CGGGFECBA HEBABEFFF EBBBCCGHG EHFGFCCCA DDDBBDHHD CBBBCEHHG AABCDEFHH FFFFFFBAA AABCEFGGH ABBDEFGGH AADEFFGGH
118,HGFFDDCBA AADFGGGFF DAADFFGGG HHGBBCCCC AACEGGGGF HEAABEFFF CBBCCGHGB DCACCFDHG GGBBBEGBF ACCEFDCHH AABCEFGGH ABCCDDFGH HHHDBBBBC ABBDEFGGH AADEFFGFH
119,DGGGFEDBA HHFEDDDBA AGGGEDDCC BDGHFBCCC HHGEDCBBA AABDFGGGG FHGGEDCAA HHGEDCCBA HHGDBCBCB FECECABGH BABCCEGHH ECCBCCDFH FFFFFFFAA ABBDEFGGH AADEFFGGH
120,DGGGFEDBA HHFEDDDBA HHFDCBBBB DGGABDFFF HHGEDCBBA AACEFGGGG HGGFECBBA HGGFDDBAA HEFGDEDAA EFFBCEBFG BBBCCEGHH AACEFFGGG GGGGGDAAA ABBDEFGGH AADEFFGGH
121,DGGGFEDBA GHFEEEDBA AEDEEFFFF GGHFBBBBB HHGEDCBBA AADEFFGGG HGDCCCCBC ABFEEEDDH HHDDCCCBB CCCBCCEHH AABCDEGHH ABCCDEFGH EEEEFFFFA ABBDEFGGH AADEEFGGH
122,DFEFEFCGA FFHECCCCB AABDEFFGH CCCDCHHCC EHFFEDCBA HHGFDBBBB AABDEFGGG AACHGDEEG BFGBDDCHD BBEDEEDHD AAEFFFFFF BBBCDDFGH AABCEFGGH ABBDEFGGH ADHGFDDAE
123,DGGGFEDBA HHFEDDDBA AADFFFFFF GGGHEBBBB HHGEDCBBA AABDFGGGG ABBCDFGGH ABBDDEFHH AACEEFFGH BCBCCDFHH DDEFFGGDA HCBBBBDFH EEEEFFFFA ABBDEFGGH AADEFFGGH
124,GGEFGEBBA HGFFEEBAA ECBABEFHH AABDEFGGH GGGGGEBAA HHGFDBBBB EFGHFDEAA HCDBCCDDE ABDEFFFGG BBBBDDEGH AABDFGGGG BBBDDDEGH AEEFFFFFF ABACEFGGG FGHFEDBBA
125,DGGGFEDBA GHFEEEDBA AACFFGGGG FFGGGDAAA HHGEDCBBA AACEFGGGG ABBDEEFGH ABBDFGGGG ABCCDEGGH ABCCDEFHH AACEFGHHB HHFECBBBC AABCEFGGH HHHFBBBBB AADEEFGGH
126,DGGGFEDBA CDCCCCCHH DAADFFGGG HBBCDDEEE DDCCCBBHH EBAADFGGG ABBDEFGGH ABCCCDFGH ABDEFGFFG FFFFFFEDA HCBBBCEGG EEEEFFFFA AABCEFGGH ABBDEFGGH AADEFFGFH
127,DGGGFEDBA HHFEDDDBA DAADFFGGG HHGBBCCCC HHGEDCBBA AADEFFGGG ABBCDEGHH AABCEFFGH BABBDFGHH BBBBCDGHH FFGGGFDAA CBBBCDEGH ABBCEFGGH ABBDEFGGH AADEFFGGH
128,DGGGFEDBA HHFEDDDBA AEDEEFFFF GGHFBBBBB HHGEDCBBA AABEFGGGG HGDCCCCBC HGGGEBBBA FEEDDHEBB DACCCCFHH AABCDEGHH AABCDEFGH FFFFFFFAA ABBDEFGGH AADEFFGGH
129,HCFEEDDBB AAADGGGFF HGGGCBBBB ABCCDDEHH GGGFFECAA FBAADGGGG ABCBDEGHH CCBBCEDHH BDGGGFBAD BBBBCDFHH HHGCBBBCC CCCCCCEGH AABCEFGGH ABBDEFGGH ABEEEFEHB
130,GFGFFDCBA HHFEDCCBA ACDCDEGGH AABEFFGGG FGGFFECAA HGGFDBBBB HBEGDADDC HHGBBBCCD DEFFFFFFA FGEAAEDGF AACEFFGGG DCCCCCEGH AEEEEFFFF ABBCEFGGH AABCEFGHH
131,AHFFFFDBA HHFFEEBAA DCBBBCGHH AABDEFGGH HFEDDCCBB GHHGDBBBB DGAACDGGG HHECCCDAC HADCDDDED CCCCCCEFH BBBBDGGGG CACCDEFGH AABCDEFGH ABADEFGGG DFGEECDAG
132,GGFGFECAA EDDCCCCCH HGGBBBCDD AABFFFGGG FGGFFECBA FHECCCCCC CHGBADEEE CCCBBCGHH ABEEFFFGG BCCCCCDHH BCCECDCHH FFDACCFEH BBCCDDDEH ABBDEFGGG DGHGEDCBA
133,HCFEEDCBB BBBBCGHGG GGGGFBBBB BBCCDEDGH EHFGFECBA DBAADGGGG HGCDDEDBA CGCGHFDDA GGDDDFDEA FFFFFFEAA AEBEEEFGG CCCCCCEGH AABCEFGGH ABBDEFGGH ABEEEFEHB
134,GGGFEDCAA AADFGGGFF DAADFFGGG HHCBCCCCC ABDFGGGFE HDAACEFFF BBBBDFFHH GFCFCCFFA DHHDCCCBB DDBBCBEHH AABCDEGHH EEEFFFFFA AABCEFGGH ABBDEFGGH AADEFFFFH
135,HDFEEECCA BBBBFGGGG GGFGFBBBB ABCDDEEGH FHGGFECAA FBAADGGGG HGFGEBBAB HFHFCBBAE BBBBEFEHH FCBBBEGHE HHHEBBBBB CCCCCCEGH AABCEFGGH ABBDEFGGH ABEEEFEHB
136,HDFEEDCBA CCBBBDHHH GFFGGGBAA AACDFGGGG AEFGFFEDC DBAADFGGG AABCEGGFG ABBEFGGGF HHGFDCBAA DDDDDEDHA HHHEBBBBB DDCCBCDFH AABCEFGGH ABBDEFGGH EFGFEECFA
137,DGGGFEDBA HHFEDDDBA AAEFFFFGG FGGHEBBBB HHGEDCBBA AADEFGGGG HHBBFBCDE GFCFFCGBA HGFFEDBAA DCBBCCFHH AABCDEGHH ABCCDEFGH HHHFBBBBB ABBDEFGGH AADEFFGGH
138,DCCCCCDGH GHGFECBAA HGGGDBBBB AACEFGGGG GGGFFECAA GCAACFGGG DAACDEHGG GCBADEFGG DGCFBACFH CCFFCAEEH HHGCBBCCC CCCCCCEGH AABCEFGGH ABBDEFGGH ABEEEFEHB
139,DGGGFEDBA BCBBBFHGG FEDEFFFFA AACDFGGGG CBBBBFHHG EBAADGGGG HGFEECAAD FFGHEABCC HGFFEDBAA FFFBBADGG AABCDEGHH FFFFFFBAA AABCEFGGH ABBDEFGGH AADEFFGFH
140,DGGGFEDBA HHFEEDDBA AABFFGGGG EFFGGGBAA HHGEDCBBA CCCBADGHH AABDEFGGH AABCEGGGH AABCEFGGH BBBBDDFHH AABCDEGHH HHGECBBBB AABCEFGGH GGGGEBBBB AADEEFGGH
141,DGGGFEDBA DDCCCCCHH FBABEFFGG HHABCDDDD DDCCCBBHH EBAADGGGG GHFEEEBAA BCDDHFDGA AHGGFEDBB GFCBCAEEG AABCDEGHH GGGGDBBBB AABCEFGGH ABBDEFGGH AADEFFGFH
142,GGGGFEDBA HHFEDCCBA DFHDCCCCC AABCDFGHH GGGFFDCAA EDDGHDBBB BACDDEEHH ABGCCFFGG HGBCCCCHC FBBCDEDEH CBBCDDFHH DCCCBCDFH BBBBCFGHH AABDEFGGH ADHGFEDCB
143,HDFEEECDA AAGHGFECC HHFBBBCCC ABBCCFGHH FGGGFECAA DBAADGGGG HHFCBDCCB GGGFDEDBA FFFFEDAEE EEEEEFDHA HFCCCCCCC CCCCCCEGH AABCEFGGH ABBDEFGGH ABEEEFEHB
144,HDFEEECDA BBBBFGGGG HGGGDBBBB ABCDEEFFH GGGFFECAA FCAADFGGG HGEBBBCEC HFGEDCABC BCCCBDFHH DDCCCCFCH GGGGCBBBB EBCBCCEGH AABCEFGGH ABBDEFGGH ABEEEFEHB
145,HGFGEDCBA HGFEEDDCA DDBABEFHH AABEFFGGG FGGGGFCAA HGFEDBBBB GGGCDEFAA DDFABDEGH ABEEFFFGG CCDCDEEHB ABCCDDEGH AADEEFFGG ABBCEFGGH AAFFFFFFF FGHFEDBBA
146,DGGGFEDBA HHFEDDDBA ADDEFFFFF GGHFBBBBB HHGEDCBBA ABDEFFGGG ABCCDFGGH ABCCDFGHH ABBDEFFGH BBBCDEGHG EFFGGFDBA DBBBCDEGH AABCEFGGH ABBDEFGGH AADEFFGGH
147,GEEFGFDBA HHFEDCCBA HGCABDEFF AABCDFGHH FGGGFECAA HGGGCBBBB HEEBCDADF HCDBCCDDE ABDEFFFGG BCCCCDDHH BBBCDDFHH ABCCDDEGH BCCCDDDDH ABADEFGGG FGHFEDBBA
148,HGGFEECAA HHGFDBBBB DCBBCCDHH AABDEFGGH FFFFFFEDA HHGGDBBBA HDFGDBCCB HGGDBBBCC ABEEFFFGG BBBBDFFHH AABDEFGGH BBBCDDFGH BBBBBFHHH ABACEGGGG FGHFEDBBA
149,DGGGFEDBA HHFEDDDBA HHFDCBBBB DGGABDFFF HHGEDCBBA ABBBEGGGG HHGFDCBBA HHFDCCBBA HGGEDCBBB AACDDDGGH ACEFEEFGG EEFFFFFFA AABCEFGGH ABBDEFGGH AADEFFGFH
150,GFGHFDCBA EEDCCCCBH HHGBABCDD AAEEFFGGG FGGFFECAA GHDDCCCCC EEFCBGBFG BBCGHGBEE CCCCCCCHH FFFFBCFGA GBDGDEBBG CCCCCCEGH AABCEFGGH AAFFFFFFF EGHFEDCBA
151,DGGGFEDBA CCCCCCCHH DAADFFGGG HHBBCCDDD FEDDCCBBH ECAACFGGG AABCDFGGH AACDEEGHH AABCDFGGH GFDBAADHG HHGGDBBBB BBBCDDFGH GGGGDBBBB ABBDEFGGH AADEFFGGH
152,GFGGFDCAA HHFEDCCBA HHFBBBCCC AABBEGGGG FGGGFECAA EEGHEBBBB CGBACFGGG HBACEEEEF EEFFFCGCA AFFFGGBDC BBCEDCEGH FEBBCDCFH BBCCCDDHH ACACEFGGG EGHGEDCBA
153,HGGGEDCBA GGFEEDDEA HHGBABCDE ACDEEFGGG DEDDDDDHA HHGFCBBBB HCEFCBCDD ADGGECFGD GGBEEBBGC BBDHFBCFF BAGFGDDFF BBBBCEFGH AAACGGGGG ABADEFGGG FGHFEDBBA
154,GGEGGCCBA HHFEDCCBA HFEBBCCDD AABEFFGGG GGGFFECAA HFCCCCCCC EBBBBEGHG DEFABCEGH BBBEEBFHH CCCCCGEEH CCDFGEBBH BBBCFDFFH ABBCEFGGH BBBBBFHHH BEHGFDCBA
155,DGGGFEDBA DDCCCCCHH HHFCBBBCC DDABDFGGG HHGEDCBBA ABBBEGGGG HHFEDBBBB HHGEDBCBA HCCDDADDH CCBEFCGHC ABBCDFGHH CBCCCCEGH FFFFFFFAA ABBDEFGGH AACDEFGGH
156,DGGGFEDBA GHFEEEDBA EAADFFGGG HHGBBCCCC HHGEDCBBA BBBBEGGGG AACDEFGGH AABDEFGGH ABCDEFFGH BABCDEGHH AABCDEGHH HHGEDCBBA AABCEFGHH FFFFFFFAA AADEEFGGH
157,HCEDDECFA AAEGFFFEF HHEBBCCCC ABBCCEHHH GGGFFECAA HFBABDEFE ABBDEFGGH ABCBDFGHG DBBDCCDGH BBBCCCEHH AABCDEGHH BBBCDDFGH AABCEFGGH ABBDEFGGH BDHFFDDAE
158,DGGGFEDBA GHFEEEDBA GBABDEFGG HHGBBCCCC HHGEDCBBA ADDDEFFFF HGGDBBCCD FFECCCBHB BGGGCADEE CCBBCCFHH AABCDEGHH ABCCDEFGH FFFFFFFAA ABBDEFGGH AADEEFGGH
159,GGGFFEDAA HGFEEEDAA ECAACEFHH ABCDEFGGG FFFFFFEDA HHGFDBBBB ABBCDDGHH FFEBCDFGB GGGGEBBBB EDBBBDFHH AABCDFGHH BBCCCDEGH BBBBEGGGG ACACEFGGG FGHFEDBBA
160,DGGGFEDBA HHFEDDDBA AABDGGGGG EFFGGGBAA HHGEDCBBA BBBBCGGHH AABCDFGHH BABCDEGHH AABDFFFGH ABBCDEFHH AACDEGHHC HGFDBBBBE AABCEFGGH HDCCCCDDD AADEFFGGH
161,HGFFGECBA HGFEEDDCA ADBBCEGHH AACEEFGGG FGGGFECAA HGFFDBBBB CEGEFFEAD CEHBCCDDE GCHGCCCCC BCCCCDDHH AAACEFGGH DDCBACFFH AAACGGGGG ABADEFGGG FGHFEDBBA
162,HEEFGEDBA GGFEEDDDA ADCBCEGHH AADEEFGGG FFFFFFEDA HHGFDBBBB HHEFDACCB FFGEFFFAA CHCDDDDDD BCCCDDEDH AADEEFGGG CCCCCCDFH AEEEFFFFF HHFFEDBAA HGGFECBAA
163,DGGGFEDBA DDDCCCCCH DAADFFGGG HHGBBCCCC HHGEDCBBA BCAADGGGG AACDEFGGH ABBCDFGGH AABDEFGGH EEEBBBEHG FFGGGECAA BBBCDDFGH FFFFFFFAA ABBDEFGGH AADEFFGGH
164,DGGGFEDBA HHFEDDDBA AACHHFEEE BCFHHEBBB HHGEDCBBA AABCFGGGG ABFGHGEDB HGFFECBAA GCABBDEGH FFGCDDAEF BBBCCDFHH HEBBCCDEH EEEEFFFFA ABBDEFGGH AADEFFGGH
165,GHGFEDCBA AADFGGFFF DAADFFGGG FFGGGDAAA CBBBCFGHH HGCABDEEE CBABEFGGG EHGEECCAC AFDBFFFFF ECBACCFHH AABDEFGHH BBCCDDEGH AABCEFGGH FFFGGGBAA AADEEFGGH
166,HCFEEDCBA BBACGGGFF HGGGCBBBB BBCCDDEHH GGGFFECAA EBAADGGGG HEFEDDCDA HFDBBDFCD GEABBDEGG BBDDCCGFH HHGCBBCCC EDCCBBDFH AABCEFGGH ABBDEFGGH GFGFEEBDA
167,GFFFGFDBA HHFEDCCBA HGBACDEFF AABCDFGHH FGGGFECAA HHGFCBBBB BDDAEHFDD GGGGEBCCA BCDDDDHFD EEEECAAEH BBBCCDFHH ABCDEEFGH AABCEFGGH ABBEFFGGG FGHFEDBBA
168,DGGGFEDBA CCCBBBGHH DAADFFGGF AACDFGGGG DCCCBBEHH FBAACFGGG AACDEFFHH ABBCEFGHG CGHGDCCBA FFFFFFFCA HFCBBBDEE ABCCDEFGH CAACDFGGH ABBDEFGGH AADEFFGFH
