,0
673,DGGGFECBA GHFEEEDBA AABFFFGGG EFGGHDAAA HHGEDCBBA AAACFGGGG HDBADGCEG HHGEDDCBA HHGCCCBBB BBCDCBFHH AABCDEGHH ABCCDEFGH AABCDEFGH HCCCCDDDD AADEEFGGH
674,FHHGEDCBA EDDCCCCCH HHGBABCDD AABFFFGGG FGGFFECAA GHFCCBCCC CFCCHGDBD CCCCCCHHD GGGEAAEBF BCCCCCDHH EEFCACDHF FDACBFGDG BBCCCCGHH ABBDEFGGG EGHGEDCBA
675,DDDDCCCCH ADEFFFFEE DAADFFGGG HHGCBCCCC AACEGGGGF HEBABEFFF DEGCBBDFG GGFCDCDBD AFGGGFFAA DDECBACHH AABDEFGHH BBCCCDFGH GGGGEBBBB ABCDEFGGH AADEFFGFH
676,HGFEEDCBA AADFGGGFF DAADFFGGG HHGCBCCCC AACEGGGGF HEAACEFFF DABFHHGCC CHBBEFFFB ABDFFGFGE BBACEEGGH AABDEEGHH ABBCDEFGH HHGBBBCCC ABBDEFGGH AADEFFGFH
677,BBBBCEGHH HHFEDCCBA FEEFFFFAA ABBCDDGHH EGGGFECAA HFBABDEED ABCDEGGFG GGGEBADFF BBDHEBBGG BDBCECDGH AABDEEGHH BBCCDDEGH FFFGGGBAA ABCDEFGGH AADEEFGGH
678,DGGGFEDBA EEDCCCCBH DAADFFGGG HHGBBCCCC FEDDCCBBH DBAADGGGG AABDEFFHH ABBCEFGHG AEGGCBDFG FFEEEEFDA HFCBBCCDE ABCCDEFGH AABCEFGGH ABBDEFGGH AADEFFGFH
679,DGGGFEDBA EEDCCCCBH FBABDFFGG HHBBCDDDD EDDDCCCBH EBAADGGGG HGCCACEDE BGECGGEDA GHEDDCCBB CBBCECFHG AABCDEGHH ABBCDEFGH HBCCCDDDE ABBDEFGGH AADEFFGGH
680,DGGGFEDBA HHFEDDDBA AABFFFGGG EFGGHDAAA HHGEDCBBA AABEFGGGG HGGCCCBBC BHGFBCEDD HGDAFEDCC HGCAACEFF AABCDEGHH ABCCDEFGH HHGBBCCCC ABBDEFGGH AADEFFGFH
681,DGGGFEDBA EEDCCCCBH DAADFFGGG HHBBCCDDD HHGEDCBBA ADDDEFFFG AABDEFFGH ACBCDFGGH ABCDDDGGH BFDCEEDDG GGGGECBAA ABBCDDFGH FFFFGGBAA ABBDEFGGH AADEFFGGH
682,GHGFEDCBA AADFGGGFF EAADFFFGG HHGCBCCCC AACEGGGGF HEAABEFFF CBBCEGBGH GGGFFCAAA BFCGGCAEF AABDEEGHH AABCDEGHH ABBCDEFGH GGGGEBBBB ABBDEFGGH AADEFFGFH
683,CCCCCCCHH CHGFEDCBB EAADFFFGG HHGCBCCCC AACEGGGGF HGBABDEEE DCABBEHGH AFCEFBDGG ADHGGFDBB BBBCCEFHH AABCDEGHH ABCCDDFGH ABBCEFGGH HHCCCCCCC AADEEFGGH
684,DGGGFEDBA HHFEDDDBA AACHHFEED BCFHHEBBB HHGEDCBBA ABABFGGGG CFGGGFCAA HGGEDCBBB HGDCDFCBA CCBBDDEGH BBBCCEFHH HECBBBDEH EEEEFFFFA ABBDEFGGH AACDEFGGH
685,HFFGFECBA HHFEDCCBA HFAACDEFF AABCEGGGG FGGGFECAA HHFDCBBBB BEHFABEFE GGHGDBBBB HBCCDDDDD BCCCCDDHH BBBCDDFHH ABCCDDEGH BCCCCCDHH ABAEEFGGG FGHFEDBBA
686,DGGGFEDBA HHFEDDDBA AAEFFFFFF GGGHEBBBB HHGEDCBBA AABDFGGGG ABBCEFGHH AACDEFGHH ABBCDFGHH BCCBCDFHH DDEFGGGCA HCBBBCDFH AABCEFGGH ABBDEFGGH AADEFFGGH
687,HGFFDDCBA AAEFGGFFF DBADFFFGG GGGHEBBBB BBABEGGGG HEAABEFFF HGCBBFCBG BBDGGGCAG GBBBEGGBF DBABDDFHG AABCDEGHH EEEFFFFFA AABCEFGGH ABBDEFGGH AADEFFFFH
688,DGGGFEDBA HHFEDDDBA AACGGGFED BCFHHEBBB HHGEDCBBA ABBBEGGGG ADHHGFCBB HGGGECBAA HHEDCBBCB BCBBCDGGH ABBCDFGHH CBCCDDDFH GGGGGDAAA ABBDEFGGH AACDEFGGH
689,DGGGFEDBA DDCCCCBHH HHFCBBCCC EDABDFGGG DDCCCBBHH DBAADGGGG HGGFECBAA HGFGEDBBA FGHFDAACD BBBBDEFHH ABFGFFEFF ABCCDDFGH HHGCBBCCC ABCDEFGGH FFHGFDCAA
690,DGGGFEDBA HHFEDDDBA AAGHGEEDD BDGHFBCCC HHGEDCBBA AABCEGGGG EGGGGEBAA HHFDBCCBB HHEEECCBA EFCABCGGG BBBCDEFHH FBDCBBDGH EEEEFFFFA ABCDEFGGH FFHGFDCAA
691,HHFFDDCBA AADFGGGFF DBADFFGGG GGGHEBBBB BBABEFGGG HFBABDEEE BBCDEBFHH EEEBBCHFD BBDGEEGGB DDDCBBCHH AABCDEGHH BBCCDEFGH ABBCEFGGH HHCCCCCCC AADEFFGGH
692,DGGGFEDBA DDCCCCCHH FBABDEFGG HABCDEEEE EDDDCCCBH EBAADGGGG HGEFECBAD GAGFFEDCB GHAEEDDCC CCBBCCFHH AABCDEGHH ABCCDEFGH HHHFBBBBB ABBDEFGGH AADEFFGGH
693,DGGGFEDBA HHFEDDDBA AAGHGEEDD BDGHFBCCC HHGEDCBBA AABCEGGGG CGGGGECBA HHGFDCBBA HHFDCCCBB HFDBCBBFH BBBCDEFHH AAEFEEEFH AABCDEFGH ABCDEFGGH AADEFFGGH
694,GGGFEEDAA HHFEDCCBA HBBBCDEFG AABDFFGGG FGGFFECAA HHHDCBBBB HGGEECCCA DDFABDEGH HBCCDDDDD CFBBCCCGH AABCDEFGH ABBCDEGHH AABCEFGGH BBBBBFHHH AFBGFFEEC
695,HHGFEDCBA AADFGGGFF DAADFFFGG EFFGGGCAA CCBBBDFHH HEBABEFFF GGGGDCDAA GGGEEEADA GBBEHEBFB DDCAACGHH AABCEFGHH BBCCDDEGH GGGGEBBBB ABBDEFGGH AADEFFGFH
696,HCFEEDCBA CCCBBBGHH GGFFFFBAA AACDFGGGG AGGGGFDBA EBAADGGGG HFFFECBAB AAGGGFDDD BDCCEGFBH FEDDDEDHA GGGGFBBBB BCBCCDEGH AABCEFGGH ABBDEFGGH AACDEFFHG
697,DGGGFEDBA HHFEDDDBA AHGFEDDCC CEHGACDED HHGEDCBBA AADEFGGGG HHGEEDBAA HGFEDCCBA HBCCCCBFH BBBCEDFGH AABCEFGHH BBBCDEFHH GGGGGCAAB AACDEFGGH FFHGFDBAA
698,DGGGFEDBA DDCCCCCGH DAADFFGGG HHBBCCDDD FEDDCCBBH FCAACFGGG ABBCEFGGH AABDEEGGH AACEFGGGG CCBBCCEHH HHGFCBBBB BBCCCDEGH GGGGDBBBB ABBDEFGGH AADEFFGGH
699,DGGGFEDBA CCBBBCHHH EAADFGGGF AACDFGGGG DDCCCBBHH FCAACFGGG AABCEFGGH AACEEEFGH AACDEEGGH BBCCCDFHH EEFGGGDAA HHEBBBBDF AABCEFGGH HHGBBCCCC AADEEFGGH
700,DGGGFEDBA DDCCCCCGH HHECCBBBC FEABDEFGG FEDDCCBBH CBAADGGGG HHHECBBBA HHFFEBCBA HGBDDBACF DBBBDCEGH AACFGFFGG AABDFFFGH GGGGDBBBB ABBDEFGGH AACDEFGGH
701,DGGGFEDBA DDCCCCBHH HHFCBBCCC EABCEFGGG CCCBBBFHH DBAADGGGG HGGFECCAA HHGFDBABB BCABGFGGD BBBCDEFGH ABEEEFFGG EEFFFFFFA AABCEFGGH ABBDEFGGH AACDEFGGH
702,HGEFFDDBA HHFEDCCBA ACBBCEGHH AABEEFGGG FGGFFECAA HHHDCBBBB HFGFDDBAA GGGFGCAAB GHHFBBBBB BCCCCDDHH AABDEEGHH ABBCDEGHH ABBCEFGGH BBBBEGGGG FGHFEDBBA
703,DGGGFEDBA GHFEEDDBA ABHHFEEDD BDGHFBCCC HHGEDCBBA AABDFGGGG FGGGFDBAA HGFFECCAA HGDDEDCBA FEBBBAEHH BBBCDDFHH HEFDCBABH AABCDEFGH HCCCCDDDD AACDEFGGH
704,BBBBCEGHH HHFEDCCBA DAADFFGGG HBBCDDDDD ACEGGGFEC HFBABDEEE BBBDEGHHB HGEGECABC AEFFFFEEE CCCCCCCGH AABDEFGHH BBBCDDFGH HBBCCDDEE ABBDEFGGH AADEFFGGH
705,DGGGFEDBA GHFEEDDBA AACFFGGGG FFGGGDAAA HHGEDCBBA CCCBADGHH ABBCEFGGH ABBCEFGHH AABEEFGGH ABBBDDFHH AABCDEGHH HHGFDBBBB AABCEFGGH GGGGGCAAA AADEEFGGH
706,HGFEDDCBA AADFGGGFF EAACFFFGG GHHFBBBBB AAADFGGGG HFBABEEEE AADEFGGGD CCCBEHDBH AFDGECFGC CCBBCCGHH AABCDEGHH BBBCDDFGH DEEEFFFGA AABDEFGGH AADEFFGGH
707,FGGGGECBA HHFEDCCBA HHGBBBCCC AABBEGGGG FGGFFECAA EEGHEBBBB ABBFGEFFF BCHGEFDBC DCBFGEEAH CHEACCDGF ABEDCDGFH DECCCBDGH BCCCDDDDH ABBCEFGGG EGHGEDCBA
708,HGFEFDCAA HHFFECAAB FCAACEFGH AABDEFGGG FFFFFGCAA HHGGDBBBB EEABCEGGG HHGBBBCCC BBCCGHFDC BCCCCDDHH AABDEFGGG CCCCCCFFH BBBBEGGGG ABBDEFGGG FGHFEDBBA
709,HGFEDDCBA AADFGGGFF DAADFFGGG HHCCCCCCC ABCFGGGFE HDAACFGFF FHHDBCDCA HCBFCFECC AEBDCHGEE ECAABDFHH AABCDFGHH BBBCDDFGH EAABDEFGH ABBDEFGGH AADEFFGFH
710,CGGGFEDBA GHFEEEDCA AACFFFGGG FFGGGDAAA HHGEDCBBA ABBBFGGGG AABDEFGGH ABBCDEGHH AABCFGGGH ABBDEEFHH AABCDEGHH GGGGGDBAA BBBCDEFHH ABBDEFGGG HHGCCCCCC
711,FGGGFDCAA HHFEDCCBA DFHDCCCCC AABCDFGHH GGGFFEBAA EEGHDCCCB HDBGEBCDC AFFEFFFAF GGGEBBBGB DDDDEHCCC AABCDEGHH BFCBBDEGH AABCEFGGH AABFFFGGG BEHGFEDCA
712,GGGGEDBAA HHEDCCBAD HHGBABCDE AABFFFGGG FGGGFFCAA HEDDCCCCC HHCCEDCBB AADFECDGH GEHGEDBAA BBBBBDGHG BCACEDGHG BBBDDDDGH BBBBEGGGG ABBCDFGHH AABCEFGHH
713,HGFEDDCBA AADFGGGFF DBACFFGGG GGGHEBBBB BBABEFGHG HFBABEFEE HGCDEBBGB ADDCCFHHD BCEGCCGHC CCBBCCEHH AABCDEGHH AABDEEEGH FFFFGGDAA ABBDEFGGH AADEFFGGH
714,DGGGFEDBA EEDCCCCBH HHEDCCBBB GHGABDEEE DDCCCBBHH DBAADGGGG HHFDCBBBB HGFDABCDD HHFABDCCE BBBCCDFHH CBBBCDGHH FFFFFFBAA AABCEFGGH ABBDEFGGH AADEFFGFH
715,GGGGFECAA DDDDCHGCC HHFBABCDE AABDEFGGG DCCCCCBHH HHGECBBBB AABDEFGGG FDAEEEFFF DDEEHGEEA BBBDHECGG BBBCDDGHH BBCCCDEGH AABCEFGGH AABFFFGGG HGGFECBAA
716,GFFFFECAA HHFEDCCBA HDDCCCCCD AABFFFGGG GGGGEDCBA FGHCCCBBB BGBCCCDHE BGFBDGGCB HGBBEEBBG GBCEBEDHD GFHGCBCBB CCCCCCEGH BCCCCCDHH ABBDEFGGG EGHFEDCBA
717,DGGGFEDBA HHFEDDDBA AABFFGGGG FFGGGDAAA HHGEDCBBA AABDFGGGG ABBCDFGHH AABDEFGGH ABBDEFFGH ABCCDCFHH FFFGGFDAA EBBBCCEGH EFFFFFGAA ABBDEFGGH AADEFFGGH
718,DGGGFEDBA CCCCCCCHH DAADFFGGG HHBBCCDDD HHGEDCBBA ADDDEFFFF AABCDFGHH ABCCDEFHH AACDEFFGH EBBBBCFHH FGGGGEBAA BBBCDEFGH FFFFGGBAA ABBDEFGGH AADEFFGGH
719,HFEGGEBBA HHFEDCCBA GAABDEGGH AABDEFGGG FGGGFECAA HHEDCBBBB HDFEABDDD HHCBBCCDD DEFFFFADF BBBBEGHGF BBBCCDGHH BBCCCDEGH BBBCCCGHH ACBDDFGGG FGHFEDBBA
720,HGGFDCBAB HHFEDCCBA HHDCBCCCC AABCFGGGG FGGFFECAA DDDDHHCBB ABFGGGDBG BBDHHHDBB FBECGGCFB ABGGDECGD CADFGGEEE ABCBEEGHH AABCEFGGH AABFFGGGG EGHFEDCBA
721,DGGGFEDBA EEDCCCCBH HHFDCBBBB EEABCFGGG HHGEDCBBA ABBBEGGGG HHGFDBBBA HGFECCCBB DBDDECDDH CDBBCCEHH ABFGFFFFF ABDDEFFGH HHBCCCCCD ABBDEFGGH FFHGFDBAA
722,HGFFFECBA HHFEDCCBA ABCCEFGGH AABEEFGGG FGGGFECAA HGEECCBBB HFGFBABBF EFFDEEFAF HBCCCCCHD BCCCCDDHH BBBCCCFHH BCCCCCEGH CCCCDDDDH ACBEGHHEC HGGFECBBA
723,DGGGFEDBA DDCCCCCHH FBABDEFGG HABCDEEEE EDDDCCCCH EBAADGGGG GADGGGCAF HGFBBDFFA DGGGGDBAA BBBDDDGHG AABCDEGHH ABCCDEFGH GGGGDBBBB AABDEFGGH AADEEFGGH
724,DGGGFEDBA GHFEEEDCA AAEFFFFFF GGGHEBBBB HHGEDCBBA AAEEFFGGG ABBCEFGGH AABCEFGGH ABBCDEGHH BBBCDEFHH AABCDEGHH HHGEDCBAB ABBCEFGGH EEEFFFFFA AADEEFGGH
725,DGGGFEDBA HHFEEDDBA AACGHGFEE BCFHHEBBB HHGEDCBBA AABCFGGGG FGGGGECAA HHGFDBBAA HGGFFDCAA HGDBAAEGE BBBCDEFHH BBCCDDEGH ABBCDEFHH ABCDEFGGH AADEFFGGH
726,HGFEDDCBA AADFFGGFF DAADFFGGG HHCCCCCCC ABDFGGGFE HEBABEFFF FABBCGHFE CCCBEHHDB DABEEEEHE DFCABCFHH AABDDEGHH BBCCDDFGH AABCEFGGH EAACDFGGH AADEFFGGH
727,GHGFEDCBA AADFGGGFF DAADFFFGG EEEFFGGAA DCCBBBEHH HFBABEFFF BACEGEGGG HGEGDBBBB EBCHFBDFF BBBCCEEHH AABCEEGHH ABCCDDFGH AABCEFGGH HHDCCCCCC AADEFFGGH
728,GGGGFECAA HHFEDCCBA DDGHCCCCC AABCDEGHH GGGFFDCAA GFDCDDEHA GDFFCDGBA DAFGCBDHE HHFFDDCBA BDBCBDFHH ABBCDEFGH BBCCCCEGH BBCCDEEFH ABBDEFGGH ADHGFEDCB
729,HGFEDDCBA AADFGGGFF DAADFFGGG HCBCDDDDD AAEFGGFED HEAACEFFF EBACBDGGH CCCBFGFHC BHGEEGCCA AACDFDEHH ABBCDEGHH BBCCCDFGH GGGGFBAAB ABCDEFGGG HGGFECBAA
730,DGGGFEDBA GHFEEEDCA DAADFFGGG HHGBBCCCC HHGEDCBBA AACEFGGGG AABDEFGGH AABDEFGGH ABCCDEFGH AACDEEFHH AABDEEGHH HGFEDCBAB AABCEFGGH FFFFFFFAA AADEEFGGH
731,GFFGGECBA HHFEDCCBA HGDABDEFF AABCDFGHH FGGGFECAA GGGGFBBBB HGGDECBBB GGHGDBBBB GCGCCCCCH BCCCCDDHH AABCEFGHH AACEEEFGH ABBCEFGGH AABFFFGGF FGHFEDBBA
732,GFFGGECBA HGFEEDDCA ACBBDFGHH AACDEFGGG FGGGFECAA HFEDCCBBB EABDEFHHA HGCBBBCCH ABEEFFFGG BCCCCDDHH ABBBDFGHH CBCDCDDFH BBBBBFHHH ACACEFGGG FGHFEDBBA
733,DGGGFEDBA DDCCCCCHH HGECCCBCC FAACEFGGG HHGEDCBBA BBABDGGGG HGGFECBAA FEBBCEFFF BBCCCDFGH BCCCDCDGH ACDDCDFHH EEEFFFFFA AABCEFGGH ABBDEFGGH AADEFFGFH
734,DGGGFEDBA HHFEEDDBA AHGGEDDCC DFHGACDDD HHGEDCBBA ABDEFGGGG ADGHFEFDB FHGGFCBAA BBBCDDGHH BABDDEGHH ABBCDEFHH AACDEEFGH EEEEFFFFA ABBDEFGGH AADEEFGGH
735,DGGGFEDBA DEDCCCCCH GBABDEFGG HHGBBCCCC HHGEDCBBA FBAACFGGG HEDEECABC ECACFECGG HHCCCCBBF CCBBCCFHH AABCDEGHH ABCCDEFGH GGGGDBBBB ABBDEFGGH AADEEFGGH
736,DDDDCCCCH AEFFFFFEE DAADFFGGG FFGGGDAAA BBBBCFGHH HFBABDFEE BBDGGGCBG GFBACFFFF GCHHEBBBB BBCBCDFHH AABCDEGHH BBBCDDFGH GGGGFBAAB ABBDEFGGH AADEFFGFH
737,DGGGFEDBA GHFEEEDBA EAADFFGGG HHGBBCCCC HHGEDCBBA AABEFGGGG AABCDFGHH ABCCDFGHH ABBCEFGGH CBABDEGHH AABDEFGHF HHGEDCBAB AABCEFGGH GGGGEBBBB AADEEFGGH
738,GFGGFDBBA HHFEDCCBA HFAACDEFF AABCEFGGG FGGFFECAA HGGGCBBBB EGGCDFGBA HHGBBBCCC ABEEFFFGG DDDDEEAHD BBBCCDEHH ABDEEEFGH AABCEFGGH BBACDEFHH AABCEFGHH
739,DGGGFEDBA HHFEEDDBA AACFFGGGG FFGGGDAAA HHGEDCBBA ABBBEGGGG ABBCEFGGH BBBBDEFHH AACDEFFGH ABBCDDFHH AABCDEGHH HHECBBBCD AABCEFGGH HHGBBCCCC AADEFFGGH
740,DGGGFEDBA DDDCCCCCH GBABDEFGG HHGBBCCCC HHGEDCBBA AEDDEFFFF FHDABFEEF HHGBBBBBF AGGFFEDCC CCBBCCFHH AABCDEGHH ABBCDEFGH EEEEFFFFA ABCDEFGGH AADEEFGGH
741,DGGGFEDBA DEDCCCCCH FBABDEFGH HHGBBCCCC HHGEDCBBA FBAADFGGG GDEACFFEF HHGCCCBBB AGGFFEDCC CCBBCCFHH AABCDEGHH ABBCDEFGH GGGGGCAAB ABBDEFGGH AADEEFGGH
742,EGGGFECBA DDDCCDHFB FFEBABCHH AABDEFGFH DHGCDCCCC HHGFDBBBB AABDEFGHF AGGFFBBBH AFEHDEFEB AAFDEEGFG BBBCCCGHH CBBCCDEGH AABCEFGGH ABBDEFGGH ADHGFDEBD
743,EEEFHGEBA HHFEDCCBA HEDCCCCCD AABEFFGGG GGGFFECAA EHFCCCCCC GHBBCCCCG DEGHDDEEA CCCCCCHEH CHBBCCDGF AABDFFHGF FEBBBCDFH ABBDEFGHH AAACGGGGG BEHGFDCBA
744,DGGGFEDBA HHFEDDDBA GBABDEFGG HHGBBCCCC HHGEDCBBA FBAADFGGG HHECBBDBD ABEDGHECG HDDBCGDFB BDBCDDGHG AABCDEGHH AABCDEFGH HHHFBBBBB ABBDEFGGH AADEFFGGH
745,DGGGFEDBA GHFEEEDBA DAADFFGGG HHGBBCCCC HHGEDCBBA ADDDEFFFF ABBCDFGHH ABBCDEGHH ABCDFGFFH ABBCDEGHH BCEFGGGEA HHGEBBBBD AABCEFGGH HHHFBBBBB AACDEFGGH
746,GFFGFECAA HHFEDCCBA HHDBBCCCC AABCFGGGG FGGGFEBAA EGHECCCCC CCEFCDCGH AEHFFEDDD ABCFDDFFH DDDDDACHH DDFFBACEH CBBBCCEHH BCCCDDDEH ABBDEFGGG EGHGEDCBA
747,DGGGFEDBA DDDCCCCCH DAADFFGGG HHBBCCDDD HHGEDCBBA BCAADGGGH AABCEFGGH AACDEFGGH BCACDEGGH GFDCDEFFA HGECBBCCD BBBCDEGGH HBBCCDDEE ABBDEFGGH AADEFFGFH
748,CGGGFEDBA GHFEEEDCA AAEFFFFFG FGGHEBBBB HHGEDCBBA AAACGGGGG BFCCCDDCH HFAEEEEDC GEAFFEECC CCBBCCFHH AABCDEGHH ABBCDEFGH AABCDFGGH ABBDEFGGG AACEEFGGH
749,DGGGFEDBA HHFEDDDBA AACHHFEED BCFHHEBBB HHGEDCBBA AABCFGGGG EGGGFECBA HHGEDCBBA HHECCCACD BCBBCDGGH ABBCDEGHH BFDBBBCGH EEEEFFFFA ABBDEFGGH AADEFFGGH
750,GGGGFECAA HHFEDCCBA HHGFBBBBC ABBCCFHHH GGGFFECBA DDDGHDCCC AACGGGEGC BBEHHEBCC BCFDGDBFG FFDCCAEHC EAADEFHFE EDBECBFFH AABCEFGGH AEEFFFFFF CFHGEDCBA
751,DGGGFEDBA HHFEDDDBA AABFFGGGG FFGGGDAAA HHGEDCBBA BBBBEGGGG ABBDDFGGH ABBCEFGHH ABCCDFGHH ABCCDEGHH AACDEFHHE HFDBBBCDE AABCEFGGH HCCCCDDDD AADEFFGGH
752,DGGGFEDBA BBABFGGGG GFFFGGCAA AACDFGGGG BBBBDGGGG FCAACFGGG ABCDFFFFH BAABEGGGH EFGGGDDCA FFFFFFECA HCBBBCEGG ABBCDEFGH HBBCCDDEE ABBDEFGGH AADEFFGGH
753,GGGFEECAA AADFGGGFF EAADFFFGG GHHFBBBBB AAADFGGGG HEBABEFFF BBDCCCFHF AFAEEFFFF AAECDFGGG FEBCBCCFH AABCDFGHH BBBCDDEGH GGGGEBBBB ABBDEFGGH AADEFFGFH
754,DGGGFEDBA GHFEEEDBA HHFDCBBBB DFFABEFFF HHGEDCBBA ABCEFGGGG HHGFDCBBA HGFFEDCBA HHGECCCBA BCBBDDFHH BBBCDEFHH HHFDCBBBD ABBCDEFGH HHGBBCCCC AADEEFGGH
755,HCFEEDDBB AAADGGGFF HGGGCBBBB ABCCDDEHH GGGFFECAA FBAADGGGG HGDCDDCCC AADEFFEFH ACDFGHFAD EEEBBBEEH HHGCBBCCC CCCCCCEGH AABCEFGGH ABBDEFGGH ABEEEFEHB
756,GGGGFECAA GGEDDDCHA HHGBABCDE ABCEEFGGG DDDDDCCCH HDDDCCCCC HGCGBCDDD ACDCFEGHD GGEAAAEGG EEEEEACGG BBBDHDEFG AACEEFGFH BBBBCFHHH ABBDEFGGH BEHGFECBA
757,DGGGFEDBA DDDCCCCCH GBABDEFGH HHABCDDDD EEDDCCCBH FBAACFGGG FGAACFFFF GGGGBBBBE GAGFFEDCC CCBBCCFHH AABCDEGHH AACCDEFGH AABCEFGGH HHCCCCCCC AADEEFGGH
758,GGGGFECAA HHFEDCCBA HHDBBCCCD AABDFGGGG GGGGFECBA EHFCCCCCC HEDCFCBFB BBDEEDFHC HBCEHECCC BCCCCCDHH BBCEDBHGG CCCBBDEFH AABCEFGGH ABBCDGGGH CFHGEDCBA
759,DGGGFEDBA DDCCCCBHH HHFCBBBCC DAACEFGGG DDCCCBBGH CBAADGGGG HGFDCCCBB GHGFBCBDA GGGGDCBAB BBBCCDFHH AABDFFGGG BBCBCDFGH HHHFBBBBB ABCDEFGGH FFHGFDCAA
760,FGGGEECBA HHFEDCCBA FHDCCCCCC AABCEGGGG GGGFFECAA GGGHCBBBB ABCECDGGG AAFEEFFFG EFFFFFFAA AACEGEDGG AABCEFGHH DBBBCEFGH BBBBCFHHH ABBDEFGGH BEHGFDCBA
761,DGGGFEDBA HHFEDDDBA DAADFFGGG HHGBBCCCC HHGEDCBBA AADEFFGGG AABCDFGGH AABDEFGHH AABCEFGHH BBCBDDGHH HHGFCBBBB BBCCDDFGH HHGBBBCCC ABBDEFGGH AADEFFGFH
762,GFFGGFCAA HHFEDCCBA HGCABDEFF AABCDFGHH FGGGFECAA HHGDCBBBB HHEFDACCC FFEAADFGG ABEEFFFGG BCCCCDDHH BBBCCCFHH CBBBBDFGH BCCCCCDHH ACBDDFGGG FGHFEDBBA
763,DGGGFEDBA CCCCCCCHH DAADFFGGG HBBCDDEEE HHGEDCBBA BCAADGGGG ABBCDEGGH ABBCDEGHH ABBCDFGGH BBCBCCFHH EEFGGFFBA EBBBCDEGH AABCEFGGH HCCCCDDDD AADEEFGGH
764,HGFFFDCBA HHFEDCCBA HEBBBCDFF AABCEGGGG FGGGFECAA HHFDCBBBB FGGBCDFFA FFGEFFFAA FGGGGCAAA BCCCCDDHH BBBCDDEGH ABBCDFGGH AABCEFGGH AAACGGGGG HEFDDCCBB
765,GFFFFECAA FEDDDDCHA HHGBABCDD ACDEEFGGG DDDDDCCCH HHGECBCBB DEEFBAEGG AEEFHFEEE HCCCCCCCG BCCCCCDHH BBBFDFFHF BBCFDBCEH BBBBEGGGG ABBDEFGGG EGHGEDCBA
766,DGGGFEDAA GHFEEEDBA GBABDEFGG HHGBBCCCC HHGEDCBBA AEDDEFFFF GBABFFFEF GHBEDDDCC HGGFEDBAA DCBDGBCHH AABCDEGHH ABCCDEFGH EEEEFFFFA ABCDEFGGH AADEEFGGH
767,DGGGFEDBA EEDCCCCBH HGDDDCBBB GHGABCDDD EEDDCCBBH CBAADGGGG HGGGDABBB HHGCCCCBB EFGEAABGG AABDGGGGF BABCDEFHH HCCCCCCDD AABCEFGGH ABBDEFGGH AADEFFFFH
768,DGGGFEDBA HHFEDDDBA AHGGEDDCC DFHGABDDD HHGEDCBBA AADEFGGGG FGHDEDBBB HGFGDBBBB BBBCDDFHH DBBCBCFGH ABEFEEFGG AACCDEFGH HBCCCDDDE ABBDEFGGH AACDEFGGH
769,HGFEDDCBA AADFGGGFF EAADFFFGG GHHFBBBBB AAADFGGGG HEBABEFFF FFEEGFEAB GGDBADEFG GGEGFDACA ABCCCEDHH AABCEFGHH BBBCCEFGH HHGBBBCCC ABBDEFGGH AADEFFGFH
770,EEEEEFCGA EDHFCCCCC CECABCEHH AABDEFFHH GHGFEDCAA HHGECBBBB AABDEFGGG GHHFCBBBB BCDDDDDDH CCCBCCEHH AAADGGGGG BBBCCDEGH AABCEFGGH ABBDEFGGH ACHGFEECC
771,DGGGFEDBA HHFEDDDBA AHHFEDCCC CEHGACDED HHGEDCBBA AACDFGGGG GGGGFDBAA HGFFECBAB GFEEFEFCA GGCBBBDDH ABBCDFGHH GCBCDCBDH FFFFGGBAA ABBDEFGGH AADEFFGGH
772,FFHGEDCBA HHFEDCCBA GGHCBCCCC ABBBEGGGG FGGFFECAA FFGHCBBCC CGCFGDACE AAFFFFFFF HDEEEEGBA EEEEEEFAG BBBCDHGFF CBDFBCDFH CCCCDDDEH ABBDEFGGG EGHGEDCBA
773,DGGGFEDBA AABGGGFFE GGFGGCAAB AACDFGGGG BAACGGGFF EBAADGGGG HGFECBBDB HGGGDBBBA CBBDHGBEF DACCDDGHG AABCDEGHH ABBCDEFGH HHGBBCCCC ABCDEFGGH AADEEFGGH
774,GGGFFDBBA HGFEEEDAA DDCABDFHH AADEEFGGG FGGFFEDCA HHGFDBBBB HBDFGGCAA GGGGDBBBB FFGGGCAAF HBBBCCCHG BBBCDDFHH AABCDFGGH AABCEFGGH AAACGGGGG FGHFEDBBA
775,DGGGFEDBA HHFEDDDBA AHHFDCCCC CEHGACDEE HHGEDCBBA ABCDFGGGG HHGFECBAA HGGEEDCAA HHFDDDBAC EDCBBBEHH ABBCDEGHH CBCCCDEGH FFFFGGBAA ABBDEFGGH AADEFFGGH
776,GGGGFECAA HHFEDCCBA HHGBBBCCC AABCEGGGG GGGFFECAA DDGHDCCCC CADGGBDFF ACFFFFFCF CHCCCGECC BCCBCCEHH CCCEDEEHC ACCCCDEGH AABCEFGGH ABBDEFGGH BEHGFDCBA
777,DGGGFEDBA HHFEDDDBA DAADFFGGG HHGBBCCCC HHGEDCBBA ACDEFFGGG AABDEGHGG AABDEFGHH AABDEFGGH ABCCDDFHH HHGFDCBBA BBBCDDFGH GGGGGCAAB ABBDEFGGH AADEFFGFH
778,CGGGFEDBA DDCCCCCHH GBABDEFGG HABCDEEEE DDCCCBBHH EBAADGGGG HFEDFFBAD HHGDDDCBA HHDEFCBBB CCBBCCFHH AABCDEGHH ABCCDEFGH FFFFGGBAA ABCDEFGGH AADEEFGGH
779,GFFFFCEBA HHFEDCCBA HEECBCCDD AABEFFGGG GGGGFECBA DFHECCCCC CCDBBFGGG EAAFFFFFF GGGGEBBBB FGGCCCEDC CADDEDCHG BBCECCEGH BBCCDDEEH ABBDDFGGH CFHGEDCBA
780,HHFFEDCBA AADFGGGFF DAADFFGGG FFGGGDAAA CBBBCFGHH HFBABEEFE CACADFGGG GGGEFBAAF BCGBBBFGG CCBBCCEHH AABCDEGHH BBCCDDEGH AABCEFGGH HBBBCDEFF AADEFFGGH
781,DGGGFEDBA HHFEDDDBA FBABDFFGG HHGBBCCCC HHGEDCBBA AEDDEFFFF GGBCCDBCH HFEDDCCBB GAGFFEDCC BBBBDDGHH AABCDEGHH ABCCDEFGH HHBCCCCCD ABBDEFGGH AADEFFGFH
782,HFFGEEDAA HHFEDCCBA HGEBACDEF AABCDEGHH FGGGFECAA GGGGFBBBB HGEEDBCDA GGHGDBBBB HBCCDDDDD BCCCCDDHH BBBCDDEHH BBCCCDEGH CCCCDDDDH ACACFGGGG FGHFEDBBA
783,DGGGFEDBA GHFEEEDBA AAFGGFEDD BCFHHEBBB HHGEDCBBA BBBBCFGHH ADGGGFECB HHFDCCCCA HGEEEDBAA CACCCDGHH AABCDEGHH AACFGGFFF ABBCDEFGH GGGGGDAAA ABDEEFGGH
784,DGGGFFDBA HHFEEDDBA AABFFGGGG EEFGGHCAA HHGEDCBBA AAACFGGGG GAAFFFEDF DDCEHEBAG FFEDDCBAH CCBBCCFHH AABCDEGHH ABCCDEFGH EEEEFFFFA ABBDEFGGH AADEEFGGH
785,HGEFEEDBA HHFEDCCBA FAABDEGGH AABDEFGGG FGGGFECAA HHHDCBBBB HHEFDACCC GGGFGCAAB ABEEFFFGG HGBBBBCGG BBBCDDFGH ABCDEEFGH AABCEFGGH AAFFFFFFF FGHFEDBBA
786,DGGGFEDBA CCCBBBGHH FBABDEFGG AACDFGGGG CBBBBEHHG EBAADGGGG HGEEEEDAD FFEDDCHCA HGFFEDBAA CCCDBBGHG AABCDEGHH ABCCDEFGH HCCCCDDDE ABBDEFGGH AADEFFGGH
787,DGGGFEDBA CCCBBBGHH FBABDEFGG AACDFGGGG CBBBBFHHG EBAADGGGG HGFCCEBAD HHGEEDCAA FFFFEGCAA DCCBCCGHF AABCDEGHH ABBCDEFGH HCCCCDDDE ABBDEFGGH AADEFFGGH
788,DGGGFEDBA DEDCCCCBH FBABDEFGG HHBBCDDDD HHGEDCBBA FBAADFGGG HGEFEAACD FEBHGCBBD GGFFBBDCC CCCBCCEGH AABCDEGHH ABCCDEFGH HHHFBBBBB ABBDEFGGH AADEFFGGH
789,DCCCCCCHH AFFGGFEBB DAADFFGGG FABCDEEEH ACFGGGEDB HEAABEFFF EADADEDGH GFBBFCAFG DHHCCCCBC CCBBCCEHH AABDEEGHH BBCCCDFGH HHGBBBCCC ABBDEFGGH AADEFFGFH
790,DGGGFEDBA DDCCCCCHH FBABDFFGG HHABCDDDD DDCCCBBHH EBAADGGGG HGFDCCBDB CEAFFFFEE EEDCCBBGH BABDEEHGG AABDDEGHH AACCDEFGH AABCEFGGH ABBDEFGGH AADEFFGGH
791,DGGGFEDBA HHFEEEDBA AAEFFFFGG EFGGHDAAA HHGEDCBBA AAACFGGGG HHEFCCBBC AHGFFEDCC GGGBDFEBA BBCBCCGHG AABCDEGHH ABCCDEFGH AABCDFFGH BABCEFGGH GGGFEDBAA
792,DGGGFEDBA GHFEEEDCA AEDEEFFFF GGHFBBBBB HHGEDCBBA ADDDEFFFF EFAEEEFDF CCCDEAFGG HGGFEDBAA CCBBCCFHH AABCDEGHH ABBCDEFGH AABCDFFGH GGGGDBBBB DGHGFDCAA
793,GFFGFEBAA HGFEEDDCA ACBBCEGHH AABEEFGGG FGGGFECAA HGFFDBBBB BEHGDBCDC HHHEBBBCC GHHFBBBBB BCCCCDDHH AABCEEGHH CCCCCCEGH BBBBEGGGG ABACEFGGG FGHFEDBBA
794,DGGGFEDBA HHFEEDDBA AEDEFFFFF GGHFBBBBB HHGEDCBBA AAACFGGGG GCAACGFFG HDCGDDCCC GHEEEABCC GCBBBBEHH AABCDEGHH ABCCDEFGH AABCDFFGH AABDEFGGH AADEEFGGH
795,CCCCCCEGH HHFEDCCBA FFEFGGEAA ABBCDGGGH GGGFFECAA HDAACFGGG FBABEFGGG EDDBBCBFH FFFFFFFBA BBBBDEGGH FGGGGFBAA EBCBCCEGH AABCEFGGH ABBDEFGGH ABEEEFEHB
796,DGGGFEDBA CDCCCCCHH GCABDEFGG HABCDEEEE CCCBBBGHH FBAADFGGG HAAEEEEEE BGABGFFFE HGGFEDBAA CCBBCCFHH AABCDEGHH ABCCDEFGH AABCDFGGH HCCCCDDDD AADEEFGGH
797,FHGGEDCBA HHFEDCCBA HHHBBBCCC AABCEGGGG GGGFFECBA DDFHECCCC ACECEGGGG BAAFFFFFG ABEFFFFGF HHCCCCDFA BACDDEFGH BCBDCDFEH ABBDEFGGH ABBBFGGGG BEHGFDCBA
798,GGFGFDCAA HHFEDCCBA HGBABDEFF AABCDFGHH FGGGFECAA HHGFCBBBB HEGEBCEEA GGGFGCABB ABEEFFFGG FBGDABFGF BBBCCDFHH ABCCCDEGH CCCCDDDDH BBCFGHGDB HGGFECBBA
799,HGFEDDCBA AADFGGFFF DAADFFGGG FFFGGFBAA CCBBBDGHH HFBABEFFF AABCEFHGH HHDBBBCCH CCDDDDCCH EBBBBCFHG AABCDEGHH BBBCCDEGH AABCEFGGH HCCCCDDDD AADEFFGGH
800,DGGGFEDBA HHFEEDDBA HHGDCBBBB CFGABEFGG HHGEDCBBA AACEFGGGG HHGFECBBA HGFFECCAA ACBCDEEGH BCBBBDGGH BBBCCEGHH FGEDBABEH FFFFFFFAA ABBDEFGGH AACDEFGGH
801,DGGGFEDBA EEDCCCCBH FBABDFFGG HHBBCDDDD EDDDCCCBH EBAADGGGG HFBBBDEDE FEAEEGFDA HBBADGFEF DDBACCFHH AABCDEGHH ABBCDEGGH HBCCCDDDE ABBDEFGGH AADEFFGGH
802,DGGGFEDBA DDCCCCCHH FBABDEFGG HABCDEEEE EDDDCCCBH EBAADGGGG HGEDDDDAC HFEDDCCBB DHGCBBFFB BECABCGHG AABDDEGHH ABBCDEFGH HBCCCDDDE ABBDEFGGH AADEFFGGH
803,DDDDCCCCH ADEFFFFEE EAADFFGGG GHHFBBBBB AAADFGGGG HFBABEEEF BBBBCFHHH HFFEECBBB AABDDFGGG CCCBCCFHG AABDDEGHH BBCCDDEGH DEEEFFFGA AABDEFGGH AADEFFGGH
804,DGGGFEDBA HHFEEDDBA AABFFFGGG EEFGGHCAA HHGEDCBBA AAACFGGGG HDBAAEGFG FGGACEDDD GFEDDCBHB EDDCDBCFH AABCDEGHH ABCCDEFGH EEEEFFFFA AABDEFGGH AADEEFGGH
805,HGFEDDCBA AADFGGGFF DAADFFGGG HHGCBCCCC AACEGGGGF HEAACEFFF ACCDEHHFB EHFFBCCCC GHFBBCCFC GDBCBBDHG ABBCDEGHH BBBCCDEGH EAABDFFGH ABBDEFGGH AADEFFGFH
806,GGFGFDBAA HGFEEDDCA ECBABDFHH AADEEFGGG FGGGFECBA HGEDCBBBB FGHGDDBDA GGGGDBBBB DEFFFFFAE GHFABBBFF BBBBEFGGH ABBCDEFHH AABCEFGGH ABBDEFGGH ABFCGFFED
807,HCFEEDCBA CCCBBBGHH GFFFGGBAA AACDFGGGG AGFFFFEDC EBAADGGGG HGFBBBDBD HGGFEDCAA GGGFFFBAA DCBBBCGHH GGGGGCAAA DBCBCCEGH AABCEFGGH ABBDEFGGH ABEEEFEHB
808,GGGGFDCAA HHFEDCCBA FHDCCCCCC AABCEGGGG GGGFFECAA FGHDCCBCC ACHFDDEFB DEAGEDDGE BCEHGCCCC BFCGEBCGG AABDEFGGG ECCBCCEFH BBBBEGGGG ABBDEFGGH CFHGFDCBA
809,HGFEDDCBA AADFGGGFF DAADFFGGG HBBCCCDFG BFGGGFDBA HDAACFFFF AEDCCCHEH CHBBDFFCF EDBCEGDDH GDCABCFGG AABCDEGHH FEFFFFFEA AABCEFGGH ABBDEFGGH AADEFFGFH
810,HFFFFEDAA HHFEDCCBA HGDABDEFF AABCDFGHH FGGGFECAA GGGGFBBBB HFCEFCBBB HFFECDCBB EFGGGCAFA BCCCCDDHH BBBCDDEHH ABCDDEFGH AABCEFGGH ACBEFGHFD HGGFECBBA
811,DGGGFEDBA GHFEDDDBA AAEFFFFGG EFGGHDAAA HHGEDCBBA AABEFGGGG HGDCCCCBC AHGFFEDCC FFEEEDDHA CEBBBBGHG AABCDEGHH ABCCDEFGH AABCDFFGH ABCDEFGGH AADEEFGGH
812,DGGGFEDBA HHFEDEDBA AAEFFFFFG FGGHEBBBB HHGEDCBBA AABEFGGGG GEGDAADFF GGDAEEDDC HHGFCBBBB CEBCCCGGG AABCDEGHH ABCCDEFGH EEEEFFFFA ABBDEFGGH AADEEFGGH
813,DGGGFEDBA CCCCCCCHH DAADFFGGG HHBBCCDDD HHGEDCBBA BCAADGGGG AABCDFGHH AABCEFGHH AACDEFFGH BBCDECEHG GGGGFCBAA BBBCDDFGH GGGGGCAAB ABBDEFGGH AADEFFGGH
814,DGGGFEDBA HHFEDDDBA AACHHFEED CDFHHEBBB HHGEDCBBA AABDFGGGG ABDFFGGGE HGDDCDCAC ABCFEGHED AABDFFGGG AABCDEGGH HHGEBABBD EEEEFFFFA ABBDEFGGH AADEFFGGH
815,HCFEEDDAB AABGGGFFF HHGCBBCCC ABBCCEGHH FGGGFECAA EBAADGGGG HDAADDEDF FBCAEGEGE EDGHGCABB EEEEDEDHA HGCCCCCCC CCCCCCEGH AABCEFGGH ABBDEFGGH ABEEEFEHB
816,HGGFEDCBA AADFGGGFF DAADFFGGG HHGCBCCCC AACEGGGGF HEAABEFFF DABBCGHFH GGGDEEACE BEBBBDGHH EEEBABCGH AABDDEGHH BBCCCDFGH HHHFBBBBC ABCDEFGGG HGGFECBAA
817,DCCCCCDGH GHGFEDBAA GGGGGBBAB AABEFGGGG GGGFFECAA GCAACFGGG HCACDFEGD EDDBBBFGH BAGGEDGBE DEEDDECHA HHHEBBBBB CCCCCCEGH AABCEFGGH ABBDEFGGH ABEEEFEHB
818,HGFEDDCBA AADFGGGFF DAADFFGGG FFGGGDAAA CBBBCFGHH HFBABEEEE AABCEFHGH HHGCCCCDA BADGEEGFF DDCBACFHH AABDDEGHH BBCCCDEGH AABCEFGGH HABCCDEFF AADEFFGGH
819,DGGGFEDBA GHFEEEDBA AACFFGGGG FFGGGDAAA HHGEDCBBA AABDFGGGG AABDEFGGH ABBCDFGGH AACCEFGGH ABBCEFGHG AABCDEGHH HHGECBBBB AABCEFGGH GGGGGCAAA ABGHGFECD
820,FGHFEDEAA HHFEDCCBA GHDCCCCCC AABDFGGGG GGGFFECBA DDDGHDCCC BBCCHGEEE DABHEEEEE BGECGGCAF HACBEEFGC BBDCDDDHG BDCBDCEGH AABDEFGGH ACCDDFGGG BEHGFECBA
821,DGGGFEDBA CCBBBCGHH DAADFGGGF AACDFGGGG EDDCCBBFH EBAACFGGG BBACEFFGH ABBCEGGGH AADDGFFGH FEEEEEFEA HFECBBCDD ABCCDEFGH AABCEFGGH ABBDEFGGH AADEFFGFH
822,DGGGFEDBA DEDCCCCCH FBABDEFGG HHBBCDDDD HHGEDCBBA FBAADFGGG HFDCCCCCC ABHDCFFEE EHCCCFDFB CCBBBDFHH AABCEFFHH ABCCDEFGH GGGGGCAAB ABBDEFGGH AADEEFGGH
823,GGGGFDBAA HHFEDCCBA ABDCDFGGH AABEEFGGG FGGGFECAA HGFFDBBBB BDGEEFDDD GGGEEDCCA GCHHEBBBB BCCCCDDHH AABCDFGHH CCCCCCEGH BBBBEGGGG BCACEFGGG FGHFEDBBA
824,AHEGFFDDA HHGCBCCCB CBAADGGGH ABCDEGGHB HHGFDCBBA GHHGDBBBB GBDFGHDAB BHFFECCDD GHHEBBBBC FFCDDFCGA BABBFGGGG ACCDEEFGH AABCDEFGH ABADEFGGG DFGEECDAG
825,HGFEDDCBA AADFGGGFF DAADFFGGG HHGCBCCCC AACEFGGGF HEBABEFFE AADFDEFFH HEFCCCFBC FEBGFBCEF CDBBBCEHH AABCEEGHH ABCCDDFGH FFFGGGBAA ABBDEFGGH AADEFFGFH
826,DGGGFECBA EEDCCCCBH FBABDFFGG HHBBCDDDD HHGEDCBBA FBAADGGGG GGFGEDBAB FBHEEDDCC HEEDDBCCC DACCCCFHH AABCDFGHH ABBCDEFGH HBCCCDDDE ABBDEFGGH AACDEFGGH
827,DGGGFEDBA HHFEDDDBA ABBCHGGFE BCEGGHDBB HHGEDCBBA BBBBDGGGG ACFGGGECC HHFEDCBBA HGGFDDDAA CEDDDBCGH BBBCCDGHH HHDBBBCDH EEEEFFFFA ABBDEFGGH AADEFFGGH
828,BBBBCEGHH HHFEDCCAA FEDEFFFFA ABCDDEEGH DFGGGFDBA HFBABDEEE EEFGEGCAD HHCDEBBCC AFFFFFFFA CCBBCCGHH AABCEEGHH BBBCDDFGH FFFGGGBAA ABCDEFGGH AADEEFGGH
829,DGGGFEDBA HHFEDDDBA ABBCHGGFF BCEGGHDBB HHGEDCBBA AABCFGGGG ACEFGGFDB HGFFECABB HCFFFEFCA CCCCDBEGH BBBCCDEHH HHFCBBBBE ABBCDEFGH ABBDEFGGH AADEFFGGH
830,DGGGFEDBA GHFEEEDCA AAEFFFFFG EFGGHDAAA HHGEDCBBA BBBBDGGGG FBABFGGFG BBCGGGGFA BBBBEHGGG CCBBCCFHH AABCDEGHH ABCCDEFGH AABCDFGGH GGGGGCAAA AADEEFGGH
831,DGGGFEDBA EEDCCCCBH HHFDCBBBB EEABCFGGG FEDDCCBBH CBABDGGGG HHFEECBAA HHGEDCBBA GGGGECAAB BBCCCCFGH AAEFFFFFF ABCDEFEGH HCCCCDDDE ABBDEFGGH AADEFFGFH
832,DGGGFEDBA HHFEEDDBA AABFFGGGG EEFGGHCAA HHGEDCBBA AAACFGGGG GAGEEEDBE AABGGGFEE FFEEEDDGA CCBBBDGHG AABCDEGHH ABBCDEFGH EEEEFFFFA ABBDEFGGH AADEEFGGH
833,DGGGFEDBA HHFEEDDBA AAEFFFFFF GGGHEBBBB HHGEDCBBA AABDFGGGG ABCCDFGGH AABCEFGHH AACFGEEFH ABCCDDFHH AABDEFGHG HGDCBBBCE ABBCEFGGH HHGBBCCCC AADEFFGGH
834,DGGGFEDBA DDCCCCCEH DAADFFGGG HHBBCCDDD HHGEDCBBA ADCCEFGGG ABBCDEFHH ABCCDFGHH ABBCDFGGH BCABEDEHH EEFFGGFBA FCBBBCDGH AABCEFGGH AABDEFGGH AADEEFGGH
835,DCCCCCDGH GHGFECBAA GGGGEBBBB ABCEFFGGG GGGFFECAA GCAACFGGG HBBBCDEDF HDGFFFBAC BBDFEBGGH EEDDCEDHB HHHEBBBBB CCCCCCEGH AABCEFGGH ABBDEFGGH ABEEEFEHB
836,HGFEDDCBA AADFGGGFF DAADFFGGG HHGCBCCCC AACEFGGGF HEAABEFFF GCBBDCEFH FCFCCADFH FHGDABEDD CDGCABDGH AABDDEGHH BBCCCDEHH HHGBBBCCC ABBDEFGGH AADEFFGFH
837,HCFEEDCBA BBACGGGFE HHGEBBBBC BBCCDEEGH FGGGFECAA EBAADGGGG HGEBABDDE FFGHEDBBA HHFFDBBAB DDEEEFDHA HHHEBBBBB CCCCCCEGH AABCEFGGH ABBDEFGGH ABEEEFEHB
838,DGGGFEDBA HHFEDDDBA ABGHGEDDD CDGHFBCCC HHGEDCBBA AABDFGGGG CFHGFDCBA HHFDDDBAB HHGCBCCBB CBBBDEGHF AABCFGGGG BBCCCDEGH GGGGDBBBB ABBDEFGGH AACDEFGGH
839,GGGFFDDAA HHFEDCCBA HABBDEFFG AABDFFGGG FGGGFECAA HGEECBBBB HHDFGCBBB GGHGDBBBB ABEEFFFGG EFFFBCBEE BBBBDFGHH CCCCCCEGH BBBCCCGHH BBBCCEGHH AABCEFGHH
840,DGGGFEDBA HHFEDDDBA AABDGGGGG EFFGGGBAA HHGEDCBBA AABDFGGGG AABCEFGGH AABCEFGGH ABBCEFGGH BCCBCCEHH FFFGGGDAA GCBBBCDFH EEEEFFFFA ABBDEFGGH AADEFFGGH
