,0
337,DGGGFEDBA DDDCCCCCH DAADFFGGG HHBBCCDDD FEDDCCBBH ECAACFGGG AABDEFGGH AACDEFGGH ABBCDFGGH DFEABBEHG HHGFECBAA ABCCDDFGH GGGGDBBBB ABBDEFGGH AADEFFGGH
338,DGGGFEDBA HHFEDDDBA AEDEFFFFF GGHFBBBBB HHGEDCBBA AADEFFGGG GCABFFFEF GGFGFBBAD HGFFEDBAA FFDABBEGH AABCDEGHH ABCCDEFGH FFFFGGBAA ABBDEFGGH AADEFFGGH
339,DGGGFEDBA DDCCCCBHH HHFCBBBCC EDABDFGGG GFEDCBBBH ABBBEGGGG HGFFECBBA HGEDDCBBC GDDCAAFGH BBBBDEEFH AABEFGGGG ABCCCDEHH HHHFBBBBB ABBDEFGGH AADEFFGGH
340,DGGGFEDBA DDCCCCBGH HHECCBBCC FEABDFGGG FEDDCCBBH CBABDGGGG HGGEDCBAA HHFDCCBBC GHCDBADEG BBCCCDEGH ABCEDEGHH FFFFFFFAA AABCEFGGH ABBDEFGGH AADEFFGFH
341,CGGGFEDBA GHFEEEDBA AAEFFFFGG EFGGHDAAA HHGEDCBBA AADEFFGGG GDEBFBDEF FHEDDCCBB GGFFEEDCA CCBBCCFHH AABCDEGHH ABCCDEFGH FFFFFFFAA ABBDEFGGH AADEEFGGH
342,GGGFEECBA AADFGGGFF EAADFFGGG GHHFBBBBB AAADFGGGF HEBABEFFF AAGGFFFFC DDDBBCCHH GHHFBBBBB BBCDBCEHH AABDDDFHH BBBCDDEGH GGGGFBAAB ABBDEFGGH AADEFFGFH
343,HGFEDDCBA AADFGGGFF EAADFFFGG GGHFBBBBB AAADFGGGG HFBABEEEE DCAADGGGG FFFDDBCAH AFFFFFFEA BBBBBEFHH AABCDEGHH BBBCDEEGH DDEEFFFGA AABDEFGGH AADEFFGGH
344,HGFEDDCBA AADFFGGFF DAADFFGGG HHDBCCCCC ABDFGGGFE HEAACEFFF BEADHFEEE ACCCFGGGG EFFFFFEEA ABEDECDHH AABCEEGHH BBBCDDFGH HHHFBBBBC ABBDEFGGH AADEFFGFH
345,DGGGFEDBA CCBBBFHGG FFEFFFFAA AACDFGGGG CBBBBFHHG EBAADGGGG HECBDCBDE AEGHDDCGB DCBBAFHGG FFDAADFGG AABCDEGHH HHGCBBBCC AABCEFGGH ABBDEFGGH AADEFFGFH
346,GGGGFECAA HHFEDCCBA DFHDCCCCC AABCDFGHH GGGFFDCBA DDDGHDBCC ADCBDGGGG CBAFFFFFF ABFFFCEGF EBBBBFEGH BABCDEFHG BDCBCCEGH ABBCEFGGH ABBDEFGGH ADHGFEDCB
347,DGGGFEDBA HHFEDDDBA FBABDEFGG HHGBBCCCC HHGEDCBBA FBAADGGGG HBEDDDCCD HFGBDDCCC HGBBEDEBE DDCABDFGH AABCDEGHH ABCCDEFGH HHHFBBBBB ABBDEFGGH AADEFFGGH
348,DCCCCCDGH GHGFECBAA HGGGDBBBB AACEFFGGG GGGFFECAA GCAACFGGG AAEGHFDDE GBCAAEGGG EAABFGGFG DDCBBCFGH HHHFCBBBB DBCBCCEGH AABCEFGGH ABBDEFGGH ABEEEFEHB
349,HEGEFEDBA HHFEDCCBA HGCABDEFF AABCDFGHH FGGGFECAA GGFFGEBAA HGGDECBBB HGFDCCCCA HHEEEEBAA DDDBBDEHH BBBBCDGHH BBCCDDEFH BBBBBFHHH ABADEFGGG FGHFEDBBA
350,GFGGEEDBA HGFEEDDCA ACBBDFGHH AACDEFGGG FGGGFECAA HGFFDBBBB BDFEBBDDH DDFABDEGH HHEEEEBAA ABFDDFCEH AACFFFFGG CCCBCCEGH AEEEFFFFF HHEFEDCBA HGGFECBBA
351,DGGGFEDBA CCBBBCGHG HHFCBBCCC AACDFGGGG CCBBBDGHH DBAADGGGG HGFEDCCAA EDAADEGHE HFFECACCD ABBCDDGHH AACEFFGGG BBCCCDEGH GGGGDBBBB ABCDEFGGH FFHGFDCAA
352,GGGGFECAA DDDGHDCCC FEDAABFHH AABDEFGGG EEDDDHFBB HHGECBBBB CDCCCDFHC EEGABCEGG ABEFFFFFF CCCCDDFBH BABDEFEGH ABCCEDGFH AABFFFGGG ABBDEFGGH ADHGFEDCB
353,HEEFGDDBA HHFEDCCBA HGDABDEFF AABCDFGHH FGGGFECAA HGGGCBBBB HGGEECCCA GGGFGCABB FGGGGEBAA ABCGGDBGG ABBCDEGHH CCCCCCDGH AACDEFGGH CCCCDDDDH GACGGFEEC
354,HEGGGDBBA HGFEEDDBA ACBBDFGHH AACDEFGGG FGGGFECAA HFFECCBBB EABCDFGGG GBBDEFHDC ABEEFFFGG BCCCCDDHH BBBBCEGHH CBBBCDFGH BBBBBFHHH FHFGFECAA HGGFECBBA
355,DGGGFEDBA DDCCCCCHH HHFCBBBCC EABDEFGGG DCCCBBEHH DBAADGGGG HGFEDCBBA GHDCCFEBA HEEFGEABB BBCCDDEHH ABBCDEGHH DBBBDDDFH AABCDEFGH HCCCCDDDD AADEEFGGH
356,DGGGFEDBA HHFEDDDBA GBABDEFGG HHGBBCCCC HHGEDCBBA AEDDEFFFF HECBEDBBF EDAFHHDBB EEFGGFBBB BBBDCCGHH AABCDEGHH ABBCDEFGH GGGGDBBBB ABBDEFGGH AADEFFGGH
357,HGFEDDCBA AADFGGGFF DAADFFGGG GGGHEBBBB BBABEGGHG HFBABEFEE AABFGEGEH DEHFBCCCC EFFBAFEEE BFDBBBDHH AABCDEGHH BBBCDEFGH FFFFGGDAA ABBDEFGGH AADEFFGGH
358,EHHGDBACB EEDDCCCHB HHGBABCCE AAEEFFGGG FGGFFEBAA FGHCCCCCC FACHEBCCH BCGGGGCBB HCCCCCHEC BCCCCCDHH CCDEEFDAH CGBBBCDFH AABCEFGGH AEEEFFFFF AABCEFGGH
359,DGGGFEDBA CCCCCCCHH DAADFFGGG HBBCDDEEE EEDDCCCBH FCAACFGGG ABBCDFGHH AACCEEFGH AACDDFGGH ABCCCDFHH EEFGGFDAA HGDBBBCDG AABCEFGGH HHCCCCCCC AADEEFGGH
360,GHGFEDCBA AADFGGGFF EAADFFFGG HHHEBBBBB AAAEFGGGG HFBABDEEE DCEGHDCBC HHDBBCCCC FFGGGCDAA BBCBECFHG AABCDEGHH BBCCCCEGH AABCEFGGH HHGDBBBBB AADEEFGGH
361,GGFGFECAA DDDCCCCHC HHGBABCDE AADEFFGGG FFFFEEDFA HHGFCBBBB CBBEGCCDH BBDGHDGDC GACEHGBAE FEADFCCHC DBBDDCGFH CCCCCCDDH AABCDFGGH ABBDEFGGG DGHGEDCBA
362,DGGGFEDBA EEDCCCCBH DAADFFGGG HHBBCCDDD HHGEDCBBA BCAADGGGH ABBCEEGHH AABEEFFGG BBBBEEHGH GGFFFCBCA HHGECBBBB ABCCDDEGH HHHFBBBBB ABBDEFGGH AADEFFGFH
363,GFFFFECAA FFEEDDHBA HHGBABCDE AABDEFGGG DDDDDDCBH GHGFCBBBB FBCDBCFFH AEFGEEGCE AEFDADFHF FEGDABFFC AAAFEFGGG BBCDDCEGH AEEEEFFFF ABADEFGGG FGHFEDCBA
364,GGFFFDBBA HGFEEDDCA ADBBCEGHH AACDEFGGG FGGGFECAA HGEECCBBB DEGHFDFAA HDECDDEEA DEFFABFFF BCCCCDDHH AABDEFGGG DCCCCCEGH AABFFFFGG ABADEFGGG FGHFEDBBA
365,DGGGFEDBA CCCCCCCHH DAADFFGGG HBBCDDEEE DDCCCBBHH FCAACFGGG AACCDFGGH ABBCDEGHH AECCEHHDC EFFEEEFEA HHDCBBCCD ABCCDDFGH HHBBCCCDD ABBDEFGGH BDHHGEDAB
366,HHFEDDCBA AADFGGGFF DAADFFGGG FFGGGDAAA CBBBCFGHH HFBABEFEE BBEGEFHCB HCEGDBBBG CCDDDDCCH BBCEBCFHG AABDEEGHH BBCCCDEGH EEEFFFGCA AABDEFGGH AADEFFGGH
367,HCFEEDCBA DDCCCCCFH EEDFFFGCA AACDEGGGG AAFGGGFED EBAADGGGG HGGGCBBBB FFECCACDH HCCDFGEBA CBCCCCFHG FFFFFGEAA AFBDCDEGH AABCEFGGH ABBDEFGGH ABEEEFEHB
368,GGFGFECAA EDDCCCCCH HFFBBBCDD AABFFFGGG GGGFFECAA HFDDCCCCC BBBBCFHHH FFFCACFFF ABEEFFFGG EEEEEACGG EDAGECEFF GBBBBCDFH AAACGGGGG ABBDEFGGG DGHGEDCBA
369,HCFEEDCBB BCBBCHHGE HGGFEBBBB AACDFGGGG CHFGFFDBA DBAADGGGG AABCCFHHH CBADGHECG GCEEFGFCA DCCDEEEHA GGGGFBBBB BDBCCCEGH AABCEFGGH ABBDEFGGH ABEEEFEHB
370,DGGGFEDBA DDCCCCCHH GBABDEFGH HHABCDDDD DDCCCBBHH EBAADGGGG HGECABCEF ABHDCFFEE FEEDDHEBB EBBDCBFHH AABCDEGHH ABBCDEFGH HHHFBBBBB ABBDEFGGH AADEEFGGH
371,BGFFFDEAE HHECCCCBB ABEEFFFFG CDDDGHDCB HFGFDCBBA HHGFDBBBB DAAFGECEG ABEFHDFDE AFCFGHECC DDDDDCEBH ACFFFFFFF ABBCDEFGH AABCDFGGH ABBDEFGGG DEGFECDAG
372,HDFEEECDA HHFEDCCAA HGGBABCDD AABBEGGGG FGGGFECAA EBAADGGGG HGEDCCBDA ABEEGGFDD HGFFDDBAB EEEEEFDGA ADBDEEGGG DCCCCCEGH AABCEFGGH ABBDEFGGH ABEEEFEHB
373,GHGFEECAA AADFGGGFF DAADFFGGG HHGCBCCCC AACEGGGGF HEBABEFFE ECAFGHECC ECDGHGDAA AEGFGGEBD BCCCCBGHG BABBEFGHH BBBCDEFGH GGGGGCAAB ABBDEFGGH AADEFFGFH
374,HDFEEECEA GHFEEDCCA FHGBABCDE ABCDEFGGG FGGGFECAA EBAADGGGG EDEDDDFHA HHGFEDBBA EEFEEEEGA FFFFFFEAA ADBEEEFGG CCCCCCEGH AABCEFGGH ABBDEFGGH ABEEEFEHB
375,DGGGFEDBA DDDCCCCCH GBABDEFGH HHBBCDDDD HHGEDCBBA AEDDEFFFF GCAACGGFG EEDCCGDBH GAGFFEDCC CCBBCCFHH AABCDEGHH ABBCDEFGH AABCDFFGH BABCEFGGH AADEEFGGH
376,DGGGFEDBA HHFEDDDBA AAEFFFFFF GGGHEBBBB HHGEDCBBA AABEFGGGG ABBCDFGHH AABDEFGGH AACDDFGGH ABBCDDGHH FFGGGFCAA BBBCDDFGH FFFFFFFAA ABBDEFGGH AADEFFGGH
377,CCCCCCDHH HHFEDCBAA GGGGEBBBB ABDEFFGGG GGGFFECAA GCAACFGGG DAAEFFHGD BCFGFBEGB EGGGFBBDA FFFFFFEAA ACBDEEGHH CCCCCCEGH AABCEFGGH ABBDEFGGH ABEFEFEHB
378,GHGFEDCBA AADFGGGFF DBADFFGGG GGGHEBBBB BBABEFGHG HEBABEFFF GDAGECEDE GCFACFCFG GCHHEBBBB BBBBCEFHH AABCDEGHH BBBCDDFGH GGGGEBBBB ABBDEFGGH AADEFFGFH
379,DGGGFEDBA HHFEEDDBA AACFFGGGG FFGGGDAAA HHGEDCBBA AABDFGGGG ABCDEEFGH AACDDEGGH ABBCDFGHH AABCEFGHH AACEFGHHB HFCBBBBDG AABCEFGGH HHCCCCCCC AADEFFGGH
380,DGGGFEDBA HHFEDDDBA AEDEFFFFF GGHFBBBBB HHGEDCBBA AAEEFFGGG HFCBBBBEG EEDFGCBAG HHFBDCCBC BBBCCEGHG AABDDEGHH ABCCDEFGH HBCCCDDDE ABBDEFGGH AADEFFGFH
381,BBBCDEGHH HHFEDCCAA DAADFFGGG HBBCCDDDG ACFGGGFDC HGCABDDDD GABCEFCGH GGFACCEGB EDBFFFFFA DCBBCDDGH AABDDEGHH BBBCDDFGH CCDEFGGHA AABDEFGGH AADEEFGGH
382,HFFFFDDBA HHFEDCCBA ABCCEFGGH AABDEFGGG FGGGFECAA HFEDCCBBB CEEDFCEEE DDFABDEGH HHCCCCCCC DDCBBCEHH BBBCCDGHH BBBCDDEGH BBBCCCGHH ACACEFGGG FGHFEDBBA
383,FFGGGEDAA HHFEDCCBA ABCCEFGGH AABEEFGGG FGGFFECAA HGEECCBBB HBEGHDBBB EFFDEEFGA EFGGGGBAA ABBEECEHH BBBBCFGHH BCCCCDEGH BBBBBFHHH EFBGGFEBA HGGFECBBA
384,DGGGFEDBA GHFEEEDBA GBABDEFGG HHGBBCCCC HHGEDCBBA BCAADGGGG HGFEECAAE FEBEEEHAC HCBDGGGBA BBCBDDFHH AABCDEGHH ABBCDEFGH AABCDFFGH BABCEFGGH AADEEFGGH
385,HGFEDDCBA AADFGGFFF DAADGFFGG EEFFGGFAA DCBBBCFHH HDBABEFGG FAABDEGGG EHFFBBCCC AABGGGFFF DDCACDDHH AABCDEGHH BBCCCDEGH AABCEFGGH HHCCCCCCC AADEEFGGH
386,DGGGFEDBA HHFEDDDBA AADFFFFFF GGGHEBBBB HHGFDCBBA AABEFGGGG AABCEFGGH ABBDEFGGH AABEFGGGG DGEDDBDGC HHFCBBBCC ABCCDDFGH CABCDFGGH ABBDEFGGH AADEFFFFH
387,DGGGFEDBA HHFEDDDBA DAADFFGGG HHGBBCCCC HHGEDCBBA BCAADGGGG ABBCEFGGH AACDEGGGH AACDEFGHF CBBBCDGHH HHFCBBBCC ABCCDEFGH HHGBBCCCC ABBDEFGGH AADEFFGFH
388,GGFGGECAA HHFEDCCBA ABCCDFGHH AABEEFGGG FGGGFECAA HHGDCBBBB GHEFDBDDA GGHGDBBBB DEFFFFFAE BCCCCDDHH BBCCCDFHH BBCCCDEGH BCCCCCDHH ABBCDEGHH AABCEFGHH
389,DGGGFEDBA HHFEDDDBA ADDEFFFFF GGHFBBBBB HHGEDCBBA ABDEFFGGG ABBCDFGHH AABDEFGGH AABCEFGGH CDCCCBDHH HHGFDBBBA BBBCDDFGH HHHFBBBBC ABBDEFGGH AADEFFGFH
390,CCCCCDDHH HHFEDDCAA DAADFFGGG GABCDEEEH ACFGGGFDB HGBABDEED BBBCDEHFH GGGFCDCBB DDCAEEDHE CCCBCCEHH AABDDEGHH BBBCCDEGH AABCEFGGH HDCCCCDDD AADEEFGGH
391,DGGGFEDBA HHFEDDDBA ADDEFFFFF GGGHEBBBB HHGEDCBBA AABEFGGGG ABBCDFGGH ABCCEEFHH AABCEFGHH BBCBCDGHH GGGGECBAA BBBCDDEGH GGGGDBBBB ABBDEFGGH AADEFFGFH
392,DGGGFEDBA HHFEDDDBA AAEFFFFFF GGGHEBBBB HHGEDCBBA AABDFGGGG ABBCEFGGH ABCDEFGGH ABBCEFGHH CCDDBBEHH EEFFGGFCA FCBBBCEGH EEEEFFFFA ABBDEFGGH AADEFFGGH
393,GGGGFECAA HHFEDCCBA DFHDCCCCC AABCDFGHH GGGFFDBAA DDGHECCCB AABGGFGGD AFHDDDEEE ABEFFFFFF CCCCFHBFG ABBCDEGGH CBCCCDEFH AABCEFGGH ABBDEFGGG ADHGFEDCB
394,DGGGFEDBA HHFEDDDBA AAGHGEEDD CDGHFBCCC HHGEDCBBA AABDFGGGG EFHGFEBBA HGGGDBBBB GDFEFEGBA BABBDEGHG BABCDEGHH FDBBBBDFH FFFFFFFAA ABBDEFGGH AADEFFGGH
395,AHFGFDDAD FFEHGBBBB BBBAEGGGG BCCCDDFHC HFEFEDCBA HHGECBBAB ACCFDFDGG HBFBCCDFF ABEFFFFGF AABFFGGHD AABFGGFGF HHGFDCBAA HHFEDCBBA HHGFECBAA HGGFECBBA
396,HEGGFDCBA GGFEEEDCA ADDABEFHH AADEEFGGG FGGGFECAA HGGFDBBBB GHCFGCBBB GGHGDABBB HBCCDDDDD CCCCCCCHH ABBDEFFGH DCCCCCDDH ABBCDEFGH ABADEFGGG FGHFEDBBA
397,DGGGFEDBA DDDCCCCCH DAADFFGGG HHBBCCCDD HHGEDCBBA ADDDEFFFF ABBCDEGHH ABBCEGGHG AABEEGGGG BBBCDDFHH DDEFGGGBA HHFCBBBCE AABCEFGGH HHHFBBBBB AACDEFGGH
398,DGGGFEDBA GHFEEDDBA AAEFFFFFF GGGHEBBBB HHGEDCBBA BBBBEGGGG AABDEFGHH ABBCDFGHH AABDEFGHH ABCCEEGHH AABDEFGHH HHFDCBBBC AABCEFGGH HHHFBBBBB AADEEFGGH
399,EGFFFEEBA FFEEEHDAA EEEBBCCCH AABDDFGHH DDDDDHEBB HHGGDBBBB HHGBBCCCC FFFFFFFAA CCCDDDDHE EEEEEEAFG ABECFFEGG CCCCCCEGH AEEEEFFFF ABBDEFGGG EGHGEDCBA
400,GFGFFDCBA HHFEDCCBA HHFCABCDD ABBCDEGHH FGGGFFCAA HHHECBBBB GGFFEDCBA GGGGDBBBB EFFFFFFAA GGFABBBGF AABCDEHHG ABBCDEGGH AABCEFGGH BBBBBFHHH GGGGEDBAA
401,DGGGFEDBA GHFEEEDBA DAADFFGGG HHGBBCCCC HHGEDCBBA ADDDEFFFF AABDEFGHH AACDEFGGH AACDDFGGH BBBCCCFHH CDEFGGGBA HHFCBBBCE AABCEFGGH HHGBBCCCC AADEEFGGH
402,DCCCCCDGH HHFEDDCAA FEEFFFGCA BABCCFGHH GGGFFECAA HDAACFGGG GBBBCDHDH AGGEEFBAE AGDCFFFEE EDBBBBFHG FFFFFFEAA BDBCCCEGH AABCEFGGH ABBDEFGGH ABEEEFEHB
403,GGFFFEDBA GGFEEEDDA ADCBCEGHH AADEEFGGG FGGGFECAA HGGFDBBBB ABDFGGHCB DDFABDEGH ABDEFFFGG CCCCCCDGH AAEEFFFGG CCCBCCEGH AEEEEFFFF ABADEFGGG FGHFEDBBA
404,DGGGFEDBA HHFEDDDBA AABFFGGGG EFFGGGBAA HHGEDCBBA BBBBCGGGH ABCDEFGGH AACDEEGGH ABCDEFGGH ABBCDEFHH DDEFGGFCA HEBBBBCEH AABCEFGGH ABBDEFGGH AADEFFGGH
405,HGFEDDCBA AADFGGGFF DAADFFGGG FFGGGDAAA CBBBCFGHH HFBABDEFF AABDFGFHF HGFBBBECC AFFFFFEEE BBBCDEDHH AABCDEGHH BBCCCDEGH EEEFFFGCA AABDEFGGH AADEFFGGH
406,HFFFEDCBA HHFEDCCBA ABCCDFGGH AABEEFGGG FGGGFECAA HHFDCBBBB GHEFDBDDA HHGBBBCCC ABDEFFFGG BCCCCDDHH BBBCCDGHH FECBBBCGH BBBBBFHHH ABBDEFGGG FGHFEDBBA
407,HGFEDDCBA AADFGGGFF EAADFFFGG GHHFBBBBB AAADFGGGG HFBABDEEE ACCBEFGHF DHFHEBBBC CEHDDDCCC BBBBCDFHH AABCDEGHH BBBCDDEGH ABBCEFGGH GGGGEBBBB AADEEFGGH
408,DGGGFEDBA GHFEEEDBA AABFFGGGG EEFGGHCAA HHGEDCBBA CCCCBBGHH ADCBDFFHG CGGFFFFAA AEEDDCGHC HBBACEEGG AABCDEGHH ABCCDEFGH AABCDFFGH HHGBBCCCC AADEEFGGH
409,BBBBCFGHH HHFEDCCBA GFFGGGBAA AABCEFGHH FGGGFECAA HEAACEFFE DABDFEDEH HHGCEECAC DAFGECDEG CDABCEGHH AABDDEGHH GGGGGEBAA AABCEFGGH ABBDEFGGH AADEFFGGH
410,DGGGFEDBA GHFEEEDBA AAEFFFFFF GGGHEBBBB HHGEDCBBA AABDFGGGG AABDEFGGH ABBCEFGGH ABBCDFGGH BBBBDEGHH AABCDEGHH HHGFDBBAB ABBCDFGGH FFFFGGBAA AADEEFGGH
411,DGGGFEDBA DDDCCCCCH DAADFFGGG HHBBCCDDD HHGEDCBBA BCAADGGGH ABBCDEGHH AADFHGFDF ABDCEGFGG FDDCBBBHH HHFCBBBCC ABCDDDEGH HHCBCCCCD ABBDEFGGH AADEFFGFH
412,GFGGFFCBA HHFDCCBAC HHGBABCDE AAEEFFGGG FGGGFECAA HEDDCCCCC HGEEFBBAB DAFEEEFFF CCADGFHED HBBBBFDFE CDBAEEGGG CCDBBDEFH BBBBEGGGG ABACEFGGG FGHFEDBBA
413,DGGGFEDBA EEDCCCCBH HHFDCBBBB EEABCFGGG HHGEDCBBA AADEFGGGG GGGGECBAA HGFFEEBAA HHFECFCAA BBDCBCFHH BBBCCDGHH GEDBCBBDH FFFFFFFAA ABBDEFGGH AADEFFGGH
414,CGGGFFDBA GHFEEEDCA AAEFFFFFG FGGHEBBBB HHGEDCBBA AABEFGGGG HFCADDDDE GGHDBBDBD GEAFFEDCC CCCBCCEHH AABCDEGHH ABCCDEFGH ABBCDFGGH GGGGGCAAA DFHHGECAA
415,GFFFFECAA HHFEDCCBA HHDCBCCCC AABCFGGGG FGGFGFCAA GGGGCBBBB HCGECEFAB DCABEFEHG AEACGGCFG AFBGDEGED BBCCDDDFH CEBBBCDGH BBBBEGGGG FGGGFDCAA HGGFECBBA
416,DGGGFEDBA HHFEDDDBA AAEFFFFGG EFGGHDAAA HHGEDCBBA AAACFGGGG HBCBBBFGG HHGEEDCAA HHGCCBBBF CCBBCCFHH AABCDEGHH ABCCDEFGH GGGGGCAAB ABBDEFGGH AADEFFGGH
417,HHGFEDCBA AADFGGGFF DAADFFGGG HHBCCCCCC ABEFGGFFE HDAACEFFF GFFCBBBDH ABDCEHHDD DABDDGEGH FECBBBDGH AABDDDGHH AADDDFGHE AABCEFGGH ABCDEFGGG HGGFECBAA
418,DGGGFEDBA GHFEEEDBA DCABDFGGH GGHFBBBBB HHGEDCBBA AAEEFFGGG DEACDDDGH HFAFFEDDC HGGFEDBAA BBBDDCFHH AABCDEGHH ABCCDEFGH ABBCDFFGH HHCCCCCCC AADEEFGGH
419,HGFEDDCBA AADFGGGFF DAADFFGGG HHGBBCCCC AACEGGGGF HEAABEFFF DDFDBCHCF BFEAADFHF FBBGECBEH FCBAEEGEH ABBCDEGHH EEEFFFFFA AABCEFGGH ABBDEFGGH AADEFFFFH
420,DGGGFEDBA HHFEDDDBA AAEFFFFGG EFGGHDAAA HHGEDCBBA AABEFGGGG HCEDDDCCC FDADDCCGH GGFFEEDCA BBACDDGHH AABCDEGHH ABCCDEFGH HHBBCCCCD ABBDEFGGH AADEFFGFH
421,DGGGFEDBA GHFEEEDBA AEDEEFFFF GGHFBBBBB HHGEDCBBA AAEEFFGGG GBBFFGFFA EEDCCBHCH HGGFEDBAA FCBBBBEHH AABCDEGHH ABCCDEFGH ABBCDFFGH HHCCCCCCC AADEEFGGH
422,HGFEDDCBA AADFGGFFF DAADFFGGG FFFGGFBAA CBBBBEGHH HGCABDDDD BACEEFHGG DABEGEGEG HHDDDABDD CCBBCCFHH AABDDEGHH BBBCDDFGH AABCEFGGH FFFFGGBAA AADEEFGGH
423,DGGGFEDBA DDCCCCCHH FBABDFFGG HABCDEEEE CCCBBBGHH EBAADGGGG HECBBECEG CBBAEHGGF HGFFEDBAA DDCBCCHGG AABCDEGHH EEEFFFFFA AABCEFGGH ABBDEFGGH AADEFFGGH
424,HGFEDDCBA AADFGGGFF DAADFFGGG HGBCCCCDC ABEFGGFFE HEBABEFFF FHDCDAFED EBBCGGEGB HBFDBDFBE EHGDCAADG AABDEEGHH BBCCCDFGH GGGGEBBBB AABDEFGGH AACDEFGGH
425,DGGGFEDBA HHFEEDDBA ABHGFEEDD BCGHFBCCC HHGEDCBBA AABCEGGGG GHGFEDBAA HGGFECBBA FEEBBGGFB EDDEDABGH ABBCDEGHH ACBDEEEFH ABBCDEFHH HDCCCCCDD AADEFFGGH
426,HGGFEDCAA HHEDCBBAG HGGBBBCDD AAEEFFGGG FGGGFECAA HEDDCCCCC GGBBGFCBE HBBCECFFC CEHDEBDDD ADDEBCDHH ABBCFFFEH DBDACFGGG AAACGGGGG ABADEFGGG FGHFEDBBA
427,FGGFFEDBA GGFEEDDEA HHGBABCDE ACDEEFGGG EEEEEEHBA GHGGCBBBB BHGDBDCBG CBAEFFFFH DEHEBBEEE EFFFFADEB ABCDDFHGG CDCCCBEFH AAFFFFFFF ABACEFGGG FGHFEDBBA
428,HDFFGFCAA HHFEDCCBA ABCBDEGHH AACDEFGGG GGGGGEBAA HHGGDBBBB AABCEGGGG HEEDEEEAA DCAFFFFFF BBBBCFGHH BBADDDGHH BBBBDGGGG ABBCDEFGH ABADEFGGG FGHFEDCBA
429,HDFEEDCCA BBBBFGGGG HGGGCBBBB ABCDEEFEH GFGFFECAA EBAADGGGG HGEDDBBBC HEEEDDCBA GFCEADCEG DDDDDCFBH GGGGCBBBB EBCBCCEGH AABCEFGGH ABBDEFGGH ABEEEFEHB
430,GFGFFFDBA HHFEDCCBA HGBABDEFF AABCDFGHH FGGFFECAA HGGGCBBBB HFFDDBEBB HHHEBBBCC GCGCFECCC DACBEFFFH BBBCCCEHH ACDDDDDGH ABBCEFGGH ABADEFGGG FGHFEDBBA
431,DGGGFEDBA GHFEEEDBA AACGGFFEE BCFHHEBBB HHGEDCBBA BBBBDGGGH DFGGFFDAA HGEEDCCBA HGFEDCCBA GFDDBABGH AABCDEGHH AACEFFGGG ABBCDEFGH HHHFBBBBB AADEEFGGH
432,AHEGFFEDA HHGFEBBBB CCBABGGGH ABCDEGHHB HHFFCBBBA GHHGDBBBB EBADGFGGB BHGBCCDEE BCCDDEHED DDDDCDHFA BABBFGGGG ACCDEEFGH ABBCDEFGH ABADEFGGG DFGEECDAG
433,DGGGFEDBA CDCCCCCHH DAADFFGGG HABCDDEEE CCCBBBGHH EBAADFGGG ABBBDFGGH AACEFEFFH AADFFHGFD FFFFFFECA HBBBBCEGG BBBCDDFGH AABCEFGGH ABBDEFGGH AADEFFGFH
434,DGGGFEDBA DDDCCCCCH DAADFFGGG HHBBCCDDD HHGEDCBBA BCAADGGHH ABBCEFGGH ABBCDEGHH ACCDDCGHG FEFFEDFEA HGECBBCCD ABCCDDEGH CABCDFGGH ABBDEFGGH AADEFFGFH
435,DGGGFEDBA HHFEDDDBA HHFDCBBBB DFFABEFFF HHGEDCBBA ACDDEFGGG HGGEDCBBA HGGEDCDBA HGGECBCBB DCBBBCFHH AABDFGGGG BBBCDEFGH GGGGDBBBB ABCDEFGGH FFHGFDCAA
436,DGGGFEDBA CCCCCCCHH DAADFGGGF HBBCDDEEE EEDDCCBBH FCAACFGGG AABCEFGGH ABBCDFGGH CBCDCDGHD EGHDBBDGB HHFECBBCC BBCCDDFGH GGGGDBBBB ABBDEFGGH AADEFFGFH
437,DGGGFEDBA GHFEEEDCA AAEFFFFFF GGGHEBBBB HHGEDCBBA AABDFGGGG AABCEFGGH ABCCDFGHH ABBCDEGHH ABBCDEGHH AABDEFGHH HHGEDCBBA AABCEFGGH EEEFFFFFA AACDEFGGH
438,DCCCCCDGH GHGFEDCAA GFFGGEAAA AABDFGGGG GGGFFECAA GCAACFGGG ACCCCEEGH HHEABFDCC BCCFDFCEH CCCBCCEHH FFFFFFCAA BDBCCCEGH AABCEFGGH ABBDEFGGH ABEEEFEHB
439,GGGGFECAA HHFEDCCBA EHDCCCCCC AABCEGGGG GGGFEDCAA EEGHEBBBB AHGBCDEEE AABFFFGGG FFGGCAAEG HHFBBBBFE BBBDEDDHH DBDECBDFH BBCCDEEEH ABBDFGGGG ADHGFEDCB
440,DGGGFEDBA GHFEEEDBA AEDEEFFFF GGHFBBBBB HHGEDCBBA AABFFGGGG GDBADGCEG FGHFCEBBA BBACHGGFF CCBBCCFHH AABDDEGHH ABCCDEFGH ABBCDFFGH HCCCCDDDD AADEEFGGH
441,DGGGFEDBA HHFEDDDBA AABFFGGGG FFGGGDAAA HHGEDCBBA BBBBEGGGG ABBCEFGHH ABCCDFGGH AACDEEGGH ABCDDDGHG GGGGGEBAA CBBCCDEGH GGGGGCAAB ABBDEFGGH AADEFFGFH
442,HEEFGEDBA HHFEDCCBA HFAACDEFF AABCEGGGG FGGGFECAA HGGGCBBBB HEEABCEEE FFGEEFFAA GGGGEBBBB BCCCCDDHH BBCCDCEGH AABDEFFGH AABCEFGGH AEEFFFFFF AABCEFGHH
443,HCFEEDCBB ABADGGGFF HGGGCBBBB ABBBDGGHG FGGGFECAA EBAADGGGG HHEEBBCCC CHGGFBBCB GGGDCECCA FFFFFFEAA AEBEEEFGG CCCCCCEGH AABCEFGGH ABBDEFGGH ABEEEFEHB
444,HHGFDDCBA AADFFGGFF DAADFFGGG HHDBCCCCC ABDFGGGFE HEAABEFFF AADEEFGGG BCFBFGGGB DFHEEEDAC BCBBDDFHH AABCDEGHH ABCCDEEGH HHGBBBCCC ABBDEFGGH AADEFFGFH
445,DGGGFEDBA DDCCCCCHH HGFCBBBCC EAACEFGGG EEDDCCBBH CBAADGGGG HHGEDCBAB HHGFDBABB GGFEBABFG BBBBCEGHH ABEGGFEEE ABBCDEFGH HHGBBCCCC ABCDEFGGH FFHGFDCAA
446,DGGGFEDBA GHFEEEDBA AAGGGFEED BCFHHEBBB HHGEDCBBA ABBBEGGGG DGHGFECBA HHGEDCBBA HGEEEDCAA AADDEEFHH AABCDEGHH AADEFFFGH ABBCDEFGH HHGBBCCCC AADEEFGGH
447,DGGGFEDBA DDCCCCCHH HHECCCBBC GFABCEFFF FEDDCCBBH CBAADGGGG HHFEDBBBB HFEFEDCCA GAACDDGGG CDDBCDDEH ABEFEEFGG ABCCDEFFH HHGCBBCCC ABCDEFGGH FFHGFDBAA
448,HDFEEDCCA CCBBBEHHG GGFGGDAAA AACDFGGGG CHGGFFCBA EBAADGGGG HGDECDBAC FFFEEGFAA HGGEDDBAB CCCBBCFGH GGGGGCAAA FDDCBBCEH AABCEFGGH ABBDEFGGG GGGFEDBCA
449,GHGFEDCBA AADFGGGFF DAADFFGGG HHDBCCCCC AADFGGGFF HEAABEFFF GHDCEACDD GGHECEBAA AFAADGGGG EHDEFBCDB AABCEEGHH BBBCDDFGH GGGGEBBBB ABBDEFGGH AADEFFGFH
450,DGGGFEDBA HHFEDDDBA GBABDEFGG HHGBBCCCC HHGEDCBBA AAEEFFGGG EFDDFGGAA GCFACFFEE HGFFEDBAA GFBBBBEHH AABCDEGHH ABCCDEFGH FFFFGGBAA ABBDEFGGH AADEFFGGH
451,HFFGFDDAA HHFEDCCBA ABCCEFGGH AABEEFGGG FGGFFECAA HHHDCBBBB HGDECBCCC EFFDEEFGA BHCCCCCCH EEBBBBEHH BBBCDDFHH BBBCDDFGH CCCCDDDDH ACBDGHHFC HGGFECBBA
452,DGGGFEDBA HHFEDDDBA AABFFGGGG FFGGGDAAA HHGEDCBBA DDDCBAEHH AABDEFGGH ABBCDFGHH ABBCDFGHH BBBBCEGHH AABCDEGHH HHGECBBBB AABCDFGGH GGGGEBBBB AADEFFGGH
453,DGGGFEDBA DDDCCCCCH DAADFFGGG HHBBCCDDD HHGEDCBBA BCAADGGGH BABCDFGHH AABCEFGGH AAECFGFFG FBBACDGHG HHGECBBBB BBBCDEFGH HHHFBBBBC ABBDEFGGH AADEFFGFH
454,DGGGFEDBA DEDCCCCCH GBABDEFGG HHGBBCCCC HHGEDCBBA FBAADFGGG HEBBBECFG FFEDGGCBB BBGGGFACE GBCDBEDEH AABCDEGHH AABDEEFGH GGGGDBBBB ABBDEFGGH AADEEFGGH
455,HGFEDDCBA AADFGGGFF DAADFFGGG HHGCBCCCC AACEFGGGF HEAACEFFF EGCFBEEGA GBCFCDBFG DCCHFBDFD EDDBBBCHH AABCEFGHH BBCCCDFGH GGGGGCAAB ABBDEFGGH AADEFFGFH
456,DGGGFEDBA DDCCCCBHH HHFCBCBBC AABDFGGGG BBBBCFHHH DBAADGGGG HGGEDCBBA HGFGFCBBA FEAAEGEFF CBBBCDEGH EGCBBBCHH FFFFFFFFA AABCEFGGH ABBDEFGGH FFHGFDBAA
457,DDDDCCCCH AEEFFFFEE DAADFFGGG FGGGGCAAA BBABDFGHH HFBABEFFE CBEGBDGGC BBDDAEGGG AFFFFFEEE CCBBCCEHH AABCDEGHH BBBCDDFGH FGGGGDAAA ABBDEFGGH AADEFFGGH
458,GFGGFDCAA GFDCCCBBH HHGBABCDD AABFFFGGG FGGGFECBA HHEDCBBCC AFGFFFDDD BCAFHGEDD HHGECBCBA FHECACFEC EABDDDFHG CEBCBBFFH AABFFFFGG ABADEFGGG FGHFEDCBA
459,GGGGFECAA HHFEDCCBA HDDCCCCCC AABDFGGGG GGGFFDCAA GGHCCCCBB BBEHEEFFA BCHEEHDBB GGBBBBBGH EEEDEBAGH BBBBCEGGH ABCCDDEGH ABBCEFGGH AEEEEFFFF ADHGFEDCB
460,DGGGFEDBA CCCCCCCHH DAADFFGGG HBBCDDEEE FEDDCCBBH ECAACFGGG ABBCDFFHH ABCDEFGGH AACDEFGHH CCBBCCFHH HHGFDBBBB BBBCDDFGH GGGGDBBBB ABBDEFGGH AADEFFGGH
461,GHGFEDCBA AADFGGGFF DAADFFGGG HHGCBCCCC AACEFGGGF HEAACEFFF CBBCDHHEE BDGDGEECB EBBBDFHGF GEEADBCGG AABCDEGHH BBBCDEFGH HHGBBBCCC ABBDEFGGH AADEFFGFH
462,HFFFFEEBA HHFEDCCBA GAABDEGGG AABDEFGGG FGGGFECAA HHHDCBBBB HDGEABDDD FFHGCBBBB ABEEFFFGG HGBBBBCGG BBBCCCFHH ABDDDEFGH ABBCEFGGH ADDEEFGFG FGHFEDBBA
463,DGGGFEDBA GHFEEEDCA AAEFFFFGG EFGGHDAAA HHGEDCBBA AAEEFFGGG CAEDDDDDH AABGGGFFE FEEDDCBAH CCBBCCFHH AABCDEGHH ABCCDEFGH AABCDFGGH HHHFBBBBB AADEEFGGH
464,AHFGFEEBB HHGFBBCCB CBAAEGGGG BCDEFGHFA HGGEDCBBA GHGGDBBBB ACFGHECCB DDFABCEGH ABEEFFFHD GDEDBBDCH AAADGGGGG AACCDEFGH AABCDEFGH ABADEFGGG DFGEECDAG
465,DGGGFEDBA HHFEDDDBA GBABDFFGG HHABCDDDD CBBBBFHHG EBAADGGGG FGECAAFGC GGGGBBBBD BBGGGFACE EGDEEBBEE AABCDEGHH GGGGEBBBB AABCEFGGH ABBDEFGGH AADEFFGFH
466,GFGFFEDBA HHFEDCCBA HGBABDEFF AABCDFGHH FGGGFECAA HGGGCBBBB HEGFCDBAE HHHEBBBCC HHCCCCCCC DDDBBEFHD BBBCDDFHH AABDEFFGH AABCEFGGH AAFFFFFFF FGHFEDBBA
467,DGGGFEDBA GHFEEEDBA ABBCHGGFE BCEGGHDBB HHGEDCBBA BBBBCFGHH BFHHGECBA HGGEDDCBA GGGGFCBAB HGFEBACFF AABCDEGHH AABCEFGHH AABCDFFGH FFFFFFFAA AADEEFGGH
468,GFFFFECAA FEDCCCCBH HGGBBBCCD AAEEFFGGG FGGGFECAA HFEDCCCCB FGEDHEABC AEFDEEFFF BDHCCCHEC CADDDDEHH ACDDCEGHH EBEBCBEHH ABBCDEFGH ABADEFGGG EGHFEDCBA
469,DGGGFEDBA GHFEEEDBA AADGHFFEE BCFHHEBBB HHGEDCBBA ABBBEGGGH CGGGFECAA HFEEEEDBA HHFDDDBBA HGDBBCBEH ABBCDEGHH ABGGFDDEF AABCDEFGH HHGBBCCCC FFHGFDCAA
470,GGFFFEDBA HHFEDCCBA GABBDEFGH AABDEFGGG FGGGFECAA HHGDCBBBB HFGGDBBBB DAFDEEFFG HHCCCCCCC CCADDDEHH BABDEEGGH AACDDEFGH AABCEFGGH AAFFFFFFF FGHFEDBBA
471,FGGGFECAA HHFEDCCBA DDGHDCCCC AABDDEGHH GGGFFDCAA DDDGHDCCC ABCCDEFHF EAFDEEFFF ABEFFFFFF FFGGABBEE BBBBDEFHG DBBCCDDGH ABBCEFGGH ADEEEFFFF ADHGFEDCB
472,DDDDCCCCH AGGFFFEBB DAADFFGGG HHGCBCCCC AACEFGGGF HEAACEFFF BBBBEHFEH HGGCECAAE BBCFHGBEF EDABCCFHG AABCEFGHH FFFFFFFCA AABCEFGGH ABBDEFGGH AADEFFGFH
473,HGFFEEDAA HGFFEEDAA DDBABEFHH ABCDEFGGG FFFFFFEDA HHGFDBBBB EGGCDFGBA EFFDEEFGA ABDEFFFGG CCCCCCDGH AABDFFGGH DCCCCCEFH AAFFFFFFF ABBCEFGGH AABCEFGHH
474,DGGGFEDBA DDDCCCCCH DAADFFGGG HHBBCCDDD HHGEDCBBA BCAADGGGG AACDEFGGH ABCCDEFGH AADFCFEEH DEBBCCFHG HHGECBBBB BBCCDEFGH GGGGDBBBB ABBDEFGGH AADEFFGGH
475,BHFGGFDBA HHGDBCCCB BBABFFGGH CDEGGHEAA HHGEDCBBA GHHGDBBBB ABCDFFHHD BEEABCFFH HHFBCBCCF DDEEEFDHA AFEEEEFFF ABBCDFGGH AABCDFGGH ABBCEFGGH ABBCEFGGH
476,HGFEDDCBA AADFGGFFF DAADFFGGG EEFGGGDAA DCBBBCGHH HDAACEFFF ACDCBEHGH CCEEDDBGH EDAGFBDFF CACCCDEHH AABCEEGHH BBCCCDEGH ABBCEFGGH GGGGGDAAA AADEEFGGH
477,DGGGFEDBA DDDCCCCCH DAADFFGGG HHGBBCCCC EDDCCBBGH FCAACFGGG AABDEFGHH AABEEFGGH BBACGGGFE EFFFFCEFA HGDBBBCDD ABCCDEFGH AABCEFGGH ABBDEFGGH AADEFFGFH
478,HCFEEDCBA CCCBBBGHH GFEFFGEAA AACDFGGGG AGFFFFEDC EBAADGGGG HGFEDBBAB HCGCDEACG ECGBCECFG FGCBBBEDH FGGGGFBAA GBDCBBCEH AABCEFGGH ABBDEFGGG GGGFEDBCA
479,DGGGFEDBA DDDCCCCCH GBAGGFDDC HHBBCCDDD FEDDCCBBH FCAACFGGG BABCDEGHH ABCCDFGGH AACDFFFGH GECBBBDGH FFGGGECAA BBBCCDEGH HHHFBBBBB ABBDEFGGH AADEFFGFH
480,DGGGFEDBA DDDCCCCCH DAADFFGGG HHBBCCDDD HHGEDCBBA BCAADGGGG BBBBCEGHH AACDFFFGH BCCCEEBHH HGDCCACGB HHFDBBBCC BBCCCEEGH HHGBBCCCC ABBDEFGGH AADEFFGFH
481,DCCCCCDGH GHFEEDCAA FEEFFFGBA AABCDFGHH FGGFFECAA GDAACFGGG CBBCFDHGE BBBDHDBGG HHGDCCBBB DDCBBCGHF FFFFFGEAA AEBCCDEGH AABCEFGGH ABBDEFGGH ABEEEFEHB
482,GGGGFECAA HHFEDCCBA DFHCCCCCC AABCDFGHH GGGFFDCAA FEEDDHFBA AABDDFGGG BFBABEGGG DCAFFFFFF BEECCCBHH BBBDEDGHH CCCCBCEGH BBBBCFGHH ABBDEFGGH ADHGFEDCB
483,GGFGFECAA EEDDCCCHB HHGBABDDD AAEEFFGGG FGGFFECAA HFDCCCCCC AACDEFGGG CCCBBCGHH HCCCCDDDD BCCCCCDHH BCBCFEFHD BFBBDGEEH BBCCCDDHH ABBDEFGGG EGHGEDCBA
484,DGGGFEDBA GHFEEEDBA AACFFGGGG FFGGGDAAA HHGEDCBBA AABDFGGGG ABCCEFGGH AABDEFGGH AACDEFFGH BBBCCEGHH AABDDEGHH HHGECBBBB AABCEFGGH GGGGGCAAA AADEEFGGH
485,DGGGFEDBA DDCCCCCHH GBABDEFGG HHABCDDDD EDDDCCCCH EBAADGGGG HHDGCBDBB HGGGDBBBA HGFDEBBAE FBBBBDFHH AABCDEGHH ABCDDEFGH GGGGDBBBB ABBDEFGGH AADEEFGGH
486,GGGGEDCAA HHFEDCCAB HHGBABCDE AAEEFFGGG DDDDDCCCH HEEDCCCCC DAGHDBCCG AHEEEEEEE ABEEFFFGG BCCCCCDHH CABFCEGGG CCCCCDCGH AAACGGGGG FHFFEDCAA HGGFECBAA
487,HGFEDDCBA AADFGGGFF DAADFFGGG HHGCBCCCC AACEFGGGF HDAACEFFF CBBCDEHGF HBHFCCCCC DEEEGGDDA EBCEDACHG AABDDEGHH BBBCCDFHH EAABDEFGH ABBDEFGGH AADEFFGFH
488,DGGGFEDBA CCCBBBGHH HHFCBBCCC AACDFGGGG FEDDCCBBH BBABDGHGG HGGEDCBBA HHFEDCBBB DEGCDEAEG BDEBBCDHH AABDEGGGG BBCCDDEFH GGGGDBBBB ABBDEFGGH AADEFFGGH
489,GGGGFCCAA GGEEEDDFA EFEBBCCCH AABDEFGGH EEEEEEHBA HHGFCBBBB GEHEBCDBD ADFGBFGDD AGBEGGBDE AFEBEGEHC ABFGDCGGF CCCCDDCDH AACCDEFGH ABADEFGGG FGHFEDBBA
490,DGGGFEDBA HHFEEDDBA AHHFEDDCC BDHGBCDEE HHGEDCBBA AADEFGGGG HGGFDCBAA HHFEDCBBA HHFEFDBAB BABCDEGHH BBBCCDGHH CECBCCDFH FFFFFFFAA ABBDEFGGH AADEFFGGH
491,HGEFFEDAA HHFEDCCBA HGBABDEFF AABCDFGHH FGGGFECAA GGGGFBBBB HGGECBBCB HFGFDBBBB FGGGGCAAA CCCCDDEHC ABCDDDFGH AABCEFGGH AABCEFGGH AAFFFFFFF AABCEFGHH
492,GGFFGDCAA HGFEEDDCA ABBBDFGHH AABDEFGGG FGGGFECAA HHFDCBBBB FGGDEFCAA HCDBCCDDE FGGEDCFBA AACGDEGGF BBBCCDGHH BBBCDDFGH BCCCCCDHH ABABDGGGG FGHFEDBBA
493,GFFFFECAA HHFEDCCBA HHECBCCCC ABBBEGGGG FGGGFEBBA GGGGCBBBB ABBDFHHFC BDAFFFFFF GGGGEBBBB AAEEEEFHG BBBCCEGHH DCBCCDEEH BBBBEGGGG ABADEFGGG FGHFEDBBA
494,HFFGFECBA HGFEEDDCA CCBACEGHH AACEEFGGG FGGGGECAA HGGFDBBBB EGGBCEGAF GGGFGCABB EFGGGGBAA CCCCDDEHC AABCEFGHH BCCCBCEFH AAACGGGGG GHFFEDCAA HGGFECBBA
495,HGFFFECAA HGFEEEDAA DCAACEGHH ABCDEFGGG FGGGFECAA HGGFDBBBB BEHFABEFE FFGEEFFAA FGGGGCAAA BCCCCDDHH AABDEFGHH CBBCCCEGH AAFFFFFFF HHEFEDCBA HGGFECBBA
496,GGGFFECAA HHFEDCCBA HGBABDEFF AABCDFGGH FGGGFECAA HHGFCBBBB HGGDECBBB HFFEEBAAF HBCCDDDDD EEEEFGAED BBBCCEGHH CCCCCCDFH BBBBBFHHH ABBCEFGGG FGHFEDBBA
497,DGGGFEDBA EEDCCCCBH HHEDCBBBC FEABCFGGG HHGEDCBBA ABBBEGGGG GGGGFDBAA HHGFECBAA DEHHEDCBA DDBCCAEHH AABEGGGFF AABCEFFGH GGGGDBBBB AACDEFGGH FFHGFDBAA
498,DGGGFFDBA EEDCCCCBH HGFCCBBBC EEABCFGGG FEDDCCBBH CBAADGGGG HGFGECBAA HGEEEEEBA HGGGECBAB ADCBCDFGH AABDEFGGH ABBCDDFGH HHHFBBBBB ABBDEFGGH AADEFFGGH
499,DGGGFEDBA GHFEEEDBA AAEFFFFGG FGGHEBBBB HHGEDCBBA CCCBBEHHH FBABEEEHF GGGFCACED GGFBBEDCC CCBBCCFHH AABCDFGHH ABBCDEFGH AABCDFFGH HHHFBBBBB AADEEFGGH
500,GGGGFECBA HHFEDCCBA HABBDEFFG AABDEFGGG FGGGFECAA HHHDCBBBB HEEBCDADF HHGBBBCCC HHCCCCCCC BCCCCDDHH BBBCCDGHH CBBBCDFGH BCCCCCDHH ABBCDEGHH AABCEFGHH
501,DGGGFEDBA GHFEEEDCA HHGDCBBBB DFGABDFFF HHGEDCBBA AABCFGGGG HGGFECCAA HGGFFCBBA FFGHFCBBA FHHECBBCD AABCDEGHH AACEFGFFG AABCDEFGH FFFFGGBAA AACDFFGGH
502,DGGGFEDBA DDCCCCCHH FBABDFFGG HABCDEEEE DDCCCBBHH EBAADGGGG HGGCCCCBC BAGGGFBDE HGFFEDBAA HEEABDDFF AABCDFGHH ABCCDEFGH HHBCCCCCD ABBDEFGGH AADEFFGGH
503,HGFEDDCBA AAEFGGGFF DAADFFGGG HHCCCCCCC ABCFGGGFE HDAACEFFF BDBFDEHDG ACCADFFHH GCGDAAFEG GFEABCDGG BABDEFGGH EEEEFFFFA AABCEFGGH ABBDEFGGH AADEFFGFH
504,GFFGGDDBA HGFEEDDCA ACBBCEGHH AABEEFGGG FGGFFECAA HGGEDBBBB BCECBEHEH HFGFDBBBB GGHFCCCCA BCEGGGDDB AABDFFGGG CCCCCCEGH AABFFFFGG ABADEFGGG FGHFEDBBA
