,0
169,DGGGFEDBA DDDCCCCCH DAADFFGGG HHGBBCCCC HHGEDCBBA AABEFGGGG AABDEFGGH ABBCDFGHH ABBCEFGHH ABCCDDFHH EEFFGGEBA DBBBCCEGH EEEEFFFFA ABBDEFGGH AADEFFGGH
170,DGGGFEDBA HHFEEDDBA ABBCHGGFE BCEGGHDBB HHGEDCBBA BBBBCFGHH AACEGGGFF GHGFDCBAA HGFDEFDBA GFEABBDFH BBBCDEFHH EHHECBBBD ABBCDEFGH HHCCCCCCC AADEFFGGH
171,DGGGFEDBA DEDCCCCCH FBABDEFGG HHABCDDDD CCCBBBGHH EBAADGGGG GCGFFABDE FFGGEEBCA GGGFCCACD GFBBBBEHH AABDDEGHH ABCCDEFGH HHBBCCCCD ABBDEFGGH AADEFFGGH
172,GFFFFECAA HGEDCBBAH HHGBABCDD AAEEFFGGG DEDDDDCBH HGGFCBBBB HHDAAFEDD DBAEGGGDF DBECAEFGH CDFEGGGBA DABECEGHG CCDBDDDDH AAACGGGGG ABADEFGGG FGHFEDBBA
173,FFGGGEDBA HHFEDCCBA FHDCCCCCC AABCEGGGG GGGFFECBA FFFGGCBBB AEBCFFEEH AFCFGGGBA DFHGEEBAA CACCCDGGH BBBDCDFHG CDBCCDEEH BCCCDDEEH ABBEEGHGE HGGFECBAA
174,DCCCCCDGH FHGFEDCAA GGGGFBBAB AABEFGGGG GGGFFDCAA HHECBCCCC AEEBGGBFE FCABFGHDC HHGDABCCB ADCBCEEGH AABDDEGHH BBBCCDEGH ABBCEFGGH ABBDEFGGH ACHGFEEBD
175,DGGGFEDBA DDDCCCCCH DAADFFGGG HHBBCCDDD HHGEDCBBA BCAADGGGG AABDDEGHH ABCDDFGGH AABDFFGFH GGCBCBEHC HGECBBCCC ABCCDEFGH HHBBCCCDD ABBDEFGGH AADEFFGFH
176,DGGGFEDBA HHFEDDDBA AABFFGGGG FFGGGDAAA HHGEDCBBA BBBBEGGGG AABCEFGGH AABCDEGHH AABDEGGGH BBBCDEFHH AABCDEGHG HGECBBBCD AABCEFGGH HHGBBCCCC AADEFFGGH
177,DGGGFEDBA HHFEDDDBA AHHFEDCCC BEHGBCDED HHGEDCBBA BBBBDGGGH CEHHFECBA HGEECBCBB HHDDDBCCB FBABCCGHG ABBCDEFGH HFECCBBCF ABBCDEFGH ABBDEFGGH AADEFFGGH
178,DGGGFEDBA EEDCCCCBH HHFDCBBBB DGFABDFFF HHGEDCBBA ABBBEGGGG HGFFEDBAA HHFEECBBB HDCFFFDCA CBBBDDGHH AABDGGGGF AACEFFEFH GGGGDBBBB ABBDEFGGH AADEFFGGH
179,GGGGFECAA HHFEDCCBA HEDCCCCCD AABEFFGGG GGGFFECAA DDGHDCCCC AABGGFFFF HHGBBCCCC AABFFFFFF BCCBCCEHH BBBEDCFHH CBFCBDCFH AABCEFGGH BBBCCCGHH GGFGGECAA
180,HGFEDDCBA AADFGGGFF DBADFFGGG GGGHEBBBB BBABEGGGG HFBABEFFE EABBCDHFH GFCCBFFFA BCEGCCBGH DDCBBDFHG AABCDEGHH BBBCDEFGH FFFFGGDAA ABBDEFGGH AADEFFGGH
181,HGFFDDCBA AADFGGGFF DAADFFGGG HHCBCCCCC ABCFGGGFE HDAACFGFG DAADEGGFF FFFABDGFE CACEFCFGG BBBCFDEFH AABCDEGHH HHHFBBBBB AABCEFGGH ABBDEFGGG HGGFECBAA
182,GHGFEDCBA AADFGGGFF EAADFFGGG HHGCBCCCC AACEFGGGF HFBABDEEE AABFGHFEE AACFGGGGA BBCCCGDGH DCACDDGHH AABCDEGHH BBBCDDEGH ABBCEFGGH GGHGCBBBB AADEEFGGH
183,DGGGFEDBA GHFEEEDBA AAEFFFFFF GGGHEBBBB HHGEDCBBA AACEFGGGG ABBCDFGGH AACDEFGGH AABEFFGGG ABBCCEGHH AABDEFGHF HGFEDBBBC ABBCDFGGH GGGGEBBBB AADEEFGGH
184,HGGFFDCAA HHFEDCCBA ACCCEFGGH AABEEFGGG FGGFFECAA HHGDCBBBB HDFEABDDD HFFEFCBBB ABEEFFFGG EEEEFGAED BBBDDDFHH ABCCCDEGH BCCCCCDHH ABBCEGGGG FGHFEDBBA
185,HGGFECCAA HHFEDCCBA HHEBBBCDE AABCDFHHH FGGGFECAA HHGECBBBB HHEFDBBBB HFFEEEBAA GHHFBBBBB BCCCCDDHH AABDEEEHH ABBCEEFHH AABCEFGGH CCCCCCCHH FGFABFEED
186,DGGGFEDBA HHFEDDDBA AEDEFFFFF GGHFBBBBB HHGEDCBBA AAEEFFGGG HDFEECAAE GGGACBCDD DDCCBGCGH FEDBBBDGG AABCDEGHH ABCCDEFGH FFFFGGBAA ABBDEFGGH AADEFFGGH
187,GFGFFDCBA HHFEDCCBA HEECBCCCD AABFFFGGG FGGFFECAA HEDDCCCCC HHDCFFCAB CDADEEGGE FHEEBACDF HBBFCDDGE CADDDFGHD HCBBEEDBG AAACGGGGG ABADEFGGG FGHFEDBBA
188,HGFEDDCBA AADFGGGFF DAADFFGGG HHGBBCCCC AACFGGGFF HEAABEFFF AADDEEHGF HBEBBGHEA DAFGFHEDA ABCCDFEHG ABBCDEGHH BBCCCCFGH HHGBBBCCC ABBDEFGGH AADEFFGFH
189,HGFEDDCBA AADFGGGFF DAADFFGGG FFGGGDAAA CBBBCFGHH HGBABDEEE DAABDGGGG EEGGDDACE ADEEEEDDH FCCBCCCHH AABCDEGHH BBBCDDFGH AABCEFGGH GGGGEBBBB AADEEFGGH
190,DGGGFEDBA GHFEEEDCA AEDEEFFFF FGGHEBBBB HHGEDCBBA BBBBDGGGG ACACGGGFG AABFFEEEH HABEEEDDD DDCCFCCGG AABCDEGHH ABBCDEFGH ABBCDFGGH FFFFFFFAA AADEEFGGH
191,HGFFDDCBA AADFGGGFF DAADFFGGG HHBCCCCCC ABDFGGFFE HEBABEFFF ADHGEBCGD HDHEBBBGC CGDHEBBBG EEDCBACHH AABDEFGGH BBCCDDEHH GGGGEBBBB ABBDEFGGH AADEFFGFH
192,HHGFEDCBA AADFGGGFF EAADFFGGG HHGCBCCCC AACEFGGGF HEBABEFFF DCAACEHGH HHEDDEBAA ABGEDGGFA BDBDCBFHH AABCDEGHH BBBCDEEGH GGGGGCAAB ABBDEFGGH AADEFFGFH
193,DGGGFEDBA HHFEDDDBA HHFDCBBBB DGGABDFFF HHGEDCBBA AABEFGGGG EHHFECCBA HGGFEDDAA HEGFCCBBB ABBCEEHGG AABDGHGFF ABBCDEFGH FFFFFFFAA ABBDEFGGH AADEFFGGH
194,DGGGFEDBA GHFEEEDBA AAEFFFFGG FGGHEBBBB HHGEDCBBA AAACFGGGG BDBADGGGG GFGFAACED HGGFEDBAA GEBBBBEHH AABCDEGHH ABCCDEFGH AABCDFFGH HHCCCCCCC AADEEFGGH
195,GFFFFECAA HHFEDCCBA HEECBCCCD AABFFFGGG FGGFFECBA FGHFCBBBB BHDBDDFCG BBAGGGGGC BBCCFECGH GGHEBCCAC CCCCBDFGH DDCABDFGH AABDEFGGH ABBDEFGGG EGHFEDCBA
196,DGGGFEDBA HHFEDDDBA ADDEFFFFF GGHFBBBBB HHGEDCBBA AADEFFGGG AABCEFGGH ABBCEFGHH ABBDFFFGH AABCEEGHH FFGGGECAA BBBCCDFGH FFFFFFFAA ABBDEFGGH AADEFFGGH
197,DGGGFEDBA HHFEDDDBA HHFDCBBBB DFGABDFFF HHGEDCBBA ACDDEFGGG HHFEDCBAA GGGFEDBAA GFGEGECAA ACCCCDFHH AACFGGFFF ABCCDDEGH HHCBCCCCD ABBDEFGGH FFHGFDBAA
198,HCFEEDCBB ABADGGGFF HGGGCBBBB BBCCDDEHH GGGFFECAA EBAADGGGG HFFABDDCD HGGFDDCAB HEFHFBBAB CCCBCCGFH HHGCBBCCC CCCCCCEGH AABCEFGGH ABBDEFGGH ABEEEFEHB
199,DGGGFEDBA DDCCCCCHH FBABDEFGG HABCDEEEE EDDDCCCCH EBAADGGGG HGBCCDEEB ABHGCCFEE CDGDEEGFA CCBBCCGHH AABCDEGHH ABCCDEFGH HHBCCCCCD ABBDEFGGH AADEFFGGH
200,GGGGEECBA HHFEDCCBA ABBCDFGHH AABDEFGGG FGGGFECAA HFEDCCBBB CEGHFCEEA HHGBBBCCD HEFFFFBAA BCCCCDDHH BBBCDEGHH CCCCCCEGH BBBBBFHHH ABBDEFGGG FGHFEDBBA
201,DGGGFEDBA GHFEEEDCA AAEFFFFFG GGHFBBBBB HHGEDCBBA AABFFGGGG CADDHGEDE HABEEEDDD HGGFEDBAA CCBBCCFHH AABCDEGHH AACCDEFGH AABCDFFGH FFFFFFFAA ABCEEFGGH
202,DGGGFEDBA HHFEEDDBA AACFFGGGG FFGGGDAAA HHGEDCBBA AABDFGGGG AABCEGGGG AACDEFGGH AACCDEGHH BBCCDEGHG AACDFGHHC HGCBBBCDF AABCEFGGH HHCCCCCCC AADEFFGGH
203,DGGGFEDBA DDCCCCBHH HHECCCBCC EAACEFGGG EEDDCCBBH CBAADGGGG HHFDDCBBB HHGEDCBBA GFFGGCAAD BBCCCCEGH AECBCDFHH FFFFFFBAA AABCEFGGH ABBDEFGGH AADEFFGFH
204,DGGGFEDBA GHFEEEDBA GBABDEFGG HHGBBCCCC HHGEDCBBA AEDDEFFFF DFCEFCBBH GHBBBDEEE GFBFFFEAD CCBBCCFHH AABCDEGHH ABCCDEFGH EEEEFFFFA ABCDEFGGH AADEEFGGH
205,GFFFFECAA EEDDDCCHB HHGBBBCDD AAEEFFGGG CCCCCCCHH HGFFCABCC HHCDDACEE FFGDADFBF ABEEFFFGG FFFFFFAFA BCFDDBGGC CBBEFCDFH AABCEFGGH AABFFFGGG EGHGEDCBA
206,DGGGFEDBA GHFEEEDBA AACGHGFEE BCFHHEBBB HHGEDCBBA BBBBDGGHH FHHFEDBAA HGGGEBBBA HGFECCBBB CAACDDGHH AABCDEFHH AABEFGGFG ABBCDEFGH GGGGGCAAA AADEEFGGH
207,AHFFGFCCA HGFFEEBAA DDCBBCGHH AABDEFGGG HHDDCCCBB GHGGDBBBB BDHEABFFE FFFEEEGCA AAEEFFFGG CCCCDDEHD BBBBBEHHH AABCDEGHH AABCEFGGH ABBCEFGGH ABBCEFGGH
208,GFFFFECAA FFDDDCCHA GHGBABCDD AAEEFFGGG DDDDDDCHD HHGFBBBCB HGDDDDEBA GHCCCCCFC BBCGEEGCG EECBBCFGG DAEDDDCEH FEBBCCFEH AABFFFGGG ABADEFGGG EGHFEDCBA
209,CGGGFEDBA GHFEEEDCA AABFFFGGG EFGGHDAAA HHGEDCBBA AABFFGGGG HECBCCCBH HFAEEEDDC FFFFFGCAA CCBBCCFHH AABDDEGHH ABBCDEFGH AABCDFGGH FFFFFFFAA AADEEFGGH
210,FGHFFDCBA HHFEDCCBA HHHBBBCCC AABCEGGGG GGGGFEBAA DFHFCCCCC GBBCCHGDD CCCCCCCHH DHCDDDDDD BCCBCCEHH AABDEFGHE BGDBBBFFH AABCEFGGH BCCCCCCHH BEHGFDCBA
211,DGGGFEDBA HHFEDDDBA DAADFFGGG HHGBBCCCC HHGEDCBBA ACBBEGGGG ABCCDEGGH AABCEFGHH AABCDFGHH EDCDDADHG HHGFDBBBA BBBCDDFGH GGGGDBBBB ABBDEFGGH AADEFFGGH
212,GFHFFDBBA GGFFEEEAA CCAACEGHH AACDEFGGG FFFFFFEBA HHGGDBBBB CDFGDBGDB FFFEFFFAA HCCCDDDDD BCCCCDDHH BBBBDEGHH BBBCEEGFH AABFFFGGG ABACEFGGG FGHFEDBBA
213,FGGGFDCAA HHFEDCCBA FHDCCCCCC AABCEGGGG GGGFFECAA FGHECBBBB BCDECDHHC AEGDDDGGE GBBEHEBGC GFDGEAACF CBBBBEGHH CBCCCCEGH BBCCCDDHH ABACEFGGH CFHGEDCBA
214,EHHGDCBAB HHFEDCCBA HHDCBCCCC AABCFGGGG FGGGFECAA FHEDCCCCC HFGGEBACA AGGGECCCG BECEBBEFH CCCCCCDHF CCEFBEGCG CCBAEEDGH ABBDEFGGG BBBBBFHHH EGHFEDCBA
215,DGGGFEDBA EEDCCCCBH FBABEFFGG HHBBCDDDD HHGEDCBBA AEDDEFGGF EHEGGDBAB CGECGFFAD DCCEHHCAF HGBBBCEFG AABCDEGHH FFFFFFFAA AABCEFGGH ABBDEFGGH AADEFFGFH
216,FGGGFDDBA HHFEDCCBA EFHDCCCCC ABBCCFHHH GGGFFEBAA FEGHDBBBB ACEFDEEGG BCGDGDFDC BEHDDDDDD BBDHEBCGG BAAEEEFHH CCCBBCFGH AEEEEFFFF ABBDEFGGH BEHGFDCBA
217,HGFEDDCBA AADFGGGFF DAADFFGGG HHBCCCCCC ABDFFGGFE HEBABEFFF BACFCGGEF EFHCCCCDD AABGGGFFF GGFDBAAGD AABCDEGHH BBCCCDFGH DEEEFFFGA AABDEFGGH AADEFFGGH
218,GFGGFDBAA HGFEEEDAA DCAACEGHH ABCDEFGGG FFFFFEEDA HHGGDBBBB CFFABCGGF GGGFFFBAA HHCCCCCCC BCCCCDDHH AABDEFGHH BCCCCCDGH ABCCDEGHH HHEFEDCBA HGGFECBBA
219,DGGGFEDBA HHFEDDDBA AAEFFFFFG FGGHEBBBB HHGEDCBBA AAACFGGGG BCBACFEHH AHGFFEDCC GHHCCBBEB CBBCCBFHH AABCDEGHH ABCCDEFGH AABCDEFGH AABDEFGGH AADEEFGGH
220,DGGGFEDBA DDDCCCCCH DAADFFGGG HHBBCCDDD DDCCCBBHH EBAACFGGG AABCEFGHH AABDEFFGH ACDDEGHGC DEFEDDFHA HGECBBCCD FFFFFFFAA AABCEFGGH ABBDEFGGH AADEFFGFH
221,HGFEDDCBA AADFGGFFF DAADFFGGG FFFGGFBAA CCBBBDGHH HEAABEFFF ABDCDFHHG CCCBBBGHH FGGGEBABF FCCBBBEHH AABCEEGHH BBBCCDFGH AABCEFGGH HHCCCCCCC AADEFFGGH
222,DGGGFEDBA EEDCCCCBH HHFDCBBBB CFFABEFFF HHGEDCBBA ACDDEFGGG HHGFDCBBA HHGDCCBBA HGFBBCEBB ECCCBBFHH BBBCCEGHH BBBCCDFGH EEEEFFFFA ABBDEFGGH AACDEFGGH
223,HFFFFDCBA HHFEDCCBA HGAABDEFF AABDEFGGG FGGFFECAA HHGECBBBB BDDCHFDDD HFGFDBBBB GGGEEDBBB FFGFCAAFF BBBCCDFHH ABCDEEFGH CCCCDDDDH ABAEEGHFD HGGFECBBA
224,DGGGFEDBA HHFEEDDBA AABFFGGGG FFGGGDAAA HHGEDCBBA AABDFGGGG AACCDFGHH ABBCDEGHH AABCDGGGG ABBCDEGGH BBDEFGHGA HECBBBCEH AABCEFGGH HHCCCCCCC AADEFFGGH
225,FGGGGECAA HGFFEEDAA DDBABDFHH ABCDEFGGG FFFFFFEBA HHGFDBBBB EEABCEGGG GGGFGCABB DEFFFFFAE BCCCCDDHH AACFFEFGG BCCCCCEGH AAFFFFFFF ABADEFGGG FGHFEDBBA
226,GGGGFCCBA GGEDDDCGA HHGBABCDE ABCEEFGGG CCCCCCHGC HHGECCCBB GGHFBBCCC CCDCHGCDD CCCFGCCCH BHGBEEBED CCCCBFHFF HDDDBABEH AABCEFGGH AEEEFFFFF BEHGFDCBA
227,HHGFEDCBA AADFGGGFF EAADFFGGG GGHFBBBBB AAADFGGGG HEAABEFFF EBEFEFHAD CCEEBBBFH HCEDDEFFA GDBABDFHF AABDDEGHH ABBCDDFGH HCBCCDDEE ABBDEFGGH AADEFFGFH
228,FFFGEEDDA DDDDCHGCC DFDBABFHH AACDEGGHF GHDCCCCCC HHGFCBBBB CACCDFGGG DFFABCEHF BCCDGHDDC CCFCCCCHG BBBBBFHHH ABBCDEGHH AABCEFGGH ABBCEFGGH ABBCEFGGH
229,GGGGFECAA HHFEDCCBA FGHDBBCCC ABBCCFHHH GGGFFECAA EEGHDBBCC AFEDGDBBG AAACGGGGG FACGGGGBA GBBBEHDDD AECGDDGHC AFDECCDFH AABCEFGGH AEEEFFFFF CFHGEDCBA
230,FHHGEDCBA HHFEDCCBA HEDCCCCCD AABFFFGGG FGGGFECAA GHDDCCCCC BBCBCFGGH HBBACFFFF BCFDGGGCB GGGGEBBDA CCDEDAHGD CCCCCCEGH CCCCDDDDH ABADEFGGG FGHFEDBBA
231,AHFGGEDBA HHFFFCABB DCBBBEGHH BCDEFGHFA HHGFDCBBA GHHGDBBBB CEGHGBCCC FFFEFFGCA CBDEHEDEC EECCCCDBH AAADGGGGG AACCDEFGH AABCDEFGH ABADEFGGG DFGEECDAG
232,DGGGFEDBA CDCCCCCHH DAADFFGGG HHBBCCDDD DDCCCBBHH FBAACFGGG AABCDFGGH AABCEFGHH BEBBCFGFH FFFFEEECA HCBBBCEFG ABBCDEFGH AABCEFGGH ABBDEFGGH AADEFFGFH
233,GGGFFDCAA GGEEDDCGA HHGBABCDE AAEEFFGGG EEEEEDCHA HHGGDBBBB HHEBCDCBB BBADEHFFG GBDDCDDGE CCEHFABGG ADCBEFFGH CABCEDFGH AAFFFFFFF HHFFEDCBA HGGFECBBA
234,DGGGFEDBA HHFEDDDBA AADFFFFFF GGGHEBBBB HHGEDCBBA AABDFGGGG AABCEFGGH ABCBDEGHH AACDEFGGH BCCBCDGHH EEFFGGEBA CBBCCDEGH EEEEFFFFA ABBDEFGGH AADEFFGGH
235,GFFFFECAA HHFEDCCBA HDDCCCCCC AABFFFGGG FGGGFECAA GHDCCCCCC HDEEEFBEA CCCBFECGH HCEGCCCCC BCCCCCDHH EEEFDAFED CBBEFCDFH BCCCDDDEH ABECDFGGG EGHFEDCBA
236,DGGGFEDBA DEDCCCCCH GBABDEFGG HHGBBCCCC HHGEDCBBA AABEFGGGG HFHFBBBBB HGAACFFEE FFEEEDDHA BBBCCDGGH AABCDEFHH ABCCDEFGH EEEEFFFFA ABBDEFGGH AADEEFGGH
237,CCCCCCEGH GHFEECBAA HGGGDBBBB AACEFFGGG GGGFFECAA GCAACFGGG CACHGCFGC ACEBCGHFD GCHHDCBBB EDDEEBDBH GGGGCBBBB EBCBCCEGH AABCEFGGH ABBDEFGGH ABEEEFEHB
238,DGGGFFDAA HHFEEEDBA AAEFFFFFG FGGHEBBBB HHGEDCBBA AABEFGGGG FDEACFFHB AGBFFFEDD HGGEBBEBA CCBBCCFHH AABCDEGHH ABCCDEFGH ABBCEFFGH ABBDEFGGH AADEEFGGH
239,CGGGFEDBA GHFEEEDCA AAEFFFFFG FGGHEBBBB HHGEDCBBA AAACFGGGG BACBEGGGG GGGFFFBAA HBBBBEGFF CCBBCCFHH AABCDEGHH ABCCDDFGH AABCDFGGH FFFFFFFAA AACEFEFFH
240,GFFFFDDCA HHFEDCCBA HABBDEEFG AABDFFGGG FGGGFECAA HHEDCBBBB HHGDCBBBB FGGFFGBAA EFGGGGBAA BBBDDCFHH AACEFFFGH BBCCCDEGH AEEEEFFFF ABBCEFGGH AABCEFGHH
241,DGGGFEDBA DEDCCCCCH GBABDEFGH HHBBCDDDD HHGEDCBBA AEDDEFFFF HGFEAACDE HHGEEDCAA FFEEEGBBC DDCCCBEHH AABCDEGHH ABCCDEFGH FFFFGGBAA ABBDEFGGH AADEEFGGH
242,FGGGFECAA GGEEEDDFA HHGBABCDE ACDEEFGGG DDDDDDCBH HHGFCBBBB EECFCAGFE AGECCFGFE GCBEBGFDD CDFCEBEGF CBBBEDGGH CEDBDFFBH AAFFFFFFF ABADEFGGG FGHFEDBBA
243,DGGGFEDBA HHFEEDDBA GBABDEFGG HHGBBCCCC HHGEDCBBA AEDDEFFFF GDEACFFEF GFDGHCBBA EDDCCBBHH DDBACCFHH BBBCDEGHH ABCCDEFGH FFFFGGBAA ABCDEFGGH AADEEFGGH
244,DGGGFEDBA EEDCCCCBH HHFCCCBBB EDABDFGGG EDDCCBBGH CBAADGGGG HHGFDCBBA HHFDDDCAA HEFFEBABG BBBBCEFGH ACEEDEFGH AACEDEGFH HCCCCDDDE ABBDEFGGH FFHGFDBAA
245,HGFEDDCBA AAEFGGGFF EAADFFFGG GHHFBBBBB AAADFGGGG HFBABDEEE CCCBADFHH GGGABCCDE ECAFFFEEE CCDDCBDHH AABCDEGHH BBBCDEFGH ABBCEFGGH HCCCCDDDD AADEFFGGH
246,GFFFFECAA GGEDCBBAH HGGBABCDD AAEEFFGGG CDCCCCCHF GHGGDBABB HHECEDCCA ACCEBFGFH HHDDBCCCC BCAFFECFH DBCBCDFHH DCABCDEGH ABBCDEFGH ABBDEFGGG EGHFEDCBA
247,DGGGFEDBA DDCCCCCHH FBABDEFGG HHABCDDDD CCCBBBGHH EBAADGGGG HHCCCCCBE FFEDDCHCA GAGFFEDCC DCCDEAEHH AABCDEGHH ABCDDEFGH HCCCCDDDE ABBDEFGGH AADEFFGGH
248,GGGGFECAA HHFEDCCBA DDGHCCCCC AABCDEGHH GGGFFECAA DDDCGHDBB CACBFFGGG ABGFGGCAG EEFFFFFFA CCCBCFEHF AABCDEGHH CBDBCDEGH ABBCEFGGH BCCCCDDHH HCEDDCCCB
249,DGGGFEDBA GHFEEEDCA AABFFGGGG EEFGGGCAA HHGEDCBBA BBBBDGGGG EBABFGGFG EHGCCBBBG FHEDDCCBB BBBBDDFHH AABCDEGHH ABBCDEFGH AABCDFGGH FFFFFFFAA AAFFDEFFH
250,GGGGGDCBA HHFEDCCBA HDAACEFFG AABCEFGGG FGGFFECAA HHHDCBBBB HHEFDACCB DDFABDEGH BGHHEBBBB BCFBBCGHG BBBCDDFGH AACDEEFGH AABCEFGHH AAFFFFFFF HGGFECBBA
251,DGGGFEDBA HHFEDDDBA AAEFFFFFF GGGHEBBBB HHGEDCBBA AABDFGGGG AACDEFGGH ABBCEFGGH AABCEFGGH ABBCDEFHH BCDEFGHFA HDBBBCDEH AABCEFGGH HHCCCCCCC AADEFFGGH
252,DGGGFEDBA CCCBBBGHH DAADFFGGF AABDEGGGG DDCCCBBHH FBAACFGGG AABCEEGGH ABADFFGFH FBAADGGGF GGECCDFGA HGDCBBCDD ABCCDEFGH HHBBCCCDD ABBDEFGGH BDHHGEDAB
253,GGFFFECAA HHFEDCCBA HABBDEFFG AABDFFGGG FGGGFECAA HHGDCBBBB HHEFDACCC HDHBCCCDD EEFFFFFAA CCCCDDEHC BBBCDEFHH BCCBCDEGH BBBCCCGHH AECFHGFCA HGGFECBBA
254,HGFEDDCBA AAEFGGFFF DAADFFGGG FFGGGDAAA CBBBCFGHH HFBABDEEE CBCEGHFBB BCHDDGCFB ADDDDGFDH ABCCDDFHH AABDDEGHH BBBCCDFGH AABCEFGGH HCCCCDDDD AADEFFGGH
255,DGGGFEDBA EEDCCCCBH HHEDCCCBB AACDFGGGG CCCBBBFHH DBAADGGGG HHFCBBCCB HFEGFFCBA AFCDDDFFH CCCCCCEGH HHFCAACDD EEEFFFFFA AABCEFGGH ABBDEFGGH AADEFFGFH
256,DGGGFEDBA CCBBBFHHF HGFDCDDDA AACDFGGGG DCCCBBEHH DBAADGGGG HFCACDEFB EAEFFDAEH FCABEGGHC BCCBBDFHH AADFFFFGG ABCDDDFGH HHGBBCCCC ABBDEFGGH AADEFFGGH
257,DGGGFEDBA EEDCCCCBH FBABDEFGG HHBBCDDDD HHGEDCBBA AEDDEFFFF HGEEEBACD FAGFFFEEA HHFBBEFBA CBCEDBEHH AABCDEGHH ABBCDFFGH HHHFBBBBB ABBDEFGGH AADEFFGGH
258,DGGGFEDBA HHFEDDDBA AEDEFFFFF FGGHEBBBB HHGEDCBBA AABEFGGGG HFCBBBBFH CDGHFBDBB GGECFFEAA BBCBDDGHG AABCDEGHH ABCCDEFGH GGGGGCAAB ABBDEFGGH AADEFFGGH
259,DGGGFEDBA EEDCCCCBH HHFDCCBBB GFAACEFFF FEDDCCBBH CBABDGGGG HHFDCCDBA HGGFDBCBA GHFBABCGE ABCDDFHGH AACFGGFGG ABBCDFFGH GGGGDBBBB ABBDEFGGH AACDEFGGH
260,HGFEDDCBA AADFGGGFF DAADFFGGG HHDBCCCCC ABCFGGGFE HDAACFFFF EBAEFFGGB CCCDEFDBH CCDGGFBBF BCBDCCFHH AABDDFGHH FFFFFFFCA AABCEFGGH ABBDEFGGH AADEFFGFH
261,GHGFEDCBA AADFGGGFF DAADFFGGG FFGGGDAAA BBABDFGHH HFBABDEEE BBCBBFGGH BCFCGDBFG CCADDDHHD BBBBCEFHG AABCDEGHH ABCCDDFGH AABCEFGGH HHGBBBCCC AADEEFGGH
262,HCFEEDCBA CCCBBBGHH GFFFGGBAA AACDFGGGG AGFFFFEDC EBAADGGGG HGFECBBBB CCBEEHHBC HFFEDDCAD GBCBBCFEH FGGGGFBAA FBCBCCDGH AABCEFGGH ABBDEFGGH ABEEEFEHB
263,DGGGFEDBA HHFEDDDBA ABBCHGGFE BCEGGHDBB HHGEDCBBA BBBBCFGHH BFGGGFCAA HGFFEDCBA HHGEDDCAA GFDCBBAFH ABBCDEFGH AAEEFFFFG ABBCDEFGH HHGCBBBCC AADEEFGGH
264,DGGGFEDBA GHFEEDDBA AEDEEFFFF GGHFBBBBB HHGEDCBBA AADEFFGGG HBDCCCCCH GGFEEEDDA AGGFFEDCC CDEBCCHGE AABDDEGHH ABCCDEFGH EEEEFFFFA ABCDEFGGG GGGFEDBAA
265,DGGGFEDBA CCCCCCCHH DAADFFGGG HBBCDDEEE HHGEDCBBA BCAADGGGG ABBCDEFGH ABCBCDGGH BCBBCFGHH FCCBCBDHH HHGECBBBB ABCCDDEGH HHHFBBBBC ABBDEFGGH AACDEFGGH
266,HGGFEDDBA HGFEEDDBA BDBBCEGHH AACEEFGGG FFFFFFDAA HHGFDBBBB CEEAFFEEE HHGCDDDAA ABEEFFFGG EFDBBBBHH ABCDFFGGG CABBDEEFH AEEEEFFFF ABACEFGGG FGHFEDBBA
267,HGFEDDCBA AADFGGGFF EAADFFFGG HHCCCCCCC ABCFGGFFE HDAACEFFF DAACFFFGH HGGEDDDAA BBDGGDFGB BBEFEBFHE AABCDEGHH GGGGGCAAA AABCEFGGH ABBDEFGGH AACDEFGGH
268,DGGGFEDBA GHFEEEDBA AAGHGEEDD CDGHFBCCC HHGEDCBBA AABDFGGGG HHGFDCBBA HHGFDCBBA HGEEEECAA ABEEDDFGH BBBCCDFHH ABDDDDFGH ABBCDEFGH HCCCCDDDD AACDEFGGH
269,HHFFEDCBA AADFGGGFF DAADFFGGG HHGCBCCCC AACEGGGGF HEAABEFFF CBBCFGHCD GCCGCCCFC GGGFDDDAA CCABDDEHH AABCDEGHH EEEFFFFFA AABCEFGGH ABBDEFGGH AADEFFFFH
270,DGGGFEDBA FFDCCCBAH DAADFFGGG HHGBBCCCC FEDDCCBBH CCAADGGGG ABBCDEGHH AACCEFFGH AABCFFEGH DDCEGCEGB HGECBBCCC ABCCDDFGH HBBCCDDEE ABBDEFGGH AADEFFGFH
271,DGGGFEDBA DDCCCCCHH GBABDEFGH HHABCDDDD HHGEDCBBA AEDDEFFFF HCBCBEEDE FHGABDDDC HGGFEDBAA HCBBBBEGG AABCDEGHH ABCCDEFGH FFFFGGBAA ABBDEFGGH AADEEFGGH
272,HGFEDDCBA AADFGGGFF DAADFFGGG HCBCDDDDD AADGGGFED HDAACEFFF AABDEGGGH HFEBBCGCE BDHHEBBFB ABDEFBFHG AACDDEGHH EEEEFFFFA AABCEFGGH ABBDEFGGH AADEFFGFH
273,DGGGFEDBA EEDCCCCBH HHFDCBBBB DFFABEFFF HHGEDCBBA ACDDEFGGG HGGFECBAA HHGEDCBAA HGBBEFBCC GEFCCABFH BBBCCEFHH ABDDEEFGH AABCDFFGH ABCDEFGGH AADEEFGGH
274,DGGGFEDBA HHFEDDDBA AAGHGEEDD CDGHFBCCC HHGEDCBBA AABCFGGGG EGGGGDBAA HGGEDCBAA HHEBDEDBB CCBBCCEHH BBBCCDFHH HGDBBBCDG EEEEFFFFA ABBDEFGGH FFHGFDCAA
275,GFFFFECAA FFDDDCCHA HHGBABCDE AAEEFFGGG FGGGFECAA HEDDCCCCC BCFDBCDHH GFACGCEGB BHFEEFDBB BBDFBBGEH FBEACFEFF CDGCCCEBH BBBBBFHHH ABBDEFGGG EGHFEDCBA
276,CGGGFFDBA GHFEEEDCA GBABDEFGG HHGBBCCCC HHGEDCBBA ADDDEFFFF HFFEAADDE BGGFFFEAC AGGGFBCDD CCBBCCFHH AABDDEGHH ABCCDEFGH AABCDFGGH HHGBBCCCC AADEEFGGH
277,DGGGFEDBA HHFEDDDBA AEDEFFFFF GGHFBBBCB HHGEDCBBA AAEEFFGGG HGDCCCCBC HHGEEDCAA HEHFCECBB BDBBCDGHH AABCDEGHH AABDDEFGH GGGGGCAAB ABBDEFGGH AADEFFGGH
278,AHGGFEDCA HHGCACCCC BBABFGGGG DDEGGHEAA HHGFDCBBA GHHGDBBBB ECBCCDDGH EDEABCEGH EFFGDCABG FFFFEDBGA AAEFFFFFF ABCCDEFGH AABCDEFGH ABADEFGGG DFGEECDAG
279,DGGGFEDBA DDDCCCCCH EBAFGGFED HHGBBCCCC FEDDCCBBH FCAACFGGG AABCDFGGH ABBCDFGGH ABCEEFGGF DDCFFCFHA HGDBBCCDD ABBCDEFGH HBBCCDDEE ABBDEFGGH AADEFFGFH
280,HGFEDDCBA AADFGGGFF DAADFFGGG HHCCCCCCC ADGGGGECA HEAABEFFF EAACFGEGH GGEBFBAEF FHEBBDBEF CCACCCEHH AABDEEGHH ABBCDDEGH HHGBBBCCC ABBDEFGGH AADEFFGFH
281,DGGGFEDBA EEDCCCCBH FBABDFFGG HHABCDDDD EEDDCCCBH FBAADFGGG HGFECACAD AABFFFEHE GHHDBCCCA DDCBCBEGH AABCDEGHH AACCDEFGH HHBCCCCCD ABBDEFGGH AADEFFGGH
282,AHFGGEDBA HGFEEEDAA DCBBBCEHH AABDEFGGH HFDDCCCCB GHHGDBBBB AACDFFHHD CEEBCCFDH AACDEGGGG EEEEEFDHA AFEFEEFFF ABCCDEFGH AABCDFFGH ABBDEFGGG DFGEECDAG
283,DGGGFEDBA GHFEEEDBA ADDEFFFFF GGHFBBBBB HHGEDCBBA AACEFGGGG ABBDEFGGH ABCDEFGGH ABDDBCFHH ABBBDDGHH AABDEFGHF HGGECBBBC AABCEFGGH GGGGEBBBB AADEEFGGH
284,DGGGFEDBA HHFEDDDBA ADDEFFFFF FGGHEBBBB HHGEDCBBA AABEFGGGG EFCDDEGFA ADDEFCFHC FEEFHFCAB CBBBDEHGG AABCDEGHH ABCCDEFGH AABCEFGGH ABCDEFGGH GGGFECBAA
285,DGGGFEDBA HHFEDDDBA AADGGGFED BCFHHEBBB HHGEDCBBA AABDFGGGG HHGEDCBBA HEGGEDCBA HGGFECABB CCCACDGHH ABBCDEGHH BAEDEDDFH ABBCDEFHH ABCDEFGGH FFHGFDCAA
286,HGEEFFCBA HHFEDCCBA HABBDEFFG AABDEFGGG FGGGFECAA HHGECBBBB HHFECDEBA HCDBCCDDE GGGGEBBBB BCCCCDDHH BBBCDDEHH ABDDEEFGH AABCEFGGH AEEEFFFFF FGHFEDBBA
287,DGGGFEDBA CDCCCCCHH DAADFFGGG HHBBCCDDD DDCCCBBHH FCAACFGGG AABDEFGGH AACCDFGGH AGGEDEECB FFFFFEEDA CBABCEGHH EEEFFFFFA AABCEFGGH ABBDEFGGH AADEFFGFH
288,GGGGFECAA HHFEDCCBA EFHDCCCCC ABBCCFHHH GGGFFECAA EEEEHHCAA AACCEFGGH FHDBEEBAF HBFDADFFF BCCBCCDHH AABCEFGFH CCCCCCEFH ABBCDFGGH AEEEFFFFF CFHGFDCBA
289,DGGGFEDBA HHFEEDDBA AAGHGEEDD BDGHFBCCC HHGEDCBBA AABCFGGGG FGGGFEBAA HGEDCCDDA HHGFDBBBA AABCEFGHH ABBCDEFGH AADGFEEFH ABBCDEFGH HHCCCCCCC FFHGFDCAA
290,DGGGFEDBA GHFEEEDCA AEDEEFFFF GGHFBBBBB HHGEDCBBA BCAADGGGG EAAFFFFEG HEEDDCCCB AABGGGFEE CCEBBBEHH AACDDEGHH ABBCDEFGH AABCDFGGH HHHFBBBBB AADEEFGGH
291,HDFEEDCCA BBBBFGGGG HGGGCBBBB BBCCDEDGH EHFGFECAA EBAADGGGG CDHFGEBAD DBABFDFHG HDDDHDCBB EDDDDCEBH HHDCCCCCC BBBCCDEGH AABCEFGGH ABBDEFGGH AACDEFGHG
292,DGGGFEDBA HHFEDDDBA DAADFFGGG HHGBBCCCC HHGEDCBBA BBBBEGGGG AACDEFGHG AABDEFGGH ABBDEEFGH ABCCDEGHH BCDEFGHGA HDBBBCDEH AABCEFGGH ABBDEFGGH AADEFFGGH
293,HGFEDDCBA AADFGGGFF DAADFFGGG HHBCCCCCC ABCFGGFFE HEAABEFFF GECBACEGH CCFGDDBFG CDHFGGBBB BBBECDEHH AABCEEGHH BBBBCDFGH HHBBCCCDD ABBDEFGGH AADEFFGFH
294,DGGGFEDBA DDCCCCCHH HGECCBCCC FEABCEFGG DDCCCBBHH DBAADGGGG HHFEDCBBA HGGEEEBAA BCEHGCBDD ABBCFEFGH AAEGFFFGF AACDEEFGH HHGCBBCCC ABBDEFGGH AADEFFGGH
295,DGGGFEDBA HHFEEDDBA AAEFFFFFG FGGHEBBBB HHGEDCBBA AAEEFFGGG GHGFFCBAB AGBFFFEDD BFFFEEDHA CBCDBDFHH AABCDEGHH AACCDEFGH FFFFFFFAA ABBDEFGGH AADEEFGGH
296,GFFGFECAA HHFEDCCBA GHDCCCCCC AABDFGGGG FGGFFECBA FGHDCCCCC AEFDCGCFG DABEEHGEE HCCCCCCDD CEHCCCCFF BEBCCDEFH BBBBEHEEH AABCEFGGH AAACGGGGG EGHGEDCBA
297,DGGGFEDBA GHFEEEDBA DCABDFGGH GGHFBBBBB HHGEDCBBA AAEEFFGGG GDACCCFGG DGGHFBBBB CGBDGCDFF CCBBCCFHH AABCDEGHH ABCCDEFGH AABCDFFGH HCCCCDDDD AADEEFGGH
298,HGGFFECBA HHFEDCCBA ABCCDFGGH AABEEFGGG FGGGFECAA GGGGFBBBB HHFFCDBAA EFFDEEFGA ABEEFFFGG EEEECAAEH ABCDCDFHH AACDEEFGH AABCEFGGH AEEEFFFFF AABCEFGHH
299,DGGGFEDBA HHFEDDDBA AAEFFFFFF GGGHEBBBB HHGEDCBBA AABDFGGGG AABDEFGHH ABCCDEFHH AABDEFGGH ABCCDDGHH AACEEFHHC HFDBBBCDF AABCEFGGH HHCCCCCCC AADEFFGGH
300,GFFGGEDBA HGFEEEDAA DCBABEGHH AACDEFGGG FGGFFECAA HGGFDBBBB EABDEFHHB DDFABDEGH HGBEFCCCC BBCFFDBHH AABDFGGGG BBCCCDEGH AABFFFFGG ABADEFGGG FGHFEDBBA
301,DGGGFEDBA HHFEDDDBA ADDEFFFFF GGHFBBBBB HHGEDCBBA BBBBEGGGG AABDEFFGH BBACEFGGH ABDDDEFGH BBBCDDFHH CCDFGGHEA HEBBBCDEG AABCEFGGH HCCCCDDDD AADEFFGGH
302,FHGEEDCBA HHFEDCCBA GGHCBCCCC AABBEGGGG GGGFFECAA DDDDGHDBB AFEADGDFG EAAFFFFFF HCCCCDDDD BCCCCCDHH ABCFHHDCD FABFFCCEH ABCDDFGHH AAFFFFFFF DFHGEDCBA
303,DGGGFEDBA GHFEEEDBA AACGHFEEE BCFHHEBBB HHGEDCBBA AABDFGGGG GHGFECBAA HFFDEGDBA HFEFFFDAA CDCCBBEHH AABCDEFHH AGHFECCCE ABBCDEFGH HHGBBCCCC AADEEFGGH
304,GFFFGEDCA HGFFEEEAA DDBABEGHH AACEEFGGG FFFFFFEBA HHGGDBBBB CCADHFEEE HEEDEBCFA EEFFFBDGA DDDBBBDGH AABDEFFGH DDCBCBCGH AABCDEGGH ABADEFGGG FGHFEDBBA
305,GGFGFDCAA HHFEDCCBA HHDCBCCCC AABCFGGGG FGGFFECAA FGHECCBBB BCFCBEEEH HGEFCCCAC ABEEFFFGG AABDCFFHH BBCDBFGFH DDCBCCEGH BBBCCCGHH ABBDEFGGG EGHGEDCBA
306,DGGGFEDBA DDCCCCCHH HHFCBBCCC EDABDFGGG DDCCCBBHH DBAADGGGG HHGFECBAA HGFEDEECA GGGFCAABG CBBCCDEGH AABCEGHGG ABCCDEFGH HHGCBBCCC ABBDEFGGH AADEFFGGH
307,HGFEDDCBA AADFGGGFF DAADFFGGG HHCCCCCCC ABCFGGGFF HEAABEFFF BAACFGGGG GGEABCFFF BGFDGDBFB EEECABDHH AABCEEGHH BBBCDDFGH GGGGGCAAB ABBDEFGGH AADEFFGFH
308,DGGGFEDBA DDCCCCCHH HHFCBBCCC EABCEFGGG EEDDCCBBH CBAADGGGG HGFFDCBBA AHGFBBEFD HHEFCBBBB BBBCDDGHH AACFGFGGF ABCCDDEGH HHHFBBBBB ABBDEFGGH AADEFFGGH
309,DGGGFEDBA HHFEDDDBA AAEFFFFFF GGGHEBBBB HHGEDCBBA AABDFGGGG ABBCEFGGH AACDFFFGH ABBCDFGGH ABCCDDFHH BBDEFGHFA HGECBBBCF ABBCDFGGH HDCCCCDDD AADEFFGGH
310,GHGFEDCBA AADFGGGFF DBADFFGGG GGGHEBBBB BBABEGGGG HFBABDEEE FAEBCDGFG HGBCGCECB ABFDBDHGF FCCCBBCHH AABCDEGHH BBBCDDFGH ABBCEFGGH HDCCCCDDD AADEFFGGH
311,DGGGFEDBA GHFEEEDBA AAEFFFFFF GGGHEBBBB HHGEDCBBA AACEFGGGG ABBCDEGHH AABCDFGGG ABCEEEFGH ABBCDEGHH AABDEFGHF HHGEDBBBC AABCEFGGH GGGGGCAAA AACCEFGGH
312,DGGGFEDBA EEDCCCCBH HHFCBBBCC EAACEFGGG DDCCCBBGH DBAADGGGG HHFDDCBBB HHFDCBABD BCHEEFFBB BBCCCCEGH ABEDCDFHH FFFFFFFAA AABCEFGGH ABBDEFGGH AADEFFGFH
313,DGGGFEDBA GHFEEEDCA GCABDEFGG HHGBBCCCC HHGEDCBBA AAEEFFGGG EBFBBFFEF HHBCBDDDC HGGFEDBAA EEDEDACGG AABCDEGHH ABCCDEFGH AABCDFGGH GGGGEBBBB AADEEFGGH
314,GFFFFFDBA HHFEDCCBA DFHDCCCCC AABCDFGGH GGGFFDCAA DDDDGHDBB ABBEHFGED CGGFGGBAC EEFFFFFAE BCCBCCEHH AABDEFHGG CCCACEFFH ABBCDFGGH AAEFFFFFF ADHGFEDCB
315,DGGGFEDBA EEDCCCCBH HHEDCCBBB GGAACEFFF FEDDCCBBH CBABDGGGG HHEDCCBCB HHEDCCBCB AAECCGGFH CCCBBCEHH HDBBBCEGH EFFFFFFFA AABCEFGGH ABBDEFGGH FFHGFDCAA
316,GGGGFECAA DDDCCCCHD HHGBABCDE AADEFFGGG FFFEECBAH HGGFDBBBB FGFCEGDCA BEAEFDGDG EEDFBEGAG HGBGEBDEB ACCFDCEHG BBCCCCEGH AEEEEFFFF ABBDEFGGG CFHGEDCBA
317,HGGFEDBBA HGBCDDDCB AACDFFGGG AABDEFGGH HFEDDCCBB GHGGDBBBB BCEDDEDHE DDFABDEGH FFBDEEDBG AADDEEEHH AABDEEGHH ACCCEFFGH ABBCDEFGH ABADEFGGG FGHFEDBBA
318,DGGGFEDBA BCBBBFHGG FBABDEFGH AACDFGGGG DDCCCBBHH EBAADGGGG HGFADDCCD HFEFGBAAC HGFFEDBAA CCBBCCFHH AABCDEGHH ABBCDEFGH HHGBBCCCC ABBDEFGGH AADEEFGGH
319,DGGGFEDBA HHFEDDDBA AACFFGGGG FFGGGDAAA HHGEDCBBA ABABFGGGG AABCEFGGH AACCEFGHH AACCDFGHH ABCDDEEHH FGGGGEBAA CBBCCDEGH GGGGEBBBB ABBDEFGGH AADEFFGFH
320,FGGGEECAA HHFEDCCBA DDGHDCCCC ABBCDEGHH GGGFFECAA EDDDHHCBB BCFCGGDDD EBFDBDCEH BCCCCGEHD EECABFFEH BCBDCDHGD BDDCBBFHH AABCEFFGH AAFFFFFFF BEHGFECCA
321,DGGGFEDBA CCCCCCCHH DAADFGGGF HHBBCCDDD HHGEDCBBA ADDDEFFFF AABDEFGGH AABDEFGGH ABDDDEGGH CCBCDCEHG GGGGFCBAA BBBCDDFGH GGGGGCAAB ABBDEFGGH AADEFFGFH
322,HDFEEDCBA CCBBBEHGF HGGFFCAAB BBCCDEDGH FGFFFECAA DBAADGGGG CBABCEGHH BCEEDBBHH EHDCBBDED DDEDEFDHA HHHEBBBBB EDCCBBDFH AABCEFGGH ABBDEFGGH GGGFEDBDA
323,FFHGEDCBA EEDCCCCBH HHGBABCDE AAEEFFGGG DDDDDCCCH HEEDCBBCC AHEEEEBEF HHCCCCCCC BHHFEEBBB FABFGGCGC EBACFFHFF DDDDDADGH BBBBEGGGG ABBDEFGGG EGHFEDCBA
324,HGFEDDCBA AADFGGGFF DAADFFGGG FFGGGDAAA CBBBCFGHH HGCABDDDD BBBCEFHGG EEEBGGCDD EEFCACEHE GDBBBBDHH AABDDEGHH BBBCDDFGH AABCEFGGH FFFGGGBAA AADEEFGGH
325,GFFGFDDBA HGFEEDDCA ACBBDFGHH AACDEFGGG FGGGFECAA HGEECBBBB GGCEFGCAA HHCBBCCDD HHCCCCCCC BCCCCDDHH BBBBDFGHH CCCBCCEGH BBBBEGGGG ABADEFGGG FGHFEDBBA
326,GGGGFECAA FFEEEHDAA EFEBBCCCH AABCDFGGG GFGFFECAA HGCCCCCCC AACDEFGGG HCDCCCDDD FBEACGGGG BCCCCCDHH DDFDDDCEF CBBBCEFHH BBBBCFHHH ABBDEFGGG DFHGEDCBA
327,DGGGFEDBA HHFEDDDBA AAEFFFFFF GGGHEBBBB HHGEDCBBA AACEFGGGG AABDEFGGH ABBCDEGHH ABBCDFGHH BCCBCCFHH BBCEFGHGA HFCBBBCDG EEEEFFFFA ABBDEFGGH AADEFFGGH
328,GFFFFECAA HHFDDCBAB HHGBABCCD AAEEFFGGG FGGGFECAA HHDDCCCCB HHBEEBBCC DAGEEDEEG GCCFFAFED GDAACGHEC BAECDFHGF BECCDBEGH AAFFFFFFF ABADEFGGG FGHFEDBBA
329,DGGGFEDBA GHFEEEDBA ADDEFFFFF GGHFBBBBB HHGEDCBBA AABDFGGGG AABDEFGGH ABBCDFGGH ABCDFFHGF ABBBEEGHH AABCDEGHH HHGEDCBAB AABCEFGGH FFFFGGBAA AADEEFGGH
330,DGGGFEDBA EEDCCCCBH HHEDCBBBB FEABDFGGG DDCCCBBHH DBAADGGGG HHGDCCBBA HHFEBBCBB HEGBACEFC DCCCBBFGH ACFFEEFGG ABBCDEFGH EAABDFGGH ABBDEFGGH AADEFFGFH
331,GGGFEECAA AADFGGGFF DAADFFGGG HHCBCCCCC ADGGGFEDB HDAACEFFF BBDBDGHHD DDDEFGECC FFCAFFEEE DCCCCBCHH AABCDEGHH EEEFFFFFA AABCEFGGH ABBDEFGGH AADEFFGFH
332,HGFEDDCBA AADFGGGFF EAADFFGGG HHGCBCCCC AACEFGGGF HFBABDEEE DBABEFGGG HCCBBBFGH FFDBFFFEA CCBBCCFHH AABCDEGHH BBCCDDEGH AABCEFGGH HDCCCCDDD AADEFFGGH
333,GGGFEECBA AAEFGGGFF EAADFFFGG GHHFBBBBB AAADFGGGG HEBABEFFE GBBFGGCEB BEFGFABEE BBHECCGFF CCBACDFHH AABCDEGHH BBCCDDEGH GGGGEBBBB ABBDEFGGH AADEFFGFH
334,HGEFGECAA HGFEEDDCA CCBACEGHH AADDEFGGG FGGGFFCAA HGFEDBBBB HHDFFCBBB HHEDBCEBA ABEEFFFGG BCCCCDDHH BBBCCDFHH AABDEFFGH AABCEFGGH AAFFFFFFF AABCEFGHH
335,DGGGFEDBA GHFEEEDBA AAEFFFFGG EFGGHDAAA HHGEDCBBA AABEFGGGG EGEDDDHAD HHEFCCBBB EDDCCBBHH CCBBCCFHH AABCDEGHH ABCCDEFGH AABCEFFGH HHCCCCCCC AADEEFGGH
336,DGGGFEDBA DDDCCCCCH GBABDEFGH HHBBCDDDD DDCCCBBHH FBAADGGGG HFEDDDDAD HHGDDCCBA HGGFEDBAA CCBBCCFHH AABDDEGHH ABCCDEFGH AABCDFGGH HCCCCDDDD AADEEFGGH
