,0
343,AAABCDDDDDC CCDDDCCCAAA DCAAABBCDDD AABDDDCCBBA CBAAABCCDDD ABBCCBCCDCC
344,DDDCCCBAAAA AABDDCDCCBA BBAAAABCDDD DDDCBBAAAAB AAABCCDCDDC BBBBAADDCDC
345,BCDDDCBCBAA ACDDDBBBBAA AABCDDDCBAA AAABDDDCCCC CDDDDCAAAAA AABCDCAADDD
346,ABDDDDCCBAA CCBAAAABCDD ACDDDDCCBAA AAAAABCDDDD DDDDCBBAAAA AAAABBCDDDD
347,DDCBBCDCBAA DDDBBAAAABD ABCDDCCACDA AAAABCDDDDD DDDDCCBBAAA ABAAABCCDDD
348,CCCCDCADCAA ACDDBBCBACD BBBBAAACDDD DDCBAAABCCC BBBCBCDDDAA ABCDBAACDDC
349,ABCDDDBCCAA AACDDBAACDD DACDDCAAABA AAAABBDDDDD DDDDCBBAAAA ABBAABCDCDD
350,AAABBCCDDDD CCDDDCCBAAA CAAAABCCDDD DDDCCBBAAAA AAAABCCDDDD DCBAAACDDDA
351,DDDCBAAABAB BBAAAACCDDD CCCDDDDCBAA AACDDDCBABC AABCDDDCBAA DDDCBBBAAAA
352,DDCBBBBBAAA AAABBCBBCDD AABCCCDDDCB DBCDDBCAABA DDDCBACBBAA AAABBCCCDDD
353,BCDDCDCABAA AAACDCBCDDD AABCCBCCDDB DBAAABCDDDD CCDCCDDCBAA ABCDDAABDDC
354,DDDBAACBBBA DCBAAAABCDD AAABCCCCDDD DBAAABCDDDD DDDDCCBAAAA BBBAAACDDDD
355,DDBAACBBCBB BAAAABCDDDD DDDDCCAAAAB ABCDDDCCBAA AAAACCDDDDD BBAAAABDDDD
356,DDDCBAABBAA ADCBDCCDDAA BAAAABCDDDD DCBAAABCDCD CDDDDBAABCB AAABBBBCDDD
357,BAAACCBACDD DCCDBACCBAA CBAAABCCDDD DDDCBBAAAAB AABBCDDBABD DCDDDCBAAAB
358,AAABCCDDDDD DDDDDCBBAAA AAABBCCDDDD BCDDDCCBBAA CCBAAABCDDD ABCCBDCDDBA
359,CBABDDDDBAA ABCBACDBBDD CDCBCDBACBA DDBAACDCBBC CDCBAABDDCA ABCDCAAACDC
360,DDDCCCBAAAA AAAABBCCDDD ABDDDCDCBBA DDCCDDAAABB DDCBBABACBA AAAAABCCDDD
361,DCAAABCCDCD AABCBDBDCCC ABBBDCDBCCC AAADDDABCCC DDCDCCABAAB CDDCCCABAAA
362,DCBAACDDCBA AABCDDCDDCA ADDCAABDCAA BBAABDBCDDC DDCBAAABCDC DCBCDBAABDC
363,DDDDCCBBAAA AAAABCDDDDD DDCCBBAAABC ABDDDDCBBAA BAAABCCDDDD CCCBAABACDD
364,DDDCCBBAAAA AAAAABBCDDD AAACCCCDDDB DDABDCBBAAA CDDDDDCBAAA DDDCBABABBA
365,CCCBBDDCBAA BBABABABCDD AAABCCCCDDC DCAAAABCCDD DDDCCBBBAAA AAAAABCDDDD
366,AABACDCBBCD DDBAAACDDCA AAABBCCDDDD BDDDCCCBAAA CDDCAAABCDC AABCDDCABDD
367,CDCCBBACCCA AAABBBBCDDD AAABCCCDDDC DCAAAABCCCC DDDCAAABBBB BBAAABCCCDD
368,BBBBBAABCDD DBCCAABDDBB CCBAAABCDDD DDDCCBBAAAA AABBBCDCDDC CCDCCDDCBAA
369,DDCBAACCABC BBCDDDCCBAA BAAAAACCDDD CDDDCCBBAAA AAAABCCCDDD DDBABAABADC
370,BCCDDDCCBAA DDDCCCBAAAA AAABCCBBCDD DDDCBAAABBC CCDDDDBAAAA CBBAAABCDDD
371,DDCBAABBBCC AAABBCDDDBB DDDCCAAAABB CDDDCCBAAAA AABBCCCCDDD DCDDDCBAAAA
372,DDDCAABAABB AAAABCBCDDD AABDCDCCCBB AABDDDCCCBA DDDCBBAAAAB CCCCCCDBBAA
373,DDDBBBBBAAB AAABBBBDDDD AABCCDDCCCB DBCDDDCAAAA DDDCDBABAAA DDDDBCCAAAA
374,ABCDDDDCBAA CCBAAAABCDD ABCDDDCCBAA AABAABCDDDD DDDDCBBAAAA AAAABBCCDDD
375,DBACDDDBAAA CDCAAABDDCB AACDDCAAABC AAAABCCDDDD DDCCCCCCCAA CAAACBBDCCD
376,CCAAABCBDDD BCDDDDCBBAA CBAAABCCDDD DDCCBBAAABC AAABBCCDDDD DDDDCCBBAAA
377,ABCCDCBDDBA BDDCDCAAABD ABDDDDDCAAA CDDDCAAABBB CBBAAABCDDC AAABCDCBCDD
378,DDDDCCCBAAA DDCCCBAAACD ABCDDDDBAAA CDDCBAAAACD DDDCBAABBBA BAAAABBCDDD
379,BBAAABCDDCD DDDCCBAAAAB AAABCCCCCDD CAAABCCDDDD DDDDCBBBAAA CCBBAADDDCB
380,ACDDDDCBAAA CCCDDDCBAAA AABBCCDDDCC ACDAAABDDDC DDCBAAABCDD DDCBBAAABCD
381,AACDDDDCBAA CCDDDDCBAAA AAABCCDDDDC AAACCCCDDDC DDDCBAAABCC CCBAAAACDDD
382,AAABBCDDDDD DDDDCBCAAAA CBAAABCDDDD BCDDDCCBBAA BAAABBCDDDD AABCDDDCBAA
383,BAABAACCDDD BABDDCDABCA BAAABBCDDDD DDDCCBBAAAA AAABBBCCDDD CCCDCDDCBAA
384,ABABBDDDDBA DDBBBBBBBAB AAABCCCCDDD CBAAABCDDDD DDDCCCBBAAA BAABACCCDDB
385,CCBACCDDCAA DAABCBABBDD AABBBCCCDDB BAAABBDDDDD DDDDBBBAAAA CBAAABBCDDD
386,AAABCDDCDDC BBCCCDDCBAA DDCBAAABCDD CDDDCCBBAAA AAABBCCCDDD DDDDCCBBBAA
387,DDDDCCBAAAA CBABABABCDD ACCDDDDCBAA AABDDCBCCCC DDDDCBBAAAA AAAAABBCDDD
388,AAAACCDDDCC CDDDDCCBAAA AAABBCCDDDD CDDDCCBBAAA CBAAAABCDDD AAAABCCDDBC
389,BCDDDDBACAA CCBABDDDCAA AAAABBCCDDD BDDDCCBBAAA CBAAABCDDDD ABBBAADDCDD
390,DDDCBAAABBC BAAAABCDDDD DDDDCBAAAAB DDDDCBBAAAA AAABCDDDCCC DDDDCCBAAAA
391,BBBCDDDCABA DDBBBAAABCD ABBAABCCDDD AAAABCCDDDD DDDDCCBAAAA AAAAABCDDDD
392,DBCCDCCAAAD AAACCCBBCDD DDCCCDDBAAA DDCCACDCBAA AABDCBABDDC BAABDDDBABC
393,ABCDDDCCBAA DDCBAAAABCD ABCDDDDCBAA AAAABBCDDDD DDDDCCBAAAA AAAABBCDDDD
394,DDCBAAAABCC BBDDDCCCCAA BBAAAABCDDD DDCBAAAABCD ABCDDDDCBAA DCAAABCCDDC
395,DDDCCCCBAAA AAAABBBBDDD BCDDDDCCBAA AAABCCCCDDD DDDDCCBBAAA AAAAABCCDDD
396,DDCBAAABBCD AABBBCCCDDD DDDDCCBBAAA AABCDDDCBBB AABBCCDDDCC DDDCCBAAAAA
397,BDDDDCCBAAA DDDDDCBBAAA AAABBBCCDDD DDDCBAAAABB BABDDDCABCA CCBAAAABCDD
398,BBBAADDDDBA AABDDDDCBBA ABDDDDBAABB ACDDDDCBAAA DDDBAAABCDD DDCAAABCDDB
399,AABAADDDCBB DDDDCBAAABC DCBAAABCCDD AABDDDDCBBA DDDCAAAACDD DBAACDDDBAB
400,CCDDCBBDCAA BCCBAAACDDD BAAABCDDDBA BAAABDDCCCD DDDDBBAAAAB BABBDDBAADD
401,AAABCCCDDDD DDDDCCBBAAA AAABBCCDDDD DDDCCBBBAAA AAAABBCDDDD CBDCCCCBCAA
402,DDDDCCBBAAA BBBAAAABDDD AABBCCCDDDA BAAAABCDDDD DDDDDCBAAAA BBAAAABCDDD
403,DDDAABBABBC CDDBCCCABAB AAABBCCDDDD DCAAABCDDDC DDDDCCBAAAA AAAABBCDDDB
404,CCDBAADDCAA ABDDCAAACDD CACBDDDAAAB BAADDBBDCCD DDCCBCDCAAA DDBAACDDAAC
405,AAABCBABDDD DCBAAACDDCB AAABCCCCDDD DDCCBBABBAA BCDDDBAAACD DDDCBAAACCC
406,DDDDCCCBAAA CBAAACCCCDD BBCDDDCAAAC DBAAABCDDDD CCDCCCDDBAA ACCCAABCDCD
407,DCBABAAABDD AAABCBCDDDC DDDDCCBAAAA BCDDDCBAAAB AAABCCCDDDD DDDDCCCAAAA
408,ABBBCDCAACD DDBAAACDDCB AABCCCCCCDD DDDCBAAAABB CBBABCDDCAA ABCDDCAAACD
409,AAACDCCDDCB BABDDDDBAAA CCBAAABCDDD BCDDDCBAAAA DCBBBDDDBAA CBABDDCAACD
410,CCDCCDCBAAA BAABBBACDDD AAACDDDDDCB AAABDDDDCCB DDDCBBBAAAA AAABCDDDCBB
411,DDDCBBABBAA AAAABBCDDDC DCCBAAABCDD DCBAAABCCDD DDDDCBBAAAA BBAABCDDDCB
412,ABDDDDDCBAA DCBBAAABCDD ABCDDDDCBAA AABAABCDDDD DDDDCBBAAAA AAAABBCCDDD
413,BACDBDDBACC CAAACDDCABC CDCAAABDCBC AACACCAACDD CBBCDDBAABD CAABDDBAACD
414,ABCDDDDCBAA DDCBAAAABCD ABCDDDDCBBA AABAABCDDDD DDDDCCBAAAA AAAABBCDDDD
415,DCCBAABDCCC AAAABBCCDDD DDDDCCCBAAA AAABCDDDCCB BBAAABCDDDD BCDDBDBAABB
416,BBAAABDDDDC AAABBBCDDDB DDBAAABBCCD DDDDCCBBAAA AAABCCDDDDC ABBBCDDDCAA
417,ABCCDDDCCAA DCDDCCCBAAA AAAABCCCDDD BDDDCBAAABB CCCDDDCAAAA BCBAAAACCDD
418,CDDDDCCAAAA ABBBCDDDCBB AAABBBCDDDD DDDCCBBBAAA CBAABCDDDBB CCBABCABDCD
419,AABCCDCAADD CAABDDCBCCB AACCCBCDDDB AAACCCBCDDD DDDDCCBAAAA BCBABDBACDC
420,CCCBDDCCBAA DDDCCCCBAAA AAAABBCCDDD DDCBAAABBBC AACDDCBCDCA CCAAAABDDDD
421,AAABBBCCDDD CCDDDDCBAAA AAAABCCDDDD AABDDDDCCBB DDCBAAABCCD CCDDCCCBAAA
422,BCDDCDCAABA ABAAACCCDDD BDDDCAAACDC DBAAABCCDDC DDDBAAABBCD DBAAACDDCCD
423,BCDDDCBBAAA DDDDCBBBAAA AAABCCCCCDD CDDCBAAABBC DDCBBCCBBAA CCBBBAAACDD
424,AAABCCCDDDD CDDDDCCBAAA DDDCBAAABBB AAAABCDDDDD DDDDCBAAAAA AAABCCDDDDC
425,BAADCABDDCA ABDDCAABDDC AAACDDDCBBC BAADCACDDCB BBCDDBAAABD DCAACDDCAAA
426,BBBACDDDBAA BDDDCBAAABD DDCBABAABBC CDDDDCBAAAA CCAABCDDDBA AABCDDDDBBC
427,CCBAAABCDDD DDDDCCCBBAA AAAABCCDDDD DDDCCBBAAAA AAABCCDDCDD CCCDDDCBBAA
428,BBBABDDDCBA CCBBAAABCDD AABBCCCDDDB DDBAAAABCCC DCCCCCDCAAA BBBABBABCDD
429,AAABBBCDDDD BBBAAABCDDD CCDDDDCBAAA DCBAAAACDDD AABBBCCCDDC CBCCCDDCBAA
430,AAAAABCCDDD CCCCCDCBAAA BAAABBCDDDD CDDDCCBBAAA BAAABCDDDDD BBBCCDDDCAA
431,ABCBCDBDCAC DDDDDCCBAAA AAABBCCDDDD DDDCBBBBAAA BBAAABCCDDD DDBBBAACCAC
432,BCCDDCCBAAA DDDBBCBBAAA AABBBCCCBDD DDDCBAAABBB AABCDCBDDDA CCBAABABCDD
433,DBAACBAACDD CDCBACBAACD DDCCBCCBAAA BCDDDCBAAAC ABAADDDDCAC CCCDDDCBAAA
434,CBBDCAAADDC BAACDDCABBD DCACBCCBAAA AABDCBCCCCD CDCBBBCDDAA ABCDCAAACDD
435,AAABCDDDCCC DDDDDCBBAAA AAABCCDDDDD AADDCCCCCBA DDCBAAAABCD AABBCCDDCCC
436,BBDCDCBDCAA AABDDDCCBBC AACDDDDBAAB ABDDDCBAAAB DDDDBBBCBAA ABCDDCAABDD
437,BAABAABCDDD CBBAADDDCBA CCAAAABCDDD DDDCCBBAAAA AABBBCDDDCB CDCCCDDBAAA
438,DDCABCBBBBB AAAABBCDDDD AAABCDDDDDC DBBDDDCAAAA DDCBAAABBBC CCDDBABBBCA
439,BDDDCCCABAA BBBCDDDCAAA AAABBCCDDDD DDDCBBBBAAA DCBAAABCCDD DDCABBABCBD
440,ABCDDDDCBAA DDCBAAAABCD AACDDDDCCBA AAAAABCDDDD DDDDCCBAAAA AAAABBCCDDD
441,DDCBABBBBAA AAAAABBCDDD AABCDDDDCBB DDCBDDAABBB DDCAAACCCBB DCCBCCCCBBA
442,DDCABBBBBBA DDDDDCCBAAA AAAABBCDDDD DBAAABCDDDD DDDDCBBBAAA AABBDCDCBDC
443,DDDCCCBBAAA DCBAAAAACDD AABCCCCDDDA AAAABBCDDDD DDDDCCBAAAA BAAAABBCDDD
444,DDDCCDCBAAA BABAAABCDDD AABCDCDCCCB AAABDDDDCCC DDDCCBBAAAA AAABCCDDDDB
445,CBADDBAACDC AAACDDBABCD DCAACDDAABC DBCBAABDDCB BCDDBAABDDB AABCDCAABDD
446,AABBCDDCDDC DDDDDCBBAAA AAABCCDDDDD AACCBBCDDCC DDCBAAABCDD DDDDCCABAAA
447,CCDDDCBBAAA CDCBBCCCCCA AABDCDCCACD CDDDCBAAAAA DCBAAACDCCD BAAAABCCCDD
448,CDDCBCCBAAA AAACDCDDCBB DDDCCBBAAAA AACDDDCBBAA DCAAAABBCDD BAAABCCDCDD
449,AABCCCCDCCC DDDDDCBAAAA AABBCCDDDCC DDDAAAABCCB DDCBAAABCDD ABCCCDCDDBA
450,ABCDDDDCBAA CBBAAAABCDD ACDDDDCBBAA AABAABCDDDD DDDDCCBAAAA AAAABBCCDDD
451,DDDBAAABBBC AAABCDDDDCB DDBAAABBCDD DDDCCBBAAAA AABBCCDDDCC DDDDCABBAAA
452,DDCAACDCCCB DDCACBBACBC AAABCCDDDDC DCAAAABCCCC DDDDCBBAAAA AAAABBCCDDC
453,CCDDDDCBAAA AAAAACCDDDD CDDDDBAAAAA DDDCBAAABCB AAABBDDDBCD CAABCCAACDD
454,BBCDCDCAACB BCCBAAABCDD CCCCDDDCAAA BDDDBAAACCC CBBBACBACDD CAAABCDDBCD
455,DDDCCDCBAAA CBAAAABBCDD AABBCCCCDDC DBAAABCDDDD DDDDDBBBBAA AAACCABCDDD
456,ABCDDDDCBAA CCBAAAABCDD ACDDDDCCBAA AABAABCDDDD DDDDCBBAAAA AAAABBCDDDD
457,DDDBAABAABC CAABBABBCDD AAABCCCCDDD DDBAAABCCCC DDDCCCBBAAA DDDCBBBBABA
458,AAABBCCCDDD DDDDDCCBAAA AAABCCDDDDD ACDCBBCCCBA DDCBAAABCDD BDDDCBCBBAA
459,AAABBABCDDD CCCBADDCBAA DBAAABCCDDD CDDDCCBBAAA AAABCBCDCDD CBCDCDDCBAA
460,CBAADDCCCAC CAABDDDCBBB ACDDCBCBAAB DBAABAACDDD CCAAAABCDDD ABCCBACDDCA
461,CBBBBAABCDD CBABAABDDDB DDCDDBBAAAB CDDDCBAAABD AABBCDDDBAC DDDDCBAAABB
462,BBBAAACCDDD DDDCCCBBBAA AAAABCCDDDD DDDCCBBBAAA AAABCDDDDDD DBAAABDDDCA
463,DCACDACDAAC AAACCBBDDDC CDDCBCCCAAA DDBAABCDDCB BBCDDDCBAAA ABCDCAABDDC
464,DDCBBBBBABA BAAAABBDDDD DDDDCCCBAAA AABCDDDCCBB AAABCCCCCDD DDBABDDBBBA
465,DBBABCAABDD DDCBBAACCBA CBCAAABCDDD DDCBAAAABDD AABCCDDDBBC DCDDDCBBAAA
466,AAABBCDDDDD DDDDCCBBAAA AAABBCCDDDD CDDDCCBBAAA BBAAABCCDDD ABCCCDDDDAA
467,AAABDDDDCBB DDDCABBCAAB AAABBCCCDDD DDAABBBBCCC DDCBCCBBBBA AAABABBCDDD
468,DDDDCBBAAAA AAAAACCDDCD AABCDDDCBCC AAAABCCDDDD DDDCCCBBAAA BBBAABACDDD
469,DDDDCBBAAAA BBBBAAACDDD AABCDDDDBBC DDDBAABCCCB DDDDCBBAAAA AAAABBCCDDD
470,ABDDDDCCAAA CBBAAAABCDD BCDDDDCBBAA AAAAABCDDDD DDDDCBBAAAA AAAABBCDDDD
471,AAABBABCDDD CCCABDDCBAB DBAAABBCDDD DDDDCCBBAAA AAABBBCCDDD BCDCCDDBBAA
472,DDDCBAAAABC AAABBCDDDDD DDDCBAAAABC DDDCCBAAABD AABCCCCDDCD DDDDCCBAAAA
473,ABBABDDCAAD DDCBAAABCCC AABCDDDCAAA AAABDDDDCCC DDCCCBAAACD CDCAAACDDCA
474,BCDDDCBCCAA AACDDDDCBAB DDDCBAABCBA AAAABDDDDCC DDDCAAAABCB AACDDBABDDB
475,ABBBACCDDDC DDCBBBABBBB AAABBBCCDDD DCAAABBCCCC DDDDCCBAAAA AAABBACDDDC
476,DDDCBBBBAAA ABAAABCCCDD AAABBBCCDDD DBAAABCCDDD DDDDCCBAAAA DDCBCAABACC
477,CDDDDBBBBAA AAAABACDDDD DDBBCCBAAAC CDDDCCBAAAA CBAAAABCDDD AAAABCBCDDD
478,DDDCCBBBAAA AAAABBCDDDD BCDDDDCBAAA BAAAAABDDDD DDDDCCBAAAA AAAABBCCDDD
479,ABDDDDCCBAA CBBAAAABCDD ACDDDDCCBAA AABAABCDDDD DDDDCBBAAAA AAAABBCCDDD
480,DDDBBCBBAAA AAABBCCBDDD ACDDDDCCBAA BBABBDDDBAA DDDCBAAABCC AABBBDDCBDB
481,DDDBABBABBC DDCCABBAAAC AABBCBCDDDC DBAAABCDDDD DDDDCBBAAAA BBBCCDDDBAA
482,DDBAABBBBCC DBCDDDBBAAA CBAAAABCDDD DDDCBAAAABC BCCDDDCBAAA AABCBBDDDDA
483,DDCBBABBBAA BBAAAABCDDD DDDDCBAAAAB ABDDDDCBAAA AAAABCCCDDD DCBBCBCCCAA
484,AAAABBCCDDD CDDDDCCBAAA AAABCCCDDDD DDDCBBBBAAA BAAAABCCDDD DDDCCBBBAAA
485,CCAAAAABDDD BCCDDDCCBAA DDDCBAAAABB BCDDDCCBAAA AAABCCDDDDD DDDCCCBBAAA
486,CCDDCDCAABB BAACCBBDDDD DDDDCBBCBAA AAABDDDCCCC DDDBAAABCCD CBAAABCDCDD
487,BBBCDDDCAAA DDDCBCBAAAA AAABBBBBCDD DDDCBAAAABB BCDDDDBAAAA CCBAABACCDD
488,ABDDDDCCBAA AAABBBBCDDC DDCBBCBBBAA AABDDDDCBBB DDDCBBBBAAA AAABBBCCCDD
489,DDDDCCBBAAA BBAAAABCDDD CCCDCDCCAAA AADDCCBBCCB DDDCCBBAAAA AAABBBBCDDD
490,DDDCBBBAAAA BAAABBBCDDD ABCDDDDCBAA BABDDCBAACB DDDCCBAAAAB BBAABBDDBCD
491,AABCBDDCBCB BCCCCDDDBAA DDDDCCBBAAA ABDDDDCBAAA DDCBAAACCDD AAAABBCCDDD
492,DDDCCCBBAAA AAAABBBCDDD ACDDDCCCBAA CAAAADDBBDD DDDCCBAAAAA AAAABCCDDDD
493,AAABBBBCDDD DCDCBBDCBAA DDBAAABBCCD AAABDDDDCCB DCBAAABCCDD CCBCCCDCBAA
494,DDDDCCBAAAA CCBBAAAACDD ABCCCDDDBAA AAAABBCDDDD DDDDCCBAAAA CBBAAABBCDD
495,DCAAABDBCCD AABBBBBCCDD AAABCBCCDDD DDDCBCCBAAA DDCAAABACBB CBBCDDDBBAA
496,ABBAACCDDCC DDDCCCCBBAA AAABCCCDDDD DDDCBBBBAAA AAAABCCDDDD BAAABCCDDCA
497,BCCBCDDCBAA DDDCBBBBBAA AAABCCDDDDC ABDCBABDDCB DDDCBBBAAAA AAAAABCCDDD
498,BBBDDDCAABD DDCBAAAABDD CBAAABBCDDD DDDBBABBAAB CDDDBAAABCB BAABDDDCABC
499,CDDDDCCBAAA BBBCDDDCBAA AAABCCCDDDD DDDCBBBBBAA BBAAABCCDDD DDDCBAAABBC
