,0
0,ACCBAACDDCA AABDDDDCBAA ACDDCBABCCD ABDDDCCBBAA DCCCBAAACDD CDDCAAABCDC
1,DDDDDCCBAAA ABBCBBBCCDD ABCCDDDDBAA ABDDCBAACBC DDDCCBBBBAA ABAAABBCCDD
2,AACCCBCCBBD CDDDDCCBAAA AAABCCCDDDD DDDCBBBBBAA BBAAABBCDDD DDDCCBAAAAA
3,BBBBCDDDBAA DDDCBAAABCD BAAAABCDDDD DDBBAAABCCD DCBAACDDDBA AABBCDDDCAA
4,ABDDDCBABBC CCDDDDCBAAA AAABCCCDDDD ACDDCBBCBAA DCCAAAABCDD DDDBBAAAACC
5,AAABCCCDDDD DCDDDCCBAAA CAAAABCCDDD DDDCCCBBAAA AAAABBCCDDD DCCBAACCCCA
6,DCCBCDDCAAA AAAAABCCDDD AABCCDDDCCB BAAADDCCCCC DDDCBBBBAAA ABAAACDDDDC
7,BCDDDDBCAAA DBBCACDCBAB BDDDDCBBAAA ACDDBAAACDD DDDDBAAAAAB AAABCDBACDD
8,AAAACCCDDDD DDDDCBCBAAA AAABCCCDDDD DDDCBBBBAAA AAAABCCDDDD BDBCCBDADAA
9,DDDCCBBBAAA BBBBAAACDDD AACCDDDDCAA BDCAAACDDDC DDDCCBBAAAA AAABBABCDDD
10,ACDDDCBBAAA CDDDDDCBAAA AAABCCCDDDD ABDDCCCCCBA CCBAAABCCDD DDDDCBBBAAA
11,AAABBCDDDDD CDDCCDCBBAA CAAABBCDDDD AAACDDDCCCB DDCAAAABCDD ABCBCBDDCCA
12,DCBAABCCDDD BCBABABBCDD AABBCDDDDCB AAACDDDCCBA DDDCBAAAABB CCCDCCCBBAA
13,AABCCDDCCCC DDDDCBBAAAA AABCDDDDCCB AAABBCCDDDD DDDDCCBAAAA AABBBBCCDDD
14,DDDBBAAAABD DBBCBBAAACD AAABCCCCDDD DBAAABCDDCB DDDDCBBAAAA CDBACBDDBBA
15,AAABBCDDDDD DDDDCCBBAAA AAABCCCDDDD CDDDBBBBBAA DDCBAAABCDD ABCCBBCBDDB
16,DDDCBBCAAAA AABABCCCCDD ABCBDDCDDBA BAAABCDDDDD DDDDCCCAAAA DDDCCBBABAA
17,DDDBAABBBBB AAAAABBCDDD CDDDDCCBAAA AAAABDDDDCC DCBAABBCCCD DDCBCCCBAAB
18,DDDDCBAAAAB CCDDDCBBAAA AAAAABCCDDD DDDCCBBAAAA AAAABCCDDDD DDDCCCABAAA
19,ABAAACDDDDB DCCDBAAAABD AAABBCCDDDD DBAAABBCCCC DDDDCCBAAAA ABAAABDDCDD
20,AAABBABCDDD CCAAACDDCCA DDCAAAABCDD ABCDDDCCBAA BAAACBCDDDD CCCDDDCBAAA
21,DCBAAABCDDD AAABCCDDDDB DDDDCBAAAAB BCDDDDCBAAA AAABCCCDDDD DDDCDCBBAAA
22,CAAADDCBACD DBAABDDCAAB CDDBABBCCAA AAAAACDCCDD CCDDCBAACCA AAABBCCDDDD
23,CDDDDCCBAAA BDDDCCBAAAD DDDDCCBAAAA CCAAAABCDDD DDCBAAABBBB CDBAABDDBBD
24,ABDDDDDCBAA CCBAAAABCDD ABCDDDCCBAA ABBAABCDDDD DDDDCBBAAAA AAAABBCDDDD
25,ACDDDDCBAAA DCBBAAAACDD ABCDDDDCBBA BBAAABCCDDD DDDDCCBAAAA AAAABBCCDDD
26,CDDDDCCBAAA DCDCDCBAAAB AABBCDDDCCD DDDBAAABCBB DBAAABCCCDD BBAAAABDDDD
27,DDDCCCBABBA BBAABABBCDD AABCCCCCDDC CBAAABCDDDD DDDDCCBBAAA BAAABBCCDDD
28,DDCAABBBCBA DCCCCBCCCAA BBAAACDDDCA BAAABBCDDDD CDDDCBAAAAA BAAABBDDDDC
29,AAABBBCDDDD CCCCCCDDCAA DDBAAABBCDD CCDDDCBBAAA AAACDDDDCCB DCBAABBCCDD
30,CDDDDCBBAAA DCBBAAABCDD AACDDDCBABC DDBAAAACDDD DDDDCBBAAAA AAAABBBCDDD
31,ABDDCDDCAAA CDCBAAABCDD DDDBAABCBBA AABDDCCBCCD DDDCCCCAAAA CCDBAAACDCD
32,DDCAAABBBCC DDDDCBBBAAA AAAAABCCDDD DCBAAAACCDD BCDDDCBBBAA AAABBCCDDDC
33,CBDCAACDDBA ACDCAAACDDB AACDDCAABCC AAABCBCDCDD DCCCDDDBAAA CDCAAABCCDD
34,DDBAAAABBDD ABAABDDCCDC DDDCCAAAABB BCDDDCCBAAA AAABCCDDDDD DDDDCCCAAAA
35,DDCAAABBBCC DBAAABBCDDD AAAABBCCDDD DDAAABCCCBC DDDDCCAAAAA DDDCCBABBBA
36,AAABBBBCDDD DDDCBDCBAAA AAABBCCDDDD DDDCCBBBAAA AAABBCDDDDD CCDCDDCBAAA
37,CBAAACCCDCD AABBCCCDDDA DDDCBBAAABB BCDDDCBAAAA AAABCDDDDDD CAAABDCDDCC
38,DDDDCBBBAAA AAACCBCDDCD DDDCCBBBAAA AACDDDCBABA CBAAACDDDCD ABAABBBCCDD
39,BCDDDCCCAAA DCBABBAACDD DDDCBABBCBA AAAABCDDDCC ACDABBAACDD ABABCCABDDD
40,ABBBDDBACDD CBAAABDDDCB CAAABDDCCCD AAACDCCDDCC DDDCAAABCDC CAAABCBBCDD
41,CBAAAACCCDD BBBAAABCDDC DDCBCDCBAAA BBAAAABCDDD DDDCBAAABBC DBACCBDDCAA
42,AAABCCDDDCD DDDDCCBAAAA AAABBCCDDDD AACDDDDCCBA DDBBAAAABDD ACDDBBDCBCA
43,DDDDCCBAAAA BBAAABCCDDD BCCCCCDDCBA AADDCAACDCC DCCDDCBAAAA AAAABBCCDDD
44,CCCCCBAABDD BBAACCBBCDD DDDCCBCBAAA AAABCDDDDCC AABBBCCDDDD CCDDDDCAAAB
45,AABCCAACDDD CBBCDDDCBAA AABBBCCCDDD DDCCBABAABB CCBAAACDDDC AABDDDDAABC
46,AAABBABCDDD DCDCABDCBAA DBAAABCCDDD DDDDCCBBAAA AAACBBDDDCC CCDDDDCAAAA
47,ABBAABCDDDD CCDCDDCBAAA AAAABCCDDDD DDDCCBBBAAA AAABCDDDCCC CBBBCDDCBAA
48,DDDCCCBBAAA AAABCCCDDDC DCDDCBAAABD CDDDCCBAAAA CBAAAABCCDD BAAABBCDDDD
49,DDDCBBBBAAA AABBCDCCCDD DDDDDCBBAAA AACDDDCBBAA DCAAABCCCCD BCBCBAABBDD
50,AAABBCDCDDD CDDDDCBAAAA AAABBCCDDDD CDDDCCBBAAA CBAAAACCDDD DDCBBBCACCA
51,AACCDDABDCA ABDDCCCAABD DCDDDCCBAAA ACDCBAABCDD DDDCCBBAAAA BCDCAAACDCC
52,BADCAADDDBA BDDBAABDDCA AACDDBABBCB AAABBBCDDDD CBCDDCBAAAB CBBCDDAAACD
53,AACDDDCBBBC CDDDDCCBAAA AAABCCDDDDD AADCBBCDDCA DDCBAAABCDD DDDCAAAAACC
54,DCBAAAACDDD ABABCCCDDCC AAABBBCCDDD ADDDBCCBBBA DDDDCBBAAAA DDCCCBCBBAA
55,BCDDDBBCBAA DCABDDCBAAB CDDDDCBBAAA ABCBBAACDDD DDDCBAABBBA AAAABCCCCDD
56,DDDDCBBAAAA CABDDBBDDBA AABCDCBAADD CDDDCBAAAAB AAABBDDDDCC DCBCAAABCCC
57,AAACDDDCCBB DDDDDCBAAAA AAAABBCCDDD DDDCBBAAAAB AAABBCDDDCA CCBAAABDDDC
58,AAACDCBAADD DDDCCCBBAAA AAAABCCCDDD CDDDCBBBAAA BBAAABCCDDD DCAAABCDDCA
59,BBBAAABCDDD DDDDCCBBAAA DBAAAAACCDD CDDDCCBAAAA AABCDDDDCBB DDCAAAACCDD
60,AABAACDDCDD CDDDDCBBAAA AAABBCCDDDD CDDDCCBBAAA CBAAAABCDDD DDCBBCDCAAA
61,BCCBADDDCAA ACDDDCBAAAA BCDDDCBAAAA AAABDDDDCCB CBCCDDDCAAA ABCCCBAACDD
62,DDCAAABBBCD AABCCCBDDDB DDCBAAABCCC BCDDDCBBAAA AAAABCCDDDD DDDCCCCBAAA
63,CDDDCCCAAAA DCCDDCBBAAA AAAABCCDDDD DDDDCBBBAAA AAAABBCDDDD DDCBCABCABA
64,DDCBBCCBAAA ABAAABBCDDD AABCCCCDDCC DBBDDCABBAA DDDBAABABBB ABBCCCCBDCA
65,ABCCCDDCAAA BBBCDDDDBAA AAABABCDDDD AACDDDCCCBA DCCBAAABCDD BCCAAABBDDB
66,AAABCCCDDDD DDDDCDCAAAA BAAABCCDDDD DDDDCBBBAAA BAAABCCDDDD ABBCDBCDCDA
67,AAACDDDDCBB DDCCBCCBBAA AABACCDDCCC AAAABCDDDDD DDDDCCBAAAA AAABAABDDDD
68,DDDCBBABBBA AAAABBCCDDD AABCCCDDBCD DAAABCCDDDD DDCDCBAABAA DDCCBAACCBA
69,ABDDDDDBAAA DDDDCBBBAAA AAAABCCDDDD BDDDCBBBBAA DDCBBAAABBB AAAABBCCDDD
70,CBBBBAAACDD DCBCBAACDDB DDCCDCAAAAB ABCDDDCBBAA AAABCCDDDBB CDCDDDCBAAA
71,DDDDCCBAAAA BAAAABBCDDD BCDDDCCBBAA AAAACDDCDDD DDDDCBBAAAA AAAAABCDDDD
72,DDCAABCBABC CCCDDCBABAB AAABBCCDDDD DBAAABCDDDC DDDDCCBAAAA AAABABCDDDC
73,BDDDCCBAAAA DDDDDCCBAAA AAABBCCDDDD DDDCBBBBAAA BAAAABCDDDD BCDBCBBDBBB
74,DDDCABAACBB ACCBCBDDDBA DDCCBAAAABC AACDDDCCBAA AAAABCDDDDD DCCCCBAAAAC
75,ABDDDDCBBAA CCBAAAABCDD ABCDDDCCBAA ABAAABCDDDD DDDDCBBAAAA AAAABBCCDDD
76,CCDDDCDBAAA DDCBAABCCBC BDDDDCBAAAB DCBAAABCCDD DDCBAAABBBB BBAABCCCDDD
77,AABCDDDDCBB DDDCCCBAAAA AAABBCCDDDD CDDDCBBBAAA DCBACCCCAAC AAAAABCDDDD
78,CBAABDDDBBB DCCBAAABBCD AAABBCCDDDC DDBBAABBBBC DCDDCCBABAA CDCDDBABBAA
79,DDDCCCBAAAA AABABDDCDDC DCDDDCBAAAA AACDDDCCBAA CBAAAABBDDD BAABABBCDDD
80,AAABBBDDDCB BCDDDCBAAAB DDAAABBCCCD AABDDDDCBBA DDCCCDDBAAB ABCDBABCDDB
81,DDDDCCAAAAA AABABDDCDDC CCCDDCCBAAA ABDDDCBBAAA DDBAAABABDD AABCABDBDDD
82,DCDDDCCABAA DDDCCBAAAAA AAABBBCCDDD DDCBBAAABBC AAAABDDCCDD DDDAAAABBCD
83,DDDCBBAAABB AABBCCCCDDC DDDBAAABCCD CDDDCCBBAAA AAABBCCDDDD DDDDDCBAAAA
84,AAABAACDDDD CCDBBCDCCAA CDDCBAAABCC AABDDDDCBAA AAAABCDDDCD CCDCCDCCBAA
85,DDCAAABBCCC AAABBCCCDDD DDDDCBAABAA CBAAAABCDDD ACDDDDCBAAA DDDCCBBAAAA
86,DDCDCDCCAAA AABBDDCCDCA DCCDDDCBAAA ABCDDDCBAAA DDCAAABCCCD AAABBBDDDDB
87,ABCDDDDCBAA DCBAAAABCDD ABCDDDDCBBA AAAAABCDDDD DDDDCCBAAAA AAAABBCCDDD
88,DDCBBBBBAAA AAABBCCDDDD AAAABBCCDDD DCAAABBCDDC DDDDCCCBAAA DDDCCAABBCC
89,CDDDCCBAAAA BBBBDDDCCBA AAABBBCDDDD DDDCBBBBAAA AAAABBCDDDD DCBBBBCDCAA
90,ABBCDCBCDCB CBAAADDDDCB AABCDCCCCDD DDDCBBAAAAB DCBBCDDDBAA ABCCCBAACDD
91,AAABCCDDDDD DDDDDCBBAAA DCAAAABCCDD CDDDDCBBAAA AAAABBCCDDD CDBDCBBDABA
92,AABCCDCDCCC DDDDCCBBAAA CAAABCCDDCD AAABCCDDDDD DDDDCCBAAAA BAABBACDDCD
93,DDDCCBCABAA BBAADDCDCBA BAAAABCCDDD DDDCCBBAAAA AAABBDDDDDC AABAABCCDDD
94,BCCDDDCBAAA DDCBBAAABBD AABCDDDDCBB BDDBAAACCCC DDDCBAAAABB AAAAABCDDDD
95,ACDDDDCBAAA CCCDDDCBAAA AABCCCDDDCC AABBBBCDDDD DDCCAAAABCD CBBAAAACDDD
96,DDDCCCBAAAA BBAAABCCCDD AABBCCDDCCD DDCAAABCCCC DDDDCBBAAAA AAAABBCCDDD
97,ABBABDDDCBA CDDDCBAAABC DDDCBAAAABB AAABDDDDDCC DDCBBCDDBAA ABCDDBABCDC
98,BAAABBBCDDD BCDBABDDBAA DDCAAABBCDD CDDDDCBBAAA AABBBCCDDDB BCCCCDDCAAA
99,CDDDDCCBAAA AABCDDDCBAA AABBCCCDDDD DDCBBBBBBBA AAAABBCDDDD DCCAAABBCDD
100,DDDDCBBAAAA AAAABBCCDDD BBCDDDDCAAA DDDBAAABBBC DDDDCAAABCC AAAAABCCDDD
101,AAABCDDDDDD CCDCDCCCBAA AAABBCCDDDD DDDCCBBBAAA CBAAAACCCDD ABBBABBDDDB
102,DDCAABCCACB BAACCBBBDCD AAABACDDCCD BAAABBDDDDD DDDDCCBAAAA CBBAABDDCDB
103,BBADDCCCABB AAACBBBDDDD DCDDDCBBBAA BBBCBAABCDD CBAABDDDCBA ABCDDCAAABD
104,AAAACBACDDD CCCBDDCBABA BAAABBCCDDD DDDCCBBBAAA AAABBCCDDDC BCDCCDDBAAA
105,CCCAABBACDD DCBAAAAACDD AAABCCCDDDD DDBBAABBBBC DDDCCBAAAAA DCBBCDCAAAB
106,AACCDDDCCCC DDDDCBAAAAB AABCDDDDCCB CDBAAABCDDD DDDCBAAABCD AABBBBCCDDD
107,CCCDDCDBAAB CBBAAAABCDD DCBBCDCCDAA DCBAAAABCDD DDDDCBAAAAB BCDDDDBAABC
108,ABDDDDCCBAA DDCBBAAABCD AACCDDDCCBA AABAABCDDDD DDDDCCBAAAA AAAAABCCDDD
109,AAAABCCDDDD DDDDCCBBAAA AAABCCDDDDD AADDCCCCCCA DDCBAAABCDD CDDDDCCBAAA
110,DDCBAABBABC AAABBCBCDDD ABCDDDCCBBA DCBAAACCDDC DDDBCCACCAA DCDDCDBBAAA
111,DDDBBBBAAAB ABAABCCCDDD AABBCCCCBDD BCAABDDDCBB DDDCCCBAAAA DDDCBCCAAAA
112,AAABCDDDDBA BAAACBACDDD AACCDDDCCBA AAABCDDCCCB DDDCBBAAAAA AAACCDDCBCC
113,AAABCBDDDCB BDDDCBAABBB AABAABCCDDD DDDCBBAAAAB DCAACDDAABD DDCAAACDDBA
114,BCDDDDCBAAA AAAABCCDDDD DDCDDCCBAAA ABDDDCCBAAA DDCAAABCCCB AAAABBCDDDD
115,DDDBAABABBC ACCDDBBAAAB AAABBCCDDDD CCAABCDDDBA DDDCCBBAAAA DDDDCCBCAAA
116,CBAAACCDDDC DDCCDDCCAAA AABCCDDDCBA AAABBCCDDDD BCDDBDCBBAA AAACDDBCDDB
117,CDDCCCCBAAA CBAAAABCDDD AACCDCDDCBB CDCAAABCDDC DDDDCBBAAAA AAAAAABCDDD
118,AAABDCBACDD CBAABCDDDCB AAABBCCDDDD DDDCCBBAAAA AAAABCDDDDB AABCCBABDDD
119,AAABCCDDCDD DCCDDDCBAAA AAABCCDDDDD AACDCCCDCBB DDDCBAAABCC AAAABBCCDDD
120,DDCBBBBBBAA AAAABCCCDDD DDDDCCCBAAA AAABCDDDCCB BAAAABCDDDD ABDDBCCBBBC
121,AABBAABDDDD DBACDDCCAAB BAAAABCCDDD DDDCBBAAAAC AAABCDDDCBA CDCDDDCBAAA
122,DDDBAABABCC AAABCCDDDCA DDDCCAAAABB BCDDCBAAABD AABCDDDDCBC DDDDCCBAAAA
123,BDDDCBBAABC CCDDDDCCAAA AAAABCCDDDD DDDDCBBBAAA BAAAABCCDDD DDDCBBBAABA
124,DDDBBBBBAAA AAABBBCCCDD AABCCCDDDDB DDDDDCAAAAA BAAAACCDDDC CBCDBCCBCCA
125,AABBCDDDDCC DCCDCCBAAAC AABCCDDDDCA DDCBBBAAABB AAABBCDDDDD AABBBBDDCCD
126,AACDDDDCBAA DDDDCBBAAAA AAABBCCDDDD DDCBBBAABBB AAABCBCDDCD BBAAAADDDDD
127,AABBBCDCDDC DDDDCCBAAAA AAABCCCDDDD DDDCBBBBAAA BBAAAABCDDD DDDCBCBABAA
128,DDCAAABCBCC BBBAABBCDDD DDCBAAACCCC AABBDCDDDCB DDCCCAAABAC DDDCCBBBAAA
129,DDDDCCBAAAA AABCCDDDDBA AAABBCCDDDD DDDCBBBBAAA AAABBCDDDDD DDCBBAAABBC
130,AAABBCCDDDD DDDDDCBBAAA AAABCCCDDDD AADDCCCDCCB DDCBAAABCDD DDDDCCBBAAA
131,DDDDCCBAAAA AAAABCCCDDD BBCCDDDDBAA AACDBBACDDD DDDDCBBAAAA AAAAABBCDDD
132,AACDDDDCAAA DDDDDCBAAAA AAABCCCDDDD DDCCBBBBBAA AAAABBCDDDD DBAAACACDCD
133,CABDBABDDBA ACDCDCAAABD DBBBCDCABAB AABCACDCBCD DCCBCDCAAAC DBAACDCAACD
134,ABCDDDDCBAA DCBBAAABCDD ABCDDDDCBAA AAAAABCDDDD DDDDCCBAAAA AAAABBCCDDD
135,DDDDDCBAAAA DDCCDCAAABD AABCDDDDBAB CDBAAABCDDD DDDCCBBAAAA AAAAABCCDDD
136,ABBBCCDDCCC CCDDDCCBAAA AAAABBCDDDD CDDDCCBBAAA CBAAABBCDDD BBBAAACDDDB
137,AAABCCCDDDD DDDDCCCBAAA BAAABBCDDDD DDDDCBBBAAA AAAABBCDDDD DCCCCBCCCAA
138,AAACCDDCDCC DDDDDCBAAAA AAABCCDDDDD ABDCBBBCCBA DDCBAAAABCD AAABBCDDDDB
139,ABCCDCDDCAA CDDBABBAABC AABCCBABCDD DCBAAABCCDC CBCCCBABDDB AABCDCACDDC
140,BBAAABCCDDD BBBCDCDDCAA DDCBAAABBCC BCDDDCCBAAA AAAABCCDDDD DDDCCCBAAAA
141,CBCDDBAABDD BAABDDCABCD DDDCBBBCAAB DBABBABBCDD CCBCDDCAAAB DDBAAABCCDC
142,DDDCBBAAAAA DDCBCBAAAAD AAABCCCDDDD DBAAABBDDDD DDDDCBBAAAA BAAABCDDCCA
143,AAABCCDDDDD DDDDCCBBAAA BAAABCCDDDD ACDDDCCBBAA BBAAABCCDDD ACCCBDDCCBA
144,DDDBBBBBAAA ACCAABDDDCC AAAABCCCCCD AAAABCDDDCC DDDDCCBBAAA DCBCCBCACDA
145,DCBAAABCCDD DCDCCDBBBAA AAAABBCDDDD BABABCDDDCA DDDDCCBAAAA CDDCBDCCAAA
146,DDDDCCBBAAA BBAAABBCDDD AABCDDDDCAB CCBAAABCDDD DDDDCBBBAAA BBAAAABCDDD
147,ABCDDCCAABD CBAACDDCCBB ACDDDCBAABC DDBAAABCCDC BBABCDDDBCA BAABCDCBCDD
148,BDDDCDCBAAA AACDDDCBBAC CDDDCCBBAAA BCBAAABCDDD DCBBBAABCDD CCAAABCDDCB
149,DDCAAAAACDD BCCDDDDCBAA AAAABCCDDDD DDDCCBBBAAA AAAABBCCDDD DDDCCBAAAAB
150,AAAABBBDDDD CBBCAACCDDC DDDCBAAABCC CDDDCCBAAAA AABABDCDDDC BBCDBCCDCAA
151,ABCDDDDCBAA DCCBAAAABDD AACDDDDCCBA AABAABCDDDD DDDDCCBAAAA AAAABBCCDDD
152,ABBACDDBABD DDCBAAABCDD DBAAABBCDDD DDDCBBABAAB DDDBBCBAABB BAABDDDBBCD
153,AAACCBADDDB AAABDDDCBBB AABBBBCCDDD DDBAAABCBBB BCDDDDBAAAA BDDCAABCDCA
154,DDCAAABABDD DDCCDCAAAAA AABBBCCDDDD DDBAAABBBBC DDDDCBBAAAA CDDCCCBAABA
155,ABCDDDDCBAA DDCBAAAABDD ABCDDDDCBBA AAAAABCDDDD DDDDCCBAAAA AAAABBCCDDD
156,DDDBBBBAAAB CCAAABBCCDD AAACCDDDDCB CAAADCDACDC DDDCCBAAAAA AABBBBCCDCD
157,AAABCCCDBCD BCBDDDCCBAA DBAAABABCDD AACDDDCCBAA DCBAAABBCDD DDDCBBAAAAA
158,DDCACCBABAB DCCBAABCBBD AABBCDDDDCB AAAACDDDDCC DDDDCBAAAAA AAABBBCDDDC
159,BCCCDDDCBAA CCBAABBBCDD ACDDDCCDBAA ACDDCBAABBB DDDCCBBAAAA AAAABBCCDDD
160,AAABCCCCDDD CCDDDCCBAAA CBAAABCCDDD DDDCCBBAAAA AAAABCCCDDD DCDCBCCCBBA
161,DDDCBBBAAAA BCBAACBCBCD AABCCCCCCDC CAAAABCDDDD DDDDCCBAAAA BBAAAACCDDD
162,CCCDCCDCAAA CDBABBABDCC AABBBCCDDDB DCAAABCBCDD ABCCDDAACDB ABCCAABCDDC
163,DDDDCCCBAAA DBABBCBDDCA DCCCCBBAAAD CDDDCBAABBB AAABCCCCDCD DCBBAABBCDD
164,CACDCBDDBAA ACDDCBAAACD DCDCAACBABA AABDCBBDDCC BDDDBAABCDA AAABCDBDCCD
165,DCAAACCCCCD BCCCDDDDBAA AACCCCBCCBD AAABBCDDDDD DDDDCBAAAAA DCAABACDDDB
166,DDCCCCBBAAA AABBBCCCCDD DDCDDCBAAAA ABDDDDCBAAA CBBBBAABCDD ACDCABBBBCD
167,DDCBAAAABCD AABBBBDDDDC DDDDCBAAABB CDDDCCBAAAA AAABCDDDCCC DDDCCCBAAAA
168,DDCBCBAABCD BDCBABDAABD DDDCCBBBAAA CBAAABDCCDD ABDDDBAABCB DDDDCBAAAAB
169,ACDDDDCBAAA CCDDDDCBAAA AABBCCDDDCC BCDAAABCDDC DDCBAAAABCD BBAAAABCDDD
170,DDDBAABBABB AAAABCDDDDD CDDDDCCBBAA AAAABCDDDDD DAAAACCDDDC AAABBACDDCC
171,ABCDDDDCBAA DCBAAAABCDD ABCDDDCCBAA ABAAABCDDDD DDDDCBBAAAA AAAABBCCDDD
172,BBCDCDCAABC DBAABDDCBCD AABDDDCABCD CDDCBAAABCD DDDCCCBAAAA AACDCAACDDC
173,DDDCBBBAAAB AAAABCCDDDD CDDDCCCBAAA AAABCDDDCCB AAABCDDDDCA AABCCDDDCBB
174,DDCBBAAABDD DDDCBCBAAAC DDDCCBBBAAA AABDDCBABDD AABCDDBABBC DDDDCBAAABB
175,AABDDDDCCBB BCCACDDBBCA ABCBDDDCCCA AAAABDDDCCC DDDCBBAAAAA AAAAABCDDDD
176,DDDCBCBAAAA BAAABBBCDDD AABCCCCCDDC AAACDDCCCBA DDDCBBBAAAA CCCCCCDCAAA
177,AABBBBCCCDD CCDDDDCBAAA AAABBCCDDDD DDDCBBBBAAA BAAAABCCDDD DDDCBBAAAAB
178,DDCBAAABBCC BAAABCDDCDB DCBBAAABCDD DCBAAAACDDD ACDDCBBCCBA DDCCCCCCBAA
179,AABDDDCCBAB CAACBBCBBDD ABBBCCBBDDC ABAABCDDCDC DDDDCCBAAAA DDCABABDBCB
180,CDDDCCBAAAA BBCCDDDCBAA AAABCCCDDDD DDDCBBBBAAA BAAAABCDDDD DDDCBAAAABB
181,DDDCBAAAABB AABBBBBCDDD BBCBCDDCABA AAABBCDDDDD DDDDCBBBAAA DDDCBCCAAAB
182,ABCCDDCCBAA DDDDCCCBAAA AAAABBCDDDD DDDCBBAAAAB AAAABBCCDDD CCBAAABBDDD
183,ABCDDDDCBAA DCBBAAAACDD ABCDDDDCBAA AAAAABCDDDD DDDDCCBAAAA AAAABBCDDDD
184,ABDDDDDCBAA DCBBAAAACDD ABCDDDDCBAA ABAAABCDDDD DDDDCBBAAAA AAAABBCCDDD
185,ABDDDDBAACB CCBAAAACDDD DDBAABCCCBA AAACCBBCDDD DDDDBBBCBAA AAABBBCDDCD
186,DDBAAABCCCC AABCBAABDDD DDDCCCCCBAA DCBAAABCDDD DDAACBBBCBC ABCCDDDCBAA
187,AABDDDDCBAA DDDDCCBBAAA AAAABCCCDDD CDDDCBAAAAA AABDCACDDCA CACCCABABDD
188,DCABDDCCABA DDDCCBCCBAA AAABCCDCCDD BAAABBCDDDD DDDDCCBAAAA AAABCCCDDCC
189,DCBAAAABCDD ABCCCDDDCBA DDDCBAAABBC BCDDDCCBAAA AABDDDDCBBB CDDDDCBAAAA
190,BBCDCCDCAAB DBABDCBAACD CCBCDDDCAAA ACDDBAAABDD DDDCBBABBAA DDCAAABDCCD
191,AAABBCCDDDD DCCDDCCBAAA DDBAAABBCDD BCDDDCCBAAA BAAABBCDCDD DCDCBCCBBAA
192,BCDDDCBCBAA CBAACCCCCCD BCDDDCCBAAA BCDBAAABCDD DDDDCBAAAAA AABCDCABDDD
193,CDDDCCBAAAA BCDDDDCBAAA AAABBCCDDDD DDCCBBBBAAA AAAABCCDDDD DDDCBBAAAAA
194,AABBBCBBDDD DDDCAABBBAA AABBBCDDDDC CCCAAADDDCB DDCCCCCBAAA ABBCBABDDDB
195,AAAABCDDDDD CDDDDCCBAAA AAABCCCDDDD ACDDCBCCBAA CCBAAABBCDD DDDCBBBBBAA
196,AACCCCCCCCD DDDDDCBBAAA AAABCCDDDDD AAACCCDDDDC DDDCBAAABBC ADDDDCBAAAB
197,AABDCAACDDC AAACDCBBBDD DDCAAABBCBB DDCBAAAABCD DDDDCBBAAAA CDDDCAAABCD
198,BAACDCBACDC BABDDCAAACD DBAABDDDCAA AAAACCBDDDC BDDCBABDDBA BBDDCAAACDC
199,CDDDCBAAAAC CCDDDDCBAAA AAABCCCDDDD DDDBBBBBBAA BAAAABCDDDD DDCBBAABABC
200,AABBBCDDCBB DDDCABBBAAC BBAAABCCDDD DDDCCBBAAAA CCDDCAAABCD DDBABCDDBAB
201,AAABDCBBDDD DCAACCBAABD AAABCCCDDDD DDCBBAAAABC CBAABCDDDCA AABCDDDCAAB
202,DDCBAAAAACD AABCDCDCCCB DDDCCBAAABB ABCDDDCBBAA AAABCCDDDDD DDDCCCBAAAA
203,ABCDDDDCBAA DCBBAAAACDD ABCDDDCCBAA AABAABCDDDD DDDDCCBAAAA AAAABBCCDDD
204,DDCBABBABBB AAAABCCCDDD DDDDDCCBAAA AAACDDDCCBB AAAABCDDDDD BABDCBCCAAD
205,DDCAACCCABC CCBBBAAABDD AABCCCCDDCC AAABDDDCCBB DDDCBBAAABB BBCCDDCDCAA
206,BCDDDCBCAAA DCDDDCCBBAA AAABBCCDDDD DDDCBBBBBAA AAAAABCCDDD DDCCBABACBC
207,CBCDBAABDDB AABDDCAABCD DABBCDBAABC ACDCAACCBBD DDCBBCDDBAA CDDBAACDDAA
208,AABCDDDCCBA CCCDCCDCBAA BAAABCBBCDD BCDDDCBBAAA DDCBAAAABCC AAAABBCCDDD
209,DDDDDCCBAAA DDCBAAAABCD AABBCCCDDDB DCAAAABCCDD CDDDDCBBAAA AAAABBCCDDD
210,DDBAABCBBAB AAAABBBCDDD ABABCDDDCBA BAACDDCABBB DDDCAABBBBA DDCCDCCBAAA
211,DDDDCCBBAAA DDDCCDCAAAA AAABBCCCDDD DDCBBAAABBB AABCDCBCCDC CBBAAABCDDD
212,AABCDDCCCCC AAAABCCDDDD DDDDCCBBAAA AAACDDDDCBB AAAAABCDDDD AAABBCDDDCD
213,CDDDCCCBAAA DCABAAACDDD ABCDDDDDBAA ABDDCBABCBB DDDCCBAAAAA AAAABBCCDDD
214,DDDDCCCBAAA AAAABBBCDDD BBCCCDCCCAA AABDDCCCCCC DDDCCBBAAAA AAAABBCCDDD
215,AABBBBCCDDD CCDDDDCBAAA AAABCCCDDDD ACDDCBBBBAA DDCAAAABCDD DCCAAABACDD
216,AABBDDDCCCC DDDDCCBAAAA AAABCCDDDDD DDCBBBBBBBA CCBAAAABCDD ACCDDBDCBBB
217,DDDCBAAAAAB ABBBAABCDDD CCBAAABDDDB BAAAABCDDDD DDCCCDCCAAA DDDDCBBBAAA
218,AAAABBCDDDC DBACDDCBACA AAABBCCDDDD DDDCBBBAAAA AABABCCDDCC CDCCCDDBAAA
219,DDDDCCBBAAA BBBAAAABDDD ABBBBCDDDBA BDCAAABCDDD DDDDCCBBAAA BBBAAABBDDD
220,ABBAAABDDDD CCCDDCDCBAA BAAAABCDDDD DDDCCBBBAAA AABCDDCCCCC ABABBCCDDCA
221,BAAAABCCDDD BABAABCDDCC DDDDCCBBAAA AAAABBCDDDD DDDCBAAABBC BBCBCDDCAAB
222,AAABBDDDCDD DDDDCCBBAAA AAABCCCDDDD BDDCBBBCBBA DCBAAAABCDD ABCDDDBBCAA
223,DDDCAAABBBC AAABCCDDDCB DDDCBAAABBC CDDDCCBAAAA AACDDDCCBBC DDDDDCAAAAA
224,AAABCCDDDCC DDDDCCBBAAA AAABCCCDDDD DDCCBBBBBAA AAAABBCDDDD DCCCCBDBCBA
225,DDCCCDCBAAA ACBBABBDCDD AACCDCCCDCB AAABDDDDCCB DDDCBBBAAAA AABBCDDDCBA
226,AAABCBDDDDD AAABBCDDCDC DDDCCBBAAAA AAACDDDDCBB AAABBBCCDDD DCCABAABDDD
227,DDDDCCCBAAA BAAAABBCDDD BCDDDCCCBAA AAACDDCCCCC DDDDCCBBAAA AAAAABCCDDD
228,AABBCDCDDCB DDCCBBBAAAA AAABBCCDDDD CAAAABCDDDD DDDDCCBAAAA AAABBCDBCDD
229,ABCBCCDDCBA AAAABBCDDDD DDDDCCCBAAA AAABCDDDCCB AAAABBCDDDD AAAABDDDDDB
230,AAABCCDDDDD DDDCCCBBAAA AAABCCCDDDD DDDCBBBBBAA CBAAAABCDDD AAABCDDDDCA
231,DDBAAABBCDD BCCCCDDDCAA DDCBAAABBCC CDDDDCBBAAA AABCCDDDCCC DDDCCCCBAAA
232,CAABDDBAACD CBAABCDDDBA ABCDDCAAABC BAAABCDCDDD CDDDDDBAAAB DCBAAABCDDD
233,BCDDDCCBAAB DDBAACBCCCB ADDDCBAABDD BAABDDDCCBB AACCDDDBABC DCAAABCBCDD
234,DDDDCCBAAAA AAAABBBCDDD ABBCCDDDDBA ABDCBABBBDD DDDDCCCBAAA CBBBAAABCDD
235,AAAAACCDDDD DCCDDCBBBAA AAABCCCDDDD DDDCCBBBAAA CBAAACDCCDD CBCCCDDDBAA
236,DDDDCCBBAAA BAAAABCCDDD AABCDDDDCCC CDDBAAABCCC DDDDCBBAAAA BBAAABBCDDD
237,DDCAAABBCDD AACCCCDDCBA DBAAABBCDDD DDDCCBBAAAA AAABCCDDDDD DDDDCCBBAAA
238,DDCBABBBBAA AAAABCCDDDD DDDDCCBAAAA AABCDDDCCBA AAAABCCDDDD ABCBBDDDAAB
239,DDDCCBBBAAA BAAABBBCDDD ABCDDDCCCBA AAABBCDDDCC DDDDCCBBAAA AAAABBCCDDD
240,DCBBBABABCD BBAAABDDDDB CBBCDDDCBAA AAABBCCDDDD BADDCCCCABA CCCCCDDDBAA
241,DDCCAAAABCD AAABCCDDDDC DDDDCBAAAAB BCDDDCBAAAC AAABCCCDDDD DDDDCCBAAAA
242,ABDDDDDCBAA CBBAAAABCDD ACDDDDCCBAA AAAAABCDDDD DDDDCBBAAAA AAAABBCDDDD
243,ACDCBBDCBBA DCCBCDCABAA AAABBCCDDDD DDDCBBBBAAA BAAAABCDDDD CCCCABCDBBA
244,DDDDCCBAAAB CDDDCBBAAAB ACDDDCCBAAA AABCDDCCBBC DDCBAAABCDD DCAAACDDDBA
245,CAABDDDCCBA AAACDDDCBCD DDCBBCDCBAA DCAAACBBDDC BBBCDDDBAAB DDBAAABDCCD
246,DDDDCBBBAAA BAAAABBCDDD ABCDDDDCBAA AAABCDDDDCC DDDCCBBAAAA BAAAAABCDDD
247,BCDDDCAABDC DBAAABCCCDD CDDDCCBAAAA CCAAAABCDDD DDDBAAABBBA AABCDCAACDD
248,CDDDCCCBAAA BBAAAABBCDD CDDDDCCBAAA AABDDCCCCCB DDDCBAAAABB AAAABCCDDDD
249,ACDDCDCBAAA DDDCCBCCBAA AAABBCCDDDD CDDCBBBBBAA DCBAAABCDDD BBBAAACBDDD
250,AABCCDCADDB BAAABDDDDCC CCBADDDBCAA AAACDDCCCCD DDDDDCBAAAA BAAACBCDDCD
251,DDDCCCCCBAA AAAABBBCDDD BCDDDDCBBAA AAAABCDDDCC DDDDCBAAAAA AAAABBCCDDD
252,ABDDDDDCBAA CCBAAAABCDD ABCDDDCCBAA BBAAABCDDDD DDDDCBBAAAA AAAABBCCDDD
253,AAABAACDDDD DDBCDDCBAAA DDBAAAABCDD DDDDCCBBAAA AAABCCCCCDD CCCDCDDCBAA
254,AAABBCCDDDD DDDDCCBBAAA BAAABCCDDDD DDDDCBBAAAA BAAAABCCDDD DAACBCCCCCB
255,ABCDDDDCBAA DCBBAAABCDD ABDDDDCCBAA AABAABCDDDD DDDDCCBAAAA AAAABBCDDDD
256,BCCDCDCAABC DBAAABDDDCB ACDDDCBAAAB DCBAAABCDDD DDCCCDBAAAA ABBCBABDCCD
257,AAABCCCDDDD DDDCDCCBBAA BAAABCCDDDD BDDDDCBBAAA DCBAAABCCDD AABBCCDDDCA
258,DDCBCBAAACD DDCCBBDBAAB DCBAAABCDDD DDCBAAAACDD AACDDCABCCC DDDDDCBAAAA
259,BCDDDDCBAAA DDDDDCBAAAA AAABCCCDDDD DDDBBBBBBBA BBAAAABCDDD DDDCCBBBAAA
260,BCCDDCCDBAA ADDDCBBBAAB ABCBCDDDCBA AAACDDCCCCD DDDDCCBBAAA BBCCAABDDCD
261,ADDDCBBBABA BBCCDCDCCAA BBAAABCCDDD DDDDCBBBAAA AAAABBCDDDD BCCAABDBCDB
262,AAAACCBBDDD CAACDDCBBBA AAABBCCDDDD DDDCBBBAAAA AABABCDDDCC CCCDDDCBAAA
263,DCAAABBCCDD DDCDDCBAAAA AAABCCDDDCD AAABCCDDDCC DDDDCBBAAAA BCCDDACCCBA
264,DDDCBBAAAAA CBAAABCDDDC BBBAAABCDDD DDCBAAAABCD CDDDDCCAAAA BAABBABDDDD
265,DDCAABBBBBC BBBAABCCBDD AAABBCCCDDD DCAABCCCCBA DDDDCBAABBA CCCBBAAACDD
266,CDDDCCCBAAA BAABDCDDCBC AABBCDDDDBA CDDDBAAABBB DDDDCBBBAAA AAAAABBCDDD
267,BBBAAABCDDD DDDCCCCBAAA DBAAABCCDDD DDDCCBBAAAA AAACDDDDCCC BABCCDDCCAA
268,BAAABBBCDDD AABCCDDCCBA DDDDCCBAAAA ABCDDDCBBAA AAABCCCCCDD DDCCCDDBAAA
269,BCDDDCBCCAA AACDCBCBCDD DDCBBAAACDB AAAABCDDDCC CDDDCBCCAAA CCBCCAACDCD
270,DDDCCCCCAAA BAAAABBCDDD CCCDDCCCAAA AAABCDDDCCC DDDCBBBBBAA AAAABBCCDDD
271,DDDDCCBAAAA BAAABCCCCDD AABCCCDDDAA BDDCAAACCCC DDDCCCBAAAA AAAAABCCDDD
272,DDCCCCBBAAA AAAAABBCDDD CCDDDCCBAAA AAABCDDDCCB CBAAABCDDDD ABDBACDCBDB
273,DDDCCBBAAAA AAABBBCCDDD AADDDDBBBBA AAABBCCDDDD DDDDCCBBAAA DDDDDBBAAAA
274,AAAABCDDDCD BABDDCDBACB CBAAABCCDDD DDDCCBBBAAA AAABCCCDDDC CDDCDDCBAAA
275,AAACDDDDCBB DDCBBAABBBB DDCCCBBAAAA AAACDDCCCCD DDDDCCBAAAA DCBBAAABCDD
276,BDDDDDCBAAA DDDCBAAAABC AABBCCCCDDD DDCBAAAABCC DDBAAABBBDD AAAAABCCDDD
277,DAADCBADDBA ACDCAABDDBB ACDDBBBDCAA AAADDACCBBD CBBCDCAABDB AACDBACDDAB
278,DDBAAABBCDD AABBBCDDDDC DDDDCBAAAAB DDDDCBAAAAB AAABCCCDDDD DDDDCCBAAAA
279,CCBAAABBDDD ABCDDDDCBAA DDCAAAABCCD CDDDDCBBAAA AAABCDDDDCC DDDCCBBABAA
280,AAAABCCCDDD DDDDDCBBAAA AAABCCCDDDD ABDDCCCCCBA DDCBAAABCCD BDDDBAABBBA
281,BACCDDCDABA CCBACDCDDBA AAAAABCDDDD DCBAAABCDDD ABCDDDCCBAA AAABBBCCDDD
282,ABBCCBAADDD CBBAAABCDDD DDBAAABBCCC BCDDCCBBAAA BAAABCDDDDB AAABCDDCBCD
283,DDBAABCCCDC CBCABAABCCD AAABCCDDDCC ABBCDDCCBAA DDCCBAAABAB DCDDCBBCBAA
284,DDCAABCACDB DCBCBAAABCD ABCDDDDCBBA AAAACDDDCCC DDDCCBBAAAA AABBBDDDDCC
285,AABCCBBBCDD DDDDCAABCBA DDDBAAABBBC AAABCDDDDCC DDCBAAABBCB BCDDDDCAAAB
286,ABDDDDDCBAA CBBAAABBCDD ACDDDDCCBAA AABAABCDDDD DDDDCBBAAAA AAAABBCDDDD
287,DDDCBCCBAAA AAAABBCDDDD AAAABCCCDDD DCAAAABCDDD DDDCCCBBAAA CCBAAABCCDD
288,DDDCBAABCBA AABCDDDDDBA DCAAAABCCDD DDDDCCBBAAA AAABCCCDDDD DDDDCCCBAAA
289,BBBCBABDDCA AAABDDDDCCB AABDDDCBCCD AACBCDDCBBD DDCBAAAACDD CAAAABCDDDB
290,BBBBCAADDCB BBBAAABCDDD CBBDDDCBBAA AAABDDCCCDC DBABBCBBDDA ABBBAACCDDD
291,AABCCDDDBAC DDCBAAACDDC DCBAABBBBCC AAABBDDDDDD DDDCCCBAAAA ABCCBABDDDB
292,DDDDDCBAAAA BAAABBBCDDD AABBCCCCCDD DBAAABBCDDD DDDDCBBBAAA BAAAABBCDDD
293,BDDDDCBBAAA DDDCBBBABAB BBCCDDDCBAA AACDDBBCCCC DDDDCBBAAAA AAAABBBCDDD
294,DDDCCCCBBAA BBAABAABCDD AABCCCDCCCA BAAAABCDDDD DDDDCCBAAAA AAAAAABDDDD
295,DDCBAAAAACD AAABBCCDDDD DDDDCBAAABB CDDDDCBAAAA AAABCCCDDDC DDDDCBBAAAA
296,BBCDBBDCAAC DDDCBAAABCD DDDCCBAAAAA AAABCDDDDCC DDDDCAAAACD DDCAAABCDDC
297,DDDDCCBAAAA AAACDDDDCCC AABDDDDCCAA BDDDCBAABBB CBAAABCDCCD AAAABBBCDDD
298,DDDCCCBBAAA AAABCDDCCDC DDDDDCBAAAA AACDDDCCBAA DCAAAABCCDD AACCBBCCDDD
299,CDCCACBBDAA CDDDCCBBAAA BBBAAABCDDD CDDDDCBBAAA AAAABCDDDDD DDDBAABBABB
300,DDCBCCCBAAA AAABCBBBCDD AABCDDDDCBA CAAABADDCCC DDDBAAABBBB AAABBBCCCDD
301,AAABBAACDDD CBAABDDDCBA ABDDDDBAABB AAABDDDDCCC DDDCCCAAAAB BDDCAABCDDA
302,DDDCBBBAAAA AAABBCCDDDD DDDDCBBAAAA ABDDDCBAABC CDDDBBBBAAA DDCBBAAABCD
303,ABCDDDDCBAA CBBAAAABCDD ACDDDDCCBAA AAAAABCDDDD DDDDCCBAAAA AAAABBCCDDD
304,CCBCDDBAABD CCBAAAABDDD DDCBBAAABBB BDDDDCBBAAA CCDDDDBBAAA ABCDDDAABCD
305,DCBAAABBCDD DBAAABCDDDB DDDBAAABBCC DDDDCCBBAAA AAABCCDDDDD DDCCCCCBAAA
306,CABDCDDCCAA ACDCAAACDDC AACDDBAACDB ACCAADCBBCD DCBBCDDBAAB CDBAABDDDDA
307,CBCDBAACDCA AABDDCDCBCC BDDBABBDBAB DBAABBBABDD DCCBBDDCAAA CDDBABDDCAA
308,CDCAAABCCCD DCCCCBAABAD AAABBCCCDDD CCAAABDDDCB DDDDCBBAAAA AABBBCDDDCA
309,DDDCBABBAAB BAAAABBCDDD AABBDDDDDCB AABCDDCCBAA DDCCBBAAABB DDDCCCBAAAA
310,CCBABAABCDD DDCBCAABDCA DDDBAAABCCD DDDDCBBAAAA AAABBDDDCBC DCDDDCBAAAA
311,CBAACDDBABD DDBAABDDBAA ADDCBBCDCAA AAAABDCCDDD BBDDDBAABCB BBBCDCAAACD
312,CDDDDCBAAAA AAABABCDDDD DBBCDDCBAAA ACDDDCBAAAA DBAAABBBCDD AAAAABBCDDD
313,AABBBDDDCBB DDDCBAAACCC AAABCCCCDDD CDDDCCBBBAA CDDCBAAACDD DDBAABCDDCA
314,AAAABCDCCCD DCDDDCCBAAA AAAABBCDDDD DDDDCCBBAAA AAAABCCDDDD DDDCCBAAAAA
315,BCDDDCCBAAA ABAAABDDDDD CCCDDDCBAAA AAABDDDCCBB AAAABBCDDDD BAAABCCDDDC
316,DDDDCCCBAAA AABBBBBBCDD DDDCBAAABCA CAAAABCCDDD CBBCDDDCBAA ABCCCAAACDD
317,BBCDDDBABCA DDBAABBBBDD ABBBAABCDDD DCBAAABBDDC BBCDDCAABCC CDDBAAACDDD
318,DDDCCCBBAAA BAABBBACDDD BCDDDDDCAAA CCBAAACDDDD DDDDCCBAAAA AAAAABCDDDD
319,AAABBCCDDDD DDDCCCCBAAA AAABBCCDDDD DDDCCCBBAAA CBAAAABCCDD AACACCCDDDC
320,DDCAAAABBDD ABBDCCBDCCB AAACDCDDDCB BAAACCDDCCC CDBBCABCBDC DDDDCCCAAAA
321,BCDDDCDCAAA ACCAADCCBBD DCCBCDDCBAA ACDCAAABDDD DDDCAABBAAB CBCDCAAACDD
322,DDDCCCBBAAA DDCBCAAABCD AABCDDDDBAA BCCBAAACDDD DDDCCBBAAAA BBAAAABCDDD
323,BDDDCCCBAAA AABABCCCDDD DDDDCCBAAAA AABDDDDCBBB DDDCBAAAABB AAAABBBCDDD
324,AABBCDDDDBB CCCDDDBCCAA DCAAAABCDDD ABDDDCCBBAA AAAABCCDDDD DCBCBAABDCA
325,CDDDDACBAAA AACBABDDDCB DCBCDBAAACD BBAAAABCDDD DCBCDDDCBAA ABAAABCDDDD
326,AAAACDDDDDD DDDDDCCBAAA BAAABBCDDDD DDDCCBBAAAA AAABBCCDDDD DDDCDBCBCAA
327,AABBABDDDCB BBDDDCBAAAC DDBABDDBAAB AABCDDDCCBB DDDBAAABCDD BAABCDDDCAB
328,AAAABCCCDDD CDDDDCCBAAA AAABBCCDDDD DDDDCBBBAAA BAAAABCCDDD DDDDCCBBAAA
329,DDDCCCBBAAA AAAABBCCDDD ABCCDDDDBAA BAACDDCCCCC CDDDDCBBAAA AAAAABCCDDD
330,BAAACCDCDBA CBBAABBBCDD AABBBBBCDDC CBAAABCCDDD DDDDCBBAABA AAAABCBCDDD
331,ABDDDDDCBAA CBBAAABBCDD ACDDDDCCBAA ABBAABCDDDD DDDDCBBAAAA AAAABBCCDDD
332,DDCAAAABCDD AAAAABCDDDD DDDCBBAAABB BBDDDDCBAAA ABCDDDCCBAA DDCAAABBDDB
333,DDDCBAAABAB AAABBCDDDDD DDDDCBAAAAB BCDDDCBBAAA AAACCDDDCCC DDDDCBBAAAA
334,AABBBCCCDDD DDDDDCCBAAA AAABCCCDDDD CDDCBBBBBAA CCBAAABCDDD DDDDCBBAAAA
335,CCDDCDBABBA AABDCCBDDCC AAABCDDDCBA AAACDDCBCDD DDDCBABCCAA ABBAACBBDDD
336,CBBBCBABCDD DBBBAABDDCB DCDDCBBAAAB CDDDDCBAAAB ABBAACCDDDB BCCCDDCBAAA
337,DDCABBBBABB ABBBBCCDDDB DDDCBAAABBC DDDCBAAABCD AAACDDCDDCC DDDCBAAAAAB
338,DDDDCBBAAAA AAABBCBCBDD AABCCDDDDBC DDDBAABBBCC DDDDCCBAAAA CBBBBAAACDD
339,AAABCDCDDCD CDDDCBCBBAA CAAABBCCDDD CDDDCCBBAAA CBAAABBCDDD ABBABCDCDDA
340,AAABBABCDDD DCDCABDDBBA DCAAABBCDDD CDDDCCBBAAA AAABCCCDDDD CBCDCDDCBAA
341,DDDCBCBAAAA AAAAABBCDDD AABCDDCCCBA DCDDDDBAAAA ABCCDDDCAAA BBBBBAACDDD
342,AAAAABCDDDD CBABDDDCCAA DDCAAABBCCD BCDDDCCBAAA AAABBDCCDDD DCBCCCDDBAA
