,0
150,ABBDEFFDC FEBBBCCCC FEBBBCDCB EEEEEDBAA AABBCDEFF AAABCDEFF AABCDDEFF EEFEDCBAA FFEDBBBBA FFDBCEDAA FFEEDCBAA AABCDEFFE CBBCBBCFF ABCBADFFF EFEDEDCAA AAABCDEFF ABDEEFECA
151,FFEDCCBBA FDCAABCEF FFEDCBBAA AABCDDEFF CFFEDCBAA FFEECCBAA FFEDBAABE AABDEFEED FFEDCCBAA AABCCDEFF BDAACECEF BBCCEFFCA FFEDCBBAA AAABCEEFF AABCEFFEC AABCCEEFF AABEEEEDE
152,FEEEECBAA AABCDEEFE FFEECBBAA AABCDEFFE FFEDCBAAB AABCDDEFF DEFEDCBAA AAABCEEFF EECAABCEF FFEECCBAA FDCAABCEF AABDEEDEF DEFFECBAA FFEECCBAA BAABCDEFF AABCCDEFF FFEEDBAAA
153,AABDEFEEE FFEDCCBAA AABCDDEFF ABBBCDEFF EEFEDCBAA BAABCDEFF FFEDDCBAA FFEDCBAAB AABCEEEEE FFFDCBBAA AAABCDEFF AABBCDEFF ABDFFEDBA FFFEDBAAA FEEEDCBAA FBAABDEEF FFEEECBAA
154,ABBBCDDEF BDEFFDCAA FFEDCBBAA BAABCDEFF CFFFDCBAA AABBCDEFF ABBBBCEFF AABCEEFED FFEDCBBAB BDEFEECAA FFEDDCBAA FFEDCBABB ABBBCDEFF AABDEEFEE FECAAACEF AABCDEEFF FFEDDDCAA
155,EFFEDCBAA BAABDEEFF AABCDEEEF AABBCDEFF FFEDCBAAB ACEFFECBA AABCCDEFF AABBDEFFE FFEDCCBAA FFEEDCBAA FEDBAABDF ACFFDCBCE AABBCDEFF FFEDCBBAA FEDEDBABA FFEEDCBAA AABCDEEFF
156,AABBDEEFF EEEEEDBAA BBCFFECAB AABCDEFEF AACCDDEFF FFEDCCBAA FFECBAABD FDBAACEEF AABCCEFFF BAABCDEFF AABCDEFFE FFEDCCBAA FDBABBDEF FFEEDCBAA BAABDFFED CDBAACDFF AACDEEEEE
157,FEDECAAAD AABCDEEFF CBAABDFFF FEDCDECAA FEBAABCEF FFEEDCBAA BAABCDEFF FFEECBBAA AABCDDEFF CBBBBCDEF AABCDEEFF ABDEFFDBA FFEEDBAAA FEEEDCBAA AABCDCEFF FFDBAABCD ABCEFEBCD
158,BAABDDEFE BAABCDEFF FFEECBBAA AABEFFEDC FFEDCBAAC FFEDCBAAB AABCDEFFE FFEDCBAAB ABCBCCDFF AABBCDEFF FFECBABBD BCDEFFDBA DBAABDDFF EFFEDCBAA FECBAABEF DEEEEECAA AABCDEEFF
159,EEEEEDBAA BBAABDEFF FFEDCCBAA FFDCBAACE ABCCDEEFF AAABCDEFF ABBBBCEFF FFFEDCBAA FFEDCCBAA BAABCDEFF EEEEECBAA FECAABCEF AABCDEFEE ABCEFFEDB FFEDBAABC AABCDEEFF EFFEDCAAA
160,AAABEFFED FFEDDCBAA AABBCDEFF BDFFEDBAA FFEDCBBAA BBABBCEFF ABCCDDDEF ABDEEDBCF FFEDBABBB BBBDEFFDA CBCDEFECA FFECBABBC AABCDEFFE AACDEFFEC FFEDCBABC AABCDEEFF FFECCDCBA
161,FFEEDCBAA AAABCEFFF AABCDEEFE EBAABCEFF AABCDEFFD FFEDDCBAA ABCBBDEFF AABCCEFFF FFEDCBAAB FFEEDCBAA AABCDDEFF FFEDCBBAA FEFEDAABB CBAABDFFF FECDECAAC FFEDCBBAA AABCDEEFF
162,CCBAACFFF EFEDBABEC CBAABDEFF AACDEFFDC FFEDCBBAA ADEBABDEF DEFFDBAAB AABCCDEFF FFDCBABCD AABBDEEFF FFEDDCBAA AABCDEEFF EDEEDECAA AABCDDEFF FFEEDCBAA EDCAABDEF FFFEDBBAA
163,BBBBCBCFF FFECBBABD ACEFFECBA FFEECBAAB AABCDEEFF FFEDDCBAA FEBABCCCD AACBCEEFF FFEDCBAAB AABCEFFED AABCDEFFE FFEDDCBAA BABBCDEFF AAACDEFFE FFEDDDCAA FEDCBABDE AACDCDEEF
164,AACDCBDFF DDCBAACEF AABDEFFED FFEDCBAAA AABCDEEFF FFFECBAAB ADABCDFED AABBCDEFF FFEDCCBAA BAABCDEFF ABCBBCEFF CDEFFDCAA FFECCDCBA FECBAACEF AABCDEFFE FFEDDBAAA FFEEDBAAB
165,DCCBBABFF FEDBAABDF AABCDEEFF FFEDCCBAA FFFECBAAA AADFFEDCB FEDEECBAA AABCDEEFF AACEFFEDC FFEEDCBAA AABCCDEFF BCEFFECAA AABBCEFEF AABCDDFFE FFEEDCBAA AAACDDEFF FDABCEBCB
166,ECCCDBABF FFEDCBBAA AABBCDEFF CEFFDCBAA FFEDCBBAA AABBDEFFF FFEDCBBAA DBAABDEFF BCBABCDFF AABCDEFFF FFEDCBBAA AABBCDEFF AABDFFDBD ABCEFFEBA FFEDDCBAA BAABCDEFF ACABEEEEF
167,CCCBCFFCA CCBABCEFF AABCDDEFF FFEDBAABD FFEDCBAAB AABDFEEDD FEDEEDBAA FFEECCBAA AABDEFEED ABCBBCEFF BAACDDEFF FFEDCBBAA AABBCDEFF FFDBAACDE FFEDCCBAA FFDCBABDE BDEFFBABC
168,AABBCEEFF BBBBBCEFF ABEEDEEDC AAABCDEFF CEFFECBAA FEEEDDCAA FECBBBCCC EEEFECBAA AAABCDEFF BCEFFECBA AABBCDEFF BDEFFDCAA AABCDEFFE FEEEECBAA BAABDFFEC FFEDCCBAA AAABDEEFF
169,DEEEEDDAA FFEEDCAAA FFEDCBBAA ECBBABCFF AABBDEEFF ABEFEEDDB FFEEDCBAA FFDCAABCE AABCDEEEF FFEDCCBAA AABCDEEFF ACABCEFEF BBABBDEFF FFEDCBBAA AABCCDEFF AABCDEEEF AABDEEEEE
170,EEFFEBABA FFEDCBBAB FFEDCCBAA AABBDEFFF FFEECBBAA AABBCEEFF EFFEDBBAA AABCDEFEE EFFECABCA EDBAABDFF FFEEDCBAA AAABCEFFF FFEDCBAAB ABDEFEDDC AAABDEFFF AAABDEEFF ABAACEFFF
171,ABBCCBCFF FFEDBAABC AABCDEFFE FFECCCCBA FFECBAACE AABDFFFEC FFEECBBAA AAABCDEFF AABCCDEFF FFEEDCBAA FEDBAACDE AABCDEEFF ECAABCDFF BCBABCDFF FFEDDCBAA BAABCDEFF DFFCDDCAA
172,EEEDDECBA ACEFFECBA FEBAEECBA FFEDCBAAC AABCDDEFF ACEFFEDBA FFEDCCBAA AABCDEFFE CDEEFEAAB ABCDFFECA AABCDEEFF FEBAABCEE FFEEDCBAA AABCDEEFF EEDBAACEF BDFFEDBBA FFEBABBBD
173,CBAABDEFF EFFECBAAB AAACDEFFE FFEDCBAAB AABCDFFED FFEBAABCD AABDEFFED FFEDCAABD ACFFEDCBA FFECBAACE ADFFEDBAA FDCDFECBA FEDBAABDF AABCDEEFF FFEEDCBAA AABCEEFED CDDEFECAA
174,DEEEEECAA AABDFFEDC FEDBABBDF AABCCDEFF EFFEDCBAA FFECBABBC FFFDBAABB AACDEEEEE BCDEFFDBA FFEDCBAAB AABCDEFFF AABBCDEFF DEFEDCBAA FFFEDCBAA BAABCCEFF AABDEEEED FFEEDCBAA
175,AABCFFEED BBBDFFEBA FFEDCBBAA AABCDEFED FFECBBBAB AABCEEEEE BBBBBCDFF ACEEEEDAC BCEFFDBAA FFEEDCBAA AAABDDFFD FFEDCBBAA BBBBBDEFF FFEDCBBAA AABBCEEFF CEFFDCBAA AABDEFFED
176,BBBBBCEFF FFEEDCBAA AABBCEEFF AABCEFFED FECCDDBAA DDEFFDBAA AABCDEEEF FFEEDCBAA AABCDEEFF DEFFECBAA AABCDEEFF FFEEDCBAA AABCDDEFF FFEDCBBAA AABBCDEFF FFEDCBBAA FFEDBABCC
177,AABCDDFFE FFEECAABC BDFEBABDF FFDCBBBBB EEFEDDBAA CBBABCEFF BCEEFEDBA FEBABBCDD EEBABDFEF ABBBDDEFF FFEDCCBAA FFEDBBABB FFECBABBC AABCDEEFF CDEFEDBAA AABCDDEFF ABEEFFDCB
178,BCDEFFEBA AABBCDEFF FFEECBBAA FECAAACEF DEFFEDBAA EDDBAABEF AABCDEEFF BAABCEFFF FFEDCBBAA FFEDBAACD BCCEFFDBA DDFFECBAA BBBBBCEFF DEFFECBAA BAABCDEFF AABCDEEFF FFEDDCBAA
179,ABDEEEECB FFEDBBBBA FFEDDCBAA FFEDBAABB AABBCDEFF AABBCDEFF ACEFFECBA FFEDCBABB FFEDBBAAD BDEFFECAA FFEEDCBAA AABBCDEFF AABCEEEEE FFEEDBAAA AACDDEEEE EEEEEBAAD AACEEFEDB
180,FFEDBAABD AABCDEFFE DEFFECBAA BAABCDEFF BBEFFDBAB ABBBCFFEE FECBCEDBA FFDBAABCD EFFECBBBA EDCAABCEF CFFECCBAA AAABCDEFF DBCBBBCEF ABDDCCDFF CFFEDDCBA FEEDEDBAA FFEDCBBAA
181,CFFEECBAA AAACDEEFF AABBDEEFF DEFFECBAA FFEDCBBAA CCBABCEFF AABCEFFED AABCDDEFF CEFFECBAA FFEECCAAA FFEDDCBAA FECBAACEF DBAABCEFF AABCCDEFF FFEECCBAA FFFEDBBAA ABCDEFFEA
182,FFEDBAABE AABCDEEFF FFEDCBBAA AABCDEEFF FFECAABCE AACDFFDCD FFEDCBAAB DEFFDBABA FFEDCBBAA AABCDEFFE EDDFEDBAA BAABCDEFF ABDCCCDEF AABCDDEFF CEEEFBDBA FFEDDCCAA FFEDCBBAA
183,DEEEEDCAA FDEFECAAA FEEEDCBAA AABBCEFFE ECAABCEFF EFFECBAAC AABCDEFFE AABCEEFFD FFEDBBABC FFEEDCBAA BAABCDEFF FFEDCCBAA FECBAABEF ACEFFDCBA AABCDEEFF AABCDEEFF FFFDCBBBA
184,BBBABEFEE FECBABCEF AABCDEEFF FFECBBCBA FDBAACDEF FEEECBCBA FEBAABDED ABBBBDEFF BDEFFDCAA FFEDBAABB ABBBDEEEF EFFFDBAAA FFDCAAADF AABCEFEDE CEFEEDCAA DBAABCEFF FEFCABCCD
185,FFEEDCBAA CAAACEEFF BDFCDFDDA EAAACDEFF CAABCDEFF FFEDCCBAA BAABCDFEF AABCEEEFF AABBCEFFF FFEEDBAAB FFEDCBBAA AABBCDEFF FFECCAACC FFDDBAACF ABCFFEACB FFECCBBAC AABCDEEFF
186,AAABEEFFF DFFEDDCAA AABCDEEFF EFFEDCBAA FFEDCBAAB AABBCEEFF DECAABCEF AABCCDEFF FFEDCBAAB AABCDDEFF FFEDCCBAA AABCDDEFF FFEDCCBAA AABCDEFFE FFFDCCBAA ACEFFDBBA FFEECBAAB
187,ABCEFFEDB BAABCEEFF EFEEDCBAA FFEDCBAAA AABCDEEFF EEEEDDCAA AAACDEFFE ECBAABDFF AABCDEFFE FFEEDCBAA BAABDDEFF FFEEDCBAA BABBCDEFF AABDEEEEE FFDCAABCE AABCDEFFE DDEEEECAA
188,FFEEDCBAA AABCDDEFF DBAACDEFF FFDBAABDE CDEFFDCAA AABCCDEFF FFEDCBBAA AABCDEEEF EFFEDCBAA AABCDEFFE FFEDCBBAB AABCEFEED FEECBAACE ABFFEDCBB EDBAADFED FFEDDCBAA AABCDEEFF
189,FFEEDCBAA AABCDEFFF DEFFCAABC BCDEFFDBA AABCDEEFF FFDCAABCE ACCCFFECA FFEDBAABB AABCCEEFF FFEEDBAAB AABCCDFFF FFEDCBAAC ABEFEECDA FFDCBAACE FEEEECBAA EFEEDCBAA BAABCDEFF
190,AABCDCDFF FFECBAACE FFEDCBBAB AABCDDEFF ABDEFFEBA FFEDCCBAA ABDCBCEFF AABCDEFFD FFECBAABD AABCEEEEF CDEFFECAA FFEDCBAAB AABCDEEFF AABCDEFFE FFFECBCAA FFEDCBAAB AABCDEEFF
191,AABCDEEFF AACDEFEED DCBAACDFF AABCCDEFF CBABBDEFF AABDEFEEC FFEDCBBBB FFEDCBAAA CBBBABDFF FFFEDCBAA BAABCDEFF AACDEEEED AABBCDEFF FFEECBAAB BDEFFECBA FFEDCBBAA BCDEFEDBA
192,AABBCEEFF EEFEDCBAA FFEDCBBAA AABCCDEFF BCBAACEFF AABBCDEFF FFEDCBBAA FFDCBAACE FFEDCBBBA AABCDEEFF EEFEDCBAA FFDDCBBAA BBBBCDEFF ABBBEFEEE ACFFFDBCB FFEEDBAAA FFFECCBAA
193,BBBDDCBCF EFFEDCBAA BAABCDEFF FFEDCBABA FDBBBABEF EFFEDCBAA ABBACDFFF ABCDEFFDA FFDBAABCE AABCEFFEC AABCDEFFE FFEDDCBAA FDBAABCEF AACDFEEDE ABCEFFECB FECBCEDBA AABDDDEFF
194,FFEDBBACB FFEEDCBAA AABCDEFFE FFEDCBAAB AABCDDEFF DFFDBBBBB FEEEDCBAA CBAACDEFF BDEFFDCAA FFDBAABCD AABCDEFDF DCBCACCEF FFEEDCBAA CBAACDEFF CDEFFDBAA AABDDEEFF ABBDEDEEF
195,FEEEDCCAA AABCEEFEE FEECAAADE FFEDCCBAA FFEECBBBA BAABCDEFF DEFFECBAA FECAABDEE AABCCDFFE EBAABDEFF DDEFEDBAA AABBDDEFF FFEDBAABC AABCDEFED FFEDCBAAB AACEFFDCB FDAABCDEF
196,FFDAAABDF ABBACFFEF EEFFDBAAB AABDDEFEE CDDEFFDBA FFEDDDBAA FFDBABBCD ABCEFECCE AABBCEFFE FFECBBCBA FDDBBABDF AABCCDEFF FFEDCBCAA DFFECBAAC BBAABDEFF FEEEECBAA FFEDBAABD
197,FFEEDCBAA AAABDEEFF EFFDAABCD DEEFFDBAA AABCCDEFF FFEDCBAAB ABBBDDEFF FFEDCBAAB ACDFFECBA CBAABDEFF FFEECCBAA BAABCDFFF FFEDDCBAA ABEFEDDCB CACFFECBA FFEDCBBAA AABCDEEFF
198,EEEEEDCAA AABDEEFEE FFEDCBBAA AABCDEEFF FFEDBCCBA DCCBBACEF AABCDEEEF AACEEEDDF FFFECBAAA FFEDCCBAA EEEEEDBAA EBAABCDFF AABBCDEFF BCEFFECAA FECBAACEF AABCDEFFE FFCBCDDCA
199,EEEEEDBAA FFEDBABBC BBAABDEFF EFEBAABDE ABBABEFEF EEFEDCBAA FDBAABDEF ABABCDEFF FFEDCBBAA DEFFEDBAA AABBCEEFF BBDFFEDBA FFDCDCBAA CBAADFFED FFEDCCBAA BBAABDEFF AABCDEEFF
