,0
0,EBABCCFEBDD FFEEEDCBAAA AAABCDDEFFF AAABCCDEEFF AABBCCDEEFF BCEFFFDCBAA FFEEDDCBBAA FECBAABCDFF AABBCDEEFFF FFEFEDCBBAA FFEEDCCBBAA DBAAABDEEFF AAABDDEFFEE AAABCCDEEFF EFFFEDCBBAA BAAABCDEFFF DEDBAAADEFF AABBCCDEFFF AAABCDEFFEE FFEEDCCBAAA FFEEEDCBAAA
1,EECDFFEBAAB AABDEFFEDCB FFEEDCBBAAA AAABCDDEEFF AAABCCDEFFF BBBCDEFFFAA BBDFFEEECAA FFEDCBDDCAA FECBCFEDCAA FEECBAACCDF AAABBCDEFFF FFDBAABBCDF AABBCDEFFEC AABCEFFEDDC FFEEDCBBBAA AABBBCDEEFF CDEFFFDCBAA AAABCDEFEEF DEEFFEDBAAA FEDBAAABDFF FFEDBBAABCD
2,AAABCDDEFFF CEFFEEDCCAA FFFEDCCBAAA FFFEEDCBAAA FFEEEDCBAAA FECBAABBDEF AABBCDEEFEF AAABCDEEEFF BDEFFDBAABD AABBCDEEEFF EDCAACFFECC EEEEEDDDBAA FFEEDCCCBAA FFECBAABBDF AAABCDEEEEF FFEEEDCBBAA FEDEFEDBBAA AAABDEFEEEE DCCBAABCEFF AAABCDDEFFF AAABCDEEFFE
3,FFEDBECACAB BBAABCDEFFF FFEEEDCBBAA BABEFFEDCBA FFEDCBBAABD AAABCDDEEFF EFFFEDCBAAA FFFEDCCBBAA AAABCDEFFFF BDFFFDBAABC AABDCCCDEFF FFFEDBAABBC AABBCCDEFFF EFFEEDCBBAA BAABBCDEEFF AABCCEFFFDB FFEDCBBAABC CCEEFEECCAA BAAABCDEFFF EEFFEDCBBAA FFEDCBAABCC
4,AAABDDEEEFF BCEFFFECBAA AABBCCDEEFF AABCDEFFFDC FFEEDCCBBAA FFEDBBBBBBB AAABDEEFEEE FEEFFCBAAAC AABDEFFDCDE ABEEAACEEEF FFFEEDCBAAA CBBBBBCDEFF AACFFECBCDF AABBCCDEEFF EFFEEDCBAAA FEDBCEEDBAA FEEEEDCBAAA AABBCCDEEFF EFFFEDCBAAA FFDBADEDBBA FFFDCBABCBB
5,EFEDEECABBA DCBAAACDFFF AABCBBDFFFE DEFFEDDCBAA EEEFEDCBAAA BBBABBCEFFF AABBCDEEFFF FFEDDDCBAAA FDEFFEDBAAA BAAABDEFFED FFEDDDCBAAA FFFEEDCBAAA AAABCDDEFFF AABBCDDEFFF EEEFEEDBAAA FFEEDCCBBAA FFEDCBAABBC AABBCDEFEEF AABCBDEEFFE ECAAABCDEFF FFFDCCCCBAA
6,AAABDEEEEEE FFEEEDCBAAA AAABCCDEEFF AABCDEEFEED FEEDEEDCBAA FFEEDCBBAAB AABBCDEEFFF FFFEEDCBBAA FFEDCBAAACF ABBBBCEFFFE AABBBCDEFFF FFEDBBBBBBB FFFEDCCBBAA FECADFDAACE AAABCDEEEFF AAABCDEEFFE FFEEDDCBBAA EDBAAABDEFF AABBCDDEEFF EFFEEDCBAAA AAABCDEEEFF
7,FFEEDBBAABD AABCDEEFEEE AABCCBCEFFF FFFEDDCBAAA BDEEAABCEFD BAABCCDDEFF FFFEDDCBBAA FFFEDDCBAAA AAABCDDDEFF CDCBAACDEFF AAABBCEFFFE FFEEDDCBBAA FFFEDCCBBAA AAABCCDEFFF AABBCDEFFFE FFFEDBCBBAA CBEFFEDCCAA CCCBBABCEFF CFFFEDCABBA FFDCDDDCBAA FFEDCBAABCD
8,AABCCDEEEEE EEEEEEDCCBA FFEEDDCBBAA FFEDCBBBBBB ABCEEBBBDFF FFFEEDCBAAA FFEEDCBBAAA AAABBCDEFFF AAABCCDEEFF FFEDBAABBCD AABBCDDEEFF FFFEDCBABCA FFFEDCBBAAA AABBDEFFEDD FFFEDCCBBAA FFEDCBBAABC AABBCDDEEFF AABCDEEEEEE FFEDCBBBBBB AAABBCDEEFF DDEEEEDDBAA
9,FFFDDCBBBAB AAABCDDEFFF FFEEDCCBBAA AAABCCDEEFF AABBCDEFFFE FFFEDDCBAAA FFECBAABCDD AABBCCDEFFF DEEFFEDCBAA ECBAAABDEFF ABCFFEBBBEF ABDEFFEDCAA FFFEDCBAAAB AAABBCDEFFF BCCBAACDEFF CDEFFEDCBAA FDCDEFFDBAA FFEEDDCBBAA AAABCCDEEFF AAABCDEEFFF FFFEDDCBAAA
10,FFEEEDCBBAA CAAACEFEEEF BDEFFDAABCD AABCCDDEEFF FFEDBBABCCD AAABCDDEFFE FFEECCBAABC AABBBCDEFFF FFEEDCCBAAA AABBCDEFFFE FFEEDCBAABC AABBCCDEEFF FFFEDCBBBAA BAAABCDEEFF DFFFEDCBBAA FFFEDCCBABA AAACDEFFEED FFEEEDCBBAA ABCFFFECBBA FFFEDCCBAAA AABBCCDEEFF
11,AABBCDEFFFE FFEEDCCBBAA FFEEDCCBBAA BBAAABDEFFF BBBBBBBDEFF DDEEEEEDCAA AAABCCDEEFF AABBCDEEFFE FEDBAAABDEF BDEEFFEDBAA FFEEDCCBBAA AAABCCDEEFF CDFFFEDCBAA FFEEDCCBBAA FFFEDCBBAAA AAABBCDEEFF AACDEFEEDDC FFEEDDCBAAA BBBBBBCDEFF AABBCDDEEFF ABDEFFFECAA
12,BBBCBBADFFF CBAACFFFEDC EEFFEDCBAAB ABEFFEEDCAA FFFEDCCBAAA BBAABBCEEFF EFFFEDDCBAA CABBBCCDEFF ABCCBBCEFFF EEEFFEDCBAA AABBCDEDEFF BBDEDAABDFF AABCDEFFEDB FFEEDDCBBAA EDBAAABDEFF AABCDDEFFED AABBCDEDEFF DEFFEDCBBAA FDBCEFFDCAA FFEEDCBBAAB AABBCDDEEFF
13,FEEEDCCECAA CDEFFEDCBAA FEDBAAABDEF AABBCDEEEFF CEFFFDCBBAA DDEFFEDCBAA EDCBAABCEFF ACDFFFECBBA FFFEEDCBAAA EEDBAAACDFF AABBCCDEEFF FFFEEDCBBAA FFDAABCCCCD AABBCCDEFFF FFEDCBBBBBD AABBCCDEFFF AAABCDDEEFF FFEEDDCBAAA FFEEDCBBAAB AABBCDDEEFF FFFCBBBCCBA
14,AABBCDEEEFF AAABCDDEFFF AABBCDDEFFF BCEEDBAACEF EFFFECBABBA FFFEDCCBBAA FFEEDCCBBAA AABBCDDEFFF EFFEEDCBBAA FFFEDCCBBAA FFEDCCBBBBA BAABBCDEEFF AABCDEEEEEE AABBCCDEFFF AABCEFFFDBA AABBBCDEEFF FFFEDCCBBAA FFEEDCCBBAA FFFEDBBBBBA FFFEDCBBAAA FFEEDDCBBAA
15,BCDEDDEFEBA FFFEDDBBAAB AABBCCDEEFF DFFEEDCCBAA FFEDCBAABCD AABCDEEEEEE DCBBBBBCEFF CDEFFEDBAAA FFFDCCBBBBB FFEEEDCBAAA AABBCCCDEFF ABDDDBACEFF FFEEDCCBBAA FECBAAACDFF AABCDEEEEEF DEEFEEDCBAA CBAABCDEFFF AAABCDEEFEF FFECBAABDEC FFEEDDCBBAA DBAABCDEEFF
16,AABCDEEEEEE EEFEEDDCBAA FFEEEDCBAAA AABBBCDEFFF BCCDEEEFEBA FFEEDCBBAAA AABBCCDEEFF AABBCDEEFFF FFFEDDCBAAA AABBCDEEFFF CDFFFEDCBAA DDEFFEDCBAA FFEEDCCBBAA DCBBAABDEFF AABCEEFEEDD FFFEEDCBBAA FFEDCBBBBBB AABBCCDEFFF AABBBCDEFFF AABBCDEEFFF CBAABDEFFED
17,AADFFFEDBBA AABCDEFFFED FFEEDCCBBAA EDBBAABCEFF AABBCDDEFFF DFFFECBAABB FFEEDCBBAAA EFFECCBBAAE AABBCDDEEFF ACEFFCDDCBA FFFEDCBBAAA AAABCDFFFED FFEEDDCBAAA CCBBBBBCEFF AABDEECCDEF EFFFEDCBBAA FFEEDCBBAAA AABBCCDEEFF AABBCDDDEFF FFFEDCBAAAB AABDEFFECBC
18,ABBAACEFFEE DBBAABCDEFF FFEEDDCBBAA FFDCBAABCEF AABBDEFFFED FFFEDCBBAAA AAABBDDEFFF AACCEEEEEEF AABBDEEEEEF ABBCCCCCDFF FFFECBBBBBB DDDDDEFEDBA FDCBAABBCEF FFFEDDCBBAA CBBBBBCDEFF AABBCDDEEFF FFEEDDCBAAA AAABBCDEEFF AABBCCEEFFF FFEEDBBAABC ABDEFFFCAAB
19,FFEDDCBAABD AAABCDEEEFF BCCDEFFECAA FFFECBBAABC AABBCCDDEFF FFFEDCBBAAA FFEDBAABDDE AABCEFFEEDB FFEDCBABCBB AABBCCDEFFF EFFEDCCBBAA EFEDCCAAADF AABCCEFFEEE EEFEDCECBAA CBBAABDEEFF FFFEDDCBAAA EEEFFEDBAAA BBBEEDCABDF AAABCDDEEFF AABCDEEFFEB ECDEEEEDDAA
20,FEEEEEDBBAA FFFEDDCBAAA AAABBCDEEFF AAABDDEFEEE AABBCCDEFFF FFFEDCCBBAA DCDEFFECBAA FFEEDCCBAAA BAABBCDEFFF AABBCDDEFFF ADFFECBBBCC AAAABDEFFEE FFFEDCBBBAA BAAABCDEFFF EFFEEDCBBAA FFFEEDCBAAA ECBBAABDEFF AABBCDDEEFF DDEFFEDCBAA AAABCDEEFFF FFEDCCCBBAA
21,BAAAEFECDEF AABBCCCEEFF AABDEFEDDDC CBBBBBCDEFF BFFDAAACEED AABCEFFFECB FFDDEEDBAAA BBAABBDEFFF FFFEDCCBBAA CBBBBBCDEFF DDABCEFFDBA FFFEDCBAAAB AAABCDDEEFF AAABDEFFEDD FFDCBAABCEF AAABCDEFFFE BCEEEEFECAA BAABDFFFDDC FFFEDCBBAAB EECDDEFECAA FFEDBBBBBBC
22,AAABCDEEFFE FFEEDDCBBAA FEEEEEDCBAA FFEEEDCBBAA BBAABBCDEFF DEFFEEDCBAA CBAABBCDEFF AAABCDEEEFF CBAAABCDEFF AABDEFFDCDE FFFEDBBBBAA EDCBAAACEFF FFFEDCCBBAA FFEDCAAABCE ACDEFFEDBAA FFFEDCCBAAA AAABCCDEFFF FFFEDBBAABB AABBBCDEFFF AABCDDEEEFF AABCDEEEEED
23,AABDEEEDCCF BDEEEEEEDAA FFFEDDCBBAA AAABBCDEEFF DEEFFEDCBAA FFEDCBAABBC AABBCCDEEFF AAABCDEFFFE CBAABCDEEFF AACEFEBCDEF FFFEDCCBAAA ABDFFFECBBA FFFEDCBBAAB AABBCDEFFEE FFEDDDCBBAA FFEDCBBABBC AABBCDEEEFF DFEDFFDCAAA AAABBCEEEFF ABAABDEEFFF FEDBCABDEED
24,ACDFEBAACEF AABCDEFFFEB FECAAABCDEF AABCDDEFFEB FFEDBAABBCD AAABCDEFFFE FFEEDCCBBAA AABBCDEEEFF EDEFEDDCBAA FFFDCBAABCD AAABCDDEFFF FFEEDDCBAAA BAAABCDEEFF DFFFEDCBAAA FFEEEDCBAAA AABBCDEFFEE FFFEEDBBAAB ACFFFEDDCAA FFEEDDCBBAA DCBBAACDEFF ACEDAACDEFF
25,BABBDDCFECF FFEEDBCDBAA FECBAABCDEF DEFFEDCBBAA FFEEDDCBBAA AAABCCDEEFF AABBCCDEEFF FFEEDDDBAAA FFDEEDBAAAC FFEEDDCBBAA BAABBCDEEFF AABBCEFFFED FFFEDCCBBAA AAABCCDEFFF CEFEDAABCDE BBBCCACEEFF DEEFFEDBBAA FECBAABCEEF EFFECBAAABD AABCDEEEEFF ABABDFFCEEC
26,EDDBBBACFEF CCDFFFECBAA AAABBDEFFFF FFEDECBABBA FFEDCCBBAAB AABBCDDEEFF AAABCDEFFEE FFEEDDCBBAA FFEEDBAAABC AABDEFFFBBC ABCEDCBCEFE AABBCCCEEFF BAABCDEDEFF DEEFFEDCBAA FFFEDDCBAAA AABBBBDEEFF CCBAABCDFFF AABCEFFEDCB FFFECBAAABC FFFEDDCBAAA AAABCDDEEFF
27,AABBBCDEEFF AABCCDEEFFF BBBAABDFFFF FFEEDCCBAAA AAABCCDDEFF AABCDEDEFFD FECAAABCDEF DDEFFEDCBAA FFEECCBBBBA FFEEDDCBBAA FFEDCBBBBBB AAABCCDEEFF AABBCDDEEFF AABCEFEEEDC FFEEEDCBAAA AABBDEFFEED FFFEDCCBBAA BBBAABDDEFF FEDDDEEDBAA FFEEDDCBBAA FFEEDDDCBAA
28,FFEDBBAABDE AABBCDDEEFF FFEEDCCBAAA AABCDDEEEEF FFFEDCCBAAA BAABBCDEFFF EFFFEDCBBAA FFFEEDCBBAA AAABCDEEFFF FFFEDCCBAAA AAABDEFEEEE EEEDCBAABEF FFFEEDCBAAA BBAABCDEFFF AABBCDDEFFF FFEEDCCBBAA FFEDCBBABBC AAABCDDEEFF FFDBAABCDEF DDDEFFECBAA EDEEFFDBBAA
29,BBBAABDDEFF AABCDEEEEEF AAABBCDEEFF AABBBCDEFFF AABBBCDEFFF CEFFFECAAAC FFDDCAABBCC BCEFFFDBAAA FFEEEDDCBAA FFEDCBBBBBA DDDCBDFFEBA FFFEDCBBAAA AAABCCDEEFF AABBDEFFEDC DBBABBCDEFF AABBCCDEFFF AABCDEFFEDB FEFEEDCBAAA AABDEFFEDCA FFEEDDCBBAA FFEEDCBBAAA
30,AABBCCCDEFF BDFFFECBAAA FFFEDCCCCAA FFEDCBBBBAB FFEEDCCBBAA FECBAAABDEF AABBBCDEFFF FFEEDDCBBAA BBABBBDEEFF AABBDDDEEFF FFECBBAABCE AAABCDEEEEF DEFFEDBAAAB FFEEDDCBBAA AAABCDEFFFE FFEEEDCBBAA CBAAABCEFFF AABCCEFFEDC FFFEDCBBBAA AAABCDEEEFF FFFEDDCBAAA
31,FFEEDCCBABA FFEEEECBAAA EEFFEDCBBAA FFFEDCBAAAB BBBBBBCDFFF AAABCCDEFFF AABBCEFFEED FFEEECBCBAA FFEEDDCBBAA DCBBAABDEFF AABCDEEEEFE FFFEEDCBBAA AAABDDEEEFF ABAACDFFDEF DBABCBCDDEF FFFEDDCBBAA FECBAABCDEF AABBCCDEFFF FFEEDCCBAAA AABBCDEEEFF AAACEEEFDED
32,BBABCCDFFDB EEFFEDBAABA DCBAABCDEFF AABBCCDEEFF CDEFFEDCBAA FFFEDCBBBAA FFECBAABCDE AAABCDEEEFF BCDEFFFDCAA FEDBAABCDEF AABBCEFFFDC AABBCCEEFFE FFEDCCCBAAB AABCEEDDDEF AABDEFFECBA FECBCDFEDAA FFEEDCBBAAB AABBCCDEFFF AABBCDEFFFE FFEDCAAABCD FFFEDDCBAAA
33,AABBBCEEFEF DFFEEDCBAAA DBAAABCEFFF EFFEEDCBAAA FFEEDCBAAAB AAABCDDEEFF AABBCCDEFFF FFEEEDCBBAA FFEEDCBAAAB AABBBCDEFFF FFEEDCBBAAA AABBBCDEFFF BAABBCDEEFF EFFEEDCBAAA FFEEDCCBBAA AAABBCDEEFF AABCCDDEEFF AACEFFEDCBA FEEEEDCBAAA FFECBAABCDE AABBCDEEEFF
34,AABCDDEEEEE EDBAABEFFFD FFFEDDCBBAA FFEEDCCBBAA AAABCDEEFFF FFECBAABCEF ABBBBBCDEFF AABCDEEEEEF AAABCDEEEFF FECAAABDEFF EEEFEECBAAA AABBCDEEFFF FFFEEDCCBAA BAABBCDEFFF FFEEEDCBBAA FFFECBBBBBB AAABCDDEEFF AABBBCDEFFF EEFFEDCBAAA AAABCCDEFFF AACDEFFEECA
35,FFEDDECBAAB ABDFFFECBAA BAAABCEEFFF AAABDEDEFFE FFECBBCDCBB DEFFFEDBAAA AABCDFFECBB FDBAAACDEEF AABCDEEFFDC FFFEDCCBAAA AAABCDDEEFF BBCEEFFECAA FFDCBBBBBDE BBAABCDEEFF AAABCDEEEFF FFFEDDCBAAA DCBAAABDEFF EFFECBAABCE AABBCEEFFEC FFEEDCCBBAA EEEFFECAAAB
36,BBBCCCCBCFF FFEEDDCBBAA FFECBAAABDE ABCEFFEDCBA FFFEDCCBBAA CBBAABCDEFF BDFFECCDBAA AAABBCDEFFF ABBBBBCDFFF CBBBAACDEFF AAABCDEFFFE FFFEDDCBAAA FFFFECBBAAA EEDEEEEDBAA FFEDCBBBBBB AABBCDDDEFF FFEEDCCBBAA BAABBCCDEFF AABBCCDEFFF FFECBAABCDE AABCDEFFFCB
37,BBBBADDCEFF CCCCBBABEFF FFFEDCBCBAA FEEEEDCBBAA AAABBCDEFFF EFFEEDCBBAA EBAABBDDEFF AABBCDEEEFF FFEDBBBBBCC AABBDDFEEEF EFFFEDBBBAA BAABBCDEFFF AABBDEDCEFF DEEFFEDCBAA FFFEDCBAABB AABBBCDEEFF FFFEDCCBAAA EDCBAABCEFF AABBCDEFFFE FFEDDCCBAAA FFECBAABCEE
38,FECAAEFDBBC ABBBBCCCEFF AAABDEFFEED FFEDCBBAABD AABDEEDDDEF AACEEEEEEDB AABCFEDDEED FFEEEDCBAAA BBBBBCCDEFF FFFEDDCBBAA FFEDBBBBBBC AABBBCDEEFF ABDFFFEDBAA FFFEDCBAABB AABBCDDEEFF AAACEFFEECB AABBCEEEEFF FFFEDCBBAAA BDEFFEDBBAA FFEEDCCBBAA CAAABCEEFFF
39,AABBCDEEEEF EFEEEEDBAAA AAABCDEEFFF AABCEEFEEDE AABBCCDEEFF AAABCDEEFFF AABBBCDEEFF EFFEEDCBAAA FFFEDCBBAAA FFEEDCCBAAA FFEDCBBBBBB FFFEDCBAAAB AAABCDDEEFF AABBCDEFFEE FFEEDCBBAAA AABBBCDEEFF AABBCDEEFFE BBAABCDEFFF FFEDBBCCBAA FFEEDDCBBAA FCBBBCDDCCB
40,AAABCDFFFEE ABDFFFEDCBA FFECCBABBBD AACDEFFEDBA CBAAABCDEFF FFFEDCCBBAA BAAABCDEFFF ABCDEFFEDBA AAABCCDEFFF BDEEFFECBAA ABBBBBCDEFF CDEFFEECBAA FFEEDCCBBAA AAABBCDEEFF AAABCCDEFFF AABBCCDEFFF FFEEDCBBABA FFEEDDCBBAA FFEECBBBBAB AAABCDDEFFF AABBCDEEEFF
41,AAABCEEEFEE FFEEDDDCBAA FFEDBBBABCD FFEEDDCBBAA AABBCCDEEFF FFFEDCBAABB BAABBCDEFFF FFEEDCCBBAA AAABBDEFFFE AAABCDDEFFF AAABCCDEEFF DDCBBBBEFEA FFEEDDCBAAA FFECBABCCCB FEFEDCCBAAA AABBCCCDEFF AAABDDEFFFE CEFEAACCDDE ABBBBCDDEFF FFFEDCCBAAA AAABCDEEFFF
42,AAABCCDEEFF AABCCDEEEFF FFFEDCCBBAA FFFDCBBBBCA FFEEDDCBAAA CBAABBCDFFF CEDAAABCEFF FFEEEDCBBAA FECAAABCDFF AAABCEEEEEF FFFEDCBAABC AABBCCDEEFF BAABBCDEFFF FFFEDCBBAAB FFFEDCCBBAA BBAABBCDEFF EFFFEDCBAAA FFEEDCBAAAB AABBCDDEFFF FFFEDCBBBAA FDBAABCDFFD
43,EDCBBAABDFF AABBBCDEFFF AABBBCDEEFF EEEFEEDBBAA DDBAAACDFFF DDDDEEFECAA FEDCBAABCEF AABCDFFFEDB FFFEDCBAAAB FFFEEDCBBAA FDBBAABDEFF AABBCCDEEFF AABBCDEEFFE FFFEDCBBAAB ABCEFFEDCBA FFEEDCBAAAB AABBCDDEEFF FFFEDCBBBAA FFEECBBCBBA FEDECAABEEC FFFEDCBAAAB
44,EEEFFCDCBAA AAABBCDEFFF ABDFFEDDBBB FFEDCCCCBAA FDBEFECAABE EFFEEDBBAAA AABBCDEDEFF AABBBCEEFFF EEFFEDCBBAA BAAABCDEFFF BCDFFFDBAAC AABBCCDEFFE FFEEDCBBBAA FFEDCBAABCD AAABCDEFFFE AAABBCDEEFF FFEEDCCBAAA FFFEEDCBBAA BAABBCDEEFF AABBCDDEEFF FFEEDDCBBAA
45,CCDEEFEECAA FFEEDDCBBAA FFECBABBBCD AABCCDDEEFF FFFFDCAAABC ABAABDEFEEF AABBBCDEFFF FFEEDDCBBAA FDBAAABDEFF AABDFFDCCEF AABBBCDEFFF FFEEDDCBAAA EFFFEDCBBAA AAABCDEEEFF ACDEFFEDCAA FFEDCABDCBA FEEEDBAABCE FFEEEDCBAAA FFEDCBBBABD AABBCDDEEFF AABBCDEEFFF
46,FFFEDDCBBAA FFDDCAABBDE AABCDDDEEFF FECBBAABCEF DDEEEFECBAA AAAACEEEEFF CDEFFEDBAAA FFDBCBABCDD AABBBCEDEFF FFEEDCBBAAA AABDFFFECBB FFFEEDCBAAA AAABCDDEEFF FFFEDDCBBAA CBAABCDDEFF CEFFFDBABBA BAABDFFFEDC BBBBBABDEFF FFFEDCCCBAA FFEEDCAAACE AAABBCDEFFF
47,FFEDDBACDBA DCBDFFEDCAA EDCBAAACEFF EEEEFECAAAC FFFEDCBBAAB AABBCDDEFFF CEEFFEDBBAA FFFEEDCBAAA AAACDEEEEEE EEDEEDDDCAA AABCDBCDEFF BAABBCDEEFF AABCDEFFEDC FFEEDCCBBAA DCAAABCDFFF AABCDEFFEDB AABBCDEEEFF ABDEFFEDCAA FFEDBAACCCA FFFEDDCBBAA AABBCDDEFFF
48,FFEDEDCBBAA FFEEEDCBAAA AAABBCDEFFF AADEEEFEDCB FEEDDBAAADF AABCDDDEFFF BBBBBBCDEFF BEFFFDCBAAA FFFEEDCBBAA FFEDDDDCBAA FFEEDCBBAAA AABBCCDDEFF AABBCDDEEFF FFFEECBBAAA AAABCCDEFFF AAABCDEFFED FFEEDCBBBBB AAABCCDEFFF FFFEEDCBBAA DBAAABCEEFF AABCEEFFEDA
49,DCBCBBBBDFF FEEEEDCBAAA AAABCDDEEFF FECCBAABCEF AABCCCDEEFF AAAABCDEFFF FFEEDCBBAAB FFFEEDCBAAA FFFEEDCCBAA FDBBAABCDEF DEFFEDCBBAA FECBAABCDEF AABCCBCEEFF FFFEDCBBAAA AABBCCDEEFF BCDCBABCEFF EFFFEDBAAAA FFEEDCBAABB CDFFFECBAAA FFEEDDCBBAA ECAAABCDEFF
50,FFEDCBAABDF AACDDDCDEFF EDEEEDEDCAA AAABCCEEEFF BAABBBCDEFF FFFEDDCBAAA FFEEDDCBBAA AAABCCDEFFF AABCCDFEDEF AABBBCDEEFF FFFEECCBAAA FFFEEDCBBAA AAABDEFFEED FFEEDBBBBBA CCBAABCEEFF AAABBCDEFFF FFEDDCBABAA AAACEEFFEDC BBBBBBCDEFF ABEFFEEECBA FFEECBAABCD
51,BBBBBACCEFF BBBBABEFFFE FFEEEDCBAAA AABBCDDEEFF EFFFEDCBBAA FFEEDCBBBAA AABBCDEEEFF ABDFFEBABCE AABBCCDEFFF FFEEDCBAABB AAABCDDEEFF CDEFFEDCBAA AAABCDEEEFF ABCDFFFEDBA FFEEDDCBBAA AABBCCDEEFF FFEEECBAABD AAABCDFFFEE FFEEECCBBAA AABBCEEFFED FFEEEDCBAAA
52,DCBBCBAEFFD CBABEFFEDBA FFEEEDCBAAA AABBCDEEEFF AABCEFFFECB FFFEDCBAABA FDCCBAABDFF FFFEDCBAABC FFEEDCCBAAB AABBCDDEEFF AABBCEFFFED FFEEDDCBBAA FFDBABBBCCC AABBCDEDEFF EEFFEDCBAAA ABBCBBCDEFF AABBCDEEEFF CDEFFEDCBAA FFFEDCBBAAA AABBCDDEEFF FFDBBCBCCBC
53,FFEEEDCBBAA FFFEEDBAAAB ABBCDEFFECA AABBCDDEEFF AAABBCDEFFF FFFEEDCBAAA FFEEDCCBBAA AAABCCDEFFF AABCEFEEDDE AABCDDDEFFE FFEEDCBAAAB FFEEDDCBAAA FDCBBAABDFF AABBCDDEFFF AABBCDEFFED FFEEDCCCBAA FFCBCEEDBAA FFEDCBAABCE EFFEEDCBBAA EDBBAABDEFF AABBCDEEFFF
54,BAABDDDCCEF FFECCCCCBBA FFEEEDBBAAA EEEEEEDCBAA FFECBBBBBBB AAABCEEEDEF CDEFFEDCBAA FFEDCBAABCD AAABCCDEEFF BCDEFFEDBAA AAABCCDEFFF AACEFFEEDBA DBAABDEFFDB FFEEDCCBBAA BAABBCDEFFF CEFFFECAAAC FFEDDCBBBAA DCBBBBBCDFF AABCDEEEEEF AAABCDEFEEF EFEDBAABDEE
55,AABCDEFFEED FFEEEDCBAAA AAABCDDEEFF CEFFEEDCAAA EEEEEEDCBAA BAABBCDEFFF AAABCDEEFFF AAABCDDEEFF DEFFFEDCBAA FFEEDBBBBAA FFFEDCBBAAA FFFEEDCBAAA AAABBCDEEFF BAABBCDEFFF FFFEEDCBAAA FDCAAABCEFF AAABCDDEFFF AACEFFEEDCA BAABBCDEEFF EEFFEDCBAAA FFEDCBBBBBB
56,FFFEEDBAABB FFECAABDECB FFEEDCBBAAA BAABBCDEFFF AAABBCDEEFF EFFFEDCBAAA FECBAACEEED EEFECBAAACF ACEFFEDBBDC FFEBCEECBBA FFFEDCCBAAA AABBBCDEFFF DAABEFFEBCD EEEEEEDCBAA AABCDEFCCEF BDEEDAABDEF AAABCDEFFFD FFEEDCCBBAA FFDBAABCDEF AAABCDDEFFF BAABCDFEEEF
57,AAABCCDEEFF AABBCDEEFFF AAABCDFFFED FFEDCCBBBAA FEEFEEDCBAA FFEDCCBBBAA FFFEDCCBAAA BAAABCDEFFF AAABCEFFFDC FFECBAABBCD AAABCCDEEFF ABCEDCBBCFF AACDEEEFEDB FDBABDFFEBA FFEEDCCBBAA AAABBCDEFFF FFFEDCCBAAA EDBBAABCEFF AAABCDEFFEE FEDFFECBBAA FFDCCCDDCBA
58,FFEEDBCEBAA FFEEEEDBAAA AAABBCDEEFF AABBCDEEFFE ABBBBCDEEFF DEFFFECBBAA FFEDDCBBBAA CBAAACEFFED FFEEDDCBBAA FFEEDCBBAAA AABCDEFFEDD AAABCCDEEFF AABBCCDEEFF EFFEDDCBBAA FFFEDDCBAAA FFECBAAABDF AABBCDDEEFF ACEFFEDEDBA FFEEDCCBBAA DBBAABCCEFF AABBDDEEEEE
59,AABCDEFFEEC FEBABCDDDCA FFFEDBBBBBB FFFFEDCBAAA AABBBCCEFFF FFEDCBBBBBC AABCDDEFFED FFECBAABCDE AAABCDEEEFF FECAAABDEEF AAABCDEFFEE FEDCCEEDBAA FFEDCBAABBC ABDEFFEDCBA FFEEDCBBAAA AAABDEFFEED FFEDCBBBBBB AAABCCDEFFF AACCCCCDEFF AABBCDEEEFF AAABCEEEFFE
60,AABCDEFECDF EEDCBAABDFF AABDEFFEDCB FFEEDCCBBAA AABDEFEDDDD FDCAAADEFED FFEEEDCBBAA CBAAABCEFFF AABBCDDEEFF FFFEDDCBAAA FFEEDCCBBAA AAABCDEEFFF DFFFDAAACCD AABCDDEFFED BAABCDDEFFF ABCEFFFDCAA FDBAAACDEFF AAABCDEFFFD FFEDCBAABCD ABCEEFFECBA FFECAABCDCD
61,FFECBBBABCD AABCDDDDEFF AABBCCDEEFF FFECBBBBBCC AABBCDEFFEC CBABDEFFDBA DAAACDEEEEF EEEEEDDDCAA FFEDCBBBBBB DDEEFFECBAA FFFEDCBBBAB AABBBCDEEFF AABDEFFEDCB FFEEDCBBAAA AAABCDDEEFF ABDFFECBBCE DFFFDBBCCAA FFEDCBBAABB AABCEFFEDCB FFEEDCCBBAA FFDCBABBBDE
62,DDDDDEFECAA AABBCDDEEFF BBAABDEFFEC FFEEDCCBBAA AAABBCDEFFF AABBBCDEFFF FECBAABCDFF AABCDCDEEFF FFEDCCDCBAA FFEDBAABBCD FFFEDDCBBAA FFFEDCCBAAA AAABCDDEEFF AABCEFFEEDC FEFFEDCBAAA BBBBBBCDEFF AAABCDDEEFF ECBAAABCEFF AAABCDEEEFF FFECDECBBAA FFEEEDCBAAA
63,FFFEEDCBAAA EDCBAACCEFF AABBCEFFEDE BCBAABDEFFF AABBCDDEFFE CAAABCDEEFF AABBDEFFECB DCBAABCEEFF EEFFEDCBBAA FFFEDCBAABC AACEEDCEFED FFEEEDCBAAA AABBCDDEEFF FFFEEDCBBAA BBAABCDEFFF FFEDDDCBAAA BBAAABDEEFF FFEECBBCBAA FFDCAACEECA FFFECBBBCBA AAABCCDEEFF
64,AABDEFFFECA FFFEDBBBBBA FFEDCCDCAAA FFFEDCBBAAA AABBBCDEEFF FFEEDCCBBAA CBAABBCDEFF AABBCCDEEFF FFEDBAAABDE AABCDEEDEEF FFFEDBBBBAA FEDCBAAACEF FFFEDCCBBAA FFEDCBAAABC AABBCCDEFFE FEEFEDCBAAA BBBBBBCEFFF AACEFFEDDCB AAACFEEDDEE CDEEEBAACEF AABBCDEEFFF
65,EEEEEEDCBAA FFEEDDCBBAA FFECAABBBCD AABCDDDEEFF DEEFFEDCBAA AABBCCDEFFF AAACDFFFEDC FFEEDDCBAAA AABBCDEFFFD AABBCDEEFFE FFEDDDCBBAA EEFFEDCBAAA DCBAABCDEFF AABBBCDEEFF FFEEDCBBBAA EEEFFECBAAA BBAABCDEFFF FFEEEDBBAAA FFFEDCBBBAA AABBCDEEEFF AABBCDEEFFF
66,AAABBDDEEFF AABBCDEEFFF AABBCDEEFFE FFEDCBBBBBB FFECBBCCABC FFEEDDCBAAA AAABBCDEFFF ABCDEFFECBA FFEEDCCBAAA AAABCCDEFFF AABCBBCDEFF FFEDCBAABCE AABCDEEFEEE BDEFFEECBAA EFFEEDCBAAA BBABBBCDFFF FFEDCCCBBAA FEDBAABCDEF AABBCDEFFFE FFDCDEDCBAA FEDBBCEECBA
67,FFFEDDCBAAA BAAABCDEEFF EEEEEEDBAAA CBAABCDEEFF AAABCDDEFFF EFFFEDCBAAA FFFEDCCBAAA AAABCDEEEFF DFFFEDCBAAA FFFEDCCBAAA CBBAABCDEFF FEEECEEDBAA FFEEDCBAACE AAABCDDEFFF FFFEDDCBBAA FECAABBCDEF DEDAAABDEEF DEEFFECCBAA AABBCDDDEFF CDEEFFECBAA AABCDEEEEFD
68,ABDEEDCBBDF BDEFEEDDCAA FFFEDCBAAAB AABDDEEEEED FFEDCBBBBBC AAABBCDEEFF AABBCEFFFED FFFEDDCBAAA FFEDCCBBBBA FFFEDCBBAAA AAAABCDEFFF AAABCDEEFFF AAABBCDEFFF FFEEEDCBBAA FFEDEDCBBAA FFDCBAABCEF AADFFEDCBCE AABBCCDEFFF AABDFFFEDBA FFECBAABCDE AABCEEFFEDB
69,FEDEBDBBCAB CCCCBAABEFF EFFFEDCBBAA FFECBBEDCBA BBAABCDEEFF AAABCDEFFFE FFEEDCCBBAA FFDBBAABCDF AABCDEEFFDB AABBDDEEFFE ABBCEFFFDBA ECBAABCDEFF AABCBCDDEFF FFEEDDCBBAA AABBCDDEFFF FFFEDDCBBAA FEDBAABCDEF BDEFFEDDCAA AAABBCDEFFF EFFEEDCBAAA FFEDCBAABBC
70,CBBBAABFFFE ABBBCCCCEFF AABBCDDEFFF EDDBBBBBCEF AABBCCDEDEF DEFFFEDBAAA FFEDDCBBBAA EEEEEDDBAAA BAAABCFFEDF FFFEDDCBBAA AAABBCDEEFF ABBBABCEFFF FFEEDDCBBAA BAAABCDEFFF CCEFFECBAAB AABCDDCDEFF FFFECBABBCB FFFEDDCBAAA AABCDEFFEDC FFFEEDCBAAA FCAAABDEEFE
71,FFFEEDCBBAA DDCCBAABDFF AABBCDDEFFF EEEDEFDCBAA FFFEEDCBBAA FEDBAAABDEF EFFFEDCBAAA FFEDCBAABCE AAABCDDEEFF AABBCDEEFFF FFFEDCCBBAA FFEEDDCBBAA DCBAAACDEFF AABBCCDEFFF FECAAABDEEF AABBCEEEEEF EEFFFECBAAA FFEEDDCBBAA AABBCDDEEFF AABDEEEDDEF EEEEEEDCBAA
72,DCCDDEFECAA AACDFFFEDBA FFEDBAAABDE AACEFFEDCBB FFFEDCCBBAA AABBCCDEFFF AABBCCDEEFF FFEEEDCBBAA FFEEDDCBBAA AAABCDEEEFF AABEFEEDDDC CBAABBCDEFF BDFFECAABDE CDEFFEDCBAA FFFEDCBBAAA AAABCCDEFFF AAABCDDEFFF FFEEDBBABBB FFEEDCCBBAA AAABCDEFEEF AAAABDDEEFF
73,AABBCDEEFFF BAAABDFFFED DCBAAADEFFF FFEDCCCCBBA FFFEDCAAABB AABBCCDEEFF AABCEFFEDDD FFEEDDCBBAA FFFEDBAAABC AABBCDEEEFF FDEDCBEECAA FFDDEEBAABB AABBCDDEEFF AABCEFFEEDC FFEDCBABBBB BCCCDEFFDBA FEEDDBABBBC AABBCCDEEFF FEEFEDCBBAA BAABCDEEFFF FFEDBAABCDB
74,ABBABBDEFFF AABEEEEEDDD FFEEDDCCBAA CBAABCDEFFF AABBCCDEFFF AABCDFFFEDB FFEEDCCBBAA FFEDCBAABBC AABBCDCDEFF BDEEFFDAABC AABBCDFFFDC BAAABCDEEFF CCDEFFECBAA AAABCCDEEFF FFEEDCBAABC ABBDEFFECAB FEDBAABCDEF AABCEFFEDDB FFEEDBAAABC AABDEFFEDCA FFFEDBAABBB
75,FFEEDDCBAAA BBBBBBBCEFF AABBCCDEEFF AACDEFFEDBA AAABBCDEFFF BBDEFFECBAA FFEEDCBBAAB DEFFEDDCBAA FFEEDCCBBAA BAAABCDEFFF AABBCCDEFFF FFEEDCCBBAA BBBBBCCDEFF AABBCDEEEFF AAABBDEEEFF AABBCDFFFDC FFFEEDCBAAA ECBAABCDEFF FFFEDCCBBAA FFDCBBBBCCC EEEDDEEDDAA
76,EEEEEEDCBAA FFEEDDCBBAA AABCCDCDEFF AAABCDEEFFF FFEEDCCBAAA AAABCCDEFFF BDCBABCDEFF EFFEEDCBBAA FFFEDCBBBAA BAAABCDEFFF AABBCEEEEEF AABCEFFEDDC FEEFEDCBBAA DCBAABCDEFF AABBCDDEFFF FFEDBAAACEE FFEEDCCBBAA AAABCDEFFFE FFEEDCCBBAA BBAABCDEFFF AABBCDEEFFF
77,FEEEEEDBAAA ACFFFEECBAA FFEDDEECBAA FFECBBBBBCD AABBCDDEEFF FFEEDCCBBAA DBAABBCDEFF AAABCDEEFFF EFFFEDCBAAA AABBCDEEFFF CBDFFFCBCBA FFEDBAAABDE EFFEDCBBBAA FFEEDCCBBAA CBBABBCDEFF AABBCEFFEDC DDFFFDCBAAA BBBBBBCDEFF AABCEEEEEEE AAABCDEEFFF FFEBAABCCDD
78,DDEEFEDCBAA AABBCDDEEFF BBCEFFFDCAA FFEEDCCBAAA AAABCCDEEFF ABBCEFFEDBA BBAABCDEEFF AABBBCDEFFE FFECBAABCDE FFEEDDCBBAA FECBAABCDFF DEFFEDCBBAA FFEDCCBBBAB AABBCCDEEFF BEFFEDBAABC FFEDCBBBBBB AAABCDEEEFF AABBBCDDEFF AABBDDEFFDD FFEEEDCBBAA FFEEEDCCBAA
79,FFEEEDCAAAC EEFFEDDBAAA FEEEEDDCBAA FFECBABBCCD AAABDEEDEFF FFFEEDCBBAA FFEDBBAABCD AABBCDEEFFF FFFEDCBAAAB AABBDEEFFEE AACEFFFDBAC FFFEDCBAABC ACEFFFDBBBA FFEEDCCBBAA BBABBBCEEFF ABBCEFFEDBA EFFEDCCBAAA CCBBBBBCEFF AAABCEEFEEE AAABBCDEFFF EEEFFDBAABB
80,AABBCDDEFFF FFFECCCCBAA FFFEDCBBAAA DDEEDEFECAA FECBAABBDFF AACDCCEFFDB FEDCBAABCEF AAABCDEEFFF FFFEDCBBAAB AABCDEEFFED CDFFFDDCBAA CDEFFEDCBAA DCBAABCDEFF DEFFEDCBBAA FFEEDCBBAAA AABBCCDEEFF FFFEDCBBBBA FEDCBAABBDF AABBCCDEEFF BAABCDEEEFF AACECDEFDDC
81,BBBAABFFFED FFEDCBAAACE ABDEFFEDCAA FFEEDCCBBAA EDBBAABCEFF AAABCDDEFFF FFEDCBBBBBB AABBBCDEEFF AAABDEEEFED DCBBAABDEFF FFECABCBBCC AACDEEFFEDB DDDDDEEECAA FFFEDCBBAAA AABBBCDDEFF CDEFFEDCBAA FFFEDCCBBAA CBAABCCDEFF AAABCDDEEFF FFFEDCBBAAB AABBCDEEEFF
82,CEEEFEECBAA AAABCDEEFFF FFEEDDCBBAA FEDCBAABCEF AAABCDEEFFF BBBBBBCDEFF BBBABBCDEFF AABBCDDEEFF FFFEEDCBBAA FFEEDCCBAAA ACEECDCEFEB FFFEECBAAAB AABBDDEEFFE FFFEDCBBAAA AABBCCDEEFF AABBCEEEDEF FFFEDCBAABB AABBCCDEFFF EFFFEDCAAAB FFFEEDCBAAA EEFEEDCBAAA
83,CCDEEFEECAA FFEEEDCBBAA FFEDCBAABBC AABBCDDEFFF DEEBAABCDFF ABCDDBBDEFF DEEFFEDCBAA FFEEDCBAABB AABBCCCDEFF BCEDAABDEFF BDEFFFDCBAA EECBAAACEFF FFFEDCBBBAA CBBAABCDEFF AABBDEFFEED FFFECBABCCB FEFECBAABDE FFFEDCBBBAA FFEDBBAAACE AABBCDDEEFF AABBCDEEFFF
84,AABCDEEEEED AABDEFFFECB FFEEDDCBBAA CBAAABCEFFF DEEEEEDCBAA FFEEDCCBAAA AAABCCDEEFF AABCDDEEEEF AABBBCCDEFF AABBCDEEFFF FFFEDCCBBAA ECCAAABEFFF FFFEEDCBAAA FFECBBBBBCD FFEEDDDCBAA FFEDCBBAABC AABBCDDEEFF AAABCDEFFFE FFEDBAAABDE AABBCCDEFFF FFFEDBBBBAA
85,CEEFFEDCBAA FFEDDDDCBAA FFEDDDCBAAA AABBCDDEEFF AACEFFEEDBA FFEDCCCBBBA ABFEECEECAD EDCBAAABEFF AAACDDDFFEE EEDEFEDDBAA EDCBAAACEFF AABBCCDEEFF FFDDDDCBBAA FFDBAABBCDD DEEEEEECAAA ABBCCABDEFF FFFEDCCBBAA FFFEDCBAAAB AABBCBCDFFF AACEDCBCDFF AABDDBDEEFF
86,AABBBDEFFEF FFFEDBABABD AABBCEFFEED FFFEECBBAAA ADEFFEDCBAA DDBAAACFFEF FFEEDDCBBAA BBAABCDEFFF AAABCDEEFFF FFEEDCCBBAA DCAABCCDEFF AABCDEFFFDB AABCDDDEEFF FFDBAABCDEF AAABBCEEEFF FFFEDDCBBAA AABBCDEEEFF FFFEDDCBBAA BBAABCDEEFF FFEEDCBCBAA FDBAABDDDEF
87,FFFEDDCBAAA DCBBABDDEFF AABCDDDEEFF DEFFFECAAAB BBCCCEFFEBA AAACDEEEEEE AABCCEFFECB FFEDCAAABCE AACEFFFEDCA FFEDCBAABBC AABABCDEFFF FEEDBAAACEF BCEFFEDBABA FFFDBAABBCD AABCDEFFEDC FFFECBBBBBA CBAAACDEFFF FEEEEEDBAAA ADFFEEDCCBA FFFEEDCBAAA AABBCCDEEFF
88,BBBBBBCEFFF FFEEDDCBAAA AAABCCDEFFF FFEEEDCBBAA FFEEDCCBAAA AAABCCDEFFF FFEDCCCBBAA BBBBBBCDEFF AAABCDEEEEF BBAABBCDFFF BBBBBBBDEFF BDFFFEDCBAA FFFEDCBBBAA FFFEDBBBBAA BBBBBBBCDFF EEEFEECBAAA BBAABCDEFFF AAABCDEFFEE FFECBAABBCD AABBCDEEFFF FFDBAABCCDD
89,AABBCCCDFFF FEDDEEDDBAA FFEEDCCBAAA AABCCDDEEFF AABBCDDEEFF DDEFFEDBBAA FFEEDDCBAAA BAAABCDEFFF FFEDCBCCCBA AAABBCDEFFF AACEFFEDCCB AABBCCDEEFF AABBCDDEFFF FFEEDDCBBAA FFFEDCCBBAA BBAABCDEFFF FFEEDCCBBAA FFEEDCBBAAA AABBBCDEFFF AABBCDEEEFF CDEEEEEEDAA
90,CDDEEFEDCAA FFEEDDCBBAA AAABBCDEFFF CEEFFEDCAAA AAABBCDEFFF ABDFEDBBCEF AAABCDEFFFE FFEEDDCBBAA FFDCBAABCDF AAABCEEFEEE AABBCCDEEFF FFEEEDCBAAA FFEEDCCBBAA CBAABBCDEFF AABBCCDEEFF FFEEDCCBBAA DEFFEEDCBAA BBAABCEFFFE FFFEDCCBBAA AAAABCDEFFF AABBCDEEFFF
91,FFEDDDDCBAA AABBCDDEEFF AABCBBCEFFF FFEEDCCBBAA ECBAABCDEFF AABBDEEDEFF FFFEDCCBAAA AAABCDDEEFF BBAAABDEFFF FFEEEDCBBAA AAABBCDEFFF FFEDDEDCBAA FFEEDCCBAAA AAABCCDEFFF ABDFFEDCCBA FFEDCCBBBBB AAABBCDEFFF AABCDCDEEFF AABCDEEEEEE FFFEDDCBBAA FFEEDDCBBAA
92,FFFEEDCBAAA FFEDBAABBCD AAABCDEEEFF FDBAABCDDFF DEEEFFDCAAA AABBBCDEEFF FFEEDDCBAAA AABEFECBCEF AAABCCEEEFF CCDEFFECBAA FFECBAABCDE AABCEDEDFEE FEDBAABCEFF AAABCDEFFEE FFFEEDCBBAA AABCCEFFEED FFEEDCBBAAB ABEFEEDDDBA BAAACFFEEEE FFFEEDCBBAA AAABBCDEFFF
93,AABBBCCDFFE DFDBCEFECAA EFEDCBAABDF FFFEDCCBBAA FFEDCBBAABD AAABCCDEFFF AABBCCDEFFF FFEEEDCBBAA FFEEDCCBBAA AABCCCCDEFF AAABBDEEEFF DEEDBAABDEF AABCDEFEDDE AABCCCDEFFF FFEEDCBBBAA FECBAABBDEF AABDEDBCEFF AACEFFEDCBB FFEECAABCBB FFFEDCBBAAB AABBCDDEFFF
94,AABCCCCCEFF FFEEDDCBAAA FFECBAABCDE AAABCDDEEFF AFFFEDBBABD FFFEDCBAAAB AABBBCDEEFF AABCEFFFDCA AABDEEDDDEF FFFEDBBBBAA AAABBCDEFFF FFFEDCBBAAB AAABCDEEFFE BAABBDEEFFF FFEEEDCBBAA CBAABCDDEFF AAABCDEEFFF FFFEDBAAABD AAABCDEEEFE FFFEEDCBBAA ECAAABDEEFF
95,AABCCDEEEFF DCBBBACBDFF AABBCDDEFFF FFFEDDCBBAA FFEEDCCBBAA FFEDCBABBBC FFEECBAAACF AABBCDEEEFF AABBCDEEFFF AABBCDEEFFF ECCBAABDFFE EFEEEEDCBAA AABCDEEFFED FFEEEDCCBAA FFFEDCCBAAA FFEEDCBBAAA AAABCCDEEFF AABBCCDEFFF AABBCDEFFFE FFEECBAABDE AACDEFFEECA
96,FFEEEDCBAAA AABCDEEFEED FFFEDCBAAAB AABBCDDEEFF AABBCCDEEFF AABCEFFFECB FFEEDCCBBAA FFEEDDCBBAA FFEBAABBCDE AABBCDEFFED FECBAAACDFF AAABCDFFFEE AABCCDEFFFE FFFEEDCBBAA FEECBAABCEF AAABCDEEFFF AACDEFFFDCB FEDDDEDCBAA FFEDBAABBDE AABBCDEEEFF EEFFEDDCBAA
97,AABCCEEEEEE BBAABCEFFFD FFEEDCCBBAA FDCBAABCDFF AABCDEFFEDB FFEEDBBABBB AAABCDDEEFF AABBCDEEEFF AABBCCDEFFF AAABCDEEFFF FFEEDCBBAAA EEEEEEDCBAA FFEEDCBBAAA FFFEEDCBBAA EDCBAABCEFF AAABBCDEFFF BCDEFFFDCAA FFEEDCBAAAB AABBCCDEEFF AABBCDDEFFE FFECBBBBBBB
98,FFEEEDCBBAA FFEDCAABBCD AABBCCEEFFF FFFFDBAABBC AABCDEFDDEF AAAABDEEFFF FFEEDCCBAAA FFEDCBAABCD AAABCDEFFEE AABCDDDDEFF FFFEDCBBBBA FFDCDEECBAA FEEEDCAAABD AABBCCDEEFF AABCDFFFEDC FFEEDCCCBAA DCDFFFEDBAA CCBBAABDFFF FFEEEDBBBAA EDCBBBBACFF AABBCDDEFFF
99,DCCBBAACEFF ACEFFCAACEE FFEEEDCBAAA FFEDBBBBBCD AAABCDDEEFF AACEFECCDED FFEEDCCBBAA FFEECBBAABC AAABCCDEEFF CEEFFEDCBAA AABBCDEEFFF CBABEFFFDBA FFEEDCCBAAA AABBCCDEEFF AABBDEFFEED FFEDDEDCBAA FFEEDCCBAAA AAABBCDEEFF AACEEEEEDDC CBAABDEFFEE FEDBABCCBCF
100,AAABCDEEFFF ACEFFEDCBAA CBBAABCDEFF AACDEEFFDCB FFEEDCCBBAA FDCCEFFECAA AACEFECCCEF AABBCCDEEFF EEFFEDCBAAA ECAAABCDEFF AABCDEFFEDC AABBCCDEFFF FFFEDCCBAAA FFFEDCCBAAA AABBCCDEEFF AABCEFEEDDE AABBCDEEFFE FFEEDDCBAAA FFFEDCCBBAA EDCBAAACEFF AABBCDEEEFF
