,0
101,AAABCCDEEFF AAABCDEFEEE AABCCDDDEFF FEEEEDCCBAA FFDCBABBBCD FFFEDCCBAAA BBBBBBCDEFF ABAABCEFFFD FFFEDCCBAAA AAABBCDEFFF ABABCEFFFEC DCBBAABCEFF AACDEDCCDFF FFEDBBCDDBA FFDCBAABCDE DEFFEDBBBAA FFEEDCCBBAA AABBCCDEEFF ABDEFFECBAA FFFEDCCBBAA FECAAACDEEF
102,FFEEDDCBAAB AABCCDDEEFF EEFFEDCBBAA FFEDCBBAABC AABBCDEFFEE FFFEDDCBAAA AAABCCDEEFF EFFEEDCBAAA FFEDCBAABCE AACEFFEDCBA FFEDDDCBBAA AAABCDDEFFF FFEEEDCBAAA FFFEDCBBBAA AABBCCDEEFF DEFFEEDCBAA FFEDCCCBAAB AABCCEEEDEF AABBBCDEEFF FFFEDCBBAAA AADFEDECDDD
103,AAABCDDEFFF FFEDBBBABCC FFEEDCCBBAA EBBAABCDEFF ABCEFFFECAA FFEEDCBBAAA AAABBCDEEFF AAABCEFFFED EDBAAABDEFF AABCEFFECDE EFFFEDCBBAA AAAABDEFFED FFFEDCCBBAA FFEDBBAABDE AABBCDDEFFF FFEEEDCBAAA ECBAABBCEFF AABBCDDEEFF AACDFFFECBA AAABBEFFEDD DEEEEEEDBAA
104,BBBBBBCDFFF AABCDDDEEFF AABBCDDEEFF AFFCBFECAAD AABBCDEEFFF EEDDEFFCBAA FFEEDCBBBAA FEDDDEDCBBA FFFFEDCBAAA FECBAABCCDE BABCDFFFDBA FFEECCBBAAB AAABCDDEFFF AACEFFEDCBB AAABCCDEFFF AABCDFFFEDC FEFFEDCBBAA CBAABBCDEFF FFFEDCCBAAA FFEEDDCBBAA FFEDCBBBBAB
105,FFEEEDDCBAA FFEEDDCBBAA BAAACCDEEFF AAABCDDEFFF FEBAABBDFED AABDDCBDEFF CDEFFEDCBAA FFFEDCCBAAA AABBBDEEEFF BAABBDEEEFF CDEFFEDBBAA FECABCFFDBA EDDCBAABDFF AAABCDDEFFF FFEEDCCBAAA EDDFFEDCBAA EECBBAABDFF EFFEEDCCBAA FEFFEDCBBAA AAABBCDEFFF AABBCDDEFFF
106,ABBBBBDFFFF FFEDCBAABCD DEEFFEDBAAA FFEEDCCBAAA AABBCDDEFFF AABCDEFFEDC ECDFFEDCBAA CBBABBCDEFF AAABCDEFFEE BBBBBBCFFFE BBBBCCCCDFF FFEDCCCBBAA FFEDDDDDCAA FFFEDCBBAAA AABBBCDEFFD AABCDDFFFDB FFFEDCCBAAA AABBCCDEEFF AABBCEFFFDD ECBAAABDEFF CDEEFFECAAA
107,AABBBCCDEFF FFFEDDCBAAA AABBCCDEEFF FFFEDCCBBAA FFFEDCBBAAB FFEDCBBBABC AABCDDCDEFF AABBBCDEFFF EEEFFECBBAA DBAABCDEEFF ABDEFFEBAAB AABBBCDEEFF FFFEDCCBAAA FFFEDDCBAAA AAABCCDEFFF AABBDEFFEDD AABCCCDEFFE FFEEDCBBAAA FFFEDDCBAAA FEEDCAAABDF AABBDEEEEEF
108,AABCDEFFEEC FFEDCBBBBBB FFEEDCCBBAA FFEEDDDCBAA FFEDCBBBBBB AABBCDEDDFF FFFEEDCBBAA AAABBCDEEFF AAABCDDEFFF DEFFEDCBAAA AABBCCDEEFF EFFEDDDCBAA DBABDEFFDBA FFEEDCCBAAA AAABBCDEFFF FFEEDDCBBAA EDCBBABBDFF AABCCDDEEFF AAABBCDEFFF AABBCCDEFFF AAABCDEEFFE
109,FFEDEDCAABC FEDCAAADFEC FFEEDDCBAAA AABBCDDEFFF AABCDFFFEDC FFEDCBABBBB FEBAADCCBEF AABCDDEEEEF FFEEDBABCBA FEDCBAAACEF EFFFEDBBAAA AAABCDFFFED CEFEEEBBBBA FFFECBABBBB DEBABCCCDFF AABBCDDDEFF DEFFEDCBAAA FFEEDDCBBAA CCBAABCEEFF AABCDEDCDFF AABCEFFFDCC
110,DEEFFEDCBAA FEDCBAABCEF AABBCDEEFFF AABCDCCEEFF ABCDEFFEDBA FFEEDCCBBAA AAABCDDEEFF FFEDBAABCDE AABBCDDEEFF EFFFEDCBAAA FFEDCCCBBAA FFEEDDCBAAA CBBAABCDFFF AAABCDEFFEE FFEEDCCBBAA BAABBCDEEFF AABBDEEFFED FFEDBCCAACB FECDFEDDBAA FFFEEDCBBAA AABBCCDEFFF
111,FEDBAAEFEBA FFFEDCBAAAC AABBCDDEEFF DFFFDCAABBA FFEDCBBBBBC AABCDEEEEEE CBABBBCDEFF AAABCDEFFFE FFEEDDCBBAA FFEEDDDBAAA FFEEDDCBBAA AABBBCDEEFF DBABDFFFDBA FFFEDCBBBAA DCBAABCDEFF AABCCCCDEFF FFFEDCBBAAA AABBCCDEEFF BBAABCEEFFF FEEEEDCCBAA FFEDCBBBBBB
112,EDDCBAAADFF FFFEDCCBBAA FFEEEDCBBAA AAABBCDEEFF BCCEEFFDBAA FFEEDCBBAAA AAABCCDEEFF AABCEFFEDCB CBBAABCDEFF ACDFFFDCBAB AABCDEEFFEC EEFFEDCBAAA ABCDEFFECBA FFEEDCCBBAA BBAABBDEFFF ABBDEFFEDBA FFFEDCBBAAA AAABBCDEEFF AACDFEDDDDE AAABCCDEFFF EFFFCAABBCD
113,FDBBBAAEFED BBAAACDFFFF FFFEDDCBBAA AAACEFFEDDD EDBAAABDEFF AABBCDDEEFF FFFEDDCBBAA FFEEDCBAABB AAABCDEEEFF DBAABDEEEEF FFFEDDCBAAA AAABCCEEFFF AABCCCDEFFF FFEEECBAABB AABBCCDEFFF FFEEEDCBBAA AABCDDDEFFF FFEEEDCBBAA AABBCCDEEFF EFFEECCBAAA FFFECBABBBC
114,DCBBEBCEFEA BCBBDFFEDBA CBBAABCDEFF FFEEDDCBAAA FFFEDCBAAAB AABBCCDEEFF AAABCDDEFFF FFFEEDCBBAA FFEEDCCBBAA AABBCDEFFEF AABBCDEFFFD FECAABCDEEE AACDCBCDEFF AABBDEFFEDC FFEEDDCBBAA AAABCCDEFFF BCBAABCDFFF ABCEFFFECBA FFEBABCDDCA FFEEDDCBBAA AABCDEDEEFE
115,BEEEEEEDBAA FFEEDDCBBAA CBAABBCEFFF AABCDEEFFEE FFDBAABCDDC ABCCDBBCEFF BABBBCDDEFF FFEEDDCBAAA FFECBAABCDE AAABCDDEFFF BAAABCDEEFF ABDFFFEDCAA FEDDEEDCAAA FEEDBAAACEF AABBCDEFFFE FFEEDDCBBAA FFFECCCBAAB CFFEECDCBAA FFFEDCCBAAA AAABBCDEFFF AABBCDEEFFF
116,FFFEEDCCBAA AAABCDDEEFF BDEEDBAABDF AACDDEEFFDB FFEEDCBBAAA FFFEEDCBBAA FFEEDDCBAAA AABBBCDEFFF AAABCDEEEFF CDFFFEDCBAA FEDEEEDCBAA BBBBBBCDEFF ABDFFFECBBA FFEEEDCBAAA DCBAABCDEFF AABBCCDEEFF FFEEDCCBBAA ECAAABCEFFF CDEFFEDCBAA BBAABCDEFFF FFFEDBBBBBA
117,FFEEEDCBBAA ABBBBCDEFFF AAABCEEEEEF BCEFFFECBAA DDEEFEDCBAA FFEDCBBAABB AABBCCDEEFF ABCEFFEDCBA CCCEFFEDBAA FFEDCBAABCD AABDFFFEDCB FFEEEDCBAAA AAABCDDEEFF AABBCCDEFFF FFFEEDCBBAA FFEEDDCBAAA AAABBCDEFFF AABBCDDEFFF DEFFEDCBAAA FECBBAABCEF CDEFFFDBAAA
118,BBBBAADFFFE FFEEEDCBAAA AABBCCDEEFF EFFEEECBAAA FFEDBBAABCE AAABCEEFEEE AABBCDDDEFF AABBCDDEEFF ABCDFFFECBA FFEEDDCBBAA FFECCCCCBBA CCCDEFFECAA FDBAABBCDEF ABCDFFFECBA FFECBAABCDF AAABCDEEEFF FFFEDCBAAAB AABBCCDEEFF BAABCEEFFEE FFDCBCEDCAA FFFEDCBBAAA
119,FFEEDDCBAAA AAABCDDEEFF AABCDEEEEEE FDAABCDCDEF ABBCDEFFEBA CBAABCDEEFF ABCEFFFECBA FFEDBAABCDE AABBCCDEEFF FFEEDDCBBAA AAABCDEEEFF BBDEFFEECAA AAABBCDEFFF FFFEDCCBBAA AAABCDEEFFF FFEDDCBBBAA EDCBAABCEFF FFEDCBBBBBA AAACEEFEEDD FFEEEDCBBAA BBAABCDEEFF
120,DCBAAADFFED FFFEEDCBAAA AABBCDEEEEF EECBBBBBCEF AABBCDEFEEE DBAABBCDEFF BBBDFFFEDBA FFFEDDCBAAA FFEDDDCBBAA FFEDCDDCBAA AAABCCDEFFF ABBCEFFEDBA FFEEDDCBBAA AAABBCDEFFF ABABCDEFFED FFECBAAABDF AABCDDEFFED AAABCCDEFFF FFEEEDCBAAA EFFEDDCBBAA FFEDCBBBBBB
121,AABBCCEEEFF FFFEEDCCBAA CCDEFEDDCAA FFEEDCCBBAA BAABDDDEEFF AABBCCDEEFF AABBCDEFEEE FFFDDECBABA FFEEEDCBBAA FEDCBAABDEF AABCDEEEFFF DEEEEEECBAA FFEDBBAABCC AAABCDEFEFF EEDAABDFECE BBABBCDFFFC FFFEDCBBAAA AABBCCDEEFF FFEEDCBBAAA AABBCDEEEFF AAACDEEFFEE
122,AABABDEEEFF BAAABCDEEFF AABBCDEEFFF EFDBCEFECAA FEEEDDEDBAA FFEEDCBBAAB AAABCDEEEFF AABBBCDEEFF FFEEDCBBBAA AABBCDEEEFF AAABDEFFEDD FFEEEDBABCA FFFEDDCBAAA BAAABCDEFFF CDEFFEDBBAA FFFEDDCBBAA FFEDCBBAABC ACCBBBBDEFF AABBCDDEEFF AABCDEFFFEC FFEEDDCBAAA
123,EEDCBAABDFF AABBCCDEEFF FFFEDDCBBAA AABBCDDEEFF CDEEFFECBAA FECAAABCDEF ABDEFFEDCAA FEDCBAABDEF AABCEFFEDCB FFFEDCBBAAB AAABCDEEFFF FFFEDDCBBAA DBAAABDEFFE FFFEECBAACC FFEEEDCBBAA AAABBCDEEFF BCEFFFEDBAA FFEEDDCBBAA AAABBCDEFFF ABCDEEFFEBA AABCEFFEDDB
124,AABCCDEEFFE FFEEDDCBAAA FFFEDCBBBAA EAAAACEEFFE FFEEEDCCBAA FEDBAAABDEF AABBBCDEEFF AAABCCDEFFF AAABCDEEFFF EEEEEDDCBAA FFEDCCCBBAA FFFEEDCBBAA BAAABCDEFFF AABCDEEEFED FFEEDCCBBAA FFEDCBAABCD AABBCDEEFFF DCBBBABDEFF AABBCDEEFFF FFFEDBAAACE AABCDEEEEEE
125,CBCCEDBAFFC BBABDFFFECA FFFEDBAAACE EFFEEDCBBAA FFFEDCBAAAB AABBCCDEEFF AABBBCDEEFF FFFEEDCBBAA FFEEDCCBBAA FECAAABCEEF AAABCDEEEFF EFFFECAAABB AABBBCEEFFF AABBCCDDEFF FFFEDCCBBAA FFFEDCBAABB AAABCDEEFFE AABBCCDEEFF FFEDDDCBAAA FFEEDDCBBAA AAABCDDEFFF
126,FFECCBABEDB EEDDCAAACFF ABEFFEDBBBA EDCBAABCEFF FFEDCCBABBB DCCBAABCEFF ABDEFFEDCAA FFFEDCCBBAA AAABCDEEEFF DEEFFEDBAAA BBBCBBCDEFF FFEDBAABCDD AABBCCDEFFF FFEDCAABBCC AABBCDDEFFE FFEEECBBAAA AABBCDDEEFF FFFEDCCBBAA AAABCDDEFFF FFEEDCCCBAA FFEDCAAABCD
127,FFEEEDDBAAA AAABCDDEEFF FFFEDCCBAAA FFFEDCBBBAA AAABBCDEFFF AAABCDEEFFF FFEEDCCBBAA FFFEDCBAABB AAAABCDEFFF EEFFEDCBBAA BAAABCDEFFF ABDFEDBACEF DEEFFEDBAAA FFEEDCCBBAA AAABCCDEEFF BCCBABCEEFF FFFEDDCBAAA FFFEDDCBAAA DCBAABCDEFF AABBCDEEFEF DEEFEEDCBAA
128,FDCBBABFFDA FFEEEDCBAAA AABBCCDEEFF AAABCDDEFFF FFEDCCCCBAA FFFEDCBBAAA AABBCDDEFFF FFEEDCDCBAA BAABBCDEFFF AABBCDEFFFE FFEEDCCBBAA FFECBAABCDD AABCCCDEEFF FFFEDDCBBAA AABBCDDEEFF ABEFFECAABE ABBCDFFFDBA FFEEEDCBBAA FFEDBAAABDE AAABCDEFEEF FFFECABBBBB
129,AABBCDEEFFF FFEDCCBBBBA FFEDDCCBBAA FFFEDCBBAAA AAABCDEFFEE CCDEFFEDBAA FFEDCBAABBC AABBCDDEFFF AABDEFFEDBB AAABCDEEFFF AAABDEFFEED FEDDEEDCBAA DCAAABCDEFF FFEEDDCBBAA FFEDBBAABCE AABBDEFFEED FFFEDCBBAAA AAABBCDEFFF AABBCCCDEFF AABCDDEEEEF DDEEEEEDBAA
130,AAABCDEEFFF ABDEEEEEDCA FFFECBBBBBA AAABCEFEDEF FFFEDCCBBAA FFDCAAABCDE AAABCDEEFFF BCEFFEDCAAA FFEDCBAABBD AABBCDEEEFF FECBAAABDEF AAAABDEFFFE FFEDDEDCBAA DCBAABCDEFF FFFECBBBBBA FFEEDCCBBAA AAABCDDEFFF ABEFFEDBABD FFECBBBABBE AABBCDEEFFE FEEEEDCBBAA
131,AAABCEEEEFF FEEDEBAABDF EFFEEDCBBAA BBBABCDEFFF FFFEDCCBBAA FFFEEDCCAAA DCBAABCDEFF AABBCDDEFFF FFEEDCCBBAA DBABBBBDEFF AAABCDEFFDB DBAABBCDEFF BDFFCAABDEF DEFFEDCBAAA FFFDCBBBABB AABBCCDEFFF AABBCDEEEFF FFFEDCCBBAA FEEEEDCBBAA FEECBAAACEF AABCDDDDEFF
132,DCDDEFFBABA BBBBBBCEEFF FFEDDDDCBAA FFECBAACDCC FFEEEDCBBAA AAABCCDEEFF CDEFFEDCBAA FFFEDCBAAAB AABDEECCDEF AABCDEEEEEE FFECAAABCDE AABBBCDEFFF FFEDCBABBCC AABBCDEEFEF EEFFEDCBBAA FDBAAACDFEF ABBDFFFDDBA FEDDCAAACEF AAABCDEFFEE FFEEDCBBBAA FFDCAAABCEE
133,EDEEEEEDBAA FFFEEDCBAAA FFEEDDCBBAA BBAABCDEFFF AABCDEFFEDC FFEBBCBBBBD EDCBBAABDFF AACCCDEDEFE FEDCEEDCBAA BAABBCDEFFF AAABCDDEFFF FFEEDDCBBAA FFEDCBBBBBB AABBCDEEEFF EFFEEECAAAA AABBBDEEEFF AABBCDDDEFF EEFFEDCBBAA FFECBAABCDE AABBCDEFEEF AABCDDCDEFF
134,FFEEDDCBBAA FFECBAABCCD AABCDCCDEFF DEEFFECCAAA AABCCCDEEFF EBAAABCDEFF AABBCDEFFED FFFEDDCBAAA FFEDBAAABDE AABBCDEEFFF BAAABCDEFFF CDFFFEDCBAA EEFFEDDBAAA FFECBAABBDF AABBCCDEFFF CEFFEDCBBAA FECEFEDCBAA DDCBAABDEFF FFFECDCBAAA FFEEDCCBAAA AAABCDDEEFF
135,AABBBCDEEFF AABCDDDEEFF BBBBBBCDEFF BCEFFFCAABC FFEDDCCBBAA FFFEDCBBAAA FFFEDCBAAAB BDEEEEEDBAA FECAAABCDEF ABCDEEFFDCA FFEDCBAABBD AABBCCDEEFF AABBCDEEEFF BBAABCDEFFF CCDDEFFEBAA FFFEDDCBBAA FFEEDCCBBAA ECAAABCDEFF FFFEDDCBAAA FFEEDDCBBAA FECCCDEECAA
136,FFEEEDCBBAA FFEDBAAABCE AABBDDDDEFF AACEEDEEFDA AAABCCDEEFF ABBCDEFFEBA FFFDDCCAAAB AABBBCDEFFF EFFFEDCBAAA BAABBDEEEFF DEFFECDBAAA CCBAABCEFFF ABDFFFDCBAA FFEEDCBAAAC AABBCDFFEEE FFFEDDCBBAA EDCBAAACEFF EFFEDDCBAAA FFEDCDCBAAA FFEDCCBAACE AABBCCDEEFF
137,BBBBBBBCDFF FFEEEDCBBAA AAABBCDEEFF FFFEDCCBAAA FFEEDCCBBAA AABBCCDEFFF AAABCDEFFFE FFEEDDCBBAA FFEDCBAABCD AAABCDDEEFF EFFEEDCBBAA AAABBCDEEFF CEECAABCEFF CDEFFEDCBAA FFFEDCCBAAA AABBBCDEFFF AAABCDEEEFF EFFEEDCCBAA FFFEEDCBAAA EDCBAABCEFF AABBCDEEEFF
138,BBBBBBCDEFF AABBCDEEEFF AABBBCEFFDD AACDEEDEEFB FFFECCBBBBB CCCBCDEFFCA FFEEDCCBAAA AABBBCDEFFF AABBCDFFFEC FFFEDCBBAAB AAABCCDEEFF AABDFFEEDCD AABCDDEEFFE FFFEEDCBAAA AABBDEFFEDB FFEEDDCBBAA EDBAAABCEFF AABBCDEFFFE FEDCDEECBAA FFEDCBBBBBB AAABCDEEFFF
139,FFFEDCABCBA CBAAACDDEFF AABCDDDCEFF AAABCDDEFFE FFEEDCCBBAA FEEEFEDBBAA FFECBBAABCE AABBCDDEEFF DEFFEEDBBAA FFEDDBABCBA FEDCBAABDEF FEEFEDCBAAA FEDCBBAACEF AAABCDDEFFF AABBCDEFFFE FFEEDDCBBAA FFEEDCBBBAA AAABCDEEFFF AABCCEFFEDB AABCCCDEFFF BACDFFBBCCA
140,FFEDCDDBAAB EEDBAAACEFF FFFEDCCBBAA BBABBBCEFFF AABBCCDEEFF FFFEDCBBBAA EDBAAAEFEEE CCDCBAABDFF FFFEDCBBBAA EDDFFEECBAA EBEFEAACDCE AAABCDEFEEF ACDBABDDEFF FFFEDCBAABB AAABDEFFFCB AAABCDDDEFF EEFFEDCBAAA FFEEDDCBBAA DBAAACDEEFF ABCEFFFDCBB ABABCEEDEFF
141,FFEEEDCBBAA FFFEDCBAABC AABCDDCDEFF AABDEFFFDCA ADEFBABBDFE AAABCEFFEEF DEFFFECBBAA FFFEDCBAABB ABBBBCDEEFF CCBAABDEFFF AABCDFFFECB FFFEDDCBAAA EFFEEDCBAAA AABBCDEEEFF AABCEFFFECB FEFEDCBAAAC FFDBBBBABDF ADFFFDDBABA FEDEEDDCBAA EDDBBBABCEF AABBCDDEFFF
142,ACEEDEFEDBA EFFFEDCBBAA FECBAAACDEF AABBCDEEEFF ACEFFEDCBBA FFEDCBBCCBA FFEEDCBAABB DEFFEDCBBAA FFEDCBAABCD AAABCCDEFFF AAABCDDEFFF FFEEDDCBBAA FFEDCBAABCD AABCDEFFEDB CBAABBCDEFF AABBDEFEEEE AABCCDDEEFF FFEEDCCBBAA FFFEDCCBAAA AABBCDEEEFF CEFFEBABCBA
143,AAABBDDEFFF FFFEDDCBBAA FEDCCDDDBAA FFFEDCCBBAA FFEDCBABBBC AAABCDDDEFF DEFFEDCBBAA FEDBAAABCEF AABCDDDDEFF FFFEDDCBAAA AAABCDDEEFF AAABCEFFEED FFFECBAAABC FFFEDCBBBAA FFEECBBAABB AABDFFFECBA FFFEDCBBAAA AAABBCDEEFF AAABDDDDEFF AAABCDEEEFF BCDEFFEDCAA
144,AABDEFFFEDB EDCBAABDEFF ABDEFFEDBAA FFEEDCCBBAA ECBBAABDEFF AABCDEFEEED EEFFEECBAAA AAABCDEEEFF AAABBCEEFFF AAABCDEFFED FFFEDCBBBAA FFEEDCCBBAA FFFEDBBBBBA FFFEDCBBAAA AABBCCDEFFF AAABCEEFFEE EEFFEECBAAA FDCAAABCDFF AABBCDEEFFF FFEDCBAABCD ABDEFFFDBBB
145,EEEEEEDCBAA FEEEEDCBBBA FEBBAABCEEE FFEEDDCBAAA AABBBCDEFFF BAABDEFFEDB FFFEDCBBAAB AABBCDDEFFF BCEFFEDCBAA AAABCDEEFFF BBCEFFFECAA FFFEDDCBAAA ABCEEFFEDBA FFFEDDCBBAA DCBBAABDEFF AABDEFFEDBA FFFEEDBBAAA AAABBCDEFFF ADEBAAEEEEF AAABCEEEEFF BAABBCDEFFF
146,AACCDFFEEDB BBBABBDEEFF FFFEDCBBBBA FFEEDCCBBAA BBAABCDEFFF AABCDEFFEDC FFEDCBBBBBC AAABCDDEEFF DCBAABCDEFF AABCDCCDEFF DEFFEDCBAAA AABCEEFFEDC FFEEEDCBBAA EDBBABBBDFF FFEEDCCBAAA BBBBBBCDEFF AABCEFFFDCB FFEDCBAABBC AABBCCDEFFF EFFFECBAAAB AABDEFFFCBC
147,DDDEEFEDBAA FFEDCBAABCC EFFFEDCBAAA FFFEDDCBAAA FDBBAABCEFF AAABBCDEFFF FFFEDDCBAAA BBBABBCDEFF AAABCCDEEFF BCDBAABDEFF FFEEDCBBBAA AABCEFFEDCB FFFEDCCBBAA FEDBAAABCEF AABBCDDEEFF FFEEDCCBBAA CBBABBCDEFF AABBDEEEEEE ABBBBBCDEFF FFFEDBAABBB AAABCDEEFFF
148,AABBBCDEEFF AABCDDECDEF AAACCDEEEFE BBBBBBCDEFF AABCCEEFFED FFFEDCCBBAA FECBBABCCCE FFFEEDCBBAA FEDBAABBDEE ABCCDEFFFCA FFFEDCBBAAA AAABCCDEEFF AABCCDEEEFE ABBBBBCEFFF AAABCDEEFFF FFEEDDCBBAA AABBBCDEFFF FEEEEDDCCAA FFEEDCCBBAA FFEDCDCBBAA AABCDFFFECA
149,EEEEEEDBAAA FFFFEDCBAAA FFEDCDDCBAA AABBBCDDEFF FFFEDDCBBAA BAABBCDEFFF AABCCCCDEFF FFEEDCCBAAA AAABCDEEEFF DAAABEFFDEE FDBCDFFDCAA DCBAABCDEFF FFFECBBCBAA FFEEDCCBBAA AAABCCDEFFF EFFEDCBAAAD FFEDCCBBBAA AAABBCDEEFF ADCBCBCCDFF AABCDEEEEEE FFFCAABCDDE
150,AABBCDEEFEF FFFEDCBBAAB EEEEEEDBAAA BBDFFFDBBBA FEEEEEDBAAA AAABBCDEFFF BBBBBBBDEFF AAABCCDEEFF AAABCDDEFFF FFFEEDCBBAA FFFEDCBBAAA FFEEDDBAAAC FFEDDDDCAAA FFEEDCBBAAB AAABCDEFFEE DCABEECBBCF ABBBBEFEDBF ABBCDEFFFDB FFFEEDCBAAA AABBCDEEEFF AABCDEEEEED
151,FFEDDCCBBAA FFFEDCCBAAB CCDEFFEDBAA FFEDCBBAABC AAABCDDEEFF BCFFFECBBBA FFFDCCCBBAA FFEEEDCCBAA CBBAABCDEFF AACDEFFEDCB FFFEDCCBBAA BAABBCDEEFF AABCCEEFFDD ABCBABDFFFF BCCDEFFECAA FFFEDDCBAAA FDCBAABCEFF AABBCCDEEFF BDEFFDCBAAC AABBBDEEFFF AABBDEEEFEE
152,FFEEEDDCBAA AAAABCDEFFF DEFFEDCBAAA FFEDCCBAABC AABBCDEFFFE FFFEDCBBAAA AABBBCDEEFF AABBCDDEFFF FFEEDCCBAAA AAABCDEEEFF FFFECAAABCD BCEFFEDDBAA FFEEDCCBAAA AAABBCDEFFF AABDFECCCEF CDEFFEDCBAA FEDEEEDCAAA FFFEDCBBAAB AABBCCDEEFF AABBBCDEEFF FFEEEDCBAAA
153,AAABCDEEFFF FFEEEDCBBAA EDBAABBDEFF AABBCDEEEFF AAABBCDEFFF EEEFEEDCAAA FFEDBAAABDE CDEFFEDCBAA FFEEDDCBBAA FFEEDCBAABB AAABCDEEFFF ECDFFEECBAA FEDBCCCBAAF AABBCDEEEFF AABBCDDEEFF AABCEFFEEDB FEDEEEDCBAA FFEDDDCCBAA FFFEDDCBBAA AAABCDEEFFF EEEEEEDCAAA
154,AABBCCDEEFF AABCDEEEEEE FFEEDDCBBAA FFEEDCCBBAA AAABCDDEEFF ADFFFEDCBAA DCBBABBCDFF AAABCDEEEFF AAABCCDEFFF AABCDEFFEDC FFEEDCBBBAA AAABCDEEFEE FFFEDCBBBAA FFEEDDDCBAA FFEDCBAABBC AABBBCCDFFF AABBCDDEFFF EEFEEDDCBAA AAABBCDEFFF AABBCDDEEFF FFFEDCCBBAA
155,DEFFEEDCBAA FEDCAAACDEF AABBCDDDEFF ABCBABDFFFF AABBBCDEFFE FFEEDCCBAAA AAABCDEFFEE FEDCBAABDFF AAABCCDEFFF AAABCDEFFFD FFEECCBBBAA FFFEDDCBBAA FFEEDDCBBAA AAABBCDEEFF EFFDBBAAACF AABBCCDEEFF BDEFFEDBBAA FFEDDDDBAAB FFEDBCECBAA FFFEDDCBBAA AAABCDEEFFF
156,AAABBCDEFFF AEEEEEEDBBA FFEECBAAACE FFEDBAABCDE AABBCDEFEEF AAABECEFEEF FFFEDCCBBAA FFFEDCCBBAA DCBBBCDFFDA CAAABCDEFFF AABBBCDEFFF FEDCBAABCEF AABCDCDEEFF ABDEFFEDCAA FFEEDDCBAAA FFECAAABCDE EFFEEDCBBAA FFFEDCBBAAB ABEFFDBBCEE CBAABCDEEFF AABCDEEFEEE
157,FFEDDDDBAAA AAABCDDEEFF ABCEFFEDBAA AABDEEEFEDC EDDEEFEDBAA FFECBABBBCD CDEFFEDBBAA FFEECBBBBBB AAABDEFFEED FFFEDCCBBAA AAABCCDEEFF BFFECCBABCE AAABCDEEEFF AABBCDDEEFF CDEFFEDCAAA FFFEEDCCAAA FEEEDDDCBAA FFEDCBBABBC DDCDEFFECAA FEDBAAABDEF AABCDEFFEBC
158,CCAABBDEEFF FFEDBAAACEE AABCDFFFEDC FFEDCCBBABB AADEFFEDCBA FFEDEDCBBAA DEFFEDDBBAA BBAABCDEFFF ABCDFFFECBA FFEEDCBAABB ABCDDBCEEEF AABBCDEEEFF ABBBDEFFECB CBAABCDEFFF CDEEFFECBAA FDBAAACDEEF ABCDEFFEDBA FFEEDCCBBAA BAAABDEEFFF FEEEFEDBBAA AAABCDDEFFF
159,EEEEEEDCBAA FFEDCBAAADF AABCDEFFEDC FFFEEDCBBAA FEDCBAABDEF AABCCDDEEFF BBBBBBCDEFF AAABCDEEFFF AAABBCDEFFF FFEEDCBBAAA FFEEDCBBBAA FFECAAABCDE AABBCDEEFFF FFFEDCCBBAA DCBAABCDEFF AAABCDDEFFF AAABBDDEFFF FFEEDDCBBAA DCBAABCDEFF AABBCDDEEFF EEEEEEDCAAA
160,AABBBBDFFFF FFEEEDCBAAA FFECAAABCDE AABBCDDEEFF EFFEEDCBAAA FFFEDCBBBAA FFEDCBAABCE AAABBCDEFFF AABBBCDEFFF BDEEDDBAADF FFFEDCBAABB BBBBBBCDFFF FFFEDBABBBB EEEEEEDCBAA FFECBAABCCD AAABBCDEFFF BBAABCDEFFF FFFEEDCBBAA EDBAABCDEFF AABBCDDEEFF FFFDCABBBBB
161,FFEEEDCBAAA FECBAABCDEF BDEEEBAACEF BCEEDEEEDBA AAABBCDEFFF AABBCCDEFFF FFEEDCBBBAA ECBAABDEFFF AABBCDEFEEF AABBBDEFFFE FFFEDCCBBAA DEFFEDDBBAA DCBAABCDEFF AAABCDDEFFF FFEEDCBBBAA FDDFFEDBAAA FFEDCBAAACE ACFEEEFEBAA FFECBAADDDB FFEEDCBBAAA AABBCDDEEFF
162,DCCCBBABDFF EEDCFFDCCAA DEFFFECBBAA AABBCDDEEFF ABCDEFFEDBA FFEEDCCBBAA AABDEFFEDCD AAABBCDEFFF FECAAABDEEE ABBBBCDEFFF FFEDCCBAABB AAABCDDEEFF BBCDEFFECAA FFFEEDBBAAB AABBCDDDEFF EBCEEFDBDBA EDCBAABCEFF AAABCEFFEEE FFEEEDCBBAA CBAAABDDEFF EFFEEDCBAAA
163,DCCBAEFDBBF EFFEEDCBAAA AAABCCDEEFF FFEEDCCBAAA FFFEDCBAABB AABBCDDEEFF DEFFFECBBAA FFEEDDCBBAA AABCCBCDEFF AAAABDEEEFF FFFEDCCBBAA AAABCCDEEFF EECAAABCEFF ABCDFFFECAA FFEEEDCBAAA BAAABCDDEFF ABCBBBCDFFF EFFEDDCCBAA EFFEEDCBBAA FDDCAAACDFF AABCEECDEFF
164,AABCEEEDCDF DEEFFEDBAAA AAABCCDEEFF CDEFFEDBBAA FFEEDCBAABB AAABCDEEFFF EEEEEEECBAA AAABBCEFFEE BABCEDBBDFF AABBBDDEFFF FFEEDCCBBAA FFECAABBCDE AAABCDEEFFE AAABCDDEFFF DEFFEDCBAAA FFEDCBABCBA FFEDDCCBBAA AABBCCDEEFF AABDFFFEDCB FFEEECBBABA FFEEDDCCBAA
165,FEDCDCBBAAF FFEEEEDBAAA AABBCDDEEFF AABCDEFFEDC FFEEDDCBBAA EFFEEDCBAAA AABABCDFFFF FFEEDCBBAAB FFEEDDCBAAB AABBCDDEEFF AAABCEEFFEE FFEEDDCBBAA FFEDBABBBCC AABBCCDDFFF DEEFFEDBAAA AABCCBCEFFF AABBCDDEFFF DEFFEDCBBAA FFEEDCCBAAA AABCDCDEEFF FFCAACCDECB
166,FEDDDDEDBAA DEFFEDCBBAA EDBAAABDEFF AABBCDDEEFF FFFEDCCBBAA FFFEDCCBAAA BBAABBCDEFF DEFFEDCBAAA FFEEDDCBBAA BAABCDEEFFF CDDCAAACEFF AABBBCDEFFF DEFFFDCBBAA FFFEDCCBAAA AABBBCDEEFF AAABCDEFFEC AABBCDDEEFF FFEEDDCBBAA FFFEDCCBBAA AAABCDDEEFF ACDBACEFFEE
167,BBCCBABDFFE FFFEDCBAAAC AABBCDDEFFF AABBCDDEFFF FFEDBAAABDF FFEEDCCBAAA AABBBCDEFFF FFEEEDCAAAB FFFEDCCBAAA FFFEDCCBAAA AAABCDEFFEE CBAACFFFBBE AABCDEEDDEF ABBCDFFFDCA FFFEDCBBAAA AABBBCDEFFF CDEFFFDBAAA AABCDFFFDCB FFFEDCCBBAA FEDCBAABDFF BBDEFFFDBAB
168,AABBBBCEFFF ABCEEEDCBCF AABBCDDEFFF DCDFFEBAABB AABBCCDEEFF BCDEFFECBAA FFFDCBBBBBA FFFEEDCBAAA CCDEEEFFCAA FFFEEDCBAAA BAABBCDEEFF AAABBCEFFFE FFFECBAAABC AABBCDDEFFF DEFFEDCBAAA AAABCDEEEFF FFEDCBBBCBA FFEEDCBBAAB BDEFFECBBBA FFEEDCCBBAA AAAABCEEFFF
169,ACDEEEEBCEA EEFFECBBBAA FEDDEEDCBAA FFEEDCCBBAA BBBABBCDEFF AABBCCDEEFF AABBCDEFFEE FEFEDDECAAA FFFEDCCBBAA FEDBAAACDEF AAABCDEEFFF FFFEEDCBAAA FFDCBAABCDE AABCCDCCEFF BAABCEFEDEF BBABBCCDEFF FFFEDCCBAAA FFECAABACDF AABBCEFFEDE AABBCEEDEFF BAAACDEEEFF
170,DDEEEEECAAA FFFEDCCBAAA EEDEEEFDBAA FFFEDBBBABB AAABCDEFEEF FFFEDDCBAAA BAABBCDEEFF AABBCDEFFFE FFEDCBAABBD AABCDEFEEEE EEFFEDCAAAB FFFEDCBBAAA ABCEFFFECBB FFEEDCCBAAA AAABCDEEFFE FFEEDCBBAAA AAABCDEEFFF FEEEDBAAABD AABDEFEDEDD AAABDEEEEEF BBBBBBCEFFF
171,AABBEEEECDF EFFEEDCBBAA AAABCCDEFFF ABDEFFEDCBA FEDDDDEDBAA FFFEDCBAAAB AABBCCDEEFF FFFEDDCBAAA FFEDCCCBBAA AABBCDDEEFF AABBCCDEEFF FFFEEDCBBAA FFEEDCCBBAA AAABCCDEEFF AAABCDEEFFE FECBAABCDEF AABDEFECDEE AABCEFFFDCA FFEEDCCBBAA AAABCDDEFFF BEFFDBBCCCA
172,FEDDECAECAA AAAACDEFFFE FFEEDDCBAAA DFFEEDDCBAA FFFECBAAABD AABBCCDEEFF AAABCDEEFFE FFEEDDCBBAA FFEEDCBBAAB AABCDDEFFEE CCCDDEFFDAA AABBCDDEEFF FFECBAABCDE AABCCDEFFED DBAABCDDEFF FFFEDDCBBAA AAABCDEEEFF CEEFEEDCCAA BAABCCDEEFF EFFFEDCBBAA FFFECBAABBB
173,EDCBAABDEFF ABCDEFFEDBA BAABBCDEFFF BCCDFFFDBAA FFFEDCBAABB AABBBCDEFFF FFEEDDCBAAA AABBBCDEFFF CDEFFECCBAA FEEECBAABDE AACEFFEDCBB FFEEEDCBBAA AAABCDEEFFF FFFEDCCCBAA CCDFFEDCBAA FFFEDBABABC AABBCDDEEFF BDEFFEDCBAA FFFEDCBAABB AABCEEFFEDC ABCCDFFFECA
174,BCDEEEEEDBA BBAABBDEFFF FFEEDDCBBAA BABBBCDEEFF AABBBCDEEFF EEFFEDCCBAA FFEEDCCBBAA AAABCEFFFED ECBAABCCEFF AABDEDEEEEE AABCDEFFFDB FFEEEDCBAAA BAAABDEEEFF AABDDDEEEEE AABBCCDEEFF BDFFFEDCBAA FFEDDDCCBAA FFFEECBAAAB AAABBCDEFFF AABEFEEEEDC FFEEEDCBBAA
175,AAABBDFFFFE DCBBAABDEFF FFEEDDCBBAA FFEDCBBAABC AABCDEFFEDC FFFEDCBBBAA AAABCCDEFFF BBEFDCBBBCE AAABBCEEFFF DEEEEEECAAC ABCDFFFECBA FEDDDDDCBAA FFFDCBBABBC DDDEFFEDBAA FFFEDCBBAAA BBBBBBCDEFF CDEFFEDCBAA EDCBAABCDFF AABBCDDEEFF FFFEDCCBAAA AAABCDEEFFF
176,BCCBBBCDDFF FFFEEDCBBAA FFDBBBBABDE AABBCDDEEFF AABCEFFEECC FFDCBCCCCBA AAABCCDEFFE FECAAABCDEE ABBBBBCEFFF FFEEDDCBBAA AABBCDDEFFF AABCDEEFFDC FFEDCBABBCD AAABDEEFFFE FFFEDCCBBAA AABBCDDEEFF EFFEEDCBBAA FFEDBAAABDF AABBCDEFFEE FFEDDBCBBAA FFFEDCBAAAB
177,AABBCCDDEFF FFFEECBBBAA AAABCCDEFFF CBAABCDFFFD FFECBBBACCB ECEFFEDCBAA FFEEDCBAABD AABBCDEEFFF FFFEEDCBBAA EBAABCDEEFF EEECAABCDEF AABBCDEDEFF BDDEEFFDBAA FFEEDCCBBAA FFEDCBAABCD FFFEDCBBAAB AAABCDDEEFF AAABCCDEEFF FFEDDCBAABB AABCDDDEEFF AABDEEEFEDD
178,AABBDEFFFEC EDBAAABDEFF AACEFFFEDCA FFEEDCCBBAA DCBAABBDEFF BDEEEEECCAA FFEEEDDCAAA AAABCDEEFFF AABBDFEEFFD AAABCDEFEEF FFFEDCBBAAA FFEEDDCBBAA AABCDDDEEEF EFFEDCBBAAA EFFEECBBAAA BBCBBBBCEFF AAACDEFFEEC FFFEDCBAAAB AABBCDDEEFF AABBCDEEEEF FFFEDCBBBAA
179,AABDEEEEEED FFFEDCCBAAA FFFEDDCBAAA FFFEEDCBBAA FFEDCBABBBC AABBCCDEEFF AABBBCDEEFF AABBCDDEFFF FFFEDDCBAAA FFFEDBAABBB FFEEECBBBAA AAABCDEEFFE FFFEDCBBBAA FFFEDDCBAAA AABBCDDEFFF AABBCDEEFFF FFEEEDCCBAA BBAABBCEFFF AABCCCDEFFF EEEFECABABE AABCDEEEFED
180,FFEEEDCBAAA AABBCDEEEFF ABCCBBCDEFF FFEEDCCBBAA AAABCCDEFFF AABDEFFECBA AAABCEEDEFF FFEEEEDBAAA DEFFFDCCBAA FEDBAABBDEF DEFFEDCBAAA FFFEDCCBAAA AAABCDEEFFE FFFEDBBBBAA AAABCDDEEFF FDBEDBAABDF AABCDEEFEEE AAABCCDEFFF FFFEEDCBAAA FEEEEDCBBAA FFEEDCCBAAA
181,ADFFEEECBAA DCBBAABDEFF AAACCDDEEFF AABCCCEEEFF FFFEDCCBBAA FFEEDCBBAAA FEEEFECAAAC AABBCDEEEFF ACEFECBABDF AABBCCDEFFF BCDFFFECBAA FFEEECCCBAA FDBBDEFECAA FFEEDDCBBAA DCBBAACDEFF FDBAABBCDFF AABBCDDEFFF AABEFFEDDCC FEFEDCCCBAA FFFEDCBBAAB AABBCDEEFFE
182,FFFEEDBBAAA AABBCDDEEFF BBCDFFFECAA FFEEDCBBAAB AABBCDEEEFF FFFEDCBAABB AABBCDEEEFF FEDCDFECBAA FFDBAABBCEF FFFEDCBBBBA FFEEDCCBBAA BAABBCDEEFF BEFFEDBAAAD FFEEDCBBBAA AAABBCDEEFF AACEDDDDDEF AAABBDEEFFF AAABCDEEFFE FFEBEDBAABC FFEEDDDCBAA FFEEDCCBBAA
183,BCDEFFEECAA FFEDBABCCCB FFDDDCCBAAB FFFEDCBAAAB AAABCDEFFED FECBAABCDEF ABBDEFFECBA BAABBCDEFFF AABDEFFECBC AABCDEEFFEC FFEEDCBBBAA BDEFFEDDBAA FFEDCCBAABB AAABCDEEFFF FFEDCDDCBAA FFEDCBAABBD AABBCDEFFEE FEDCBAAABDF AABCCCDDDFF AABBCDDEEFF FFFEEDBAAAA
184,CCCBAABDFFF FFFEEDBBAAA AAABCDDEEFF ABDDEFFECBA FFECBCDDCBA FEDCBAABCDE BEFFFDCCCAA EFFEEDCBBAA AABBDDDDEFF AAABBCDEFFF ABCDFFFECBA FFEEDDCBBAA AAABCCEFFFF AABBCCCDEFF FFFEDCBBAAB FFFEDCBAAAC AABBCDDEEFF BAAABCDEFFF FFFEECBBBAA BAABBCDEEFF FEEFEBAABCC
185,FFEEEDDBBAA FFEDBAABBCD AABCBCEEFFE DEEEEEECBAA AAABCDDEFFF DBAABCDEEFF DEFFEECBBAA FFFEDCBBAAB AABCDCCDEFF AABCDDDEEFF AABBBCDEFFF FFFDDCCBBAA FECDEFECBAA FFEDDDCBAAA AABBCCDEFFF FFFEDCCBAAA FFFEECBBBAA AAABDEEEEEF FFEDCDEDBAA FFEDDCBBAAE AABBCDDEEFF
186,BAAAADEEFFF AAADFFFEDCB EDCBAABCEFF AABBCDDEEFF FFFEDCCBBAA FFEEDCCBAAA AABCCDDEEFF ABCDDDEFFBA AABBBDDEFFF AABCBCDEFFE FFEEDDCBBAA AABBBCDEEFF AACDEFFEDBA FFFECCAAABD AAABCCDEEFF FFEEEDBBBAA AAABCDEEEFF EFFEDDBABBA FEFFDCBAABD DEFFEDCBBAA FFFEDDCBAAA
187,AABBDEEFFEE FEDBAAACDEF AABCDDEFFED FFFEDCCBBAA FFFEDCBAAAB AABBCDDEFFF ADFFEEEDBAA FFEEDCBAABC ACEEFFEDCBA CBBAABCEFFF AABBCCDEFFF FFEEEDCBBAA FFEDCBBBABB AABBBCEFFFF FFFEDDCBBAA BAABBCDDEFF AABBCDEEFFF EEEEEDDCBAA BBAABCDEFFF AABCDDEEEEE DBBCEFFFEBA
188,FFFEEDCBBAA FECAAABDEEE BCDEFFFDBAA AABBCDDEFFF FDBBABBCEFF ABDEFFFEBAA DBBAABCEFFF CDEFFEDCBAA FFEEDCCCAAA AABCCDEEEEF EEFFEDCCBAA AAABCCDEEFF EFFEDDCBBAA FECCBAABDEF AABDFFFEDCC FFEEDCCBAAB AAABCDEFFEE FFEEEDCBBAA AADEFFEDDCB FFEEEDCBBAA AABBCCDEEFF
189,FFFEEDCBAAA DCBAAACDEFF ABBBBCDEFFF FCBAABCDEFF CDEEEEECBAA AABBCDEEEEF FFFEDDCBAAA AABBCDEEFFE EEFFEDCBAAA FFFDBAABBCC AABBCCDEFFF EEFEEEDBBAA BAAABCDEEFF AABCEFFEDDC FFEDCBAAABD AABDFFEEECC FFEEDDCBBAA AAABDFFEEED FEDCBAAACEF FFEEDDCCBAA BBAABCDEFFF
190,AAABBDFEEEF EFFEEEDBBAA ABCDFFFDCBA EDDCBAABDFF AABBCCDEFFF AABCDEEFFEC FFEEDCCBBAA FFDBAAACDEE AAABCDEEEEF AAABDDEFFEC FFEEDCBAAAB AABBCDDEFFF BAAABCDEEFF FFFEDDCBBAA FFEEDCBAABB AABBCCDEFFF BCBAABDEFFF DEFFEDCBBAA FFEEEDCBBAA FFEEDCBAABB AABBCDEEFFF
191,AAABCDEEEFF AAABBCDEFFF FFFEEDCBAAA AAABCDEEFFF AABBBCDEFFF DCBAABBDEFF AABBCDDEFFF FFEEEDCBAAA FFDCCDDCBAA FFFEDBBABBB DECCCCAABEF DDEEEEEDBAA FFEDDCBAAAB AABBCCDEEFF AACEFFEEDCB AABBCCDEEFF ACEFFEEDBAA BBAABBDEFFF FFFEDDCBAAA FFEEDCBBAAA AABCDEFFEDB
192,AAABCCDEFFF AABDEEFFECB FFEEDDCBBAA FFEDCBBABBB AABBBCDEFFF CDECBAABDFF AABCCCDEEFF AACDEFFEDBA FFEEDCBBBAA EEDDBAABDFF FFEDDDBAABA BBBABBDEEFF AABCDEDEEFE FFEEDCCBBAA FFEEDCCBAAA BBBBBBCDEFF AABBDDDDEFF BBABBBCEFFF FFFDCDCCAAA FFFEDCBAABB FFFEECBBBAA
193,BAABCFFEEDB AACEFFEEDCB FFFEDCBBAAB AAABCDDEFFF FFEDDCBBBBA FFECBBCBABD AABDEFFEDCB FFECBABCDCB AABBDEDEEFF BBCDEFFFDBA FFEDCBBAABC AABBCCDEEFF FFECBAABCDE BCDEEFFDCAA FFEEEDCBBAA FFECBAABCCE AABBCDDEFFF BBAABCDEFFF EFFEDCBBBAA EDBCDFFECAA AAABDEEDEEF
194,FFEEDCBBBAA FFEEDECBAAA FFDBAABCCEF ABDEFFEDBAA FFFEDCBAAAB AABBCCDEEFF AABDEFFEDCC DCEDEFECAAB FFFEDDCBBAA AAABCCDEFFF ABCEFFFECBA FFFEDDCBAAA AABBDDEEFEF AACDEABDEFE ABCABCCDEFF FFFEDDCBAAA FFEDCBAABCD AABBCCDEEFF FFEDCBAABCD AABBBDDEFFF AACBDEFDEEE
195,FFEEDEDBABA BBAABCDEFFF FFFEDDCBBAA BBAABCEEFFE FFFEDCCBAAB EFFEDDCBAAA EECBAAABDFF AAABCDDEFFF FFEEDCCBBAA EBAAACDEEFE AABBCDDDEFF FFEECBAABBC AAABCDDEEFF FFEECBAABBC AAABCCDEEFF FFFEDCBBAAB AABBCDEEEFF FFFEDDCBAAA EEDBAAACEFF ACDFFFDCBAA FFDBAABCDEE
196,FFFDCBABBBC AABCDEEDDEF BCBAACCDEFF FFDBABBCCCC AABCDEFFEEE ABBCDEFFFDA FFDDDDCBAAA FFFEDCCBBAA BABBBCCDEFF ACEFFFCAABE AABBCCDDEFF FFEEDDCBAAA EFFEDDCBAAA BBAABCDEFFF AABBCCDEEFF FFEDDDBBABA FDBBDFFDCAA ECBCFFEDBAA AAABDEEEEEE EFFFEDBBBAA FFEEDDCBAAB
197,FFEEDDCBBAA FDCAAABCDFF AABBCDEEFFD BAABBCDEEFF EEFFFECBAAA AAABCCDEFFF EFFFEDBBBAA BAAACCDEFFF AABBCDEFFEC FFEEDCBABBB AABCDFFFDCB FFEDCBAABCE AABBCDEFFEE FFEEDDCBBAA AAABCDEEFFE FFEECCDCBAA AAABCDEFFEE EEEEDCBAACF FFEEDDCBBAA FFFEDCBBAAB AABBCDDEEFF
198,DEEEEEEDBAA AAABBCDEFFF FFEEEDCCBAA FFEDCBAABCD AAABCDEEFFF FFEEDBBBBBA FFEDDCBBBAA AAABCDEEFFF AABBCBDEFFF ABDEEEDBBDF EFFEEDCBAAA FFFEEDCBAAA FFEBBBCCCBA FFFEDDCBAAA BABBBCCDEFF AABBBCDEEFF BBAAACDEFFF FFEEDDCBBAA AAABBCDEEFF AABBCDEFFEE FFECAABCCCC
199,EEEEEEDCBAA FFEEDDCBBAA AABCDEFFEDD AABCCDEEEFF FECAAABDDEF BBCCAACDFFF AABCDFFFECB FFEEEDCBAAA AAABCCDEEFF AAABCDDEFFF FFFEDCBABAA ECBABCFFEDA FFEDCBAABCD AABBCCDEFFF CDEFFEDCBAA FFEDBBCCBBA DDEECBAACEF FFFEDCCBAAA FFFEEDCBAAA AAABBCDEFFF AABBCDEEFFF
