,0
0,EBDDFCECA FFECBABBD ABCBBCEFF AABCCDEFF DEFFECBAA FFEEDCBAA AABBCDEFF EEFEEDBAA FFEDCCBAA AABCDDEFF BBABCCEFF DEFFECBAA BAABCDEFF BAACDDEFF AABCCDEFF FFEDCBBAA FFEECBBAA
1,CCCECAADF EFFEDCBAA CBABBCEFF ABBBCDEFF CCDEFFAAB FFEEDCBAA FFEDBAACB FFDCBABBD AAABDEFFD BAABCDEFF CECAACEFE FFEEDBBAA AABBCDEFF FFEDBAABC ABBCEFFDB FEDCAABCE FFDBABCCC
2,AABCDEEFF FEEEDCBAA FFEDCCBAA FFEEDCBAA ECAABCEFF ABBCCCEFF AABDEFFED AABCDEFFF DCABFECBC FFFEDCBAA FFEDCBAAA AABCDEEEF FFEEDCBAA FFEDBAABD FFEEDBAAD AABBCDEFF AABDEFFEC
3,FEDEDDCBA AABDEFEED FFDBABDCB FFEDCBAAC AABCDEEFF FFEDDCBAA ECBABBDFF BCCFFEAAC ABCBBCEFF DBAABCEFF ABDEFFDBA ECAABCEEF BBDEFFDBA ECAABDEFF EEDBAACEF BDEFEDCBA FECBABCDE
4,AABCDEEFF CCBBABDFF AABCDEEFF FFEDCBBAA FFDBBCBBB ACEECDCED AAABDEFFE AACEDCEEF FFEEDCBAA AABBCEEFF AAABCDEFF CEFFEDBAA FEDEEDBAA EECBAACEF AABDFFEDC FFECACCBA FFDBBCCBA
5,FFEECBCBA AABCDEEFF ACCBEFECC FEDEECBAA BAABCDEFF ABDFFEDBB FFEDBBCBA DCAABDFFD FFEDCAABB FEDBAABDF AABBCDEFF CDEFFECAA FFEDDCBAA DBAABCEFF AAABDEEFF FECAABCEF FFEDDBAAA
6,AACEFFEDB FFEDBAABC AABCDEEFF FFECDCBAA FFDCBAABD AABDEEEEE FFEEDCBAA AACDDDEEE AABBCEFFE FEEEEDBAA FFECCABCA AABCDEEFF AABDEFFDB FFEDCBBAA AABBCDEFF CEFFEDBAA AABDEEFED
7,FECBAACEF ABCDBCEFF BCDEFFCBA AADFCACFE AABBCDEFF FFEDCBBAA FDAAACDFF ACDDABDFF AABCEFFDC FFEDBBCBA EDBAABDEF AABCDEFFF FFEDCCBAA FFEDACCBA AABDEFEED FFECCCBBA FECBAACDF
8,AABDEEEEE EEEEECBAA FFEDCBBAA AABDFCCEF FFEDCCBAA FECBAABEF AABCCDEFF EFFDBAABC AABCDEFFE FEEEEDBAA CBAABCEFF FFEECBBAA FECBAABDF AABCDDEFF FEEFECAAA AABBCDEFF EEEEEDBAA
9,FFDCBAABE AACDEFEDC EDBAABDEF AABCDEEFF FFEDCBBAA BAABCDEFF AABCEFFDC FECBAACDE ABEDBBDEF FFEEDCBAA CAABBCEFF ABDCBBDFF DEFEDCBAA EFFEDCBAA EDBAABDEF AABCDEEFF FFEEDBBAA
10,FFEEDCBAA ABCBBDEFF AABBDEEFF FFEDBAABB AABDEFFDB DCAABCEFF DEFFECBAA AABCDEFFE FEDCAABDF AABDEFFDC FFDCAABDF BDEFEDBBA FFEDCBAAC ADFFECCBA FDCAADFEC FFEDCBBAA AABCDEEFF
11,AABCEFFEC FEEEDCBAA FFDCBBBBC ABBCBBDFF EEEEEDBAA AABBCDEFF EFFEDBAAB ABDEFFECA FFEDCBBAA AABCDEEFF FFEEDCBAA FFEDCBBAA AABBCDEFF EFFEDCBAA FFDCBAABD AABCDEEFF BDEFFDBAA
12,BBCBAFFEC AEFEDBBCA BAABDFFEE EEFEDCBAA BAABCDEFF FFFECBAAA AABCEEEEF EDEEFDCAA AABCDCEFF BAABCDEFF FFEDCCBAA FEDBAACDE AACDEFDCE ABBBCEFFE FFECBABCB FFEDCBAAA AABCCDEFF
13,EEEDDDAAD FFEEDCBAA AABCDEEFF ACEFFECBA EEFEDCBAA AAABCDEFF FFEDCCBAA FDECAABDF AABCDEEFF FFEEDCBAA AAABCEEFF FFEDBAAAB AABCDEFEE BCDEFFDBA FFEEDCBAA AABCDEEFF FFDCCDBAA
14,AABCDEEEF AABCDDEFF AACDEFEED BDFFECABA FFEDCCBAA FFDCAABCE ABCEFFEDB FFEEDCBAA FFDDCCBAA AABBCDEFF ABBBCDEFF AACDEFFEC AABBCEEFF FFEDCBBAA FFEEDCBAA FFEDCBBAA FFEEDCBAA
15,DEEEEECAA EDBAABDFF AABDFFEED FFEDCBABC AACEEEEEE AAABCDEFF FEDDDCBAA FEEEDCBAA AABBCDEFF DCBDFFDBA FFEDCBAAB AABCDEFEF EEFEDCBAA AABCDEEFF ADDFFEBAC FFEDDCBAA CAABDEEFF
16,AACDEEEDE FFEEDCBAA FDBBBBBCE CBBDEFFDA FFECBAABC AABCDEEFF CEFFEDBAA AABCDEEFF DFFEDCAAA FFEEDCBAA FFEDCBAAC AABDEEFEE FFEEDCBAA DCBBBBCFF AACCDDDFF AABCDEEFF DBBEFFEBA
17,ABEEDBACF DEFFEDBAA FFEDBBAAB AABCDDEFF EFFDBBCBA FFDCBBCBA BAABCDEFF AADEFDEDC FFECBBBBB CDFFEDCAA FFDCBBBBB AABDEEDEF EFFEDCBAA FECBAACDF AABCDEFFF DEFFDBAAA ACEFFDCCA
18,ABACFFEDB AABDEFFDB FFEDCBBAA AABCDEFFE FFEDCBBAA AABCDEEFF BBBBCDEFF AABCDDDEF FFDCBBBBB EEFEEBAAA CDEFFECAA FDBAABCEF AABCDEFFD FFECBBABB AABCDEEFF FFEDCBAAB BDFFEBBBA
19,FDCCAABEF AABCDDEFF FFEDCCBAA AABCDDEFF FFEDCBBAA BAABBDEFF FFEDDBBAA AABCCDEFF FFEDCBBAA BBBABCEFF FFDCCCBAA DCBAABDFF FFEECBAAA FFECBBBBB AABCCDEFF AABCDEFFD EDEEEEBAA
20,FEEEDCBAA FFECBABBC AABBDDEFF AABCDDEFF FFEDDCBAA EFEEDCBAA FECBAABEF AABCDEEFF AFFDCBCCB BCEFFECBA EDCBAACEF CDFFEDBAA FFFECBBAA AABBCDEFF AABCEFFEC DBAABDEFF FFEDDCBAA
21,BABDCCDFF AABBCDEFF FEECBAABC ABEEDCDEE BCEFFECBA FFFDCBAAB DEEFFDBAA FEBBBBCDE EDDEFECAA EDBAABDFF AABCCDEFF FFECBAABD AABCEFEEF FEFECBAAB FFEEDCBAA EEDCCEEBA FFCBBBBCD
22,AABDEFFED FFEDCBAAA FFEDCBBAA FCBAABDEF EFFEDCBAA AABBCDEFF CEFEBAACE AABDEFEDE FFEDCCBAA BAACEFFEB FFEDCBBAA AACEFFECB FFEDCBBAA AABCEFEEE BAABCDEFF AABCDEEFF ABDEFFECA
23,ABCCCBCFF FEEEDCCAA FFDBABBCC CDEFFECAA FEDBABBDE AABCDEEEF DFFDBAACE AABDFEDEE FFEDCBAAB FFEEDCBAA BAABCDEFF FFEDCCBAA FECBAABDF AABCDEFEF DCBABBDFF AACCCEEFF FECACEECA
24,ACDBABDFF DEFFECBAA AABCDDEFF FFEDBAABC ABCDEFFDB FFDCBABCD AABEEFEED FEEDCAABC AABCEFFED FFEDDBAAB AABDFFEED FFEDDCBAA AABDFEEEE DCBAACEFF FFEEDBBAA FDCBAACEF ADBACEEFF
25,CCDEEEECA FEEEDCBAA AABDEFEDC FFEEDCBAA AABBCDEFF AABCEFEEE FFEECBCBA EFFEDCBAA AABBCDEFF CDFFEDCAA FECBAACDE ACEFEBBDE ABBACCEFF FFEDCCBAA ACCEFFDBA AABCDEEEF BACFEEECB
26,ECABAFEEE FFEDBBAAD CFFEECCAA FFEDCBBAA AABCDEEFF BDEFEDCBA FFEDCBBAA AACDEFFDD ACEDCEFAC AAABDEEEF AABDEFFEB FFEDDCBAA AABBCEEFF AABCDDEFF FFEDCCBAA FFEECCBAA AABCCDEFF
27,AABBCDEFF AACDFEEEE EEEEECBAA CBABCDDFF ABDEEFEBA AABBCDEFF FFEDCBBAA FFEDDCBAA FFDBBABCD AABBCDEFF AABCDEFFF FFECDCBAA AACEFFDDC FFEDCBBAA AACEEEEED FFEDCCBBA FEEEECBAA
28,EDCBABCEF ABCEEFECA DBAABDFFF FFFEDCBAA AABBCDEFF FFEECBBAA CBBABCEFF FFEEDCBAA AABEFEDDD EDBCFFDBA FECBBABDF AABCCDEFF FFEDDCBAA CBAABCDFF BCEFFDAAC BCDEFFDBA EEFFDBAAB
29,BBABCCEFF ABBBCDEEF AABCDEEEF ABBBCDEFF CEFEBABFB DAABCDEFF FEEEDCBAA FFEDCBBBA EEDEFECAA FFDBBABCE AABCDDEFF FEBAABCDF AABCDEFFF DEFFDBABA ECBAACEFE FFEDDCBAA FFECBBABB
30,ABBBCDEFF FFECBBBBA FFFDCBAAA EFFEDCBAA ECBAACDFF BBDFFECBA FFECAABCD AABCDEEFF FDBAABCEF AACBCEFFE FEEEECBAA BAABCDFFE FFEEDCBAA AABCDEEFF FFEDDCBAA AAABCEEFF FFEDCBAAA
31,FFEDDBBAA FFDBABDEC FFEDDCBAA AACCCDEFF AABCCEEFF ACFFDCCBB FFEDDCBAA EECBAACEF AADEEEEEC FFECAABCD AABCDCEFF ACDABCEEF FFEEDCBAA AAABDEEFF DEFFDCBAA AABCDEEFF AADEFDECC
32,BBBCDECBF FFEDDCBAA AABCCDEFF ABDEFFDBA FFEDCBBAA CAABCDDFF AABCDEFFE FFDCAABCD AACDFFDCE BCEFFECAA BAABCEFFF ABCDEFFDC FEDEFECAA FDBAABDEF AABBCDEFF FFEDBAABC FFEDCAABB
33,BBBBCCDFF FFEDDCBAA ABCEFFEBA FFEDCBAAA AABCDEEFF AACFFEDCB FFEDDCBAA AABCCDEFF FFEDBBABC AABCDEEEF ABCEFFDBA FFEDCBBAA AABBCDEFF AABBCDEFF FFEDCCCAA FFECBAABC AABCDEEFF
34,AACDEEEED CDEFFDCAA FFEDCBBAA BAABCEEFF EDBAABDEF AAABDEEFF BBBBCCEFF EFEBAACEE FFFECBAAB AADEFFEDA FFEBAABBC FFEEDCBAA FFDBBBBBC AABCDEEFF ABCEFFEDB CBAABDEFF BDEFFECBA
35,FDCDBAADF FFEDCBAAB AABCDDEFF FFECBBCBB EFFFDBAAA EFFEDCBAA AABBCEFFF FFEDCCBAA AABCCDEFF EFFEDBBAA BCDDBABEF AABCDEEFF FFEEDBBAA AABCDEFFE AABBCEEFF FFEDDCBAA EFFEBAABC
36,BBBBBBEFF FFEEDCBAA AABCDEFFE FFEEDCBAA BBABCDEFF FEDDBAACF AACDEEEEE DDCBAADFF AABDEFEED FFECBBCBA FEDDCBCCA FFEDCBBAB AABCCDFFE FFEDCBABB AABBCEEFF FFECBAABC ABDEFFCBB
37,BAABCDFFF AAABDFFFE FFEECBBAA BBABBDEFF FFEEDCBAA AABBCDEFF EEFFECAAA AAABDEEFF FFFECCBAA AABCDEEFF AABCEFFEB FFEDCBAAB ABBBCDEFF FFEDCCBAA AABBCDEFF FFEDCBBAA FDBAABDEF
38,ECACEBBDF AABBCDEFF FFECCBBAA AABDEEEEE ACEFFEDBB DFDEEDBAA FFDBBBBBC EFFEDCBAA FFCBABBCD AABBCDEFF FFEEDCBAA AABCDDEFF AACFFDCCE ADEEFEDBA CBABDFFEB FFEDCCBAA BAABDEEEF
39,AABDEEEEE FFEDBAABC ABBCDEEFF AABBCDEFF AABCEEEEE AABCDEFFE FFEDDCBAA FFEECBBAA FFDCCCCBA EDBAABDEF AABCDEEFF FFEDCBBAA AABBCDEFF ABDFFECBE BEFFECAAB FFEDDCBAA FCCDEDCBA
40,AABCEEDDF FFEEDCBAA AAABCEFFF FDBAABDEF FFEDCBBAA AABCCDEFF FECAABCEF ABDEFFEBA ABBBCDEFF FFEECCBAA FECAABCEF AABCDDEFF AABCDFFED FFEDDCBAA FFEDCBBAA AABBCDEFF AABCDEEFF
41,ABCEEFEDA FEFEDCBAA CBEFFDCBA AAABCDEFF FFECBBBBB AACEFFECB ECBBABDFF BAABCDEFF AABCCEFFF EEEFEDBAA FFDDDBAAB FFDDCBBAA AABBCDFFF ABDFEDEEB ABBBCDEFF EEFEDCBAA AABDEEEEE
42,AABBCDEFF AACDFEFDB FFEDCBBAA FFEDDCBAA BAABCDEFF CBDEFFCBA FFEDCBAAB AABCDEEEF FFDBAABDF AABCEEEEF BDFFEDCAA EFFEDCBAA BAABCDEFF FFEDCBBAA BAABCDEFF FFEEDBBAA FCBCDFECA
43,DCBAACEFF AABCDDEFF AACDEFFEC FDDBAACEE EEEEFDBAA BAABCDEFF FFEDCCBAA EEEFECBAA DBAABDEFF AABCCDEFF DFFEDCBAA AACDFFECB FFDCBAACE AABCEFFEE FFEEDBAAA FEDCCAADC FFECBABBC
44,EEFEDCAAA AABCDEEFF FFEEDBAAA FFCBDCBAC FFFDCBAAB AABBCDEFF ACCDFFEBA FDAABCDEF BDFFBABDF BCEFFECAA FFEDCBBAA AABCDEFFF AABBDEFFE FFEDCCBAA FFDBAABCE AABCDDEFF FFEDDCBAA
45,DEEEEDCAA FFEEDCBAA AAABDEFFF DEFFEBAAB AAACDDDFF ABCEFFECA FFEDCBAAB AABDEEDEF AABBDEFFE FFECABCCA ECCAABDFF ABCDFFEDB FEECDDCAA FCAADFEDB FFEDCBBAA AABCDEEFF AABCDEEEE
46,FFEEDCBAA BBABCDEFF DEFFEBAAA BDDEEFDAA AAACDDEFF FFEDCBBAA AABCCDEFF EFFDDCAAA ABEFFDBBB FFECBAACE AACEFFEDB FDBAABCEF DFFECCBAA BEFFDBBBA ABEFFECBA FFEDCBAAC AABBCEEFF
47,FFEDCECAA EFFECBBAA AADDEEEEC EFFEDBAAA AABCDEEFF FFEEDCBAA FEBAABDEE EEEDEDDBA ABCBBDEFF AABCDDEFF FFEEDCBAA FECAABCEF ABCEFECCE AABBCDEFF FFEDDBAAB FFEDCCBAA AABCDEEFF
48,FEEEDCBAA FFEDBAABC AABDEEEEE FFDCCBAAE AABDDEEEE AAABCEFFF FEDDDCBAA FFEDCCBAA FFECBBBBB AABBCDEFF BCDEFFDBA AABBCDEFF AABDFFEDA FDBABBCEF BEFFEDCAA FEBAABDEF BDEEFEDBA
49,CBBBACEFF EDCBAABEF AACEFEEDD AABCDDEFF AAABDEFFE FFDBBBCBB FFEDDCBAA FFCBBBBCD EFFEDCBAA AAABCDEFF BDFFEDCAA AABBCDEFF BCBABCEFF FFDCDCBAA BAACEFFEC FFEEDCBAA DAAACDEFF
50,EDCAABDEF ABADFFCEC FFDABBBCD CCBABCDFF FFEDCBBAA FFEDBAABC AABCCEEFF AABCCDEFF FFEDCBBAA FFEDBAABD FFEEDCBAA EDCAABDEF AABCDFFEE FFCBBBACF FFECBAACE ABDEEEEDC FEDBAACDF
51,BBBACDFFF BBEFFECBA CBAACDEFF CDEFEDCAA FFEDBBAAB AABCDDEFF AABBCDEFF FFEDCBAAB AABCCDEFF FFEDBAABC AABCCEFFE FFEDCCBAA AABCDEFED CCBABCEFF EFEDDCBAA AAACDEFFE FFEDCBAAB
52,DCCCCFECA DFFEDCAAA CBAABDEFF AABCEFFED FFEDCBBBA BAACFFFEC ECDFEDBAA AABCDDEFF AACEFFECB FFEEDCBAA AABBCDEFF DEEFFDBAA ABBACEFEF AABBCDEFF FFEDDCBAA AABCCEEFF FEABBCBCD
53,FFEEDCBAA EDBAACEEF DDBAACDFF ABBBCDEFF FFEECBBAA FFEDBAABC AABCDEFFE AABCDEEFF FFEDBABBB FFEDCBBAA AABCCDEFF AABCDEFFE FFEDDCBAA EFFEDCBAA AACEFFECA FECBAACEF AABCDEEFF
54,AABCCBEFF FFFEDCAAA FEDCCCDBA FFECBBBBB AABCDCEFF FFEEDCBAA AABBCDEFF BCCDFFEBA AABCDEEEF EFFEDBAAA FFEEDCBAA DBAABCDFF DFFECACBA FFEDCBBAA AABCDEFFF AABBCEFFF EECAACEEE
55,ABDEFFECA FFECBAACD AABDEFEED FEDEEDCAA AAABDEEFF ABBCCCDFF AABCEFFEC FFEDCBBBA FFEDCBBBA FFDCBABBC AABDDDEFF EEFEECBAA DBAABCEFF AABCDEEFF EEDBAACEF BDEFFDCAA FFDCBCBBA
56,FFEEBBCBA EDEFEDCAA EDCBAACEF AABBCDEFF EFFECBBBA BACFFEEDB AAACEFFEE FFECBCCBA FFEDBBABC AABDEEEEF FCBDDEEDA EAABDEDDF BCCAACDFF DEEFFDBAA FFEDCBAAB AABBCEEFF AABCEDEEF
57,AABCCDEFF AABCDDEEF FFFECBBAA FFDDEDCAA FFECCBBBA FFEDBBBBB AABCCDEFF FFECBAABC AABBCDEFF BBAACDEFF FFEDBAABC FFEDCBBAA AABCDFFED FFEDCBBAA AABCDDEFF FEDCDCBAA FEDDEDCAA
58,FFECDCABA FFEDBAABC AABCDEEFF BABBBCEFF EFFEDCBAA FFEEDCBAA EFFEDCBAA FFEDCBBAA AACEFEDDE AABBCDEFF AACDFFEDD FFEEDCBAA EDBAABDEF AABCDEEFF FFFEDCBAA FEBBABBDE AACDEEEEC
59,ABDEFFEBA EEEEEDCAA EEEEDDCAA BABBBCEFF FECBAABDE CDFFEDBAA AABBCDEFF BEFCAACEF AABDFFEDB EEFEDCBAA AAABDEFFE FFEDCBBAA AACEFFDDC DCBBBBCEF AACCDEEEF AABCDEEFF AABDEFFEC
60,ABDEFDEDA BAABCDEFF FFEDCBBAA AAACEFEDD ECAAEFECB FFEEDCAAA AABBCDEFF DEFFECBAA FFEDCBAAB AABCDEFFE AABBCEEFF ECAABDEFF CDEFEDBAA AABCDDEFF EFFEDCBAA AACDEFEDC FEBABCCDE
61,FEBBAACEF ABBBCDEFF AADFFEDDD AABCCEFFD DCDEFECBA ABCDDEEEE FFEDCBBAA CDDEFFDAA FFECBBBBC AABBCDEFF FFEDCCBAA AAABCDEFF ABEDBACEF FEEEDCBAA AAABCDFFF FFEDCBBAA FDBAABCEF
62,DEEEFCAAD AABCDFFEF FFFEDCBAA DBAABCEFF AABCDFFED AAABCDEFF BDFFECABA FFEDBAABC FFEDDCBAA FECBAACEF AABCDDEFF FEDEDCBAA BBBBBDEFF AACDFFEDD AABBCDEFF EFFECDBAA FFEEDCBAA
63,FFEEDBBAA AABBCDEFF EDABDCADF AABCCEEFE BAABCDEFF DEFFECBAA ABCDFFEDB FFEDCBAAB ABEECFDEB EDCBABDFF ABCEFEECB DCBAACEFF FFEEDCBAA AABDEFEED FFEDDBAAC FFEDCBBBA AABCCDEFF
64,CDEEFEDBA FFDDCBBAA FEEEDCBAA AABBCDEFF FFEDCBBAA AABBCDEFF ACEFFDCAA AABCEFEEF FFECCCBAA CAABEFFDB FFEDCCBAA AABCDDEFF FFFEDBBAA AABCDDEFF DCBAABFFE ABDEFBADF AABDEEEEE
65,EEEEEDCAA FFEEDCBAA AABBCEFFF BCDFFECAA AABBCEEFF DEFFDCBAA DBAABDEFF BAABCEEFF FFEDCBAAB FFEDDCBAA AABCDDEFF EFFEDCBAA EEFEDCBAA ABDFFEDCB FFEECCBAA AABCDEEFF AABCDEEEF
66,AAACCDEFF AABCCCEFF EFFEDCBAA FFECBBBAB FFEDCBAAA AABCDDDFF FFEDDCBAA AAABCDEFF ABBBCEFFE CBAABDEFF ABABDFFED FEEEDCBAA BAABCEFFE FFEEDCBAA AABBCDEFF FFDCCCBAA FECDFDBAA
67,FFEEDCBAA AABCDEEEE FFEDBAACE AABCDDEFF EFFEDBBAA FFEDBAABE AABDFFEDC FFEEDCBAA BAABCEFFE FEFDABDBA AAABCDEFF EFFEDCBAA FCAABCEEF AABCCDEFF ECAABDEFF BCDEFFDBA ABCEDEEDD
68,ABCCBBCFF FFEEDCBAA BAABDEEFF FFECBBABB AABBCDEFF CDFFEDBAA FFEDCBBAA FFEDCBBAA AAABCDEFF AABCDDEEF ACEFFEDBA FFEDCCBAA EDBAABDEF CBBABCEFF AACCCDFFE FFECBAABC ABDEFFDAA
69,ECCCBBAFF BAABDEFFE FFEDCBABB CBBABCEFF AACDFFEDB FFEDDCBAA AABCDDEFF CAABDEEFF CDEFFECBA AABCDDEFF CDEFFDCAA BAABCDEFF FFEEDCBAA BAACDEEFF EDCBAACEF BDFFEDBAA FFDBAACDD
70,BBAACFEEE ABBBCDEFF ACFFEDCBC AACDDEEEF EFFEDCBAA FFEDCBBBA FEDBBABCD EFFEDCBAA AABBCDEFF AABDEFEDC FEDBAABDF ACDFFECBB AABCCDFFF FEDEECBAA CBAABDEFF FEEEDCBAA EAAACEEEF
71,FFEEDCBAA BAABCDEFF AACDEEEED EEEEDCBAA ECBAACDFF FFEDDCBAA AABBCDEFF AABCDEEFF FFEDCBBAA FFEDCBBAA AABCDEEFF FFDBAABDE AABCDDEFF FFEDDCBAA EDBAABDEF AABDEEEEE EEFEECBAA
72,CCDEECAAF EFFEDCBAA AABCDEFFE FFEEDCBAA AABBCDEFF AABDEFEED FFEDCBBAA CBAACEEEF BCEEEEDBA AABCDEFFF AABCDFFEC FFEEDBBAA AABCDEFFF ABDEFFDBA EEFEDCBAA CBAACEFFF AAACCDEFF
73,AABDEFFED BDFFECBAA EFFFDBAAA FFEDCBAAB AABCCDEFF DEFEEDBAA FFEDCCBAA AABCDEEFF FEDCFDACA DDBAACDEF AABBDEEFF FFEDCBABB CDDEFEBAA CBBBBCDFF AACFEEEDB DCAABDEFF FFDABCCBB
74,BBBBCDDEF EFEEDCBAA FFECBAACE AABCDDEFF BCDEFEDBA FFEDDCBAA AABCDEFFF ABDEFFCBD BCCEFFDBA AABCDEEFF FEDBABCDE FFFECBAAB CCEFFDCBA BAABCDEFF FFEEDCBAA AABDEFFEC FFECBBBBA
75,FFEEDBAAA AAABCDEFF AABCDEEFF BBABBDEFF CDFFECBAA ECBAABEFE FFEDCBBAA DBBAACEFF AABCDEFFE FFEDBBBAB AABBCDEFF AABBCDEFF ABCDFFDBA FFEDCBBAA DEEFEDBAA FECBBBBBB EEEEEDAAA
76,EEEEEDBAA FFECBAABC AABCCDEFF FFEDDCBAA AABBCEEFF AABCDEFFE FFEDCCBAA ECAAACEFF AABCDDEFF DFFEDBABA FFEDBAABC AABCCDEFF FEDBACECA FEDBAABDF EFFEDCBAA CBBABCEFF AABCDEEFF
77,EEEECAACE FFEEDCBAA FFEDCBAAA AABBCDEFF FFEDCCBAA AABBCDEFF ABBDFFEDB AAABCEEFF DDFFDDCAA CAAACEFFD FFEEDCBAA ECBAABDFF ABBEFFDCC FFECCBBBB AABCDEFFF AAABCDEFF FEAABCDDD
78,EEFFECAAC AABCDDEFF FFEDCCBAA BAABCDEFF BCDFFECAA AABBCEEFF EFFEDCAAA FFFEDCBAA DBAABCEFF FFEEDCBAA BBABCDEFF ABDFFDCBD FECBBABCE AABCDEEFF AABCDDEFF FFEDDCBAA FFEEDCBAA
79,FEEDBAADE FFEDCBBAA FFEDCBAAA AABCDEEEF FFEDDCBAA BBABBCEFF ACDEFEDBA AABCDEFFE ACFFFCBCA DCBABCEFF FEEEDCBAA DCBABCDFF ABDFFDBBD FFEDCBBAA AABCDDEFF BBBBBCEFF EFFEAABCD
80,AABDDFFEC FEEEDDBAA FECBBBBDB FFDBAABCE BCDDFFDBA BAABCDEFF BCDEFFCBA AABCDEFFE DFFEDCAAB FFEEDBBAA AABDEFFDC FFEDCBBAA AABBCDEFF FFDEDCBAA AABBCDEFF AEBACDEEF ACEDFEDCA
81,BBBBFFECA CBAABDEFF FFEDCBBAA FECBAABDF AABCDEFEE ECAABBDFF AACEDEEEE EDCBAACEF FEBABBCDE EEFFEBAAB FFEEDCBAA BABBCDEFF DEFFDCBAA FFEDCBAAB AABBCDEFF DFFEDBAAA AABCEEFFD
82,CDEDDBABF ABDEFFECB FFEDCBBAA AABCDEEFF AABBBDFFE AABBCDEFF ACDFFEDBA FFEDCCBAA BEEDEEEBA FEBAABDEF EEFEDDBAA AABBCDEFF AABDEDEFD DCBABCDFF AACEFFEDC EEFEECBAA FFFEDBAAA
83,DEEEEDCAA FFEEDCBAA AABBCDEFF BCEEAABEF ABCBBDEFF FFEDCCBAA BAABDEFEF ABCECADFF CEFFECABA CBBEFFCCA FFEDBAACE AABCDEFFE FFECBDDBA FCABEFDCA FFEDCBBAA AABCDEEFF AABCDEEEE
84,AACEEEDDE EEFEECBAA FFECBAABD ACEFFEDBA FFEDCBBAA AABCDEEFF ABBBCDEFF AABCDEEFF FFEDCBBAA AABEEEFEC FFEDCBBAA EFFEDCCAA FFDBAABCE AABCDEEFF EFFEDCBAA AABCDDEFF FFEDCCCAA
85,DFFEECBAA FFFEDCBAA BBAABDEFF AACDFFEDC FFDDCBBAB EDEDBFEBA AABCDEEEF FEDDEDCAA DBBABDEFF AABCEFEEE FFFEDBAAB DDEEEEDAA ABBBBCEFF FFEDDCBAA CAABCDEEF AABDEDDEF ABCBCDEFF
86,AABCEFEEE CBBBBCEFF FFEDDCBAA AACFFFDBB DBAAEFFEC FFEDCBAAB AABCCDEFF FFEDDCBAA CAABCDEFF BCEFBACEF EEFFDBAAB AABBCDEFF FFEDCBAAB AABCDEFED FEECAABDE DFFEDCBBA EBABCCEFF
87,FFEEDBBAA AABBCDEFF AABDEFFEC ABBCDFFEB AABDEEEEE DEFFDCBAA AABCDEFFF FFEDCBABB AAACEFFEC BAABCDEFF FEEECCBAA AABCDEFED FFECCCCAA AACEFEEDD DBAADFEED FFEEDCBAA AABCDDEFF
88,AABBCFFFE FFECBABCD DEFFDCBAA FFEDCBBAA AABCDEFFF FFEDCBAAB AABCDDEFF AADCCDEFF BBBBBCEFF FFEDCBBAA FFEDCCBAA FCBBBBBDF EFFEDCBAA AABCDDEFF EFFEDBAAA AABCDEEFF FEBBBCDBB
89,AABBCEFFF FFEEDCBAA FDAABCDEF AABCCDEFF EEFFDCBAA FFEDCBAAB BDFFECBAB CBABBDEFF ACFFDDBBE AABCDDEFF CEFEDCBAA FFEECBBAA AAABDEFFD FFEEDCBAA DBBABCDFF AABCDEEFF DEEEEEBAA
90,EEEEEDCAA FFEDCBABB AABCEFFEC BAABBDEFF ACDCBBDFF BCEFFECBA FFEDCBAAA AABCDEFEE AABCDEFFE FFEDDCBAA FFECBAABD AABCCDEFF FFEDCBAAB FFEECBAAB EFFEDCBAA BBBABDEFF AABCDEEEE
91,FEDDDBAAC AABBCEEFF DEFFDCBAA FECAAACDF AABCDDEFF FEDBAABDF AACDECDEF FFEDECBAA AAACEFFED FFFEDCBAA CBBABCEFF AACEFEDDC FFDCBBBBC AABCDEEFF AABBCEEFF FFEEDCBAA FFEEDCBAA
92,FFEEDCBAA CAABCDEFF BEEFEAABC CDEEFFCAA AABCCDFFE FFECBAABD AABCDDEFF ABCEFFDBA FEBAABDEF DEEEEDCAA AABBCDEFF FFEEDCBAA AACDFEEDC ECBAACEFF EEDBAACFF EEFFECBAA AABBCDEFF
93,AABBBFEEF EEFEDBCBA AAEFFEDBB FFEDCBAAB AABCDEEFF AACEFFEDB FFEDCCBAA FBABCCDEF AAACDDEFF BAABCDEFF BAABCDEFF FFFEDCBAA ECAABCEFF BBABCDEFF FFEEDCBAA FFEECBAAA AABCCEEFF
94,ABBCBDFFE FFEDCCBAA AABBCDEFF ABEFEDDDD FFECAABCD AABCDDDEF FFDBBBBBB FFFECBBAA AABBDEEFF FDBAACEEF BDFCAACEF FFEEDCBAA BAABCDFFF ABDFFEDCA AABBCDEFF FFEEDCBAA DAABCEEFF
95,AABDEEEEE AABBCDEFF DEFFECBAA FFEDCCBAA FFDBABCCC CBAABDEFF AABCDDEFF AAACDEEFF DBAABFEEF FFEDBAACE FFFECBBAA FFEDCBBAA FFEDBBBBB AABBCDEFF AABBDDEFF FEEECAABD BDEFFEDAA
96,FEEDBAABF CEFFECBAA BAABCDEFF AABCCDEFF BCEFFEDBA FFEDCCBAA FFEDCBAAB AABCDEFFE DCBABCEFF ABDECBDEF EFFEDDBAA FFDCBAACD AABCDEEEF EFFEDCBAA FFEDCBBAA AABCDEEFF EFFEDCBAA
97,ABCEEFEDC CDEFEDCAA FFEDCBAAB AABDDEFED FFEBAABCD AABCDEEFF AABBCDEFF AABBCDEFF FFEDCBBAB FFEEDBBAA EEDEEECAA FECBAABDE AABBDEEFF EFFEDCBAA BAABCDEFF AABCDEEFF FFCBBCCBA
98,FFEEDCBAA CBAABDEFF CDEEEFCAA AABCEFEEF ABBDEFFEB FFEDDCBAA AABCDDEFF AABCDEEEF FFEDCCBAA EFFEDCAAA AAABCDEFF AABCEFFED FFEDDCBAA FFEECBBAA ACFFEEDBA FEDBBBACF AABCDEEFF
99,CBBAADEFF FEABEEDCA FFEDCBBAA AABBDEEFF ADEEDEECA FFEDCCBAA BAABCDEFF ACEFFEDBA AABCEEFEE EEFEECBAA DBAABCEFF AABCDEFFE FEEEDCBAA FFECBBABC AABCDEFFE EDBAADFFE ECBABADFF
100,AABCDDEEF FFEECBBAA AABCDEEFF FFEDCBBAA FDEFFDAAA BBAABDEFF ABCDEFFCA FECAABCDE AABEFDCDF ABDEFFDBA FFEDDCBAA AABBCDEFF ABCEDCCEF ACEFFECBA FEEDECBAA FEDBAABDF AABCDEEFF
101,AABBCDEFF AADEDDDEF DDFFBCBBA FFDCBBBBB FFEDCBBAA AABBCEFEF EFFEDCBAA BAABCDEFF ABBEFFECA AAABCDEFF AADFFEBBD FFECBABBC EFFECCBAA FFDCBABCD AABCDEFFE FFFEDCBAA ECAACDEFF
102,FEDCBAADF AABCDEFFE FFEDCBBAA AABCDEFFE FFEDBAABD AABCDEFFE FFEDDCBAA AACDFFEDB FFEEDCBAA AACEFEEDC FEBDFECAA AAABCDEFF EFFEDCBAA FCCAABDEF AAABDEEFF EFFEDCBAA ABECDDCEF
103,AABCDEFFE FEDDEECAA FFECBBBBB ABCDFFECA FFEDCBBAB AABCDEEFF FFFDCBAAC AABCEFEDE FFFEDCBAA BDFFEDCBA FFEDCBBAA AABCDDEFF FFFECBBAA AABBCDEFF AABCDEFFE EBAABEFED EEEEECAAA
104,BBBBBDEFF ABBBCDEFF AABDEEEEE AABCDEEFF EEEEEDBAA FFEDCBAAA FEEDDDCAA FFCBBBBBC CCDFFECBA DCBBABDFF AABCDEFFE BAABCDEFF ABDFFEDBB FFEDCBAAA ABDFFEDBA FFEDDCBAA FFDCBBBBB
105,FFEEDCBAA FFEDBBAAB AABCDDEFF FFDBABCDC ABCBBCEFF FFEDCBBAA CBAACDDFF ACBABDFEF DEFEDCBAA DEFFECBAA AABCCDEFF FFEDCBBAA EEFEDCAAA BAABDEFFE FFEDCCBAA BBABBDEFF AABCDEEFF
106,AAABEFFED CBAABDEFF FFEECBBAA AAABDEEFF ABDEFEDBA FFEDCBBAA AABCDDEFF DBBBBBEFE BBBBBCEFF FFEEDCBAA FFEEDCBAA BABBCDEFE ABDEFFDBA FFECBABBD AABCDDEFF FECBAACEF CEFFEBABA
107,AABBCEFFF FFECBABCD ABCEFFDCB FFEEDBAAA FECBBABDE ABABCEFFF ABCDEFFDA FEBAABDEE ACEFCAACF ABCEFFEBA FFEDCCBAA BAABCDEFF AABDEDDEF BCDFFECBA FDDEEECAA FFDCBAABD AABDDEEEE
108,ABDEFEEBA FDDDEDBAA FFEEDCAAA FFECBBBBB AABCCCEFF FFEDBBABB AABCCDEFF BCEFFDBAA AABBCDEFF FFFECBAAB FFEDCCBAA BAABBDEFF FFEDCBBAA BAABCDEFF ABBBCDEFF AABCCDEFF AACDEFEED
109,FEEECACCA ECDFFDCAA CBAABDEFF AABCEFFED FFECBCCBA BBBBBCEFF BCDFFECAA FFECBAACE FFFDBAABB ABEECCEEE FEEEECBAA BCEBACCEF AABCCDEFF FFEDCBBAA FFECBAABC AABDEEDEF AADFFDCDB
110,EEFEECBAA BAABCDEFF ABDCADFEF ABBDEFFDB FFEDCBBAA AABCDFFED AABBDEEFF CDFFEDBAA FFEDCBABA FFEDCBBAA AABCCDEFF FFEDDCBAA AABBCDEFF BDFFECBAA FEFECACCA FEEEDCBAA AABCDEEFF
111,FECCFECAA DCBAACEFF ABBDFFECC FFEDBBBBB AABDEEEED AABBCDEFF EFFECBBAA FFEDDCBAA FFEEDCAAA AABCDFEEF FFEDDCBAA FECAABCEF AACBCDFFE FECBAABDF AABDDDDFF FFDDDCBAA FFDCBBBBB
112,DCBAACEFF FEEEDDBBA FFDBBBBCC ABCDFFECA FFEDCBBBB AABBCDEFF FFECBAABD AACEFFDCC AACEFFDBC FFDBAABDE FFEDCCBAA ECBAABDFF ABEFFDBBB FFDCBBABD AABCDEFFE AABBCDEFF EFEAABCDD
113,FCCBBFECA AADFFEDDC FECAABDEE FEDBAACEF AABCDEEFF FFEEDCBAA BAABCDEFF CDCAADEEF FFEDBAABC AABDDDEFF DEFFDCCAA AABCDDEFF FFEDCBAAB ABBEFFECB DCAABCEFF CEFFECBAA FFDBABBCD
114,CBBBBECEF DFFEDCBAA ACFFEDCBA FFFEDBAAA AABCDEEFF ABDFFEDCA FFEDCBBAA BAABCEFFF ABBDEFECA AABCCDEFF AABBCDEFF FFEDCCBAA AABBCEEFF AABCCDEFF FFEDDBAAB FFEDCCBAA AACDDEEEF
115,DEEEEDCAA FFEDCBAAA AACDCEEFF FFECAABCB ABCBBDEFF AABDEFFDB FFEDCBAAA AABBCDEFF BABBCDEFF FFEDCCAAA FFEDCCBAA AABCDEFFF FFEDCCAAA DCBAACFFE FFEDEDBAA BBBBBDEFF AABCDEEFF
116,FFFEDBAAB AABCDEEFE AABCDEEFF FFEDCBBAA FFEDDCBAA FFECBABBC AABBCDEFF ABDFFEDBA FEEEDCBAA AABBCEEFF FFEDCCBAA CDDBABCFF AABCDEFFE FFEDCBBAA AABCDFFED DCBAACEFF FFECBCBBA
117,FFFECBAAB AABBCDEFF AAABDEFFD FEDDEECAA FFDBAABCE AABBCDEFF FEDBABDDB FFEDBAABC ACEFFECBA FFECBAABD AABBCDEFF EEFEECBAA FFEDCBBAA AABCCDEFF AABDEFEDC FFDCBAACE DEFFDBABA
118,BBAAEFEED FEDBAABDF AACEFFEDB FFDCBBABC AABDEEEEF ABBBCDEFF AABCDEFFE FFEDDCBAA FEDDCCBAA EFFEDCBAA AABBDEFFE FFECBAABD AABCDDEFF ECBAABDEF AACDCCEFF FFECBCCBA FFEDBBBBA
119,FFEEDBBAA AABCCDEFF EEFFDAABB ABBCDFFEB BAABCDEFF EFFEDCBAA AABCDDEFF FFFEDCBAA AABCDDEFF FFEECBAAC CEFFEDBAA BAABCDEFF FFEDCCBAA AAACDFFEE CCCBABFFF FFEEDCBAA BAABCDEFF
120,DBAAFFEDC DCBAABDFF AABEFEDDD AABCDEFEF BAABBDEFF EFFECBBAA FFEDDBBBA FFEDCCBAA AABCDEFEF EFFEDCBAA EDBAABCEF AACBCEFFE EDBAABDEF ABEFCABDF ACDEFEDBA DEFFEDBAA FFDCBBBBB
121,AABBEEFFE FFEDBAABC FFEEDCBAA FDAABCDEF AABBCDEFF AADEEEEDD FEFECBBAA FEECBAACE AABDDEEEF FFEEDCBAA AABCDDEFF ACEDACFEE CCCDEFEBA FECBABCDE BDEFFDCAA AABCDEEFF AACEEFEDC
122,ABBDEEFEA AABCDDEFF ABCDFCCFE FEDDCCCBA FFECBAABC AABBCDEFF BDEFFDBAA AABCDEEFF AACEFEDDC FFDDEBCBA FEDBAABDF ABDEFEDBA FFEEDCBAA DBAABDFFE AABBCDEFF AABCDEFFE FFEEDCBAA
123,DCBAACEFF AABDEFFDB FEBAABCEE BCDEFFDBA EBAABCEFF EFEEDCBAA AABCDEFFF FFEEDCAAA AABCDFFEE FFEEDCBAA BFFEDCCBA FFEEDCBAA AABBCDEFF FFFEDCBAA FDBAABCEF AACDEEFEB ACEFFEDAA
124,AACDEFFED FFEDCBBAA FFEDBAABC EEEEDCBAA FCAAACEFF AABBCDEFF AABBCDEFF EEEEEDBAA FFEDCCBAA FFEDCBAAB AABCDEEFF FFEEDCBAA FECBAACEF AACEEEEED AABCDEEFF EEEEEBAAD AACEEEEED
125,CDDEBFEBA DFFFDBBBA AABDFFEDC FFEDCBAAB AABCDDEFF AABCEFFED FFEDCCBAA FEDBAABCD AABCDDEFF FDAABCDEF ABCBBDEFF DEFFDCBAA FFDCAABCE ABCDEDCEF ACEFFDCBA EFFEDCBAA AABCDEEFF
126,FEDCAEDAA BBABCDEFF FFEECBAAB BFFECBABB CBAABCEFF EFFEDCBAA EDBAACEFF BCEFFFCAA BBBBDEFFB CAABCDEFF DEFFDCBAA AABCDDEFF FFEDBAABC ABCDFFEDB EECBAACEF CFFEDCBAA FECAABCDF
127,FFEEDBAAB AABCEEFED FFEEECBAA CBAABDEFF AABCDEFFE FFEDCCBAA BAABCCEFF CDEFFDCAA AAABCDEFF CBAACDEFF FFEEDCBAA BAABCDEFF BBAACDEFF FFEDBCCBA FFECBAABC AABCDEFFF EFFEDCAAA
128,FDDCEFDBA FFDBAABDE AABCDDEFF FFEDCBBBA FFECBBABC ABCFFEDCB FFDBAABDF AABCDEFFE FFEDCCBAA BAABCDEFF ABDFFEDBA BAABCDEFF ACEDBACEF EEFFDCBAA FFEEDCBAA AABCDEFFF FFEBBCCBA
129,AABCDEFFE FEEEDDCAA FFEEDCBAA BABBCEFFE DEEFEDBAA CBAABCEFF AABCCDFFE BAABCDEFF AACEFFDCB FFFEDBAAA DEFFECBAA FFEDBAABC AACEFFDCC FECBBAACF AACDDEEEF AABCDEEEF EEEEEDCAA
130,AABCDEEEF EEEEEDBAA CBBABCEFF EEFEDCBAA FDBAABDEF AABCCDEFF FFEEDBBAA AABCDEEFF ECAAACEFF ACEFFECAA FFECBAABC EFFECBBBA FFEDCBAAB AABCDEEFF FDDFDCBAA AABCDEFFE EEEEDCCBA
131,AABDDEEFE CBAACEFFD FFDBBAACE ADFFECCBA FFEEDCBAA AABBCDEFF DEFFEDBAA FEBABACEF BCDEFFDBA AABCDEFFE AACDEFFDB FFEDCBAAB AABCDEFEF AABDEFFEC FFEDCCBAA FEDCBAACE AACCCDEFF
132,DDDFEBBBA AABCDFFEE FFEDCBAAB FFEEDCBAA AABCDDEFF FFEEDCBAA CAABCEFFE AABDEEEEE FDBAABDEF BCDEFECAA AABCDDEFF DDEFFDBAA DBAABDDFF EFFEDBBAA AABCCDEFF FFEDCBBAA EDBAABDFF
133,EEFEECAAA FFECCCBAA FEDBAAACE AABCEFFED FEBCBBCDB BAABCDFFF EEFECABBA DCAABCEFF AABCDFFEE FFEEDCBAA BBBABDEFF EEEEEDBAA ABBDEFFCD AABBCEFFE FFEDCBAAA AABCDEFEF AACCCEEFF
134,FFEEDCBAA CAABCDEFF AADDEFFDB BAABDDEFF CAABCDEFF DDEFEDBAA FFEEDBBAA AABCDEEFF BAABCDEFF FFEDCABBA FFEEDCAAA AABCDDEFF EFFEDCBAA FFEECCBAA ACFFEEBCA FFEDCBBAA AABCDEEFF
135,AABBCDEFF AABDEEEEE AABDEEFED FFFDCBBAA FFEDCBBAA FECAABDDD FFEECBAAB AACDEFFEC FECBAABDF AABCCDEFF ABCCCCCEF ABDDEFECA FFEEDCBAA FFEDCBBAA ABDFFFDCA FFEDDCBAA FDDEEDBAA
136,FFEEDCBAA CAAACEEFF AACCCEFEF FCAABCDEF CDDEFECAA DDBAABEFF ACCDFFEBA ECAABDEEF EFFEDCBAA AABCCDEFF FFEDCCBAA AABCDEFEE FFEEDCBAA AAABDEFFE FFEEDBBBA FFEDCBAAC AABCDEEFF
137,BBBBBCEFF FFEDBBABC ABDEFFDBA FFEDCBBAA AABCDEEFF BCEFFECBA FFEDCBBAA AABBDEEFF FFEEDCBAA AABCDEFFE AABCDFFEC FFEDCBBAA AABCDEFFF AABCDEFFE FFEDCCBAA FEDBAABDF AABCDEEFF
138,BBBBBDEFF AABCDEEFF ADAACEFEE FFEDCBAAA DDDEFFCAA FFECBBBBB AABBCDEFF FFEDCBAAA AABBCDEFF BCCBABDFF EEFDEDBAA CAABCEFEC FFEEDCBAA AAABCDEFF DFFECAABA FFECCBBBB AABCDEEFF
139,FFEDCDBAA AABBDDEFF AABCDDEFF FFEDCBBAA FEFEDCBAA BBABBDEFF AABCEFFEC FFEDCBABA ECBAACEFE FFEDCCBAA AABBCDEFF AABCDEFFF FFEDDCBAA FFDCBABCD AABBCEEFF EBABCCEFF CDEFCDDBA
140,FEDDCAADD CABDFFDCA FEDBAABCF AABCCDEFF FFEDCCBAA AAEFEEDEB AACEFEDCC FEDDEECAA CCDABCCEF AACDCDFFE DDEFFDBAA AABBDEFFC AABCCDEFF FFEDCBBAA FFECBAABD AACDFFEDC AABDDDFFF
141,FFEEDCBAA ECAABCEFF AABCCDEFF FCBDCABCD AABCEDDEF FFEDDCBAA BAACDEDFF ABDBACEFF ABDFFECBA FFEDBBBBA CBAABCEFF AABCEFFED FFEDCACBA BBAACDFFF FFFECBBBA FECCBBBBE AABCDEEFF
142,ADDEFDBAF FFEDCCBAA AABBCEEFF ABCEFEDDB FFECDDCAA ECAAACEFE FFEDCCBAA AABBCDEFF AABCDFFEE FFEEDCBAA AABBCEEFF EDBAABDEF AABDEDDEF BCDEFFDBA FFEEDCBAA AAABCDEFF DFFDCDCBA
143,AAACDEFFF FFEDCBAAA FFEEECBAA FFECBBABB AABCCDEFF FFEEDCBAA AABCDEFFF CEFFEDBAA AABCCEEFF BDFFEDCAA BACEFFDBA FFEDCBAAB ACEFFDBAB FECBBABCF AABDDDEEF AABBDEEFF DEEEEDCAA
144,BCEFFEDBA AABBCDEFF FFEEDCBAA FECBAABDF AACEFEEDD FFDCBAACF AABCCDDFF AABBCEFFE FFEDBBBBA FFEDCCCBA EEEEECBAA AABBCDEFF AABDEEDEF FFEDCBBAA AABCDEEFF FFEDBAABC BDFFECBBA
145,EEFEECBAA FFEEECAAA EEEFECBAA DBABBCDFF BBDEFFDBA EDBAABDEF AABCDFFED BAABCDFFF BCEFFCABB FDCAABDEF FFEDDCBAA FECBAABEF BCEFFEBAA FFDCBABBD AABDEEEEE AAABDEFFF AAACDEFFF
146,ACDFFEDBA AABDEFFEC FFFEDCBAA DCBAACDFF ABDFFEDCA CBBBBCDFF AACEEDDEE AABDEDDEF EFFECBAAB DFFFDCBAA FFECBBBBB FFEEDCBAA BAABCDFFF DEFEDCBAA AABBCDEFF BDFFECBAB ACEFFDCCA
147,EEEEEDCAA EBAACEEEE EEEEEDBAA FECBBBBCD AABBCEEFF FFEDCBAAB AABBCDEFF ABCDCBDFF FFEDCBBAB EFFEDCBAA FFEDCBAAB AABCDDEFF FFEDCBBAA AABBCDEFF BBBBCCDEF DEFFEBABA AABDEEEEE
148,AABBCDEFF ABBACDEFF BCDCBBBEF AABCDEEFE FFEDCBBAA DDDDEFEBA FFEDCBAAB ABCDDEFEB FFEDBAABC AABCDEEFF ABBBCDDEF AABCDEEFF FFEEDCBAA AABDEEEEE FFEEDCBAA FFEDCBBBA CDDEFEDBA
149,EEFEDAABC FFEEDCBAA FEBAABCDE EEFEDCBAA AABBCDEFF AAACFFEDB CBAABCEFF CFBAAEFDE FDDEEDBAA AABCEFFEC FFEEDCBAA BAABCDEFF EFEDBACDA FEDBBAACF AABDEEEEE AABCDEEFE FFBABCDDD
