,0
0,DADDF EEDBA FDBAB ABDEF ABCEF ABDEF ABCEF FFDBA FECBA FEDBA ABCEF ABDEF EEEBA FEDBA FEDBA ABDEF ABDEF BADDF ABCEF FECBA CABEF ACFEB ACEDF ABCEF ABCEF FECBA FECBA FEDBA
1,DBEFA ABCEF FECBA FECBA ABCEF ACCDF ADEED CDFEA ACFDD FECBA FFDBA CFECA FEBAC ACDEF ACFEB CABDF ABCEF EAADF FEDCA FECBA ABCEF ABCEF FECAB ABEEE CEFCA FECBA ABDFE FBACE
2,ABCEF ABDFE FEDBA FECBA FEDBA FEDBA FECBA BABEF ABDEF BBCEF ABDEF FEBAC ABDEF CEFBA FECBB FEECA FECBA FECBA ABCEF ACEDF FEDCA FDBBB FECBA ADEED EDABE ABCEF ABDEF ABDEE
3,FDBDA EECAD ABEFE FEDBA ABFEC FEDBA BACEF ABCEF EFEBA FEDBA FEBAC ABEEE BEFCA ABDEF ABDFF FDABD ACDEF ACFEB FECBA ABDEF ABCEF FECBA BACEF EEDCA BACEF ABEFD FEDBA FCACE
4,ABDEF ABDEF CBADF ABCEF ABDEF FEDBA FEDBA FBCDB ABDEF CDBED BABEF BFEAC BECBE BDFEA FECBA BACDF ACFEC ABCEF ABDEF FECBA FCADC FEBBB FCAAE ABCEF DFEBA FFDBA FEDBA FCADB
5,EEEDA FEDBA ABCEF BADFE CFDBA FDBCB FEDBA ABCEF ABCEF FEDAA FEDBA FEDBA BABEF FECBA FBADD FEDBA ABDEF ABCEF ABDEF FEDBA FECBA FECBA BACEF ACEDF ACCEF FECAB ABDEF FDEBA
6,AADEF FEDBA FECBA ABCEF ABDEF FECAB FEDBA FEBBB ABCEF AEFEB FEDBA ECABF ACCDF BABEF ACEED FBCCB FEDBA FDCAB CACEF ABDEF ABCEF FEDBA FECBA ABCEF ABCEF ACEED FECBA ACEEE
7,FEDBA ABCEF CDACF BACEF FFDBA BBEFB CEFCA ABCEF EFDBA FEDBA FDBBC ABCEF EEABE ABCEF CFECA FEDBA FECBA EBADF ABCEF ABEFE FECAA DBAEE FDACC BBBEF CFECA FECAB FEDBA FCABE
8,ABDEF CEDBD EEEBA FEDBA FECBA ABDEF ABCEF FECBA FECBA BBCEF ABDEF ABDEF FECAB ABCEF ABEED FDACB FECBA BBCEF FECBA FECBA FECBA ABCEF ABDEF AEEDE FECBA BBBEF ABDEF EEDBA
9,FECBA BBCEF ACEFD FEDBA ABCEF ABDEF CFFCA FECBA FEBAB ABCEF ABCEF FEDBA FCABE ABDEF BACEF EFDBA FECBA ABCEF ABDEF BACEF BDFDA FEBAC FECBA FEDBA ABCEF ABCEF AEFCB FEDBA
10,FEDBA FDBAC BBBDF FEABC ACDEF EFDBA ABDEF ABDFE FECBA ABDEF ACFEB FEDBA ABCEF FECBA CABEF ABCEF FECBA FEBAD ABCEF FECBA FEDBA BABEF EFDBA FEDBA ACFEC FEDBA DCACF ABDEF
11,ABCEF FEDBA FEDBA FECBA CBBCF ABEFC ABDEF EEECA ABCEF ABCEF CEECA CABEF ADEEC FECBA FECAB ABDEF BEFDA FEDBA FEDBA FECBA ABCEF ABDEF FEDBA FEDBA DBACF ABCEF ABDEF DFEBA
12,CCDBE EDCAE FECAB FECBA ADFDD EDECA FECBA ABCEF DFDCA FDBBB ABCEF BACEF DEFCA FBBCD BACEF DBADF ABCEF FECBA FECBA AACEF ABDEF CABDF AACEF FEDBA EACFC FEDBA CBADF ACCEF
13,FDDAD CABEF FEDBA CABEF ABDEF ABDFE FECAB FEDBA FDBAD ABDEF FEDBA FECBA FEBAD ABCEF ABDFE FEDBA FDABC ABDEF ADFEB FBBBE ABDEF DCADF ACEFB FECBA FECBA ABCEF ABDEF EBDFA
14,ABDEF BBCDF ABDEF ABDEF BFFBA ACEFC EEECA FECBA FECBA CABEF ABDEF FEDBA FEDBA FECBA FEDBA ABCEF ABDEF ABCEF ABDEF CEFCA ABCEF BEFDA FECBA FEDBA FECBA FEDBA FCCCA FEDBA
15,ADDCF FEDBA DAADF ABCEF DFEBA FECBA BACEF ADDEE FCBBD ABDFF FDBBB FEBBB FEDBA FBACE ABCEF DBAEF FECBA FEDBA ABDEF ACEDE CEFCA FEBAB ABDEF ABDEF FECAC FEDBA FEDBA ABDEF
16,ABDEF FCCEA FEDBA FFCAA BBBDF BABEF EEDBA FECBA ABDEF ABDEF ADFEC FECBA ABDEF ABDFE FECAB FEDBA FECBA FECBA ABDEF AEFDB EFDBA FECBA CCBBF ABCEF ABBEF ABCEF ADEEC ACEED
17,ACFEC BACEF EFDBA FEDBA FDBAD ABDEF ABCEF FDBBC FECBA DCFDA BBBDF ABDEF AEFBD FEDBA FCBAD ABFFC FEDBA FDCBB ABCEF BEACF EFEBA FECBA FCABE ABCEF ABDEF BEFDA CABDF CFFBA
18,BBBDF FECAB ABEFE FEDBA FEBAB ABDEF EFDBA FECBA AACEF ABDEF BBBCF ACEEE ACEED CEFCA EAEDC DEEDA FDBBC CEFCA FECBA ABCEF ABDEF EFDBA FECBA ABCEF ABCEF FECBA BABEF EFDAA
19,FECCA ABDEF ABCEF DEECA FECBA ABDEF ABEFD FECBA FECAC ABDEF FEDBA FDADB ABCEF ACFEC FECAA EDBAF ABCEF FDCDA FEDBA ABDEF FECBA FCACD FDBBB DDBBF ABCEF ABCEF EFDBA EEECA
20,EEDCA FEDBA FDBBB ABCEF ABDEF ABCEF ACFEC FEDBA BBEFB FEDBA FECBA ABDEF ABDEF ABDFE ECEDA ABEFE FECBA FDBAE ABDEF FECBA FEDBA FFCBA ABCEF ABCEF BEFDA FCABE ACEFD FEDCA
21,BADFD ABCEF ABDEF BFDCB CBBCF ACEED ACCCF BEFDA FCCCA FEBBB ABDFD FEDBA EBBCF ADFBE FEDBA FEBAB ABDEF ACBDF FFCBA CABDF ABCEF BACFF FECBA AEFCB FECBA FFCAC FEDBA FBBBD
22,ABDEF FEDBA FEDBA FEDBA FEDBA FDBBB ABCEF FEDBA CABDF ABCEF BEFCA ABCEF ABEFD BDFEA EFDBA BABEF FECBA FECBA ABCEF EFDBA FECBA CBBDF ABDFE FDBBC ABCEF ABCEF ABCEF ADEEC
23,ABEFE ABEEE FFCAA FEDBA AACEF ABDFF FEDBA FCABE ABCEF ACDDF CFEBA ABCEF ACFEC CEFCA FEBAC FEDBA FECBA ABCEF DFEBA FEDBA FECBA ABCEF ABDEF EFDBA ABCEF ACEEE CDEEA CACFE
24,BEFCB ABDEF EFDBA ABCEF ABDEF FEDBA ABDEF ABDFD FEDBA CABEF ABDEF FEDCA FECBA ABCEF AEFDB FEDBA BABEF ACEFD FDDBA FECBA ABDEF FDCCA CBADF FEDBA FECBA FEDBA ABDEF CACEF
25,BBCCF EFDBA EFDBA BACEF DFEBA FECBA FEBAB ABCEF ABDEF AFEDB FECCA FECAC FEDBA FDABE ABCEF ACFED FECBA FCABE ABDEF FBADE BCDBF ABDEF FECBA BACEF EFDBA ABDEF BACEF AEDDC
26,FDBBC BBAEF FECBA ABDFE FEDBA FECBA CBADF ABDEF ABCEF FEDBA FEDBA FDABD ABDFE ABDEE CDFAC ABCEF BACFF ABDFF FECBA FECBA ABCDF AEFBC ABDEF BFFCA FEDBA EFDBA FECAB ACCEF
27,ABCEF ABDEF ACFED ABDFE FECBA FBACF ABCEF ACCFC FDABD ABCFF FECBA FDCBA FECBA FECBA BBBEF ABCEF ABDEF ABDEF FEDBA FECAA ABDEF FEDBA FEDBA ABCEF FBBEB FECBA FEDBA EEECA
28,FECBA ABDEF ACEFC FECBA ABEEE EEEBA FCCCA ABCEF DFEBA FECBA FDAAE ABDFF FECBA ECACF FDBBB DCACF FEDBA FECAD ABCEF ABCEF FECBA FECBA BACEF ABDEF FEBAC ABDDF FECBA EFDBA
29,CBADF ABDEF BABEF ABCEF ABCEF ABDEF ABDEF FECAB FDCAB ABDEF FEDBA FEDBA FECBA FECCA EFDBA FECBA ABCEF ABDEF FEDBA ABCEF ABCEF ABCEF EFDBA FEDBA ABDFE FECBA FEDBA FECBA
30,ABDEF ABDFE FDBBB FDDDA FDBBB DEFBA FEDBA CABDF ACCDF FEDBA FECBA ABCEF ABDEF EFDBA ABCEF ACEDF DFEBA EFDBA FEBAB ABEFD FEDBA FEBBB ABDEF ACFEB FECBA BBBDF ABDFE FEDBA
31,FECBA FEEBA FCACE FEDBA FEDBA ACEEE ABCEF ABCEF ABCEF FECBA EFCBA FEDBA FCABE ABDEF DDFDA FEDBA ABDEF ACDCF DBCFB ABDDF EFDBA FECBA ABDEF ABCEF FEDBA ABCEF ABCEF AEFCC
32,BBCDF CBCFC FDECA ABCEF ABDEF ABDEF FEDBA FECBA FEBAB ACBEF ABCEF DFEBA FDBAC ABCEF EFBAC ABDFE FECBA ABCEF BACEF CFEBA FBADE FECBA DBADF ABDEF ABCEF FECBA ABDFD FECAA
33,ABCEF ABEFD FEDBA ABCEF EFDBA FECBA DABDF ABDEF ABCEF FEDBA FECBA FEBAB ABCEF EFDBA FBABF ABCEF BACEF ACFEB FEDBA FECBA ABCEF ABDEF ABDEF EFDBA FEEBA FECBA ABDEF ABDEF
34,ABDEF FEDAA DEECA FEDBA FECBA CABDF ACEEE DBADF BBCDF ABDEF BBBEF ABDEF FDABE BCCFD FDBBC ABDEF FEDBA FDBBC BEFEA FEDBA FECBA ABCEF ABDEF ABCEF EFEBA ECABF ABDEF CFEDA
35,FDBCA ABCEF FECBA ABDEF ABDEF FECBA BCBCF FECBA ABCFE FFCBA BBBDF BDEEA FEDBA BBBEF ABDEF DFEBA FDBBB EFCAC ABDEF ACDEF FEDBA FEDBA ABDEF FCABF ABCEF FECBA FECAB FECAB
36,ACEEC AEFDB FEDBA EBACF ACEFD FEDBA FECBA ABCEF BFEBB DBADF ABDEE BBBEF ECABF ABCEF CFECA FECAA EEDBA EECAD FEDBA FDBBB ABDFF DFEBA FECBA ABCEF ABDEF EFDBA ABDEF BDEEA
37,CBAFE CFDDA ABDEF FDCBA FDEBA DBBCF ABDEF FEDBA FABDE ABCEF CDEEA FBBCE ABDFF BDEFA FEDBA ABCEF ABDFD ABDFE FECBA FDBAC ACCEF BDFDA FDCBA BABEF ABDEF FEDBA FEDBA DAADF
38,ECAED ABDEF ABCEF ADFEC FECBA ABCEF BBBDF DEEDA ABFED FECBA FECBA ABCDF FEDBA FEDBA ABCEF ABCEF ACEFC FEDBA CABDF ABDEF AADFE BABEF ECFCA FECAB BDFDA FEDBA FECBA ABEEE
39,ABDEF CEEDA FECAB ABDEF ABDEE ABCEF ABCEF ABDEE ABCEF ACFEC FECBA FECBA FECBA FECBA EDEDA FEBBB ABCEF ABDEF DFECA FECBA ABCEF ABDEF BEFDA ABDEF FEBBB FECBA FEDBA ACFEB
40,ABCEF BBBEF FECBA ECABF ABDFE FECAB ABDFE FECBA CABEF ABCEF FECAB ABCEF ADEFB FCBBD ABCEF FEDBA FECBA FBACE ABDEF ABDEF ABCEF FFDBA FDEBA FEDBA FECBA ABCEF ABDEF ABEEF
41,ABCFF FEDBA FEDBA ECABF FECBA BBBEF ABDFE FEBAB BACEF EFEBA FDCBA ABEFE ABDEF ABCEF ABEFE BBCFC FECBA EEEBA DEEBA FEDAA ABDDF ACBDF BFEBD DACEE ABCEF CEFDA FCABE ABDEF
42,ABDEF ABDEF ABEDF FEDBA FECAB FEDBA FECBA ABCEF EEABE EFDBA FEDBA BACEF ABDFF BEEDA BABEF ABCEF BACEF EFDBA FBAED FECBA CABDF ACEFC FECBA FDBAC ABDEF FEDCA FEDBA ABDFE
43,FEBAC ACEEF ABDEF ABCEF DEFDA FEDBA ADFDD DEECA FEBAB ABDEF FEDBA FEBBB EFDBA FECBA ABCEF ABDEF ABDEF FEDBA EAADF DFEBA FECBA ABCEF ABDEF FECBA FECAB FDCBA BEFDA FEBAB
44,DDFBA CBBCF ABDEF FEDBA FEBBB FDBAC CABEF FECBA ABDEF ABDEF ACCEF FEDBA CABEF ABCEF DABDF ABDFE FECBA FECBA AACEF ABEFE ABCEF DFEBA FDBBB FEDBA BACDF ABDEF ABDFE FEDBA
45,ACEFD FEDBA FEDBA FABCF ABDEF BDEEA BACEF ABEEE ABCEF EFDBA FEDBA BACFF ACEFC ABCEF ACFED FFDBA EFDBA EBACF ABCEF EFDBA FDCAC FECBA AADFE FEDBA FECBA ABDEF ABDEF ABDEF
46,FEDBA FECBA ABCEF ABCEF FDCBB ACDEF FDBBB ACDEF BEFDA FEDAB ABDEF ABCDF FDDBA BBBDF FEBBB FECBA ABDEF ACFEC FEDBA ABCEF CEFCA FDABE FECAB BACEF FECBA FEDBA BACEF ABDEF
47,FEDAB FDAAE FEBBB CABEF DEEDA CFECA CBBDF ABDEF BEFDA FECBA FEBAB ACEEE FCDBB FABDE ABDFE ABDEF ABDEF FECBA FECBA ABCEF ABDEF CABEF ABCEF EFDCA FEBAB FECBA FEBAB ABCEF
48,FDDCA FEDBA FECBA ABCEF ACEEE FECBA BACEF ABCEF BBCDF ABDFE FDBBB FEDBA FDCCA FECBA FCBBD ABCEF ABDEF BDFEA EBADF ABDEF BACEF FEDBA CABDF ABDEF FEDBA FECAB ABDEF BEFEA
49,FDDBB AEEED FCABE ABCEF FCCAB ABDEF ABEFE ABDEF FECBA CEFEA FEDAA FEDBA FCBBC ABCFD FEDBA BABEF ACDDF EFDBA FBACF ABCEF CFCAD ACEFD FCECA FEBAC BEFCA FFDBA FECBA ABDEF
50,FECBA ABDEF ACFEC EEECA ABDEF FFBAD ABDEF FECBA FECBA FBACF ABDEF ACFCE ACCEF ADFEB FECBA FECBA AADEF FEDBA EFEBA ABCEF ABCEF FEDBA FDCDA AEFDB CBADF ACDEE EEDBA FCABE
51,DBCCF ADDDC BFEDA FECAA ABDEF ACEFD FEDBA FECBA ABCEF ABCEF BACEF ABCEF FECBA ABCEF ABCEF FEDBA ABDEF ABCEF FEDBA FEDBA ABDEF EFDBA BACEF ACFED FEDBA BACEF EFEBA FEDBA
52,DBDBE FCAAF FEDBA FECBA ABDEF ABDEF FEDBA FDBBB FECAB DEEDA DACFC FECAB ABDEF ABDEF EFDBA FEDBA FDBBB ABCEF BADEF FECAA ACCCF BCADF ABCEF FEDBA FEDBA ABDEF ACEFC ADCEE
53,FEDBA FEDBA DABDF BDFEA ABCEF ACBDF ABDEF FECBA FECBA EBACF ABDEF BFEBC ABDEF FEDBA FBCEB FEDBA FDBAC ABCEF ABDEF ACFEC FECBA FECAB FEDBA ECABF EFDBA FECBA ABDEF ABDEF
54,AAEFE AFECB FEDBA FECBA EDEDA FECBA DBBCF ACECF ADFDA FEDBA ABCEF ABCEF ACEFC DABDF ACDDF EEECA CABEF FECBA FECBA ABCEF CFECA EFDBA FECBA BBBDF ABEEE ABCEF ACCEF EAAEF
55,ABDEF FEDBA FEBAB ABCEF BFECA FDACC FEDBA ABDEF ABDEF BBBEF ABCEF FEDBA FECBA FECBA FEDBA FECBA ABCEF ADDDF ABDEF FECBA FDABD ABCEF ABDEF DEECA BACEF ACEFD FEDBA FCBCB
56,FEDCA FEDBA DFECA FECBA BACEF ABDEF ABCEF FECBA FDAAE FDDCA BACEF FEBAC FDADB FEDBA FCABE ABDEF CADFD ADDEE FEBBB BDDBF DFEAB ABDDF DEECA FEDBA FEBBC ABDDF BEFCA ABEDF
57,ABCEF ABDEF ABEEF ACFFC FECBA FEBBB FEDCA FECBA FEDBA FDBBC ABDEF ACFEB FEBAB ABCEF ABCEF DCACF ACDEF FECAB FEDBA FECBA ABCEF FECBA FECBA BABEF ABCEF FDBBC FEDBA DDEEA
58,FECAC EEECA FECBA ABCEF ABDEF DACDF ABDEF FECBA FECBA FECAB DFEBA FEDBA FECBA ABCEF FEBAD ABDEF ABDEF ACFED FEDBA FECBA FEBBB ABCEF ABDEF EEDCA FECBA FDBBB ABDEF ACEEE
59,ABDEF FECAB EEECA FDBBB FEEBA EABDF BDFEA FCABE ABDEF FECBA ABCEF ABDEF FDABD ABDEF DFDBA DEFCA FECBA ABCEF FECBA FECBA ABCEF FEDBA CBBCF ABDEF ADDEF ABDEF BCFDC ACEEE
60,ABDFE EFDBA ABDEF BFECA FECBA BABEF FDCCA BAEFE FEDBA FECAB ABDEF ABDEF FEDBA FECBA FEBAC ABDEF EFEAA ABCEF EFEBA ABDEF ABEFD FECBA ABEDF ABEFD FECBA ABDEF FEDBA DACEE
61,FEBBA ABCEF ABCEF ABCEF FDBBB ABDEF EEECA BEFDA DACEF ACEFD FFDBA FDBBB BDFEA FEDBA DBADF ABCEF ABDFE FEDBA FDABD ABDEF ADFEB ABEFD EFDBA FDBAC ABDFE FECBA FEDBA DABDF
62,ABBFF BABEF ABDFE ACEFC FECBA FCABE ABCEF ABCEF FDBAD ABDEF ACEFC EDECA FECAB BEFCA FEDBA FECBA ABDEF ABCEF FEDBA FECBA CBBDF ABDEF ACEFC BBCEF ABDEF DEEAA FEDBA FEDBA
63,FEDBA FECBA ABDEF ACFDC DCADF ABCEF DEFCA ABDEF ABCEF FECAA ABDEF FECBA FEDBA ABDEF BEDEA FEDBA ABDEF ADFDC FEDBA ABDEF FECBA FECAB ACEFD FDCCA FDAAE FEDBA EFEBA ABCEF
64,ABDFE FEDBA FEDBA EEEAA FEDBA ABCEF ABEFC FECBA DABDF ABCEF ABEFD EBACF ABDFE CEFDA EFDBA CBADF FECBA FEDBA BACEF ABDFE EEEBA FDBBC ABDEF DFDCA ABEFE ABDFE ABCEF ABDEE
65,EEECA FEDBA FEDBA DACDF ABDEE ABDFF FEBBC ABCEF ABDFF FECBA FCABE ABEFD ABDEF FECBA FDAAD FECAB EBACF ABDEF ABDFE FECBA DEFCA FEBAD AEFDB FECBA FECBA BACEF ABDEF ABDEF
66,ABCEF ABDEF ABDDF ABDFE FECBA FEDBA EEDEA FECBA ABCDF BBBDF FECBA FECBA ABCEF ABDFE ABEFD FCABF ABDEF ABDFF FECAB FEDBA CABDF EFDBA FEDBA BABEF ABCEF FECAB FECBA CDFDA
67,FEDBA FDBAD ABDFE FFDBA DAADF ABDEF ABCEF FEDBA FECBA DCACF ABCEF FEDBA FEDBA FECAB ABEEE EEECA FEDBA ABCEF ABDEE FEDBA FDABC BDFDA ACCEF FEDBA ABDFE ABCEF FECAB AECED
68,AEFEB ABEEE FEDBA FEBAB ACDEE FECBA BBCDF ABCEF ABCEF FECBA FECBA FDCCA FECBA DCBAF ABCEF ABDEF ABCEF BEFCA FEDBA FEDBA FEBAB ABDEF BBBDF ABDEF ABEFE FECBA ABCEF BDFEA
69,FDCCA ACEEC ABDEF FECBA FDABC FEBAC ABDEF ACEFD FECBA FECBA ABDEF ADEEA ABDEF BACDF FEDBA ABCEF ABDEF DFEBA FEBAC ABCEF FFDBA FEDBA ABDEF EEDCA AACEF ABFED FECCA FCABE
70,DCBBF EABDE ABCEF ABDEF FEBBB ACDEF BBBEF FEDBA FECBA FDCCA FECBA ABFDE FECBA FBABE ABCEF AACEF FECBA FDBAD ABDEF FECAB ABEEE CFECA DEFBA FECBA ABDFF FDCCA FEDBA ABDEF
71,FEDBA FECBA ABCEF ABDEF EDDEA EDEDA FEDBA CABEF EFEBA FEDBA AACEF ABDEF ABDEF EEEBA FECBA FEDBA FCABF ABCEF BEFDA BACEF ABDFF ABEEE FEDBA FECBA ABCEF ABDEF CACEF FEDBA
72,BBCFE BABEF FEDBA EBACF ACEFD FEDBA FECAB ABCEF ABDEF BFEDA FEDBA FEDBA ABDEF ABDEF EEECA ABCEF BFFBA ABCFF FEDBA FECBA ABCEF ACCDF ADFEA FDBBB FECBA EBACF ADCEE ABCEF
73,ABDEF FEBAD EFDBA AADEF FECBB FEDBA BACEF ABCEF ABDFE FEDBA FECBA FDABD ABDEF CFCCA EEBDA EFBBC ABCEF ABDEF FEDBA FDACC ABCEF FECBA BBBEF ABCEF FEEBA FDAAE BEFDA FABED
74,BCBDF ABBEF FEDBA FEDBA CABDF ABDEF ABCEF BEFDA FECBA FEDBA BACEF ACBEF BDEEA ABDEF EFDBA ABDEF ACEFB FCACE ACEFC FDBAC ABDFD FEDBA ABDEF BFECA FEDBA ABDEF FEDBA FDABC
75,FECBA EBADE ABCEF ABCEF ABDFE EBABF ABDEE EFDBA FECBA ABDFE FEDBA FECBA BBBDF ABCEF ABEFD FECBA BABDF ABCEF ABEEF ABDEF ABCEF FEDBA FECBA ABCEF FEDBA FDBBB ACEEC EEEDA
76,EEEDA FEDBA FECAB ACBEF ABDEF FECBA FECBB ABCEF DDABF ACFEB FEDBA FECBA CABEF ABCEF BBBEF BFECA EEECA FECBA ABDEF ABDEF FECAA FFDBA FDABD ABEFD FECBA FDBAC ABDEF ABDEF
77,EEECA ABDFE FECBA EEECA FDBBB ABCEF BCFFB FECBA EBBCF ABCEF ABCEF FECBA ABDEF DDACF FEDBA EBACF EFDBA FEDBA FECBA ABCEF ABCEF FCAEC FECBA ABCEF ABEEE ABCEF CDEEA BACEF
78,BDFDA BABEF ABEEF DFEBA FECBA CBBDF ABCEF BFFCA CABDF ABDEF CEFCA DAADF FEDBA FECBA ABCEF FECBA FECBA ABCEF ABDEF FDBAC FECBA ABCEF ABDEF ABCEF ABDEF FECBA FECBA FEDBA
79,FEDCA ACEFE FECBA FEDBA FDBBB ABCEF BACEF FECBA FECBA ABCEF ABCEF FEBAB ABDEF EAAEF FDBCA FDBAC ADFEB FEDBA FECBA ABCEF ABDFE ECFDA FECBA BBBDF ABDEF EBABF ABEEE FEABC
80,ABDEF FEDBA EEDCA FECBA BCBFD FECBA ABDEF CBEFB FECAB ABCEF ACCEF FECAB ABDEF DACFE FEBAC FEDBA FBACF ABDFE FEDBA FECBA ABCEF ACFEB EEEBA DBBCF ABDEF BFBCE BBCEF CBFDB
81,CBBDF FEDBA BBCEF EFDBA FECBA FECBA ABCEF ABDEF FECBA ABCEF ABDEE ADEEC FDABF EFEBA BACEF CEFDA BABEF FEDBA FDBBC ABCEF BDFDA FEDBA FECBA ABCEF ABCEF BEFCA DAADF ABDEF
82,BEEEA BBCEF ADFEB FEDBA FECAB ABCEF ACEEE ABBEF CBADF ABCEF ABDEF FEDBA FEDBA FACED EEECA FEBAB ABDEF FEDBA EBACF ABCEF ABCFF DFECA CABDF ABCEF EEECA CEEDA FCABD FEDBA
83,ABEFD FEDBA FEDBA FCABD ABDEF CDFEA ABEDF CBBDF BEFDA FEDBA CABEF ABBEF CFCAE AACEF FEBCA CABEF FEDBA FECAB ABDEF ACFEC FECAA FECCA ABEFD FECCA FECBA ABDEF ABDEF ABDEF
84,ABDEF BABEF FEDBA FEDBA DBADF ABEEE FEDBA FECBA ABCEF ABDEF ACCEF ABCEF ABDEF EFEBA FECBA AACFF EEDBA FECBA ABDFD FEDCA FECBA ABCEF ABDEF ACEEE FECBA ABCEF ABEEE FDCBA
85,BEFDA FECBA FEDBA FFDBA ABDEF ABDEF FEDBA FEDBA AEECE CEECA ABDEF ACDFD DCFDA FECBA ABDEF ABCEF FCDCA FEDBA ABEDF EEEAA ACEBF BDFEA FEDBA FEBBB ABDDF ABDFF ABDEF CACEF
86,ABCEF EEDCA BBBDF ACFEC FEDBA AACEF FEDBA AADEE FEDBA FEBAC ABDEF ABDFE FECBA FECAB ABDEF BCEFA ABDEF EFDBA ABDFF ABDEF FEDBA CACEF ABCEF FECBA CABEF BFFCA FEDBA ABDDF
87,FEDBA FECBA ABCEF BBBDF CEFCA ABDEF FEBAC ACEEE ABCEF FECBA ABDEF DEEDA FECBA ABDEF BEFDA EBACF ADFDA FEDBA ABCDF ADFEB FECBA FECAB ACFEC EFDBA AFEDB FEDBA FCACF ABDEF
88,BBCCF FEDBA FEBAB ABCEF FEDBA FECBA FECBB ABCEF FDCBA FEBAC ABCEF ABEEE DABDF ACCEF ABCEF FEDBA FEDBA FDDCA EFCBA BBBDF DEECA FDBBB ABDEF ABEFD FECBB ABCEF ADFEB BACEF
89,ABDEF AEFBD FEDBA FECBA ABDEF ABDEF ABCEF FECBA FEDBA FEBAC ACFFC FCDDA ABCEF ABCEF FDBAE ABCEF ABDEF FECBA FECBA FEDBA BABEF FFDBA FEDBA FECBA ABCEF ABDEF ABDEF EEEDA
90,ABEFC FEDBA FECBA ABDEF BEFDA EBACF ABDEF FCABE ABCEF FEDBA FEDBA DBBDF ABDEF ABCEF ACEED FECAA FECBA FECAB ABDEF ABDEF FECBA EABFD FEDBA ABEFE FECBA ECBAF ABDEF ABDEF
91,FDBCB BABEF ABCEF BACEF FECBA FECBA ABCEF ACDDF FEDBA BBBDF ABDFE ABDFF FDEBA FCABD AEFDA EFEBA FECBA BABEF ABCEF FFCBA FECBA BBBDF ABDEF ABCEF ABDEF EFDBA FEDBA FEDBA
92,FEDBA FECBA ABCEF ABDEF FBACD ABCEF FDABD ABCEF FECBA DBADF BACEF ABDEF ACFFB FEDBA ABDEF BCDFC FDBAD ABCEF DFEBA FEDBA ABCEF FEDBA CBADF FECCA BACFF BDFEA FEDBA ABDEF
93,BBDDF EBFBB FECAB ECACF FEDBA FECBA BABEF ABDEF ABCEF EFDBA FECBA FEDBA ABEEF ABDDF ABDEF DAADF ABDFE ABCEF ADFEA FECBA FDBBC ABDEF ABDEF EFDBA FECAB FEDBA DBADF ACCEF
94,ACEEE DFEBA FECBA DABDF ABDEF ABEEE CACFC FEBAC ABCEF ABCDF FECAA BDBCF FFCAA CBCDF ACDEE FECAB ABCEF FEABD CEFDA FEDBA DABEF ACCEF AEFDA FDABE ABDEF FEDCA FEDBA ABDEF
95,ABDEF FFCBA AADEF ABDFF FECBA FEDBA FEDBA FCABD FEDBA ABCEF ABDEF ABDEF ABDEF EFCBA ADEDE FEDBA ABDEF FECBA FEDBA FECBA FECBA BBBEF ABCEF ABCEF ABCEF FEDCA ABCEF CEEDA
96,FEDCA ABCEF EFDBA FEBAB ABDEF ABDEF ABDEF BEFDA FECBA FEDBA FEDBA CABDF ABCEF FECBA ABDEF ACFED ABDEF FECCA FECBA DABDF ABCEF BACEF FECBA EFEBA FECAB ABDEF ABCEF FEDBA
97,ABDEF FEBAD DFEBA FECBA FDBAD ABDEF FFDBA FDBBC ABCEF ACDEF ABCEF ABDEF ABCEF EFEBA FDBBB EEDCA FECBA DDFDA FECBA BBBEF ABCEF ABCEF FEDBA FEBBB ABCEF ABDEF CEFCA FBBCD
98,FEDBA FECBA ABCEF ABDEF EFEBA ABCEF CABEF ABDFE FECBA FEDBA ABCEF ACEED ABEEE BEFDA FEEBA DFECA FEDBA ABDEF ABDEF AEFDA FECBA FCACE FECBA BACEF FEEBA FECBB AACEF ABDEF
99,FDBAD ABDFE ABFED FEDBA FECBB ABCEF ABCEF EEACC FECBA FEDBA BABEF ABDEF BEFDA CABEF ADFEB BEFDA FECBA BACEF ABDEF ADFEC FDCCA FECBA FECBA ABCEF ACEEE FECAC DFEBA CBDBF
100,ABDEF AACFF FEDBA ABCEF ABDEF FECBA FEDBA DEECA ACFEC ABDEF ABCEF FECBA FBACF ABCEF EDABF ABCEF FECBA FEDBA FDABD ABCEF ABEFE ABDEF BEFCA FECBA FEDBA FECBA ABDEF ABDEF
101,AACEF ABCEF AEDCE ABBEF FDDCA FECBA BDDFA FECBA CABDF ABEDF DFEBA FECBA ABCEF ABDDF EFDBA BABEF ACFED BFFCA EFDBA DABDF DFEBA FECBA FEBAC ABCEF ACFEC EEECA FEDBA AADEF
102,FECBA ABDEF ABCEF FECBA FECBA ABDEF DFDBA FECAB ABCEF ACFEC FECBA FCABF ABEFD FECAA FECAB ABCEF FEDBA BDFDA EEBAE ABCEF CFFCA FEDBA EBACF ACECF ACCEF DEFBA FBACE FBCCB
103,AACEF DFEBA CCEFA FEDBA FBACE ABCEF FEDBA FECBA ABCEF ABCEF EFDBA BACEF ABDFE ACEFB FECBA ABEFD FECBA FEDBA ABCEF ABDEF FEDBA FECBA ABCEF ABCEF ABEFD FCBBE FDBBC EEECA
104,CBBCF ABCEF ABCEF ABDEF BEBEB ABCEF ACEED DFEBA FECBA FEBBB FEDAA FECBA FDBBC BCBDF FEDBA FDBBB ABDEF ABCEF FDBAB ABDEF ABDFE FDBCA FECBA ABCEF FEDBA FEDBA FEDBA FDCBB
105,FEDBA FEDBA FECBA ABDDF ABDEF FFCAA ACCDF CBADF BEFDA FEDBA EBACF ABDEF BACEF ABCFF FECBA BCFEA FECAC ABCEF ADFEB FEDBA DCFDA FDEBA ABDEF FEDBA EEEBA EBBBF ABDEF ABDEF
106,BBBDF FECBA BACEF FECBA FECBA BBCEF ABEEF ADFDB CBFDA FECAB ABCEF ABEED BBBCF FDBAD AACFF FEDBA FEBBB FEDBA FCBBC ABDFD ABCEF FEDBA FDBAB ABCEF ABCEF FECBA ABDEF EFDAA
107,ABCEF CFECA FEBAC ABCEF EFDBA FECBA FDCDA FDCAD ACEEE ABDEF ACCEF FEDBA DABEF ABCEF EBACF ABCEF FECBA FECBA FEBAB ABDEF ABDFF AACEF BEFCA FECAB FEDBA FECBA AACEF ACDEF
108,ABDEF FEDBA CEFCA FECBA FEBBA FECBA EDBAE ACCDF EFDBA FCABD ABCEF ABDEF DFEBA BBCEF ABCEF FEDBA CABEF FECBA FEBBB ABDFF FEDBA FECBA ABCEF AADEF ABCEF ABDEF ABCEF ACDEE
109,FDDCA DFDCA CFECA FECBA ABDEF ABCEF FEDBA FCBCB FBADC ABCEF ABDFD FDBDB FECAB ACFFB FBACE ACFFC CFEDA FEEBA ABDEF ACCDF ABCEF ABDFE FECBA FEDBA EBACF ABDEF BACEF BEFBB
110,DDFDA FECBA ABDEF ABDEF ABEDF ABCEF FEDBA FECBA ABDEF ADFDB ABCEF ABDEF EFDBA FEDBA FEBBA FEDBA EBADF ABCEF CFEBA FEDBA BACEF ABDEF EFDBA EDCAD FAEEB FEDCA FECAB ABDEF
111,ECABF FEDBA BABEF ABDEF DFEBA FECBA BBBEF ACEEE CABDF ABCDF DFECA FEDBA FECCA FEDBA FECBB ABCEF CACFF FEDBA FEDBA ABCEF ACEDF CFECA FDBAD ABCEF BABEF FEBBB FEDBA FCBBC
112,FECAB ADEEC FEDCA FEDBA ABCEF ABDEF FEDBA FECBA ABCEF ABDEF FECBA ABCEF ADFEB ABCEF EFDAA FEDBA ABEFD FECBA FECBA ABCEF ABDFE FDECA FECBB ABCEF ACEED ABCEF ABDEF FABCD
113,FCCBE FECAC AEFCC FECBA ABEFE FEDBA ABCDF ABCEF FECBA FEDBA DABDF ABDEF DABEF BDFEA EBACF ABDFE ACDDF FFCBA DABEF AADEF FEDBA BACEF ACEED FEDBA ABDEF ACFFC FEDBA FCABD
114,DBDBE BAECF FECBA ABCEF FECBA EEDBA CBBDF ABDEF ABCEF FECBA FEDBA FEDBA ABCEF ABDEF DFEBA ABDFE ADECF ABCEF EFDBA FEDBA ABCEF ADFDC ABCEF DFEBA FDABD FEDBA FEBAC ADCEE
115,AEEEB FEDBA FECBA ABCEF ABDEF FEDBA ACCDF CBAEF BBBEF CFECA FEDBA DABDF ABCEF BECBF ABCEF FFDBA FCCDA FECBA ABCEF ABEFE FECBA FDDBA CBADF FDECA FEDBA CBBCF ABDEF ABDEF
116,EEEBA CBBDF ABDEF ECABF ACDEF FEDBA FBACE FEDBA FECBA EABCF ABDEF ABDEF BEFCA FEBAB FECBA ABCEF ADFEC FECBA FCBEA ABCEF ABCEF EFEBA FECBA ABDEF ADFDA FDBAC ABDFE FDBCB
117,FEDBA DACDF ABCEF ACEEE ACFEB FBACE FEDBA FDBAC ABDEF ABCEF FECBA EFDBA FECBA ABCEF FEDBA FECBA ABDEF ABCEF ABDEE FEDBA FECBA FDBBC ABDEF ABCEF CFECA FECBA ABCEF FFDAA
118,CBBBF FEDBA FDABE ABCEF EFDCA FECBA ABCEF ACEEE ABDEF ABCEF ABCEF DFEBA FEDBA FECBA FECAA DEECA FCBBD ABDEF FEDBA DABDF ABCEF BEFDA CABDF ABCEF BACEF FEDBA FEDBA FECBA
119,FEDBA FCABE ABCEF ACDEE FABDD ABCDF FEDBA ABDEF ABEFD FEDBA ABDEF ABDEF FEDBA FCABE ABCEF EFDBA BACEF EFDBA FECAB ABDEF FECBA FEDBA ABDFE FDCBA AAEEE FEDBA FEDBA ABDEF
120,DCBBF FECBA DBACF ACEDF FEBAB ABDEF ACBFE ABCEF AAEFD FEDBA FECBA EFDBA FEBBA FCABE ACFDE CFECA FECBA EBADF ABDEF ACEFC FECAB ABDEF EFCAB ABDEF FEDBA ACFEB FEDBA FDBBB
121,ABCDF EFDCA FECAB EEDCA FECBA FDABD ABCDF ABCEF ABDEF DDFBB FDEBA FEDBA FECAB ABDEF ACCDF EEDBA FECBA ABDEF ABCEF ABEED BBCDF FEDBA FCACE ABCEF FECBA ABCEF AACEF ADEFD
122,ABBFF EDBAF ABDEF ABDEF ECAEE FDCBA FEDBA FECAB ABDEF ABDEF ABEFD FECBA ABCEF ABCEF FECBA FEBCB EFDBA FDBAD ABDEF FECBA FECBA FECBA BABEF BBBEF ABCEF ABDEF EFDBA FEDBA
123,FECAB ABDEF ABDFE FECBA ABDEF ABCEF FEDBA BBCEF ACEED FEDBA ABDEF BFECA FEDBA ABCEF ADFEC FEDBA DBADF FDCBA EBFDA FEDBA ABCEF ABDEF FEDBA FEDBA ABCEF ABDEF FFCAA BEFCA
124,ABDEF FEDBA FECBA FDCBA DBADF FEDBA FEDBA CABEF ABCEF ABCEF ABCEF ABDEF EEDCA FECBA FECBA FEDBA CABEF ABDEF EEECA FECBA FECBA ABDEF ADEED BACEF ABDEF DDEDA BACEF ACEEE
125,CCEDB FDBAE FEDAA FDABE EFDBA FECBA CBBDF ABCEF ABCEF BFFCA FECBA FEDBA FDBAD ABCDF AACEF FEBBC ABCEF BBBEF ABDEF FEDBA FEDBA ABDEF AEFCC ABCEF FECBA CEFBA FEDAA ABDEF
126,FECBB FDDCA ABDEF FECBA FDBAD AFFCB EDEDA BBCEF ACEFC FEDBA FEBAB ABDEF CEEEA ACDFD BDFEA EABDF ABDEF FEDBA ABDDF ABCFE FEDBA ABCEF ABEFD FECBA BACEF AEFCB FECBA FBACE
127,FEDCA BBBDF ABDEF FEDBA FECBA ECABF ABCEF ABDEF FEDBA FEDBA DABEF ABDEF DFEBA FDBBC ABDEF EDABF CEFCA FEDBA FEBAB ABDEF BDACF ADFEB FDBCB FEDBA EBADF ABCEF ACCEF FEDBA
128,ECBAF FECBA FDBAC ABCEF ABCEF FEDBA FEDBA FEBBB ABCEF FEDBA FEDBA ABCEF ABDEF FECBA FEDBA DABDF ABDEF BEFDA FDBAC ABDEF ADFDA ABDEF FECBA FEDBA FECAB ABCEF ABBEF FBBCB
129,ABDEF EFEBA FEDCA FEDBA FECBA BACDF BEACF EFDBA FECBA ABCEF ABDEF CFECA ABDEF CBADF EFDBA EFDBA EBACF FFDBA FECBA EBACF ABCEF FDCCA FDBAB ABDEF ABDEF ABCEF ABDEF EEDCA
130,AADEF ABCEF EEEBA FDBBB ABDFE CEFCA FEDBA CABDF ABCEF BACEF FEDBA FCABE ABDEF DFEBA ABDFF ABDFE FDCCA FECBA ABEFE FDBCA FEDBA CBBDF ABDEF FEBAC FECBA ABDEF BFEBA FEDBA
131,AADFF CFEBA ABCEF FEDBA BBBDF ADFEC FEDBA FEDBA EBACF ABCEF ACFEB FEDBA EADBF ACCEF EFDBA ABCEF CFEAB ABDFD FECBA FDBBC ABCEF BBBEF ABDFF FEDBA EEEBA FECBA ABCEF ACBEF
132,CCCFB EDDBB ABDFE EEECA FEBAC FEDBA FDBAD ABDEF BEFDA FEDBA EBADF CEABF ABDFE EEEBA ABDEF ABCEF FECAB ABDEF ACBEF FEDBA FCABE ABCEF FEDBA DBADF ABCEF FECBA FEDBA DABDF
133,BEFDA FCECA FDCCA FECBA BBBDF ABDEF FEDBA CDBBF FEBAB ABDEE DEFCA DFECA BACEF ABCEF ADFDB FEDBA FECAB BACEF ABFEE FFCAB ABCEF DCADF ABCEF FEDBA FEBAB ABCEF ABBEF BBBEF
134,FEDBA FECBA ABCEF ABBEF CEFCA DABEF ACEFB ABCEF ABDEF FECBA FEDBA EBACF ABCEF FFBAD ABCEF FEDBA DFECA EEDBA ABCEF ABCEF CFECA FDBAC FECBA BACEF FECBA FECBA DBACF ABDEF
135,ABCEF ABDEF ABDEE ABCEF BDFEA EFEBA FEDBA FECBA FEDBA ABDFE FEDBA AACEF ACDEF FEDBA BACEF ABCEF ABDEF CEBAE ABDEF DEEBA FEDBA FEDBA FEDBA ABCEF FEDBA FECBA FEDBA DEFDA
136,FEDBA FECBA ABDEF ACBEF ACEEE FDABC ABDEF CDFDA FECBA ABDEF ABCEF FECBA BACEF ACEFD FEDBA ABCEF ACFEB FECBA CABEF ABFED FECCA FECBA ABDEF FEDBA FEBCA FFDBA BACEF ABDEF
137,ACDDF AEFDB FECBA ABCEF FFDBA FEDBA FDAAE ABDEF ABCEF FEDBA FECBA FCABE ABDEF ACFEB FECAB ABDEF EFBAD ABCFF FEDBA FECBA ABCEF ADBCF ABCEF FEDBA EFDBA FECBA ABDEF ABDEF
138,CBBCF ABDEF ABDEF BBEFC ACEEE FEDBA FDCBA BCFEA FECBA FBBCF ABCEF ACFFC FECBA ABCEF ABDEF CFEBB ABDEF FDDCA FEBAB ADFEA FEDBA FECBA ABDEF ABDFE FCBEB FECBA CCBCF ABDEF
139,FEDBA FEBAB ABDEF BCBDF ABCEF FEDBA FEDBA FFDBA FECBA ABCEF ABCEF FEDBA FECAA FECBA ABEEE FEDBA FECBA ABCEF ABDEF ABDFE FECBA FECBA FEBAB ABDEF ABDEF FCADD BDFCB DFBCB
140,FEBCA BEFDA ACFEC FECBA BBBDF ABDEF ABEFE FECBA EBACF EECEA ABDFF FECBA CCFEA FDBCB ABCDF ACEEE AFBDE DEECA CABEF ADFEA ABDFE ABDFE FECBA FEDBA DBADF ABDEF FCABD ACDDF
141,FEDBA FEDBA BABEF BBBDF ABDFF FBBDB CDFCA ACEDE CEFCA FEDBA BABEF ABDEF DBACF AACEF FECBA FEDBA EFDBA BABEF ABCEF BEFDA FEDBA DFEBA BACEF FEDAA FCDCA FDCBB ABCEF ABDEF
142,ADDEE DBEEA FEDBA BABEF ABDEF ABDEF FEDBA FCCDA FECBA ABDFE FEDBA FCACE ABCEF ABCEF ADFEB FEDBA FECBA ABCEF EFDBA ABCEF ABDFF ABDEF BCFEA FEDBA FECBA BACEF ABDEF FCBCB
143,ABCEF DFECA FEDBA DEFBA FECBA FECBA ABCEF ABCDF DFEBA FEDBA ABCEF ACCDF FEDBA BABEF ABDEF ACFEC FECBA ADFEB FEDBA FDBBC ABEFD FDDCA FDBBD ABCEF AADEF ABCEF ABCEF EEDCA
144,ABDEE FEDBA ABDEF EFDBA FECBA FECBA ABCEF ADFEC DEECA CBBDF ABCEF ABDEF AACEF FECBA FECBA FEDBA FFDAA FEDBA FBACE ABCEF ABDEF AADFE FECBA BBCEF ABCEF FEDBA ABCEF EFDAA
145,CEFDA FDBBB EEEBA BACEF FEDBA FBBCD ABEFE ADFDA FEDBA ABCEF ABDEF FEDBA ABCEF BDADF FEABB FECAA ACDFE FDDBA FECBA BBCEF ABDFD FDCCA FECBB ABDEF AEBCF BBCDF ACEFB ABDEF
146,ABCFE FECAC ABEFE FDCCA FECBA FDBAC ABDEF AEFDB FECBB ABCEF ABDFE ABCEF ACEEE ABDFE FDABD BEFDA FEEBA FDCBB BCFEA FECBA CBBCF ACBDF FECBA FCABD ABCEF ACEFC DABDF CEFBA
147,ACEFC FEDBA ABDEF FECBA FEDBA FEBBB ABCDF ABCEF FFDBA FDBBB ABCEF ABDEF CEBBF EFEBA FECAB BFECA FECBA FECBA ABCEF ABCEF FECBA FDBBB ABCEF ACEEE ABBDF BEFEA BBBDF ABDEF
148,ABCEF ABDEF BACEF ABDEE BBBDF ABDEF EEECA FECBA FCBBC EEECA FECBA CACEF ABCEF FEDBA EBACF ABDEF ABDEF BACFF ABDEF ABDEF FEDBA FCACD ACEEE EEECA FEDBA FECBA FECAB BEFDA
149,DEEDA ADEEB FEEBA EEEBA ABCEF CEFCA FECBA ABCEF ACEDF CFECA FDABD ABDEF CABEF FFBAB FEDBA ABCEF FECAB FEDBA FEBAC ABDEF EFDBA CFEBA FEBAB ABDEF AEDCE ABCEF CEFBA DACEF
150,ABCEF FEDCA DAAFE EFDAA ACFEA FECBA FECBA ABCEF BDCBF ABDEF ABCEF ABDEF FEDBA FECBA FDDCA FEBAC FEBBA FEDBA CBBEF ABEEE DADEB ACEEE CBAEF ADFEA EEDBA BACEF ABDEF ADEED
