,0
151,FECBA FEDBA EAADF EFDBA FECBA ABDEF ABCEF FECBA FEBBA FECBA FEDBA ABCEF ACEEE FEDBA FEDBA ABDEF ABDEF BADFD ACCEF DEFBA FEDBA FECBA ABDEF ABDEF BEFCA ABDEF ACCEF ADEED
152,FEDCA ECABF ABDEF FECBA FECBA ABDEF DFEBA FECBA ABCEF ABCEF BEFDA FECBA ABCEF BDFEA ABCEF FEDBA FECBA EBACF ABDEF DEABF BDFDA FEBAC FECBA FECAB ABDEF ABDEF ABDFF FEDBA
153,ABCEF FEDBA FECBA ABCEF ABDEF ACCDF ABDEF FEDBA FECAB ABDFF FECBA FEDBA FECBA ABCEF ADFDC FEDBA FDBCA ABCEF ABDEF ABCEF ABDFE FEBBB FEDBA FEDCA FEDBA FCABD ACEED EEEBA
154,ABCEF ABCEF DFECA FEDBA FECBA DABDF ABDEF FEDBA FCACE ABCEF ABDEF ABDEF ABDEF FEDBA FDBAC ACEED FECBA FEDBA FECBA FCABD ACCDF ABCEF ABDEF FEDBA ABCEF ABDEF ABEFE FDDCA
155,BEFDA FEDBA ABDEF ACCEF ADBDF BACEF CEFCA FECBA ABCEF FECBA ABDEF ABCEF ABCEF FECBA FEDAA FECBA FEDBA FCABE ABDEF ECBBF ABCEF ABDEF FECBA EFDAA FEBCB FECBA FEABC ABDEF
156,ABCEF ACEEE FEEBA FCABE FECAB ABDEF ABBFF ACDDF FECBA FEDBA FECBA BBEFB CABEF ABDEF ABDFE DBADF ABDEF ABCEF FECBA FECBA FEBAB ACFEC FEDBA FECAB AEFCB EFCAC ABDEF ACFEE
157,FDCCA BBBEF ABDEF EFDBA ABEEF FDBBC FEDBA DABDF BDFEA FEDBA BBBDF ADFEC FECBA CABDF ABDEF FCABE ABCFF ABDEF ABCEF FEDBA FEDBA FECBA FEDBA FDBBD BACFE FECBA ABDEF BDFDA
158,DBBDF EEECA ABDEF AEFDA FDCBA ABCEF FECBA FEDBA CFECA FDCAD ABCEF DFECA FECBA ABEEE ABBEF ABDDF ABCEF FEBAB ABDEF EFDBA FBABE ABDEF FECBA FEDBA BABEF AEDCE FECBA ABDEF
159,DEEDA FEDBA BACEF ADFDB FEDBA FECBA ABDEF ABCEF BBBCF ABCEF ADEEE ABDEF FEDBA FECBA FEDBA DABDF ABDEF EEEBA FECBA ABCEF ABCEF DDABF ACEFC FEDBA FCABF ABDEF ABDEF FEDBA
160,BBBDF FEDBA FECBA DABDF ABDEF ACFED FCACC FECBA FEDBA ABCEF ACDEF ABDEF CEEDA CEFDA FACDE ABCEF FFDBA ABEFD FEDBA EAADF ABCEF BFDAE ABDEE FEDBA FCABE ABDEF ABDFE FBCDB
161,FEDBA FECBA ABCEF EBACF AEDEE FBACD ACECF ABCEF FECBA FECAB ACECF ABEEF ABCEF FECBA FEBAC FEDBA FCABF ABDEF ACFEC FECCA ECFDA CDFCA BACEF EEFBA FEBAC FECBA DBACF ABDEF
162,FEDAA ADEDE FECAC FECBA ABDEF ABDEF FEDBA FECBA ABDFE ABCEF BDFEA BACEF ACBEF FFDBA DABEF ABDDF ABDFE FDDBA EBADF ABCEF DCEEA FEDBA ABDEF ACFED FEDBA FECAB ABCEF FEDBA
163,CCAFE ABFED FECBA ABCEF FECBA FEDBA CABDF ABDEF CEFCA FEDBA FEBBB BBBDF BACEF CEFCA FEBAB ABDEF FDABD ABCEF FECBA FECBA CABEF ABEFD ABDEF FEDBA EFDBA FECBA ABCEF ADBDF
164,ABEFD ACEEE EBABF ABCEF BEFDA FECBA FBCCC ACDEF EDDEA FDABC AFBDE BDADF ABCEF FFDBA FEDBA DABDF ABCEF CABDF ABCEF FEDBA FECAB FEDBA FDAAE ABDEF ABEFE FECBA FEEBA FEDBA
165,FDCBB ADFEC FDAAD ABCEF ABDEF FECBA FECAB FECBA BBBDF FEDBA FDADB FECAA ABDEF ABCEF EFEBA FEDBA FEBAB ABCEF ABDEF FFDAA ABDCF BBBEF ABDEF FECBA FEDBA BACEF ACEFE ACDFC
166,FBBDC BADFD FECBA BBCEF ABDEF ADFDB FDABD FECBA CABDF ABEFE FECBA FEDBA BACEF BCEFA ABCEF ABCEF DEFCA FECBA FCBBD ABCEF ABCEF EAADF ACEFC FEDBA FECBA EBACF ABDEF ABEFE
167,CECAF FECBA BABEF ABDEF ABDEF FEDBA ABDFE FECBA ABCDF FEDAA FBBEC FEDBA FECBA AACEF CFECA AEFBC ABDFE ABDEF FEDBA FECBA ABCEF ABDEF FCABE BEFDA FEDBA FECBA ABDEF DFEAA
168,BBCCF ABCEF BBBEF ABDEF CCFCA BBCEF ABCDF EFDBA FECBA EEECA FDBBB DEECA EFDBA FDBBC ABCEF ABDFE FECBA ABCEF ABDEF FECBA ABCEF DFEBA EFEBA FEBAB BEFDA FECBA FECBA ABDEF
169,ADEFB FDBDA EEDBA EFEBA FEDBA FDBBB ABDEF ABCEF ABCEF FEBCA FECBA FEDBA FDBAC ABCEF ACEEE FEDBA FDBAC ABCEF ABEFD ADFCE BBBEF BDFDA FECBA DABDF ABCEF ABCEF BADFE ACEEE
170,BDEEA EEECA FECBA EEECA FECBA ABCEF ABBEF FECBA BABEF ABDEF DFEBA FCABE ABDEF ABEFD FBBEB FECAB ACEFD FEDBA FDBAD ABDFE FEDBA BBBEF ADFDB FDABD ABEFE BBBEF AACEF AACEF
171,ABDFE ACFEB FECBA ABCEF ACEFC FECBA FEDBA FDBAB ABDEF DFECA FEDBA FEDBA ABDEF ABCEF ABDEF FEDBA FECBA FCABE ABDEF ABDFE FDABC ABDEF CABEF CEFCA FECBA EBADF ABDEF FBCCB
172,ECDAD DCBBF BFFCA FECBA DFDBA FECBA BABEF ABDEF ABCEF FEDBA FEDBA FECAB ABDEF ABDEF FEBAC ABCEF FEBAB ABCEF DFEBA ABDEF FFDBA FCABE ABDEF FEDCA BACEF ACEFD FEDBA FCACC
173,FDAAE ABDEF FECBA ABDEF ABEFC FEDBA DABDF ABCEF FECBA ABBEF ABDEF FECBA FEDBA ABCEF FECBA FEDBA ABCEF FEDBA FECAA FEDBA FECBA ABCEF ABDEF FEDBA FEDBA ABCEF EFBAC CEEDA
174,ADDEE FEBAB ACEFD FEDBA BBBDF ABDEF ABDEF FEDBA FECBA DABDF EFEBA ABCEF ACEEE BBCEF EFDBA FECBA BACEF ABDEF BBCDF ABDEF AEFDB FEDBA FECBA FEBAB ABCEF ABCEF FFDBA FEDBA
175,ABBEF FECBA ACEFC FEDBA FECBA ABDEF FFDBA FECBA ABCEF ADDEE BBBDF ABDEF CDEEA ABCEF FECBA EEECA FECBA ABCDF FEDBA FECBA BBBDF ABDFF FEDBA BABEF ABDEF AEFDB FDBBD ABDEF
176,CDACF ADEED FEDBA DBBCF ABDEF ABCEF FECCA DDDEA ABCDF FECBA ABDEF AACEF FECBA DABEF ABDEF ADFFB FECAB ABDEF CFECA FEDBA ABCEF ACFEC FECBA EBACF ABCEF FEDBA FEDBA FEBAB
177,ABDEF DFDDA FEDBA ABDEF DABDF FECBA CDFCA FECBA FEDBA ABCEF ABEEE FECBA EABEF EEEDA ABEEE ACDDF ACEFC FEDBA FECBA FCABE FECBA ABCEF ABDEF ABCEF FECBA ABDEF ABEEF BCEEB
178,ABCEF FECBA ABCEF DFECA FECBA FECBA ABDEF EEDCA FEDCA BBBEF ABDEF ADDEC ABCEF DEFCA FEDBA FEDBA ABEEF ACFEB EBACF FECBB CDBBF ABCEF EFDBA FEBAB ABCEF ABDEF ACCEF FECBA
179,ABEEE FEDBA FECBB FEDBA FEDBA FEDBA ABCEF ABCEF ABCEF ABCEF ABEEE FECBA FECBA DFEBA ECBBF ABEEE FECBA FEDBA FCACF ABCEF ABCEF EEEBA FEDBA ABCEF ACDEF DDCEA BBBEF ADEFC
180,FEDBA ABCEF ABCEF BACEF FEDBA DBACF ABDEF CFFBA ABDFE ADFDD FDBAC FECBA FDBBC ABDFE FDCCA FECBA ABDEF FECCA CBBCF ABDEF FCEBB ABCEF DEABE ABCFE EEEBA FEBBB FEDBA FEDBA
181,AFEDB FEDBA ABDEF ABCEF ABDEF BDFEA FEDBA FECBA EDEDA ABCEF ABDEF FDABE ABDEF ABCEF FECBA FEDBA EABEE FECBA FECBA BACEF FCABD ABDEF ABDEF DFDBA FEDBA EEECA EBADF ABDEE
182,FEDBA ABCEF ABDEF DFEBA FECBA ABCEF ABCEF FDBAC ABDEF EFCAB FEDBA CABDF FECBA FECBA FECBA ABCEF BFECA CFECA FDBAB ABCEF ADEEE ABCEF ACDEF ABEEE FDCCA EFDBA FEDBA FEDBA
183,ABEFD FEDBA DFEBA FECAB FEDBA ABCEF EFEBA BABEF ABDFE FDABE ABCEF CFEBB ABDEF FECBA ECABF FEDBA FECBA ABCEF ADFDB EEEBA FECBA ABCEF DFEBA DBBCF ACDEF ABDEF ABDEF FECAB
184,DEBAF EECDA FCACE ABCEF ACDFE FECBA EEDBA DBADF BEFCB EDDDA FEBBB ACBDF BBCEF ABCEF FECBA FECBA ABCEF ABDEF ABDFE FECAB FECBA ABDEF ABDFD ABDFF FEDBA FDABD ABEFE FDACD
185,FEDBA FECBA ABDEF AADFE CFDDA FBACE BDEFA ABDEF CEFCA FEDBA DABDF BBBEF ABEEF ABDEF ABDFE FECBA FADEA FECBA FCABE ABDEF FECBA BDFDB FFCBA ACDEF FEACB FECBA BBBDF ABDEF
186,BBBEF BBBDF FEBCA BACEF ABDEF CEFCA FEDBA FECBA ACDEF ABDFE EFCAB ABCEF ABCEF FECBA FEBAC ABCEF ABDFE FECBA BACEF ABCEF FEDBA ECACF ABCEF FECBA EFDBA ABEFD FEDBA FEDBA
187,ABDEF FEDBA ABDEF ACEFC FECBA FECBA DABDF ABCEF AEEEC EEEBA BABEF EEEBA DBADF ABCEF ACEEE FEDBA FECBA ABDEF CEEDA FECBA BACEF ABDEF ABDEF FEDBA CABEF ABDEF DFECA CEFDA
188,FEDBA FECBA ABDEF EEEBA ABCEF FFCBA ABDEF EFEBA EBACF ABDEF FEDBA FEDBA ABCEF BDDFB FECAA ABCEF EFDBA FECBA ABCEF BFEBA FEDBA ABCEF DFDBA FEDBA ACEED FEDBA FDBAE ABDEF
189,FEDBA FECBA ABDEF ABDEF FBACE ABDEF FECAB ACDEF EFDBA BACEF ACCDF FECBA FECAB ABDDF ABDEF FEDBA BABEF ABCEF FEDBA FDBAE ABEFE FEDBA FECAB AEEEC FECBA CFDCA FEDBA ABDEF
190,ABCEF ABEED FEBAB DFEBA FECAC ABDEF ABCEF ACEFB FECBA FEDBA ADFEC ACEDE ABDEF FECBA CBBDF ABDEF BABEF CEFCA FEDBA FDBAC ABCEF ACFDE ABDEF FECCA FDECA FECBA CABEF ABDEF
191,AACEF ABCDF ACEEE FECBA ABDEF ABDEF AEFEA ABCEF ABCEF DFECA FECBA EEECA FECBA EEDAA AACEF EEEBA FECBA ABCEF ABDEF DEECA ABCEF ABDEF FECBA ABCEF FEDBA FECBA FCACD ADFEA
192,ABCEF ABDEF FEDBA FEDBA FECBA ABDFF ABDEF CABDF ABDDF ABCEF FECBA FEBCA FECAC DFDBA FCDCA ABCEF ABEEE FECBA FEDBA FEDBA BBBDF ABDEF ABDFE ABCEF FEBBA FEDCA FCDCB FECBA
193,BBBFE BACEF FECBA FDBAB ABCEF FEDBA EEEBA EBDAF ABDFE FEDBA ADCCF ACCEF ABCFF FECBA BACEF ABCEF FECAB ACCEF FEDBA FEDBA FEBBB ABCEF ACFEC ABDEF EFDBA FEBAC FECAA ADCCF
194,FECBA EEFBA FEDBA CACEF ACEFC FECBA DABDF ABDEF ABEFE FCACD FCCDA FEDBA ABCEF ABCEF FECBA FEDBA ABDEF ABDEF ADFBD ABCDF FEDBA FECBA AADEF ABCEF FECBA ABDEF ABCEF ADEDE
195,FECCA FECAD ABDEF FECBA CABEF FECBA DBADF FECAA FDBAC ABCEF ADFEB FECBA EAADF BABEF ABDFD FCABE ABCEF DFEBA ABCEF ABCEF FEDBA ABDEF ABDEF FEDBA FEBAC ABDEF FECBA CACEF
196,FECAA ABDEF BACFF ABCEF FDBBC AADEF CCACF BDFFA FDCCA FFDBA FECBA ABCEF ADFEA ABCEF ABEFD FEDBA EFDBA FEBAC ABDEF ABCEF FECBA FECAC FECBA CFDBA ABDFF FDCDA FEDBA FECAB
197,FEDBA FECBA ABDEF ABDFD BACEF ABDFE FDBBC ABCEF EFDBA FEBAC ACCEF ABEFC FECBA ABCEF FECBA FCABF ABCEF FECBA FECAB ABDFE FECBA ECACF CFDBA EDBAF FEDBA FECBA DAADF ABDEF
198,BEEEA FDABF ABDEE FEDBA FECBA ABDEF AEFDA FDBCB FECBA BBBEF ABDEF AACEF ADEEB ACEFC FEBBB FECBA FDABC FEDBA FECBA ABCEF ABCEF ADFDE CEFDA FEDBA ABCEF ABDEF DFEBA EACEE
199,EEDDA FEDBA FECAB ADFEB ABDEF EFDBA ABDEF BACEF ABDEF FEDBA FEBAB ABCEF ABDEF BDFDA FDDBA ACFEB FECBA ABDEF ACDEF FEDBA FEBAB FDBDA ABDFF FDDBA EFDBA ECBBF ABDEF ABDEF
