,0
0,FFEDBBBCBBA FEFFEDCBAAA BBBBBBDDEFF AAABCDEEFFF ABBDEDBCFED FFEEEDCBBAA FFEEDCBBAAA AAABBCCDEFF AABCDEEFEEE EEEEEEDBAAA FFEEDCCBAAA FFEEDBBBAAC AABBBCDEEFF AABBCDEEEFF AABBCCDEEFF AABBCDDEEFF FEEEEEDCBAA AABBCDDEEFF AABCCDDEEFF AABBBCDEFFF AABBBCDDEFF EEFFEDCBAAA FFFEEDCBBAA AAABCDDEEFF AABCDEFFFDB FFEEDCBBBAA FFEEDCBBBAA FFEEEDCCBAA FFEEDDCBBAA AAABCCDEFFF AACEFFEEDCA FFEEDDCBAAA FFFEDDCBAAA FFFEEDCBBAA EEDBBBBBCDF AABCDEEEEED FFEEDCBBAAA AABBCCDEEFF AACDCBCDFFF CDBCDFFFCAA ACECEFECCCD AACCCCDDEFF AAABCDDEFFF AAABCDDDEFF AABBBCDEFFF AABBCEFFEBE
1,AAABDEEEEEE FFEEDDCBBAA FFEDCBBABBC AAABBCDEFFF AABBCDDEFEF DEEFEDDCBAA FFEDCCBBBBA FFEEEDCCBAA FFEEDDCBBAA ECBAABBCDFF AABBCCDEEFF AABBDEFFEED FFEEDDCBBAA FFDCBABBCDD AABBCDEEFFF AABBCCDEEFF AAABBCDEFFF DEEEEEDCBAA FFEDCBBBBBB FFEEEDCBBAA FFECBBAABCE AABBBCDEEFF FFFEEDBBBAA EFFFEDBBAAA AABBCCDEEFF AAABCDEFFFE FFEEDCBBBAA FFFEDCCBBAA FEDDDEDCBAA FDCAABDEECC DCBBBABCFFF FFEEEDCBBAA FFFEDCBBBAA FEEEEDDDBAA AAABBCDEFFF FFFEDCCBBAA FFEDBBBBBBC AABCCDDEFFF FFFECCBABBA AAABCDDEEFF AAABCDEEEFF AABBBCDEEFF AAABCDEEEFF BBECCBABDEF ABBBBCCDEFF AABBBCDEFFF
2,ABEFFFEDBBA FFFEDCCBAAA FFEDCCBBBBB EDEEDEEDBAA CAAACCDFFFD FFEEEDCBBAA FFEEDCCBBAA FFEEDDCBBAA FFDCBBBBBBE AAABBCDEEFF AABBCDEEEFF FFEEDCCBAAA FFEEDCBBBAA AAABCDDEFFF AABBCDEEEFF AABBCDDEEFF AABBBCDEEFF AABBCDDEEFF AABBCDDEEFF AABBBCDEEFF DEEEEEDCBAA FFFEDCBBBAA FFEDCCBBBBB AAABCCDEEFF AABCEFFEEDC FFEEDCBBBAA FFEDBBBAADF FEEEEDCBBAA FFEEDDCBBAA BBBABBCDEFF AABDEEEEEDD FFEEDDCBBAA FFEEEDCBBAA FFEEDDCBBAA CBAAABEFFEE FFEEDCBBAAA ECAAABDEEFF AABBCDEEEFF AAACDCDEFFF AABCEFFECDD AABCDDDEEFF AABBCCDEEFF AABBCDDDEFF AABBCDDEEFF AABBBCCEEFF BCBBBBBDEFF
3,BFFEDCBBBBB AAABCCDEEFF AABBCCDEFFF AABBCCDEEFF AAABCDEEEFF AABBCDEEEFF FEFEECAABCB EFEEEDDCBAA FFEEDDCBBAA AABBCCDEEFF AABBCCDEEFF DFFFEDCBBAA FFEEDDCBBAA AACCBCEEFFF ABABBCEEFFF AABBCCDEEFF AABBCDEFFEC FEBAABBCDEE AABCCDDEEFF CCBBBBBDEFF ABBBBCCDEFF AAABCDEFFED FFFEDCCBAAA EEEEEECBAAA AABBCCDDEFF AABBCDDEEFF CFFEDCBBBBB DDAABEEEEDE BDCEFFEDCAA FFFEEDCBAAA FECCCCBBBDC AABBBCCDFFF DEEEEEDCBAA FFFEDCCBBAA FFEEDCCBBAA AABCEEEEEED FFFECBAAACE AABBCDEEEFF AAABCCDEEFF AABBCDEEEFF AABBCDDEEFF AABBCCDEEFF AABBCDDEEFF AABBCCDEEFF AABBBCDEEFF CDDEEEEEDAA
4,EFFECBCCBAA FFFEDCBBAAA BBBBBBCDEFF AABBCDDEEFF AABBCCDEEFF EEEEEEDCBAA FFEDDCBBABB AABBCCDEEFF AABBCCDDEFF FFEEEDCBBAA FFEEDCBBAAA ABBBBCDEEFF AABBCCDEEFF AABBCDDEEFF AABBCDEEEFF EEEEEEEDBAA FEBBBBCCCDD AABBCCDEEFF AABBCDDEFFF AABBBCDDEFF ABBCDEFFECA FFEEDCCBBAA FFEDCBAABCE AABBCDEEEFF BBCEEFFECAA FFEEDCBBBAA FFECCBBBBBB FFEEEDDCBAA FFEEDDCBBAA BBAABCDEEFF AABDEFEEDDC FFEEEDCBBAA FFEEDCCBBAA FFEEEDCBBAA FECBBBBBBDF AAABDEFFEDD FFEDCCCBBAA AABBCDDDEFF FFEDCCCBBAA FEDEEEDCBAA EFFEEDCBAAA FFFEDBBBBAA FFFDCCBBBBA FFEEEDCBAAA CBBBBBBCEFF AABBBCDEEFF
5,FFDBCCCCBBB AAABCCDEFFF AAABCDDEFFF AABBCCDEEFF AABBCDEEEFF BBBBBBBCDFF AABCDEEEEEE CDEEFFECBAA FFEEEDCBBAA FFEEDCCBBAA AABBCDDEEFF AAABBCDEFFF AABBCCDEFFF FFEDCCBBBBA FFEDCBBBBBB FFEDCCCBBAA FFFFECBAAAB EEEEEDDDCAA FFDCBBBBBBB FFFEDDCBAAA CBBBBBBCDFF AABBBCDEEFF AABBBCDEFFF CEEEEEECAAA FFEEDCCBBAA FFFEDCCBAAA FFECBBBBBCD AABABCDEEFF EEEEEEDCBAA FFEEEDCBBAA FFEEDCCBBAA FFEEDDCBBAA FFEEEDCBBAA FFEEDDCCBAA FFEDBBBBBBC AAABBCDEFFF AABBCDDEEFF AABCDCCFFFF CEEEDBACEFA DFFFECBAABB DEEFFEDCAAA AABBBCEEFFF FFEDCBAABCD AABDDDEFEDE AAABCCDEEFF EEEEEDDBAAA
6,AAABCEEEEFE FFEDBBBCBBA FFFDCCBBBBB FFEDDDCBAAA EEFEEEDCBAA BBAABCDEFFF FFFEEDCBAAA FFEEDCCBBAA FFEEDCCBBAA FFEDBBBBBBC AABBBCDEEFF AAABCDDDEFF FFEEDDCBAAA FFEDCAAABDD AABBCDEEFFF FFFFECBBBAA FFEBAABBCDD AACECBDEEDF FEEEEDCCBAA FFEEEDCBBAA FFEEDDCBBAA CCBBBBBCEFF AABBCDDEEFF AABBCDEEEFF BBBBBCCDEFF AABBBBDFFFF AABBBCDEFFF AABBCCDEEFF AABBCDDEFFF EEEEEEDCBAA FFEEDCCBBAA CCBBBBBBDFF AAABBCDEFFF EBDFECCDDCA FFEEDCCBBAA FFEEDCCBBAA FFFEDCCBBAA FFDDEEDCBBA DCBBBBBBDFF ABBBBBDFFFF FBBBABCCDEE DEFFEDCBAAB AAABCEEEEEF FFECBBBBBBB FFFCBBAABCD AABBBCCDEFF
7,FFFEDCCBAAA FFFDCCBBBAB AAAABDDEEFF AABBCDDEEFF AAABDEDEFFF BFFFECBBDBA FEFEEDCCBAA FFEEEDCBBAA FFFEDCBAAAB AABBBCDEFFF AAABCDDEFFF FFEEDDCBBAA FFEEDCCBAAA AABBCDDEFFF AAACDDDEFFF AAABCCDEEFF AABBCCDEFFF FFECBBBBBCC AABBCDDEEFF AABBBCDDEFF AABBBCDDEFF AABCEFFEEDB FFEEDCCBBAA FFEEDDCBAAA BABBBCCDEFF AAABCDDEEFF AAABCDEEEEE FFFEDCBBBAA FFFEEDCBBAA FFEEDDCBBAA FECBAAABCEF AAABCDEFFFE FFFEEDCBBAA FFEEDCCBAAA AABCEFFEEDC FFEDCCBBBAA FEDBAAACDEF AABCCDEEEFF FFFEBBCBABB AABCDEDDEEF AAABCDEEFEF AABBCCDEEFF AABBDDEEFFE BCCDDDEEEEA AABBBCDEEFF AABBBCDEEFF
8,EEFFCABBCBA FFEEDCCBAAA FFEEDCBBBAA FFFEDDCBBAA FFEEDDCBAAA FFFEDDCBBAA FFEEDCCBBAA BBBBBBCDEFF AABBCDDEFFF DEEFFEDCBAA FFEEDCCBBAA FFFEDCBBBAA FECBBAABCEF AABBCDDEEFF AABBCDDEEFF AAABCDDEEFF BCDDEEEEEBA FFECBBBBBCC AABBCDDEEFF ABBCBBCDEFF AABBBCDDEFF FFFEDCCBAAA FFFEDCBBAAA AAABCCDEFFF AABBCDDEFFF FFEEDCBBBAA FFEDDCBBBAA FFEEDDCCBAA FFEEEDCBBAA FFFEDCBAABC AABBCCDEEFF AABDEEEEEDC FFEEDCCBBAA FFEEDDCBBAA FFEEDCCBAAA ABFFFEDCBBA BBBAABCDEFF AABCCDDEEFF AABBCDEEFFF AAABCDEEFEF AABBCDEEEFF AABBCCDEEFF AABBCCDEEFF AABBCCDEEFF AABBBCDEFFF ABCDEFFFCAB
9,DDFFFECBBAA FFEEDCCBAAA EDCBABBBDFF AAABCDDEEFF AABBBCDEFFF AABCEEEEEFD FDECCCAADCC FEDCBCDDEBA FFEEDCCBAAA FCDBBAADEDF BAABBCDEFFD FFEEDDCBBAA CBBAABCDFFF AABBCDEEEFF AABBCDEEFFF AABBCCDEEFF FFFECBAABBC AAABCDDEEFF AABBCDDEEFF AABBCCDEEFF CCDEEFFDBAA FFEEDCCBAAA FEDEDDDCCAA CAAABCDDFFF AAABCDDEEFF AABBCDEFFEE FFFEDCBBBAA FFEEDDCBBAA FFEEDDCBBAA FFFEDCBBAAA AAABBCDEEFF ACDEEFFECBA FFEEEDCBBAA DCBBBBABEFF FEDCBAAACEF AABCDEEFEEE FFEEDCCBAAA AABBCCDEFFF AABCCDDDEEF AABBCCDDEFF AABBBCDEFFF AABBCCDEFFF AABCCDDEEFF AABCDEEDEFF AABBBCDEEFF AABBBCDEEFF
10,CFECBAABCEF FEFEDCBBAAB AAABCCDEFFF AABBCCDEEFF AAABCDEEEFF ABCEFFFEDBA FFEEDCBBBAA FFFEDCBAAAB AABBCCDEEFF AABBCDDEFFF EEEEEEDCBAA FFEEDCBBBAA FEEEEDCCBAA FFEEDCCBBAA FFEDDCCBBAA FFEEDCBBAAA AABBBCDEEFF AABBCDDEEFF AABCDDEEEFF FFEEEDCBBAA FFEEDCBBAAA AABBBCDDEFF AABBCDEEFFF FFFEDCBBAAA FFEDCBBAABD AABBCDDEEFF AACEEEEEEEE AABBCCDEEFF AABBCDEEFFF FFEEEDCCBAA FFECBAABDEE FFDCCDDDCAA FEEDBBDDCBA FFFEDDCBBAA FFFEDDCBAAA FFEDCBBBBBB AABBCDDEFFF AABCCDEEEFF BEFECCEFCAA AABDEDDEEED AAABCDEEFFF FBBBBCCDEEB BAAABCDEFFF ACEFDDFEBAB AABBBCDEEFF EEEEFEDBAAA
11,FFFEDCCBBAA FFEEDCCBBAA FFEEDCCBBAA FFEEDCCBBAA FFEEDDCBBAA FFEEDDCBBAA FFEEDDCBBAA FFEEEDCBBAA BAABBCDEEFF AABBCDDEEFF AABBCDEEEFF FFEEDCCBBAA FFEEEDCBAAA FFEEDCCBBAA DBAABCDEFFF AABBCDDEEFF AABBCCDEEFF AABBCDDEFFF AABCCDEEFFF BBBBBBCDEFF ABCDEEFFDBA FFFEDCBBAAA FFFEDCBBBAA BBBBBBCDEFF AABBCDEEFFF AABCDDEEEFF FFEDDCBBBAA AABCDDDEEFF FFFEEDCCBAA FFFEEDCBBAA FFEEDCCBBAA CCCBBBBBDFF AABBCDEEFFF FFFEEDCBAAA FFEEDDCBBAA CBBAABCEFFF ADEFFEDCCBA FFEEDDCBBAA FFEDBBBBBBB ABDEEEEDDDD AABBCCDFFEE AABBCCDEEFF ACEDDCBBDFF AABCDEEEEEF AAABBCDEFFF AABCCDEDCEF
12,BDFFFEDCBAA FFFEDCBBBAA FFEDCCBBBBB AAABCDEEEEF FFEDDCBABBA FFEEEDCBAAA FFEEDDCBBAA FFEEEDCBBAA FFEEDCBBAAA AAABBCDEEFF AABBCDDEEFF AABCDEEEEEE FFEEEDDCBAA FFEEDCCBBAA FFEDBBBBBBC AABBCDDEEFF AAABBCDEEFF AABBCDDEEFF AABBCDEEEFF AABBBCCDEFF AABBBCDDEFF AAABCEEEFEE FFEEDDCBBAA BBBABCCDEFF AABDEEEEDDE FFEEDCBBBAA FFEDCBBBBBB EDDEFEDCBAA FFEEEDCBBAA FFFEDDCBBAA FFEEDCBBBAA AAABCDEEEFF ABDEDEEEDCC FFEEDDCBBAA FFEDCBBBBBB AAABCDDEEFF EEEEEDDDBAA FFFEDCBBAAA AAABCDEEEFF EFFFDBAABBC FFEEDCCCBAA BAAABCDEFFF AABCDDDDEFF AAABBCDEFFF AABBBCDEFFF AABCDEEFFEB
13,FFFEEDCBAAA FFEEDCBBBAA FFEEDCCBBAA FFEEDCCBBAA FFEEDDCBAAA FFFEDDCBBAA FFEEDDCBBAA AABBCCDEEFF AABBCDEEEFF FFFEEDCBBAA FFEEDCCBBAA FFEEDDCBBAA AABBCCDEEFF AABBCDDEEFF AAABCDEEFFF FFFEDBAABBB AABBCCDEFFF AABCCDDEEFF AABBCCDEFFF AABCDEFFECA FFEEEDCBBAA FEDBBAAACEF AABCCDEEEFF FFFEDDCBBAA FFEEDCBBBAA FFDCBBBBBCD AACDEEFEEDB AABBCCDEFFF AABCDEEEEEE FFEEEDCBBAA FFEEDCBBAAA FFFEEDCBAAA AAABBCDEEFF AABBCDDEFFF EFEEEDCCBAA FFEECBBAABB AABBCDEEEFF AABBCDDEEFF EEFFEDCBAAA FFDCBBBAACF EEEEEEDBBAA FFEEDDCBBAA FFECBABBCCD AABBCCDEEFF AABBCCDEEFF AABBBCDEFFF
14,AABBDEEEEEF AABCDEFEEED FEDBAABBCEF AABBCDEEEFF AABBCCDEEFF CDEFFEECBAA FFFEDCBBBAA FFFEEDCBAAA FFEEDCCBBAA FFEEDCBBBAA ABBBBCCDEFF AAABCDEEFFE FFEEDCCBBAA FFFEDCBAAAB AABBCDEEFFF AABBCDEEEFF AAABBCDEFFF AABBCDDEEFF AACDEEEDEDE DDCBAABBDFF AABBBCCDEFF DEEEEEECBAA FFEEDDCBBAA FFDCBAABBDE AABBCDDEEFF AACDEEEEDDD FFEDCBBBBBB FFEEEDDCAAA CDEFEEDDDAA FFEEEDCBAAA BBAABCDEFFF AAABCDDEFFF DCAAABEFFEC FFEEEDCBBAA FFFEDCCBBAA FFEDCCBBBBA FFEDBBBBBBC AAABCDEEFFF AABBBCDEEFF AABCDDEFFDF AAABCDEEEFF ACBBBBBCEFF AAABCDEEEFF CAACCBBDEFF AABCCCDEEFF AAABBCDDEFF
15,FFEDDCBBBAA FFEEDCBBBAA CBBABBCDEFF AABBCCDEFFF AAABCDEEEFF EEEFEDDCBAA FFEEDCCBBAA FFEEEDCBBAA AAABBCDEFFF AABBCDDEEFF BDEFFEDCBAA FFEEDDCBBAA FFEEEDCBBAA CAAABCDEEFF AABBCDEEFFF AABBCDDEEFF AAABBCDEFFF AABBCCDEEFF AABBCDDEEFF AABBBCDEEFF AABBCCDEFFF FFEEEDCBAAA FFFEDCBBAAA BBBBBBCDEFF AABBCDDEEFF DEEFFEDBBAA FFEDCBBBBBB EFFFEDCBBAA FFEEDDCBBAA FFEEEDCBBAA FFEEDCCBBAA BBBBBBCDEFF ACDDEEFFECB FFEEEDCBBAA FFEDCBBBBBD AABBCDEEEFF DDEEECBEECA FFEDCCCBBAA AABCDDDEEFF AAABCDEEEFF AABBCDEEEFF AAABCDEEEFF AABCCCDEEFF AAABCDDEEFF AABBBCDEFFF AAABBCDEFFF
16,AABBCEFFEDC FFEEDCCBBAA FFEEDCBBBAA FFEEDCCBBAA FFEEDCCBAAA FFEEDDCBBAA FFEEDCCBBAA FFFEDDCBBAA AABBCCDEEFF AAABCCDEFFF EFFFEDCBAAA FFEEDDCBBAA FFEEDCCBBAA BBBABCDDFFF AAABCEEEEEE AACCCCCDEFF AABBBCDDEFF CDEEEEEECAA AABCDEEDDFF AABBCCDDEFF AAABCDEFFFF DEEFFECBAAA FFEDDCCCBAA FFEDCCBBBBB AABBBCDEEFF AABBCCDEEFF AABDEEEEEEE FFFEDCCBBAA FFEEDDCBBAA ECAABCCCCFF AABBCCDEFFF FFEEDDDCBAA FFEEDDCBAAA FFEEDDCBBAA DCBBAABCEFF AABCDEFFEED FFEEDDCBBAA FFDBBBBBCCC AAABCCDEEFF AAABCDDEEFF AABBBCDEEFF AABBCDDEFFF AABBCDDEEFF AABBCCDEFFF AAABBCDEFFF AABBBBCEFFF
17,EDCCBBBBBFF AABCDEEEEEE FFEEDCBBBAA FFFEDCBBBAA FFEDCCBBBBA FFEEEDCBBAA FFFEDCBBBAA FFEEDDDCBAA FFFEDCBBAAA AAABCCDEEFF BCDEFFEDBAA FFEEDDCBBAA FFDBABBBCDD AABBCDEEFFF ACBBCDEFFED AABBBCDEEFF EEEEEECBAAA AABBCDDEEFF AABBCDDEEFF AABBBCDDEFF AABBBCDDEFF FFEEDDDBAAA FFCBBBCDDCB FECBCCCCBBB BCAACDFFEBD ABEFFEDCBBA FFEEDCBBBAA FFEEDDCBBAA FFFEDCBBAAA AABCDEEEEEE BBAABCEFFFF FFEEEDCBBAA FFEDCCCBBAA FFEDCBBBBBB AAABCDEFFFE AAABBCDEFFF AABCDEFFEDB FFEEDCCBBAA FDBBBBBCCCC AABBCDDEFFF AAABCDEEEFF ABBBBCCDEFF AABBCDEEEFF FFFEDCCBBAA FFFEDCBAABC AABBBCDDEFF
18,FECACEEEDBA FFFEDCBBBAA FEEEDCCBBAA FFFEDCBBBAA FFEEDCCBBAA FFEEDCCBBAA FFECCCBBABE AABBCCDEEFF AAABCDEEFFF FFFEDCCBAAA FFFEDCBBAAA AABBCCDEEFF AABBCDDEEFF AABBCDDEEFF EEEEEEDCAAA AAABCCDEEFF AABBCDDEEFF AABCDDEEEFE AACCCBBDEFF EEEEEDCBAAA FFEEDDCBBAA FFFEDCBBAAA AABBCDEEEEF ABBBBCCDEFF FFEEDCBBBAA FEDBBABBCDE AABBCDEEFFF FEEEEDDCBAA FFEDBAABCDD AABBCDEEEEF AABCDEFEEEE FFEEEDCBBAA FFEEDDCBAAA BBBBBCCDEFF AABBCDDEEFF ABDEFFEECBA FFEEDCCBAAA AAABCDDEEFF AABBCDDEFFF AABBCDEEFFF FFDBBBBBCCC EFFEDDCCBAA BCBBAACEFFF AABCCBCDEFF AAABBCDEFFF DDEDDDEEDBA
19,FECBABCCDDC FFFEDDCBAAA FFEDCCBBABB EDDFEEDCBAA FFFFECBBAAA FFEEEDCBBAA FFEEDCBBAAA AAABCCDEEFF AACDEEEEEDC FFEEEDCBAAA FFEEDCCBBAA FFEEDCCBBAA ABBBBCCDEFF AABBCDDEEFF AABBCDDEEFF CDEEEEEDCAA FCAABBCDEEF AABBCDDEEFF AABBCDEEFFF AABBBCDDEFF CCDEEFFDBAA FFEEDCCBBAA FFDCBAABCDE AABBCDDEEFF AABCDEFFECB FFEEDCCBBAA FFEEDCCBBAA FFEEDDCBBAA BBBBBBCDEFF AABBBCDEEFF AABDEFFEECB FFEEDDCBBAA FFEEDCCBBAA FFEEDCBBBAA FFEEEDCBAAA BCBBBBCDEFF FFEECBBBBCA FFEEDCBBBAA AAABBEFEEEF AAABCDEEEFF AAABCDDEEFF AABBCCDEEFF AABBCDDEEFF AABBCCDEFEF AABBBCDEEFF AABBBCDEFFF
20,FFEEDCCBBAA AAABBCDEFFF AABCEEEEEEE FFEEDCCBBAA FFEEDCBBBAA FFEDDDCBBAA FFEDBBBBBBC AABBCCDDEEF FFEEDDCBBAA FFEEDCCBBAA BBAABCDEEFF AABBCCDEFFF EFFEEDCBBAA FFEEDCCBBAA FFEEDCCBBAA FFEEDCBBBAA AABBBCDEEFF ABCDEFFFDBA FEAABBCCDDE AABBCCDEEFF AABBBCDDEFF AAABCCDEEFF EFFFEDCBAAA FFEEDCCBAAA AABCCDDEEFF AAABCDDEFFF FFEDDCBABBB FFEEDDCBBAA FFFEDDCBBAA BAAABDEFFFE ABAABDFFFED FFEEDDCBBAA FFEEDCCBBAA CCBBBBBCEFF AABBCDDEEFF DEEEEEDCBAA FFEEDCCBBAA FBAABCCDEEE AABBCDDDEFF EEEEEEDBAAA EFFFEDCBAAA AABBBCDEEFF AAABCDEEFFE DFFECAAACDE DDDCCBAACEF AABBCCDEEFF
21,FFFEEDCBAAA FFFDBAABBBC ACDDDCBBCFF CBDFFFECBAA FFEDEEDBAAA FFEEDCBBBAA AABBCCDEEFF AABBCCDEEFF AABCCCDEFFF FFEEDDCBAAA BAABBCDDEFF AABBCCDEEFF AABBCDDEFFF AACDEFFEECA FFDDCCBBBBB AAABBCDEFFF AABBCDEEEFF EFFEEDCBBAA EEEEEEDCBAA FFEEDCCBBAA FFFEDCBBAAA FFEEDCCBAAA ABBBCDEFFEA FFEEDCCBBAA FFEEDCBBBAA AAABBCDEFFF ABBBBBCEFFF ABBCCCCDEFF ABCBCEFFEDB FFFEDDCBAAA FCBAAABDEFF BBBBBBCDEFF AABCDEEEEEE FFEDCCCBAAB AAABCDDEEFF AABBCDDEEFF AABBCDEEEFF CDDDEEFECAA FFEEDCCBAAA FFEEEDCBAAA FEDBAAABDEF AABBCDEEEFF AABCDEEEDDE AAABCCDEEFF EEEEEDDBBAA FFDCBBBBBCC
22,AAABDEEEEEE FFEEEDCBBAA FFEDCCBBBBB FFEEDDCBBAA FEFECBCCBBA FFFEDDCBBAA FFEEDCCBBAA FFEEDDCBBAA FFEDCBBBBBB AAABCCDEEFF AABBCDDEEFF BCDEFFEDCAA FFFEDDCBAAA FFFEDCBBAAA AABBCDDEEFF AABBCDDEEFF AABBCCDEFFF AABBCDDEEFF AABBCDDEFFF AABBBCCDEFF AABBBCDEFFF FFFEEDCBBAA FFEEDCBBAAA AABBBCDEEFF AABBCDEEFFF FFFEDCCBAAA FFEEDCCBBAA FFEEDDCCBAA FFEEEDCBAAA AAABCCDEEFF AACEEFEEDDC FFEEDDCBBAA FFEEDDCBAAA FFEEEDCBAAA AAABCDEEFFF FFFEDDCBAAA FFEDCCBAABC AABBCDEEEFF AAABCDEEEFF ABBCDEEFFEA FFEDCCCBBAA AAABBCDEFFF AABBCDEEEFF AADEFEDCCDF AABBBCDEEFF AABBCCDEEFF
23,DEFFDAABCDE ABDCDFFEDBB AAEEEDDDDEE AAABCCDEFFF AABCDDDEEFF ABDDFFEEDBC FEECCBBBADC EDEEFFDBAAA FFEDBAABCCD AAABCDDEEFF AABBCEFFFEC FFEEDDCBBAA FFECBBBBBCC ABBBCDDEEFF FEEEECBBCAA DBBBBBCDEFF DEEEEEEDBAA BAABBCDEEFF AABBCDEEEFF BBBBBBCDEFF AABBBCCDEFF AAABCDDEFFF FFEEDCBBAAA FFEEDDCBAAA AAABBCEEEFF AABBCDDEEFF ADFFEEDBBBC FDDECBCCABE BAAABDFFEEF FFFEDDCBBAA FFEDDCBABBB AABBCCDDEFF DFEEEDDCBAA FFEEDDCBAAA FFECBAACDCB FFEDDCBBBAA AAABBCDEFFF AABCCDDEFFF AAABCCDEFFF AAABCDDEFFF AABBCCDEEFF AABBCDDDFFF AAABBDEEFFF AABBCDDDEFF AABBBCDEFFF AAABCCEFEFF
24,DAAABCDEEFF AABBCDDEEFF AABBCCDEEFF AABBCDDEEFF AABBCDDEEFF ABCDEEFEECA FFFEDCBBAAA FFEEEDDCBAA FFFECBBAABC AABBCCDEEFF AABCCCDEFFD FFEEDDCBBAA FFEEDDCBAAA CCBAABBCEFF AABBCDEEFFF AABBCCDEEFF AABBBCDEEFF EEEEEDDCBAA AABCCDDEEFF FFFEDDCBBAA FFEEDCBBAAB AABBBCDEEFF AAABCDEEFFF FFEEDDCBBAA FEDBBAAACEF AABCDEFFEED DBCDEFFDBAA FEEDEECBBAA FFFEEDCBBAA FFFEDCBAAAB AAABCDEEFFF FEEDDDDDCAA FFEEDDCBBAA FFEDCCBBBBA FFEEDCCBBAA AABCDEFFFDC FFEEDCBBBAA AAABCEEEEEE FFEDCBBBBCB AAABBCDEFFF AABBCDDEEFF AABBBCDEFFF AAABCDDEEFF AABBBCDEEFF AABBBCDEEFF ACEEFEEECAA
25,EEEFFECBABA FFEEEDCBAAA FFEEDDCBAAA EBBACFFEDCB FFEEDCCBBAA FFFEDCBBBAA EDBAABCDEFF AABBCCDEEFF AABBCDEEEFF EFFEEDCBBAA FFEEDDCBAAA FFDBABBCCDD AAABCCDEEFF AABBCDDEEFF AABDEFFFECA FFCBBBBBCCC AABBBCDEEFF BBABBCDDEFF AAABCDEEFFF AABBCCDEEFF FFFEDDCBBAA FFFEDCCBAAA FEDBAABCDEF AABBCDDEEFF AABBBCEFFEC FFEDCCBBBAA AAABBDDEFFF FFEEEDDCBAA FFEEEDCBBAA BBBABBCEEFF AAABCCDEEFF AAABCCDEFFF FFEEEDCCBAA FFFEDCBBAAA CCBBBBBCDFF AABBCDDEEFF EFFFEDCBAAA FFFEDCBAABB AABBCDDEFFF AABBCCDEEFF AAABCCDEEFF AABBCCDEEFF ABBCBBBDEFF AABDEEDCDEF AABBBCDEFFF EEEEEEDCBAA
26,FFFEDCBBBAA FFEDDCBBBAA BAABACEFFFF AAABCDEEEEF AABCDCDEEFF DFFDEEBBBAB FFFECBBCCAB FFFEDDCBAAA AAABBCDEEFF AAABBCDEFFF FFFEEDCBAAA FFFEDCBAAAB AABBCCDEFFF AABBCDEEEEF ACBCBCDCEFF AAABCDEEFFF FFFEDCBAABB AABBCDDDEFF AABCCDDEEFF AABBBCCDEFF AABBBCDDEFF FFFEDDCBBAA FFDCCCCCBAB BABBBBCDEFF AABBCCDEEFF FFFEDCCBAAA CAABCDEEEFF FFFEEDCBBAA FFFEEDCBBAA FEEDDEECBAA AABBBCDEFFF ABDEFEEEDBA FFFEDDCBAAA FFEEDDCBBAA AAABCDEFFEE FFFEDCBBBAA AAABBCDEEFF AABBCDEEEFF AABBCCDEEFF AABBCCDEEFF AAABBDEEFFF AAABCDDEEFF AAABCDDEEFF AABBCCDEEFF AABBBCDEFFF AABBDEEEFFB
27,FFEDCBAABDC BBCCCBBDFDF AAABCCDEEFF AABBCDDEFFF AABBDEFFEDE EEEFDDDDBAA FFEEDCCBBAA FFEEDDCBBAA FFEEDCBBBAA BBBBCBBCDFF AAABCDEEFFE FFEEDDCBBAA FFFDCBBBBBB AABBCCDEEFF AABBCDEEEFF AABBCCDEEFF CCDDEEFECAA AAABCDDEEFF AABDEEEEEEE FFFEDCBBAAA BBBBBBCDEFF AAABCDEFFEE FFEEDDCBBAA FFEDCCCCBAA AAABCCDEEFF AABBCCDEEFF AAABCDEFEEE AABDDDDFEFD BCBCDEFFEBA FFFEDCCBBAA FFEEDCBBAAA AABBBCDDEFF AABCDEEEEDD FFEEEDCBBAA FFFEDCCBAAA ABDFFEEECBA FFFEDCCBAAA AABCDEEEEEE CBCFEBCFEAD BABCCDFFDCF EFFFECBBBAA AABBCCDEEFF AAABCDDEEFF AABBCCDDEFF AAABBCDEFFF CCCBBBBCBFF
28,FFEDCBBBBBB FECCBAABCEE AABBBCDEFFF FFEEEDCBBAA ECBAAACFFED EFFECBABBBB AABBBCDDEFF AABBCCDEEFF AAABCDDEFFF FFFEDCCBBAA DCBAABBDEFF AABBCCDEEFF AABBCDDEEFF ACDEEFFECAA FFFEDCBBAAA AAACEECCDFF AAABBDDEFFF DDEEEEDDCAA FFEEDBBBBBA FFEEDCCBBAA FFFEDCBBBAA EAABCCEFFED EDCDEEEECAA FFEEDCCBBAA FFEEDCBBBAA AAABBCDEFFF AABBCCDEEFF AAACDEFEEED EFFEEDCBBAA FFEEDDCBAAA DBAAABCEEFF AABBBCDDEFF AAABBCDEFFF AAABCDDEFFF FFEEEDCBBAA CBAABBDEFFF AABBCDEEEFF AABBCDEFFFD FEEDCBBCBBA FFEEDDCBBAA EDCBAABCDFF AABBCCDEFFF AABCDEEEEEF AABBCDEEEFF EEEEEEDCBAA FECBBBBBCDD
29,FFFEECBBBAA FFEEDCBBBAA FFEDDCBBBAA FCABABCCEEF AACDCDDCECF FEEEEDCBBAA FFEEDDCBBAA FFEEEDCBBAA FFEEDCBBAAB AABBCDDEEFF AABBCDDEEFF AABCDEEEEEE FFEEEDCBBAA FFEEDCCBBAA FFEEDCCBAAA AABDEEDDDEF AABBBCDEEFF AABBCDDEEFF AABCCDDEEFF EFFEEDCBAAA BBBBBBCDEFF AABBBCDEEFF EEFFEDCBBAA FFFEDCBBAAA BBBBBBCDEFF AABBCDDEEFF FFFEDCBBAAB AABBCCDEEFF EFFEEDCBAAA FFEEEDCCBAA FFEEDCCBBAA FEEDCBBAACF AABCDEEEEEE FFFDDCCBBAA FFFDDCCBBAA BAAACDDEEFF EFEDCDDDDAA FFEEEDCBAAA BBBBBCCDDFF AABEFDBDEEE BAAABCDEFFF AAABCCDEFFF AABBCDDEEFF AABDDDDEEFF AAABBCDEFFF ABBCDEFFCAC
30,ECBAAACDEFF EFFEDDCBAAA BABBBCCDEFF AABBCDDEEFF AABBCDDEEFF EEEEEEDCBAA FFFEDCCBAAA FFEEDDCBBAA AAABBCDEEFF AAABCDEEFFF FFEEDCCBBAA FFEEDDCBBAA FFEDCBBBBBC AABBCDDEFFF AABBCDEEFFF AABBCCDDEFF AABBCDDEFFF DEEEEEECBAA FFEDCBBBBBB FFEEDDCBBAA CBBBBBBCEFF AABBBCDEEFF BEFFEDDCBAA FFEEEDCBBAA DCBAABCDEFF ABDFFFEDCBA FFEEDCBBAAB AABBCCDEEFF FFFEECAACBA CCCBBBBBEFF FFEEDCCBAAA FFEEDDCBBAA FFEDCBABBBC CCCDEEFFEBA CCBBBABCEFF FFEEDDCBBAA FFEEDCBBAAA AABCDEEEEED FFFEDCCBAAA FEEEDDDCBAA AABCDEEEEEF ABBBBCCDFFF AAACDEEEEEF FFFEDCCBBAA CBBBBBBDEFF AABBBCDEFFF
31,AAAABDEEFFF AAAABCDDFFF AABCDDEEEFF AABBCDDEEFF AABBCCDEEFF AABCCDEEEFF AAABCDDEFFF AABCDEFFEED FFEEDDCBBAA FFEEDDCBBAA FFDBAAABCDE AABBCDDEEFF AABBCCDEFFF AABDEEEEEED FFFECBBBBBA FFEDDCCCBAA FFECBBCCBBB FFFEDCBBABB FFFEEDCBBAA FFEDCBBABBB ABBBBCCDEFF AAABCCDEFFF AABCDEEEEEF EDEEEEDDCAA FFEEDCBBBAA FFEDDCBBBAA BAABBCCEFFF AABBCDEEFFF FFEEEDCBAAA DDCEFFEDBAA FFEDDCBBBAA FEEEEDDCBAA FFEEEDCBBAA FFEEDDCBBAA FFEEDCCBAAA AAABBCDEFFF AABBCDEEEFF AABCDDEEEFF CDFFEEDCBAA FEDDEEEDBAA EEEEEDDCBAA DEFFEEDBAAA FFEEEDCBBAA FFEEDDCBBAA FFEEDCBBBAA EEEEEEDCBAA
32,FFCDDCCCBAA FFEDCBBBBBB AABBCCDEEFF AABBCDDEEFF AABBCDEEEEF DEEFFEDCBAA FFEEDDCBBAA FFFEDBBAABC AABBCCDEEFF AABBCDEEFEF FFFEDCBBBBA FFEEEDCBBAA FFDBAABBCDE AABBCDDEEFF AABBCDEEEFF AABBCDEEFFF FFFEDCAAABB AABBCCDEEFF ABCDEFFFDAB BBCCDEEEFDA AABBBCCDEFF ADFFFEDBBAB FFEDCBCCBAA AAABCCDEEFF AACDDDEEEFD FEFFEDCBAAA FFDCBBBBBCD AABBCDEEEFF DEEEEEDCBAA FFFEDDCBAAA ABDEDDEEDDD EFFEDCAABBA FFEEDDCCBAA FFFEDCBABBA FFEEDCCBBAA AABCDDDEEFF ABBBBBBCEFF CDEFFEDBAAA EDEEDBBDFBA EEEEEEECBAA CFCBCCCBBCD AAABBDFFEEE BBCDEFFFDAA FFEEDDCBBAA AABBBCDEFFF EFFFECBBBAA
33,FFEDCCBBBAA FFEDDCBBBAB ABACEFFEDDC FFFEDCCBAAA EEEFEEDBAAA CBBBBBCDEFF AABBBCCDEFF AABBCCDEEFF ABCDEFFFDBA FFEEDCCBBAA FECBAABCDEF AABBCCDEEFF AABBCCDEFFF AABCDDEEEFF BBBBBBCDEFF FFFEDBABBBB AABBBCDEEFF AABCCDDEEFF CEFFEBBAACD AABBBCDEEFF FFEEEDCBBAA FFEEDDCBAAA AABBCDDEFFF CDECBAABDFF FFFEDCBBAAA FFECBBBBBCD AAABCDEEFFF FFEEEDDCBAA AABABCDEFFF AAABCCDEEFF FFEEDCCBBAA FFEEDCCBAAA FFFEDCBBAAA AABCDEEEEEF AAABCDDEFFF FFFEDCCBBAA AAABCDEEFFF AABBCCDEFFF AABCCDDEEFF AABBCDEEEFF AAABCDDEFFF AAABCDEEEFF FBBBBBBCEFF AAABCDEEFFE FFEEDDCBBAA CDDBAACDFFC
34,AADEEEEEDDC FFFEDCCBBAA FDCDBABBCEF AABBCDDEEFF AABBCCDEEFF ACCDEFEEEAA FFFDDCBBAAA FFFEEDCBBAA FECBAAACDFF AABBCCDEEFF AABBCCDEFFF FFEEDDCBBAA FFEDBBBBBBC AABBCDDEEFF FFCCDCAABDD AAABBCDEFFF FFFFEDBAAAB AABBCDDEEFF AABBCDDEEFF AABBBCCDEFF AABBBCDDEFF AACEFFFEDBA FFEEDCCBBAA FFDBAABCCDD AABBBCDEEFF CCEFFFDCBAA FFEDDCCBBAA FEEEEEDCBAA FFEEDDCBBAA CBABBBCEFFF AABBCCDEEFF FFFEEDCBBAA FFFEDDCBAAA FFEEDCBBAAA AABBCCDEEFF CBAABCDEFFF FFEEDCCBBAA FFECBBBBBBB AAABBCDEFFF AABBCCDEEFF AABBCDDEEFF AABBCCDEEFF AABBCDDEEFF AABBCCDEEFF ABABBCDEEFF AABBCDEFFFC
35,ABBBBBCDFFF AABCDEEEEEE AABBBCDDEFF AABBCDDEEFF CAABBCCDFFF EEEEEEDBAAA FFEEDCBBBAA BBBBBBCCEFF AABCDDDEFEF EAACEEEEEDA FFFEDCCBBAA FFFEDCBBAAA BBBBBBCDEFF AABBCDDEEFF AAABCDDEEFF AAABCCDEFFF FFEEEDCBAAA AAABCDDEFFF AABBCDDEFFF ABBBBCCDEFF AABBBCDDEFF ACEFFFEDBAA FFEDCBAABCE AABCCDEEFFD FFEEDCCBBAA FFEEDCBBBAA FEDDDDDBBBA FFFEDCCBBAA EDBAAACDEFF AABBBCDEEFF EFFEDDCBAAA FFEEDDCBBAA FFFEDDCBBAA BBBBBBCDEFF AABCDEEEEEF AAABCDDEFFF BDEEEEEDCAA FFEEDDCBBAA FFEEDCBBAAA AABBCCDEFFF AABBCCDEEFF AABBBCDEEFF AAABCDEFFEE AABBCCDDEFF AABBCCDDEFF AAABCDEEFFF
36,EFFFEDCBAAA FFEEDCCBBAA FFEEDCCBBAA FFEEDCCBBAA FFEEDDCBBAA FFEEDDCBBAA FFEEDDCBBAA FFEEDDCBBAA CBBABBCDEFF AABBCDDEEFF AABBCDEFFFE FFEDDCCBBAA FFEEEDDCBAA FFFEDDCBAAA FFEEDCBAAAA FDFFECAABCC AABBBCDEEFF AABBCDDEEFF AABBCDDEEFF AABBCCDEEFF AABBBCCDEFF AAABCDEEFFF FFEEEDCCBAA FFEEDCCBBAA AAABCCDEEFF AABCDDEEEFF DDFFFEDCAAA FFEEEDCBBAA FFEEEDCBBAA FFEEDDCBBAA FFEDCCBAABC AABBCCDEEFF AABCDDEEEEF DEEEEEEDBAA FFEEDDCBBAA BAABDEFFEEC FFFEECBBAAA AABBBCDEFFF AABBBCEEFFF AAACEFFFECC BFFCBBBBCEE BCEFDAABCEF ABCDEFFFCAC AAABBCDEEFF AABCBBCDEFF ABABBCDEEFF
37,AEEDEEEDDCA AABBBCDEFFF CCAABCDEFFF BBABBBCDFFF DEEEFEDCBAA AAABCDDEFFF DDEFFECBAAA FFEEEDDCBAA FFEEDDCBBAA FECBBAABDFF AABBCCEEFFF AABCCCCEFFF AAACDEDDEFF AADEDCDEFDD FFDCCDECAAA FDCEDBBBCDC CCCCCDEFFDA FFDCBBBBBCC AABBCDEEEFF AABBBCCDEFF AABBBCCDEFF AAABCDEEFFF AABBCCDEEFF AABCEEEEFDC FFFEDCCBAAA FFEEDCBBBAA FFDCBBBBBCD AAABCDEEFFE FFEEEDCBBAA EEFFEDDCBAA FFEDDCCBBAA EEEFFEDBAAA FFEEEDCBAAA BBABCCCEFFD AABBBCDEEFF AABBCCDEEFF AABBCDEEEFF ADDEECBBDEF AAACDEEEEFE AABBCDEEEEF BCCDEFEDDDA DDCDDEEEDBA FFEEDDCBAAA FFFEEDCBBAA FFFEDBAAABC CEFECBCDEBA
38,EEFEEDCBAAA FFEEDCCBBAA FFEEDCCBBAA FFEEDDCBAAA FFEEDDCBAAA FFEEEDCBAAA FFEEDDCBBAA FFEEEDCBBAA AABBCCDEEFF AABBCDDEEFF CDEFEEDDBAA FFEEDDCBBAA FFEEDDCBBAA FFECBAABCDD AABBCDEEEFF AABBCDDEEFF AABBBCDEEFF AABBCCDEEFF AABBCDDEEFF AABBBCDEEFF EEEEEEDCBAA FFEEDDCBAAA FFFECBBBBBA AABBCCDEEFF AABBCDEEEFF ABDEFFFDCBA FFEDDCBBBAA FFEEDDCBBAA FFEEEDCBBAA FFEEDDCBAAA FFEEDCBBBAA AAABCCDEEFF AABBCDEEEEF FFFEEDCBBAA FFEEDCCBBAA FFECBBABBBE AABBCDEEFEE FEEEEEDBBAA FECAABCDCDF AABCCDDEFFF AABBBDEEEFF AABBCDDEFFF AABBCCCDEFF AAABCDDEEFF AABBBCDEFFF AABBBCDEFFF
39,BBDFFFEDBAA FFEEDCCBBAA FFEEDCBBBAA FFEEDCCBBAA FFEEDDCBBAA FFEEEDCBBAA FFEEDCCBBAA FFFEDDCBAAA FFECCBBBBBD AAABCCDEEFF CDEEEEEDBAA FFEDDCCCBAA FEDBAAACDEF AABBCDEEEFF AABBCDDEEFF AAABCCDEEFF AAABCCDEEFF AABCCDDEEFF AAABCDDEEFF ABBCCEFFFDA FFEEDDCBBAA FFEEDCBBAAB AAABCDDEFFF CDDEFFEDBAA FFEEDCBBBAA FFDCBBBBBCD AABBCDEEEFF FFEEEDCCBAA AAABCDEFFEE DCCBBBBBEFF AABBCDEEFFE FFEEDDCBBAA FFEEDDCBBAA FFEEDDDCBAA AABEEFEEDCB FFFEDCBBAAA AABBBCDEFFF AAABCDEEEFF BBCEFDEFCAA ABECBBCEFED AAABBDEEEFF AAABCDDEFFF AAABCCDEFFF AAACCDEEEFF EFBABDCACDF AAABBCDEFFF
40,FFFEDCBBAAA FFEDDCBBBAA BADFFFEDCBA FFEEDCCBBAA FFEEDCCBAAA FFEEEDCBBAA FFEEDCCBAAA BBBBBBCDEFF AAABCDDEEFF ABCDEEFFDBA FFEEDCCBBAA ECBAABCDEFF AABBCCDEFFF AABCDDEEEFF BBBBBBCDEFF FFEEEEDBAAA AAABBCDEFFF AABBCDDEEFF AABBCCDEEFF ABCDCCDFFEA FFEEDDCBBAA FFFEDCBBBAA EDDEDBCEFCA FFFEDBBABBB AAABCCDEFFF FFECBBBBBBC AAABCDEEFFF FFEEEDDCBAA BBABBCCEEFF AABCCCCDEFF ABCEFFEECBA FFEEDDCBAAA FFFEDCCBBAA FFFEDDCBBAA AAABCCCDEFF AABBCDEEFEE FFEEDDCBBAA AAACDDDEFFF AAACCDDEEFF AABBCDDEEFF AAABCDDEEFF AABBCDDEEFF AABBBCDEFFF AAABCDEEFFF AAABBCDEFFF CCCDDEEEFCA
41,FFEEDCBBBAA FFFEDCBBBAA FFEEDCCBBAA FFEDDCBBABA CCCCCBBBBFF FEEFEDDBAAA AAABCDFFEEC DCCBBBABDFF AAABCCDEEFF AAABCDEFFFD FFEEDCCBBAA DCBAABCDFFF AABBCCDEFFF AABCCDEEEFF AAABBDEEFFF FFDBBBBBCCC AABBBCDEFFF AABBCDDEEFF AAABCDDEEFF CDDEEEEECAA FFEEDDCBBAA FFEEDCBBAAA BAAABDEFFFF FFEDCBAABDE CCDEFFFDBAA FFEDDCBBBBB AABBCDEEFFF FFEEEDDCBAA BABBBCDEFFF AABBCCDEEFF DFFFEDCBBAA FFEEDDCBBAA FFEDDCCBBAA CBBBBBBCDFF AAACDEEEEEE FFEDDCBBBAB BBBBBBCEFFF AABBCDEEEFF AAABCCEFEFF AAABDDEEEEF AABBCDDEEFF AABBCDEEEFF AAABCDEFFFC AAAABCDFFFF AAABBCDEFFF FFFEDCBAABB
42,FFFEEDCBAAA FFFEDCCBAAA FFEEDCBBBAA BABBBCDDEFF FEEDDDBAABD EFEEEDDCBAA FFEEDDCBBAA FFEEEDCBBAA FEDCBBAABDF AABBCDDEEFF AABBCDEEFFF DEFFEDCBBAA FFEEEDCBBAA FFEEDCBBBAA FBAABCDDEEE AABBCCDEEFF AABBBCDEEFF AABBCDDEEFF AABBCDDEEFF AABBBCDEEFF AAABCCDEFFF FFEEDDCBAAA FFEDCCBBBAB AAABBCDEEFF AABBCDEEEFF FFFEDDCBAAA FFEEDCBBBAA FFEEDCCBBAA FFFEEDCBBAA FFFEDDCBBAA BAABCDEEFFF EEEEEEDCBAA FFEEDDCBBAA FFFEDCBAABB AABBCDDEFFF FFEEDDCBBAA FFEDCBBBBBA AABBCDDEEFF AABBCDDEEFF FFEECBBBBBA FFEDCCBBBAA ABABBCCEEFF AAABCDEEEFF AABBBCDEEFF ABABBCDEEFF AABBCCDDEFF
43,FFEEDDCBAAA FFEDCCBBBAA FFEDDCBBBAA FFFECCBBBBA FFEEDCCBBAA FFDBCCCCCCA BBAABBDEEFF AAABCCDEEFF AABBCDEEFFF FFEEDCCBBAA FFEEDCCBAAA AABBCCDEEFF AABBCDDEFFF AABCDDEEEEF EEEEEEDCAAA AAABBCEFFEF AAABBCDEFFF AABCCDEEEFF AAABCDEEEFF EEEEEEDCBAA FFEEDDCBAAA FFEEDCBBAAA AAABBCDEFFF AAABCDEFFED FFEEDCBBBAA ECBAABBDEFF AABBCDEEFFF FEDCBBAACEF AABBCDDEEFF AABBCEFFEEC FFEEDCCBBAA FFFEDCBBAAA FFEDCBBAABF AABBDEEFEEE BBAABCDEFFF ABCEFFFEDBA FFEDBAABBCC AAABCDEEEFF AABBCDDEEFF FFEDDCCCBAA FFEEDCCBAAA FEDCAAACCEF AABBBDEEEFF AABBBCCEEFF AABBBCDEFFF CCCDDEFFDAA
44,FEFEEDCBAAA FFECCBBBBBB EEDDEFEDBAA FFFEDCBBAAA FFEEEDCBAAA AABCCBCDDFF AAABCDDEFFF AAABBCDDEFF AABBCDDEEFF EEFFEDCBAAA FFEEDCBBAAA AABBCCDEEFF AABBCDDEFFF AABCDDEEEEF EEEEEEDCAAA AAABBCDEEFF AABBCCDEFFF AAABDEEEFFE AAACDDEEFEF FFEEDCCBBAA FFEEDDCBBAA FFCBABBCCCD AABBCDEEDFF FFFEDDCBAAA FFEEDCBBBAA BAABBCDEEFF AABBCDEEEEE AABBBCDEFFF AABBCCDEEEF DEFFEEDCBAA FFEDDCCBBAA FEEDDDDBAAA BBBBBCCCDFF AABBCCDEFFF ACEFFEDCBAA DEEEEEDCBAA AABBCDEEEFF AAABCCDEFFF AABBCCDEFFF AABBCDEEEFF AABBCDDEEFF AAABCDEEFFF BBBAABCEEFF AAABCDEEEFF EEEEEEDCBAA FFDBBBBBBCD
45,AACDDDCCCFF ECBBAABCDFF AABBCDDEEFF AABBCDDEEFF AABBCDDEEFF AABCDEEEEEE FFFEDCBBBAA FFEEEDCBBAA FFDBAAABCEF AABBCCDEFFF ACDEEEEEDBA FFEEDDCBBAA FFEEDDCBAAA BAAABCDEFFF AABBCDEEEFF AABCDDEEEFF AABBBCDEEFF AABBCDDEEFF DEFFEEDCBAA FFEEDCBBBAA BBBBBCCDEFF AAABCCDEEFF EFFEEDCBAAA FFFEEDCBAAA AAABCDEEFFE FFFEDCBBBAA FDBABBBCDEF AABBCCDEEFF ACDEFEEEDCB BAAABDEFFFE FFEEDCBBBAA FFEEDCBBBAA FFEEDCCBBAA FFEEDDCCBAA FFFEDDCBAAA EDCBBBAACFF AAABCDEEEFF AABCDDDDEFF BDEDDFFDCAA BBBBBBCDEFF DDDEFEEDCAA EDDEDDDEEAA FFFEDCBBBAA FFFEDDCBAAA FFEDCBBBBBD BBCDEFFEEBA
