,0
92,AAABCDEEFFF AEEEDCAABEF ABDFFEEDCBB FFEEDCCBBAA FEDBCBBAACE EEFFEDCCBAA BBBBBBCEFFF AABCDDEEEEE EEEEEEDCBAA FFEEDDCBBAA FFEEDCCBBAA AABBCDDEEFF AAABBDEFFFF EEEFEDDCBAA FFFEECCBBAA FFFEEDBBAAA FFEDCCBBBBA EEEFFDCBAAA FFEEEDCBAAA FFEEEDCBBAA FFEEDDCBBAA BBBBBBCDEFF AABBCDDEEFF AABDEEEEDDE FFECBAAABEF AABBCDEEEEF FFFEDCBBAAB AABBCCDDEFF AAABCDEEFFF FFFEEDCCBAA FFEEDCBBBAA FFEEDDCBBAA FFEEDCCBBAA EEEDEEECBAA FFEEDCCBBAA DBBAADFFFED DFAABCCDEEE ABBBBBCEFFF EFFEDCCCBAA FFECCCCBBAA DCBBBABCEFF AABBCCDEFFF CCDFFFCAABB FFEEDDCBBAA FFEDCCBBBBA ABCBBBCDEFF
93,AABDEEEEEDD FFFFEDCBAAA AABBBCDDEFF AABBCDEEEFF FFEEEDCBAAA FFEEEDCBBAA FFEEDDCBBAA FFEEEDCBBAA FFEDCBBBBBB AABBCCDEEFF AABBCDDEEFF EEFFEDDCBAA DBAAABCEFEF BAABBCDEFFF AABBCDDEEFF AABBCDDEEFF AABBCCDEFFF AACDDEEEEEE AABBBCDEFFF AABBBCCDEFF BCDEFFFDBAA FFEEEDCBAAA BBAABBDEEFF AACDEFFEDCA FFEEDCCBBAA FFEEDCBBBAA FFECBBCBAFA FFEEDDDCBAA AAACDEEEEEE FFFEDDCBBAA FFEDCCBBBAA FFEECBBAADB BBBBBBCEFFF AABCDEFFFEC DEFCAAABCEF AABBCDDEEFF AABBCDEEEFF DEEEFFEBAAA DDDDDEEEEAA FFEDBBBBBBB FFFEEDBBAAA FFFEDCBBAAA AABBCDEEEFF CEECAAABDFF ABBBCCCDEFF AABBCDEFFEC
94,FCAABBBCDEE AAABBCDEEFF AABBCDDEFFF AABBCDDEEFF AABBCDDEFFF DCDFEEECBAA DECBCBABDFE CEEEEECBCCA FEFFEDCBAAA FFDDCCCCBAA BBAABCDEEFF EEFFEDDCBAA FFFEDCBBAAA AAABCDEEEFF AABDEDCDEFF AABBCCDEEFF AABBCCDEFFE FFFEDCBAABB AEFFEEDBBCA FFEEDDCBAAA FEECBBAABCF AABBBCDEEFF CEEFEEDCBAA FFEEDCCBBAA ECBBABBDEFF AABBCDDEEFF AAABCDEEFFF AABCCDEEEEF AABCDDEEFFE FFEEEDCBBAA FFEEDCBBBAA FDDCCCCBAAF AABBCCDEEFF FFFEDDCBBAA FFFEDCBBAAA BAAACEFFFED DDFFEEBAABC AABCCDDEEFF ABABBCEEEFF AAABCDEEEFF AABBCDDEEFF ABBBBCCDEFF AABCEEEEDEE CDCCBBBBCFF AABBCEEEEFD ABEEDEFECDB
95,AAABCDEFFEE FFFEDCCBBAA FFEDCBBBBBB BABABCDEEFF AABCDDDDEFF AAABCDDEFFF CCCCCCBBEFF AABBCCDDEFF FFFEEDCBAAA FFEDBBAABCE AABBCCDEEFF AABDFFFEDCB FFEEDDCBBAA FFFEDCBBAAA FFEEDCBBBAA AAABBCDEEFF AABBCDEFFED FFEDCBBBBBB AABBBCDEFFF AAABCDEEFFF AABBBCDDEFF AAABCCDEFFF FFEEDCCBBAA FFFEDCCBBAA BAABBCDEEFF AABBCCDEEFF CFFFEDCBBAA DAABBCFFEED CBAAABCEFFF FFEEEDCBAAA FDAAABCDDEF AAABCCDEFFF FFEEEDCBBAA FFEEDDCBBAA FFEDDCBBAAA AAABCDDEEFF CDEFFFDCBAA FFEEDCCBBAA FCAABBCDDEF AABBCCDEFFF AAABCDDEEFF AABBBCDEEFF AABBCDDEEFF AABBCCDDEFF AABBBCDDEFF AABBCCDEEFF
96,FFEDCCBBBBA FFEEDCCBAAA CBAABBCDEFF AAABCDEEEFF AABBCCDEFFF AAACEEFFEED FFEDDBBBBBC FEEEEDCBBAA FFEEDCBBAAA AABBCCDEFFF AABBCDDEEFF AAABCDEFFFF FFEEEDCCBAA FFEEDCCBBAA FFEEDCCBBAA FFEDCCBBBBB AAABBCDEEFF AABBCCDEEFF AABBCDDEEFF AABBCCDEEFF AABBBCDDEFF AAABCDEEEFF FFEEDDCBBAA FFEEDCCBBAA FFECBAAABDE AAABCCDEEFF AABBCCDEEFF FFECBAABDEE AABBCCDEEFF EEEEEDDBBAA FFEDDDCBBAA BAABBCDEFFF AABBCCDDEFF ABDEFFEEDBB FFFEDDCBBAA FFEEDCCBAAA AAABCCDEEFF FECBBBBBCDE AABBCCDEEFF AABBCCDEEFF AABBCDDEEFF AABBCCDEEFF AABBCDEEFFF AABBCCDEEFF AABBCCDEEFF AAABCDEEEFF
97,BAACDDDDFFE FFEEDCBBBAA FFEDCCBBBBA FFEEDCBBAAB FEEEEDCBAAA FFEEEDCBBAA FFEEDDCBBAA FFEEEDCBBAA CBAABCCDEFF AABBCCDEFFF AACDEFFFECA FFEEDDCBAAA FFEDEEDCBAA AABBCDDEEFF AABBCDEEEFF AABBCCDEEFF AABBBCDEFFF AABCDDEDEFF EEEEEDDCBAA AABBBCDEEFF EEFFEDCBBAA FFEEDCBBAAA AAABCDDEEFF AABCDEFFEED FFEEDCBBBAA FFEDCCBBBAA AAABBCDEFFF FFEEEDDCBAA FFEEDCBAAAF AABBCDDEFFF FFEEDCBBAAA FFEEDDCBBAA FFFECCBBBAA FFFEEDCBBAA FFEDCCBAACC ABBBBCDEFFF AABCDDEEEFF ABBBBCDEFFF DEEDDDEEBAA CBEFFECBCBA FFEDEDBABBB EEFCAAACEDD FFFEDCBBAAA FEDDCCCBBBA AABBBCDEFFF FEAABBCEFFB
98,AACEFEDDDDD FECEEDEDBAA ABBBBCCDEFF AABBCDDDEFF ACACBBEFEEE EFEEEECBAAA FFFEEDCBBAA FFEEDDCCBAA FFEEDDCBBAA AAABBCDEEFF AABBCCDEEFF FFEEDDCBAAA FFFEDCBBAAA AABBCDDEEFF AABBCDDEEFF AABBCDDEEFF EEEEEEDCAAA AABBCDEEEFF EFEEEDCBBAA FDCBBBBBCEF AABBBCDEFFF FFEEDCBBBAA AABCEEEEEEE AAABCDDEEFF AABBBCDEFFF FFFEDDCBBAA FFFEDCBBAAA FFFEDDCBBAA FFEEDCBBAAA AABBCDDEFFF AABBBCDDEFF BEFFFEDCBAA FFEEDDCBBAA DBBBCCBBCEF FFEDCBBAABD AAABCDEFFFE FFEEDDCBBAA AADEEEEDEBC CEECABCBDFD AABBBCDEFFF AABBCDDEEFF AABBCCDEEFF AABBCCDEEFF AAABCDEEFEF DBCCBBCDDDF AAABBCDEFFF
99,AAABBDEEFFF FFEEDCBAABA FFFEDCCBBAA FFEEDCCBBAA FFEEDCCBBAA FFEEEDCBBAA AABCDEEEEEE DEEEEEDCBAA FFEEDDCBBAA FFFEDCBBAAA EDBBAABCEFF AAABBCDEFFF AABCCDDDEFF FBDFFCABDCA FFFEDCCBBAA FFEEEDCBBAA FFFEDDCBAAA FEEEEDDCBAA AAABDEFFFED FEDDEEECAAA FDBBBBBBCEF AABBBCDEFFF AABEEEDDDDF BFFFEDCBBAA BBCDCBBCDFF AABDEFFFDBB FFEDCCBBBAA BCDEFFECBAA FFEEEDCBAAA FFEEDDCBBAA AAABCDDEFFF EFFEEDCBAAA FFFEEDCBAAA FFEEDDDCBAA FFFEDDCBBAA FFEEDCBBAAA DBAABCDDEFF AAABCDEEEFF AABBCCDEFEF AAABBDEEEFF ABBBCCCDEFF AABBBCDEEFF EFFEEDCCBAA FFFEECBAAAA EEEEDBAAACF ABBBBCCDEFF
100,ABBDFFDCBDD FFFEDDCBBAA FFEDDCBBBAA FFEDCBBBABC AAABCCDEEFF BCDFFFEDBAA FFEEDDCBBAA FFFEDCBBAAA AAABCCDEFFF AAABCDDEFFF FFFEDCCBAAA FEECBBAABCF FFFFEDCBAAA AABBCDDEFFF AABBCDEEEFF AABCCCDEEFF AABBBCDEEFF AABBCDDEEFF AABBCDDEEFF AABBBCDEEFF AABBBCDEEFF FFFEEDCBBAA FFEEDCBBAAA AAABCDEEEFF CEEEEEECBAA FFEEDCBBBAA CBAABBCEFFF CDDEEEEECAA FFEEEDCBBAA AAABBCDEFFF EEFFEDCBAAA FFEEDDCBBAA FFEEDDCBBAA FFEEDCBBAAA FFFEDBBABBB AABBBCCDFFF AABBCDEEEFF AABBCCDEFFF FFFDCCBBBAA FFFEEDCBAAA DDCBAABCEFF BBBBBBCDEFF AAABCCDEFFF AAACDDEEEEF AABBBCDEFFF DDDDEEEECAA
101,AAABCEEEEFE FFEEDCBBBAA FFFEDCBBAAA FFEEDCBBABA AAABCCDEFFF DDDDDCCBAAF AABBCDEEFFF AABCDEEFFED FFEEEDCBBAA FFEEDCCBBAA BAAABCDEEFF AABBBCDEEFF AABBCDDEFFF FFFDDDCCCAA FFFEDCCBBAA FFEDCCCBBAA CAAABCDEEFF EEEEEEEDBAA FFCBBBBBBCC FFEEEDCBBAA FFEECBAAACE AABBBCDEEFF ACCCCCDFFEC FFFEDBAABCA FDAAABCEEDF ABBBBCDEFFF FFEDCBBBBBB AAABCDDEEFF BDECBCDCCFB FFFEEDCBAAA FFEDCBBAABD FFDBCDDCBAA FFEDDCCBBBA AACDEFFEDBA FFFEDCCBAAA FFFECBBBBBB FFECBAABCDE AABBCDEEEFF DEFFEDCCCAA AAABBDEEFFF AAABCCDEFFF AABBCCDEEFF AABCDEEEFED FFFEECBBAAA EEDCBBABCEF AABBBCCDEFF
102,EFFEEDCBBAA FFEEDDCBAAA FFFEDCCBBAA FFEEDCBBBBA ABDDDDDEEEE AADEEEEEDEA AAADEEEEEEF BBBBBBCDEFF AAABCDDEEFF EFFFEDCBAAA FFEDDCCBAAA AABBCCDEEFF AABBCDDEEFF AACDEEEEEDD AAABCDEFFFC FFDBBBBBCCC AAABBCDEFFF ABDCBBBCEFF AABBBCDEEFF ABCDEEFFDBA FFFEDDCBAAA FFFEDCBBAAA EAABCCCCEEF AABBBCDDEFF FFFEDCBBBAA FFECBABBCCC AABBCDEEFFE FFEDCBBAABF ABCCEEDCDEF DEEEEEDCBAA FFEEDCCBBAA FFEEEDCBBAA BBBBBBCDEFF BDDCCBBBCFF AABBCCDEEFF FFEEDDCBBAA EBAAABDEEFF AABBCDDEEFF AABBCDDEEFF FFFEEDCBAAA EFFEEDCBAAA FFEEDCBAABC AABBCDDEEFF AAABBCDEEFF AABBBCDEFFF BBBCCDEFFEA
103,FFFEDCBBBAA FFEDDCBBAAC AAABCCDEEFF AABBCCDEEFF AABBCCDEFFF ACDDDCDFFDA FFFEDCBBAAA FFEEEDDCBAA FFFEDDCBAAA EEBBAABDEFF AABBBCDEEFF FFFEEDCBBAA FEBABBBCCEE AABBCDDEFFF AABBCDEEFEF AABBBCDEEFF EEEEEECBAAA AABBCDDEEFF AABCCDEEEFF ABBBBCCDEFF AABBBCDDEFF FFFEDCCBAAA FFEDCBBBBBA FFDBAAACDEF AAABCCDEFFF AAABCDDEFFF FFFEDCCBBAA FFEEDCCBAAA FFEEDCCCBAA FFEEDDCBBAA AABBCCCDEFF CDEEFFEDBAA FFEEDDCBBAA FFFEDDCBAAA AAABCDEFFEE FFEEEDCBAAA CABCBBBDEFF AABBCDEEFFE AABBCDEFFFE ABBBBBDEFFF FCCCBBBADFE ABABCCDEEFF AAABCDDEFFF CADEBBDBCFF AABBBCDEEFF AAABCCEEFFE
104,FFFEDCCBBAA FFEDCBBBBBB DDDEEEEDCAA FEFFEDCBAAA FFEEDCCDCAA FEEEDBBAABD AABBCCDEFFE BBBBBBCDEFF AABBCCDEFFF AABCDEEFFED FFEEDCCBBAA CBBAABCDEFF AABBCDDEFFF AABCDDEEEEE CDDEEEEDDBA BAABBCDEEFF AABBCCDEFFF EEEEEEDCBAA FFFEDDCBBAA FFEEDCCBBAA FFEEDDCBBAA FFEDCBBABBB AABBCDDEFFF DEEFFEDBAAA FFFEDCCBAAA FFDCBAABBDE BBCCCCCCCDF AABCCDEEEFF AAABCDEFFFE FFFEDDCBAAA FFEDBBBBBBB FFEEDDCBAAA AAABCCDEEFF AABDEEEEEED FFFEDCCBAAA AABBCDDEEFF AABBCDEEEFF AABBCCDEEFF AAABCDEEFFF AABBCDDEEFF AABBCDDEEFF AABBCDDEEFF AABBBCCEFFF FFFEEDCBBAA FFFEDCBBAAA AABBCCDDEFF
105,FFEDCCBBBAA AABBCDDEFFF FFFEDCCBAAA FFFEDDCBBAA FFEEDCCBBAA FFEEDDCBBAA FFEEDCCBAAA FFEEDDCBBAA FFEEDDCBAAA FFDCBAABCDE AABBCCDEEFF AABBCCDEFFF FFEEDDCBBAA FFECBABBCCD AABBCDEEEFF BEFBABBCDEF AAABCDEEFFF FFFEDBAABBB AABBBCDDEFF AABBBCDDEFF AAABCCDEEFF FFFEDDCBAAA FFEEDCCBBAA FFFEDCBBBAA AAABBCDEEFF AAABCDEEFFF FFFEDCBBAAA FFEEEDDCBAA FEEDCBAABDF AABBCDEEEFF AAABCDEFFEE FFEEDDCBBAA FFEEDCCBBAA FFEEDDCBBAA BBAABCDEFFF FFECBAABCDE FFEEEDCBAAA AAABCDDEFFF FEBAAABDEEF AABBCCDEFFF ABEECBCDDEF AABBCCDEEFF ABBCEFFDACF FFFEDCCBBAA FFEEDCCCDAA AABCCCCDEFF
106,ABAACEEEEEE AABBCDEEEFF AAABCCDEFFF AABBCCDEEFF AABBCDDEEFF ABBBCCCCDEF AAABCDEEFFF AABCCDEEFFF FFFEEDCBBAA FFFEDCCBAAA FFFEDDCBBAA BAABBCDEEFF ABBABCDEEFF BAAABDEFFFF EEFFFECBAAA FFEEDCBBBAA FFFEEDBBAAA FFFEDCCBAAA FFFFECBAAAA FFEEDCBBAAA BBBBBBCDEFF AABBCCDEEFF AABCDEEFEEE EEEEEDCDEAA FFFEDCCBAAA FFEEDCBBBAA FEDBBAABCDE AABBCDDEFFF EEEECBAADEC FFEEDDCBBAA FFEEDCCBAAA EEEEEEDBAAA FFFEEDCBAAA FFEEDDCCBAA CBBBBBBDEFF ABCDFFFCABD AABCCDDEEFF ABBAACDEFFF EEFFEDCBAAA FFFFECBBAAA EEEEEDDBAAA FFFBBCCCCAA BBABBCCDEFF FFEDCBBBBBB FFFFDBBABBB FFEEEDDBAAA
107,FFFEEDCBBAA AEBEFDCBCDE AAABCDEEFFF AAABCCCDEFF CDEEFFDCAAA AABBCDEEFFF EEEEEEDBAAA FFEEEDCCBAA FFFEDCCBAAA AAABCCDEFFF AAABCDEEEFF ACDDFFFECBA AAABCDDEEFF FEEEECBBBBA FFFFEDCBAAA FFEEEDCBAAA EDEEEEEDBBA FFFEDCBAABB AABBCDDEEFF AAABBCDEFFF ABBBBCCDEFF AAABCDEEFFF AABCDDDEEFF CFFEDDDBABA BBBACEFFFDA FFEEDCBBAAA FFEDCCBBBBB AAACEFFFEBB EEFFEDCCBAA FFFEEDCBBAA AACEFEEDDDC FFEEDDCBAAA FFEEDDCBBAA FFEEDCCCBAA FFEEDCBBAAA AABBCCDDEFF AABCDEEEEEE ABBCCCCDFFF ABCDFFEDDBA EBCDEEEEABE AABBBCDDEFF EFFFEDBAAAA AABBBCCEFFF AAACCDDEEFF AABBCCDEFFF EEEFEECBAAA
108,BCDFFEDCBAA EEFFEDCBAAA FDCBAABCDFF AAABCDDEEFF AABCCDDEEFF CBEFFEEEBAA FFFEDCBBAAA FFEEEDCCBAA FFEDDCCBBAA FFDDBBBBBAD AAABCDEEEFF FFEEDDCBAAA DCBAABCCEFF AAABCDEEEFF AAABCDEEFFF AAABCDEEEFF FFFEDBAABBB AABBCDEEFEF AADEFEDDBDC CDBAAACEEEF AABBBCDEEFF FFFEDCBBAAA FFEDDDDCBAA FFFEDBBBAAB AABBBCDDEFF AABBCDDEEFF ACEEDDEDDDD AAADEFEEEDB FFEEEDCCBAA FFFEEDCBBAA FDAABBBCDEF AABBCDDDEFF ABACEFFEEDB FFEEDDCBBAA FFEDCBBBBBA FFEDCBBABBD AAABCDDEFFF AAABCDEEFFF BBBBBBCCEFF AABBBBDFFFF AABBCDDEEFF AAACEDDDEFF FEECBCCDEBA EFFFECAAABB BABBBCCDEFF AABBBCCDEFF
109,FEFEDCCBBAA ECBBAABCEFF AABBCDEEFFF AABBCCCDEFF AAABCDEEEFF AABCDEEEEEF BCCEEEEEEBA FEEDCDEDBAA AAABCCDDEFF AAABCDDEFFF FFFEEDCBAAA FEEFEDCBBAA FFECBAABCDE AABBCDEEEFF AABBCDDEEFF AAABCCDEFFF FFFFEDBAAAB AABBCDDEEFF AABBCDDEEFF AABBBCDDEFF AABBCCDEFFF FFFEEDCBBAA FEDCBAABBDF AAABCDDEFFF FFFEDCCBAAA FFEEDCBBBAA FFEDDCCBBAA FFEEEDCCBAA AABBCDEEFFF FFFEEDCBAAA FFEEDCBBBAA DBAACFFEDCC FFFDDDCBAAA FFFDCBBBBBB BBBBBCCCEFF AABBCCDEEFF AABBCDEEEFF AABCDEEFEDE AABBBCEEFFF AAABCDEEEFF AAABCDDEEFF AAABCDEEEFF AABBCCCDEFF AAABCDEEEFF EEEEEEDCBAA FFCBBBBBCCD
110,BEFFEDCBBAA FFFEDDCBAAA FFEDDCBBBAA FFFEDCCBBAA FFEEDDCBBAA FFEEDDCBBAA FFEEDCBBAAA BBBBBBCDEFF AABBCDDEFFF EEEFEDCBBAA FFEEDCCBBAA FFEDCBBBBBB AABBBCDEEFF AABBCDDEEFF AABBBCDEFFF AABCDEFFFEB FFFDCBBBBBB AABBCDDEEFF AABBCDDEEFF AABBBCDEEFF ABBDEFFFDBA FFEEDDCBBAA FFFEDCBAAAB AABBCDDEEFF AABCDEEFFEC FFEEDCBBBAA FFEDDCCBBAA FFEEDDCBBAA FFEEDDCBBAA BBAABCDEEFF AABBCDEFFFE FFFEEDCBBAA FFEEDCBBBAA FFEEDCCBBAA BBBBBCCDEFF AAABBCDFFFF FFFEDCCBBAA FFECBABBBCC AAABBCDEEFF AADDEEEDDDE BAABBCCDEFF AABBBCDEFFF AAABCDDEFFF ABBBBCCDEFF AABBBCDEEFF AABBBCDEEFF
111,FFEEDCBBBAA FFEEDCBBBAA FFEDCBBBAAE CCBBBBACFFF FDFEECACBAB FEDEDEEDBAA FFEEEDCBAAA FFEEDDCCBAA BAABCCCEEFF AABBBCDEFFF FFFEDDCBAAA FEDCAAABCEF AABBCCDEEFF AABCCDEEEFF BCBABCCDEFF AABBCDEEEFF FFFEEDCBBAA FAABBCCCDEE AAABCDEEEFF BBBBBBCEEFF AABBBCDEEFF DFFFEDCBAAA FFEDCCCBAAB FFDCCCBBBBB AAABCCDEFFF AAABCDEFFEE FFEEDCBBBAA FFEEDDCCBAA FFEEDDCBBAA FFDCBAABCDD AAABBCDEEFF AAACDEEFFED FFEEDDCBBAA FFFEDCBBAAB FEFEEDCBAAA BABBBBCDEFF AABBCDDEEFF AABBCDDEFFF AABBCDEEEFF AAABCDEEEFF AAACCDDEEFF AABCCCDEFFF AABCCCCDEFF AAABCDDEEFF AAABBCDEFFF DDDDDDEFEAA
112,FFEDCCCCBAA FFEEDCCBAAA FFFDBBBBBCC AAACDEEEEDF FEFEDDCBBAA FFEEDDCBBAA DCCBBBBBDFF AABBCCDEEFF AACDEFFEDCA FFEEDDCBBAA FFEDCBBBBBB AABBBCDEEFF AABBCCDEEFF AABBCDDEEFF AABBCDDEEFF BBCDEFEEDCA FFECBBBBBCC AABBCDDEEFF AABBCCDEFFF AABBBCDEEFF DEEFFEDCBAA FFFEDDCBAAA FECBAAABDEF AAABCDDEFFF EEEFEDCBAAA FFEEDCBBBAA FFEEDCBBBAA FFEEDDCBBAA FFEEDDCBBAA FEDCBBAABEF AABBCDDEEFF FFFEDCCBAAA FFEEDCCBAAA FFEDDCCBBAA AABBBCCDEFF AABBCCDEFFF FFEEEDCBAAA FFEDCBBAABC BAABBCDEFFF AAACEEEEEEE AABCCDEFFED ABDEDDDFFBA CDEEEEEDCAA AABCCCDEEFF AABBBCDEFFF AABBCCDDEFF
113,FFEDCCBBBBA CBBBBBCDEFF AAABCDEEEFF AABBCCDEFFF AABBCDDEFFF AABBCDDEEEF AAABCDEFEEF FEEEEDDCBAA CBBBABDEEFF AAABCCDEFFF AABDEFFFDCA FFEDCBAABCD AAABCCDEEFF AABCDDEEEFF CECBBBBCDEF AABCDEFFFEC FFFECBABBBB AABBBCDEFFF FFEDBBBBDCA ABBBBCCDEFF AABBCDEFFFD FFFEDCBBAAA BABBBCDEEFF AABBCCDEFFF ACCEFFEDBAA FFEEDCBBBAA FFEEDCBBBAA FFEEEDCBBAA FFDCAABBDCE FFECBAABCDE FFFEDCCBAAA FFEEDDCBAAA CCCBBBABEFF FFEEEDCCBAA BBBBBBCDEFF AABBCDDEEFF AAABCDEEEFF AABBCCDEEFF AABBCDEEEFF AABBDEEEEEF AAABCDDEEFF AAABCDEEFFF BCBBBBBDEFF AAABCDDEEFF EEEEEDCBBAA FDBBBBBCCDE
114,FFEDCBBBAAD AABBCDEEFFF AABCDDEEEEE EFEEEDEDBAA FFFDCBBCBBA FFEEEDCBBAA FFEEDCBBAAA AABBCEEEFFB FFEEEDCBBAA FFEDBBAABCD AADEFEDCCCD AAABBCDEFFF FFEEEDCBBAA FFEDCBBBBBB DBAAABDEEFF CBCCCBBBCFF AABBBCDEEFF DDEEEEEDCAA AABBCDEEEFF FFEEEDCBBAA FEDCBAABBEF AABBBCDEEFF AABCEEEEEED FFEEEDCBAAA BAAABCEEFFF DEFFEDCBAAA FFEEDDCBAAA FFFEECBAAAB FFEEDDCBBAA FFFEDCCBAAA AAABCDDEEFF AABCDEFEEED FFEEDCCBBAA FFFEDCBBBAA EDCBAAACEFF BBBAABCDEFF DEEFFEDCBAA FFEEDCCBBAA FFEDCBBBBBB FEFFEBAABBB AABCCCDEFFF ABBBBCCDEFF AAABDDEEEEF FFFEDCBBBAA FFFEDCBAABC AABBCCDEEFF
115,FFEEDCCBBAA FFEDCBBBBBB AAABDEEFFEE AABBBCDDEFF AAABDEEEEEF AABCCDEEFFF ABBCDDEEEFE FFFEEDCBAAA AAABCCDEEFF AAABCCDEFFF FFEEDCCBBAA CBAABBCDEFF AABBCCDEEFF AABCCDEEEFF AAABBCDEFFF FFFECBABBBB AABBBCDEFFF AABCDEEEEEE EEEEEEECAAA FFFEEDCBAAA FFEEDDCBBAA FFFEDCBBAAA AAABCDEEFFF AAABCCDEFFF EEFFEDCBAAA FFEEDCBBAAA FEFEEDCBBAA FFFEDCBAABB AABBCCDEFFF AABBCDEFFEC FFEEDCBBBAA FFECBBBBBBB FFEDCBAAADE AAABBCDEEFF AABDEFFEEDC FFEDCBAABBC AABBCDEEEFF AABBCCDEEFF AAABCDEEEFF AAABCDEEEFF AABBCCDEFFF AABBCDDEEFF ABBBBCCDFFF AAABCDDEEFF FFFEDDCBBAA FCAABBCCDEF
116,ABCEDCBDFFF FFFEEDCBBAA CBBBBBCDFFF AAACCCDEFFF FFFEDCBBBAA FFEEEDCBBAA FFEEDCCBBAA FECBAABDCDF AAABCDEEEFF AAABCDEEFFE FFEEDCCBBAA FFFEDCBBAAA BBBBBCCDEFF AABBCDDEEFF AABBCDDEEFF AABBCDDEEFF EEEEEEDDBAA AABBCDDEEFF AACDEEEEEDD BBBBBCCDEFF AAABCDEFFFD FFFEDBBBBAA FFFEDCBAAAC AABBCDEEEFF FFFEDCCBAAA FFEEDCBBBAA FFEDDCCCBAA FFEEDDCCBAA DCCBBBBBDFF AABCEEEEEED FFFEDCCBBAA FFEEDCBBBAA CEFFEBAABCE AAABCCCDEFF AAABCDEEFFF AABBBCCDEFF EEEEEECBBAA FFEEDCBBBAA FDCCCDDDBBA BAAABCDEFFF AAABCDDEEFF AABBCCDEEFF AAABCDDEEFF AABBCCDEEFF AABBBCDDEFF AAABBCDEEFF
117,DFFEDCCBBAA FFEEDCBBBAA CAABBBDEEFF AAABCDEFFEE FECDCCDCEBA FFEEEDDCBAA FFEEDCCBBAA FFEEDDCBAAA FECAAABCDEF AABBBCDEFFF AABCDEFFEED FFEEDDCBBAA FFEDCBAABBC AABBCDDEEFF AABBCDEEEFF AABBCDDEFFF FFFEEDBAAAB AABBCDDEEFF AABCDDEEEEE BBBBBCCDEFF AABBBCDDEFF ACEFFEECBAA FFEDDDCBBAA AAABCDEEFFF FFFEDCCBAAA FFEEDCBBBAA FFEDDCBBBAA FFEEDDCBBAA BBBBBCCDEFF ABEFFEEDCBA FFEEDCCBBAA FFEEDDCBBAA ECDFFEDCBAA FEDCBBBABDF AABBCDDEFFF FFEEEDCBAAA FFEEDCCBBAA AABBCDEEEFF ABBABCCEEFF ABBBBCEFFFC AABBDDDDEFF AABBCCDEFFE ABCBBBCDEFF AAABCDEEEEF AABBBCDEEFF AABCDEEFFEA
118,AABCEEEEEEE AAABBCDEEFF AABBCDEEFFF AABBCDDEFFF AABCEFEDDCE CDEECCEFDAA FEEEEEDCBAA FFEEEDCBBAA FFDCBBBBBCD AABBCCDEEFF AABBCDDEEFF ABCCBBDEEEF ABBBBCDEFFF AABCCDEEEFF ABBBCCCDEFF AAABCCDEEFF AAABCCDEFFF FFFEEDCBAAA FFDCBBBBBCC AAABBCEFFFE FFEEEDCBBAA BAAABCDEEFF EFFFEDCBAAA FFFEDCCBBAA FFEEDCBBBAA FECAABBCCDF AAABCDEEEFF FFEEEDCBBAA FFFEDDCBBAA FFFEDCCBAAA AAAABCDEFFF AABCDDCCEFF AABBCCDEEFF AABBCCDEEFF AABBCDDEEFF ACDFFFECBAA AAABBCDEFFF BBBABBCDFFF FFEDCCBBABB ABBBBCDEEFF AABBCCDEFFF FFFEDDCBAAA FFEEDCCBBAA FFFEDDCBAAA FFFEDCBAAAB AABCCDEFFEB
119,EBADCABDFEF FFFEDDCBAAA FFEDCBBBBBB AABCDDDEEEF EBACDDDBEFC FEEEEDCBBAA FFEEDCBBAAA EEDCBBAABEF AABBCCDEEFF AABCDEFFFEB FFEEDCCBBAA FFEEDCCBAAA AABBBCDDEFF AABBCDDEEFF AABBCDEEEFF AAABCCDEEFF BCDEEFFECAA FFECBBBBBCC AABBCDDEEFF AABBBCCDEFF AABBBCDDEFF CEFFEDDCBAA FFEEDDCBBAA AAABBCDEEFF AACEEFFEDBA FFEEDCBBBAA FFEEDCBBBAA FFEEDDCBBAA FFEEDDCBBAA AABBCDDEEFF FFFEEDCBAAA FFEEEDCBBAA FFEEDDCBBAA FFFEDCCBBAA BBBBBCDEEFF AACEFFEEDCB FFEEDCBBAAA CAAABBDEFFF AABCDDEEEFF AABBCDEEEFF AAABCDDEEFF AABBCCDEEFF AABBCCDEFFF AAABCDDEEFF AABBBCDEEFF AABBBCDEEFF
120,EEEFEDCBAAA FFEEDCBBBAA FFEEDDCCBAA FFFEDCCBAAA FFFEDDDBBAA FFEEEDCBAAA FFEEEDCBBAA FFEDCBBAABD AABBCCDEEFF AABBCDDEEFF FFFEDDCBAAA FFEEDCBBAAA EFFEEDCBAAA BAABBCDEFFF AABBCDDEEFF AABBCCDEEFF AABBCCDEFFF AABBCDDEEFF AABBCCDEEFF AABBBCDEEFF AACDFFFEDBA FFFEEDCBBAA BBABBBCDEFF AACDEFFFDCA FFEEDCCBBAA FFEEDCBBBAA FFEDDDCBBAA FEEDCBAAADF AABBCCDEEFF EFFEEDCBBAA FFEEDDCBBAA FECBAAACDEF AABBCCDEEFF ABCEFFEEDCA FFEEDCCBAAA AABBCDDEEFF AABBCDEEEFF EEFFEDCBBAA BAAABDEEEFF BBBBBBCDEFF ABCEEFEEECA FFFEDDCBBAA FFEDBBBBBBB AABBCCDEEFF AABBBCDEEFF AAABCCEEFFF
121,FFEDDCCBBAA FFFEDCCBAAA FFEDDBBBBBB FFFEDCBBBBA FFFEDCCBAAA FFEEDDCBBAA FFEEDDCBBAA FFFEDCBAAAB AAABCCDEFFF AABBCDDEEFF AABBDEEFFEE FFEEDDCBBAA FEEEEDDCBAA FFFEDCBBAAB AABBCDEEEFF AABBCDDEEFF AAABCCDEFFF AABBCDEFFED FFEEDCCCBAA CBBBBBBCEFF AABBCEFFFEB FFEEDDCBAAA CBBBBBBCEFF AAABCEEFFED FFFEEDCBAAA FFFDCCBBABB FFCBBCDCCCB FEEEDDDDBAA FFFEDCCBBAA FFFEDCCBAAA AABBCDEEFFF FEFFEDCBAAA FFEEDDCBBAA AABBBDDDEFF AAABCCDEFFF AADEEEEEEDB FFEEDCCBBAA FFEDBBBBBBB AABCDEDDEFF FFFEEDCBBAA DBBABBCDEFF AAABCDDEEFF AABCCCCCEFF AADEDDEFEEB AABBBCDEFFF FFDBABBCDDB
122,EEFFEDCBBAA FFFEDCCBBAA FFEDCBBBBAA FFEEDCCBBAA FEDBDEDCBAA FFEEEDCBBAA FFEEDCCBAAA FFEEEDCBAAA AABBCCDEEFF AAABCCDEFFF EEEEFEDBAAA FFEEDDCBBAA AABBCDDEFFF AABCCDEEEFF AABBBCDEFFF EEEEEEDCBAA AAABBCDEFFF AABBCDDEEFF AABBCCDEEFF DEEEEEECBAA FFFEDCCBAAA DEBAABCDEFF AAABCDEEEFF FFFEEDCBAAA FFEEDCBBBAA CBAABBCDEFF AABCCDEEFFE AABBCCDEEFF AABCDEFFEED FFFEDDCBBAA FFEEDCBBBAA FFEEDCBBAAA AAABBCDEEFF AABBCCDEEFF BEEEEEDCBAA FFEEDCCBBAA FFECBABBBCC AAABCDEEEFF AAABCDDEFFF AAABCDEEFFF AABCCDDEEFF AABBCDDEEFF AABBCCDEEFF AABBCCDEEFF AABBBCDEFFF EEEEEEDBAAA
123,FFFEDCBBBAA AABBCDDEEFF DFFFECCBAAA FFEEDDCBBAA CBBAABEFFED FFEEEDCBBAA FFFEDCBBAAA EEEEEEDCBAA FFEEDDCBBAA FFEDDDCBAAA AABBCCCCEFF AABBCDDDEFF FFFEEDCBBAA FFFEDCBBBAA AABBCDEEFFF DEFFFECBBAA AABBBCDEEFF DEEEEEEDCAA AABCCDDEEFF FFEEEDCBBAA FEDBBAABCEF AABBBCDEEFF AACEEEEEDDC FFFEDCBBAAA BAABBBCEEFF AABBCDDEFFF FFEDDCBBBAA AAABCDEEEFF DEEEEEDCBAA FFEEEDCBBAA AABBCDEEFFF FFEEDCCBBAA FFEEDDCBBAA FFEEEDCCBAA FFFEDDCBAAA FFEEEDCBAAA FFCBBCCBCCB CDEEEEEECAA FDBEFEECAAA EEFEEDDCAAA AABBCDEEEEF DDEEFEECAAA AABDFFFEDCB FFFEDCCBBAA FFFEDCBAAAB AABCCCDEEFF
124,AACDEFEEDDC AAABCDEEEFF AAABCDEEFFF AABBCCDEEFF AABBCDDEFFF BBBBBCDEEFF AABCDEEEEEE FFFEEDCBAAA FFFEDDCBBAA FFEEDCCBAAA AABBCCDEEFF AAABCDEEFFF AABBCDDEFFF AAABCDEFFEE FFEEEDDBAAA FFEEDCBAAAB FFEEDCCBBAA FECBAABCDFF AABCDEEEEEF AABBBCDDEFF AABBBCDDEFF ABBBBCDEFFF BBCDDDCBBDF ACEFFEEDCBA FFFEDDCBAAA FFEEDCBBBAA CBAABBCEFFF BCCDEFFFDBA FFEEDDCBBAA CCBBBABCEFF FFEDDCCBBAA FEEEEDCBBAA FFFEDCCCBAA FFFEDCBBAAA FECBDFEDBAA AAABBCDEFFF AAABCDDEFFF AABBBCDEFFF AAABCDEEFFF FFEEDDCBAAA AABBCCDEEFF ABBCDDEEEED BBAABBCEFFF AABCDDEEEEF AAABBDEEFFF FFFEDCBAAAB
125,AABABEFFEDC FFEEDCCBAAA FFEEDCBBBAA FFFEDCCBAAA FFEEDDCBBAA FFEEEDCBBAA FFEEDDCBBAA FFFEDDCBAAB AAABCDEEEFF AABBCDEEFFF FFFEDCBBBAA FFEEDCCBBAA FFFEEDCBAAA CBAABBCDEFF AABBCDEEEFF AABCCDDEEFF AAABBCDEEFF AABBCCDEEFF AABBCDDEEFF AABBBCDEEFF AABBBCDEEFF ABCEEFFEEBA FFEEEDCBAAA DCBAABBCEFF AAABDEEEEEE FFEEDCBBBAA FFEDCBBBBBB ABCDEFFFDBA FFEEEDCBBAA FFFEDDCBAAA AABBCDEEEFF AABEEEEEEDD FDAAABDEEED FFEEEDCBBAA FFFEDCCBAAA FFEEDCBBBAA AAABCDDEEFF AAABCDEEEFF AABBCEEFEBF DEEEECCEDAA FEEFECAABBB DDDDCCDFFBA FFEDCBABDBA AABCCCCCFFF CBBBBBCDEFF BBABBBCDEFF
126,AABCDEFEEED BBAABBCDEFF AABCCCDEEFF AABBCCDEEFF AAABCDEEEFF BBBBBBCDEFF AABCDDDEEFF EEEEEEDCBAA FFEEDDCBBAA FFEDCBAABBD AABBCDDEEFF AAABCDEEEFF AAABCCDEFFF DEFFECCDDAA FFFEDCCBBAA FFEEDDCBBAA FFEDCBAABCC FFFEEDCBAAA BABDBBCDEFF ABBBBBCDEFF AABBBCCDEFF AABBDDEEEFF AAABCDDEEFF ACEEEDDEECA FFFEEDCBBAA FFEEDCBBBAA FDBAABBCDFF AABBCDEEFFF FFEEEDCBBAA FFFEEDCBBAA FFEEDCBBBAA FFEEDDDBBAA FFFEEDCBAAA EECBBABDFFA FFDCDDCCBAA CBBBBBCDEFF AABBCDEEEFF AABBCDEEEFF AABBCDEEEFF EDEEEEEDBAA FFFEDBBBBAA EEEEEEDCBAA FEEEEDCBBAA FFEEDCBBBBA FFFEDCBBBAA FFEEEDDCCAA
127,ABBBBDEEEFF ABDDDCCDDEF AAABCDDEEFF AABBCCDEEFF AABBCDDEEFF AABCCDEEFFE FFEDDCBBBAA FFEEEDDCBAA FFEEDDCBBAA FFEDCBBBBBB AABBBCDEEFF AABBCCDEEFF DEEDAACDCEF FFEEEDCBAAA AABBCDEEEFF AAABCDDEEFF AAABBCDEFFF AACDCCDDEFF CEFFFECBBAA BBBBBBCDEFF FFFEECCBBAA AABBBCDEEFF AAABCDDEFFF FFEEDDCBBAA FFEEDCBBBAA FFEDCCBBBBB AAABCDDEFFF FFEEEDDCBAA AABBCCDEFFF FFFEEDCBBAA FFEEDCBBBAA FFEEDCCCBAA FFFEDDCBBAA DCBAABDFFFE FFFEDCBBAAA FEDCBBBBBCF AABBCDDEEFF AABBCDDEEFF AABBCCDDEFF ABDDDEFFEBA EFEEEDBBCBA AABBCDDEEFF FFEBBBBBBCC FFFCBBBBBBB AABBBCDEEFF EEEEEDDCBAA
128,EFEEEDCBBAA FDBBAABCDFF AABBCDEEFFE AABBBCDEEFF AABBCDDEEFF AABBCDEEEFF AAABCDEEEFF AAABBCDEEFF AABBCDDEFFF FFFEEDCBAAA FFEEDCCBBAA AAABCCDEEFF AABBCCDEEFF AABBCDDEEFF AABBCDDEEFF FFFCBBBBBBC AABBBCDEFFF AABCCDDEEFF AABBBCDEFFF AABBBCDEFFF FFEEEDCBBAA FFEDCCCBBAA BAABBBCEFFF DBBBABBDEFF FFFEDDCBAAA FFEEDCBBBAA FFEEDCCBBAA FFEEDDCBBAA FFECBABCCCB FFEDBAAABDF DEFFEDCBBAA FFFEDCBAABC AABBBCCDEFF AAABCDDEEFF AABBCDEEEFF BBCCCABDEFF AABBCDEEEFF BBBBBBCDEFF AAABCDEEFFE ECAABEFECCE AAABCDDEEFF AABBCDEEEFF ABBBBBCDEFF AABCDEEFFEA FFEEDDCBBAA CABBBBCDEFF
129,FFFEDCCBAAA FFEEDCCBBAA FFEEDCBBBAA FFEEDDCBBAA FFEEDDCBAAA FFEEDDCBBAA FFEEDDCBBAA FFEEEDCBBAA BBBBBBCDEFF AABBCDDEEFF AABCDEEEEEE FFEEDDCBAAA FFEEDDCBBAA FFEEDCCBBAA FFEDCBBBBBB FFEEDCBBAAA AABBBCDEEFF AABBCDDEEFF AABBCDDEEFF AABCDEEFFDE AABBBCCDEFF AAABCCDEFFF FFEEDCCBBAA FFFEDCCBBAA AABBBCDEEFF AABBCDDEEFF AACEEEEEEDD AABCDDDEEFF EEEEEEEDBAA FFEEEDCBBAA FFEEDCCBBAA CBBBBBBDEFF AABCDDEEEEF DEEEEEECBAA FFEEDDCBAAA ECBAABEFEDE FFFEDCBBAAA FFEDCBBBBBB AAADFFFDBDC EEEAADEDCBC ABBEFDBBCEF AABCCEFFECD AAABCCDEEFF DDAABBCEFFD AAABBCDEFFF AABBCCCDFFF
130,EEFEEDCBAAA FFEDDCBBBAA AAABCDEFFED FFEEDCCBBAA FEDBCEEBBBA FFEEDCBAAAD AAABCDEEEFF BBBBBBCEFFF AABBCCDEEFF EFFEEDCBAAA ECCBAABCEFF AABBCCDEEFF AABBCDDEFFF AACDDDEEEED FFFEDBBBBBB AABBBCDEEFF AAABCDEEEFF DEEEEEDCCBA FFEEDDCBBAA FFEEDDCBBAA FFEEDDCBAAA FFEEDCBBBAA DEEFFDCCBAA FFEEDCCBBAA FFFEDCBBBAA BBBBBCCDEFF AAABCDDEEFF ABCEFFFECBA FFEEDDCBBAA FFEEDCCBAAA BBBBBBCDEFF AABBCDDEEFF DFFFEEDCBAA EDCBAAACDFF AABBCDDEEFF AABBCDDEFFF AABBCDEEEFF EEEEEECBBAA FFFEDCBBAAA FFFFECBBAAA FFECCBAABDF AABBCDDEFFF AABBCCDEFFF AAABCDEEEFF EEEEEEDCBAA FFCBBBBBCDD
131,CDEFFEDCBAA FFEEDCBBAAA FFEDCCCCBAA BBAADFEEEED FEEEEECBAAB FFEEEDDBAAA FFEEDDCCBAA FFEEEDCBAAA AAABBCDEEFF AABBCDDEEFF FFEEDCCBBAA FFEDCBAABCD AABBCCDEEFF AABCCDEEEFF ABBBBCCDEFF DDEEEEEDCAA AAABBCDEFFF AABBCDDEEFF AABBCCDEEFF AABBCCDDEFF FFEEDCCBBAA FFFEDCCBAAA FFDDCBBBCCB FFFEDCBBAAA ABBCDEFFEBA FFEDCCBBBBA AAABCDEEFFF DDDFFEECBAA CCBBBBBCEFF AAABCDDEFFF FFEEDCCBAAA FFEEDDCBAAA FFFEEDCBAAA BBBBBBCDEFF AABBCCDEEFF FFFEDDCBBAA FFFDCAABBBC AABBCDDEFFF AABCDDEEEEF AABCDDEFEDD AABBCDDEEFF AAABCCDEFFF ABCABDFECEF DDAABBCEFFF AAABBCDEFFF EEEEEEECBAA
132,FFEDDCBBBAA FDCBAABBDEF AABBCDDEEFF AABBCDDEEFF AABBCDDEEFF AABDEFFEECB FFEEDDCBBAA FFEEEDCBBAA FEDCBAAACEF AABBCDDEEFF AAABBCDEFFF FEEFEDCBAAA FFFEDDCBAAA FFFEDCBBAAA AABBCDEEEFF AABBBCDEEFF ABBCDEEFFEA FEBBBBCCCCD AACDEEEEEED FFFEDCBBBAA BBBBBBCCEFF AABBBCDEEFF FFFEDCBBBAA FFEEDDCBAAA AABBCDEEEFF FFFEEDCBAAA FFDCBBBBCCD AAABCDEEFFF EDFFEEDCBAA FFFEEDCBBAA FFEEDCCBAAA FFEEDDCBBAA FFFEDDCBAAA FFEEDDCBBAA BBBBBBBCEFF AABBBCCDEFF AABBCDDEEFF AABBBCDDEFF AABDEEEEEED FEEDCDEEBAA FFFEDDCBAAA AACEEEEDDDD FFFEDDCBAAA ECBAADFFDBC AAABBCDEFFF EFEEEECCAAA
133,FFFEDCCBAAA FFEEDCCBBAA ECBABBBDDFF AABBCCEEEFF ABACCCDEEFF ABBEFECCFDB FFEEECBBAAA DEFFEEDCBAA FFFDDCAAABC AAABCDDEEFF AAABCDDEEFF FFEEDDCBBAA FFFEDCBBABB AAABBCDEFFF ACEBCCCEEEE AABBBCCDEFF DEEEEEEDBAA AABBCDDEEFF AABBCDDEEFF AABBBCDDEFF AAABCCDEFFF FFFEDCBBBAA FFEDDCBBABA DBBAABCDFFF AABBCCDEFFF AABBCDDEEFF FFFEDCBBBAA FEEEDDDCBAA FFEDDDCCBAA FFEEDCCBAAA AABBCCDEEFF AABBDEFFEED FFEEEDCCBAA FFEEDCCBBAA BBBCCBBCEFF BDEFFEDCBAA FFEDCBBABBB AABCDDEEEFF AABBCDEEEFF AABBBDEEEFF AABBCCDEEFF AABBBCDEEFF AAABCDDEEFF AABBCCDEEFF AABBBCDEFFF AABCCCDEFFF
134,CFFEDCBBBAA FFFEDDCBAAA FFECBBBBBCD ABACCDEDCFE FFEDCBBBBBA FFFEDDCCBAA FFFDCCBBBBA ABBBBCDEEFF AABBCCDEFFF DDEEEEEDBAA FFEEDCCBBAA FFEDCCCBBAA CBBBBBCDEFF AABBCDDEEFF AABBCDDEEFF AABBCDDEEFF BCDDEEFEDBA FFECBBBBBCC AABCDDEEEFF BBBBBCCDEFF AABBBCDDEFF AABDEFFEDCB FFFEEDCBBAA DCBBABBDEFF AABBCDEEEFF FFEEDCCBBAA FFEEDCCBAAA FEEEEDCBAAA EEDCBBAACEF AAABCDDEEFF FFFEDCCBBAA FFEEDCCBBAA FFEDDDDCBAA FFFDBBBBBBB AABBBCDEEFF AAABCDDEEFF FFFEDCCBAAA FFFEDCBBAAA FEEBBBBCBAF AABCCDEEEFF AABBCDDDEFF AABBCCDDEFF AAABCDDEEFF AABBBCDEEFF AABBBCDEEFF AABBBCDEFFF
135,FFEDBBBBBBB FFEEDCCBAAA FFEEDCCBBAA FFEDDDDCBAA FFFEDCBBAAA FFEEEDCBAAA FFEDCBBAACE AAABCDDEFFF AADEEFFECBA EBAABDEFEDC FEDCBAABCEF FFEEDDCBBAA FDBBBBBBCEF AABBCDDEEFF AABBCDDEEFF AABBCDEEEFF EEEEEEDDBAA FAAABCCDEEF AABBCDDEEFF AAABBCDEEFF AABBBCDEEFF FFEEDDCBBAA FFFEDCBAABB AAABCDEEFFF AABBBDEEFFE FFEEDCCBAAA FFEDDCBBBAA FFEEEDCBBAA FFEEDDCBBAA CCBBABBDEFF AABBCDDEEFF AEEFFEDCCAA FFEEDDCBBAA FFEEDDCBBAA FFEECCBBABB AAABCEFFFED FFFECBBAABC AABBCCDEEFF AAABCEEEEEE AABCCDDEEFF AAABCCDEEFF AABBCCDEFFF AAABBCDEFFF AAABBCDEEFF AABBBCDEFFF ABBDFFEBADE
136,CBBBABCEFFF DFEDBAAACDF AACEEEEDDDD AAADFFFEDCB BABBBBCEFFF DEEEEEDCBAA AAABCDEEFFF AABCDDDEFFE FFFEDCCBBAA FFEEDCBBAAA EDBAABBCEFF AABBCCCDEFF AAACEEEDEFF FEEEEEDBAAA FFFEDCBBBAA FFEEDCCBBAA FFEDCBBBBAA FFEEDCBAABB BCBBBBBDFFF CCABBBCDEFF AAABCCDEEFF AABCCCDDEFF AABBCDEEEFF AABCDDEEEEE FAABDEDDDEB FFEEDCBBBAA FFDCBBBBBBC AAABCDEFFED FFEEEDCBBAA FFFEDCBAAAC ADDEFFEDCBB FFFEDCBBAAA EEDDDEEECAA FFFEDCBBBAA FFFFDCBBAAA FFFEEDCBAAA BBBABCDEFFF AACDFFFEDCB CFFFEDDBAAA FEEDCBBBBCB ACCDDCBCEFF FBBBBBBBCFF AACDDBCFFEE FFEEDCCBBAA FFEDDCBABBB AABCCCCDEFF
137,ABCDFFFECBA AABDDDEFEEE FFEDDCBBBAA FFEEDCCBAAA FFEEEDCBBAA AABBCDEEFFF FFEEDCBBAAA FFEEEDDCBAA FFEEDDCBBAA FFFEDCBAAAB AABBCDDEEFF AABBCDDDEFF AAABDEFFDDE FFEDDDDCAAA EEFFEDDCBAA FFFECCCCCAA EEFFEDBBBAA FFFCABBCDBB FFFEEDCBAAA FFEEEDCCBAA FFEEDCCBAAA AABBBCCDEFF AABBCDEEEFF DFECAAABDEF ECBBCBACFFE ABDEFFDCBBD AFFEDDCCBBB AABBCCDEEFF AACEFEDEEDB FFEEEDCBBAA FEDCBBAABDF ACDDEEEEEDD FFEDBBCCBBA FFEEEDCBBAA FFFEDDCBBAA FFEEDCBBBBA FFECCBBABCC AABBBCEEEFF AAABCCDEFFF AABCCDEEEFF BCCCCBACDFF AABBCCDEEFF FFDBBCBABCD ABBABDDDEFF AAABBCDEEFF AABBCCDEFFF
