,0
0,FDBCB EFDBA BBBEF ABDEF ACDDE FEDBA FECBA ABCEF ACEFE EEEBA FECBA FEBBB ABCEF ABDEF ABCEF ABDEF EEEBA ABDEF ABDEF ABCEF ABCEF EFDBA FEDBA ABDEF ACEFC FECBA FECBA FEDBA FEDBA ABCEF AEFDB FEDBA FEDBA FEDBA ECBBF ACEEE FECBA ABCEF ADBEF CCFEA ADFCD ACCDF ABDEF ABDEF ABCEF ABEFC
1,ABEEE FEDBA FDBAB ABCEF ABDEF EFDCA FECBA FEDBA FEDBA DABCF ABCEF ABEFD FEDBA FCABD ABDEF ABCEF ABCEF DEECA FEBBB FEDBA FDBAD ABCEF FEDBA FFDBA ABCEF ABDFE FECBA FECBA FDEBA FBBEC CBADF FEDBA FECBA EEDCA ABCEF FECBA FDBBB ABDEF FECBB ABDEF ABDEF ABCEF ABDEF BDBBF ABCDF ABCEF
2,BFFCA FECBA FECBB EEECA BACFE FEDBA FECBA FEDBA FCBBC ABCEF ABDEF FECBA FECBA ABDEF ABDEF ABDEF ABCEF ABDEF ABDEF ABCEF EEECA FECBA FECBB ABCEF ACFEC FECBA FDBAE FEDBA FEDBA BBBEF ACEED FEDBA FEDBA FEDBA BABFE FECBA DABEF ABDEF ABCEF ACFED ABDEF ABCEF ABDEF ABDEF ABCEF CBBDF
3,EFCBB ABCEF ABCEF ABCEF ABDEF ABDEF FECAB FEDCA FEDBA ABCEF ABCEF EFDBA FEDBA ACCEF ABCEF ABCEF ABDFD FABCE ABDEF CBBDF ABCDF ABDFE FECBA EEEBA ABCDF ABDEF EFCBB DAEEE CEFDA FEDBA FCCBC ABCEF EEECA FECBA FECBA ACEED FEBAD ABDEF ABCEF ABDEF ABDEF ABCEF ABDEF ABCEF ABCEF CDEEA
4,FEBCA FECBA BBBEF ABDEF ABCEF EEECA FECBB ABCEF ABCEF FEDBA FECBA BBCEF ABCEF ABDEF ABDEF EEEDA FBBCD ABCEF ABDEF ABCEF ACEFB FECBA FDBAD ABDEF BEFEA FECBA FDBBB FEDCA FEDBA BACEF ADFEC FEDBA FECBA FEDBA EBBBF ABEFD FDCBA ABDEF FDCBA EEECA FEDBA FEBBA FECBA FEDBA CBBDF ABCEF
5,FCCCB ABCEF ABDEF ABCEF ABDEF BBBCF ABEEE CEFCA FEDBA FECBA ABDEF ABCEF ABCEF FDCBB FEBBB FDCBA FFCAB EEDDA FCBBB FEDBA CBBCF ABCEF ABCEF DEECA FECBA FECBA FCBBC ABCEF EEECA FEDBA FECBA FEDBA FEDBA FEDBA FDBBC ABCEF ABDEF ACCFF DEBCC EFCAB DFEBA ABCEF FDBAC ACDFE ABCEF EEDBA
6,ABEEF FDBCB FECBB FEDBA EEEBA BACEF FEDBA FECBA FECBA FDBBC ABCEF ABDEF FEDBA FEABD ABDEF FFCBA FBABD AEBEE FEDCA FEDBA FEDBA CBBDF ABDEF ABDEF BBCEF ABBFF ABCEF ABCEF ABDEF EEECA FECBA CBBCF ABCEF DFCDA FECBA FECBA FECBA FDECA CBBBF BBBFF EBBDE EFDAA ABEEF FCBBB FDBAC ABCEF
7,FECBA FECBA AADEF ABDEF ABEEF DFCCA EEDCA FEDBA FECAB ABCEF ABDEF FEDBA FECBA ABDEF ABDEF ABCEF ABCEF FDBBC ABDEF ABCEF ABCEF ACFEC FECBA FEDBA ABCEF ABDEF ABDEE FECBA FEDBA FEDBA FCABF ABDFE FEDBA FECBA ACFED FDCBA FBACE ACDEF FEBBB ACEDF ABDEF ABCEF ABDEF BDDEB ABCEF ABCEF
8,EFABB FECBA FECBA FEDBA FEDBA FEDBA FECBA BBBDF ABDEF EEEBA FECBA FECBA ECABF ABDEF ABDEF ABDEF BDEEA FDBBC ABDEF BCBDF ABCEF FECBA FECBA ABCEF ABDEF FECBA FECBA FEDBA FEDBA FECAB ABCEF ADEED FECBA FEDBA FECBA AFECA BABEF ABDEF ABDEF ABDEF ABDEF ABCEF ABCEF ABCEF ABCEF ACFEB
9,DFEBA FECBA EBBBF ABDEF ABCEF ACEEE FDCBC FCCEA FECBA EBADE BBCEF FEDBA BABEF ABDEF ABDEF ABCEF FEBBB ABDEF ABDEF ABCEF CEFDA FECBA FEDCA BACEF ABDEF ABDFE FECBA FEDBA FEDBA FECBA ABCEF BEFEA FEDBA DBBCF ECABF ABEEE FECBA ABCEF ACDEF ABCEF ABCEF ABCEF ABDEF ABEDF ABCEF ABCEF
10,EDABE FECBA ABCEF ABCEF ABDEF ADFEA FECBA FECAB ABCEF ABDEF EEEBA FECBA FEDBA FECBA FDCBA FECBA ABCEF ABDEF ACDEF FEDBA FECBA ABCEF ABDEF FECBA FEBAC ABDEF ADEEE ABCEF ABDEF FEDBA FCABE FCDDA FDBDA FEDBA FEDBA FDBBB ABDEF ABDEF DECEA ADDED ABDEF EBCDD AACEF BFDDA ABCEF EEEBA
11,FECBA FECBA FECBA FECBA FEDBA FEDBA FEDBA FEDBA ABCEF ABDEF ABDEF FECBA FEDBA FECBA CACEF ABDEF ABCEF ABDEF ACDEF BBBDF ADEFB FECBA FECBA BBBDF ABDEF ACDEF FECBA ACDEF FEDBA FEDBA FECBA CCBBF ABDEF FEDBA FEDBA CABEF BFECA FEDBA FDBBB AEEDD ABCFE ABCEF ADCCF ACEEF ABCEF ABDDF
12,CFECA FECBA FDCBB ABDEF FDCBB FEDBA FEDBA FEDBA FECBA ABCEF ABDEF ABEEE FEDBA FECBA FDBBB ABDEF ABCEF ABDEF ABDEF ABCDF ABCEF ABEEE FEDBA BACEF ACEED FECBA FEBBB EEECA FEDBA FEDBA FECBA ABDEF AEEEC FEDBA FDBBB ABDEF EEDCA FECBA ABDEF EFBAC FECCA BACEF ABDDF ABCEF ABCEF ABEFD
13,FEDBA FECBA FECBA FECBA FEDBA FEDBA FEDBA ABCEF ABDEF FEDBA FECBA FEDBA ABCEF ABDEF ABDEF FFBAB ABCEF ABDEF ABCEF ACEFB FEDBA FCABF ABDEF FEDBA FECBA FCBBC ADEEC ABCEF ACEEE FEDBA FECBA FEDBA ABCEF ABDEF EEDBA FEBAB ABDEF ABDEF EFDBA FCBAE EEEBA FEDBA FDABD ABCEF ABCEF ABCEF
14,ABEEF ABEEE FCABE ABDEF ABCEF CFECA FECBA FEDBA FECBA FECBA BBCEF ABDEE FECBA FECAA ABDEF ABDEF ABCEF ABDEF ADEDD DBACF ABCEF DEECA FEDBA FCABE ABDEF ADEED FEBBB FEDBA CEEDA FEDBA BACEF ABDEF DABFD FEDBA FECBA FDCBB FDBBB ABDEF ABCEF ABDFE ABDEF BBBDF ABDEF BBBDF ACCEF ABCDF
15,FECBA FECBA BABDF ABCEF ABDEF EFDCA FECBA FEDBA ABCEF ABDEF CFECA FEDBA FEDBA BACEF ABDEF ABDEF ABCEF ABCEF ABDEF ABCEF ABCEF FEDBA FECBA BBBDF ABDEF DFEBA FDBBB FFDBA FEDBA FEDBA FECBA BBBEF ADEEB FEDBA FDBBC ABDEF DECEA FDCBA ABDEF ABDEF ABDEF ABDEF ABCEF ABDEF ABCEF ABCEF
16,ABEFD FECBA FECBA FECBA FECBA FEDBA FECBA FEDBA ABCEF ABCEF EFDBA FEDBA FECBA BBCEF ABEEE ACCDF ABCEF DEEDA ACEDF ABCDF ABDFF EFEBA FDCCA FECBB ABCEF ABCEF ACEEE FECBA FEDBA DACCF ABCEF FEDBA FEDBA FEDBA CBADF ACEED FEDBA FCBBC ABCEF ABDEF ABCEF ABDEF ABDEF ABCEF ABCEF ABBEF
17,DCBBF ACEEE FECBA FECBA FECBA FEDBA FECBA FEDBA FECBA ABCEF CEFDA FEDBA FBBBD ABDEF ABDFE ABCEF EEEAA ABDEF ABDEF ABCEF ABCEF FEDBA FBBDB FCCBB BADFC BFECA FECBA FEDBA FECBA ABEEE BACFF FEDBA FECBA FDBBB ABDFF ABCEF ACEFC FECBA FBBCC ABDEF ABDEF ABCEF ABDEF FECBA FECAB ABCEF
18,EBEEA FECBA FECBA FECBA FECBA FECBA FDCAC ABCEF ABDEF FECBA FECBA ABCEF ABDEF ABDEF EEEBA ABCEF ABDEF ACDEF ACBDF EEDBA FEDBA FECBA ABDEF ABCEF FECBA FBABE ABDEF FEDCA FDABD ABDEF ABEEE FEDBA FEDBA BBCDF ABDEF AEFDA FECBA ABDEF ABDEF ABDEF FCBBC FEDBA BBAEF ACBEF ABCEF DEDEA
19,FBBCD FEDBA FDCAB EEECA FFCBA FEDBA FECBA ABCEF ADEED FEDBA FECBA FECBA BBCDF ABDEF ABDEF DEEDA EABDE ABDEF ABDEF ABCEF CEFDA FECBA FCABE ABDEF ACEFC FECBA FECBA FEDBA BBBEF ABCEF ADFEC FEDBA FECBA FECBA FEDBA CBBDF FEBBB FECBA ABEEE ABDEF ABDEF ABCEF ABDEF ABCEF ABCEF ABCEF
20,FECBA AACEF ACEEE FECBA FECBA FDDBA FDBBC ABCDF FEDBA FECBA BACEF ABCEF EEDBA FECBA FECBA FECBA ABCEF ADFFB FABCE ABCEF ABCEF ABCEF EFDBA FECBA ABDEF ABDEF FECAB FEDBA FEDBA BADFE AADFE FEDBA FECBA CBBCF ABDEF EEECA FECBA EACDE ABDDF EEEBA EFDBA ABCEF ABDEE EEAAE DCBBF ABCEF
21,FFDBA FEABC BDCBF BEFBA FDEBA FECBA ABCEF ABCEF ABCEF FEDBA ABCDF ABCEF ABDEF ADFEB FDCBB ABCEF ABDEF FEDBA EEECA FECBA FECBA FECBA BBDFC FECBA FECBA ABCEF ABBEF ABCDF ACEFC FEDBA EAADF BBBDF ACEEE FDCBA ABDEF ABDEF ABDEF CDEEA FECBA FEDBA FCACE ABDEF ACEEE ABCEF EEDBA FCBBC
22,ABEEE FEDBA FDCBB FEDBA FEBCA FEDBA FECBA FEDBA FEBBB ABCEF ABDEF BEFDA FEDBA FECBA ABDEF ABDEF ABCEF ABDEF ABDEF ABCEF ABCEF FEDBA FECBA ABCEF ABDEF FECBA FECBA FEDBA FEDBA ABCEF ADFEC FEDBA FEDBA FEDBA ABDEF FEDBA FECAB ABDEF ABDEF BCEFC FDCBA ABCEF ABDEF AEECE ABCEF ABCEF
23,DFABD ADFEB AEDDE ABCFF ABDEF ADFEC FDBBC DEFBA FDABD ABDEF ABEFD FEDBA FCBBC ABDEF FECBA BBBDF EEEDA ABCEF ABDEF BBBDF ABCDF ABDEF FECBA FEDBA ABCEF ABDEF BFEBC EEBBC BADFF FEDBA FDCAB ABCDF EEDCA FEDBA FDACC FDCBA ABCEF ABDEF ABCEF ABDEF ABCEF ABDEF ABDEF ABDEF ABCEF ABCFF
24,BACEF ABDEF ABCEF ABDEF ABDEF ADEEB FECBA FEDBA FEBAB ABCEF ABCFE FEDBA FEDBA CBBDF ABDEF ABCEF ABCEF EEDBA ABDEF FEDBA FECAB ABCEF ABDEF FEDBA FCABF ACEED CDFDA FDEBA FEDBA FECAB ABDEF FDDDA FEDBA FECBA FECBA ACEFD FECBA AAEEE FDBBB ABCEF ABDEF ABCEF ABDEF ABCEF ABCEF BEEDA
25,EFEBA FEDBA FEDBA CAFEC FECBA FECBA EABDF ABCEF ABDEF FEDBA FEDBA FBBCD ABCEF ABDEF ACFEB FBBBC ABCEF BACEF ABDEF ABCEF FEDBA FECBA EBACF ABDEF ABCFD FECBA ABDEF FEDBA FEDBA BABEF ABCEF ABCEF FEDBA FECBA CBBCF ABDEF EFDBA FECAB ABDEF ABCEF ABCEF ABCEF ACBDF ADEDF ABCEF EEECA
26,FECBA FECBA AACFF ABDEF ACCEF EEEBA FEBCA FEDBA AACEF ABCEF FEDBA FECAB ABCEF ABDEF ACCDF ABDEF FECAB ABDEF ABDEF ABCDF ABCEF FEDBA FDCCA ABBDF ABCEF FECBA AADEF FEDBA FEDBA FDECA ABCEF AEEEB FEDBA FEDBA ABDFE FECBA ABCEF ABDEF ABCEF ABCEF ABDEF ABDEF ABDEF ABCEF ABCEF ABEEE
27,FDBAD BCBEF ABCEF ABDEF ABEFE EFDCA FECBA FEDBA FECBA BBBCF ABDFF FEDBA FEBBB ABCEF ABDEF ABCEF CDEEA ABDEF ADEEE FECBA BBBDF ABDFE FEDBA FDCCA ABCEF ABCEF ABDFE ACDEE BCEFA FECBA FECBA ABCEF ACEFD FEDBA FECBA AEEDA FECBA ACEEE BEBFB ACDED EFCBA ABCEF ABDEF ABCEF ABCEF CCBCF
28,FDBBB FCABE ABCEF FEDBA DBAFE FEBBB ABCEF ABCEF ABDEF FECBA DABDF ABCEF ABDEF BEFEA FECBA ABECF ABDEF DEEDA FEBBA FECBA FECBA BBCFE DDEDA FECBA FECBA ABCEF ABCEF ABEEE FEDBA FEDBA CABEF ABCEF ABCEF ABDEF FEDBA BABEF ABDEF ABDFE FDBCA FEDBA EBACF ABCEF ABEEF ABDEF EEECA FBBCD
29,FFCBA FECBA FECBA EBBDF ADDDE EEDBA FEDBA FEDBA FECAB ABDEF ABDEF ACEEE FEDBA FECBA FECBA ACEDF ABCEF ABDEF ABDEF FEDBA BBBDF ABCEF EFDBA FECBA BBBDF ABDEF FECBB ABCEF EFDBA FEDBA FECBA FDBAE ACEEE FECBA FECBA AADEF FDDDA FEDAA BBCDF ADDDE BACEF ABCEF ABDEF ACDEF ABCEF ACEFB
30,DAADF FEDBA BBCDF ABDEF ABDEF EEECA FECBA FEDBA ABCEF ABDEF FECBA FEDBA FDBBB ABDEF ABDEF ABCEF ABDEF DEECA FDBBB FEDBA BBBDF ABCEF DFDCA FEDBA CABDF AFFCB FECBA ABCEF FFCBB CCBCF FECBA FEDBA FDBBB CCEFA CBADF FEDBA FECBA ACEEE FECBA FEDCA ABEEE ABCEF ABEEE FECBA BBBDF ABCEF
31,AADEF AACEF ACDEF ABDEF ABCEF ABDEF ABDEF ABEFD FEDBA FEDBA FCABE ABDEF ABCEF ACEED FEBBA FECCA FCBBB FECBB FEDBA FEBAB BBCDF ABCEF ACEEF EEECA FECBA FECBA BBCEF ABDEF FEDBA DEFCA FECBA FEDBA FEDBA FEDBA FECBA ABCEF ABDEF ACDEF DFECA EDECA EEDCA EFEBA FEDBA FEDBA FECBA EEECA
32,FCCCA FDBBB ABCEF ABDEF ABDEF EEECA FEDBA FEBAB ABCEF ABDEE FECBA FEDBA FCABE ABDEF ABDEF ABDEF FFCAB ABCEF ADFEA BCEFB ABCDF BFEBA FEBBA ABCEF ADDEE EFDBA FCBBC ABDEF EEECA FEDBA AEDED FFCAB FEDBA FECBA FECBA ACDEF BBBCF DFEAA DEBEA EEECA FBCBC ABDFE BDFEA FEDBA ABCEF FFCBA
33,FECBA FECBB ACFEC FECBA EFEBA BBBDF ABCEF ABCEF ADFEB FECBA FBACF ABCEF ABCEF ABDEF BBBDF FEBBB ABCEF ABDEF DFBAC ABCEF FEDBA FEDBA ABDEF DDACF FECBA FCBBC ABDEF FEDCA ABCEF ABCEF FECBA FECBA FECBA ACEEF ABDEF FECBA ABDEF ABCEF ABDEF ABDEF ABDEF AADEF DBBCF ABDFF FEDBA DBAEF
34,AEEEC FECBA EDABF ABDEF ABCEF BDFEA FECBA FEDBA EBACF ABCEF ABCEF FEDBA FDBBC ABDEF FCCBD ABCEF FFDAA ABDEF ABDEF ABCEF ABCEF AEFEB FECBA FBACD ABCEF CFFCA FECBA FEECA FEDBA BABEF ABCEF FEDBA FEDBA FECBA ABCEF BACEF FECBA FDBBB ABCEF ABCEF ABDEF ABCEF ABDEF ABCEF ABCEF ABDFE
35,BBBDF ACEEE ABCEF ABDEF BACEF EEEBA FECBA BBBDF ACDEF BBEEB FECBA FECBA BBBDF ABDEF ABDEF ABCEF FEDBA ABDEF ABDEF ABCEF ABCEF BFFCA FDBAD ABDFE FECBA FECBA FDDBA FECBA EAAEF ABCEF FEDBA FEDBA FEDBA BBBDF ACEEF ABDEF CEEDA FEDBA FECBA ABCEF ABCEF ABCEF ABDFE ABCEF ABCDF ABDEF
36,EFDBA FECBA FECBA FECBA FEDBA FEDBA FEDBA FEDBA CBBDF ABDEF ABDFE FECBA FEDBA FEDBA FECAA EFCAC ABCEF ABDEF ABDEF ABCEF ABCDF ABDEF FEDBA FECBA ABCEF ABDEF DFEBA FEDBA FEDBA FEDBA FECAB ABCEF ABDEE EEECA FEDBA ABEED FECBA ABCEF ABCFF ABFFC DDBBE CFABE ACFEB ABCEF ACBEF ABCEF
37,BEEDB ABCEF CACEF BBBEF DEEBA ABDEF DFEBA FEDBA FEDBA ECACF ABCEF ACCEF ABEEF AECED FCDCA FDBBC CCDFA FCBBC ABDEF ABCDF ABCDF ABDEF ABCEF ACEED FECBA FECBA FCBBC ABDEF FEDBA EFDBA FDCBA EEEBA FEDBA BACEF ABCEF ABCEF ABDEF BECBF ABEEF ABDEF BDFDA DCEEA FEDBA FEDBA FEBAB DFBEA
38,EEDBA FECBA FECBA FEDBA FEDBA FEDBA FEDBA FEDBA ABCEF ABDEF DFECA FEDBA FEDBA FDABD ABDEF ABDEF ABCEF ABCEF ABDEF ABCEF EEECA FEDBA FEBBB ABCEF ABDEF BEFDA FECBA FEDBA FEDBA FEDBA FECBA ABCEF ABDEE FEDBA FECBA FDBBC ABDEE FEEBA FABDE ACDEF ABDEF ABDEF ABCEF ABDEF ABCEF ABCEF
39,BEFCA FECBA FECBA FECBA FEDBA FEDBA FECBA FEDBA FDBBC ABCEF DEEDA FDCCA ECACF ABDEF ABDEF ABCEF ABCEF ABDEF ABDEF BCEFB FEDBA FECBB ABDEF CEFCA FECBA FCBBC ABDEF FEDBA ABDFE DBBCF ABDFF FEDBA FEDBA FEDBA ADFEC FECBA ABCEF ABDEF BEDFA ADBFE ABDEF ABDEF ABCEF ABDEF FADBE ABCEF
40,FECBA FECBA AEFDA FECBA FECBA FEDBA FECBA BBBEF ABDEF ADEFA FECBA DABDF ABCEF ACDEF BBBDF FEEBA ABCEF ABDEF ABCEF BCCFC FEDBA FECBA DEBFA FEBAB ABCEF FDBBC ABDEF FEDCA BBCEF ACCDF BEFDA FEDBA FECBA FEDBA ABCDF ABDFE FEDBA ABDEF ABDEF ABDEF ABDEF ABDEF ABCEF ABDEF ABCEF CDEEA
41,FECBA FECBA FECBA FDCAB CCBBF EEDBA ABDFD CCBBF ABCEF ABDFE FECBA CABEF ABCEF ACDEF AADEF FBBBC ABCEF ABDEF ABDEF CEEDA FEDBA FECBA AADFF FDBAD CEFCA FDCBB ABDEF FEDBA ABCEF ABCEF EFDBA FEDBA FECBA BBBCF ABEEE FECBA BBBEF ABDEF ABCFF ABDEF ABDEF ABDEF ABDFE AACFF ABCEF FFCAB
42,FEDBA FECBA FECBA ABCDF FDDAC EEDCA FEDBA FEDBA FDBAE ABDEF ABDEF EFDBA FEDBA FECBA EACDE ABCEF ABCEF ABDEF ABDEF ABCEF ABCEF FEDBA FDCBA ABCEF ABDEF FEDBA FECBA FECBA FEDBA FEDBA AADEF EEECA FEDBA FECAB ABDEF FEDBA FDBBB ABDEF ABDEF FEBBB FDCBA BBCEF ABDEF ABCEF BBCEF ABCDF
43,FEDBA FDCBA FECBA FECBA FECBA FCCCB BABEF ABCEF ABDEF FECBA FECBA ABCEF ABDEF ACDEE EEEBA ABCFF ABCEF ABDEF ABDDF EEECA FEDBA FECBA ABCEF ABDFE FECBA DABDF ABDEF FDBAE ABDEF ABEFD FECBA FECBA FEBAC ABEEE BACEF ADFEA FDABC ABDEF ABDEF FDCBA FECBA ECACF ABDEF ABCEF ABCEF CDEFA
44,FEDBA FDBBB EDFDA FECBA FEDBA ACBDF ABDEF ABCEF ABDEF EFDBA FECBA ABCEF ABDEF ACDEF EEEBA ABCEF ABCEF ABEEE ABDEE FECBA FEDBA FBBCC ABDDF FEDBA FECBA ABCEF ABDEE ABCEF ABCEF EFEBA FECBA FDDBA BBCCF ABCEF BFECA EEECA ABDEF ABCEF ABCEF ABDEF ABDEF ABDEF BABEF ABDEF EEEBA FBBBC
45,ADDCF DBACF ABDEF ABDEF ABDEF ACEEE FECBA FEDBA FCABE ABCEF BEEEA FEDBA FEDBA BACEF ABDEF ABDEF ABCEF ABDEF EFEBA FECBA BBCDF ABCEF FEDBA FEDBA ABDEF FECBA EBBCF ABCEF AEEEB BADFE FECBA FECBA FECBA FEDBA FEDBA DCBBF ABDEF ACDEF CDFDA BBBDF DEEDA DEDEA FECBA FEDBA FDBBC BDFEA
46,CEFCA FECBA FECBA FECBA FECBA FEDBA FEDBA FEDBA ABCEF ABDEF DEECA FECBA FEDBA FECAB ABDEF ABDEF ABCEF ABDEF ABDEF ABDEF ABCEF ACFED FECBA CBBDF ABDEF FECBA FECBA FEDBA FEDBA BABEF AEEDB FEDBA FEDBA FDBBB ADFED FECBA ABCEF ABDEF AACFF ACEEC ABEDE ACCEF ABCEF ABCEF ABCEF ABCEF
47,FDCCA FDDBA FDBBC ABDEF ABDEF EEECA FECBA FEDBA FECBA BABDF ABCEF ABDEF EEDBA FECBA FECBA ABCEF ABCEF ABDEF ABDEF BBBDF BBCDF ABCEF FEDCA FEDBA EBACF ABDEF FDBBB ABCEF EEECA FEDBA FECBA BBBEF EEEBA FEDBA FECBA BBCDF ABDEF ABDEF AAEFE EEECA FEDBA ABCEF ABDEF ABDEF ABCEF ABCEF
48,BBBDF AEEDC FDBAC ABCEF ABCEF EEECA FECBA FEDCA FEDBA FECBA ABCEF ABCEF DFEBA FECBA CACEF ABDEF ABCEF CEEDA ACDEE FEDBA FDBAB ABCEF ACEEE FECAA ABDFE FECBA FBBBD CDFDA FEDBA BABEF ADFDC DBEFA FEDBA FCBCB FECAA ABDEF FEDBA FECBA FECBA FBACD ABDEF ABCEF ABDEF EDABF CBBCF ABCEF
49,ADEED DFEBA ABCEF ABDEF ABCEF DFDCA FECBA FEDBA FEDBA FECCA ABCEF ABDFE FCBCB ABDEF ABDEF ABDEF ABCEF ACDEF FFDBA BBBDF ABCEF FECBA FECAB ABDEF ACEFC FECBA FECBA FEDBA FEDBA ABCEF FEDBA FEDBA FEDBA ECBAF BFEDA FEBBB ABCEF ACDEF DFECA EBBED FEDBA FEBBB FDDBA FECBA ABCEF ACEBF
50,FCCCA FECBA FECBA FECBA FEDBA FEDBA DCBBF ABDEF EEDCA FEBAC FEBAC ABCEF ABCEF ABDEF ABDEF EEECA FBBCD ABCEF ABEFD ABCEF CEFCA FEDBA BACEF ACDEE FECBA FECBA ABCEF FEDBA FECAC ABDEF FECBA FEDBA FDDBA CABDF ACEEE BFECA FDBAD ABDFF BAFDE FEDBA BADDF ADEED FDBBC ABEEF ABCEF DEFAA
51,FFBBB CBBDF ABDEF ABDEF ABDEF BEEEA FEDBA FEDBA FBACF ABCEF ABEFE FEDBA FECBA FBACE ABDEF ABDEF ABCEF ABDEF ABDEF ABBEF ABCEF AEFDB FEDBA FCBAE ABDEF BFEDA FDBBC ABDEF ABDEE FEDBA FECBA CBFCC ABCEF ACFED CFEBA DCACF ACDCF ABEFD CEFCA EDEBA FDCBA FEBCA EEDCA FEDBA BBBDF EEEBA
52,AFEDC FEDBA FDBBB ABDEF FDEBA DEFDA FEDBA FEDBA FDBAD ABCEF ABDEF CFEBA FEDBA FEDBA FECBA FDCBA ABCDF ABDEF ABDEF EEECA FECBA ABCEF ABDEF FEDBA FECBA ABCEF ABDEF ABEEE FEEBA FEDBA FECBA CBADF ABDEF ACEED FEDBA FDABD ABDEF FEDBA FECBA FBBCC ABDEF ABCEF ABDEF ABCEF ABBDF ABCEF
53,ADBDF FFDBA FCABE FEDCA FECBA FEDBA FECBA ABCEF ABDEF EEEBA FECBA ACFEC FECBA ABCEF ABDEF ABCEF ABDEF FEDBA ACDEF FEDBA CBBCF ABCEF FECBA FEDBA ABCEF ABDEF FECBA EEECA FECBA FECAA ABCEF EEDBA FEDBA FEDBA FECBA ACFEC ABCEF AEDDE FECBA ABEEF ABCEF ABCEF ABCEF BBBEF ABCEF BDFEA
54,ADEED FCBBD ABCDF ABDEF ABDEF EEDCA FECBA FEDBA FDBBC ABCEF ABDEF FEDBA FECBA ABCEF ABDEF ABCEF ABCEF ACDEF ADCEF ABCDF ABCEF EEECA CABEF EFEBA FECBA FDCBA ABEEE BBBDF AEEDC FEDBA FECBA FECBA BDCCF ABFDD DBADF ABDEF ABDEF ABCEF DEEDA FEBBB FFCBA FECBA ABDEF FFBAB BBBDF ACECF
55,FFCBA FDBBB ABCEF ABDEF ABDEF ACDEF FCBAD EEDDA EEEBA CABEF BBEFB FECBA EABDF ABDEF ABCEF ABCEF FEDAA ABDEF ACDEE BBBDF ABCEF BEFDA FECBA FCABD ABDEF AEFDB FECBA FECBA FEDBA FDABE ABDEF EFDBA FEDBA FECBA FDBBB FECAB ABCEF ABDEF ABDEF ABDEF ABDEF ABDEF ABDEF ABCEF ABCEF ABCFE
56,FDCBB ABDEF FECBA ACEEE FCACD FEDBA FECBA EEECA FEDBA FECBA FECBB ABCEF BDFEA FEDBA ABDEF ABCDF ABCEF FEDAA ACDEF FEDBA FDBAC ABCEF ADEED FEDBA ABDEF ABEEE FDBBB ABDEF BEFEA FEDBA ACEEE FDCCA FDDCA FEDBA FEDBA FECBA EBACF ADEEC FECBA BBBDF EFDBA FEABC CEFCA FECBA FECAA EECAD
57,FDDBA ABCEF ABDEF ABCDF ABDEE ABCEF BACFF FEDCA FEDBA FECAB ABDEF ABDEF ABDEF FEEBA FDDBA FECBA FEDBA FECBA DFEBA FEDBA BBCDF ABDEF ABDEF ABFFC CEDEA FECBA FDBBC ADFDC FEDBA FECAB FFDBA FEDBA FEDBA FEDBA FECBA AACEF ABDEF ABDEF ABCEF ACEEE BBCEF ABCEF ABDEF ABDEF ABCEF FEDAA
58,BCAEF FEDBA FECBA FEDBA FECBA FEDBA FECBA ABCEF ABDEF FEDBA FECBA FECBA ABCEF ABDEF ABCEF ABDEF FEDBA ABDEF ABDEF ABCEF ABEFD FEDBA FEBAC ABDEF BEEDA FECBA FDCBA FEDBA FEDBA CBADF ABCEF FEDBA FEDBA FEDBA FECBA BBBDF ADEDE FDBBB DEEBA ACDDF ABCEF ABCEF BAECF FECCA ABCEF ABCEF
59,FDCBA FECBA FECBA FEDBA FEDBA FEDBA FECBA ABCEF ABDEF FECBA FECBA FEDBA ABCEF ABDEF ABDEF ADEFB FEBAB ABDEF ABDEF ABCEF ABDFE FECBA FECAC ABDEF CEFDA FECBA FECBA FEDBA FEDBA FECAC ABDEF DFECA FEDBA FEDBA ECABF ABEEF FECBA FBACE ABDEF ACEFD CBCBF ABDEF ABCEF ABCEF ABCEF ABCEF
60,AFECC EFDBA ABCEF ABCEF ABCEF EFCBA FDCBB FEDBA FECBA BBCDF ABDFE FEDBA ECACF ABCEF ABDEF ABCEF ECACF ACDEF ACDEF ABCDF ABDFE FEDBA ADFEC ABCEF ABCEF FECBA FECBA FEDBA FECBA FABCE ABCEF ABEEE FEDBA FECBA FECAA ABDEF FEDBA FDBBB ABCEF ABDEF ABDEF ABCEF ABDEF BCBCF ABCEF ABCEF
61,BBBEF AEEDB ABDEF FEDBA FECAB FEDBA FEDBA AACEF DFECA FEDBA FEDBA BABEF ABDEF FEDBA FECBA FECBA FDCBB FFDBA FDCBA FECBA FECBB ABCEF ABDEF BFECA FEDBA FDDCA FECBB AADFE FEDBA FEDBA FECBA FEDBA FEDBA FDECA FECBA BBBDF ABCEF AEEDB DEECA ABFED EFCAA EEECA FEDBA FEDBA FECBA ABCDF
62,FFCBA FDBBB ABDEF ABDEF ABEEE FEDBA FEDBA FEDBA FEBBB ABCEF ABDEF FEDBA FCABF ABDEF ABDEF ABCEF ABDEF FBBCC ACCEF CBBDF ABCEF ABEFE EBEEA FEDBA FECBA FDBBB ABDEF ABCEF ACDEF EDFCA FECBA FDABD ABCEF AADEF FDCDA CCEAF DFBBB FDCBA FDEBA FDCBB FEEAA FEDBA FDCBA FEDBA BBCEF ABDFD
63,EFDCA FECBA FDBBB CDFDA FECBA FEDBA FECBA ABCEF ABDEF FECBA FECBA FDCBB ABCEF ABDEF ABDEF ABDEF EEECA ABDEF ABCEF ABCEF ADFEA FECBA FDCBA ABCEF ACEFE FECBA FECBA FEDBA FEDBA AACEF ABEEE FEDBA FECBA FEDBA CBBDF ABDEF FECBA FBACE ABCEF ABDEF ABCEF ABCEF ABDEF ABCEF ABCEF ABCEF
64,ACFEE FEBCA ACCEF ABCEF ABDEF ADFEB FECBA FEDBA FECBA FDBBB ABDEF FECAA CCDBF ABDEF ABDEF ABDEF ABCEF ACDEF ABCEF ABCEF ACFEB FEDBA EBACF ABDEF FECBA FECBA BBCDF BBEFC FEDBA AACEF EFDBA FEDBA FEDBA EFDBA FACDC DBADF ABDEF ABCEF ACDDF FCCCA EFBAB CCADF FECAB FEDBA BBCEF BDAFD
65,ABEEE FECAA ABCEF ABCEF ABDEF FEDBA FECBA FEDBA FDBAD ABDEF ABDEF FEDBA FEDBA FECBA FECBA FECBA ABCEF ABDEF ACEEE FEDBA FEDBA BBBDF ABDEF FEDBA FCCCA ABCEF ABDEF ABCEF ABDEF EEECA FECBA FECBA BABEF CEFCA FECBA AADFF FEDBA FECBA EFEBA CADFC FECBA FBBCC FEEBA FECBA EEEBA ABCEF
66,FECBA FECBA BBBDF ABDEF ABDEF CECFA FBBCC FFCBA FEDBA BACEF ABCEF EFDBA FEDBA FDBBB EECBA CEBAF ABCEF FDBBC ABDEF ABCEF ABCEF FECBA DACFD BABEF ABDEF AEFDA FEDBA FEDCA FECAB ABDEF ABCEF FECBA FEDBA FDBAE ACEFD FECBA ABDEF ABDEF ABCEF ABCEF ABCEF ABCEF ABCEF ABCEF ABCEF ABCEF
67,EEDBA BBBEF ABDEE FEDBA FECBA FEDBA FECBA FEDBA FEDBA FECBA FCABF ABCEF ABDFE FECBA FDBBC ABDEF ABDEF ADEEC AACEF FECAC ABDFE FECAB ABCEF AFEDB FECBA FECBA FEDBA CCBBF ABDEF ABDEF FEDBA FECBA FEBBB DCCAF AEFDA FEDBA FECBA FEDBA FEEBA EFBCB ABEFE ABDEF ABDFE CDCCE BBCDF ACCDF
68,ACEEE FEDBA DBBCF ABDEF ABCEF EFDBA FECBA FEDBA FECBA FECBA ABCEF ABEFD FBCDB ABDEF ABDEF ABDEF ABCEF ACDEF FECBA BBCDF ABEFD FEDBA FCABE ABDEF DFEBA FECBA FECBA FEDBA FECBA ABCEF BFECA FEDBA FEDBA FEDBA ACDEE FECBA ABCEF ABDEF ACEFC FBCBD FDDBA EDADF ADEEC EEDDA ABCEF ABEFE
69,FECBA FECBA FECBB AEFCB FEDBA FEDBA FEDBA FEDBA FDBAC ABCEF ABDEF FEDBA FEDBA FEDBA ABDEF ABDEF ABCEF ABDEF ABDEF ABCEF ABEFD FEDBA FECBA BBBDF ABDEF ACEFD FECBA DFDCA FEDBA FEDBA FECBA BBCEF ADDEE FEDBA FECBA ABDEF BBCBF BBBEF EBECC BBCEF ADECD BBCDF ABDEF ABDEF ABEFB BDFAE
70,DFEBA FECBA FECBA FECBA FEDBA FEDBA FEDBA FECAA ABDEF ABDEF EFEBA FECBA FECBA FEDBA FECBA FECBA BBCEF ABCEF ABDEF EEDCA FECAB ABCEF ABEEE FEDBA EBACF ABDEF ABDEF ABDEF ACEFE FEDBA FECBA FECBA ABCEF DEECA FEDBA FECBA ACEEE FECBA FDBAC ABDEF ABCEF ABCEF ABCEF ABCEF ABCEF ABCEF
71,EECAC FECBA FECBA FEDBA FEDBA FEDBA FECBA ABCEF ACDFD FFDBA FECAA ABCEF ABCEF ABDEF ABDEF CDEEA FBBCD ABCEF ABDEF ABCEF CEFDA FEDBA FCABE ABDEF FEDBA FECBA EABEE FEDBA EDBAE ABDEF FEDBA FEDBA EBEDA CABDF ABCEF EFEBA FDBBB ACDEF ADEED BDFEA FEDBA FFCBA FECBA FECBA ABCEF ABCEF
72,BBBEF FEDBA FDBBB BBCEF FDBBC EEECA FECBA FEDBA FECBA FDBBC ABDEF ABDFF FEDBA FABDE ABDEF ADDDF ABCEF FEDBA ABDEF DBBBF BBCDF EFDBA ABDFE BBCEF ABCEF ACFEC FDCBA FEEBA FEDCA ACDEF ABCEF FECBA FECBA FEDBA ABCEF FEDBA FEBBB ACFEC FECBA DADDE ABDEF ABCEF ABDEF ABBDF ABCEF CCACF
73,FEDBA FDBBB ACFED FECBA FEEAA BBCDF ABCDF ABCEF ACFFC FEDBA EBACF ABCEF ABDEF ABDEF EEEBA ABCEF ABCEF ACDEF ABDEF FECBA FEDBA FDBBB BCDCF EEEBA FECBA CABDF ACEEE ABCEF ABCEF FEDBA FECBA BEFCA BBBDF ABCEF EFDBA EBACF ABDEF ABCEF ABDEF EFDBA ABEFE FEDBA ABDEF ABDEF ABCEF FECAB
74,FDCAB ABDEF FDDBA FECBA FEDBA FEDBA FECBA FEDBA FECBA BACEF ABDEF EFDBA FECAB ABDEF ABDEF ABCEF FFCAB ABDEF ABDFE ABCEF ABCEF FEDBA FECAB ABDEF DEFCA FECBA FECBA FEDBA ABCEF FDBBB EFDBA FEDBA FEDBA AACEF ADFEB FECBA ABDEF ABDEF ABDEF ABDFE FECBA FEEBA FECBA FECBA FEBAD ABCEF
75,FEDBA FEBAB ACEFD ABCFF ABEDE DBACF ABCEF ABCEF ABDEF FECBA FEDBA FEBAD ABCEF ABDEF ABCEF BDFEA ABCEF ABDEF ABCEF CEFDA FEDBA FECAB DFDCA FECBA FEDBA FBABE ACEFD DBADF ABDEF FEDBA FECBA EFDBA ABCEF ACEEE FECAB ABCEF ABDEF ABCEF ABDEF ABDEF ABDEF ABDEE EEECA FEDBA FDCBB ABCEF
76,FECBA FECBA FECBA FECBA FEDBA FECBA CBBDF ABCEF ABDEF DEFCA FECBA FDCBB EEDBA FECAA ABDEF ABDEF ABCEF ABDEF ABDEF ABCDF ABCEF FEDBA FEDBA DBADF ABCEF ABEFE FDCBB ABCEF EEDCA FEDBA FECBA CBACF ABCEF ABCEF FEDBA FECBA EADED EFDBA ABDEF ABDEF ABDEF ACDEF BCBDF ABCEF ABCEF FCACC
77,FDBBB FECBA BBBEF ABDEF ADEEC EFDBA FDBBB ABCEF ABDEF EEEBA FECBA FECBA BBCDF ABDEF ABDEF ABDEF EEECA ABDEF ABDEF ABCEF ABCEF FEDBA FECBA BBBDF ABCEF FEDBA FECBA FEDBA FEDBA BBBDF ABDEE FEDBA FECBA FEDBA FCABD ABDEF FECBA BABEF ABCEF ABDEF ABCEF BDBDF ABCEF ABCEF ABCEF BDFCB
78,FEDBA FECBA FDCAB ACDEE BCCDF EEDCA FECBA FEDBA FECBA BACDF ABCEF EEDBA FEDBA BACEF ABDEF ABCEF ACEFB DABDF ABDEF ABCEF ABCEF FECBA FECBA FECBA ABCEF ABDEF ABDEF FEDBA FEDBA FFCAA ABCEF ABCEF DEEDA FECBA ECABF FFDBA FEBBB ABDEF ABCEF ABCEF ABCEF ABCEF ABDEF ABCEF ABCEF ABCEF
79,BACEF FECAA FFDBA FECBA CBAEF FEDBA ABCEF ACEEE FEDBA FEDBA FECAB ABCEF ACEED FEDBA FEDCA FECBA FDCBB EFDBA FEDCA FDCBA FEDBA BBBDF ABDEF ABDEF ADEEE DFEBA FDBBB ABCEF ABDEF FEDBA FEBAC EEECA FDCBB FEDBA FEDBA FECBA ECABF ABDEF ADBDF EEECA FDCBA BBCDF ABDEF EEEBA FECAB ABCEF
80,FECBA FECBA FDBBB BEAED EDCCB FEEBA FEDBA FEDBA FDCBA BBBEF BEFDA FCABD ABCEF ABDEF ABCEF DEEDA ABCEF ABDFE ABCEF CDFEA FECBA FECBA ABDEF ABCEF ADFEB FECBA AEFDB FEDBA ABDFE EDBAF ACCEF FEDBA FECBA BBBDF CFECA FECAA ABCEF ABCEF ABDEF ABDEF ABDEF ABDEF ABCEF ABDEF ABCEF ABCEF
81,ACDEE ABCEF ABCEF ABDEF ABDEF BBBDF ABCEF ABFFC FEDBA FECBA DBADF ABDEF ABDEF BEEEB EEDBA FEDBA FDBCA FEDBA FDBBB FEDBA DBBCF ABCEF ACDEE AADFF FEDBA FECBA DABDF ABDEF BADFE FEDBA FECBA FEDCA FEDCA FECBA ECABF ACDEE ABDEF CCBCF DDDEA DEECA EFDBA FEBBB FAACE FEDBA CBBEF FEDBA
82,ACEEE EFDBA ADDDF ADEFB EFCBA BBBDF FEDBA FEDBA FECBA FECBA ABCDF ABCEF ABCEF ABDEF ACFEC FECBA ABCEF ABDEF BFECA BDAEE BBCDF ABCEF AEFDB BADFF FEDBA FECBA FBACE ABDEE FEDBA FEDBA FDCBA ABDEF ABCEF ABDEF EEECA FEDBA FECBA FECBA FEDBA FEDBA FEDBA FECBA FEDBA FECBA EBACF BEADF
83,AEFDC FECBA FECBA FCADD FECBA FEDBA FEDBA FECBA ABCEF ABDEF FEDBA FDCBA CDEEA BACEF ABDEF ABDEF ABCEF ABCEF ABEEF ABCEF ACEFC FEDBA BBBEF ABDFE FECBA FECBA ABCEF FEDCA BBBEF ABDEF FECBA FEDBA FECBA FEDBA CEFCA FDCAD ABDEF ABCEF ABEEF CDEEA FCBCB BACEF DBADF FBDCB ABCEF ABCFF
84,AEFDB FECBB EEECA DACCF ABDEF ABDEF ABDEF BBBDF ABDEF DEECA FECBA ABCEF ABDEF ABCEF EEDBA ABCEF ABDEF CFEBA ABCEF FEDBA FEDBA FBBBD ABCEF EFDBA FECBA BBBEF ABEEE ABCEF ABCDF FEDBA FECBA EEEBA BBBEF BDDAF ABDEF FEDBA AACEF ABCEF ABCEF ABDEF ABCEF ABDEF ABCEF ABDEF CDEEA FEBBB
85,ACEEE EFDBA DBBCF ABCEF ABDEF AEFDA FECBA FEDBA FDCBA BBBDF ABCEF FFDBA ACDFC FECBA ABDEF ABCEF ABCEF ABDEF ACDEF BBBDF ABCEF ABEFE FEDBA DABDF BEEDA FECBA FECBA FEDBA FEDBA ABDEF DFEBA FEDBA FECBA FEDBA CFECA FDABC ABDEF ABDEF ABDEF FEBBB CAEEC ABCEF ABDEF BCBCF ABCEF ABDFE
86,FECBA FECBA ABCEF ABCEF ABCEF ABEED FEDBA FECBA FECBA ACBFE ABDEF FEDBA BBBDF ABDEF ACDEF ABCEF EEEBA ABDEF ABDEF ABCEF ABCEF FEDBA FECBA FEBBB ABCEF ABCEF FECAA ABDEF FEDBA FECBA FACED BEEDB FECBA FECBB ABDFE FEDBA FCBBD ABDEF BACEF ABDFE ABDEF ABDEF ABCEF ABCEF ABCEF ABCEF
87,FEDBA FECBA FECBA FEDBA FEDBA FEDBA FEDBA ABCEF ABDEF EFDBA FECBA FEDBA FDAAD ABDEF ABDEF DEEDA ABCEF ABDEF ABCEF BDFEA FEDBA FEBBB ABCEF ABDEF FEDBA FECBA FEDBA FECAB ABCEF ACEED FECBA FECBA FEDBA ABCEF ACEED FECBA FCABD ABDEF EFCAC AFFBC BACEF ABDEF ABCEF ABDEF ABDEF FECAA
88,CFEBA FECBA BACEF ABCEF ABDEF FEBDA FECBA FEDBA FECBA DBBBF ABCEF DFECA BABEF ABDEF ABCEF ABCEF EEEBA ABDEF ACDEE BBCEF ABCEF AEFDB FECBA ACEEE FECBA FECBA BACEF FEDBA AACEF EFEBA FECBA FEDBA DEECA BBBEF AACEF FEDBA AADEF ABCFE ECEEA CBAFE EEEAA CABEF FCBBC ABCEF ABCEF EEECA
89,DFEBA FECBA FECBA FECBA FECBA FEDBA FEDBA FEDBA FECBA ABCEF ABDEF ABDFE FEDBA FEDBA FECBA ABDEF ABCEF ABDEF ABDEF ACDDF BCBCF ABEFE FECBA FECBA ABCEF ABDEF ADEED ABCEF ABEEE FEDBA FECBA FECBA ACDEE DEECA FECBA ECABF FEDBA FECBA DCCBF FECBA CDEAE EDECA DEECA ACDEF ABCEF ABCEF
90,DCBBF ADEED FECBA FECBA FECBA FEDBA FECBA FEDBA FECBA ABDEF ABDFE FEDBA FEDBA ABCEF ACDFE FFCBA ABCEF FCBBC ACDDF FECAB BBCDF ABCEF FFDBA FECBA BACEF ABDEF FECBA FEDBA FEDBA FEDBA ABCEF ACEEE FEDBA FECBA FECBA BACEF AEEEC FEBBB CBCBF CAECF ABCEF CABDF ABDFE FECBA FEDBA ABCDF
91,ABCFF FECAC AEEDB FEDBA FEBAC FEDBA FECBA BBBEF ABDEF ABDEF FEDBA FECBA FEDBA FECBA FECBA FEDBA BBBDF ABDEF ABDEF ABDEF BBCDF ABCEF FEDBA FECBA ABCEF ABDEF FDBBC ABCEF ABEFD FEDBA FECBA ABDEF ACDEF EEDBA FEDBA FECBA ABCEF ABEEE ABDEF ACDEF ADEEC ACDDF FBCAD EFDCA ABCEF BEEDB
92,AADEF CECAF AFEDB FECBA FCBAD EFDBA BBBEF ACDEE EEECA FEDBA FECBA ABDEF AADFF EFDCA FFCBA FEDBA FECBA EFDBA FEDBA FEDBA FEDBA BBBDF ABDEF ADEDE FDAAE ABDEE FECBB ABCEF ABDEF FEDBA FECBA FEDBA FECBA EDECA FECBA CADFD EACDE ABBEF FECCA FDCBA CBACF ABCEF CEFAB FEDBA FDCBA BBBDF
