,0
118,AABBBBCCDDD AAABBCCDDDD CCCCCCCCBAA DCBAAAABCDD AAABCCCCDDD AABBCCCDDDD AAABBCCDDDD CBBAAAABCDD DCCBAAABDDD DDDCCBBAAAA AAAABBDDDDD DDDDCCBBAAA AAABBCCCCDD AAAABBCCDDD BDDAAABBCCC DDDCBAAAABB DDDDDCCBAAA DDCCBBBBAAA
119,DDDDDCBBAAA AAABCCDCDDD DDDDCCBAAAA AAAABCCDDDD DDDCCBBAAAA AAABCCCDDDD BBCCCDDDCAA AAABBCCCCDD AABCDDDDBAA BAAAABCDDDD DDDCBBBAAAA BBBBAAABCDD DDDCCBBBAAA CCBBBAAABDD CDDDDCBAAAA AABBCCCCDDD AAAABBCCDDD AAAABBBCDDD
120,DDDCCBBAAAA DDDCCBBBAAA DDDCCCBBAAA AAAABBCDDDD DDDCBBBAAAA CBAAABCCDDD AAABBBCDDDD AAABBBBCDDD DDDDCCCBAAA ABCDDDCBAAA DDDCBBBBAAA AAABBCDDDDC DDCCBAAABCD ABDDDDCCBAA AAABBCCDDDD DBAAABCCCDD DDDDCCBBAAA AAABBBCCDDD
121,DDDDCBBAAAA DDDDCCBBAAA DDDCCCBBAAA AAAABBCCDDD BCDDDCCBAAA DDCCAAAABCC AAABBBCDDDD DDDCCBAAAAB DDDDDCBAAAA AABCDDDCCBB DDCBBBBBBAA DDDDCCCBAAA AABCDDCCCCC AAAABBBCDDD DDDDDCBBAAA AABCDDDDCAA AAAABBCDDDD AABBBCBBCDD
122,DDDDCBBBAAA DDDCBBAAAAA DDDCCBBBAAA AAAABBBCDDD DDDCCBBAAAB AABBCCCCCDD DDDAAAABCCC AABBCCDDDCA DDCBAAAABBC DDDDCCBAAAA AAABBBCCCDD AACCDDDCBAA DDDCCBAAAAC AAABBCDDDDD DDDCBBAAAAB AAABBCCCDDD AAABBCCCDDD AAAABBCCDDD
123,AAAAABCDDDD DDDCCBAAABB DDDDCBBAAAA DDDDCCBAAAA AAAABBCCDDD DDDCBAAAABB AAAAAABCDDD DCBBBBBBBBA AAAAABBCDDD DDDCBAAAABC AACDDCCCBBB CCDDDCCCBAA AACDDCCCCCB DDDDCCCBAAA DDDCBAAAAAB DDBBBBBBBAA AABBDDDCBBC DDDDCCBBAAA
124,ABBAAACCDDD AAABBBCDDDD AAAABCDDDDD DDDDCBBAAAA AAAABBCDDDD AABCDDDCCBA DDDCCCBBAAA AABBBCCCCDD AAAABCCDDDD CCCDDDCCBAA DDCBBAABBBB DCCCCBBAAAD DDDCBBBBAAA DDDCCBBAAAA AAABBCCDDDD ABBCDDDCCBA AAAACCDDDDD AAABBBBCDDD
125,CCDDDCBAAAA DDDCCBBBAAA DDDDCCBBAAA AAAABBCCDDD DDDCCBBBAAA DBAAAABCDDD AAAABBBCDDD AAABBCCCDDD AAABCDDDCBB CBAAAABCDDD DDCBBBAAABB DDDDCCCBAAA AAABCCDDDDD DDDDCCCBAAA DCBAAABCDDD AABBCCCDDDB DDCCCCCDAAA ABABBCCBBDD
126,AACBBABCDDD AAAABBCCDDD AAABCCDDDDD DDDDCCBAAAA AAABBCCCDDD ACDDDDCBAAA DDDCCBAABAA DBBBBBBBBCC AAAABCCDDDD BCCDDDCCBAA DDCBBAAABBB DDDDCCCBBAA DDDCBBBBAAA DDCCCDCAAAA AAAABCCDDDD AAABCCDDDDD DDCCCBBBAAA DDDCCCBBAAA
127,AABBCCCCCDD AAAABCCDDDD ABDDDDCBBBA DDDDCBBAAAA AAAABBCDDDD DDDDCAAAAAB AAAABBCDDDD ABCCCBBBBCD BBAAAABCDDD DDDDCCBAAAA DDBBAABBBBB AAAABCDDDDC DDDCCBBBAAA DDCBCDDBAAA AAAABBCDDDD AAABBBCDDDD BBAAABCDDDA DDDBAAAABCD
128,DDDCBAAABCC AAAABBBCDDD AAABBBCCDDD AAABCDDDDCB DCBAAABBCDD AAABCCCDDDD DAAAABBCDDD AAAABBBCDDD DDDCCBBBAAA BCCBBCDDCAA DDCCBBBBAAA DDDCBCBBAAB DDDDCBAAABB AAAABCDDDDD AAAABCCDDDD AAABDDDCCCC AAAABCCDDDD CCCDDDCBAAA
129,DDDCCBBAAAA DDDDCCBBAAA DDDCCCBBAAA BAAAABBCDDD BCDDDCCBAAA DDDCCBBAAAA BBAAAABCDDD AAABCCCDDDD AAAABBCDDDD DDDCBAAAABC AAABCCDDDDD CCDDDCCCBAA CBBBAAABCDD CCDDDCCBAAA BACCDDDBBAA AABCDCCCBCB AAAABCDDCDD ABBABBBBCDD
130,DDDCCBAAAAA DDDCCBBAAAA AAAAABCDDDD AAABCCDDDCC AAAABBCCDDD ABCDDDDCAAA AAAABCCDDDD DDDDCBBAAAA DDDCCBBAAAA DDDCCBBAAAA AAAABCCDDDD DDDDCCBBAAA AAAABCCDDDD BBAAAABCDDD AAABCCCDDDD DDDCBBBBAAA AAAABBCDDDD BBBBCCDDDCA
131,DDDDCBBAAAA DCAADCCCBBB DDDCCCBBBAA AAAABBCCDDD DDDCBBAAABC AAABCCCCDDD DDDCAAAABBC AAABBBCCDDD DDDCCBBAAAA DDDCAAABCDA DDBBABBBBBB BBAAABBCDDD DDDCCBBAAAA AAAAABCCDDD DDDCBBAAAAB AAABCCCDDDD AAABBCCDDDD BABAABBBCDD
132,DDCBBAAABBC AAABBCCDDDD CDDDCCCBBAA CBBAAABCDDD AABDDDDCCCB DDDCBAAAABB BBCCCDDDCAA AACDDDDCBAA AAAAABCCDDD DDCBBAAACDD DDDCBAAAABB CDDDDCCCBAA DDDCCBBBAAA DDDDCBAAAAB AAAABCCDDDD AABCDCCCCCC DDCAABBBBBA BBBABBBBCDD
133,DDDCCBBAAAA AAABBCCDDDD CDDDCBBAAAB CBBBAAABCDD CCDDDCCBAAA AAAABCDDDDD BBCCDDDCAAA AAABBCCCDDD CCDDDCBBAAA BBAAABBCDDD AABCDDDCCCC DDDCCCCBAAA AAABBCDDDCC DDDCBBAAAAC DDDDCBAAAAB AAABBCCCDDD AAAABBCCDDD AAABBBBCDDD
134,DDDCCCBAAAA AACCDDDCBBB DDDDCBAAAAA AAABBCDDDDB DDDCCBBAAAA AAABBCCDDDD BBCCCDDDCAA AABBCCCCCDD AAAABDDDDCB CBAAAABCDDD DDDCBBBAAAA BBBAAABCDDD DDDCCBBBAAA CBBAAAABCDD BBCDDDCBAAA DABBAABBCDD AAAABBCCDDD AAAABBBCDDD
135,DDCCCBBAAAA DDDCCCBBAAA DDDCBAAAABC CCCDDDCAABA CBABDDDCBAA AAABBCCDDDD BCCDDDDCBAA AAABBBCCDDD BCCDDDCBBAA AAABCCDDDDD DDDCBBBAAAA DDDCCBAAABD AAABCDDDCCB DDDCCCBAAAA ABDDDCAAABB AAABCCCDDDD AAAABCCDDDD AAAABBBCDDD
136,AAABCCCCCDD CBABBBBBBDD AAAAABCDDDD DDDDCCBBAAA AAAABCCCDDD CDDDDABBAAA DDDCCBBBAAA AABBBCCCCDD AAAABBCCDDD AAACCDDCCCC DDCBBBAABBB DDDDCCCBAAA CDDDCCBAAAA DDDCCCBBAAA DCBAAAABCDD DDCDCBBAAAA ABBCCAAACDD DDDDCCBBAAA
137,ADDBABCDCBA DDDCCBBBAAA AACDDCCCCCC DDDDCBBAAAA AAABBCCDDDD DDDCCBABAAA DDDCBBBAAAA DDDDCBAAAAA BBAAAABCDDD AACCCCDCCCD ABAABDDCCCD CCCDDDCCBAA BAAACDDDDDC DDDDCCCBAAA DDCCCBAAABB AAABBCCDDDD AAAABCCDDDD AAAABBBCDDD
138,CDDDCCBAAAA AAABBCCCDDD DDDDCCBBAAA AAAABBCCDDD DDDDCBBAAAA DDBAABBBCCC AAAABBCCDDD AAABBCCCCDD BCCDDDCCBAA AAAABCCDDDD DDDCBBBBAAA CCBBBAAABDD ADDDCCCBAAA DDDCCBAAABB DBAAAABCDDD AAABBCCDDDD AAAABBCDDDD AAABBBBCCDD
139,DDCCCCBBAAA BAADDDDCBAA DDDDCBBAAAA DDDCCCBBBAA DDCAAAABBCD AAABCCCDDDD DDDDDCAAAAA AAABBBCCDDD DDDDDCBBAAA AAAABCDDDDD DDDCBBBBAAA DDDCCBAAAAD AABCDDDCCBA DDDCCBBAAAA BDDDDCBAAAA AAABBCCDDDD AAABBCCDDDD AAABBBBCCDD
140,DDDCBBAAAAB AAABBCCCDDD DDDDCCBBAAA CBBAAABBCDD CDDDCCBBAAA AAABBCCDDDD CCCCDDDCAAA AABCCDDCCCC AAAABCDDDDC BBBAAABCDDD DDCCBBAAABB BBBBBBAACDD DDDCBBBAAAA DDDDDCBAAAA AAAAABCDDDD ABAAABCDDDD AAABBCCDDDD DDCCCCAAABD
141,DDDDCCBBAAA DDDCCBBAAAA BBBBAAABCDD CDDDDCCBAAA AAAABBBCDDD AAABBCCDDDD DDBAAABBCCC AAAAABBCDDD DDDDCCBAAAA BCDDDDCBAAA BAAABCCDDDC BBBAAABCDDD DDDCCCBBAAA BAAAABBCDDD AAAAABCDDDD AAABBCCDDDD DDDCCCBBAAA DDCBBAAABCD
142,DDDDCBAAABB DDDDDCCBAAA DDCBBAAAACD ABCDDDDCBAA BAAAABBCDDD AAABCCCDDDD DDCAAABCCCC CCBBBCCDDBA DCCBAAABCDD DDDDCCBAAAA CBAAABBBCDD CCDDDCCBAAA AAAABBBCCDD AAAABBCDDDD CBAAAABCDDD AAABBCCDDDD DDDCBBAAAAA DBAAABBCCDD
143,ABCBBAABDDD ABBBBBBBBDD CDDDCCCBBAA CBBAAABBCDD AAAABBCCDDD ABDDDDCBBAA AAABCCDDDDB DDCBBAAAACD CCCDDDCCAAA DDDCCBBAAAA AAABBCCDDDD DDDCCBAAAAB AAABBBCCDDD AAAABBCCDDD AABCDDDDDBA DBAAABBCCDD AAABBCDDDDD DDDDCCBBAAA
144,ABABCCCCCCD AAABBCCDDDD DDDDCBBAAAA CCDDDCCAAAA DDDCCBBAAAA AAABBCCDDDD BCCCDDDCAAA ACDDDDCBAAA AAAABCDDDCC DCBAAABCDDD CDDDCBBAAAA DDDDCCCBAAA AAAABCDDDDD DDDCCCBBAAA BCDDCBBAAAA DDDCCBBAAAA AAAABBBCDDD BBBBBBBBCDD
145,DDDCCBAAAAA AAAABBCDDDD DDDDCCCBAAA DDCBAAAABDD AAACDDDDCCB DDDCBAAAABB AAAAABCDDDD DDBBBBBBBBB AAAAABBCDDD DDCBAAABCCC DDCCBBBAAAA BBAAAABCDDD DDDCBBBBAAA DDDDDCCBAAA AAAABCCDDDD AACCCDDDCCB AAAABCCCDDD BBBBBAABCDD
146,DCDDCBBAAAA DDDDCCBBAAA BBBAAABCDDD AAABCCDDDCC DDCCBBBBBAA DDCBAAABBCC AAAABBCCDDD AACCDCCBBCD CCDDDCBAAAA CBBAAABCDDD ABDDDCBBBBB DDDCCCCBAAA BBAAAABCDDD CCDDDDCBAAA AAAABCCDDDD DDDCBAAAABB AAAABCCDDDD AAAABBCDDDD
147,DDDCCBBAAAA DDDCCBBBAAA DDDCCCBBAAA AAABBCCDDDD DDDCCBBBAAA DDDCCBBAAAA BBAAAABCDDD AAABCCCDDDD AAAABBCDDDD DDDCBBAAAAB AAABCCDDDDD CDDDDCCCBAA CCBBAAAACDD CDDDDCCCAAA BAABCDDDDCB DBAAABCCCCD AAAABBCCDDD AAAABBBCDDD
148,CBDDDCAAAAB AAABBCCDDDD DDDDCCBBAAA DDDDCBAAAAA DDDDCCBBAAA AAABCCCDDDD CDDDDDCAAAA AABCCCCCCCD AAAABCDDDDC CBAAABCDDDD DDDCBAAAABB BBBBBBAABDD DDDCBBBBAAA DDDCCCBAAAA AABBCCCCDDD BCDDCCCCCAA AAAABCCDDCA DDDCCBAAABD
149,AACDDDCCCBB CABBABCDDCA DDDDCCBAAAA DDDCBAAAABB AAABBCDDDDC DDDCCBBBAAA AAAABBCCDDD AACCDDDCCBB AAAABBCDDDC CBAAAABCDDD DDDCBBBBAAA DDCCBAAAACD AABCDDDDCCC DDDDCBBAAAB DDDDDCBAAAA BAAABBBBCDD CBBAAAABDDD AAABBBBCDDD
150,DCCDDDBBAAA DCDDCCBBAAA DDDCCBBAAAA AAABCDDDDCB DDDCBBAAAAB AAABBCCDDDD BCDDDDCBAAA AAABBBCCDDD DDDDCCBBAAA AAABCCCDDDD DDCCBBBAAAA BBBBAAABCDD BCDDDCCBAAA DCCBBAAABDD DCBAAAABCDD AAABCCCDDDD AAABCCDDDDB AAAABBBCCDD
151,AAABBBDDDDD AAAABBCDDDD AAABCCCDDDD DDDDCCBAAAA AAAABBCCDDD CDDBCCCCAAA DDDCBAAAAAA DDDBBBBBAAA AAAAABCDDDD CBCDDDCCBAA DDCBBAAABBB BBBBBAABDDD DDDCBBBBAAA DDDDCCBAAAA AAAABCCDDDD AABBCBABDDD DDDDCBAABBB DDDCBBBBAAA
152,AAACDDCCCCD DDDCCBBBAAA BAAAAACDDDD DDDDCBBAAAA AAABBCCCDDD AACDDDDCCBB DCDDDDCBAAA AAAAABBCDDD AAAABBCDDDD CDDDDCCBAAA DDCBBBBBBBA CBBBCDDDCAA DDDCCBBAAAA AAABBBBBCDD ABABCCCDDDD AAABCCDCDDD DDDDCCBAAAA DDDCBBBBAAA
153,AAAABCDDDDD DDDCCCBAAAA DDDDCBBAAAA DDDCBAAAABC AAABCDDDDCB DDDCCBBAAAA AAAABBCCDDD AAABBCCDDDD AAAABBCDDDD DCBAABCDDCB DDDCBBBAAAA CCCBBAAABDD DDDCCBBBAAA AAAAABCDDDD DDDDDCBBAAA CCCCCCDCAAA DDDCCBBAAAB ABDDBBCCBAD
154,AAACDDCCCCD AAABBBCCDDD AAAABCDDDDD DDDDCCBBAAA AAABBBCDCDD ABBDCDCCCBB DDBBBAABBBB DDCCBBBBAAA AAAABBCDDDD AABCDDCCCCD DDDCBAAAABB BCCCCCBBAAD DDDCBBBBAAA DDDDCCBBAAA AAAABBCDDDD DDCBBBAAABC DDDCBBBBCBA DDDDDBBAAAA
155,ABADDDDCBAA ACBCCCCCCCC DDDDCBBAAAA AAABBCCDDDC DDDCBBAAAAA AAABBCCDDDD CCCDDDCCBAA AAABCCCCDDD AAABCDDDCBA BAAAABCDDDD DDDCBBBAAAA DDCCCBBAAAD BDDDCCBBAAA DDDDCCBAAAA ACDDDCBBAAA AAABBCCCDDD AAAABBBCDDD AABBBBBCCDD
156,ABDCAABCDDD AAABBBCDDDD AAAABCDDDDD DDDDCCBBAAA CBAAAABCDDD ABCDDDDCBAA DDDCCBBAAAA DDDDCBAAAAA CBBBAAABCDD AAABCCDDDDD BBDDDDBAAAB ABBCCDDDCBA DDDCBBBAAAA DDDDCCCBAAA BBAAABBCCDD BDDCCDDBAAA CCCCBAAACDD AAAABBCCCDD
157,BCDDCAABBAA DDDCBBBAAAA AAAABCDDDDD DDDDCCBBAAA AAABBCCCDDD DDDDCCBAAAA DDDDCBAAAAA DDCBBBBBBAA AAAAABCDDDD AABCCDDDCCB DDCCBBBAAAA BBBBBAABDDD DDDCBBBAAAA DDDDCCCBAAA AAAABBCCDDD ABDDDDCBBAA AAAABBCDDDD AAABBBCCDDD
158,DDDCCBBAAAA AAABBCCCDDD DDDDCCBBAAA CBAABABBCDD DDDDCCBAAAA AAABBCCDDDD BCCDDDDAAAA AAABBBCCDDD BCDDDDCBAAA AAAABCDDDDD DDCCBBAAABA DCCCBBAAACD DDCCBBBAAAA CBBDDCAABCD AAAABBCDDDD CCCDDDDBAAA DDDDCBAAAAA AAABBBBCDDD
159,DDDCBBAAAAA CBAAAACDDDC CDDCCCCCBAA AAAABCCDDDD DCBAAAABCDD AABBCCCCDDD DCAAAABCCDD AAABBBBCDDD DDDCCBBAAAA DDDDCCCBAAA AAAABCDDDDC AAABBCDDDDC DDDCBBBAAAA AAAABBCDDDD DDDCAAABBBB AAABCCCDDDD AAAABBCDDDD AAAABBBCDDD
160,CDDCCBAAAAA AAABBCCDDDD DDDDCCBBAAA DDDCCBBAAAA BCCDDDDBAAA AAABBCCDDDD BBCCCDDDCAA AABCCCCCCCD CCDDDCCBAAA AAAAABBCDDD ADDDCBBAAAB DDDDCCBBAAA AAAAABCDDDD DDCBBAABDCA CBAAABCDDDD AACBBBCCDDD DDCCBAABBBC AAABBBCBCDD
161,AADDDDCBBAA DDDCCBBBAAA AAABCDDDDCC DDDDCBBAAAA AAABCCCCDDD DDDDDCBAAAA DDCCCCCCBAA BBDDDDCBAAA BBAAAABCDDD AABBBCCCDDD AAACDDDCCCC CCDDDCCCBAA BAAAABCDDDD CCDDDCCCAAA DDDCBBBBAAA DDCCBBBAAAB AAAABBCDDDD AABBBBBCDDD
162,DDDDCCBAAAA AAABCCDDDDC DDDDCBBAAAA AABBCCDDDDA DDCBBCCBBAA AAAABCCDDDD AABBCCDDDBA AABBCCCCCDD AAABCDDDCBA BBAAABCCDDD DDDCBBBAAAA DCCCBBAAACD CCDDDCBBAAA DDDCCBAADBA BBCDDDCBAAA DDDCBAAAABA AAAABBBCDDD AAABBBBCCDD
163,CDDDCBBAAAA AAABBDDCDDD DDDCCBBBAAA AAABBCCCDDD DDCCBAAAACD AAABCCCDDDD DDBAAABCCDD AAABBCCDDDB DDDDCBAAABC DDDDCCBAAAA DDCCBBBBBAA AACDDDDCBAA DBAAABBBCDD AABCDDCCCCC AAABBCCDDDD CCCDDDDBAAA DDDCCBBBBAA DAAAABBCCDD
164,DDDCBBAAAAA AAABBCCDDDD DDDDCCBBAAA BBAAAABCDDD CDDDDCCBAAA CAAABBCDDDD BCCDDDDAAAA AAABBCCCCDD AAABDDDDCBA AAABCCDDDDC DDCCBBBAAAA BAAAAABCDDD DDDCBBBBAAA DDDDDCCBAAA AAAABCCDDDD AAABBCCCDDD AAAABCCDDDD AAABBBBCCDD
165,DDDDCBAAAAA DDDCCCBBAAA DDDCCCCBAAA CBAAAABCDDD ABCDDDDCBAA DDCCBBAABBC AAAABBCCDDD AAABBCCCDDD CCDDCDCCBAA AAABBCCDDDD DDCCBBAAAAB DDDDCCCBBAA AAAAACCDDDD CCDDDCCAAAA BDDDCCBBAAA BAAAACDDDDC DDCBBBBBBAA DDCBBAAAACD
166,AACCCCCCCCC DDCCBBBAAAA AAAACDDDDDD DDDDCBBAAAA AAABBBCCDDD CDDDDCBAAAA AAABCCCCDDD DDDDCBBAAAA AAAAABCCDDD AABBBCDDDDD DDDCBBAAAAA CDDDCCBBCBA DDCCBBBBAAA AAAABCDDDDB AAABBCCDDDD DDDDCBAAAAA DDDDDDBAAAA DDCBBBBBAAA
167,DDDDCBBAAAA DDDCCBBBAAA DDDCCCBBAAA AAAABBCDDDD DDDCCBBAAAA DCAAABBCDDD AAABBBCDDDD AAABBBBCDDD DDDDCCBAAAA AABCDDDDCBA DDDCCBBBAAA BAAAABBCDDD DDDCCBBBAAA AAABCDDDDCB AAAABCCDDDD AABCDDCBCBC DDDDCCBBAAA AAABBBCCDDD
168,AAACDDDCCCC DDDCCBBAAAA AAAAABCDDDD DDDDCCBBAAA AAAABCCDDDD CDDDDCBBAAA DDDCBBBAAAA DDDCBBBBAAA BBAAAABCDDD AAABDCCCCCD AAABBCDDDDD BBCCDDDDCAA DDCBBAABBBB DDDDCCBAAAA DCBBBBAABDD DDDCBBBAAAA CDDDCDCBAAA DDDDCBBBAAA
169,AAAABCDDDDD AAABBBCCDDD DDDDCBAAAAA DDDDCCBAAAA BAAAABBCDDD DDDCBBAAAAB AAAAABBCDDD DDBBBBBBBAA BAAAABBCDDD DDDDCBBAAAB AABCDCCCCCC DDDDCCCBAAA AAABCDDDDDD DDDDCCBBAAA DDDCBBAAAAA DDDCBBAAAAA AABBBBABDDD DDDDCCBBAAA
170,CBABDBDCCAA DDDCCBBAAAA DDDCCBAAAAC BBCCDDDCBAA CBAAABBCDDD AAABBCCDDDD DDDBAAABBCC AAAABBCCDDD DDDDCBBAAAB BCDDDDCBAAA CAAAABCDDDD BBBBAAACDDD CDDDCCBBAAA CCBBBAAABDD CDDDCCBAAAA AAABBCCDDDD AAAABCCDDDD AAABBBBBCDD
171,DDDDCCBAAAA AABBCCDDDCC DDDDCBBAAAA AAABCCDDDDB DDDCBBBAAAA AAABBCCDDDD BCCDDDDBAAA AAABBBCCCDD CDDDDCBBAAA AAAABCCDDDD DDDCBBBAAAA BBBBAAABCDD CDDDCCBBAAA DDDDCCBAAAA CDDCBBAAABB AAABBCCCDDD DABCDDBAACD AAABBBBCCDD
172,DDDCCBBAAAA DDDCCCBBAAA DDDCCCBBAAA AAAABCCDDDD DDDCCBBAAAA DDDCCBBAAAA BAAAABBCDDD AAABBCCDDDD AAAABBDDDDD DDCBAAAABCD AAABCCDDDDD CDDDDCCCBAA DCBBAAAABDD AACDDDDCCBA DCAACDCCBBA DDCAAABBBCC AAAABBCDDDD AAABBABCCDD
173,DDDCBBAAAAB AAAABCCDDDD DDDDCBBAAAB AAABCDDDCBB CCDDDBABBBA DDCBBAABBBB AAAAABBCDDD DDDBBBBBBAA AAAAABBCDDD DDDDCBAAAAB AABCDDCCCCC CCCDDDCCBAA AAACDDCCCCC CDDDDDCBAAA DBABDCCBBBB AACBBBCCDDD AABCCCDCBCD ABABBBBBCDD
174,DDDCCBBAAAA DDDCCBBAAAA DDDCBBAAAAB AAABCCDDDCC DDDCBBBBAAA AAABBCCDDDD AAACDDCBCCD AAABBBCCDDD DDDCBBBBAAA AAABCCBBCDD DDCCBBBBAAA DDDCBAAACCC ABCDDDCCBAA BBBBABABCDD CDDDDCBAAAA AAAABBCCDDD AAABCCCDDDD AAABBBBCDDD
