,0
886,DDDDDCCAAAA BDBABBBBCCC DDDCCCBDAAA AAABBBCDCCD DBBACCCCABD AABBCCBCCCD AAAABBBDDDD
887,DDDDDCBAAAA AACCCCDDDAA BBBBAAABDDD AAABBCCDDDD AAABBBCCDDD DDDDDCAAAAA DDDDDCAAAAA
888,DDDDDCCAAAA BAAABBBCDDD DDDDCCCCAAA DDCBCCBAAAA DDBBBBBBBAC AAAABBCDDDD AAAAACDDDDD
889,AAAAABBDDDD BBCCCCCDDAA AAAACDDCDDD AAABCCDCDCC BAACBBBCBBD AAAABCCCDDD CCCDDDDAAAA
890,DDDDDCBAAAA BDBBBBBBCCC CCCCCBBDAAA BBCDDCAABCC BBBBBBBBBCD AAABCCCBCDD AAABBCCDDDD
891,CCCCCBBAABD DCDDDDAAABB AAAACDCCDDD DCBBBDABBBA BACCBBBABCD AAABBCCCDDD DAABBBCCCCC
892,AAAAABDDDDD DCDDDBAAAAB BDDDCBAAABB AAABCCBBCDD DDCCAABAABD AAABCCCCCDD DDBAABBBBBB
893,AAAAABDDDDD DCDDDDAAAAA ACDDDCBABBB CBBCBDCCDAC CBBBABBACDD CCCCCCCCBAA AAABBCCDDDD
894,DDDDDCBAAAA ADDCBBCDBBB BBBAAAACDDD DDDCCBBBAAA DDCBAAAABCD AAAABBCDDDD CCCCCCCCCAA
895,DDDDDCCAAAA BAAABBBCDDD DDDDCCCBAAA DDCDBBBBBBA ABBBBBBBCDD AAAABCCDDDD AAAAAADDDDD
896,BBBBBBAACDD DDDDBAAABBB AAAABDDCDDD AAAABCCDDDD AAABCCDCCDD DDCBBAAAABB DDDBAABBBBB
897,DDDCCCCBBAA BAAAAACDDDD DDDDCBBBAAA CCAABBADDDD ABBBDDDCBBB BBBBBBBBBBD AAAABCCDDDD
898,DDDDDCBAAAA CCDDDDDAAAA BBAAAABDDDD AAABBCCCDDD AAABBBBCDDD DDDDDBAAAAA DDDDDCAAAAA
899,CCCCCBBAAAD DDBBBBCABCC AAAAABCCDDD DDDCBBAAAAA CBABBABBCDD AABCCCCCCCD DDDBAABBBBB
900,ABAAAABDDDC DBAAAABCDDD BDDDCBAABCC DDDCBBABAAA AAAAACDDDDD DDDDDCAAAAA AAABBCCDDDD
901,DDDDDCBAAAA ADDCBBCDBBB BBBAAAACDDD CDDDCCBBAAA BBCCCBAABDD AAAACCDDDDD DDDDDAAAAAA
902,DDDDCCCBBAA AAAABBBDDDD DDDDDCBAAAA AAADDBDCCCB BCCCCAACCDD AAACCCCCCDD AABCCCCCCCC
903,AAAAABCDDDD DCDDDDCAAAA ABDDDCBBBCC BAABDBCCDDC CCBCCCBABCD CCCCCCCCCCA AAABBCCDDDD
904,CCCCCBBAAAD CCCCDDDAAAA BAAAAADDDDD DDDCAAAAACC DDCCCDAAABD AAABBCCCDDD DDDDAAAABBB
905,AAAAABDDDDD DCDDDDCAAAA ABDDDCBBBCC AAABBDDCDCB AABCBBBBCDD AAABCCCCCDD DDDBAABBBBB
906,DDDDDCCAAAA BAAABBBCDDD DDDDCCCCAAA DDCCBBCAAAA CDDDBAAAABD AAAABBBCDDD AAABBBBCDDD
907,CCCCCBBAAAD CCDDDDCAAAA AAAAADDCDDD AAABBCCDDDD AABBACCCCDD DCAABBBBBCC DAABBBCCCCC
908,CCCCCBBAAAD DDBBBBAABCC AAAAABCCDDD DDDCCBBBAAA AAAABBCCCDD AACBBCCCDDD DDAABBBBBBB
909,DDDDDCCAAAA DBAAAABCDDD CCCCBBDDAAA AABBBADCCDC CCCDDDAAAAB AAACBCCCCDD AAAAADDDDDD
910,DDDDDCBAAAA ADCBBBCCABB BBAAAABCDDD DDDCCBBAAAA AAAACDCDCDD AAAABBCDDDD CCCCCDDDAAA
911,CCCCCCBAAAD BBAAAABDDDD CCCCDCBBBBB CBAAABBCCDD DCBBCBBBBBC ABAACBBCCDD AAAABBDDDDD
912,AAAAABCDDDD CCCCCCDDAAA AAACDDCCCCC BABDCCCACCD CCBCACAAACD AAABCCCCDDD DDDDCAAAAAB
913,AAAAAACDDDD DCDDDDBAAAA ACDDDCBABBB ABCCCDDCBBA AAACCCCBCCD AAABCCCCCDD DDDAAABBBBB
914,CCCCCBBAAAD CCDDDDBAAAA AAAAADDCDDD AAABBCCCDDD AABBBCBBBDD DDCAAABBBBC DDBAABBBBBB
915,DDDDDCCAAAA BAAABBBCDDD DDDDCCCCAAA DDDBBBCBBAA AABBBBCCDDC AAAABCCDDDD AAAAACDDDDD
916,CCCCCBBAAAD DCCDDDBAAAA BAAAAADDDDD DAABBDCBBCC DDDBBBBAABC AAABBCCCDDD DBABBBBBCCC
917,AAAAABCDDDD CCDDDDDAAAA AACDDCCBCCC ACDDCACBBCC CBCDBBCAAAD AAABCCCCDDD CCDDDDCAAAA
918,DDDDDCBAAAA BDBABBBBCCC CCCCBBBDBAA AAABBCCDDDD ABBBBBBCDCC AAABCCBBCDD AAAABCDDDDD
919,DDDDDCBAAAA CCCCDDDAAAA BBAAAABDDDD BBADCDDABAC DBCCCBBABBD AAABBCCCDDD CCCCCCCCCAA
920,CCCCCBBAAAD DDCBBBAABBB AAAABDCCDDD DDDCCBBBAAA AAABBBBBCDD ABBBCCCCCDD DBABBBBBBCC
921,CCCCCCBAAAD DDBBBBAABCC AAAABDCCDDD DDDCCBBAAAA BBBBBBBBCDD CCCCCCCCCAA AAABBCCDDDD
922,DDDDDCCAAAA BDBABBBBCCC CCCCBBDDAAA BCBDAABDDBB ACBDDDBAABD AAABBCCCCDD AAABBBCCDDD
923,DDDDDCCAAAA BDAAABBBCCD CCCCBBBDBAA BDDCBBCAACB BCCCCCAAACD AABBCBCCCDD AAABBCCCCDD
924,DDDDDCBAAAA BDBBBBBBCCC CCCCCBBDAAA AAABBACCDDD ABBBDBCCBCD AABBCBCCCCD AAAABCDDDDD
925,AAAAABCDDDD CBCCCCCDCAA AAABDDCCCCC AAABDDBBCDD BDCCAAACBBD AAABCCCCCDD DDDDCAAAAAA
926,DDDDDCCAAAA CAAAABBCDDD DDDDCCCBAAA DDDBCCCAAAA ABBBBBBBCDD AAAAABCDDDD AAAAABCDDDD
927,AAAAABBDDDD CCDDDDDAAAA AACDDCCBCCC AABCCCDCCCC BBCDDCAAABD AAABCCCCDDD DDDDBAAAABB
928,DDDDDCCAAAA BDAABBBBCCD CCCCCBDDAAA CDBABBBDBBC AAAABDDBCBC AABCCBDBBCD AAABBCCCCCD
929,BBBBBBBABDD DDDBAAABBBB CDDDCBAABBB AAACCDDDDBA BCCBAABACDD DDDCBBAAABB AAABBCCDDDD
930,DDDDDCCAAAA AAAABBBCDDD DDDDCCCBAAA CDCCCDDAABA CCABABDDBBD AAAABCCDDDD AAAAACDDDDD
931,DDDDDCBAAAA ADDCBBCDBBB BBBAAAABDDD CDDDCBBAAAA DCCCCBBAAAD AAAACDDCCCD DDDDDCAAAAA
932,DDDDDCCAAAA CBAAABBCDDD DDDDCCCBAAA DDDCAABAABB DDDBBAAAACB AAAAABBCDDD AAABBBBBDDD
933,AAAABDDDDDC DCDDDAAAACD DDDDCBAAABB AABCDDDCBCD DCBAABBBACD DDDDBAAAAAA AAABBCCDDDD
934,BBBBBBBAADD DDDDAAABBBB CDDDCBAAABB BABAABCDDDD CBCCBCBBBCC DDDBBBBBBBB AAABBCCDDDD
935,CCCCBBBAABD DCDDDDAAAAA AAAAADDCDDD AAABBCCCDDD BBCCCCCCCCA CCCCCCCCCAA AAABBCCDDDD
936,BBBBBAABDDD DDCAAAABBDD DDDDCBAAABB DCCDCCBAABA BBBBBBBBBCD DCBBBBBBBBB AAABBCCDDDD
937,BBBBBBBAADD DCDDDDAAABB AAAADDCCDDD DDCAABADCBB CDCBBCAAACD CCCCCCCCAAA AAABBCCDDDD
938,DDDDDCCAAAA BDBABBBBCCC CCCCCBBCDAA AABDDBBBCCD CBBBBCBACDD AABBCCBCCCD AAABBBCCCDD
939,CCCCCBBAABD DCDDDDAAABB AAAACDCCDDD DCAAAADCCCC DBACBBBBCCB AAABBCCCDDD DAABBBCCCCC
940,CCCCCBBAAAD CCDDDDBAAAA AAAAADDCDDD AAABBCCDDDD BCCCDCCCBCA DBAABBBBCCD DAABBBCCCCC
941,CCCCCBBAAAD DCCDDDBAAAA AAAADDCCDDD DBABCBBDBCC DCCBBBAAACD AAABBCCCDDD DAABBBCCCCC
942,AAAAAACDDDD CBCCCCCDDAA AAABDDDCCDD AAAAACCCCDD CDCBAAABBCD AAABBCCCDDD CCCCDDDCAAA
943,DDDDDCBAAAA AACCCCDDDAA BBBAAAACDDD CBBBCBDDDAA BBAABCBBBDD AAABBCCCDDD DDDDDCAAAAA
944,DDDDDCCBAAA AAAABBCCDDD DDDBBBBBAAA AABBCCDCCDD BBBBBBBBCDD BBBBBBBBBDD AAABBCCDDDD
945,DDDDDCCAAAA BBAAAABDDDD DDDDDCAAAAA DCACBCABBCB CBBBCBDBCAB AABCCDBBCCD AABCCCCCCCC
946,DDDDDCCAAAA BAAABBBCDDD DDDDCCCCAAA DDCCBBBBBBA DDBBCAAABBD AAAABBCDDDD AAAAABCDDDD
947,DDDDDCBAAAA CCDDDDDAAAA BBAAAABDDDD AAABBCCDDDD AABCCCDCCCD DDDCBAAAABB DDDDAAABBBB
948,DDDDDCCAAAA CBAAAABCDDD CCCCBBDBAAA DBCBBCABCCB BCDCACCABCD AABABDBBCCD AAAABDDDDDD
949,AAAAABCDDDD CCDDDDCAAAA ABDDDCBBBCC AADBCCCDCBB BCDDBBBABBD AAABCCCCCDD AAABBCCDDDD
950,AAAAABBDDDD CCDDDDCAAAA ABDDDCBBBCC DCBCDCDBAAA BCCACAABCCD AAAABCCCDDD DDDBAABBBBB
951,DDDDDCCAAAA CDAAAABBCDD CCCCCCBDBAA BBDABABBBDC DAAABBBDDDB ABDCBCCBABD AAAAABCDDDD
952,AAAAABCDDDD DCDDDDAAAAB BDDDDBAAABB BABACCACCDD BABBCCCABCD AAABBCCCDDD DDDDBAAAAAB
953,DDDDDCBAAAA ACCCCDDCAAA BAAAAADDDDD CBBABCDDCBA DCCCDBBAAAD AAABBCCCDDD CCCCCCCDCAA
954,DDDDDCCAAAA BAAABBBCDDD DDDDCCCBAAA DDCCDDBBAAA DCDDCCBAAAC AAAABBCCDDD AAABBBBBDDD
955,DDDDDCCAAAA AAABBBCCDDD DDCBBBBBAAA AABCCCDCCDD AAAAABCDDDD AAAAABDDDDD AAAABCCDDDD
956,DDDDCCCBAAA AAAABBBDDDD DDDDDCCAAAA DDDCCCAAAAA DDDDCABBBAA AAABCCCCDDD AAAACDDDDDD
957,AAAAAADDDDC CBAAAABBDDD DDDDCBAAABB DBABADDCCAA CCCCCCCCCCA AABBCCBBBCD AAABBCCDDDD
958,AAAAABCDDDD CCCCDDDCAAA AABDDDCCCCC AABACDDCCDD BBBBBBBBCCD AAABCCCCDDD BCCCCDDDCAA
959,CCCCCBBAAAD DDBBBBAABBB AAAABCCCDDD DDDCCCBBAAA ABBBBBBBCDD ABBABCCCCDD DBABBBBBBCC
960,DDDDDCCAAAA CCAAAABBCDD CCCBBBBDDAA ACDDAAABDDA AAABCDCDCCD AAABCCCCDCD AAAABBBDDDD
961,DDDDDCBAAAA ABCCCCDDBAA BBBBAAABDDD CBAAAADDCCC DDDBBAAAABD AAAABCCCDDD DDDBAABBBBB
962,AAAAABCDDDD DCDDDDCAAAA ABDDDCBBBCC AABCDDCBCCD DDCABABCBAD AAABBCCCDDD DDDBAABBBBB
963,AAAAABCDDDD CBCCCCCDCAA AAABDDCCCCC ABBABCDCDDC BBBCCAAACDD AAABCCCCCDD DDDDDAAAAAA
964,DDDDDCCBAAA AAAABBBDDDD DDDDBBBBAAA DDDDDBBBBAA BCCCCCCAAAD AABCCCCCCCD ABCCCCCCCCC
965,DDDDDCBAAAA ADDCBBCDBBB BBAAAABDDDD DDDCBBBBAAA DDDCCAAAABC AAABDCCCCDD DDDDAAAABBB
966,DDDDDCCAAAA AAABCCCDDDA DDDCCCCBAAA AACCDDCDAAA AAACDDDCABD AACCCCCCCCC AAABBCCDDDD
967,CDCCCCBAAAD DDCCBBBAABB AAAAABCCDDD DDDDCBBAAAA BBBBBBBBBCD ABAABBCCDDD DAABBBCCCCC
968,CCCCCBBAAAD DDBBBBBABCC AAAAACCCDDD DDDCCBBAAAA BBAAAABDDDD AAACDCCCCDD DDBAABBBBBB
969,DDDDDCCBBAA AAAAABCDDDD DDDDCBBAAAA AADDCCCCBAB CDCCAAAABBD AABCCCCCCCD ABCCCCCCCCC
970,DDDDDCBAAAA ABCCCCDDDAA BBBBAAABDDD ABBDDDDCAAC BCCCBBAAACD AAAABCCCDDD DDDBAABBBBB
971,DDDDDCCAAAA BBAAAABDDDD DDDDCDBAAAA DCBBBACBCBC BCCDCABBDBC BABBCCBABCD ABCCCCCCCCC
972,DDDDDCBAAAA ABDCBBCDDBB BBBAAAACDDD DDDDCBAAAAA DCBBAAACCDD AACCCCCCCCD DBABBBBBBCC
973,DDDDDCBAAAA CCDDDDDAAAA BBBAAAACDDD AAAABCCDDDD AAABBCCCDDD DDDBAAAABBB DDDDBAAAAAB
974,DDDDDCBAAAA AACCCCCDDBA BBBAAAADDDD DBBDCDBBABB DCCCCCDAAAC AAAABCCCDDD DDDDBAAAAAA
975,AAAAABCDDDD CCCCCCDDAAA AAACDDCCCCC AAAABBDDDDD BBBBBBBBCDD AAABCCCCCDD DDDDDAAAAAA
976,AAAAABCDDDD CCDDDDDAAAA AACDDCCBCCC AAABCDCCDCD BBCBBABCACD AAABCCCCDDD CDDDDDAAAAA
977,DDDDDCBAAAA ABCCDDDDBAA BBAAAAACDDD AAABBCCDDDD AAABCCCCDDD DDDDBAAAAAB DDDDBAAAAAB
978,DDDDDCBAAAA ABCCDDDDBAA BBBAAAADDDD AAABBCCDDDD AAABCCDDCDD DDDCAAAAABB DDDAABBBBBB
979,BBBBBBBAADD DDDDAAABBBB ACDDCCBACCC AAABBBCDDDD DDDBBAAAABB DCBBBBBBBBB AAABBCCDDDD
980,DDDDDCCAAAA AAAABBBDDDD DDDDDCBAAAA DDCCCBBAAAA ABBBBBBBBCD AABCCCCCCDD ABCCCCCCCCC
981,DDDDCCCBBAA AAAABBBDDDD DDDDCBBAAAA DDDDCCBAAAA CCCBBAAABCD BBBBBBBBBBD AAABBCCDDDD
982,CCCCCBBAAAD DCDDDDAAABB AAAADDCCDDD DCBBACDDBAA DDDCCCBAABC AAABBCCCDDD AAABBCCDDDD
983,AAAAABBDDDD CCCDDDDCAAA AABDDDCCCCC AAACBCDCCDD CBBBBBBABDD AAABCCCCDDD DDDDBAAAABB
984,DDDDDCBAAAA ABCCDDDDBAA CBBBBAAACDD AAABBCCDDDD AAABBCCCDDD DDDDDCBAAAA CCDDDDCAAAA
985,BBBBBBAADDD DDCAAAABBCD DDDDCBAAABB CCAACDBCDCB CCBCBBBBBCD DCBBBBBBBBB AAABBCCDDDD
986,DDDDDCCAAAA BBAAAABDDDD DDDDCDBAAAA DBBBBAACDCD DCABBCBBCCB AABCCCBBCCD AAACCCCCCCC
987,DDDDDCCAAAA CAAAABBCDDD DDDDCCCBAAA AABBCCDCDCC DCCCCCCBAAB AAAABBCCDDD AABBBBBBBCD
988,CCCCCCBBBCA AAAAACCDDDD DDCBBBBBAAA AACCCBCDCCD BBAAAACCCDD AAAABDDDDDD AAABBCCDDDD
989,DDDDDDAAAAA ABBBCCCDCBB DDDDCCCBAAA AAABCCDCCDD BBBBBBBBBBD AAAABBCCDDD AAABBCCDDDD
990,AAAAABCDDDD CCCDDDDCAAA AABDDCCCCCC AAAABCDCCDD AAABCDDBBCD AAABBCCCDDD CCCDDDDAAAA
991,DDDDDCBAAAA ADCBBBCCBBB BBAAAABDDDD DDDCCBBAAAA DDCBAAAABBD AAABCDCCDDD DDDDDCAAAAA
992,AAAAABCDDDD CBCCCCCDCAA AAACDDCCCCC AABBCDDBBCD BBBBABDBBCD AAABBCCCDDD DDDDBAAAABB
993,DDDDDCBAAAA AADCBBCDDBB BBBAAAABDDD DDDDCCBAAAA DDDCDCBAAAA AAAABCDDDDD DDDDDDCAAAA
994,CCCCCCCBBCA BAAAABCDDDD CCCCCDBBAAA ABCBBBBDCCC DBBBBBBBBBD AACACCCCCCD AAAACDDDDDD
995,AAAAABCDDDD CBCCCCCDCAA AAACDDCCCCC ABABCBBBDDB AABBBBCCCDD AAABCCCCDDD DDDDBAAAABB
996,CCCCCCBAAAD BBAAAABDDDD CCCCCCDAAAA CDDDCBABBAB BBAABBDDCDD BDBCBCCABCC AAAACDDDDDD
997,BBBBBAABDDD DDCAAAABBCD DDDDCBAAABB BAABCDBBDDD CDCBAACCCDD DDBBBBBBBBB AAABBCCDDDD
998,DDDDDCCAAAA DBAAAABCDDD CCCCCCDAAAA CCCCAAACCDB CBBDDCBDBAB CBCCADAACBD AAABBBBCDDD
999,DDDDDCBAAAA DDBBBBCAABB BAAAAACDDDD DDDDCBBAAAA DDDBAAAACBC AAABDCCCCDD DDDDAAAABBB
