,0
591,EEEEEEDBBBA AAABBBDEFFF FFFECCBBBAA EEFEEDCBAAA CCBBBBBCCFF BBBBBBBBDFF AAABCDEEFFF
592,EFEEEDCBBAA ACEEEEEFBAA CCBBBBBDFFF AABBCDDEFFF AAABDDEEEEF EFFFFCAAAAB EEFFFDAABBB
593,EEEEEEDBAAA BABBBCCEFFF EEEEEEDBAAA FEFDEEDAAAB DCBABCDDEDF AAABBDEEEFF AABBBBFFFFF
594,EFEEEDCBBAA ABFEDCDEFCC CBBBBBBCFFF FFFEDCBAAAA FFECBAABBCE AAABEFEEEEE FFFFFABBBBB
595,BBBBBBDFFFF EDEEEEDAAAA ACEFEDCCCDD ACCCBDCEDFD BBEDDCDACDF AABBDDDEEEF FBABBCCDDDD
596,BBBBBBDFFFF EDEEEEDAAAA ACEFEECCCDD AAACDEFEECB BBBBBEDBDFF AABBDDDEEFF FFCBBBCCCCC
597,EFEEEDCBBAA ACDDDEEFFAB CCBBBBBCFFF CCDBBBDEEFA BBBACDCCDFF AABBCDDEEFF EEEEFFAAAAA
598,BBBBBBBCFFF FFBAABBCCDF FFFEDBAABCC ECDDEFEEAAA DDDBCBBBBEF FFBBCCBBBCC AABBCDEEEFF
599,DDDDDCBBBBF FECCCCBABCD BBBAACEEFFF FFFEDBBCCBA BBBCCCCCDDF DDDDDDDDDDA AABBCDEEEFF
600,EEEEEEDCBAA BAABBCDEFFF FFFFEDBBAAA EDFFDDDDAAA BCDCDCDDBCF AAABDEEEEEF AAABEEEEEEE
601,EFEEEDCBBAA FFCBBBDBBCC CBBBBABEFFF FFEEEDCBAAA FEEDDBAABCF AAABEFEEEEE EEEEFFAAAAA
602,DEEDDCCBBAF EDEEEFCAABB BBBAACEEFFF FDBCAABEEFB DEFFBBBABDE AABBCDDEEFF AAABCDEEEFF
603,BBBBBBDFFFF DCDDDDEEFBA AAABEEEEEEE AAADEEEEDEE BBCBACCFECF AABBCDDEEFF BBCDDEEEEEA
604,EEEEEEDBAAA FCAABBBDFFF EEEEDDFCAAA AABBBDDEEEF FFEBBBEBBBC DDCDEBAABEF AAABBDFFFFF
605,DDDDDCBAAFF FECCAABDEFF AEFEDCBACDD AABBCEEEEEE AABBBBCEFFF FFFDBBBBBBB AABBCDEEEFF
606,EEEEEEDBAAA AABCCCDEFFB FFEEDDDCAAA AACCBFDDDFF BABCCCEDDEF AADDEEEEEEE AAABCDEEFFF
607,EFEEEDCBBAA AADDEEEEFCA CCCBBBBBEFF AABBCDEEEFF AABBCDDEEFF DEEEFFDBAAA DDDDEEEEDAA
608,CCCCCBBBCFF EEFFFCAABBB AAAAEEEDEEE AABBCDEEEFF AACCCDEDEFF FDBABBBCCDE FBABBCCDDDD
609,EEEEECBBAAE FECCCCBABDD BAAACEEEEFF FFEEDCBBBAA BBBBBBCDEEF AABCCDDEEFF AABBCDEEEFF
610,BBBBBBDFFFF DCDDDDEEFBA AAABEEEEEEE AABEFEEEDDD CCBBCCCCAFF AABBDDDEEFF AABBCDEEEFF
611,EEEEEEDBBBA ABABBBCEFFF FFFFECBBAAA FFFCCDCCBAA ABBBCCCCDEF AACDEEDDDEF ACDDDDDEEEE
612,EEEEEDCBBAA ABFEDCDEECC CBBBBBBDFFF EFFEDCCBBAA FFDCBACBBCE AADDDCDDEEF FFBBBCCCCCC
613,DDDDDCBBBAF EDEEEEFAAAA BBBBBACEFFF EDCDCFDCBBA EDBBBBBBCEF AABBCDDEEFF EEEEFFAAAAA
614,EFEEEDCBBBA AFEDCCDFDCC CBBBBBBCFFF FFFEDCCBAAA FECCECBABCE AABBCCDEFFF CCCDDDDEEEA
615,EEEEEDBAAAC FEDCCCBABCC BBBAACEEFFF FFFECCBCBAA FCCDBCABCDF ACCCCDDEEEF FCBBBCCCCCD
616,EEEEEEDBAAA CAABBBCDEFF EEEEEDDDAAA FFEDDCCBBBA FEFCBBBBBCD AABBCCCCEFF AABBCDEEEFF
617,EFEEEDCBBAA ABEEEEEFEAA CCBBBBBDFFF AAABCDDEEFF AABBBCCDEFF EEEFFECAAAB EEEEEEFAAAA
618,DDDDDCBBBBF EDEEEFCAABB BBAAACEEFFF EBACACEEDFC EEBBCDBBCEF AAABCDDEEFF FFBBBCCCCCC
619,EEEEEEDBAAA BAABBBCEFFF FFFFEDBBAAA FFEDDDCAAAB FFFCBBBBBAF BABBBBDEEFF BBBBCCCCCFF
620,EFEEEDCBBAA BFDCCCDEBCC CBBBBABEFFF FFFEDCCCBAA FFDBDBABBCE AAABEEEEEEE FFFFFABBBBB
621,BBBBBBDFFFF EDEEEEEBAAA ABEFEEDCDDD AABDCEFDECD BBDDCABCDEF AABBDDDDEFF FFFFABBBBBB
622,DDDDDCCBBBF EDEEEFCAAAB BBAAADEEFFF AABBCDEEEFF CBBBBEDCCFF FFCBBBBCCCE FBBBBCCDDDD
623,BBBBBBBFFFE FFFCAABCCDD AADFEDDCDEE AABBCDDFFFE AABBDCCFEDF EEDDDDDDDDA AABBCDEEEFF
624,EFEEEDCBBAA BFECCBDEBCC CBBBBBBDFFF FFFFDCBBAAA FEEDDCCAABE AAABEFEEEEE FFFFFABBBBB
625,EFEEEDCBBAA AFFDCCDFCCC CBBBBBBDFFF EFFFDCBBAAA FFFCBABABDE AAABDEEEEEF FFFFFABBBBB
626,EEEEDCBBAAF FECBBCBACDD BBBBAADEFFF FFEECBBBBAA DEDCBBAABFF AAABDFEEEEE EEFFFDAAAAB
627,EFEEEDCBBAA BFECCBDEBCC CBBBBABEFFF FFFEDCCBBAA FCAADBDCCEF AAABEEEEEEF FFFFCBBBBBB
628,BBBBBBDFFFF EDEEEEEBAAA AAEFEEDCDDD ADCAAEFEEDD BABDBDEDCDF AABBDDDEEFF FFFCABBBBCC
629,EEEEEEDBAAA DBAABBCDEFF EEEEEDDCCAA FFEDDDCBAAA FFCCCCDDCAC ABBBBCCDEFF BBBBCCCCDDF
630,EEEEEEDBBBA AABBBBCEFFF EEEEEEDBAAA FDEDFEDBAAA DEEEEECAABE AAABDEEEEEF AAABEEEEEEE
631,EEEEEEDCBBA BAABBCDEFFF FFDCCCCCBAA BBABDDEBEEF FCBBBBCCCDF AAAACEEEEEE AAABCDEEFFF
632,EEEEEEDBAAA FCAABBBDEFF DDDDCCFEBBB CCEBCCEDFCC BBBBBBEDCFF ABBBCDDDDEF AAABBEEEEFF
633,DDDDDCBBBBF EEEEFFAABBB BAAACEEEEFF FCECECEBBBB CBBDDCCBBEF AAABCDDEEFF FBBBBCCCDDD
634,EFEEEDCBBAA FFCBBBDBBCC BBBBAADEFFF FFEDDCCBBAA AABBCEEDCEF AAABDEEEEEF FFFFBBBBBBB
635,EFEEEDCBBAA ACEEEEEFBAA BBBBAADEFFF AABBCCEEEFF AABCDDDEEFF EEFFFDCBAAA DDEEEEEDAAA
636,EFEEEDCBBAA EDEEEEFAAAA CBBBBABEFFF AABBCDDEEFF AAABBCEEEFF FFFFDBAAABB FFFFDABBBBB
637,EEEEEEDBBBA AABBBBCEFFF FFFFECBBAAA AEAACDEDDEF DBBBBBCCCEF AAACEEEEEEF AAAEEEEEEEE
638,CCCCCBAAFFD FECCAABDEFF AAACEEDDEFF ECBAABBDEFF ABBBCCCDEEF AABCDDDEEEF FFBBBCCCCCC
639,EEEEECBBAAE FECCCCBABDD BBAAAEEEFFF FFEDDBBBBBA FECBABBBDFF AADDDDEEEEE FFBBBCCCCCC
640,EEEEEEDBAAA DFBBBBBCDEE EEEDDDCFBAA ABDDCDFFDCC AABCCCCEDEF AABBEDBCDEF AAADDEEEEEE
641,EFEEEDCBBAA EDEEEEFAAAA BBBAAAEEFFF AAABCDDEFFF AABBCDDEEFF EEFFFDCBAAA DDDDEEEEDAA
642,EEEEEEDBAAA BAABBBCEFFF EEEEEEDBAAA FFEEDDDCAAA FEBBBBBBCDF AAAACDEEEFF AAAABEEEEEE
643,EEEEEEDCCAA AAABDDDEEFF FDCCCCCCBBB ABBCDDEDEEE FEDBBBCCBCF AAACEEEEEEE AAABCDEEEFF
644,BBBBBBCFFFF DCDDEEEEEAA AAACEEEEEEE AABCDDEEFDE BBBCBBBBDFF AABBCDDEEFF EEEEFFAAAAA
645,DDDDDCBBBAF EDEEEFCAABB BBBBAAEEFFF FDDDDEFBAAA CBBDCCBBCEF AABBCDDEEFF FFFFFAABBBB
646,CDCCCCBBBBF EEEFFFAABBB BAAACEEEEFF AABCCDEEEFF AABCCCDDEEF FFFDBBBBBBC FFFFBBBBBBB
647,EFEEEDCBBAA ADDEEEFEAAB CCCBBBBBEFF DAACBCDFFEE EDDDDCAABEF AABBCDDEEFF EEEEEEEAAAA
648,BBBBBBDFFFF EDEEEEEBAAA AAEFEEDCDDD ABBDDEFEECB BFDCBDABCDF AABBCDDEEFF FFCBBBCCCCC
649,EEEEECBBAAF FEDCCCBABCC BBBAACEEFFF FFFEDCCBAAA DDBBAABDEFF AAACEEEEEEE EEFFFDAAABB
650,EFEEEDCBBAA EDEEEEFAAAA BBBBBACEFFF FBBBABDEEED FDDCABCBCEF AAABCDDEEFF FFFFCBBBBBB
651,DEDDDCCBBAF EDEEEEFAAAA BAAAAEEEEFF FABBADEECFB CEDDCABACFF AAABCDDEEFF AABBCDEEEFF
652,BBBBBBAFFFF FFFBAABCDDD AAFEEDCCDEE FDCEACCCDCC FDCCBBDAAEF EEEEEEEEAAA AABBCDEEEFF
653,BBBBBBDFFFF EDEEEEDAAAA ACEFEDCCCDD DBBACEFEDCB BDEEBCAACEF AABBCDDEEFF FFFBBBBBCCC
654,EFEEEDCBBAA AFEDCBDFDCC CBBBBBBEFFF FFEDDCBBBAA FFEDCDBAABE AAABDEEEEEF EEFFFDAAABB
655,BBBBBBDFFFF CCDDDDEEFBA AAABEEEEEEE AABDEFEDDCE DDCBBBCBDEF AABBDDDDEFF CCDDDEEEEAA
656,EFEEEDCBBAA ABFECCDEECC CCBBBBBBFFF DFFFEDCBBAA FFDDCAABCCE AAABEFEDDEE FFFFFABBBBB
657,BBBBBBDFFFF CBDDDDDEFCA AAABDEEEEEE BBDCCEFDACF EDBBCCDCBDF AAABDDDEEEF EEEFFDAAABB
658,EFEEEDCBBAA EDEEEEEAAAA BBAAAEEEEFF AAABCDEEEFF AABCDEEEDEF FFDBBBBBCCD FFFABBBCCCC
659,EEEEEEDBAAA BABBBCCEFFF EEEEEEDBAAA EECDAABDBFF EFECBBBBDCF AAABCDEEEFF AAABBDFFFFF
660,CBBBBBACFFF EECAABBCCEF FFFEDBAABDD FFEEECBBBAA EEEEDCAAADE FFBBCCBBBCC AABBCDEEEFF
661,EEEEEEDDAAA AAADDDDEEFF FFECCCCBBBB AAABEEEDEED DDBBDCABCFF BBBCCCCCCFF AAABCDEEFFF
662,EFEEEDCBBAA ADEEEEEEAAA CBBBBABEFFF AABBCDDEEFF AABCCDEEDEF FFFFDBAABBB EFFFFAABBBB
663,EFEEEDCBBAA EDEEEEFAAAA BBBBBACEFFF ECEEDCECDAA CDDCCCCBBDF AAABCDDEEFF FFFFBBBBBBB
664,DDDDDCBAABF FECCCCABCEE AAAAEEEDEFF FFEDDCBBAAA CBDDBABCDEF DDDDDDDDDDA AABBCDEEEFF
665,EEEEEEDBBAA BBAABBCFFFF EEEEDDFDAAA EEEEECAACCC BDCADDDDECF AACCCEDBCEF AADDDDEEEEE
666,EEEEEEDBAAA CFBBBBCCDEE EEEEDDCFAAA FBBDADBDDCF AABCCEDCDEF AABCDEDDDEF AAADDEEEEEE
667,CCCBBBBCFFE EDBABBBCDFF FFFEDBAABDD ABABACEEFFF ABBCCCCCEEF FDCCCCCCCCC AABBCDEEEFF
668,EFEEEDCBBAA EDEEEEFAAAA BBAAACEEFFF FCCDBDBBDEA EDBBBDBCCEF AAABCDDEEFF FFCBBBCCCCC
669,EEEEEEDCBBA BBABBBCEFFF FFFFCBBBAAA FEFDDDDDAAA FBBBBBCCCDF AACDEDDDDEF ACDDDDDEEEE
670,BBBBBBFFEDC FEAAABCDEFF AFFFDCAACDD FFEDCBBBBBB BBBBBBCEFFF EEEEEEDAAAA AABBCDEEEFF
671,EEEEEEDBAAA DBAABBCDFFF EEEEEEDBAAA FFEDECBBBBA FFFDDBCAABC BBBBBBCDEFF BBBBCCCCCDF
672,EEEEEEDBAAA CAABBBCDFFF EEEEEDDCCAA FFEEDDBBBAA CDDCBDEBBAF AABBBCDEFFF AABBBBDFFFF
673,EFEEEDCBBAA AADDEEEFFBB CCBBBBBCFFF EAAEBEEDDCC FECBBBBCBEF AAABCDDEEFF EEEEFFAAAAA
674,DDDDDDCBBBF CBABBBBEFFF EEEEDDFBAAA CCEEACCCCED DDAABDDDEEF DEACFDBBCDD AAABEEEEEEE
675,AAAAACEFFFE EDEEEEEBAAA AAEEEEDCDDD CEBBDEFCBCB CEEECBCBABF AABBCDDEEFF FFFABBBCCCC
676,BBBBBBDFFFF EDEEEEEBAAA AAEEEEDCDDD AAEFCBEBEEC ACEEECABDEF AABBDDDDEFF FFABBCCCCDD
677,AAACEFFEEDD FEFFCAABBCE FFFEDCBAABB ABBEDEEEBDE BCDBCCCBDDF AABBDDDEEEF FFFFABBBBBB
678,EEEEEDBBAAE EDEEEEFAAAA BBAAAEEEEFF AABBCDEEFFF DEDDEDDCDDA FBAABCCDDEF AABBCDEEEFF
679,DEDDDCCBBAF EDEEEFCAABB BAAAAFEEEFF FBABBCEDFEB EDCCBBBBDEF AABBCDDEEFF FABBCCDDDDD
680,EFEEEDCBBAA AADDEEEFFBB CBBBBBBEFFF FEBBABEEBDC EDDDDEEAACD AAABCDDEEFF FFBBBCCCCCC
681,EEEEDCBBAAF EDEEEECAAAA BBBBAAEEFFF AABBCDEEEFF AABBCEEEEEE FFFCBBBBBBC FFFFABBBBBB
682,BBBBBBCFFFF EDEEEEEBAAA ABEFEEDCDDD BBCDCFFEEAA BBCABCCDEFF AAABCDDEEFF FFFABBBCCCC
683,AAAABDFFFEE EDEEEEEBAAA ABDEEEDDDDD BAACEDEEEDF CDDDCBABCEF AAABCDDEEFF EEEEEFDAAAA
684,EFEEEDCBBAA ABFECCDEFCC CCBBBBBCFFF EFFEDCCBAAA FDDECBAACCF AAACEFEEEEE FFFFFABBBBB
685,EEEEEEDBAAA CAABBBCDFFF EEEEEEDBAAA CFCCEEFEAAA DBBBBBCCCEF AAABCDEEEEF AAAADEEEEEE
686,EFEEEDCBBAA ACEEEEEFBAA CCBBBBBDFFF AABBCDDEEFF AAABCDEEEFF EFFFECAAABB EEEFFDAABBB
687,BBBBBBDFFFF DCEEEEEFBAA AABEEEDDDEE DBABADDFFEE CBBDBDABDFF DDDDDDDDDDA AABBCDEEEFF
688,EFEEEDCBBAA ABFECCDEECC CCBBBBBBEFF DFFEDDCCBAA FECBBBBABEF AAACDEEEEEE FFFCBBBBBBB
689,DDDDDCBBABF FEBBCCBACDD BAAACEEEEFF FFEECCBBBAA CDBABBBCDFF ACDCCCDDEEF FFBBBBCCCCC
690,EFEEEDCBBAA AEFDCCDFCCC CBBBBBBCFFF FFFEDCBBAAA FEEDCBBAACC AAABDEEEEEF FFFFFABBBBB
691,BBBBBBDFFFF DDEEEEEFBAA AABEEEEDEEE AABADEEDDFE BCDCDCDCBDF AABBCDDEEFF EEEEEFDAAAA
692,DDDDDCBBBBF EEEEFFAABBB BAAAAFEEEFF FEEBADBCCCB FCDCCCBABDF AAABCDDEEFF FFCBBBCCCCC
693,EFEEEDCBBAA AEFDCCDFCCC CBBBBBBCFFF EFFEECBBAAA FFDDCCBAAAC AAABCEEEEEF EEFFFDAAABB
694,EEEEEEDBAAA BAABBBCEFFF EEEEEEEBAAA FFEDDBBBBBB FDDDEBCAABF AABBBCDDEFF BBBBBCCCDFF
695,BBBBBBDFFFF CCDDDDEEFBA AAABEEEEEEE FFEDBCCBBAB CBDBCCDABFF AABBDDDEEEF FFFABBBCCCC
696,CCCCCCBBBFF FEFEAAACCDD DFFEDBAABDD ECCBAABFFDD CCDDDECCCDB FFFBBBBBBBB AABBCDEEEFF
697,EFEEEDCBBAA BFECCCDDBCC BBBBBABEFFF FFFEDDBBAAA CBBABCCDEFF AABCDEEEEEF FFFCBBBBBBB
698,DDDDDCBBBBF EDEEEECAAAB BBAAAEEEEFF AABBCDEEEFF AACDDDDDDEF FFDBBBBBBCD FFFABBBBCCC
699,CCCCCBBBBFF EEFFFCAABBB BAAACEEEEFF AABBCDEEEFF AABBCDEEEFF FFFFECBAAAB EEEEEEFAAAA
700,DDDDDCBBABF FECCCCBABCC BBAAAEEEFFF FFEDDCCBAAA DBBABDCCDEF AADDDDDEEEE FFFBBBBBBCC
701,DDDDDCBBABF FECCCCABCDE AAAAEEEDEFF FFEEDCCBAAA BBBBCBCCEFF DDDDDDDDDDA AABBCDEEEFF
702,EEEEEEDBAAA AABBBBCEFFF EEEEEEEBAAA FFEECCCCBAA FFCBBBBBCDF ABBBBBCDEFF BBBBBCCCFFF
703,EFEEEDCBBAA AFEDCCDFCCC CBBBBBBDFFF FFFEDCBBBAA FEEEDCBAABD AAABDEEEEEE EEEEEFAAAAA
704,AAACEFEEEDD EEEFFFAAABB AEFFEDBABBB BBDEEDEECAB ACCCCCCBCCF AABBCDDEEFF FAABCCDDEEE
705,EFEEEDCBBAA ABEEEEEFEAA DCCCCBBBAFF AABBCDEEEFF AABBCCDEEFF DDDEEFFDAAA DDDDEEEEDAA
706,BBBBBBDFFFF EDEEEEEDAAA AACFEEDDDDD ABDEFCCBEDE BDDCEBBBBEF AABBDDDEEFF EFFFFAABBBB
707,EEEEEEDBAAA ECAABBBCFFF DDDDDDCFBAA AADBCCEFEED DCFECEEABBD ACCCEEDCBDF AAABBEEEEEE
708,EEEEEEDCBAA BAABBCDEFFF FFFFCBBBBAA EBCEFFFBAAB ABCFBBCCCDF AABCDEEEEEF AAAEEEEEEEE
709,BBBBBBDFFFF EDEEEEDAAAA ACFFEDCBCDD FFBBBCBDCDC BBBDCDBACFF AABBCDDEEFF AAABCDEEEFF
710,EFEEEDCBBBA ABEEEEEFEAA CCBBBBBBFFF AABBCDEEEFF AABBCCDEEFF ABCDEEFFEAA AAABCDEEFFF
711,EEEEEEDBAAA CFBBBBCCDEE EDDDDCCFBAA DACABBFEEED DDAACBEEFED AABBDDEDDEF AABBBCCFFFF
712,EEEEEEDBAAA BBABBBBEFFF EEEEEFBBAAA FBCBAABEDDF FFEDBAAABDE AACCEDCDDDF AAADEEEEEEE
713,BBBBBBDFFFF DDEEEEEFBAA AABEEEEDDEE DBBABAEDEFF ABBBDBDCDEF AABBCDDEEFF FFFFBABBBBB
714,EEEEEDBBAAE FEDDCCDAABB BAAACEEEEFF FFEDDDBBAAB CBBBBBCCDFF DDDDDEEEEAA AABBCDEEEFF
715,CCCCCCCCEFB BBAABCDEFFF EEEEFEBBAAA AABDEECDEEF DEFFEAABDBD AABBEDDDDEF AABBBCCFFFF
716,EEEEEEDBAAA FBABBBBEEFF EEEEDDFCAAA CBBBEBFCEFB FBCCBFBDCDE EFCABBCCCDF AAAADEEEEEE
717,EFEEEDCBBAA ABEEEEEFEAA CBBBBABDFFF AAABCDEEFFF AABBCDDEEFF FFFFDBAAABB FFFFDABBBBB
718,CDDCCCBBBBF EDEEEECAAAB BBBAAAEEFFF AAABCDEEEFF AABCDEDDDEF FFFEBBABBBC FFFFABBBBBB
719,EEEEEEDBAAA BABBBBCEFFF EEEEEEDBAAA FFDDEEDAAAB DDEDCBAADFE AAABDEEEEEF AAABEEEEEEE
720,EEEEEEDBAAA EBAABBBDFFF DDDDCCCCFCA ABCCADDFFED CCDECACECCE BDEEDBAACEF ABBBBBBFFFF
721,EEEEEDBBAAE FECCCCBACDD BBBAABEEFFF FFEDDCBBAAA BBBBBDDCDEF ACCCCCDEEEF FBBBBCCCCDD
722,EEEEEEDBAAA AABBBCCEFFF FFFEEECBAAA EEBAADEDEED DBBBEBCCCDF AAABCEEEEEF AAAABEEEEEE
723,DDDDDCBBBBF EEEEFFAABBB BAAAAFEEEFF DCEEBEEBBDB EFFDCBABBDE AAABCDDEEFF FFFBBBBBCCC
724,EFEEEDCBBBA ACEEEEEFBAA CBBBBACEFFF AABBCDDEEFF AABBDDDDEFF DDEEFFECBAA BCCCDDEEEEA
725,EFEEEDCBBAA ABFEDCDEECC CBBBBBBCFFF FFFEDCCBAAA FFFEDCBAABB AAABCEEEEEF EEFFFDAAABB
726,BBBBBBCFFFF EDEEEEDAAAA ACEFEDCCCDD BAAEDCDCFFC BBDCECDAAEF AABBDDDEEFF EEEFFDAAABB
727,BBBBBBDFFFF CBDDDDDEFFA BAAADEEEEEE ABEDEFEECBB BBDACCCDEEF AABBDDDEEFF EEEEEFDAAAA
728,EEEEEEDBAAA CFEBBBCCCDD FFFEDCBABBA DDCDBBBEBDE EDCCBACCBEF AABBDEDDDEF AAABBEEEEFF
729,BBBBBBDFFFF EEEFFFAAABB AEFFEDBABCC BAABEEDDEEE CECDBAACEEF AABBDEDEEEF FFFBBBBBBCC
730,EFEEEDCBBAA EDEEEEFAAAA CBBBBABEFFF AABCCDDEEFF AAABBCDEEFF DEEEFEDBAAA CCDDDEEEEDA
731,EEEEEEDBAAA CBABBBCDEFF EEEEEDDDBAA FFECCCDCAAA DEBBBEBBCDF AABBCCDEFFF ABBBBBBFFFF
732,EEEEEEDBBAA AABBBBCEFFF EFEEEEBBAAA EDEFFDCAAAC DEEEECAAABF AAACDEEEEEF AAACEEEEEEE
733,DDDDDCBBBBF FEDCCCAACDD BBBAACEEFFF FFFDCBBBBBB BBBBCCDDDEF DDDDDDDDDDA AABBCDEEEFF
734,EFEEEDCBBAA BFEDCCDDBCC BBBBAADEFFF BFFEDCEEBAA AABBDDBDEFF AAABCDEEFFF FFFFFBABBBB
735,DDDDDCBBBAF EDEEEEFAAAA BBAAACEEFFF FDECBCBBDBE EBBBADCCCEF AAABCDDEEFF FFFBBBBBCCC
736,AAAAACEFFFE DCDDEEEEEAA AAADEEEDEEE ACDEAEDADEE CDDBBBBBDEF AABBDDDEEFF FFFBABBBBCC
737,EFEEEDCBBAA EDEEEEFAAAA CBBBBABEFFF AAABCDDEEFF AABCDDCCEFF EEEFFECBAAA DDDEEEEEBAA
738,EEEEEEDBAAA CAABBBCDFFF EEEEEEDDAAA FFEFEDDAAAA BCCCCCDDEBF AAAABDEEEFF AAABBDEFFFF
739,EFEEEDCBBAA ABEEEEEFEAA CCBBBBBBFFF AABCDDDEEFF AABBCDDEEFF EEEEFFDAAAA EEEEEEFAAAA
740,DDDDDCBBBAF EDEEEEFAAAA BBBBAAEEFFF FDBEEEEBAAB BDDDCCBABEF AAABCDDEEFF FFFFFABBBBB
741,DEDDDCBBBAF EDEEEEFAAAA BBAAACEEFFF EDCEEEEBAAA CDDDCCBABEF AAABCDDEEFF FFFCBBBBBBB
742,CCCCCCCCBFB BBAABCDEFFF FFDCCCCBBBB ABCDEBFEDBE ACCBBBDEEFF AAABEEEEEEE AABBCDEEEFF
743,EEEEEEDBAAA EBAABBBEEFF DDDDCCFCBBB EAAABEEFEEC BBBCEEFBCCE AACDDDDBCDF AABBBCCDFFF
744,EFEEEDCBBAA EDEEEEFAAAA BBAAACEEFFF FDBBBBBCEDD ECBECABCDFF AAABCDDEEFF FFCBBBCCCCC
745,EFEEEDCBBAA EDEEEEFAAAA BBBAAAEEFFF AAABCDEEEFF AABBBCCDEFF EEFFEDCBAAA DDEEEEEDAAA
746,EEEEEEDBAAA EBAABBBDFFF DDDDDDFEAAA CDDDDBDEDBB ABCCDFDDDDF CDCADEBBBDF AAAABEEEEEE
747,DDDDDCCBBBF EDEEEFDAAAA BBBAACEEFFF AABBCDEEEFF CBCEFFDBCDA FCAABBCCDEE FABBCCDDDEE
748,EFEEEDCBBBA ACDEEEEFCBB CBBBBBBCFFF BBABBFEEEEE DBDCCCBBBEF AAABCDDEEFF AAABCDEEEFF
749,EFEEEDCBBAA ABFECCDEECC CBBBBBBCFFF FFFEECCBAAA FDBBBBBBCEF AAABDEEEEEF FFFFFABBBBB
750,EEEEEEDBAAA DDBAABBCEFF DDDCCCCFFBB AACCCCDFFDD ACDBCEECBDE BABCDDCDCEF AABBBBFFFFF
751,EFEEEDCBBAA ABEEEEEFEAA CCBBBBBBEFF AABBCDEEEFF AABBCDDEEFF EEEFFEBAAAB EEEEFFAAAAA
752,BBBBBBBBFFF FEFFAAABCCC AAAFEEDDDEE AABBCDDDFFF EEEDDCDDDCA CAABCCDEEFF FABBCCDDDEE
753,BBBBBBDFFFF EDEEEEEDAAA AACEEEDDDDD ABBBFCDDDDD ACBDEEDCBDF AABCDDDDEEF FFFABBBBCCC
754,EFEEEDCBBAA FFCBBBDABCC BBBBBADEFFF FFEDCCBBBBA FECBBABBCEF AAABCEFEEEE EEEEEEEAAAA
755,BBBBBBBCFFF FFDAABBCCDF FFFEDBAABCC FDDDCBABCCD CDDECDDAACF FFBBCCBBBCC AABBCDEEEFF
756,EEEEEDCBBBA BBAABBDEFFF DDDDDFCBBBB ECCBCACCEFE FECCFDCCBAD AACBBBCEFFF AAACEEEEEEE
757,DDDDDCBBBBF EDEEEFCAABB BAAAAEEEEFF EBBEEEEEAAB CDDDCCBBBEF AABBCDDEEFF EEEEEEDAAAA
758,EEEEEEDBAAA EBAABBBDFFF DDDDDCFBBBB DABABBDEEFE EBFDBBBBCCE BBCBEDCBCEF AAABBDEEFFF
759,DDDDDCBBABF FECBCCABDEE BAAACEEEEFF FFEDDCBBBBB CCBBBBBCDFF AACCEDDDEEF FFCBBBCCCCC
760,EEEEEEDBAAA FDBBBBCCDEE EEEEEDDEAAA AAABCCEFFFF EEEECAACECE AABCEDDDEFF AAACEEEEEEE
761,EEEEEDCBBAA EDEEEEFAAAA CBBBBACEFFF AAABCDDEFFF AABCCDDDEFF FFEBBBBBBCD FFBBBBCCCCD
762,EEEEEEDBAAA CAABBBCDEFF EEEEEEDBAAA FEEBCDDAADE ABBBCCCCDEF AAABDEEEEFF AAAADEEEEEE
763,CDCCCCBBBBF EEEFFFAAABB BBAAACEEFFF AAABCDEEEFF AABBCDDDEFF FFFFEBAAABB EEEEFFAAAAA
764,EEEEEEDBAAA CAABBBCDFFF EEEEEEDBAAA FFEEFBCBBBA EFFCABBBBCF AABBBCDEFFF BBBBBBCDFFF
765,DDDDDDCBBBC BBAABBEEFFF EEEEEFBBBBA CCCADADEFDD FBCCCECCCCD BBDEFCBDBBF AAADEEEEEEE
766,EFEEEDCBBAA EDEEEEFAAAA BBBBAAEEFFF DACEDEECDCB FEEDCBABCAF AABBCDDEEFF FFFFFABBBBB
767,EEEEEDCBAAE FEEDDDDAABB BBAAAEEEFFF FFECDDCBAAA BBBBBBBEFFF EEEEEEAAAAA AABBCDEEEFF
768,EEEEEDCBBAA BFECCCDDBCC BBBBBACEFFF FFEEDCBCAAA AABBDDDDDEF ABBBCCDEEFF FABBCCDDDDD
769,BBBBBBDFFFF EDEEEEEDAAA AACEEEDDDDD EDEEBDDAACE DCDBBABCDEF AABBCDDDEFF FFABBCCCCDD
770,CCCCCCEFBBB BBABBBCEEFF FFFEDCCBAAA ABCEEFFEBBB BBBBCECBCEF AACDDEEEEEE AABBCDEEEFF
771,EEEEEDCBBAA CFECBBDDBCC CBBBBABEFFF FFFEDCBBBAA FEEEEDBAAAC AAADFEDDEDE FFFFBBBBBBB
772,EEEEEEDBAAA DEABBBBCEFF EEEEDDDFAAA ECFCBBADDDD FEEEEBBBBBB AABFDDCECDF AAAABEEEEEE
773,BBBBBBAFFFF FFFBAABCDDD AAEEEDDCDEE FEDBCDEEBAA BBEECDABCFF AABBCDDEEFF FFBBBCCCCCC
774,EEEEEEDCBBA BBABBBCEFFF FFFFECBBAAA FEFFCDDDAAA EFFBAFBABBE AAABCDDEFFF BBBBBBBDFFF
775,EFEEEDCBBAA CFDCBBDEBCC BBBBBACEFFF FFFDCCBBBAA FEDCBCBAACF AAACEEEEEEF FFFFBBBBBBB
776,EEEEEEDBAAA DDAABBBCFFF DDDDCCCFBBB ABDACBDFFFE ECBFBBBBCDF BBCCFACCCEF AAABBDEEFFF
777,EFEEEDCBBAA EDEEEEFAAAA BBBBAAEEFFF AABCCCDEFFF AABCCDDEEFF FFECCBBBBBC FFFCBBBBBBC
778,DDDDDCBBBBF EEEEFFAABBB BAAADEEEEFF FDEDADDCCBB FDECBBBABDF AABBCDDEEFF FFFFBBBBBBB
779,EEEEEEDBAAA EBAABBBEFFF DDDDCCFEBBB BCADEEADEEE EEDAACEDDDC ABCBDDCEDEF AAABBEEEEEF
780,BBBBBBDFFFF DCDDEEEEEAA AAACEEEEEEE AAADEEFEEBD ACBBDDCCDEF AABBCDDEEFF EEEFFDAAABB
781,EFEEEDCBBAA EDEEEEFAAAA BBBBAAEEFFF FBCBBFDCCCB DEEDDBAACEF AAABCDDEEFF FBBBBCCCDDD
782,EEEEEEDBAAA CBABBBCDEFF EEEEEDDDBAA FEEDECCCAAA DBBBBBCCCEF AAAACDEEEEF AAAABEEEEEE
783,EFEEEDCBBAA ADFDCCCEFCC CCCBBBBBDFF DFFFEDBBAAA FEEDCBAABCE AAABCCDEFFF DDDEEEEEDAA
784,EEEEEDCBBAA AADDDDEFFCB CCBBBBBCFFF CADDCDDDFBD EEEEDDAAACE AAABCDDEEFF FFFFFABBBBB
785,EEEEEEDBAAA BABBBCCEFFF EEEEEEEBAAA FEECDDDDCAA DEEEEECAABE AAABBCDEFFF AABBBBDFFFF
786,CCCCCCBBAFF EEEFFCAABCC AAADEEDDEEE FEEEBDBBBCA DDDCCBBCBFF AABBCDDEEFF FABBCCDDDDD
787,CCCCCCBBAFF EEEFFCAABCC AAADEEDDEEE FEBDADDCCCB FFEFBBBABCD AAABCDDEEFF FABBCCDDDDD
788,DEDDDCBBBAF EDEEEFCAABB BBAAACEEFFF FEEBCDBEDAB EDCBCCBBBDF AAABCDDEEFF FFCBBBCCCCC
789,AAAABCFFFFE EEFFFDAAABB BFFFECBABBB BBABDFECECF EFDDDBAAACF AABBCDDDEFF FFABBCCCCDD
790,DDDDDCBBABF EDEEEFCAABB BAAADEEDEFF FECBCBBCDCC CCCBDCACDFF AAABCDDEEFF AABBCDEEEFF
791,EFEEEDCBBAA ACDDDEEFFBB CCBBBBBCFFF FDBAAAEEEDD EECEBABBBEF AABBCDDEEFF EEFFFDAAABB
792,EFEEEDCBBBA ADDEEEFEAAB BBBAAAEEFFF FCEEECABACD DDDCCBBABEF AAABCDDEEFF DDEEEEEEAAA
793,EEEEEEDCBBA ABBBBBCEFFF FFFFEDBBAAA CFECDDECAAA FFCBBBBBCDF AABCEDDDDEF AAAEEEEEEEE
794,EFEEEDCBBAA ADDEEEFEAAB CCBBBBBCFFF DAAEDFCECCB FDDBCDBABDF AABBCDDEEFF EEFFFDAAABB
795,AAAACFFEEEE EEEFBAABCEE FFFEDCAABBB DADFFECBBBE EEEEDAAACEF FFFEBBBBBBB AABBCDEEEFF
796,DDDDDCBBBBF EEEEFFAABBB AAAAEEEDEEE CABBBCECFFE EEEEDCAAACF AABBCDDEEFF EEEEFFAAAAA
797,EEEEEEDBAAA DDAABBBCEFF DDDCCCCFCBB ACBEEDADEEE EEEEEEDAABA AABCEECDCEF AAABBDEEFFF
798,EEEEEEDBAAA CAABBBCDEFF EEEEEEDCAAA FFEEECCCBAA CDDDEEBCADE AAABCDEEEFF AAAABEEEEEE
799,BBBBBBDFFFF DCDDDDEEFAA AAABEEEEEEE ABCEFFEBBBE BCCBBEBBBFF AABBDDDEEFF EEEEFFAAAAA
800,EEEEEDCBBAA FFCBBBDBBCD BBBBBABEFFF FFEDCCBBBAA AABBCDDDEFF AAACEEEEEEE FFFFCBBBBBB
801,DEEDDCCBBAF EDEEEFCAABB BAAAAFEEEFF FCBCDDBCDDB DBBDDDCACEF AABBCDDEEFF FABBCCDDDDD
802,DDDDDCBBABF EEEEFFAABBB BBAAAFEEEFF FEEECEBBBAA EEBCEBDAAFF AABBCDDEEFF FABBCCDDDDD
803,AAAAACEFFFF EDEEEEEDAAA AACEEEDDDDD AAADEFFEECC AACEEDCBCEF AABBDDDEEEF EFFFFAABBBB
804,EFEEEDCBBAA AADDDDEFFCB CCBBBBBCFFF EBADEEFBCDC EEDDECBBBAF AABBCDDEEFF FFFFFAABBBB
805,BBBBBBDFFFF EDEEEEEBAAA ABEFEEDCDDD ACDFEBEDBBB EDABCDCCBDF AABBDDDEEFF AAABCDEEEFF
806,EEEEEEDBBBA BAABBBCEFFF FFFEEECBAAA FFEEDCCCAAA DEEEBEEAAAD BBBBBBCDEFF AABBCDEEEFF
807,DCCCCCBBAFF FEFEAAABCDD BFFEDCBACDD FEBBBDDCCCB FFEEBBAAACE FFFDBBBBBBB AABBCDEEEFF
808,EEEEEEDBAAA FDBBBBCCDEE EEEEDDFDAAA AECCCBBEDDE ACFBBBDECCF AABBCDDCDEF AAADDEEEEEE
809,BBBBBBDFFFF EEEFFFAAABC EFFFDCBABBB ABBCEEFBDED DCCDCFCAAEF DDDDDDDDDDA AABBCDEEEFF
810,EEEEEEDBAAA CBABBBCDEFF EEEEEDDDBAA FEEEDDCBAAA EFFBDABBBCF AAABBCEEEFF AAABBDFFFFF
811,EFEEEDCBBAA ACDDDEEFFAB CBBBBBBEFFF FBAAABFEEED EEEEEABAADE AABBCDDEEFF EEFFFDAAABB
812,EFEEEDCBBAA ACDEEEEFCBB CBBBBBBEFFF EFAAEEEADCC FFCBBBCBCEE AABBCDDEEFF FFFFFAABBBB
813,CDDCCCBBBBF EDEEEECAAAB BBBAACEEFFF AAABCDDEEFF AABCDDDEEEF FFFCBBBBBBC FFFCBBBBBBC
814,EFEEEDCBBAA ABFEDCDEECC CBBBBBBDFFF AEFFFECBBBA ABBCBBBDFFF AABCDFFEDDE FFFFFBABBBB
815,BBBBBBBFFFF FEAABBBCDFF FFFEDBAABCC FAABCDDDEEE DDDDDDDCCCB FCCCCCCCCCC AABBCDEEEFF
816,BBBBBBDFFFF EDEEEEEBAAA ABEEEEDCDDD AAAEEFEDDCD BBBCEEECACF AABBDDDEEFF FFCBBBCCCCC
817,AAAABEFFEEE EEEAAAADEEE FFFEDCAABBB FACEFCCBBCD BDDCCCEDDCD FFCBBBBBBBC AABBCDEEEFF
818,BBBBBBDFFFF DCDDEEEEEAA AAACEEEEEEE AABCDFFDDDB ABCCDDDCBEF AABBDDDEEFF EEEFFDAAABB
819,EFEEEDCBBAA ABEEEEEFEAA CCBBBBBDFFF AABBCDDEEFF AABBCDDEFFF DEEEFFECAAA DDDDEEEEDAA
820,EEEEEEDBAAA FCAABBBDEFF DDCCCCCFFBB ABBCBDBFEEE BCDDAFCBEED ABBCECDCDDF AAABBDEFFFF
821,CCCCCBBBBFF EEFFFCAABBB BAAABEEEEFF AAABCDEEFFF BCDDDEDDDEA FCAABBCCDEF AABBCDEEEFF
822,DDDDDCBBBAF EDEEEFCAABB BBAAACEEFFF FCBBBBDDDED EDCDDBAABEF AABBCDDEEFF FFFCBBBBBBB
823,EEEEEEDBAAA ABBBBBCEFFF FFFFEDBBAAA DEDEDEECCAA DFEBBBBBCDF AABCEEDDDEF AAAEEEEEEEE
824,EEEEEEDBAAA AAACCCDEFFE FFEEEDDCAAA CCEEAAFDCBC FFDCDDCBCBB AABEEEEEEEE AAABCDEEFFF
825,BBBBBBDFFFF EDEEEEEBAAA AADFEEDCDDD ABBBCFFEDED DCDCDCCAADF AABBCDDEEFF FFFFABBBBBB
826,DEDDDCCBBAF EDEEEFCAABB BBBAACEEFFF FEECABDDCCB FDDBCCABBDF AAABCDDEEFF FABBCCDDDDE
827,EFEEEDCBBAA AAEEDCDEFDC CCBBBBBBEFF DFFFEDCBAAA FFEECBBBBAC AAABEFEEEEE FFFFFABBBBB
828,AAACEFEEEDD EEFFFAAABBD FFFFECBAABB EEEEAEDBBAB BCCCCBCCCFF AABBCDDEEFF FFFFABBBBBB
829,EFEEEDCBBAA AADEDCDEFDC CBBBBBBCFFF DEFFEDCBBAA EEEEDAABBBF AAABDFFEEEE EEFFFDAAABB
830,EFEEEDCBBAA ACDDDEEFFAA CCBBBBBBEFF BABCCCCFFFD BBBDDCCBCEF AAABCDDEEFF DDDDEEEEDAA
831,EEEEEDBBAAE FECCCCBABDD BBAAAEEEFFF FFEEDCCBBAA CCCBABCDDFF ACDDDDDDEEE FABBCCDDDDD
832,EFEEEDCBBAA AADDDDEFFCB CCBBBBBCFFF BCBBABBFFFE EEEDEAAAAEF AAABCDDEEFF FFFFFABBBBB
833,EFEEEDCBBAA ACEEEEEFBAA CCBBBBBDFFF AAABCDDEFFF AABBBCDEEFF EEEFFECAAAA EEEEEEFAAAA
834,DDDDDCBBBBF EDEEEECAAAA BBBAABEEFFF AAABCDEEEFF AABBCDEDEFF FFFFEBAAABB EEFFFDAABBB
835,AAAABEFFEEE EEDAAACDEEE FFFEDCAABBB FDDEEECCCAA CCCCDDDCCEE FFCBBBBBBBC AABBCDEEEFF
836,BBBBBBDFFFF EDEEEEEBAAA ABEFEEDCDDD CBBBDFDCBCF EEABCCDCACF AABBCDDEEEF FFABBCCCCDD
837,CBBBBBBCFFE FEBAABBCDDF FFFEDBAABDD FEABCDCDCBB EEDCCCCDDCB FFCBBBBBBBC AABBCDEEEFF
838,EFEEEDCBBAA AFFDCCDFCCC CBBBBBBDFFF EFFEECBBBAA FEBCBBBACFF AACEEDDDDEE FFFBBBBBCCC
839,EEEEEEDBAAA BAABBBCEFFF FFFEEECBAAA FEFDDDDDAAA BCDDDDEEABE AAACDEEEEEF AAABEEEEEEE
840,EFEEEDCBBAA AADEEEEEFCA CCBBBBBDFFF AABCCDDEEFF AABCCDEEEEF FFFFDBAAABB EFFFFAABBBB
841,AAACEFFEEDD FEFEAAABBDE FFFEDCBAABB CBBEFECBBBE DBCCDDCABDF DDDDEEEEEAA AABBCDEEEFF
842,CCCCCBBBCFF EEFFFCAABBB AAAAEEEDEEE AABCCDEEEFF AABCDDEDDEF FFFFECBAAAB EEEEEEFAAAA
843,EFEEEDCBBAA EDEEEEFAAAA BBBAAAEEFFF AABCCDDEEFF AABBCDDEEFF EEFFFDCBAAA DDEEEEEDAAA
844,EFEEEDCBBAA FFDCCBDABCC BBBBAADEFFF BDFFDCCDCBA BBBBBBCDDFF AABCDDEEEEF FFFCBBBBBBB
845,EFEEEDCBBAA ACEEEEEFBAA CCBBBBBBFFF AABBCDEEEFF AAABCDDEEFF CDEEFFECBAA AAABCDEEFFF
846,EEEEEDCBBAA BFECCBDEBCC BBBBAADEFFF FFFEDCCBBAA BBAABCDEEFF AACEEDDDEEE FFFCBBBBBBB
847,EEEEECBBAAE FECBBBDABDD BBBAABEEFFF FFEDCCBBBBB FDCDDBBAADF AABDEEDEEEE FFCBBBBCCCC
848,EEEEEEDBAAA FCABBBBCEFF EEEDDDDFAAA DFEBCACEECA AAABCDFFFFC BCEEBECBACF AABBBBFFFFF
849,EEEEEEDCCBA BBABBBCEFFF FFFFEDBBAAA AEDEFBBCCEC BBBBBBBCFFF BBBBBBBFFFF AAABCDEEFFF
850,EEEEEEDBBBA BBAABBEEFFF FFFFEBBBBAA ABABCEDDEFF EFEDDFBBBBA CCCCCCCCCCF AAABCDEEFFF
851,BBBBBBCFFFF DDEEEEEFBAA AACEEEDDDDD EBABCEFDDDE BBBBDDACEFF AABBCDDEEFF FFCABBCCCCC
852,EFEEEDCBBBA ACDEEEEFCBB CBBBBBBEFFF CBBCFBFFECA BBBBCDCCCFF AABBCDDEEFF CCCDDDEEEEA
853,EFEEEDCBBAA ABEEEEEFEAA CCBBBBBBFFF AAABCDDEEFF AAABCDEEEFF EEFFFCBAAAB EEEFFDAAABB
854,EFEEEDCBBBA AFEDCCDFCCC BBBBBACEFFF FFEDDCBBBAA FEDDEDAAACE AABBCCDEFFF CCCDDDDEEEA
855,EEEEEEDCAAA BABCCCDEFFB FEEEDDDDAAA CEEEEFEBAAD AABEEEEEEDD ACDDDDDDDDE AAABCDEEFFF
856,DDDDDCBBABF EEEEFFAABBB BAAAAFEEEFF FECCECFBBBA EEDEEDBAACE AAABCDDEEFF FBBBBCCCDDD
857,DDDCCCBBBBF EEEFFFAAABB BBAAAEEEEFF AABCDDDEEEF ABDCEEDDCCF FBABBCCCDDE FABBCCDDDEE
858,BBBBBBDFFFF EDEEEEDAAAA ACEFEDCCCDD BABCCCECDFF CECABCFCCEE AABBCDDEEFF FFABBCCCCDD
859,EEEEEECBAAB BBAABBEEFFF FFEEFBBBAAA BCACAEFEDBE AEDDEBBEEBE CCCCCCCCCDF AAABCDEEFFF
860,EFEEEDCBBAA AFEDCCDFDCC DCCCCBBBBFF ADFFFEDCBAA FFFDCBBABCE AAABBCEFFEF EEEEEEEDAAA
861,BBBBBBBBFFF FFDAABBCCDF FFFEDBAABCC EDEEEDEBBAA DCCBCCCCDED FFCBBBBBBBC AABBCDEEEFF
862,EEEEEECBAAC BBABBBBEFFF DDDDDDCFAAA ACCAEBEEEEE ADEDBEEEEEA ABCDECBCCEF ABBBCCDDDDF
863,AABEFFEDDDC DBAABDDEEFF FFFEDCAABBB FFFFBBBBBDA CDCCDDCCCDE FCCCCCCCCCD AABBCDEEEFF
864,EFEEEDCBBAA ACEEEEEFBAA CCBBBBBBFFF AABBCDDEFFF AABBCCDEEFF CDDEEEFEBAA CCDDDEEEEDA
865,EFEEEDCBBAA ABFECCDEFCC CBBBBBBEFFF FFEEDCBBBAA FEEDBCBAACE AAABDEEEEEF EEEEEFAAAAA
866,CCCCCCEFBBB BBBBBBCDFFE FFFEDCCBAAA ABCEEFFEBBB BCCCCCCBCDF ACCDDDDDDEE AABBCDEEEFF
867,EEEEEEDBAAA BABBBBCEFFF EEEEEEEBAAA DECDEEFDAAA FEBBBBBBCDF AAABCDEEEFF AAAABEEEEEE
868,EFEEEDCBBAA ADDEEEFEABB CCCBBBBBEFF DCBBAFEEBED FEEFBBAAACE AABBCDDEEFF FFFFFAABBBB
869,EEEEEEDBAAA AABBBCCEFFF EFEEEEBBAAA FEEFDDDAAAA DEBBBBCCCDF AAAABDEEEFF AAABBDFFFFF
870,CCCCCBBBCFF EEEEFCAABCC AAADEEDDEEE FEDDAEECCBB EEDBBCBCBDF AABBCDDEEFF FFFBBBBBCCC
871,EFEEEDCBBAA EDEEEEFAAAA CBBBBACEFFF AABBCDDEEFF AAABCDEEEFF FFFFDBAABBB FFFFCABBBBB
872,EEEEEEDBAAA CAABBBCDFFF EEEEEEDDAAA FFEECBBBBBA FEBBBBBBCDF AAABBDEEEFF AAABBDEFFFF
873,EEEEEEDBAAA AABBBCCEFFF FFFEEEBBAAA FEEFDBBBBBB FFBBBCCCCAF AAABCEEEEFF AAABBDEFFFF
874,DDDDDCBBBBF EDEEEFCAABB BBAAACEEFFF FBCEEEEBBAA CDDDCCBBBEF AABBCDDEEFF EEEEEEDAAAA
875,BBBBBBCFFFF EDEEEEEDAAA AACEEEDDDDD CAAACDDFEFF DECEDABBBCF AABBDDDEEFF EEEEEFDAAAA
876,EEEEEEDBAAA BABBBBCEFFF EEEEEEDDAAA EEFDDDCAAAE EABFFADBBCF AABBBCDEEFF AABBBBDFFFF
877,DDDDDCBBABF FEDCCCBABCC AAAADEEDEFF FFEECBBBBBA ECBBBBCCEEF ABBBCDEEEEF FCBBBCCCCDD
878,CCCCCBBABFF EEEFFBAABCC BAAACEEEEFF FCEBADDDCCA EEECAAABCEF AAABCDDEEFF AABBCDEEEFF
879,EEEEEEDBAAA CFBBBBCCDEE DDDDCCCEFBB ACCECEDCEDD BBDBEBBDDCF AABCDEDCCEF AABBCCDDEFF
880,EFEEEDCBBAA ACEEEEEFBAA CBBBBABEFFF AABBCDEEEFF AABBCCDEEFF EEEFFECBAAA DDDEEEEEAAA
881,EEEEEEDCBBA BBAAACEEFFF EEEEFBBBAAA CFBCABDDDDE CFEECBBCDEA CCCCCCCCCDF AAABCDEEFFF
882,DDDCCCBBBBF EEEFFFAABBB AAAAEEEDEEE AABCCDEEEEF CCDDEDDDEDA DDDDDDDDDDA AABBCDEEEFF
883,BBBBBBDFFFF EDEEEEDAAAA ACEFEDCCCDD DCDECDEDADB BCCDCBBCBEF AABBCDDEEFF FFFFEAABBBB
884,BBBBBBDFFFF EDEEEEEBAAA ABEFEEDCDDD AAEFEDEDBDB ABBCCCDDCCF AABBCDDEEFF FFFFDABBBBB
885,BBBBBBDFFFF EDEEEEDAAAA ACEFEDCBCDD ABBCBEFCDFF EBAABDCCDEF CCCDDDDDEEA AABBCDEEEFF
