,0
591,DDDDDCCBAAA AAAAABCDDDD DDDCBBBBAAA CDDDDCBBAAA BBBBBBBBBDD BBBBBBBBCDD AAABBCCDDDD
592,DDDDDCBAAAA ABCCDDDDBAA BBBAAAACDDD AAABBCCCDDD AAABCCCDDDD DDDDDBAAAAA DDDDDCAAAAA
593,DDDDDCCAAAA AAAABBBCDDD DDDDDCCAAAA DDDCCCCAAAA CBAAABCCCCD AAAABCCDDDD AAAAAADDDDD
594,DDDDDCBAAAA AADCCBCDDBB BBBAAAABDDD DDDCCBBAAAA DDCBBAABABD AAABCDDCCCD DDDDDAAAAAA
595,AAAAABCDDDD CCDDDDCAAAA ABDDDCBBBCC ABBBACBDCDC AACCCBCABCD AAABCCCCDDD DAAABBBCCCC
596,AAAAABCDDDD DCDDDDCAAAA ABDDDCBBBCC AAABCDDDDBB AAABBCCBCDD AAABCCCCDDD DDBAABBBBBB
597,DDDDDCBAAAA ABCCCCDDDAA BBBBAAABDDD BBCBABCDDDA BAAABCBBCDD AAABBCCCDDD DDDDDDAAAAA
598,BBBBBAABDDD DDBAAABBBCD DDDDCBAAABB CBCCDDDDAAA CCCBBBAABDD DDBBBBBBBBB AAABBCCDDDD
599,CCCCCBBAABD DDBBBBAABBC AAAAABDCDDD DDDCCAABBAA ABBBBBBBCCD CCCCCCCCCCA AAABBCCDDDD
600,DDDDDCCBBAA AAAAABCDDDD DDDDDCBAAAA DCDDCCCCAAA BBCBCBCCABD AAABCCCCCDD AAAACDDDDDD
601,DDDDDCBAAAA DDBBBBCAABB BBAAAABCDDD DDDDCCBBAAA DDDCCBAAABD AAABCDDCCCD DDDDDDAAAAA
602,CCCCCBBAAAD DCCDDDBAAAA AAAAABDCDDD DCABAABCDDB CCDDBBAAACC AAABBCCCDDD AAABBCCDDDD
603,AAAAABCDDDD CBCCCCCDDAA AAAACDDCDDD AAACCDDCCDD BABBABBDDBD AAABBCCCCDD BBBCCCCDDDA
604,DDDDDCCAAAA DBAAAABCDDD CCCCCCDBAAA AAAABCCDDDD DDDAAACAABB CCBCDAAABDD AAAAACDDDDD
605,CCCCCBAAADD DCBBAAACCDD ADDDCBAABCC AAABBDDDDDD AAAAABBDDDD DDDCAAAAABB AAABBCCDDDD
606,DDDDDCCAAAA AABBBBCDDDB DDDCCCCBAAA AABBADCCCDD AAABBBCCCDD AACCCCCCCCC AAABBCCDDDD
607,DDDDDCBAAAA AACCCCCDDBA BBBBBAAACDD AAABBCCCDDD AAABBCCCDDD CCDDDDCBAAA CCCCCCDDCAA
608,BBBBBBAABDD DCDDDBAAABB AAAADDCCDDD AAABBCCCDDD AABBBCCCCDD DCAABBBBBCC DBAABBBCCCC
609,CCCCCBBAAAD DDBBBBAABCC AAAABDCCDDD DDDCCBBAAAA BBAABBBCCDD AABBBCCCDDD AAABBCCDDDD
610,AAAAABCDDDD CBCCCCCDDAA AAABDDDCDDD AABCDDCCCCC BBBBBBBBADD AAABCCCCCDD AAABBCCDDDD
611,DDDDDCCBAAA AAAABBBDDDD DDDDDBBAAAA DDDBBCBBBAA ABBBBBBBCDD AABCCCCCCCD ABCCCCCCCCC
612,DDDDDCBAAAA AADCCBCDDBB BBBAAAACDDD CDDCCBBAAAA DDCBBABAABC AACCCBCCCDD DDAABBBBBBB
613,CCCCCBBAAAD CCCCDDDAAAA BBAAAABDDDD DCBCBDCBBAA DCBAABBBBDD AAABBCCCDDD DDDDDDAAAAA
614,DDDDDCBAAAA ADDCBBCDCBB BBBAAAABDDD DDDCCBBAAAA DCBBCBAAABC AAABBBCDDDD BBBCCCCCCCA
615,DDDDDCBAAAB DDCBBBBAABB AAAAABCCDDD DDDCBBBBAAA DBBCBBAABCD ABBBBCCCDDD DBABBBBBBBC
616,DDDDDCCAAAA BAAABBBCDDD DDDDCCCCAAA DDDCCBBAAAA DDDBAABBBBC AABBBBBBCDD AAABBCCDDDD
617,DDDDDCBAAAA AACCCCDDDAA BBBAAAACDDD AAABBCCCDDD AAABBBBCDDD CDDDDDBAAAA CCCDDDDAAAA
618,CCCCCBBAABD DCCDDDBAAAA AAAAABDCDDD DAABABDCCDB DDAABCAABCD AAABBCCCDDD DDAABBBBBBB
619,DDDDDCCAAAA AAAABBBDDDD DDDDDCBAAAA DDDCCCBAAAA DDDBAABBBAD AAAABBCCDDD AABBBBBBBDD
620,DDDDDCBAAAA BDCBBBCCBBB BBAAAABCDDD DDDCCBBBAAA DDCBCBAAABC AAAACDDCDDD DDDDDAAAAAA
621,AAAAABCDDDD CCDDDDDAAAA AACDDCCBCCC AABCBDDCDBC ABCCBABBCDD AAABCCCCCDD DDDDAAABBBB
622,CCCCCBBAAAD CCDDDDBAAAA AAAAACDCDDD AAABBCCDDDD BAAAADCBBDD DDBAAABBBBC DAAABBBCCCC
623,BBBBAAADDDD DDDBAAABBCC AACDDCCBCCC AAAABCCDDDD AABBCBBDCCD CCCCCCCCCCA AAABBCCDDDD
624,DDDDDCBAAAA ADCBBBCCBBB BBBAAAACDDD DDDDCBBAAAA DDCCCBBAAAD AAABCDDCCCD DDDDDAAAAAA
625,DDDDDCBAAAA ADDCBBCDBBB BBBAAAACDDD DDDDCBBAAAA DDDBBAAABCC AAAACCDDDDD DDDDDAAAAAA
626,CCCCCBBAAAD DDBBBBAABCC BAAAAACDDDD DDDCBBBBAAA CCCBBBAAADD AAAACDDDCCD DDDDDCAAAAA
627,DDDDDCBAAAA ADCBBBCCBBB BBAAAABCDDD DDDDCBBBAAA DBAACACBBDD AAABCCCCCDD DDDDBAAAAAA
628,AAAAABCDDDD CCDDDDDAAAA AACDDCCBCCC ACBAADDDDCC BAACBCCCBCD AAABCCCCCDD DDDBAABBBBB
629,DDDDDCCAAAA CBAAABBCDDD DDDDCCCBBAA DDDCCCBAAAA DDBBBBCCBAB AAAABBBCCDD AABBBBBBCCD
630,DDDDCCCBBAA AAAABBBDDDD DDDDDCCAAAA DCCCDDCBAAA CCCCDDBAAAD AAAACCCCDDD AAAACDDDDDD
631,DDDDDCCBBAA AAAABBCDDDD DDCBBBBBAAA AAABCCDACDD DBAABBBBBCD AAAABDDDDDD AAABBCCDDDD
632,DDDDDCCAAAA DBAAAABCDDD CCCCBBDDAAA BBCBBBDCDBB ABBBBBDCBDD AABABCCCCCD AAAAADDDDDD
633,CCCCCBBAABD DCDDDDAAABB AAAABDCCDDD DBCBDBDBAAB BAACCBBABDD AAABBCCCDDD DBABBBBBCCC
634,DDDDDCBAAAA DDBBBBCAABB BAAAAACDDDD DDDCCBBBAAA AAABBCDCBDD AAABCCDDDDD DDDDAAAABBB
635,DDDDDCBAAAA ABCCDDDDBAA BBAAAACDDDD AAABBBCCDDD AAABCCCCCDD DDDDDCBAAAA CCCCDDDCAAA
636,DDDDDCBAAAA CCDDDDDAAAA BBAAAABCDDD AAABBCCCDDD AAAABBCCDDD DDDDCBAAAAB DDDDCAAAAAA
637,DDDDCCCBBAA AAAABBBDDDD DDDDDBBAAAA ADAABCDCCDD CBBBBBBBBCD AAABCCCCCDD AAACCCCCCCC
638,BBBBBAAADDC DCBBAAACDDD AAABDCCCDDD CBAAABBCDDD AAABBBBCCDD AABBCCCCDDD DDAABBBBBBB
639,CCCCCBBAAAD DDBBBBAABCC AAAAACCCDDD DDDCCBBBAAA DCBAABAACDD AACCCCCCCCD DDAABBBBBBB
640,DDDDDCCAAAA CDAAAABBCDD CCCCCCBDAAA ABCCBCDDCBB AAABBBBCCDD AABBCCBBCCD AAACCCCCDDD
641,DDDDDCBAAAA CCDDDDDAAAA BAAAAADDDDD AAABBCCDDDD AAABBCCCDDD DDDDDCBAAAA CCCCCCDDCAA
642,DDDDDCCAAAA BAAABBBCDDD DDDDCCCBAAA DDDDCCCBAAA DDAAABBBBCD AAAABCCDDDD AAAAADDDDDD
643,DDDDCCCBBAA AAABCCCCDDD DCBBBBBBBBB AAABCCDCCDD DCCAAABBBBD AAABCCCCDDD AAABBCCDDDD
644,AAAAABBDDDD CBCCCCCDCAA AAABDDCCCCC AABBCCCCDCC BABBBBBBCDD AAAABCCCDDD CDDDDDAAAAA
645,CCCCCBBAAAD DCCDDDBAAAA BAAAAADDDDD DCCCCCDAAAA BBBCBBBABDD AAAABCCCDDD DDDDDAAAAAA
646,BCBBBBBAABD DCDDDDAAAAA AAAABDCCDDD AAABBCCDDDD AAABBBCCCDD DDDCBAAAABB DDDDAAAABBB
647,DDDDDCBAAAA ACCCCDDCAAA BBBBBAAADDD CAABBBCDDDC CCCCCBAAACD AAABBCCCDDD CCCDDDDAAAA
648,AAAAABCDDDD CCDDDDDAAAA AACDDCCBCCC AAACCDDCCBB BDCBBCABBCD AAABBCCCDDD DDBAABBBBBB
649,CCCCCBBAAAD DDCBBBBAABB AAAAABDDDDD DDDDCBBBAAA CCBBAAACCDD AAABCCDDDDD DDDDDCAAAAA
650,DDDDDCBAAAA CCCCDDDAAAA BBAAAABDDDD DBAAAACDDCC DCCBAABBBCD AAAABCCCDDD DDDDBAAAAAA
651,CCCCCBBAAAD CCCCDDDAAAA AAAAADCCDDD DABBACDDBDB BCCCBAAABDD AAABBCCCDDD AAABBCCDDDD
652,BBBBBAADDDD DDDBAAABCCC AADDCCBBCCC DCBDABBBCBB DCBBBBCAADD CCCCCCCCAAA AAABBCCDDDD
653,AAAAABCDDDD DCDDDDCAAAA ABDDDCBBBCC CBAABDDDCBB ACDDBBAABCD AAABBCCCDDD DDDAAABBBBB
654,DDDDDCBAAAA ADDCBBCDCBB BBBAAAACDDD DDDCCBBAAAA DDDCBCAAAAC AAABCCCDDDD DDDDDCAAAAA
655,AAAAABCDDDD BBCCCCCDDAA AAAACDDCDDD AAACDDDCCBC CCBBBBBBCCD AAABCCCCCDD BBCCCCDDDAA
656,DDDDDCBAAAA ABDCBBCDDBB BBBBAAABDDD CDDDDCBAAAA DDCCBAABBBD AAABDDDCCCC DDDDDAAAAAA
657,AAAAABCDDDD BBCCCCCDDBA AAAACDDCDDD AACBBDDCABD CCAABBCBACD AAABCCCCCDD DDDDDCAAAAA
658,DDDDDCBAAAA CCDDDDDAAAA AAAAADDCDDD AAABBCCDDDD AAABCCDCCCD DDCAAABBBBC DDDAABBBBBB
659,DDDDDCCAAAA BAAABBBCDDD DDDDDCCAAAA CCBCAAACBDD DDDBAAAACBD AAAABCCCDDD AAAAACDDDDD
660,BBBBBAABDDD DDBAAAABBCD DDDDCBAABCC DDCCCBBAAAA DDCCCBAAACD DDBBBBBBBBB AAABBCCDDDD
661,DDDDCCCCAAA AAACCCCCDDD DDDBBBBBAAA AAABDCDCCCC CCBBCBABBDD BBBBBBBBBDD AAAABCCDDDD
662,DDDDDCBAAAA ACCDDDDCAAA BBAAAAACDDD AAABBCCCDDD AAABBCCCCDD DDDDCAAAAAB DDDDDAAAAAA
663,DDDDDCBAAAA CCCCDDDAAAA BBAAAABDDDD CBCCCBDBCAA BCCBBBBAACD AAAABCCCDDD DDDDAAAABBB
664,CCCCCBBAAAD DDBBBBAABCC AAAACDCCDDD DDDCCBBAAAA BBCCBAABCCD CCCCCCCCCCA AAABBCCDDDD
665,DDDDDCCBAAA BBAAAABDDDD CCCCCCDCAAA DCCCDBAABBB BCBACCCCCBD AABBBCCBBDD AACCCCCCCCC
666,DDDDDCCAAAA BDABBBBBCCC DDDCCCBDAAA DBACACACCBD AABBBDCBCCD AAABCCCCCDD AAACCCCDDDD
667,BBBBBAABDDC CCAAAABBCDD DDDDCBAABCC AAAAABDDDDD AABBBBBBCDD DCBBBBBBBBB AAABBCCDDDD
668,DDDDDCBAAAA CCCCDDDAAAA AAAAABDCDDD DBBCBCABCDA DCBABCABBCD AAABBCCCDDD DDBAABBBBBB
669,DDDDCCCBBAA AAAAABBDDDD DDDDBBBBAAA DCDCCCCCAAA DBAABBBBBCD AABCCCCCCCD ABCCCCCCCCC
670,BBBBAADDDCB DDAAAABCDDD ADDDCBAABCC DDDCBBBBAAA AAAAABBCDDD DDDDDDCAAAA AAABBCCDDDD
671,DDDDDCCAAAA CAAAABBCDDD DDDDCCCBAAA DDDCCBAAAAA DDDCCBBAAAB AAAABBBCCDD AABBBBBBBCD
672,DDDDDCCAAAA BAAABBBCDDD DDDDCCCBBAA DDDCCCBAAAA BCCBBCCBAAD AAAABBCDDDD AAAAABCDDDD
673,DDDDDCBAAAA AACCCCDDDAA BBBBAAABDDD CAACBDDCCBB DCBBBAABACD AAABBCCCDDD DDDDDDAAAAA
674,CCCCCCBBAAD BBAAAABDDDD CCCCCCDAAAA BBCDABBBBCC CCAAACCCCCD CCABDCAABCC AAAACDDDDDD
675,AAAAABDDDDD CCDDDDDAAAA AACDDCCBCCC BDBACDDBBBB BDDCBBBBAAD AAABBCCCCDD DDDAAABBBBB
676,AAAAABCDDDD CCDDDDDAAAA AACDDCCBCCC AADDBBDBCCB ABDCCBABCCD AAABCCCCDDD DDAABBBBBCC
677,AAABDDDCCCC DDDDBAAAABC DDDDCBAAAAA AABDCCDCBCD ABCABBBBCCD AAABCCCCCDD DDDDAAAABBB
678,CDCCCCBAAAC CCDDDDDAAAA AAAAADDCDDD AAABBCCDDDD CCCCCCCBCCA DAAABBBCCDD AAABBCCDDDD
679,CCCCCBBAAAD DCCDDDBAAAA AAAAADCCDDD DAAABBDCDCB DCBBBBAACDD AAABBCCCDDD DAABBBCCCCC
680,DDDDDCBAAAA AACCCCDDDAA BBBAAAACDDD DDAAAADCBCB DCCCCDCAABC AAABBCCCDDD DDAABBBBBBB
681,CCCCCBBAAAD CCDDDDBAAAA BBAAAACDDDD AAABBCCCDDD AAAABDDDDDD DDDBAAAABBB DDDDAAAABBB
682,AAAAABBDDDD CCDDDDDAAAA AACDDCCBCCC AABCBDDDCAA AABAABBCDDD AAABBCCCDDD DDDAAABBBBB
683,AAAAACDDDDD CCDDDDDAAAA AACDDCCCCCC AAABDCCCCCD BCCCBAAABDD AAABBCCCDDD CCDDDDCAAAA
684,DDDDDCBAAAA ABDCBBCDDBB BBBBAAABDDD DDDDCBBAAAA DCCCBAAABBD AAABDDCCCCD DDDDDAAAAAA
685,DDDDDCCAAAA BAAABBBCDDD DDDDDCCAAAA BDBBCDDDAAA CABBBBBBBCD AAAABCCDDDD AAAACDDDDDD
686,DDDDDCBAAAA ABCCDDDDBAA BBBAAAACDDD AAABBCCDDDD AAABBCCCDDD DDDDDBAAAAB DDDDDCAAAAA
687,AAAAAACDDDD CBCCCCDDAAA AABDDDCCCCC CAABACCDDCD BABCBCAACDD CCCCCCCCCCA AAABBCCDDDD
688,DDDDDCBAAAA ABDCBBCDDBB BBBBAAABDDD CDDDCCBBAAA DCBBBABABDD AAABCCCDDDD DDDBAAABBBB
689,CCCCCBBAAAD DDBBBBAABCC AAAABCCCDDD DDDCBBBBAAA BCBAABBBCDD ABCBBBCCCDD DDAABBBBBBB
690,DDDDDCBAAAA ADDCBBCDBBB BBBAAAABDDD DDDDCBBAAAA DDDCBABAABB AAAACDDDDDD DDDDDAAAAAA
691,AAAAABCDDDD CCCCCCDDAAA AAACDDCCCCC AAAACCDCCDC ABCBCBCBACD AAABBCCCDDD CCDDDDCAAAA
692,CCCCCBBAABD DCDDDDAAABB AAAAADCCDDD DCDBACBBBBB DBCBBBAAACD AAABBCCCDDD DDBAABBBBBB
693,DDDDDCBAAAA ADDCBBCDBBB BBBAAAABDDD DDDDCBBAAAA DDCCBBBAAAB AAAABCDDDDD DDDDDCAAAAA
694,DDDDDCCAAAA BAAABBBCDDD DDDDCCCBAAA DDDCCAAAAAB DCCCCBBAAAD AAAABBCCDDD AABBBBBBCDD
695,AAAAABCDDDD BBCCCCCDDAA AAAACDDCDDD DDDCABBBBAA BACBBBCABDD AAABCCCCDDD DDDAAABBBBB
696,BBBBBBBAADD DDDCAAABBCC CDDDCBAABCC CBBAAABDDCC BBCCCCBBBCB DDDBBBBBBBB AAABBCCDDDD
697,DDDDDCBAAAA ADCBBBCCABB BBAAAABDDDD DDDDCCBAAAA BAAABBBCDDD AAABCCCCDDD DDDBAABBBBB
698,CCCCCBBAABD CCDDDDBAAAA AAAAADDCDDD AAABBCCDDDD AABCCCCCCDD DDCAAABBBBC DDDAABBBBBB
699,BBBBBBBABDD DCDDDBAAABB AAAABDDCDDD AAABBCCDDDD AAAABCCCCDD DDDDCBBAAAA CCCDDDDAAAA
700,CCCCCBBAAAD DDBBBBAABBB AAAAACCCDDD DDDCCBBBAAA CABAACBBCDD AACCCCCCDDD DDDAABBBBBB
701,CCCCCBBAAAD DDBBBBAABCC AAAACDCCDDD DDDCCBBBAAA AABBBBBBCDD CCCCCCCCCCA AAABBCCDDDD
702,DDDDDCCAAAA AAAABBBDDDD DDDDCCCBAAA DDDCBBBBBAA DDBAAABBBCD AAAABBBCDDD AAABBBBBDDD
703,DDDDDCBAAAA ADDCBBCDBBB BBBAAAACDDD DDDDCBBBAAA DDCCCBAAABC AAAACDDDDCD DDDDDDAAAAA
704,AAABDDDCCCC DCDDDDAAAAA ADDDDCBAABB ABCCDCDDBAB ABBBBBBBBBD AAABBCCCDDD DAABBBCCCCC
705,DDDDDCBAAAA AACCCCDDDAA CBBBBBBAADD AAABBCCDDDD AAABBBCCDDD CCCCDDDCAAA CCCCCCDDCAA
706,AAAAABCDDDD CCCDDDDCAAA AABDDCCCCCC ABCDDBBBDCC ACCBCBAABDD AAABCCCCDDD DDDDDAAAAAA
707,DDDDDCCAAAA CBAAAABBDDD CCCCCCBDAAA AACBBBDDCCC CBDCBCCAABC ABBBCCCBBCD AAAAADDDDDD
708,DDDDDCCBAAA AAAAABCCDDD DDDDBBBBAAA CABCDDDAAAA AABDBBBBBCD AAABCCCCCDD AAACCCCCCCC
709,AAAAABCDDDD CCDDDDCAAAA ABDDDCBBBCC DDABBBBCBCB BBBCBCBABDD AAABBCCCDDD AAABBCCDDDD
710,DDDDDCBAAAA ABCCCCDDDAA BBBAAAABDDD AAABBCCCDDD AAABBBCDDDD AABCDDDDDAA AAAABCCDDDD
711,DDDDDCCAAAA BDAABBBBCCC CCCCCBBDAAA CABAAADDDDC CCAABBCCDCC AAABCCDCCDD AAAABBBDDDD
712,DDDDDCCAAAA BBAAAABDDDD DDDDCDBAAAA DABBAABDCCD DDDCAAAAACC AABBCCBCCCD AAACCCCCCDD
713,AAAAABCDDDD CCCCCCDDAAA AAACDDCCCCC CABABACCCDD ABBACBCBCDD AAABBCCCDDD DDDDBAAAABB
714,CCCCCCBAAAD DDCCBBCAABB AAAABCCCDDD DDDCCCBAAAA BBABBBBBCDD CCCCCCCCCAA AAABBCCDDDD
715,BBBBBBBBCDA BAAAABCDDDD DCCCDCBAAAA AABCCCBCCDD CCDDCAAACAC AAABCCCCCDD AAAABBBDDDD
716,DDDDDCCAAAA DBAAAABCDDD CCCCCCDBAAA BAAACBDBDDB DABBADACBCC DDBAAABBBCD AAAACDDDDDD
717,DDDDDCBAAAA AACCCCDDDAA BBBAAAACDDD AAABBCCDDDD AAABBCCCCDD DDDDCBAAAAB DDDDCAAAAAA
718,BCCBBBBAABD CCDDDDBAAAA BBAAAACDDDD AAABBCCCDDD AABBCDCCCDD DDDDBAAAABB DDDDAAABBBB
719,DDDDDCCAAAA AAAABBBCDDD DDDDDCCAAAA DDCCCDCAAAA CCCCBBAACDD AAAACCCCDDD AAAACDDDDDD
720,DDDDDCCAAAA DBAAAABCDDD CCCCBBBBDBA ABBBACCDDCC BBCCBABDBBC ACDDCBAABCD AAAABBBDDDD
721,CCCCCCBAAAD DDBBBBAABCC AAAAABCCDDD DDDCCBBAAAA ABBABCCBCDD ABBBBBCCDDD DBABBBBBBCC
722,DDDDDCCAAAA AAABBBBDDDD DDDDDCBAAAA DCBAACCCCCC CAABDBBBBCD AAAABCDDDDD AAAAADDDDDD
723,CCCCCBBAABD DCDDDDAAABB AAAAADDCDDD CBDCADDAACA DDDCBAAABCC AAABBCCCDDD DDDAABBBBBB
724,DDDDDCBAAAA ABCCDDDDBAA BBAAAABDDDD AAABBCCCDDD AAABCCCCDDD CCCDDDCBAAA BBBBCCCCCDA
725,DDDDDCBAAAA AADCCBCDDBB BBBAAAABDDD DDDDCBBBAAA DDDDCBBAAAA AAAABDDDDDD DDDDDCAAAAA
726,AAAAABBDDDD DCDDDDCAAAA ABDDDCBBBCC BAACCBCBDDB BACBCBCAACD AAABCCCCCDD DDDDDCAAAAA
727,AAAAABCDDDD BBCCCCCDDDA AAAACDDDDDD AADCDDDCBBB AACABBBCCDD AAABCCCCCDD CCDDDDCAAAA
728,DDDDDCCAAAA BDCBBBBBBCC DDDDCBAAAAA CCBCBABDBCD DCBBAABBBDD AAABCCCCCDD AAAABDDDDDD
729,AAAAABCDDDD DCDDDDAAAAA ACDDDCBABBB AAABDDCCDDD BCBCAAABCCD AAABCCCCCDD DDDBAABBBBB
730,DDDDDCBAAAA CCDDDDDAAAA BBAAAABDDDD AAABBCCDDDD AAAABBCDDDD CCDDDDCBAAA BBCCCCCCDCA
731,DDDDDCCAAAA BAAABBBCDDD DDDDCCCCAAA DDCBBBCBAAA CCAABCBBBCD AAABBBCDDDD AAAABBBDDDD
732,DDDDDCCBAAA AAAABBBDDDD DDDDDDBAAAA CCDDDCBAAAB CDDDDBAAABD AAABCCCDCDD AAABCCDDDDD
733,CCCCCBBAABD DDCBBBAABCC AAAAABDCDDD DDDCBBAAABB AAAABBCCCDD CCCCCCCCCCA AAABBCCDDDD
734,DDDDDCBAAAA BDDCBBCCABB BAAAAACDDDD ADDCCBDCBAA AAAACCBCCDD AAAABCCDDDD DDDDDAAAAAA
735,CCCCCBBAAAD CCCCDDDAAAA AAAAABDCDDD DCCBABABCBC DBAAACBBBDD AAABBCCCDDD DDDAABBBBBB
736,AAAAABDDDDD CBCCCCCDCAA AAACDDCCCCC ABCCADCACDD BCCAAABACDD AAABCCCCDDD DDDBAABBBBB
737,DDDDDCBAAAA CCDDDDDAAAA BBBAAAACDDD AAABBCCCDDD AAABCCBBDDD CCDDDCBBAAA CCCCCDDDAAA
738,DDDDDCCAAAA BAAABBBCDDD DDDDCCCCAAA DDDDCCCAAAA ABBBBBCCCBD AAAABCCDDDD AAAAACDDDDD
739,DDDDDCBAAAA AACCCCDDDAA BBBBAAABDDD AAABCCCCDDD AAABBCCCDDD CCDDDDCAAAA CCCDDDDAAAA
740,CCCCCBBAAAD CCCCDDDAAAA BAAAAADDDDD DCBDCDDAAAB BCCCBBAAACD AAABBCCCDDD DDDDDAAAAAA
741,CCCCCBBAAAD CCCCDDDAAAA AAAAABDCDDD DCBDDDDAAAA BCCCBBAAACD AAABBCCCDDD DDDBAABBBBB
742,BBBBBBBBBDA AAAABBCCDDD DDCBBBBBBAA AABCDBDDCAD ABBBBBCDDDD AAAADDCDDDD AAABBCCDDDD
743,DDDDDCCAAAA DBAAAABCDDD CCCCBBDBAAA CAAAACCDCCB ABBBCDDBBBD AABCCCCBBCD AAABBBBCDDD
744,DDDDDCBAAAA CCCCDDDAAAA AAAAABDCDDD DCAAABBBCCC CBACBABBCDD AAABBCCCDDD DDBAABBBBBB
745,DDDDDCBAAAA CCDDDDDAAAA BAAAAADDDDD AAABBCCDDDD AAABBBBCDDD DDDDDCBAAAA CCCCDDDCAAA
746,DDDDDCCAAAA CBAAAABCDDD CCCCCCDCAAA BCCCCACCCBB AABBCDCCCCD BCBACCAABCD AAAAADDDDDD
747,CCCCCBBAAAD CCDDDDCAAAA BAAAABDCDDD AAABBCCDDDD BABCDDCBBCA DBAABBBBCCD DAABBBCCCCC
748,DDDDDCBAAAA ABCCCCDDBAA BBBAAAABDDD AAAAADCCDDC CACBBBBABCD AAABBCCCDDD AAABBCCDDDD
749,DDDDDCBAAAA ABDCBBCDDBB BBBAAAABDDD DDDDCBBAAAA DCBABBAABDD AAABCCDDDDD DDDDDAAAAAA
750,DDDDDCCAAAA CCAAAABBCDD CCCBBBBDDAA AABBBBCDDCC ABCBBDDBBCC AABBCCBCBDD AAAAABDDDDD
751,DDDDDCBAAAA AACCCCDDDAA BBBBAAAADDD AAABBCCCDDD AAABBCCCDDD CDDDDCAAAAA DDDDDDAAAAA
752,BBBBBAABDDD DDDDAAABBBB AAADDCCCCCC AABBBCCCDDD CCCCCBCCCBA BAAABBCCDDD DAABBBCCCCC
753,AAAAABCDDDD CCCDDDDCAAA AABDDCCCCCC ABABDBCCCCC ABBCDDCBBCD AAABCCCCCDD DDDAAABBBBB
754,DDDDDCBAAAA DDBBBBCABBB BAAAAACDDDD DDDCBBBAAAA DDBBAAAABCD AAAABDDDDCD CCCDDDDAAAA
755,BBBBBAABDDD DDCAAAABBCD DDDDCBAAABB DCCCBAABBBC BCCCBCCAABD DDBBBBBBBBB AAABBCCDDDD
756,DDDCCCBAAAA BAAAAACDDDD CCCCCDBBBBA CBBBBABBDDD DCBBDCBBAAC AABABBBDDDD AAABCCCDDDD
757,CCCCCBBAAAD DCCDDDBAAAA AAAAADDCDDD DABCCDDDAAB BCCCBBAABCD AAAABCCCDDD CDDDDDCAAAA
758,DDDDDCCAAAA CBAAAABCDDD CCCCCBDBAAA CABABBCDDDD DADCBBBBBBD ABBBCCBBBCD AAAAACDDDDD
759,CCCCCBBAAAD DDBBBBAACCC AAAABDCCDDD DDCCCBBAAAA BBBBAABBCDD AABBCCCCCDD DDBABBBBBBB
760,DDDDDCCAAAA DCABBBBBCCC DDDDCCCCAAA AAAABBCDDDD CCDDBAABCBD AAABCCCCCDD AAABCCCDDDD
761,DDDDDCBAAAA CCDDDDDAAAA BBAAAABDDDD AAABBCCDDDD AAABBCCCDDD DDCBAABBBBC DDAABBBBBBC
762,DDDDDCCAAAA BAAABBBCDDD DDDDCCCBAAA DCCBBCCAACC ABBBBBBBCDD AAAACCCCCDD AAAACDDDDDD
763,BCBBBBBAABD DCDDDDAAAAA BAAAABDDDDD AAABBCCDDDD AAABBCCCCDD DDDDCBAAAAB DDDDDDAAAAA
764,DDDDDCCAAAA BAAABBBCDDD DDDDCCCAAAA DDCDDBBBBBA DDDBAAAABBD AAAABBCCDDD AAABBBBCDDD
765,CCCCCCBBABB BAAAAACDDDD CCCCCDBAAAA BBBACACDDCC DBBBBDBBBBC BACDDBACBBD AAACCCCCCCD
766,DDDDDCBAAAA CCCCDDDAAAA BAAAAADDDDD CABCCCDBCBB DDCCBBAABAD AAABBCCCDDD DDDDDAAAAAA
767,CCCCCCBAAAD DDCCCCCAAAA AAAAACCCDDD DDDBCCBAAAA ABAAAABCDDD DDDDDDAAAAA AAABBCCDDDD
768,DDDDDCBAAAA ADDBBBCCABB BBAAAABDDDD DDDCCBBBAAA AAAACCCCCDD ABBBBBCCDDD DAABBBCCCCC
769,AAAAABCDDDD CCCDDDDCAAA AABDDCCCCCC DCDCACCAABC CBCBAABBCCD AAABBCCCCDD DDAABBBBBCC
770,BBBBBBDDBBB AAAABBBCDDD DDDDCBBAAAA AABCDDDDAAA ABBBBCBBBCD AABCCCCCCCD AAABBCCDDDD
771,DDDDDCBAAAA BDCBBBCCABB BBAAAABCDDD DDDDCBBAAAA DDDDDCBAAAB AAACDDCCCCD DDDDAAAAABB
772,DDDDDCCAAAA CDAAAABBDDD CCCCCCCDAAA CBDBBAACCCC DDDDCAAABAA AAADCCBCBCD AAAAADDDDDD
773,BBBBBAADDDD DDDBAAABCCC AACDCCCBCCC DDCABCDCAAA BACCBCABBDD AAABBCCCDDD DDAABBBBBBB
774,DDDDCCCBBAA AAAAABBDDDD DDDDDBBAAAA DCDDBCCCAAA DDDBADAAABD AAAABCCCDDD AAABBBBCDDD
775,DDDDDCBAAAA BDCBBBCCABB BBAAAABCDDD DDDCBBBAAAA DCCBABBAABD AAABCCCCCDD DDDDAAAAABB
776,DDDDDCCAAAA CCAAAABBDDD CCCCBBBDBAA AACABACDDDC DBBDBBBBBCD ABBBDABBBCD AAAAACDDDDD
777,DDDDDCBAAAA CCDDDDDAAAA BBAAAACDDDD AAABBBCDDDD AAABBCCCDDD DDCBBAAAABB DDDBAABBBBB
778,CCCCCBBAABD DCDDDDAAABB AAAACDCCDDD DCCCACCBBBA DCDBBBAAACD AAABBCCCDDD DDDDAAAABBB
779,DDDDDCCAAAA CBAAAABDDDD CCCCBBDDAAA ABACCCACDDD CDCAABDCCCB AABACCBCCCD AAAAADDDDDD
780,AAAAABCDDDD CBCCCCCDCAA AAABDDCCCCC AAACCDDDCBC ABAACCBBCDD AAABBCCCDDD DDDDDCAAAAA
781,DDDDDCBAAAA CCCCDDDAAAA BAAAAADDDDD DABBBDCBBBA CCCCCBAABCD AAABBCCCDDD DBABBBBBCCC
782,DDDDDCCAAAA BBAABBBCDDD DDDDCCCCAAA DDDCCBBBAAA CABBBBBBBCD AAAABCCDDDD AAAAADDDDDD
783,DDDDDCBAAAA ACDCBBBDDBB BBBBBAAACDD CDDDCCBAAAA DDDCBBAAABC AAAABBCDDDD CCCCCCCCCAA
784,DDDDDCBAAAA AACCCCCDDBA BBBBAAABDDD BACCBCCCDAC DDCCCCAAABD AAABBCCCDDD DDDDDAAAAAA
785,DDDDDCCAAAA AAAABBBCDDD DDDDCCCBAAA DDCBCCCCBAA CCCCDDBAAAD AAAAABCDDDD AAAAABCDDDD
786,BBBBBBBAADD DCDDDBAABBB AAACDCCCCDD DDDDACBAABA CCCBBBABADD AAABBCCCDDD DAABBBCCCCC
787,BBBBBBBAADD DCDDDBAABBB AAACDCCCCDD DDACACCBBBB DDDDBAAAABC AAABBCCCDDD DAABBBCCCCC
788,CCCCCBBAAAD DCCDDDBAAAA AAAAABDCDDD DCCABCBDCAA CCBBBBBABCD AAABBCCCDDD DDBAABBBBBB
789,AAAABBDDDDD DCDDDCAAAAB BDDDCBAAABB AAABCDDBCBD DDCCCBAAABD AAABBCCCCDD DDAABBBBBCC
790,CCCCCBBAABD DCCDDDBAAAA AAAACDCCDDD DDBBBAABCBB BBBBCBABCDD AAABBCCCDDD AAABBCCDDDD
791,DDDDDCBAAAA ABCCCCDDDAA BBBBAAABDDD DCAAAADCCCC DDBCBAAAADD AAABBCCCDDD DDDDDCAAAAA
792,DDDDDCBAAAA ACCCCDDCAAA BAAAAADDDDD DBDDDBAAABC CCCBBBAAACD AAABBCCCDDD CCCCCDDDAAA
793,DDDDCCCBBAA AAAABBBDDDD DDDDDCBAAAA BDDBCCCBAAA DDBAAABBBCD AAABCCCCCDD AAACCCCCCCC
794,DDDDDCBAAAA ACCCCDDCAAA BBBBAAABDDD CAACCDBDBBB DCCABCAAACD AAABBCCCDDD DDDDDCAAAAA
795,AAAABDDDDDC DCDDAAAABCD DDDDCBAAABB CACDDCBAAAD CCCCCAAABCD DDDDAAAAAAB AAABBCCDDDD
796,CCCCCBBAABD DCDDDDAAABB AAAADDCCDDD BABBBBDBDDD DDDCCBAAABD AAABBCCCDDD DDDDDDAAAAA
797,DDDDDCCAAAA CCAAAABBDDD CCCBBBBDBAA ABBCDCACDDD CDDDDDCAAAA AABBCCBCBDD AAAAACDDDDD
798,DDDDDCCAAAA BAAABBBCDDD DDDDCCCBAAA DDCCDBBBBAA BCCCCCABACC AAAABCCDDDD AAAAADDDDDD
799,AAAAABCDDDD CBCCCCCDDAA AAABCDDCCDD AABCDDDAAAC BBBBBCBABDD AAABCCCCCDD CDDDDDAAAAA
800,DDDDDCBAAAA DDBBABCABBC BBAAAABDDDD DDDCBBBBAAA AAAABCCCCDD AAABCDDDCCD DDDDBAAAAAA
801,CCCCCBBAAAD DCCDDDBAAAA AAAAADCCDDD DBABCCBBCCA CABCCCBABDD AAABBCCCDDD DAABBBCCCCC
802,CCCCCBBAABD DCDDDDAAABB AAAAADCCDDD DDCCBCBAAAA CCBBCACAADD AAABBCCCDDD DAABBBCCCCC
803,AAAAABDDDDD CCCDDDDCAAA AABDDCCCCCC AAACDDDDCBB AABCDCBBBCD AAABCCCCDDD DDDDDAAAAAA
804,DDDDDCBAAAA AACCCCCDDBA BBBBAAABDDD CAACCDDABCB DCCCDBBAAAD AAABBCCCDDD DDDDDAAAAAA
805,AAAAABCDDDD CCDDDDDAAAA AACDDCCBCCC ABCDDBDCAAA DCABBCBBACD AAABCCCCCDD AAABBCCDDDD
806,DDDDCCCBAAA AAAABBBDDDD DDDDDCBAAAA DDDCCBBBAAA CCDDBDDAAAC AAABBBBCDDD AAABBCCDDDD
807,CBBBBBBAADD DDDDAAABBCC ADDDCBAABCC DCAABCCBBBA DDDCBAAAABD DDDCBBAAABB AAABBCCDDDD
808,DDDDDCCAAAA DCAABBBBCCC CCCCCCDCAAA ADBBBBBCCCD ABDAAACDBBD AAABBCCBCDD AAACCCCCDDD
809,AAAAABCDDDD DCDDDDAAAAB DDDDCBAAAAA ABABCDDBCCC CBBCBDBAACD CCCCCCCCCCA AAABBCCDDDD
810,DDDDDCCAAAA BAAABBBCDDD DDDDCCCCAAA DDDCCCBBAAA DDDBCAAAABD AAAABBCDDDD AAAAACDDDDD
811,DDDDDCBAAAA ABCCCCDDDAA BBBAAAACDDD DAAAAADDDCC DCCCDABAACD AAABBCCCDDD DDDDDCAAAAA
812,DDDDDCBAAAA ABCCCCDDBAA BBBAAAACDDD DDAACDDACBB DDBBAABBBCD AAABBCCCDDD DDDDDAAAAAA
813,BCCBBBBAABD CCDDDDBAAAA BAAAABDDDDD AAABBCCCDDD AAABCCCCDDD DDDBAAAAABB DDDBAABBBBB
814,DDDDDCBAAAA ABDCCBCCDBB BBBAAAACDDD ACDDDCBAAAA AABBBABCDDD AAABCDDDCCC DDDDDAAAAAA
815,BBBBAAADDDD DCAAAABBCDD DDDDCBAAABB DAABBCCCCCD CCCCCCCBBBB DBBBBBBBBBB AAABBCCDDDD
816,AAAAABCDDDD CCDDDDDAAAA AACDDCCBCCC AAADDDCCCBC BAABCCDBABD AAABCCCCCDD DDBAABBBBBB
817,AAAAACDDDDC DDDAAAACCDD DDDDCBAAABB DABDDBBAABC BCCBBBCCCBC DDBBBBBBBBB AAABBCCDDDD
818,AAAAABCDDDD CBCCCCCDCAA AAABDDCCCCC AAABCDDCCCB ABBBCCCBADD AAABCCCCCDD DDDDDCAAAAA
819,DDDDDCBAAAA AACCCCDDDAA BBBAAAACDDD AAABBCCCDDD AAABBCCCDDD CCCDDDCBAAA CCCCCCDDCAA
820,DDDDDCCAAAA DBAAAABCDDD CCBBBBBDDAA AABBBCADDDD BBCCADBBCDC ABBBDBCBCCD AAAAACDDDDD
821,BBBBBBBAADD DCDDDBAAABB AAAAADCCDDD AAAABCCCDDD BBCCCCCCCCA DBAABBBBCCD AAABBCCDDDD
822,CCCCCBBAAAD DCCDDDBAAAA AAAAABDCDDD DBAAABCCCCC DCBCCAAAACD AAABBCCCDDD DDDBAABBBBB
823,DDDDDCCAAAA AAAABBBDDDD DDDDDCBAAAA CDCCCCDBBAA CDDAAABBBCD AAABCCCCCDD AAACCCCCCCC
824,DDDDDCCAAAA AAABBBCDDDD DDDCCCCBAAA BBDDAADCBBB DDCBCCBABAB AABCCCCCCCC AAABBCCDDDD
825,AAAAABCDDDD CCDDDDDAAAA AACDDCCBCCC AABBBDDCCDC CBCBCBBAACD AAABBCCCDDD DDDDAAABBBB
826,CCCCCBBAAAD DCCDDDBAAAA AAAAABDCDDD DDDBABCCBBB DCCBBBAABCD AAABBCCDDDD DAABBBCCCCC
827,DDDDDCBAAAA AACDCBCDDCB BBBBAAABDDD CDDDDCBAAAA DDDCBAAAAAB AAABDDDCCCD DDDDDAAAAAA
828,AAABDDDCCCC DDDDDAAAABC DDDDCBAAAAA CDDDADCBBAA ABBBBABBBDD AAABBCCCCDD DDDDAAAABBB
829,DDDDDCBAAAA AACDCBCDDCB BBBAAAABDDD CDDDDCBBAAA DDDCCAAAABD AAAACDDDCCD DDDDDCAAAAA
830,DDDDDCBAAAA ABCCCCDDDAA BBBBBAAADDD AABBBBBDDDC AAACCBBBBDD AAAABCCCDDD CCCCCCCDCAA
831,CCCCCCBAAAD DDBBBBAABCC AAAAACCCDDD DDDCCBBAAAA BBBAAABCCDD ABCCCCCCCCD DAABBBCCCCC
832,DDDDDCBAAAA AACCCCCDDBA BBBBAAABDDD ABBBABBDDDD DCCCDAAAADD AAABBCCCDDD DDDDDAAAAAA
833,DDDDDCBAAAA ABCCDDDDBAA BBBAAAACDDD AAABBCCCDDD AABABBCCDDD CDDDDDBAAAA CCCDDDDAAAA
834,CCCCCBBAAAD CCDDDDBAAAA BAAAAADDDDD AAAABCCDDDD AAABBCCCDDD DDDDDBAAAAB DDDDDCAAAAA
835,AAAAACDDDDC DDCAAABCCDD DDDDCBAAABB DCCCCDBBBAA BBBBCCCBBCC DDBBBBBBBBB AAABBCCDDDD
836,AAAAABCDDDD CCDDDDDAAAA AACDDCCBCCC BABBCDCBBBD DDAABBCBABD AAAABCCCCDD DDAABBBBBCC
837,BBBBBAABDDD DDAAAABBCCD DDDDCBAABCC DCAABCBCBBA DCCBBBBCCBB DDBBBBBBBBB AAABBCCDDDD
838,DDDDDCBAAAA ADDCBBCDBBB BBBAAAACDDD DDDDCBBAAAA DDBBBBAABDD AABDDCCCCCD DDDAABBBBBB
839,DDDDDCCAAAA BAAABBBCDDD DDDDDCBAAAA DCDCCCCCAAA BBCCCCCCAAC AAABCCCCCDD AAAACDDDDDD
840,DDDDDCBAAAA AACCCCCDDBA BBBAAAACDDD AAABBCCCDDD AAABBCCCCDD DDDDCBAAAAB DDDDDAAAAAA
841,AAABDDDCCCC DDDDAAAABCD DDDDCBAAAAA BABCDCBBBBD CBBBCCBAACD CCCCCCCCCAA AAABBCCDDDD
842,BBBBBBBABDD DCDDDBAAABB AAAADDCCDDD AAABBCCCDDD AAABCCCCCDD DDDDCBAAAAA CCCDDDDAAAA
843,DDDDDCBAAAA CCDDDDDAAAA BAAAAADDDDD AAABBCCDDDD AAABBCCCDDD DDDDDCBBAAA CCCCDDDCAAA
844,DDDDDCBAAAA DDCBBBCAABB BAAAAACDDDD ACDDCBBCBAA BABBBBBCCDD AAABCCCCDDD DDDBAABBBBB
845,DDDDDCBAAAA ABCCDDDDBAA BBBBAAABDDD AAABBCCDDDD AAAABCCCDDD BCCDDDDBAAA AAABBCCDDDD
846,DDDDDCBAAAA ADCBBBCCBBB BAAAAACDDDD DDDCCBBBAAA AAAAABCCDDD AABCDCCCCCD DDDBAABBBBB
847,CCCCCBBAAAD DDBBBBCABCC AAAAABCCDDD DDDCBBBAAAA DCBCCBAAACD AABCCCCCCCD DDBAABBBBBB
848,DDDDDCCAAAA DBAAAABBDDD CCCCCCCDAAA CDCABABDDBA AAAABCDDDDB BBCCBCBAABD AAAAABDDDDD
849,DDCCCCCBBAA AAAAABBDDDD DDDDDCBAAAA ADCDDABBBCB AABBBBBBDDD AAAAAAADDDD AAAABCCDDDD
850,DDDCCCCBBAA BAAAAACDDDD DDDDDBBAAAA ABABBCCCDDD DDCCCDBABBA BBBBBBBBBBD AAAABCCDDDD
851,AAAAABBDDDD CCCCCCDDAAA AABDDDCCCCC DBAABCDCCCC AAAACCABCDD AAABBCCCDDD DDBAABBBBBB
852,DDDDDCBAAAA ABCCCCDDBAA BBBAAAACDDD BAABDBDDDBA BBAABCBBBDD AAABBCCCDDD BBBCCCCCCCA
853,DDDDDCBAAAA AACCCCDDDAA BBBBAAABDDD AAAABCCDDDD AAAABCCCDDD DDDDDBAAAAA DDDDDCAAAAA
854,DDDDDCBAAAA ADDCBBCDBBB BBAAAABDDDD DDDCCBBAAAA DCCCDCAAABD AAAABBCDDDD BBBCCCCCCCA
855,DDDDDCCBAAA AAABBBCDDDA DDDCCCCCAAA BCDCCDCAAAC AABCDCCCCCC ABCCCCCCCCC AAABBCCDDDD
856,CCCCCBBAABD DCDDDDAAABB AAAAADCCDDD DCBBDBDBAAA CDCDCCAAABD AAAABCCCDDD DBABBBBBCCC
857,CCCBBBBAABD DCDDDDAAAAA AAAAADDCDDD AAABCCCCCDD ABCBDCCCBBD DBAABBBBCCD DAABBBCCCCC
858,AAAAABCDDDD DCDDDDCAAAA ABDDDCBBBCC AAABBBDBCDD BDBAABDBBCC AAABBCCCDDD DDAABBBBBCC
859,DDDDDCBAAAA BAAAAACDDDD DDDDDBBAAAA BBABADDCCBC ADCCDAACDBC BBBBBBBBBCD AAAABCCDDDD
860,DDDDDCBAAAA ADDCBBCDCBB CBBBBBBAADD ACDDDCCBAAA DDDCBAAAABC AAAABBDDDDD CCCCDDDCAAA
861,BBBBBBAADDD DDCAAAABBCD DDDDCBAAABB CCCDDCCBAAA CBBBBBBBCCC DDBBBBBBBBB AAABBCCDDDD
862,DDDDCCBAAAB BBAAAABDDDD CCCCCCBDAAA ABBACBCCCCD ACCCBCCCCCA AABCDBBBBCD AAABBBCCCCD
863,AAACDDDCCCB CAAAACCDDDD DDDDCBAAABB DDDDBBBAACA BCBBCCBBBCC DBBBBBBBBBC AAABBCCDDDD
864,DDDDDCBAAAA ABCCDDDDBAA BBBBAAABDDD AAABBCCCDDD AAABBBCCDDD BCCCDDDCAAA BBCCCCCCDCA
865,DDDDDCBAAAA ABDCBBCDDBB BBAAAABCDDD DDDCCBBAAAA DCDCBBAAABD AAAACCDDDDD DDDDDDAAAAA
866,BBBBBBDDBBB AAAABBBCDDD DDDDCBBAAAA AABCDDDDAAB BBBBBBBBBCD ABBCCCCCCCD AAABBCCDDDD
867,DDDDDCCAAAA AAAABBBCDDD DDDDCCCBAAA CCBCDDDCAAA DDAAABBBBCD AAAABCCDDDD AAAAADDDDDD
868,DDDDDCBAAAA ACCCDDDCAAA BBBBBAAADDD CBAAADCCBCC DDDDBAAAABD AAABBCCCDDD DDDDDAAAAAA
869,DDDDDCCAAAA AAABBBBDDDD DDDDDDBAAAA DCDDCCCAAAA CDABBBBBBCD AAAABCCDDDD AAAAACDDDDD
870,BBBBBBAABDD DCDDDBAABBB AAACDCCCCDD DDCCACCBBBA DDCAABABACD AAABBCCCDDD DDDAABBBBBB
871,DDDDDCBAAAA CCDDDDDAAAA BBAAAABDDDD AAABBCCCDDD AAABBCCCCDD DDDDCAAAAAB DDDDBAAAAAB
872,DDDDDCCAAAA BAAABBBCDDD DDDDCCCCAAA DDCCBABBBBA DDAAABBBBCD AAAABCCDDDD AAAAACDDDDD
873,DDDDDCCAAAA AAABBBBDDDD DDDDDCBAAAA DDDDCAAAAAB DDBBBBBBBAD AAAABCCDDDD AAAAACDDDDD
874,CCCCCBBAAAD DCCDDDBAAAA AAAAABDDDDD DBBDCDDBAAA BCCCBBAABCD AAABBCCCDDD CDDDDDCAAAA
875,AAAAABBDDDD CCCCDDDCAAA AABDDCCCCCC BAAABCCDCDD CCBCCAAAABD AAABCCCCDDD CCDDDDCAAAA
876,DDDDDCCAAAA AAAABBBCDDD DDDDCCCCAAA DCDCCCBAAAD CABDDACAABD AAAABBCDDDD AAAAABCDDDD
877,CCCCCBBAAAD DDCBBBAABBB AAAACDCCDDD DDDCBBAAAAA CBAAAABBCDD ABBABCCDDDD DBABBBBBBCC
878,BBBBBBAABDD DCDDDBAABBB AAAABDCCDDD DBCBACCCBBA DDCBAAABBDD AAAABCCCDDD AAABBCCDDDD
879,DDDDDCCAAAA BDBABBBBCCC CCCCBBBDDAA ABBDBDCBDCC AACBDABCCBD AABBCCCBBCD AAABBBCCCDD
880,DDDDDCBAAAA ABCCDDDDBAA BBAAAABDDDD AAABBCCDDDD AAABBBCCDDD CCDDDDBBAAA CCCCCDDDAAA
881,CDDCCCCBBAA AAAAABCDDDD DDDDDBBAAAA BDBBABCCCCD BDCCBAABCCA BBBBBBBBBCD AAAABCCDDDD
882,CCCBBBBAABD DCDDDDAAAAA AAAADDCCDDD AAABBCCDDDD BBCCCCCCCCA CCCCCCCCCCA AAABBCCDDDD
883,AAAAABCDDDD DCDDDDCAAAA ABDDDCBBBCC CBCCBCDCACA ABBCBAABBDD AAABBCCCDDD DDDDDAAAAAA
884,AAAAABCDDDD CCDDDDDAAAA AACDDCCBCCC AACDDCCCACB ABABBBCCBBD AAABBCCCCDD DDDDCAAAAAB
885,AAAAABCDDDD DCDDDDCAAAA ABDDDCBBBCC AABBADDBCDD DAAABCBBCDD BBBCCCCCCCA AAABBCCDDDD
