,0
0,HFEDCBA ABEGGFF DABFFGG GGGEBBB BABEGHG HDABEEE AABFHGF GHBBCDE GCHCCCC CCCCCHH ABCDFHH BCCCDFH ABCEFGH CABDFGH ABEFFGG
1,HGFFCBA GGFEEBA DDABEGH ABDEFGG FFFFFCA HHGDBBB HEFABED CFABDFH FGFDGAA BBBEEGH ABEEFGG DBBCCGH AEEFFFF AACEGGG FHGEDBA
2,FFHFDBA HGEDCBA HHCBBCC ABCEGGG GGFFDBA DDHECCC ABCEFHG CGEDFAE CCDDDDH CCDFCGG BBCEEHG EBDFCCH ABCEFGH CCCDDDH EFFACEE
3,EGGFEBA EDCCCBH HGDCCBB GCACEFF HGFDCBA ACDEGGG HHFDBBB GGHDBAB HGDCABC BCCCCGH ABFFFFG ABCEDFH HFBCCCC ABDEFGH ABEFFGG
4,EGGFEBA HGEDDCA AHGEDCC CFHBCDD HGFDCBA ABDFGGG EHGECBA HGFECBA HFFGCBA BBBCDGH AABEGGG CCBCEFH GGGDBBB ABDEFGH ABEFFGG
5,FGFFDBA HGEDCBA HGCBCCD AACFGGG GGFFDBA DHFCCCC FFDGBEB ACDGFGE CCDDEHD DABFFGG CCEDCEH CEEBBEH BBCDDEH ABCEGGG CHGFDBA
6,GFGGDAA HGEEDCA BCBCFGH ABDEFGG FFFFEDA HHGDBBB EGHDEAA HGDDDCA DEFFAFF BCCCEEH AACFGGG DBBBDGH AABGGGG AACEGGG FHGECBA
7,GFGGDBA HGFEEBA CBACFGH ABDEFGG FGGFEBA HGFDBBB EGGDEDA DFABDFH EFFFFCA FGGCACF BBCCDGH ACCDDFH ABCEFGH AEEFFFF FHGECBA
8,EGGFEBA HGEEECA ADEFFFF GHGBBBB HGFDBBA ACEFFGG ABCEFGH ABCDFGH ABCEFGH BABDFHH ABCDFHG HGECBBC ABCEFGH GGGEBBB ABEEFGG
9,AABEGGG HGEDCBA HHFBBBB ABDEFGG GGGFDBA GCACFGF FEAECCH BBDCGEH FCAFFED CDDCCEH GGGCBBB DCBCCFH ABCEFGH ABDEFGH BCEEGFC
10,EGGFEBA EDCCCCH HGDCBBB FBADFGG DDCCBEH CBADGGG HGFDBBA HHEBBBD HFEDABC CEDBBFH AADFGGG ADFFDDG HHGBBBB ABDEFGH ABEFFGG
11,GGGFDBA HGEDCBA GGCCCCC ABCEGGG GGFFDBA EEHEBBB BAEDFGG AEEEEEH ACEFFFF BGGDADE ABCEFHG DCCBDEH ABCEFGH ACFFFFF AGGFECB
12,EGGFEBA HGEDDCA AABGGGG EFGGGAA HGFDCBA BBBCGHH ABCEGGH ABCDFGH AACFGGG ABCDFHH ABCDFHH HGDBBBC ABCEFGH HHDBBCC ABEFFGG
13,GGGEDBA ABEGGFF DABFFGG GGGEBBB BABEGHG GCABFGG BBBGGGD CGCEGCC BGGGEBA BBCCDGH ABCDFHH BBCCEGH ABCEFGH HBBCEFF ABEFFGG
14,CFGFEEA HGFEBBB BCBBGGH BBCDEFH HFDDCBB GHGDBBB AADDGGG AEEEFFG FCABGGG CCCCCFH BBBDGGG BBCDEGH ABCDFGH AACEGGG EGFECBE
15,EGGFEBA EDCCCCH EABEFGG AADFGGG EDDCCCH DBADGGG HBEEECC HHCCCDB FDCCBDH EBEBCGH ABCDFGH GGGGBAA ABCEFGH ABDEFGH ABEFFGG
16,EGGFEBA HGEDDCA DACFFGG HHCBCCC HGFDCBA AADFGGG ABCDFGH ABCDFHH ABCEFGH CEBBBGH FFGGFBA BBBCEGH FFFFFCA ABDEFGH ABEFFGG
17,EGGFEBA HGEEECA ABGHFED CDGHCBB HGFDBBA BBBDGGH ADGHGDB HGECCBB HHEECBA HDBBBFF ABCDFHH ACEEFFG ABCDFGH HHDBBBC ABDEFGH
18,EGGFEBA HGEDDCA ABEFFFF GGHEBBB HGFDCBA AACFGGG ABCEFGH ABCEFHH ABDDFGH ABCEFHH CCEGGFA HEBBBDF ABCEFGH HFCCCCC ABEFFGG
19,EGGFEBA HGEEECA FAADFGG HHBBCCC HGFDCBA AEDEFFF DCDDDGF HHEDCBA HDCFCDC BCCCCHH ABCDFGH ABCDEGH FFFFFCA ABDEGGG GGGECBA
20,GGFEDBA ABEGGFF DACFFGG HHCBCCC ABDGGGF HCACFFF DABCGHF DFGGBBC EBHEDDD EEDBBFH ABCDFGH FFFFFCA ABCEFGH ABDEFGH ABEFFGG
21,EGGFEBA EDCCCCH FAADFGG HDBCDDD DCCCBEH EBADGGG HFBBBFF HFCFDBB DDGFGBB DDBBBGH ABCDFGH ABCDEGH HHCBCCC ABDEFGH ABEFFGG
22,GFFGEBA HGEDCBA HGCBCDD ABCCGHH FGGFEBA HHECBBB CEGHCBB HFBBCCD FFEFCCC GGFAADF AACDEHH ABCCFGH ABCEFGH CCCCCFH AEGFFED
23,GFFGDBA GGEEDDA BDBBEGH ABDEFGG FFFFEDA HHGDBBB GFEGCDA DHDEBCC DEFFFFA BBCCDHH BBBCDHH BBBBGHH AAEEEFH HFFEDBA HGFECBA
24,GGFFDBA HGFEEBA DBACFGH ABDEFGG FFFFFCA HHGDBBB CGABDGG FGFFFAA ACEFFGG BCCCEEH AADFFGG BBCCDFH AAFFFGG AACEGGG FHGEDBA
25,EGGFEBA DCCCCFH FABDFGG HACDEEE HGFDCBA CBADGGG HFCCCBC BCFDFFE GFFEGAA CCBCCHH ABCDFGH ABCEEGH HFBCCCD ABDEFGH ABEFFGG
26,EGGFEBA AEHGEDB HHFEBBB ABDFGGG BABGGGG DBADGGG HGFCBBB HHEDBBA AAEEGGG CCCCCFH HFCBBDD ABCEFGH ABCEFGH ABDEFGH ABEFFGG
27,GGFGDBA HGEEDCA BCBCFGH ABDEFGG FFFFEDA HHGDBBB ABDFGFF HEDDDEA EFEAFGB EEBEBCH ABEFFGG DCCCBGH AEEEFFF HGFEDBA HGFECBA
28,EGGFEBA HGEDDCA AABGGGG EFGGGAA HGFDCBA AACFGGG ABCEGGH AACEFGH ABCEFGH BBDEDGH CDEFGFA HDBBCDG ABCEFGH ABDEFGH ABEFFGG
29,GEFFECA GGEEDDA ACBDFGH ABDEFGG FFFFEDA HGGDBBB HDFGBBB FGFFFAA BHEDDDD BCCCDGH AABFGGG CCCCCFH BBBEGGG AACEGGG FHGECBA
30,GFGFDBA HGEEDCA BDBCEGH ABDEFGG FFFFFCA HHGDBBB BFGACFF FGEEFCA EFEAEFG BBBBDHH AACDEHH CCCCCHH ABCDFGH AACEGGG FHGEDBA
31,HGEDDBA ABEGGFF DABFFGG GHGBBBB AACFGGG HDABEFF HCBDECG CDHEGBB ADFCGFF ACDDEGH ABCDFHH BBCDEGH FFFGFAA ABDEFGH ABEFFGG
32,FGGECCA HGEDCBA DHECCCC ABCDGHH GGFFDAA FEFHCBB AEHFCDD ADFFFFF FFFFFCA FCBGBCH ABEEDGH CCBECEH ABCEFGH BBBBGHH BGGFECB
33,EGGFEBA CCCCCFH DACFFGG HBCDEEE EEDCCBH EBACGGG AACEFGH ABCDFGH ABCDFGH BBBCDHH HHFCBBB BBCDEGH HHGBBBC ABDEFGH ABEFFGG
34,EGGFEBA HGEEDCA ABEFFFG FGHEBBB HGFDCBA ABEFGGG GCEDBCG EEGGEAA DCCBBHH CCBCCHH ABCDFGH ABCDEGH FFFGFAA ABDEFGH ABEFFGG
35,GGGEDBA ABEGGFF DACFFGG HHCBCCC ABDGGGF HCABEFF BDBCEHF HFGCACC BADCGGH DCCDDGF ABCEFGH BBCDEGH GGGCBBB ABDEFGH ABEFFGG
36,EGGFEBA EDDCCBH HGDCBBB EAADFGG EDCCBDH CBADGGG HGECCBA GHGDDBA EBAHDGE AACEGGH ABFFFGG BCBDEFH HFCCCCD ABDEFGH FGGFCBA
37,DGGGEBA FEDDDGB HHCABDD ACEEFGG DDDDCCH HGFBBCB FFBDBGC ACFFFFF EEAFFFF BCBCDGH CCEFFHA HCACFEG ABCEFGH BBCCCHH FHGEDBA
38,EGGFEBA DDCCCCH FAADFGG HEBCDDD HGFDBBA EBADGGG HBCFECD HCGECCB FEDHEBB CBBDCGH ABCDGGH ABCDEGH ABCDFGH ABDEFGH ABEEFGG
39,EGGFEBA HGEEECA FAADFGG HHBBCCC HGFDCBA ABEFGGG HDCBCEE DCEEDFE DGEFFBB EBBDCGH ABCDFGH ABCDEGH FFFFFCA ABDEFGH ABEEFGG
40,EGGFEBA HGEEECA ADEFFFF GHGBBBB HGFDBBA ADDEFGG ABCEFGH ABDEFGH ACEECDH ABBDFHH BBEFGHB HGDBBBD ABCEFGH HHCBCCC ABEEFGG
41,GGEGDBA HGEDCBA ADCDFGH AADFGGG FFFFEEA GHGDBBB EGGCDFA FGFFFAA AABGGGG AABFFGH BABEFHH AEFFFFF ABCDFGH AACEGGG EHGEDBA
42,DCCCCFH HHEDCBA FEFFFEA ABBCGHH GGFFDBA GBACFGG FEBBEGE HGFDBBB BDGGGCA CCBCCHH FFGGFAA DCCCCFH ABCEFGH ABDEFGH BCEEGFC
43,EGGFEBA HGEDDCA DACFFGG HHCBCCC GFDCBBH BBADGGG ABCDFGH AACDGGH AACFGGG DFGEADE HHFCBBB BBCDEGH HHGBBBB ABDEFGH ABDEFGH
44,GFFFEBA GGEEDDA BEBBEGH ABDEFGG FFFFEDA HHGDBBB ACFGHCC GHGDBBB HFCCCCC CACDDFH ABDEFHG CCCCCDH ABCEFGH AACEGGG FHGEDBA
45,HGGEDBA HGEDCBA HBACEFG ABCEGGG FGGFEBA HHECBBB DGABDGF DFABDFH ACEFFGG FFBBCEG BBCDDGH ABDEFGH ABCEFGH ACFFFFF ABCEFGH
46,GGGEDBA ABEGGFF DACFFGG FFGGFAA CBBCFHH HFBBDDD CACCGGG DHEBBGD FGCGFAA CBBDDGH ABCDFHH BCDBCGH ABCEFGH FFFFFCA AADEFGH
47,EGGFEBA DCCCCEH HGDBBCC EAADFGG HGFDCBA ACDEGGG FGGFEAA HGFEDAA GHFCBCB DBBDBGH AACGHGF ABCDEGH GGGGBAA ABDEFGH ABEFFGG
48,EGGFEBA DCCCCFH FABDFGG HACDEEE EDDCCCH EBADGGG GGFCABE DABEGGF HGFECBA CCBCCHH ABCDFGH ABCDEGH HCCCDDE ABDEFGH ABEFFGG
49,HGFEDBA ABEGGFF DACFFGG HFCCCCC ABEGGFF HCACFFF BFCCCGG DBCDEGG FCAFGFC DBCBDHH ABCDFHH BBBDEGH HCBCDDE ABDEFGH ABEFFGG
50,EGGFEBA HGEDDCA ABEFFFG EFGHBAA HGFDCBA AADFGGG HFEDDBC DGGDBCC HGFECBA FEDAAGG ABCDFGH ABCDEGH HCCCDDE ABDEFGH ABEFFGG
51,DGGFEBA GGEEECA AEEEFFF FGHEBBB HGFDBBA AABGGGG EBADCGG HFCCBBF GFFFEBA BDBDDHH ABCDFGH ABCDEGH ABCDFGH ABCEGGG ACFGGEC
52,EGGFEBA DCCCCFH FABDFGG HACDEEE CCCBCHH EBADGGG HECCCCC CEGGDBB HGFECBA EDBBBGH ABCDFGH EEFFFFA ABCEFGH ABDEFGH ABEFFGG
53,GFFFDBA HGEDCBA HGCBCCC AACFGGG GGGFEBA GHDCCCC ABDCFHG GCEFFAE BBBEGEH EBBGCDH CBBFCGH ABCEEGH AABGGGG AACEGGG EHGEDBA
54,EGGFEBA HGEEECA AAGHFEE BDGHDBB HGFDBBA BBBDGGH ADGHGCB HGFCDBA HHECBCA DCDBBGH ABCDFGH ACEEFGG ABCDFGH HHGBBBB ABEEFGG
55,HEEEDCA CCBBCHH GFFFFBA ABDFGGG AEGGFED DBADGGG HGEEEAA CBBCGHF GHBADDF CDFEDDE FFGGEAA ECBCCFH ABCEFGH ABDEFGH BCEEGFC
56,HFEDDBA ABEGGFF DABFFGG HHFBBBB AADFGGF HCABEFF ACFFFFF GHBBFEB ADDFHFC GECABFG ABDEEGH BBCDEGH HHEBBBC ABDEFGH ABEFFGG
57,EGGFEBA EEDCCBH HGDCBBC EBACFGG HGFDCBA ACDEGGG HHGCBBB HGEDEBA GBCBCGG CCCCCFH EGDABFH FFFFFCA ABCEFGH ABDEFGH FGGFCBA
58,GFFFDCA GFEEEDA BFBBEGH AAEFGGG FGGFEBA HGGDBBB EGCCEGA CFABDFH ACEFFGG AACFGGG ABDEFHG ACFFFFF ABCDFGH AACEGGG FHGEDBA
59,HGFEDBA ABEGGFF DABFFGG FGGGCAA BBBCFHH HDABEFE BBBEEHH GACDEFF AADFGGE CCACDHH ABCDFHH BBCDDGH ABCEFGH HABDEFF ABEFFGG
60,EGGFEBA DDCCCCH DACFFGG HFBCCDD EEDCCBH EBADGGG ABCEFGH ABCEFHH AAEGEGG GDDFEFA HFCBCDD BBCDEGH HBCCDDE ABDEFGH ABEFFGG
61,EGGFEBA DDCCCCH DACFFGG HFBCCDD EEDCCBH DBADGGG ABCEFGH ABBEFGH ABBDHGF FFFFFCA HBBBCFG FFFFFAA ABCEFGH ABDEFGH ABEFFGG
62,FGGFDBA HGEDCBA ACBDFGH AADFFGG FGGFEBA HHECBBB GGFEDBA GGFDCBB HHCBCCC BCCCDGH BBCCDHH ABCEDFH ABCEFGH AEEFFFF ABCEFGH
63,EGGFEBA EDCCCCH FAADFGG HEBCDDD HGFDCBA EBADGGG HECCCCC DBCEGHD HGFECBA CCBCCHH ABCDFHH ABCDEGH HHGBBBB ABDEFGH ABEFFGG
64,EGGFEBA DDCCCCH FAADEGG HEBCDDD HGFDBBA AEDEFFF GDBFDED BBGGGFA HGFECAA CCECBGH ABCDFGH ABCDEGH ABCDFGH HHGBBBB FHGFCBA
65,EGGFEBA CCBBCHH FAADFGG HACDEEE DCCCBFH EBADGGG HCAEEDD GHEBCCC FEDDCBH CCBCCHH ABCDFGH ABCDEGH HHGBBBB ABDEFGH ABEEFGG
66,HGFECCA HGEEDCA CBACEGH ABDEFGG EFFECAF HGFDBBB HFFBDEA DFABDFH ACEFFGG GBBCCFH BBCCDGH ABDEFGH ABCEFGH ACFFFFF FHGECBA
67,EGGFEBA HGEEECA ABEFFFG FFGHBAA HGFDBBA AABFGGG EEFHCAD GGEEEDA EHBBBGF CCBCCHH ABCDFGH ABCDEGH ABCDFGH HHGBBBB GHGECBA
68,GFFFEBA HGEDCBA HECCCCD AAEFGGG FGGFEBA GHECBBC EGEEEAD BAEGHFC BEFFFGA CCCCGDH BCEGFFA GBADEEG AACEFGH AEEFFFF FHGEDBA
69,DGGFEBA HGEEECA FAADEGG HHBBCCC HGFDBBA AEDEFFF EFDDDFB HHFCBBB FEDDCBH CCBCCHH ABCDFGH ABCDEGH ABCEFGH HCCCDDD ABEEFGG
70,FGGFCBA HGEDCBA HECCCCD AAEFGGG FGGFEBA FHDCCCC CCFAFHE BBFBGHD DEGCGCC HFCDDBC CDFHHAB BDBDCEH ABBEGGH BBCCCHH FHGEDBA
71,GFFFDBA HGEDDDA HHCABCD ABEFFGG DEEDDFC HHGCBBB HFDCBBF AEDECGF DCFCEEE BGDCHDC BACDFHG CBCCDGH ABCDFGH AACEGGG FHGEDBA
72,EGGFECA CCBBCHH HGDBBCC AADFGGG DDCCBEH CBADGGG HGFDCBA HGEDCBB HGDEBBC BCCCDEH HDBBBFG ABEEFFH ABCEFGH ABDEFGH ABDEFGH
73,EGGFEBA FEDCCBH DABFFGG HHBBCCC HGFDBBA ADEFFGG ABCEFGH ABCDFGH BACEGGH BBBDEGH BCEFGGA HGDBBCD ABCEFGH HHCBCCC ABEEFGG
74,DDDCCCH AEFFFEE DABFFGG GGGEBBB BABEGGG HDABEEE BADEGGG HHBBFBC DHHEBBB CCBCCGH ABCDEHH BBCCDGH FFFGFAA ABDEFGH ABEFFGG
75,EGGFEBA HGEEECA FAADEGG HHBBCCC HGFDBBA AADFGGG CCDDDGG HHEDCBA GEEFEAC CCBCCHH ABCDFGH ABCDEGH ABCDFGH HFCCCCC ABEEFGG
76,EGGFEBA EDCCCCH FABDFGG AADFGGG BBBEGGG EBADGGG HECCGEA AEGGFED HGFECBA CEECAGH ABCDFHH FFFFFCA ABCEFGH ABDEFGH ABEFFGG
77,EGGFEBA DDCCCCH DABFFGG HHBBCCC EEDCCBH EBACGGG AACEFGH ABDEFGH ABCDFGH DBCCCGH HHFCBBB BBCDEGH HHGBBBB ABDEFGH ABEFFGG
78,GGGFDBA HGEDCBA DHECCCC ABCDGHH GGFFDBA DDFHCCC ACDFHFE BABFGGG ACEFFFF DHCCCFD ABDEEGH BBCCDFH ABCEFGH ADEFFFF AGGFEDB
79,EGGFEBA HGEDDCA HHFDBBB FHBBDEE HGFDCBA ABBEGGG HGFECAA HGECCBA HEDFCBB ABDEFGH AACFGGG ABEFFEG GGGDBBB ABDEFGH ABEFFGG
80,GGGEDBA ABFGFFF DACFFFG FFGGGAA CBBBEHH HEABDEE BBBDGGH HGCCDBC FGGCAFB BCCCDGH ABCDEHH BBCDEGH ABCEFGH HCCCDDD ABEFFGG
81,DCCCCFH HGFECBA GFGGCAA AACFGGG GGFFDBA GBACFGG CBDFGGB CFEGCDB DFHDBEB BBBFFHE GGGFBBB CCCCCFH ABCEFGH ABDEFGH ACEEGFC
82,DCCCBFH GHFEDBA FFFGFAA AACEGGG GGGFDBA GBACFGG BCCCGHF DGDGDBB EEGHEBA EBBBCHH GGGGDAA DCBCCFH ABCEFGH ABDEFGH BCEEGFC
83,HEEEDCB DCCCBGH FEEFFEA ABDFGGG ABGGFFE DBADGGG HEDDDBB HDCEEAD HGAEEBC FEBBBFH FFFFFDA GCBCCEG ABCEFGH ABDEFGH BCEEGFC
84,HGFDDBA ABFGGFF DABFFGG FGGGCAA BBBCFHH HDABEEE EEHECBC ADGHEDB EFCCHCC CEDCBEH ABCDFHH BBCCEFH CCEFGGA AACEFGH ABEFFGG
85,HGFDDBA ABFGGFF DACFFGG FFGGGAA CBBBEHH FCABFGG ACBDEHH BFFFBEF BGFGCCC BDBBCGH ABCDEHH BBCDEGH ABCEFGH ABCEGGG HDCCCCC
86,GGFEDBA ABEGGFF DABFFGG HHCBCCC ABDFGGF HCABEFF FHFDCBB HEBBCGC AABGGGG CCBCCHH AACDFGH ABCDEFH GGGEBBB ABDEFGH ABEFFGG
87,EGGFEBA EDCCCCH HGDCBBB FBADFGG HGFDCBA ABCEGGG HGEDBBB HHEDBBB HFFFCAB CBBBDHH AACEGGG ABCEEGH HHCBCCC ABDEFGH ABDEFGH
88,EGGFEBA HGEEECA ACHGFDD BDGHCBB HGFDBBA ABBFGGG HHGEBBA HGEEDBA EEFGFCA ABDDDHH ABCDEGH ACGEEEG ABCDFGH HDCCCDD ABEEFGG
89,HGFEDBA ABEGGFF DABFFGG GGGEBBB BABEGGG HDABEFE AAFEDEH AAEFFGG DCFFFCC DDDBAFH ABCDFHH BBCDEFH GGGDBBB ABDEFGH ABEFFGG
90,HEEEDCA BBBGHFE HHGBBBB BBCCDHH FGGFEBA DBADGGG GGDAAEF CBEGHBC GGFDFBA DDDDCEH HGCCCCC ECCBBEH ABCEFGH ABDEFGG GGFEDCA
91,EGGFEBA HGEDDCA AHGEDCC CFHADEE HGFDCBA ABDFGGG FGGEEBA HHGCBBB HGGECAA GDCACFG BBBCEHH EDDCBDH FFFFFCA ABDEFGH ABEFFGG
92,GGGEDBA ABFGGFF DABFFGG FGGGCAA BBBCFHH HEABEEE CABFGGG FGADEEE CDDDDCH EABDDGH ABCDFHH BBCDDFH ABCEFGH HCCCDDD ABEFFGG
93,DCCCCFH HHEDCBA ECEFFFA ABCCFHH GGGFDBA GCACFGF BCEBGHF FHFDEDA HFECCAD CCCCCGH FFFFFDA FCBCCEH ABCEFGH ABDEFGH BCEEGFC
94,EGGFEBA DCCCCFH FAADFGG HACDEEE DCCCBEH EBADGGG HFFDBDB CFGGFAA AGGFECC GCBBBGH ABCDFGH ABCDEGH HCCCDDE ABDEFGH ABEFFGG
95,EGGFEBA HGEDDCA ADEFFFF GHGBBBB HGFDCBA AADFGGG ABCEFGH ABCDFHH ABDEGGG ACDECGH EEFGGCA FBBBDFH EEEFFFA ABDEFGH ABEFFGG
96,HGEDCBA ABEFGFF DABFFGG HHCBCCC ABDFGGF HDABEFE CCCBEHF AADGGFF GGFBFDA DABFFHF ABCDFGH BBCDEGH DEEFFGA AACEFGH ABEFFGG
97,GGGEDCA HGFEEBA DCABEGH ABCEFHG FFFFFCA HHGDBBB DEDEFDC HHFBBBC CDFBBEH ECACCGH ABEFFGG CCCCCFH ABCDFGH AACEGGG FHGEDBA
98,EGGFEBA HGEDDCA DACFFGG HHCBCCC HGFDCBA CBADGGG ABCDFGH ABCDGGH ABCDEGH DCBCCGH HHFDBBB BBCCEGH HHGBBBC ABDEFGH ABEFFGG
99,EGGFEBA BBBBGHG FEEFFFA ABDFGGG DCCCBFH EBADGGG HFCCCBC ABFGFFE GHDCCBB CCCCCGH ABCDFGH ABCDFGH HHGBBBB ABDEFGH ABEEFGG
100,GGFEDBA ABFGGFF CACFFGG FFGGFAA CBBBFHH HEABEEE ABCFGFG FGABDFF CDHDDCC DCBBDGH ABCDFHH BBCCDGH ABCEFGH CABDFGH ABEFFGG
101,CGGGECA GGFFCAA CDBAFHH ABDEFHF GGGDCBA GHGDBBB ECCEGBG DCBCCFH DBBGDGD DBCGDCG AACGGGG ABCDFGH ABCDFGH ABCEFGH ABCEFGH
102,CGGGECA HGFEDAA DDBBCHH ABCEFGH HEDCCCB GHGDBBB GGDGBBB FHEFEAA FFGBDEC GFFFEBA BBBFGGG ABCDFGH ABCDFGH ABCEFGH ABCEFGH
103,HEEEDCA BABGGGF HGGCBBB BBCDDGH GGFFEBA DBADGGG HHECCBB HGGEDAA FEEEFEA GGGFBBB ABDEEHH CCCCCFH ABCEFGH ABDEFGH ACEEGFC
104,DHGFCBB HHFCBBB ABBGGGG CCDDDHE HGCDECA HGGDBBB GEFDBAG DDBBGDH FBBEDFG CCCBGEH AAFFFGG ABCDEGH ABCDFGH AACEGGG DGFECBE
105,GGGGCBA HGEDCBA GFAACFG AAEFGGG FGGFEBA HGECBBB ABCEGGG DGABDFH ACEFFGG GGADCDF BBCDEFH BBBCEGH ABCEFGH BBBEGGG BBBDFGH
106,GEGGEBA HGFEEBA DCABEGH ABDEFGG FGFFFAA HHGDBBB EGGDEDA FGEEFCA ACEFFGG CCCCCFH ABDEFGG CCCCCDH AACDFGH AACEGGG FHGEDBA
107,EGGFEBA HGEDDCA FABEFGG HHBBCCC HGFDCBA EBADGGG HDBCDDD DGGDEEA GGFEDAA DCDBBHH ABCDEHH HFCCCCC ABCEFGH ABDEFGH ABEFFGG
108,FHGEDBA HGEDCBA HECBCCD AAEFGGG GGGFCBA GHCCCCC CGHBCBE ADBFFGG GGFBBBF ADDEEGG DEBCAGH CCCDAGH BCCDDEH AAEEFGG CHGFDCA
109,GFFFDBA HGEDCBA HGBACEF ABCDFHH FGGFEBA HGGEBBB HGCDDBB HFBBCCD EFFFFBB BCCCDGH BBDCDGH ABDEFGH ABCEFGH AAFFFGG ABCEFGH
110,EGGFEBA DDCCCCH DACFFGG HEBCDDD EDCCBDH EBACGGG ABCDFGH ACDEFGG ABBGFGG BBDEGHC HFCBBCD BBCDEGH HEBCCDD ABDEFGH ABEFFGG
111,DGGFEBA GGEEECA AAEFGGG FFGGBAA HGFDBBA BBBEGGG ABCEFGH ABDDEGH ABDEFGH BBCDDGH ABCDFHH GGGEBAA ABCDFGH ABCEGGH HFCCCCC
112,HFFGDBA GGFEEBA CCABEGH ABDEFGG FFFFFBA HHGDBBB CGHACEE HHCBCCC BBCHDEH DDBBCGH ABEFGGF CBBBCGH ACFFFFF HGFEDBA HGFECBA
113,EGGFEBA EDCCCCH FABDFGG HDBCDDD DCCCBFH EBADGGG HECCCEB EGHCBCC DCDHGDA DBCCCGH ABCDFGH ABCDEGH AACEFGH ABDEFGH ABEFFGG
114,EGGFEBA HGEDDCA AAEFFGG FFGHBAA HGFDCBA AABFGGG FEEEEBC DEFGFCA CGBAFGF DCCBCGH ABCDFGH ABCDEGH FFFFFCA ABDEFGH ABEFFGG
115,CHFFDCA HGFEDAA DDBAEHH ABCEFGH HDCDCCC HGFCBBB BEDCCGH EAEEEEF ECEFBDG FGFCEBC BBBBGHH HGFECBA HGEDCBA HGFECBA HGFECBA
116,EGGFEBA HGEEECA AEEEFFF GHGBBBB HGFDCBA AABFGGG BBAGGFG GHDDCCB FFEEDFA CCBCCHH ABCDFGH ABCEFGH ABCDFGH ABDEFGH ABEEFGG
117,BBBDGHH HGEDCBA FEFFFCA ABCDEGH DGGFEBA HDABEFF DBBCDHH FGGFCCA DDCBEHE CBBCFHG ABCDEHH FFFFFAA ABCEFGH ABDEFGH ABEFFGG
118,HGFDDBA ABEGGFF DACFFGG HHCBCCC ABDGGGF HCABEFF CBCCHHC DBCCFFH GDBBFEE ACDFCFH ABCEFGH BBCDDGH HHEBBBC ABDEFGH ABEFFGG
119,EGGFEBA HGEDDCA AGGEDCC BEHFBCC HGFDCBA AADFGGG GHGEDBA HGFDCBA HGEBBBC FDECAEH BBCCEHH ECBCCEH FFFFFCA ABDEFGH ABEFFGG
120,EGGFEBA HGEDDCA HHECBBB EHABEFF HGFDCBA ABDFGGG HGGEBBA HGFDDAA GFGDEBA EFCCDCG BBBCEHH ABDFFGG GGGGBAA ABDEFGH ABEFFGG
121,EGGFEBA HGEEECA AEEEFFF GHGBBBB HGFDBBA ABEFGGG HFCCCBC ADFEEDH HGDCCBB CCCCCGH ABCDFGH ABCDEGH EEEFFFA ABDEFGH ABEEFGG
122,EFFEFDA FHFCCCB AACEFGH CCCCHEC GGGEDBA HHGDBBB ABCEFHG AAGGEEF BGCDCFF ACDEEGF ABFFFFF BBCDEGH ABCEFGH ABCEGGG BGGFDCD
123,EGGFEBA HGEDDCA ABEFFFF GGHEBBB HGFDCBA AACFGGG ABCDFGH ABCDEGH ABDEFGH BBCCDGH DEFFGEA GCBBBEH EEEFFFA ABDEFGH ABEFFGG
124,GFFGDBA HGFEDAA ECABEGH AACEFHG GGGGDAA HHGDBBB EFGFDCA HDCCCDE ACEFFGG BBBDCFH ABCFGGG BBCDDFH AEEFFFF AACEGGG FHGECBA
125,EGGFEBA HGEEECA AAEFGGG FFGGBAA HGFDBBA ABEFGGG ABCEFGH ABDFGGG ABCDFGH ABCDEGH ABDFGHC HGECBBC ABCEFGH HHGBBBB ABEEFGG
126,EGGFEBA DCCCCFH DACFFGG HBCDDEE DDCCBEH EBADGGG AACEFGH ABCCEGH ACEFGEG FFFFEEA HBBBDFG EEEFFFA ABCEFGH ABDEFGH ABEFFGG
127,EGGFEBA HGEDDCA DACFFGG HHCBCCC HGFDCBA ABEFGGG ABCDEHH ABCEFGH BBBDFGH BBBCDHH FFGGEBA CBBCDGH ABCEFGH ABDEFGH ABEFFGG
128,EGGFEBA HGEDECA AEEEFFF GHGBBBB HGFDCBA AAEFGGG HFCCCBC HGGEBBA FEDDHBB CBCCCHH ABCDFGH ABCDFGH FFFFFCA ABDEFGH ABEFFGG
129,HEEEDCB AABGGGF HGGCBBB BBCDDGH GGGFDBA EBADGGG ACBDEHH CCBCDFH BFGGEAC BBBCDHH HHDBBCC CCCCCFH ABCEFGH ABDEFGH ACEEGFC
130,GFGFDCA HGEDCBA ADCDFGH AADFGGG GGGFEBA HGFDBBB GCGDBDD HHBBCCD DEFFFFA FGAAFDG ABDFGGG CCCCCFH AEEEFFF ABCEFGH ABCEFGH
131,BGGFECA HGFEDAA DCBBDHH ABCEFGH HEDDCCB GHGDBBB EDACEGG HGCCCCB HCCDDDD CCCCCFH BBBDGGG BBCDEGH ABCDFGH AACEGGG DGFECBE
132,GGGFDBA EDCCCCH HGCBBCD AAEFGGG GGFFEBA GHDCCCC DHCADEE CCBBCHH ACEFFFG BCBCDGH BCECEEH FFACCGG BCCDDEH AACEGGG EHGEDBA
133,HEEEDBB BBBCHGG GGGFABB BBCDEFH FGGFEBA DBADGGG HEDDDCB DDFHEDA GFEDFDA FFFFFBA ACEEEGG CCCCCFH ABCEFGH ABDEFGH ACEEGFC
134,GGFEDBA ABEGGFF DACFFGG HFBCCCC ABFGGFF GCACFGF BBBDFGH GDECEFB EHDCCCB DCBCBHH ABCDFGH EEFFFFA ABCEFGH ABDEFGH ABEFFGG
135,HEEEDCA BBAFGGG GGGFBBB ABCDEFH FGGFEBA EBADGGG HFGEBBB GGGCBAD BBAEFGH FBBBFGF HHFBBBB CCCCCFH ABCEFGH ABDEFGH ACEEGFC
136,HEEEDCA CBBBEHH FFFGFAA ABDFGGG AFGFFED DBADGGG AACEHFG AADFGGF HHGDCBA DDDDFGC HHFBBBB DCCBCFH ABCEFGH ABDEFGH EFFEECA
137,EGGFEBA HGEDDCA ABEFFFG FGHEBBB HGFDCBA ABEFGGG HEBFBEE GDFFCFA HGFECBA CCBCCHH ABCDFGH ABCDEGH HHGBBBB ABDEFGH ABEFFGG
138,DCCCCFH GHFECBA GGGDBBB ABDFGGG GGGFDBA FBACFGG CABDFHG FCADEGG EEEBBEH BDGCAFG HHCBBCC CCCCCFH ABCEFGH ABDEFGH ACEEGFC
139,EGGFEBA CBBBGHG FEEFFFA ABDFGGG CBBBGHG EBADGGG HGEEBAC FFHEACC HGFECBA FGCBAGG ABCDFGH FFFFFAA ABCEFGH ABDEFGH ABEFFGG
140,EGGFEBA HGEEECA AAEFGGG EFFGGAA HGFDCBA CCBAFHH ABCEFGH ABCEGGH ABCEFGH BBBDEHH ABCDFHH HHFCBBB ABCEFGH GGGEBBB ABEEFGG
141,EGGFEBA DCCCCFH EABEFGG HDBCDDD DCCCBFH DBADGGG GGFEEAA BDCHEFB BGGFECB GDCCAFG ABCDFGH GGGDBBB ABCEFGH ABDEFGH ABEFFGG
142,GGGFECA HGEDCBA DHECCCC ABCDGHH GGFFDBA EDFHCBB BBDDEGH ADECFGG HECCCEE EBBDFDH CBCDDHH DCDBCEH BBBCGHH AACEGGH AGGFECB
143,HEEEECA ACHGEDC HHCBCCC ABBCFHH FGGFEBA DBADGGG HGDBDBB GGFDECA FFFECAE EEEEFEB HDCCCCC CCCCCFH ABCEFGH ABDEFGH BCEEGFC
144,HEEEDCA BBBFGGG GGGDBBB ABDEFFH GGFFDBA EBADGGG HGBBBDD HGFDCAC BCCBEGH DCCCCFH GGGCBBB DBBCCFH ABCEFGH ABDEFGH ACEEGFC
145,HFGECBA GGEEDDA DCABEGH AADFGGG FGGGEBA HGFDBBB GHDDEDA DFABDFH ACEFFGG CDCDEHD BBCDDGH ABEEFGG ABCEFGH ACFFFFF FHGECBA
146,EGGFEBA HGEDDCA ADEFFFF GHGBBBB HGFDCBA ACEFGGG ABCDFGH ACCDFGH ABCEFGH BBCDEHH EFGGFCA DBBCDFH ABCEFGH ABDEFGH ABEFFGG
147,GEFGEBA HGEDCBA HFABDEF ABCDGHH GGGFEBA HGGCBBB HFBCDBF HDBCCDE ACEFFGG BCCCDGH BBCDDGH ACCDDFH CCCDDDH AACEGGG FHGEDBA
148,HGGEDAA HGFDABB DCBCCFH ABCEFGH FFFFEDA HHGDBBA HEGDBCC HGEBBBC ACEFFGG BBBDFGH AADEFGH BBBDEGH BBBBGHH AACEGGG FHGECBA
149,EGGFEBA HGEDDCA HHECBBB EHABEFF HGFDCBA ABBEGGG HGFDBBA HGECCBB HGEDCAB ABEDDGH ADFEFFG EFFFFFA ABCEFGH ABDEFGH ABEFFGG
150,FFHFDBA EEDCCBH HHCABDD ABEFFGG GGGFEBA HGDCCCC EEDBFBG BBFHFCE CCCCCFH FFFBDGB FBGDEAF CCCCDFH ABCEFGH ACFFFFF EHGEDBA
151,EGGFEBA CCCCCFH DABFFGG HEBCDDD EEDCCBH EBACGGG ABCDFGH ABCEFGH ABCDFGH GECABGG HHGDBBB BBCDEGH GGGDBBB ABDEFGH ABEFFGG
152,GGGFDBA HGEDCBA HHCBBCC ABBEGGG GGGFEBA EEHEBBB DFACFGG HACEEEF EEFFCGA AFFGFBD BBEDCGH FDBCDDH BCCCDFH ABCEGGG EHGEDBA
153,GGGEDBA GFEEDDA HHCABDD ADEEFGG DEDDDGC HHFCBBB HDFCBDD AFGEDGE GDCEBED BBHFCDF ADFGCEF BBBCEGH AABGGGG AACEGGG FHGEDBA
154,GEGGCCA HGEDCBA HFCBCDD AAEFGGG GGFFDBA HECCCCC DBBBFHG DGABDFG BBCECHH CCCCGDH CCEGDBH BBBFDGH ABCEFGH BBBBGHH CHGFDCA
155,EGGFEBA DCCCCEH HGDBBCC EABDFGG HGFDBBA ABBEGGG HGEDBBB HHFDBCA GCCDBEG CBDFCHD ABBDFHH CBCCCFH FFFFFCA ABDEFGH ABDEFGH
156,EGGFEBA HGEEECA DABFFGG HHCBCCC HGFDBBA BBBEGGG ABDEFGH ABCEFGG ABCEFGH BACDFHH ABCDFGH HHEDCBA ABCEFGH FFFFFCA ABEEFGG
157,HEDDEDB ABGFFFF HGCBCCC ABCCFHH GGGFDBA HEABDEE ABCEFGH ACBDGGG DBDCCFH BBCCDHH ABCDFHH BBCDEGH ABCEFGH ABCEGGG BGGFDCD
158,EGGFEBA HGEEECA FAADFGG HHBBCCC HGFDBBA ADDEFGF HHDBCCC FFDCCFD CGGCAEE CCBCCHH ABCDFGH ABCDEGH FFFFFCA ABDEFGH ABEEFGG
159,GGGFDBA HGFEDBA DBACEGH ABDEFGG FFFFEDA HHGDBBB ABCDEHH FGBCEGC GGGEBBB ECBBEGH AABDFHH BBCCDFH BBBEGGG ABCEGGG FHGEDBA
160,EGGFEBA HGEDDCA AACGGGG EFFGGAA HGFDCBA BBBCGHH ABCDFGH BBCDFGH ABCFFGH ABCDEGH ABDEGHD HGDBBBD ABCEFGH HCCCCDD ABEFFGG
161,GGEGDBA HGEEDCA BCBCFGH ABDEFGG FGGFEBA HGFDBBB CFFFEBC CHCCCDE FFHCCCC BCCCDGH AACEGGH DCCADFH AABGGGG AACEGGG FHGEDBA
162,GEFGEBA GGEEDDA BDBCEGH ABDEFGG FFFFEDA HHGDBBB HGFDBCC FGEFFCA EGCDDDD BCCDEEH ABEEFGG CCCCCFH AEEFFFF HGFECBA HGFECBA
163,EGGFEBA DDCCCCH DABFFGG HHBBCCC HGFDCBA BBADGGG ABDEFGH ABCDFGH ABCEFGH EFBBBHH FGGGEBA BBCDEGH FFFFFCA ABDEFGH ABEFFGG
164,EGGFEBA HGEDDCA ABGHFEE BDGHDBB HGFDCBA AACFGGG ACGHGDC HGFECAA GBBBEFH FGDDBBF BBCCEGH GCBCCEH EEEFFFA ABDEFGH ABEFFGG
165,GGGEDBA ABFGFFF DABFFGG FGGGCAA BBBCFHH HEABDEE CAAEGGG EHDECBB AFBFFFF DCACCGH AACEFGH BBCDDFH ABCEFGH FFFGFAA ABEEFGG
166,HEEEDCA BABGGFF HGGCBBB BBCDDGH GGGFEBA DBADGGG HEFDDDA HFBBEEC GCBBEFG BBECCGH HHCBBCC ECCBCEH ABCEFGH ABDEFGG GGFEDCA
167,GFFGEBA HGEDCBA HDACDFF ABCDGHH FGGFEBA HHFCBBB CEAEHED GGGEBCA BCDDEHD EEECACH BBCCDHH ABDEEGH ABCEFGH ABEFFGG FHGEDBA
168,EGGFEBA CCBBCHH DACFGGG ABDFGGG DCCBBGH EBACGGG AADEFGH ABBEGGH DHHDCCA FFFFFDA HDBBCDE ABCDEGH CABDFGH ABDEFGH ABEFFGG
169,EGGFEBA DDCCCCH DABFFGG HHBBCCC HGFDCBA AADFGGG AADEFGG BBBDFGH ABCEFGH ABCDDGH EEFGGCA DBBCDFH EEEFFFA ABDEFGH ABEFFGG
170,EGGFEBA HGEEECA ABBHGFF BDFGHBB HGFDCBA BBBCFHH ABEGGFF HHGDCBA HGEEFBA GFBBBFH BBCDEGH FHFCBBC ABCDFGH HFCCCCC ABEFFGG
171,EGGFEBA EDCCCCH FAADFGG HDBCDDD CCCBCHH EBADGGG FEFFADE FFHEDBA GGFCCAD GCBBBGH ABCDFHH ABCDEGH HFBCCCD ABDEFGH ABEFFGG
172,GFFFDBA HFDCBBF HHCABCD ABEFFGG DDDDCBH HGFCBBB HGBAFDD DADGGEE CCDAFFH CFEGGDA CAECEHG CDBDDEH AABGGGG AACEGGG FHGEDBA
173,FFGGEBA HGEDCBA GGCCCCC ABBEGGG GGFFDBA FFGGBBB BCBFEEH BDFGGEA DGHEEAA BBCCDGH BBCCEHH CCCCEEH BCCDDEH ABDEHGF HGFECBA
174,DCCCCFH FHGECBA GGGFBBB AADFGGG GGFFDBA HGCBCCC BFBGEDF EBBFGFC HHEABCC BDBCEGH ABCDEHH BBCCDGH ABCEFGH ABCEGGH AGGFECC
175,EGGFEBA DDCCCCH DACFFGG HFBCCDD HGFDCBA BBADGGG ABCDEGH ABDDFGH ABCFFGH GEBCBGD HGCBBCC ABCDEGH HEBCCCD ABDEFGH ABEFFGG
176,EGGFEBA HGEDDCA AAEFGGG FFGGBAA HGFDCBA BBBEGGG ABCEFGH ABBDFGH AADEGGG BBCDEHH ABCDFHH HGCBBCD ABCEFGH HHCBCCC ABEFFGG
177,EGGFEBA HGEDDCA AHGEDCC CFHBCDD HGFDCBA BBBDGGH CGHFDBA HFECBCB HFCDBCB EBBCDHG ABCDEGH HFCCBCE ABCDFGH ABDEFGH ABEFFGG
178,EGGFEBA EDCCCCH HGDCBBB EHABEFF HGFDCBA ABBEGGG HGFECBA HGEECAB HCEFFCA CBBDDHH AACGGGF ABDFFEH GGGDBBB ABDEFGH ABEFFGG
179,GGGFDBA HGEDCBA HECCCCD AAEFGGG GGGFDBA DDHDCCC AAFGFFF HHCBCCC AAFFFFF BCBCCGH BADDCHH CDCBDEH ABCEFGH BBCCDHH GGFGDBA
180,HGFDDBA ABEGGFF DABFFGG GGGEBBB BABEGGG HDABEFE DBBCEGH GDDBFFB BCGCCEH DCBBDHH ABCDFGH BBCDEGH FFFGGBA ABDEFGH ABEFFGG
181,HGFDDBA ABEGGFF DACFFGG HFBCCCC ABEGGFE GCACFGG CACEHFF FGABEGE BBDFCGG BBCFCFH ABCDFGH HHGBBBB ABCEFGH ABDEGGG HGFECBA
182,GGGEDBA ABEGGFF DACFFGG HHCBCCC ABDFGGF HDABEEE AAFGHEE ABFGGGB BCCCGEH DACDDHH ABCDFGH BBCDDFH ABCEFGH GGGCBBB ABEEFGG
183,EGGFEBA HGEEECA ABEFFFF GGHEBBB HGFDBBA ABEFGGG ABCDFGH ABCEFGH AADFGGG BBCCEHH ABCEGHG HGFDBBC ABCDFGH GGGEBBB ABEEFGG
184,GGFFCBA HGEDCBA ACCEFGH AADEFGG FGFFEBA HHECBBB HEFACED HFEFBBB ACEFFGG EEEFFAE BBCDDGH ACCCDFH BCCCCFH ABCEGGG FHGEDBA
185,HGGECBA HGEDCBA HGBBCDE ABCDGHH FGGFEBA HHFCBBB HGFDBCB HFEEEAA GHGBBBB BCCCDGH AACEEGH ABCEEGH ABCEFGH CCCCCFH FGBBFEE
186,EGGFEBA HGEDECA AEEFFFF GHGBBBB HGFDCBA ACEFGGG HEFEBAD GHBCBED DCCBGDH FECBBGG ABCDEHH ABCDEGH FFFGFAA ABDEFGH ABEFFGG
187,GGFFDBA HGEDCBA HECBCCD AAEFFGG FGGFEBA HEDCCCC HGBFFBB CACEEHF GGFBADF GAECEEF BBEDFHE GCBEFCG AABGGGG AACEGGG FHGEDBA
188,HGEDDBA ABEGGFF DACFFGG HHCBCCC AAEGGFF HCABEFF ABDEFHF FDCBGGB CCGFGDA ABCDFGH ABCDEGH BBCCDGH HHCBBCC ABDEFGH ABEFFGG
189,HGEDDBA ABEGGFF DABFFGG FGGGCAA BBBCFHH HEABEEE CABDGGG EFHDCAE AEEEEDH ECBCCFH ABCDFHH BBCDEGH ABCEFGH GGGEBBB ABEEFGG
190,DGGFEBA GGEEECA AEEEFFF FGHEBBB HGFDBBA BBBDGGG ABBGGGG AAEFEEH HAEEEDD DDCFBFG ABCDFGH ABCDEGH ABCDFGH FFFFFCA ABEEFGG
191,HGFDDBA ABEGGFF DACFFGG HFBCCCC ABFGGFE HCABEFF AGGEBEE GGFBBDD DEGEBBF EDCBAFH AACEFGH BBCDDGH GGGEBBB ABDEFGH ABEFFGG
192,HGFEDBA ABEGGFF DABFFGG HHCBCCC ABDFGGF HCABEFF DBACFHH HGDDDAA AEFDGGB BCDCBGH ABCDFHH BBCDEGH GGGGBAA ABDEFGH ABEFFGG
193,EGGFEBA HGEDDCA HHECBBB EHABEFF HGFDCBA AADFGGG FHGECBA HGFEDBA HFGCCBB ABCEEHG AACGHFF ABCDEGH FFFFFCA ABDEFGH ABEFFGG
194,EGGFEBA HGEEECA ABEFFFG FGHEBBB HGFDBBA AABFGGG BCADGGG GFGAAED HGFECBA FCBBBGH ABCDFGH ABCDEGH ABCDFGH HFCCCCC ABEEFGG
195,GFFFDBA HGEDCBA HECBCCD AAEFGGG FGGFEBA FHGCBBB CGBDDEF BAFGGGD BCCFDEH GHFBCBC CCCBEGH DDABEFH ABCEFGH AACEGGG EHGEDBA
196,EGGFEBA HGEDDCA ADEFFFF GHGBBBB HGFDCBA ABEFGGG ABCEGGH ABCEFGH ABCFEGH ABCEEHH FGGGDBA BBBCDGH FFFFFCA ABDEFGH ABEFFGG
197,EGGFEBA HGEDDCA HGECBBB DGABEFF HGFDCBA ACDEGGG HGFDCAA GGGEDAA GGEGDBA ACCCDGH ABFGGFF ABCDDGH HFBCCCC ABDEFGH FGGFCBA
198,HEEEDCB BABGGGF HGGCBBB BBCDDGH GGGFEBA DBADGGG HGBBECD HGFDDAA GFGFBBB CBCCCGH HHCBCCC CCCCCFH ABCEFGH ABDEFGH BCEEGFC
199,EGGFEBA DCCCCFH FABDFGG HACDEEE EDDCCCH EBADGGG HEBCDEB AEGCEFE CFDEFFB CCBCCHH ABCDFGH ABCDEGH HFBCCCD ABDEFGH ABEFFGG
200,GGGEEBA HGEDCBA ABCDFGH AADEFGG FGGFEBA HFECBBB CEGFDEA HHBBCCC HEFFEAA BCCCDGH BBBDEGH CCCCCFH BBBBGHH ABCEGGG FHGEDBA
201,DGGFEBA GGEEECA ACEFFFG GHGBBBB HGFDBBA AAEFGGG BCDHFDE HAEEEDD HGFECAA CCBCCHH ABCDFGH ABCDEGH ABCDFGH FFFFFCA ABDEFGH
202,EGGFEBA HGEEECA AAEFGGG FFGGBAA HGFDCBA AACFGGG ABCEGGG ABCEFGH ABCDEGH BBCDEHG ABDFGHD HEBBBCF ABCEFGH HFCCCCC ABEFFGG
203,EGGFEBA DCCCCEH HGDCBCC DACEGGG EEDCCBH CBADGGG HGEDCBB HGEDCBA GFGGBAC BCCCDFH BDCCDGH FFFFFAA ABCEFGH ABDEFGH ABEFFGG
204,EGGFEBA HGEEECA FAADFGG HHBBCCC HGFDBBA AEDEFFF DEDFCBG HFBBEEE GCFFEBB CCBCCHH ABCDFGH ABCDEGH EEEFFFA ABDEFGH ABEEFGG
205,GFFFDBA EEDDCGD HHCBBCD ABEFFGG CCCCCGH HGFCBCC HFDDAEE FGEAEDE ACEFFFG FFFFEBB BEDDBHD BBCFCEH ABCEFGH AAFFFGG EHGEDBA
206,EGGFEBA HGEEECA AAGHFEE BDGHDBB HGFDBBA BBBDGGH GHGECBA HGGEBBB HFFCCBB CABDEHH ABCDFGH AAEFGGG ABCDFGH GGGGBAA ABEEFGG
207,BGFGECA HGFEDAA DDBBCHH ABCEGGG HFDCCCB HHGDBBB CGGACGE FGEEFEA ACDFFGG CCCDDHF BBBBGHH ABCDFGH ABCEFGH ABCEFGH ABCEFGH
208,GFFFDBA FEDDCGC HHDABDD ABEFFGG DDDDCGF HGFBBCB HEDDDCA HFCCCED BBGEFEF EEABDGG CCEDCDH FCBCCFH AAFFFGG AACEGGG EHGEDBA
209,DGGFEBA GGEEECA AAEFFGG FFGHBAA HGFDBBA AAEFGGG HDBCCCH HBDEEDC FFFFGAA CCBCCHH ABCDEHH ABCDEGH ABCDFGH FFFFFCA ABEEFGH
