,0
628,GGGEDBA ABEGGFF DABFFGG HHCBCCC ABDGGGF HDABEFF CFGEBBG GGEDEBB DBCDHDG CEEBBFH AACEFHH BBCDDGH GGGGBAA ABDEFGH ABEFFGG
629,GFFGECA HGEDCBA HGCABDE ABCDEHH FGGFEBA GGFGCAA HGECBBB HHCEBBC HHCBCCC FFFGABE ABCDEGH ABCDEGH ABCEFGH CCCCCFH HHDCCBB
630,GFGFEBA HGEEDCA BBBCFGH ABDEFGG GGGFEBA HGDCBBB FCCDAGG HHFBBBC ACEFFGG GDBBCFG BBCCEHH BBCCDFH BBCCDHH BBBDFGH ABCEFGH
631,CFGGECA HGFEEBA DCBBDFH ABCEFGG HHECBBB HHGDBBB ECBBEHG EFAEEFG HGBCCCC BCBCDGH CCCCCEH AEEDEFF ABCDFGH AACEGGG DGFECBE
632,GGGEDBA HGEDCBA HHCCCCC AACFGGG GGGFDAA DHGCCCC EAHFCDD DEDGDEB ACEFFFG BFCBCHF BBDECGH CCCCDEH BBCDDEH ABCEGGG BHGFDCA
633,EGGFEBA DCCCCFH FAADFGG HACDEEE DCCCBEH EBADGGG GCBDBFG CHDDCED DDADGFF CCBCCHH ABCDFHH ABCEEGH HFBCCCD ABDEFGH ABEFFGG
634,EGGFEBA HGEDDCA HHECBBB DGABEGG HGFDCBA ACDEGGG HGFDCBA HGFEBBA BBCEFEH DEDBAGH BBBDFHH BBDDDFH FFFGFAA ABDEFGH ABEFFGG
635,EGGFEBA HGEEECA ABEFFFF GGHEBBB HGFDBBA ACEFFGG ABCEFGH ABCEEGH ABCDFGH BBCCCHH BBEFGGB HGECBBC ABCEFGH HHGBBBB ABEEFGG
636,EGGFEBA HGEDDCA DABFFGG HHCBCCC HGFDCBA ABDFGGG ABCDFGH ABCEFHH ABCDFGH ACCCEHH FFGGFBA EBBCDFH EFFFFDA ABDEFGH ABEFFGG
637,GGGFDBA HGEEDDA BBBDFGH ABDEFGG FFFFEDA HHGDBBB BFGACFE CFABDFH EGCDDDD BCCCDGH BBBDFHH BBCCDFH BBBEGGG ABCEGGG FHGEDBA
638,EGGFEBA BBBGHGE HGEDDAA ABDFGGG CBBBFHH DBADGGG HGEDBAD AACEGGG BBBDEHH BBCDDGH AACFGGG ABDEEFH HHCBCCC ABDEFGH ABEFFGG
639,EGGFEBA EDCCCBH HGDCBBB FBACFGG FEDCCBH BBADGGG HGFDCBA GGFEFBA HGGCCAC BBBCFHG AAEGGGG BCDDDEH HHCBCCC ABDEFGH ABEFFGG
640,GGGFDBA HGEDCBA EHECCCC ABCCGHH GGFFDBA EEHDBBB ABHEFDG DHGEBBC BBBBGHH CCDCCFH BBCEDHH BBCCEFH BBBEGGG AACEGGG CHGFDBA
641,EGGFEBA GGEEECA DABFFGG HHCBCCC HGFDBBA ADDEFFF ABCDFGH AACEFGH ABCEFGH ABCDEHH BCEGGGA HGFCBBC ABCEFGH GGGGBAA ABEEFGG
642,GGEFDBA HGEDCBA GABDEFG AACEGGG FGGFEBA HHECBBB FHDEFAA GHFCCCA HHCBCCC BCCCDGH BBCCDGH ACDDDFH CCCDDDH AACDGGG FHGEDBA
643,CGGFECA GGFFEAA CDBAFHH ABCEFGH HDCCCCC HHGDBBB AEBEFGG DFABCFH HFGDBBB BFCCCFH BBBBGHH ACDDEGH ABCDFGH AACEGGG DGFECBE
644,HGFDDBA ABEGGFF DABFFGG FGGGCAA BBBCFHH HDABEEE ABBFGGG DECHDCC EFAFFEE BBBCEHH ABCDEGH BBCDEGH ABCEFGH HCCCDDD ABEFFGG
645,EGGFEBA DDCCCCH FAADFGG HEBCDDD HGFDBBA AEDEFFF HCDBDDE HHCCCBB FAECFEE DCCCCHG ABCDFGH ABCDEGH EEEFFFA ABDEFGH ABEEFGG
646,EGGFEBA CCCCCFH DABFFGG HBCDEEE DDCCBEH EBACGGG AACEGGH ABDDFGH BBAFGGG BCCCCGH GGGFCAA BBCDDGH FFFGFAA ABDEFGH ABEFFGG
647,EGGFEBA HGEEECA AEEEFFF GHGBBBB HGFDBBA BBBDGGG GDACFEF AEGFFED FEDDCBH BBBCDHH ABCDFHH ABCDEGH ABCDFGH HHCBCCC ABEEFGG
648,HGEDDBA ABEGGFF DABFFGG HHCBCCC ABDGGGF HCABEFF BCBDFGH GGEFDBB BGHCDCC DBCCCHH ABCEFGH ACCCEGH HHGBBBC ABDEGGG HGFECBA
649,EGGFEBA EDCCCCH HGDCBBB GCACEFF HGFDBBA ABBDGGG HGFEDAA HHGDCBA HGFDCAA ABDDFGH BBBDFHH ACCCEGH ABCDFGH ABDEFGH ABEEFGG
650,DGGFEBA HGEEECA FAADFGG HHBBCCC HGFDBBA ABEFGGG HFCCCBC BCFFFED GGCFEAA CCBCCHH ABCDEGH ABCDEGH FFFFFCA ABDEFGH ABEEFGG
651,EGGFEBA EDCCCCH FABDFGG HHBBCCC EDDCCCH DBADGGG HDBEDBE FFECDGA AGGFECC ACCCFHH ABCDFHH ABCDEGH ABCEFGH ABDEFGH ABEFFGG
652,EGGFEBA AAFGGFE GGGGBAA ABDFGGG AAFGGFF EBADGGG HFDDGBB DDDFGDB HGDCCBB DFBBCHG ABCDFGH GGGDBBB ABCEFGH ABCEFGH ABCEFGH
653,GGGEDBA ABEGGFF DACFFGG HFCCCCC ABEGGFF HCACEFF GDFBAFF HGEDBBB ACFHGCC DABDEGH ABCDEGH ABCDEGH GGGEBBB ABDEFGH ABEFFGG
654,EGGFEBA HGEDECA AEHFEDD BEHFCCC HGFDCBA AADFGGG HHFDBBA HGFDDBA GGGDCAB FCDBAFH ABCDFGH AAFFEEH ABCDFGH ABCEFGH ABEFFGG
655,HGFDDBA ABEGGFF CACFFGG FFGGGAA CCBBEHH HFABDDE BBCDEHH FGDDAEF FGFDCDA DBCCEGH ABCDFGH BBCCEGH ABCEFGH FFFGFAA ABEEFGG
656,EGGFEBA HGEDDCA ABGHFEE BDGHCBB HGFDCBA ABBEGGG ADHGFEB HGEDCBA HGEDDBA ACDEBHH BBCCEGH HFBBBCF EEEFFFA ABDEFGH ABDEFGH
657,HGEDDBA ABFGGFF CACGFFG EFFGGBA CCBBDHH HDABEFF ABGFDFF HFCBADG GHCBBDC EEDABGH ABCDEGH BBCDDGH ABCDFGH CABDFGH ABEFFGG
658,EGGFEBA HGEDDCA DACFFGG HHCBCCC EEDCCBH FBACGGG BBBDFGH ABCDGGG ABCEEHG FECBAGH HHGCBBB ABCDEGH GGGDBBB ABDEFGH BFHGDBB
659,GGFFDCA HGEDCBA GABDEFG AACFGGG FGFFEBA HGDCBBB FHDEFAA BBEBFGH GGGECAB ADBEEEH BBCCDGH BBBCEGH ABCEFGH BACEGGG FHGECBA
660,HEEEDCB BABGGGF HGGCBBB BBCDDGH GGFFEBA DBADGGG HFDCCCB GGGEDBA HGFDDAB DBCCCGH HHCBBCC CCCCCFH ABCEFGH ABDEFGH BCEEGFC
661,GFFGEBA HGGEBBA BCACGGG ABCEFGG GGHCBBB GHGDBBB CBEBEGG GDDEEEB FFEAAGG BBCCFHG ACBDFHG BCCCCHH ABCDFGH ABCEFGH ABCEFGH
662,EGGFEBA HGEDDCA ADEFFFF GHGBBBB HGFDCBA ABDFGGG ABCEFGH ABCDFGH ABDEFGH CCDCBHH FFGGFBA CBBCDGH EEEFFFA ABDEFGH ABEFFGG
663,EGGFEBA HGEDECA FAADFGG HHBBCCC HGFDCBA ABEFGGG GAEFFDE EFFFEAC ECFFECC CDBBBGH ABCDEGH ABCEEGH FFFGFAA ABDEFGH ABEFFGG
664,EGGFEBA DDCCCEH HGDBBCC CACEGGG CCCBBHH CBADGGG HGFDBBA HGEDBBB DCEHGDA BBCDDFH AFFEDFF EFFFFFA ABCEFGH ABDEFGH ABEFFGG
665,GFFFDBA HGEDDDA HHCABDD ABEFFGG GGGFEBA FHGCBBB EDFDDEC FACEFEF CFFCAFG DDBGBDG BAFFEGF FCABDGH AAFFFGG AACEGGG EHGEDBA
666,GGGFDBA HGEDCBA DHECCCC ABCDGHH GGFFDBA FFHDBBB HECCECC FAEFBEG ACDEFFH EBBCCGH ABBDFGH CBCCDFH ABBEGGH ABCEGGH AGGFECB
667,HEEEDCA BBCHGFE HHFBBBC BBCCDHH FGGFEBA DBADGGG CFDEGDB CACDFGH ABCFGGG CCCDDEH HGCCCCC CCCCCFH ABCEFGH ABDEFGH BCEEGFC
668,EGGFEBA HGEDDCA FAADFGG HHBBCCC HGFDCBA EBADGGG HFBDDBC EBDFFGB GGEBCCC DADCCGH AACDFHH ABCEEGH HHGBBBB ABDEFGH ABEFFGG
669,GGFFDBA GGFEEBA DCABEGH ABDEFGG FGFFFBA HHGDBBB HFEGBBB GHGDBBB HFCCCCC BCCCDGH ABEFFGG CCBCEFH ACFFFFF ABCEFGH ABCEFGH
670,EGGFEBA CHGEDCB HHFBBCC ABDFGGG AEGGFEC DBADGGG HGFDBBA FGGBBDC BABFGFH AADEGGG ABDDFHH HFCCCCC ABCEFGH ABDEFGH ABDEFGH
671,GGGECBA HGEDCBA HFBBCDE AACFGGG FGGFEBA HHFCBBB HGFDBCB EFEEFFA GGGEBBB DEBCCFH AACEEHH ABCDEGH ABCEFGH CCCCCFH EEBFFED
672,HFFGDBA HGEDCBA HCACEFF ABCEGGG FGGFEBA GGGGCAA HGFCDAA HEDEDBB DEFFEAF FFBDBDH BACEEGH ABDEEGH ABCEFGH ACFFFFF FHGECBA
673,EGGFEBA HGEEECA AAEFFGG FFGHBAA HGFDCBA AABFGGG GCADGCG HHEDCBA HHDCCBB BBDCBHH ABCDFGH ABCDEGH ABCDFGH HCCCDDD ABEEFGG
674,FHGECBA EDCCCCH HHCABCD AAEFGGG GGGFEBA HHDCBCC DDCHFCC CCCCDHF GGFABEE BCCCDGH EEEACGG FBCBFFG BBCCDHH AACEGGG EHGEDBA
675,DDDCCCH AEFFFEE DABFFGG HHCBCCC ABDGGGF HDABEFF DHCBBEG GHBDCCC BGGGFDA DEDBAFH AACEFGH BBCCDGH GGGEBBB ABDEFGH ABEFFGG
676,HGFEDBA ABEGGFF DACFFGG HHCBCCC ABDGGGF HCACFFF CADHHEC EFBEFFC ABFFGFF BABEEGH ABCEFGH ABCDEGH HHCBCCC ABDEFGH ABEFFGG
677,BBBCFHH HGEDCBA FEFFFCA ABCDEGH EGGFEBA HEABDED ACCEHGF FGEBAFF BBGEBDG CCBECFH ABCEFGH BBCDDGH FFFGFAA ABDEFGH ABEEFGG
678,EGGFEBA EEDCCBH DACFFGG HHBBCCC EEDCCBH DBADGGG ABCEFGH ABCEFHG AFHCBEG FFEEEEA HEBBCDE ABCDEGH ABCEFGH ABDEFGH ABEFFGG
679,EGGFEBA EDCCCCH FABDFGG HEBCDDD EDDCCCH EBADGGG HDDADDE CFBGFEA HGDDCBB CBBECHG ABCDFGH ABCDEGH HCCCDDE ABDEFGH ABEFFGG
680,EGGFEBA HGEDDCA AAEFGGG EFGHBAA HGFDCBA AADFGGG HHDCCBB CGGBDED HGAFECC HFAACFF ABCDFGH ABCDEGH HHCBCCC ABDEFGH ABEFFGG
681,EGGFEBA EDCCCCH DACFFGG HEBCDDD HGFDCBA ADDEFFG AACEFGH ABBDGGH ABDDDGH CEDEDEF GGGEBAA BBCDEGH FFFGFAA ABDEFGH ABEFFGG
682,GGGEDBA AAEGGFF DABFFGG HHCBCCC ABDGGGF HCABFFF BBCEFCH GGFFBAA CDGGBCF AADEEHH ABCDEHH BBCDEGH GGGEBBB ABDEFGH ABEFFGG
683,CCCCCFH DHFEDBA DABFFGG HHCBCCC ABEGGGF HEABEEE DBABFHH BDEFAGG AFGGFBB BBCCEGH ABCDFHH BBCDEGH ABCEFGH HFCCCCC ABEEFGG
684,EGGFEBA HGEDDCA ABGHFED BDGHDBB HGFDCBA AABFGGG CGGGEBA HGFDBBB HFCDEBA CBBDDGH BBCCEGH HDBBBEG EEEFFFA ABDEFGH ABDEFGH
685,GFGFDBA HGEDCBA HCACDEF ABCEGGG FGGFEBA HGDCBBB CFGACFE GHGDBBB HCCDDDD BCCCDGH BBCDDGH ACCDDFH BCCCCFH BADEFGG FHGEDBA
686,EGGFEBA HGEDDCA ABEFFFF GGGEBBB HGFDCBA AACFGGG ABCEFGH ABCEFGH ABCDFGH BCBCDGH DDFGGEA GBBBCEH ABCEFGH ABDEFGH ABEFFGG
687,HGFDDBA ABFGGFF DABFFGG GGGEBBB BABEGGG HCABFFF HECBFBE BBGGGAF FBBEGEE CBBDDHH ABCDFHH EEEFFFA ABCEFGH ABDEFGH ABEFFGG
688,EGGFEBA HGEDDCA AAGGFEE BDGHDBB HGFDCBA BBBEGGG BFHGEBB HGGECBA HGDCBCB BCBCDHH ABBDFGH CBCDCEH GGGGBAA ABCEFGH ABDEFGH
689,EGGFEBA DCCCCEH HGDBBCC EABDFGG DDCCBEH CBADGGG HGFECAA HGGECAA GHGDABD BBBDEGH ADGFEFF ABCDEGH HHCBBCC ABDEFGH FGGFCBA
690,EGGFEBA HGEDDCA ADHGEDD CEHFBCC HGFDCBA AACEGGG FGGGDAA HGEBCBB HFEECBA EEABDHG BBCDEGH ECCBBFH EEEFFFA ABDEFGH FGGFCBA
691,HGFDDBA ABEGGFF DABFFGG GGGEBBB BABEGHG HDABEEE BBCEBHH EFBBDHD BBGEFGC DDCBBGH ABCDFHH BBCDEGH ABCEFGH HFCCCCC ABEFFGG
692,EGGFEBA DCCCCFH FAADFGG HACDEEE EDDCCCH EBADGGG HFEECAC EDFFEDC GDDEDCC CCBCCHH ABCDFGH ABCDEGH HHGBBBB ABDEFGH ABEFFGG
693,EGGFEBA HGEDDCA ADHGEDD CEHFBCC HGFDCBA AACEGGG DGGGDBA HGFDCBA HGECCBB GECCADH BBCDEGH ACFEEFH ABCDFGH ABDEFGH ABEFFGG
694,GGFEEBA HGEDCBA HBBCDFG AACFGGG FGFFEBA HHECBBB HGEECCA DFABDFH HCCDDDD DDBCCEH ABCDEGH ABCDFGH ABCEFGH BBBBGHH ACGFFED
695,HGFEDBA ABFGGFF DACFFGG FFGGGAA CCBBEGH HDABEFF GGGDCBA GGEEEBA FBDHCDC DDAADHH AACEFGH BBCDDGH GGGEBBB ABDEFGH ABEFFGG
696,HEEEDCA CCBBCHH GFFFFAA ABDFGGG BGGGFCA DBADGGG HFFEBAB ACHGFCD BCCEFDH FEDDEGB GGGFBBB BCCCDGH ABCEFGH ABCEFGH ABDEGGG
697,EGGFEBA HGEDDCA AHGEDCC CFHACDD HGFDCBA ABDFGGG HGFEDBA HGEDCBA GCCCBDH BBCEDGH AACEFGH ABCDEGH GGGGBAA ABDEFGG FGGFCBA
698,EGGFEBA DCCCCEH DACFFGG HEBCDDD EEDCCBH EBACGGG ABCEFGH ABCEFGH ABEFGGG CCBCCHH HHFCBBB BBCCDGH GGGDBBB ABDEFGH ABEFFGG
699,EGGFEBA CBBBDHH DACFGGF ABDFGGG DDCCBEH EBACGGG AACEFGH ABDEEGH ABCEEGH BBCCDHH EFGGFBA HGCBBCF ABCEFGH HHCBCCC ABEEFGG
700,EGGFEBA DDCCCEH HGDCBBC GBADFGG EEDCCBH CBADGGG HHFCBBB HGFEBBA HEDDBBF CBBDCGH ABEGFGG ABCFFGH GGGDBBB ABCEFGH ABDEFGH
701,EGGFEBA DCCCCFH HGDBBCC CACEGGG CCCBCHH CBADGGG HGFECBA HGGDBBB CBAGFHE BBCDEFH ACEEFGG EEFFFFA ABCEFGH ABDEFGH ABDEFGH
702,HFFFDCA HGEDCBA ACBCFGH AADEFGG FGGFEBA HHECBBB HFGDDAA GGFGBAB GHGBBBB BCCCDGH AACEEHH ABCDFGH ABCEFGH BBBEGGG FHGECBA
703,EGGFEBA HGEEECA AEHFEDD BEHFCCC HGFDCBA AACFGGG FGGFDBA HGFECBA HFDEDCA FDBBBGH BBCDEGH HFECBBG ABCDFGH HCCCDDD ABDEFGH
704,BBBCFHH HGEDCBA DABFFGG HBCDDDD ADFGGED HDABEEE BBCEGHC HFGEBAC AFFFFEE CCCCCEH ABDEFGH BBCDEGH HBCCDEE ABDEFGH ABEFFGG
705,EGGFEBA HGEEECA AAEFGGG FFGGBAA HGFDBBA CCBAFHH ABCEFGH ABCEFGH ABDEFGH BBBDDHH ABCDFGH HHGDBBB ABCEFGH GGGGBAA ABEEFGG
706,HGFDDBA ABEGGFF EABFFGG GHGBBBB AACFGGG HDABEEE ABEFGHE CDBEHBG AEGECGD CCBCCHH ABCDEHH BBCDEGH DEEFFFA ABCEFGH ABEFFGG
707,FGGGDBA HGEDCBA HHCBBCC ABBEGGG GGGFEBA EEHEBBB ABEGEFF BFGEFBC DBEGECG EHACDEG ADDCEGH DDCCBFH BCCDDDH ABCEGGG EHGEDBA
708,HGEFDBA HGFEBAB EBACEGH ABCEFHG FFFFGAA HHGDBBB EBACEGG HHCBCCC BCCGHCD BCCCDGH ABCEFGG CCCCCGH BBBEGGG ABCEGGG FHGECBA
709,HFEDDBA ABEGGFF DACFFGG HFCCCCC ABEGGFE GCACFGF GHEBCDA GBFCGCC BCDCHEE EBABEHH ABCDFGH BBCDDGH DABDFGH ABDEFGH ABEFFGG
710,DGGFEBA GGEEECA AAEFGGG FFGGBAA HGFDBBA ABBFGGG ABDEFGH ABBDFHH AACFGGG ABDEEGH ABCDFGH GGGGDAA BBBDFGH ABCEGGG HHCCCCC
711,FGGFDBA HGEDCBA DHECCCC ABCDGHH GGFFDBA EDHDBCC HBFECDC AGEFFCD GGFBBDC DDDEHBC AACDEHH CEBBEFH ABCEFGH AAFFGGG BGGFDCB
712,GGGECBA HGECBBC HHCACCD AAEFGGG FGGFEBA HEDCCCC HFBEDBB ABFECFH GGGECBA BBBBEHH BBBEDHG BBDDDEH BBBEGGG AACDFGH ABCEFGH
713,HGEDDBA ABEGGFF DABFFGG GGGEBBB BABEGHG HDABEFE HECEBDC AECCGHE BCGCCHD CCBCCGH ABCDFHH ABCEEFH FFFGGBA ABDEFGH ABEFFGG
714,EGGFEBA EEDCCBH HGDCBBB GHABDEE DDCCBEH CBADGGG HGDCBBB HGEACCD HHABDCD BBCCDGH CBBCEHH FFFFFAA ABCEFGH ABDEFGH ABEFFGG
715,GGGFDBA DDDCHCC HHBABDE ABDEGGG DCCCCFH HGFCBBB ABCEFHG FADEEFF DDEHFEA BBCHDEG BBBDEHH BBCCDFH ABCEFGH AAFFGGG HGFECBA
716,GFFFDBA HGEDCBA HDCCCCC AAEFGGG GGGECBA FHDCCBB DECCDGF CGBDGEB HDBECBF FBFBFEE GGGCBCB CCCCCFH BCCCDFH AACEGGG EHGEDBA
717,EGGFEBA HGEDDCA AAEFGGG FFGGBAA HGFDCBA AADFGGG ABCDFGH ABDEFGH ABCEFGH ABCDDGH FFGGFBA EBBCCFH EFFFFDA ABDEFGH ABEFFGG
718,EGGFEBA CCCCCFH DABFFGG HEBCDDD HGFDCBA ADDEFFF ABCDFGH ABCDEGH ABDEFGH DBBBCGH FGGGDAA BBCDEGH FFFGFAA ABDEFGH ABEFFGG
719,GFGGDBA HGEDCBA EABDFGG AACEGGG FGGFEBA HGDCBBB HEFABED HFBBCCD DEFFEAF BBBEGHG BBCCEHH BCCCDFH BBCCDHH ABDDGGG FHGEDBA
720,HGGDCAA HGEDCBA HGCBCCC AACFGGG GGFFEBA DDDHGBB ADFGGBF BBGHGBB EDCGFCC AEGDEEE BAFGGDE ACBEFGH ABCEFGH AAFFGGG EHGEDBA
721,EGGFEBA EDCCCBH HGDCBBB FBACFGG HGFDCBA ABBEGGG HGFDBBA HFECCBB CDCECDH CCBCCGH ADGFFFF ABDEFFH HFCCCCD ABDEFGH FGGFCBA
722,HFFFEBA HGEDCBA ABCEFGH AADEFGG FGGFEBA HFECBBB HFGBABE EFDEEBD GCCCCGF BCCCDGH BBCCDGH BCCCDFH CCCDDDH BBDGHFC HGFECBA
723,EGGFEBA DCCCCFH FAADFGG HACDEEE EDDCCCH EBADGGG EBFGFAE GGBBEFB EGGGCBA BADDDHG ABCDFGH ABCDEGH GGGDBBB ABDEFGH ABEEFGG
724,EGGFEBA GGEEECA ABEFFFF GGHEBBB HGFDBBA ABEFFGG ABCEFGH AACEFGH ABCDEGH BBCDEHH ABCDFGH HGFDCBB ABCEFGH EEEFFFA ABEEFGG
725,EGGFEBA HGEEDCA AAGHFEE BDGHDBB HGFDCBA AACFGGG FFGGEBA HHGDBBA GGFFDBA HGBABFF ABCDEGH BBCDDFH ABCDEGH ABDEFGH ABEFFGG
726,HGEDCBA ABEFGGF DACFFGG HFCCCCC ABFGGFF HDABEFF EBBCGGE CDBEHFB CAEEEGF EEBBCGH AACDFGH BBCDEGH ABCEFGH CABDFGH ABEFFGG
727,GGFEDBA ABFGGFF CACFFGG EEFFGDA DCCBBGH HDABEFF AADGFGG HFGDBBB DBGFBFF BBDCEGH ABCEFGH BBCDEGH ABCEFGH HGCCCCC ABEFFGG
728,GGGFDBA HGEDCBA DDHCCCC ABCDEHH GGFFDBA GECDDGA FEGCFEA CCGCCFF HGFDEBA BCCBDGH ABCDEGH BBCCDFH BBCDEEH ABCEGGH BGGFECB
729,HGFDDBA ABEGGFF DACFFGG HBCDDDD ACFGGFD HCACFFF DBCBEGH CCBFGGD CHEEGBB ABCFDGH ABCDFGH BBCCDGH GGGFBAB ABDEFGG HGFECBA
730,EGGFEBA GGEEECA DABFFGG HHCBCCC HGFDBBA ABEFGGG ABCEGGH ABDEFGH ABCDEGH ABDEEGH ABCEFHH HGEDBBB ABCEFGH FFFFFCA ABEEFGG
731,GFFGEBA HGEDCBA HGABDEF ABCDGHH FGGFEBA GGGFBBB HGDEBBB GHGDBBB FFCCCCG BCCCDGH AACEFHH ABDEFGH ABCEFGH AAFFGGF FHGECBA
732,GFGGDBA HGEEDCA BBBDFGH ABDEFGG FGGFEBA HFECBBB DACEGHC HFBBCCG ACEFFGG BCCCDGH ABBDFHH CBDCDEH BBBBGHH ABCEGGG FHGEDBA
733,EGGFEBA DCCCCEH HGDCBCC DACEFGG HGFDCBA BBADGGG HGFEBAA FCCCEGF BCCCDGH BCCDCFH ADDCDGH EEFFFFA ABCEFGH ABDEFGH ABEFFGG
734,EGGFEBA HGEEECA AHGEDCC EGHACDD HGFDBBA ACDFGGG AEGFFEC FGGFCBA BBCDDHH BADDEHH ABCDEGH ABCEEGH EEEFFFA ABDEFGH ABEEFGG
735,EGGFEBA EDCCCCH FAADFGG HHBBCCC HGFDCBA EBACGGG HEDECAC EACFDEG HFCCBBE CCBCCHH ABCDFHH ABCDEGH GGGDBBB ABDEFGH ABEEFGG
736,DDDCCCH AEFFFEE DABFFGG FGGGBAA BBBCGHH HDABEFE BBGGFBE GDACFFF FFHEBBB BCBCEHH ABCDFHH BBCDEGH GGGFBAB ABDEFGH ABEFFGG
737,EGGFEBA HGEEECA DABFFGG HHCBCCC HGFDBBA AAEFGGG ABCDFGH ABCDFHH ABCEFGH CBBDEGH ABCEFHG HGFDCAB ABCEFGH GGGEBBB ABDEFGH
738,GGGFCBA HGEDCBA HCACDFF ABCEGGG FGFFEBA HGGCBBB FGCDFEA HHBBCCC ACEFFGG DDDEEDF BBCCDGH ABDEEGH ABCEFGH BBBDEGH ABCEFGH
739,EGGFEBA HGEEECA AAEFGGG FFGGBAA HGFDCBA ABBEGGG ABCEFGH BBBDEGH ABDEFGH ABCDEHH ABCDFHH HGDBBCD ABCEFGH HHCBCCC ABEFFGG
740,EGGFEBA DDCCCCH FAADEGG HHBBCCC HGFDBBA AEDEFFF GGABFEE HHCBBBE AGGFECC CCBCCHH ABCDFGH ABCDEGH EEEFFFA ABDEFGH ABEEFGG
741,EGGFEBA EDCCCCH FAADFGG HHBBCCC HGFDCBA EBADGGG FFACFEF HHDCCBB AGGFECC CCBCCHH ABCDFHH ABCDFGH GGGGBAA ABDEFGH ABEEFGG
742,FGGFECA DDCCEHC FFBABFH ABDEFGH FHCDCCC HGFDBBB ABCEGHG BGFFBBG BEHDFEC ACDEEGG BBCCDHH BBCCDGH ABCEFGH ABCEGGH AGGFDCD
743,EEFHFCA HGEDCBA HECCCCD AAEFGGG GGFFDBA GHDCCCC GFBCCCG DEHDDEA CCCCDGH EFBCCEG AADFGHF FCBBCFH ABCEFGH AABGGGG CHGFDCA
744,EGGFEBA HGEDDCA FABDFGG HHBBCCC HGFDCBA EBADGGG HGDBBCD ACDGHCF GDCCGDC BBCDDHG ABCDFGH ABCDEGH HHGBBBB ABDEFGH ABEFFGG
745,EGGFEBA HGEEECA DABFFGG HHCBCCC HGFDBBA ADDEFFF ABCDFGH ABCDFHH ABCFFFH ABCDEHH BDFGGFA HGEBBBD ABCEFGH HHGBBBB ABDEFGH
746,GFFFDBA HGEDCBA HGCBCCC AACFGGG GGGFEAA EHFCCCC CDECEDH AGGFDDD ABEDEFH DDDDAGH DEGBAEH CBBCDGH BCCDDEH AACEGGG EHGEDBA
747,EGGFEBA DDCCCCH DACFFGG HFBCCDD HGFDCBA BBADGGH ABCEFGH ABDEFGH BBBDEHH GEDDEGA HGCBBCD BBBDEGH HBCCDDE ABDEFGH ABEFFGG
748,DGGFEBA GGEEECA ACEFFFG FGHEBBB HGFDBBA AABGGGG CECCDDH HBDEEDC GAEFEDC CCBCCHH ABCDFHH ABCDEGH ABCDFGH ABCEGGG ABDEFGH
749,EGGFEBA HGEDDCA AAGHFED BDGHDBB HGFDCBA AACFGGG FGGFEBA HGEDCBA HGCCBBD BBBCEGH BBCDEGH CECBBEH EEEFFFA ABDEFGH ABEFFGG
750,GGGFDBA HGEDCBA HGGBBBC ABCCGHH GGFFEBA DDFHCCC AAFGGEE BCHHDCC BECGCDG FFBCBGE DACEGHE EBDCBGH ABCEFGH AEEFFFF DHGEDBA
751,EGGFEBA HGEDDCA AAEFGGG FFGGBAA HGFDCBA BBBEGGG ABCDFGH ABBEFGH ABCDFGH ABCDEHH ABDEGHF HECBCCE ABCEFGH HCCCDDD ABEFFGG
752,EGGFEBA BABFGGG FFFGFAA ABDFGGG BBBDHGG EBACGGG ACDFFFH BABEGGH EFGGCDA FFFFFDA HBBBDFG ABCDEGH HBCCDDE ABDEFGH ABEFFGG
753,GGFEDBA ABEGGFF DABFFGG GHGBBBB AACFGGG HDABEFF BCDCCHG ACDEFFF ACCDFGG FCCBCEH ABCDFGH BBCDEGH GGGEBBB ABDEFGH ABEFFGG
754,EGGFECA HGEEECA HHECBBB DGABEFF HGFDBBA ABDFGGG HHFDCBA HGFEDBA HGFCCBA BBBDDHH BBCDEGH HHECBBD ABCDFGH HHCBCCC ABEEFGG
755,HEEEDBB AABGGGF HGGCBBB BBCDDGH GGGFDBA EBADGGG HFCDDCC ABDFFFG BCFGHCC EECBBFH HHCBBCC CCCCCFH ABCEFGH ABDEFGH ACEEGFC
756,GGGFDBA GFDDCFB HHCABDE ACDEFGG DDDDCCH HDDCCCC HDGBCDD ADCFEHE GGBABGG EEEEAFG BBBHDFG AAEEFGH BBBCGHH ABCEGGG BHGFDCA
757,EGGFEBA DDCCCCH FAADEGG HDBCDDD EDDCCCH EBACGGG GDACFFF GGHBBBD ECFFEDC CCBCCHH ABCDFGH ABCDEGH ABCEFGH HFCCCCC ABEEFGG
758,GGGFDBA HGEDCBA HGCBCCC AACFGGG GGGFDBA GHDCCCC HEBFBDC BBFEDHD GBDHDCC BCBCDGH BBEDCHG CCCBDFH ABCEFGH ABCDGGH DHGEDBA
759,EGGFEBA DCCCCEH HGDBBCC CACEGGG DDCCBEH CAADGGG HGECCBB HHFBCBB GGGDCBA BBCCDHH ABDFFGG BCBCDGH HHGBBBB ABDEFGH FGHFCBA
760,GGGEDBA HGEDCBA GGCCCCC ABCEGGG GGFFDBA GGHCBBB ABDCFHG ADEEFFG EFFFFCA ABDGEFG AACEFHH CBBCEGH BBBCGHH ABCEGGG CHGFDCA
761,EGGFEBA HGEDDCA DACFFGG HHCBCCC HGFDCBA ABEFGGG ABCDFGH ABCEFGH ABBEGGH BBCDDHH HHFCBBB BBCDDGH HHCBBCC ABDEFGH ABEFFGG
762,GFGGEBA HGEDCBA HFABDEF ABCDGHH FGGFEBA HHECBBB HFFDBCC FGAAEGG ACEFFGG BCCCDGH BBBCDHH CBBBDGH BCCCCFH ABDDGGG FHGEDBA
763,EGGFEBA CCCCCFH DABFFGG HBCDDEE HGFDBBA BBADGGG ABCDFGH ABCDFGH ABCDFGH BBCCDHH EEFGFDA EBBCDFH ABCEFGH HCCCDDD ABEEFGG
764,HGFFDBA HGEDCBA HDBBCEF ABCEGGG FGGFEBA HGDCBBB FHCCEFA FGEFFCA FGGGBAA BCCCDGH BBCDDGH ABCDFGH ABCEFGH AABGGGG HFEDCBB
765,GFFFDBA FEDDCGC HHCABDD ACEEFGG DDDDCCH HHECBBB EEFBAGG AEEHEEE HCCCCCF BCCCDGH BAEDGGG BBFDCDH BBBEGGG AACEGGG EHGEDBA
766,EGGFEBA HGEEECA FAADFGG HHBBCCC HGFDBBA AEDEFFF FAAFFFF GEDDDCC HGFECBA DBCGBFH ABCDFGH ABCDEGH EEEFFFA ABDEFGH ABEEFGG
767,EGGFEBA EDCCCBH HFDDCBB GHBBCDD EEDCCBH CBADGGG HGGDACB HHDCCCB EGFABDG AADGGGF BBCDEGH HCCCCDD ABCEFGH ABDEFGH ABEFFGG
768,EGGFEBA HGEDDCA AHGEDCC DGHACDD HGFDCBA ABEFGGG FHEECBB HFGDBBB BBCDDGH CBCBCGH ACFEEGG ABCDEGH HCCCDDD ABDEFGH ABDEFGH
769,HGEDDBA ABEGGFF DABFFGG GHGBBBB AACFGGG HCABEFF FFDGEBA GFCAEEG GFGFCBA BBDCEGH ABCEFGH BBCCEGH HHCBCCC ABDEFGH ABEFFGG
770,EEEEFEA DGGCCCC DDBBDGH ABCEFGH GGFECBA HGFCBBB ABCEFHG GHGCBBB BCDDDDH CCBCCGH AACGGGG BBCCDGH ABCEFGH ABCEGGH AFGFEDC
771,EGGFEBA HGEDDCA BHGECCC CFHACDD HGFDCBA AADFGGG GGGFCBA HFGECAB GFEFEEA GECBBEH ABBDFHH GCBDCCH FFFGFAA ABDEFGH ABEFFGG
772,FGHECBA HGEDCBA GHDBCCC ABBEGGG GGGFEBA FFHCBBC EFEGDBE ACFFFFF GDEEEFA EEEEEBE BBCDHFF CBGBCEH CCCDDDH AACEGGG EHGEDBA
773,EGGFEBA AAFGGFE GGGGBAA ABDFGGG BABGGGF EBADGGG HGECBCB HGGDBBA CBCHGBF CBCDDHG ABCDFGH ABCDEGH HHCBCCC ABDEFGH ABEEFGG
774,GGFFCBA HGFEEBA DDABEGH ABEEFGG FGFFECA HGFDBBB GCEGGBA GHGDBBB FFGGBAE GBBCCFH BBBDDGH ABCDGGH ABCEFGH AABGGGG FHGECBA
775,EGGFEBA HGEDDCA BHGDCCC CFHADEE HGFDCBA ABDFGGG HGFEBBA HGFEDBA HGDDCAB ECBBBGH ABBDFHH BBCCDFH FFFGFAA ABDEFGH ABEFFGG
776,GGGFDBA HGEDCBA HHCBBCC ABCEGGG GGFFDBA DDHDCCC BBFGBFF AEFFFEE EFCCHCC BCBCDGH CCEDEGE ACCCDFH ABCEFGH ABCEGGG CHGFDCA
777,EGGFEBA HGEDDCA DACFFGG HHCBCCC HGFDCBA ADDFFGG ABCEGGG ABCEFGH ABCEFGH ABCDDHH HHFDBBA BBCDEGH GGGGBAB ABDEFGH ABEFFGG
778,DGGFEBA DCCCCFH FAADFGG HACDEEE DCCCBFH EBADGGG HFDFEAC HHEDCBA HFDFCBB CCBCCHH ABCDFGH ABCDEGH FFFGFAA ABDEFGH ABEEFGG
779,GFFFCDA HGEDCBA HECBCCD AAEFGGG GGGFDBA DHFCCCC CDCBFGG DAEFFFF GGGEBBB FGECBFC BBCEDFH BBECCFH BCCDDEH ABCDFGH CHGEDBA
780,HGFEDBA ABFGGFF DABFFGG FGGGCAA BBBCFHH HDABEFE CBADGGG GGFFBAE BFCBCHG CCBCCGH ABCDFGH BBCDDGH ABCEFGH HABCEFF ABEFFGG
781,EGGFEBA HGEDDCA FABDFGG HHBBCCC HGFDCBA ADDEFGF GEBCDBG HEDDCCB FCFFECC BBBDDHH ABCDFGH ABCDEGH HFBCCCD ABDEFGH ABEFFGG
782,HFGEEBA HGEDCBA HGCACEF ABCDFHH FGGFEBA GGGFBBB HFEDCDA GHGDBBB HCCDDDD BCCCDGH BBCDDGH BBCCDFH CCCDDDH ABCFGGG FHGEDBA
783,EGGFEBA HGEEECA ACGGFED BDGHDBB HGFDBBA BBBCGHH AEGGFCB HGECCCA HGEECBA BBCCDHH ABCDFHH ABEGFFF ABCDFGH GGGGCAA ABEEFGH
784,EGGFEBA HGEEECA AAEFGGG EEGGGAA HGFDBBA AABFGGG FAEFFEE DDDHCBE FEDDCBH CCBCCHH ABCDFGH ABCDEGH EEEFFFA ABCEFGH ABEEFGG
785,HFEEECA HGEDCBA EABDFGG AACEGGG FGGFEBA HHECBBB HFFDBCC GGFGBAB ACEFFGG HDBBCEG BBCDEGH ABDEFGH ABCEFGH ACFFFFF FHGECBA
786,EGGFEBA CCBBCHH FAADFGG ABDFGGG CBBBGHG EBADGGG HFEEEBB FFDDDGA HGFECBA CBDBCHG ABCDFHH ABCDEGH HCCCDDE ABDEFGH ABEFFGG
787,EGGFEBA CCBBCHH FAADFGG ABDFGGG CBBBGHG EBADGGG HGDCEAC HHEECBA FFFEGAA DCBCCHG ABCDFGH ABCDFGH HCCCDDE ABDEFGH ABEFFGG
788,EGGFEBA EDCCCCH FAADFGG HEBCDDD HGFDCBA EBADGGG HFEEABD FBGGCBD GGFBCDC CCCCCGH ABCDFHH ABCDEGH HHGBBBB ABDEFGH ABEFFGG
789,DCCCCGH AFGGFDB DACFFGG DACDEEH AEGGFDB HCABFFF DCBDDFH GDBFBCG EHDCCCC CCBCCHH ABDEFGH BBCCEGH HHCBCCC ABDEFGH ABEFFGG
790,EGGFEBA DCCCCFH FABDFGG HDBCDDD DCCCBFH DBADGGG HGECBBB DAEFFEE EDCCBDH BADEEHG ABCDFGH ABCDFGH ABCEFGH ABDEFGH ABEFFGG
791,EGGFEBA HGEEECA ABEFFFG FFGHBAA HGFDCBA AABFGGG HFFCCBB AHFFEDC GHCDECA BCBCDHG ABCDFHH ABCDEGH ABCDFGH BACEFGH GGGECBA
792,DGGFEBA GGEEECA AEEEFFF GHGBBBB HGFDBBA ADDEFFF FBDEFEE CCCEBHG HGFECAA CCBCCHH ABCDFGH ABCDEGH ABCDFGH GGGDBBB DHHFDBA
793,GFFFDBA HGEEDDA BCBCFGH AADEFGG FGGFEBA HGFDBBB BHGDBDC HHFBBBC GHGBBBB BCCCDGH AACEFHH CCCCCGH BBBEGGG AACEGGG FHGECBA
794,EGGFEBA HGEEECA AEEFFFF GHGBBBB HGFDCBA AABFGGG GBACGFF HBGDDCC GGEEACC FBBBBGH ABCDFGH ABCDEGH ABCDFGH ABDEFGH ABEEFGG
795,CCCCCFH HGEDCBA FEFGGBA ABBDGGH GGGFDBA GBACFGG EABEFGG DECBCDH FFFFFDA BBBDFGH FFGGEAA DCBCCFH ABCEFGH ABDEFGH BCEEGFC
796,EGGFEBA CCCCCFH FAADEGG HACDEEE CCCBCHH EBADGGG GADEEEE CDAGFFE HGFECAA CCBCCHH ABCDFGH ABCDEGH ABCDFGH HCCCDDD ABEEFGG
797,FGGEDBA HGEDCBA HHCBBCC ABCEGGG GGGFDBA DDHECCC ADCEGGG BAEFFFG ACEFFFG HFCCCEB AADDEGH BBDCEFH ABCEFGH ABBFGGG CHGFDCA
798,GGGFDBA HGEDCBA HEABDFF ABCDGHH FGGFEBA HHFCBBB HFFBDEA GGFGBAB ACEFFGG EDEABGF BBCCEGH ACCCEFH CCCDDDH BBEGHFB HGFECBA
799,HFEDDBA ABFGGFF DACFFGG FFGGFAA CBBBEHH HDABEFF AACEFHH HFBBBCG CDDDDCH DBBBCHH AACDEHH BBCCDGH ABCEFGH HCCCDDD ABEFFGG
800,EGGFEBA HGEEDCA HHECBBB CGABEGG HGFDCBA ABDFGGG HGFECBA HGFECBA BBCDEFH BBBBEHH BBCCFHH FFDBACH FFFFFCA ABDEFGH ABDEFGH
801,EGGFEBA EDCCCCH FABDFGG HEBCDDD EDDCCCH EBADGGG HDBBDDE FBEEGEB GBADGFE DCACCHH AACDFHH ABCDFGH HCCCDDE ABDEFGH ABEFFGG
802,EGGFEBA DCCCCFH FABDFGG HACDEEE EDDCCCH EBADGGG HFDDDBB HEDDCCB FHCBBGB CEBBDHG ABCDFGH ABCDEGH HCCCDDE ABDEFGH ABEFFGG
803,DDDCCCH AEFFFEE DABFFGG GHGBBBB AACFGGG HDABEEF BBBCGHH HGEEBBB AADDGGG CCBCCHH ABCDEHH BBCDDFH DEEFFFA ABCEFGH ABEFFGG
804,EGGFEBA HGEEECA AAEFFGG EEGGGAA HGFDCBA AABFGGG GCAAFGG FHBCEDD FEDDBFD EDCDAFH ABCDFGH ABCDEGH EEEFFFA ABDEFGH ABEEFGG
805,HGFDDBA ABEGGFF DACFFGG HHCBCCC ABDGGGF HCACFFF ACDEHGC FGGBCCC GHCBCDD GCCBBGH ABCDFGH BBCCEFH DABDFGH ABDEFGH ABEFFGG
806,GGGFDAA HGEEDDA ECABEGH ABDEFGG FGGFEBA HGECBBB FGGDDBB GHGDBBB DEFFFBC GHBBBDF BBBEFGH ABCDEGH ABCEFGH ABCEFGH AFCGFFE
807,HEEEDCA CCBBCHH GFFGFAA ABDFGGG AGFFEDC DBADGGG HGCBBCC HGFEDBA GGFFEAA CCBBCHH GGGGBAA DCBCCFH ABCEFGH ABDEFGH BCEEGFC
808,GGGFDBA HGEDCBA GHCCCCC ABCEGGG GGFFDBA FHFCBBC AGGDEFB EAFEDEE CCHGCCC CDGEBEG AADEFHG ECBCCFH BBBEGGG ABCEGGG CHGFDBA
809,HGFDDBA ABEGGFF DACFFGG HBCCDEG CGGGEBA HCACFFF BECCDGH EFBDFDE EBCEFDG GDABDGH ABCDFGH EEFFFFA ABCEFGH ABDEFGH ABEFFGG
810,GFFFEBA HGEDCBA HFABDEF ABCDGHH FGGFEBA GGGFBBB HEDFBBB HFECDBB FFGGBCB BCCCDGH BBCDDGH ABDDEGH ABCEFGH ABEFHGD HGFECBA
811,EGGFEBA HGEDECA ABEFFFG FFGHBAA HGFDBBA AADFGGG HFCCCBC AHFFEDC FFEEDFA DDBBCHG ABCDFGH ABCDEGH ABCDFGH ABDEFGH ABEEFGG
812,EGGFEBA HGEDECA ABEFFFG FGHEBBB HGFDCBA AADFGGG GFEAAFF GGAEEDC HHGCBBB CCDCCHG ABCDFGH ABCDEGH EEEFFFA ABDEFGH ABEEFGG
813,EGGFEBA CCCCCFH DABFFGG HEBCDDD HGFDCBA BBADGGG ABCDFGH ABBEFGH ABDEFGH ABDECHH GGGFBAA BBCDDGH GGGGBAB ABDEFGH ABEFFGG
814,EGGFEBA HGEDDCA AAGHFED CEGHCBB HGFDCBA AADFGGG ABFFGGE HFECDBC ABEEHGD AACFFHG ABCDFGH HHFBABD EEEFFFA ABDEFGH ABEFFGG
815,HEEEDBB AAFGGFF HHDBBCC ABCCFHH FGGFEBA EBADGGG HCADEEF ECAEGEF EFHGBAB EEEDFFB HECCCCC CCCCCFH ABCEFGH ABDEFGH ACEEGFC
816,HGFEDBA ABEGGFF DACFFGG HHCBCCC ABDGGGF HCABEFF CABCGGG FGDEDAE CCBBEHH EFCABEH AACDFGH BBCCEGH HHGBBBC ABDEGGG HGFECBA
817,DCCCCFH GHFECBA GGGGBBB AADFGGG GGGFDBA FBACFGG GABDGFE EEBBBGH BDGEEED EFDDEEC HHFBBBB CCCCCFH ABCEFGH ABDEFGH ACEEGFC
818,HGEDDBA ABEGGFF DABFFGG FGGGCAA BBBCFHH HDABEEE AABEFHH HHCCCDA AAGEFGF DCCACGH AACDFHH BBCCDFH ABCEFGH HABCEFF ABEFFGG
819,EGGFEBA HGEEECA AAEFGGG FFGGBAA HGFDBBA AACFGGG ABCEGGH ABBDFGH ABCEFGH ABBEFHG AACDFHH HGFCBBB ABCEFGH GGGGBAA ADHGEDD
820,FHFEDCA HGEDCBA HGCCCCC AACFGGG GGFFDBA DDFHCCC BBCHFEE DAHEEEE BGCGFAE GCBEEFD BCCDDGH BDBDCGH ABCEFGH ACDDFGG BHGFDCA
821,EGGFEBA CCBBDHH DACFGGF ABDFGGG EDCCBDH EBACGGG BACEFGH ABBEGGH ACCGFFH FEFEEFA HFDBBCD BBCDEGH ABCEFGH ABDEFGH ABEFFGG
822,EGGFEBA EDCCCCH FAADFGG HEBCDDD HGFDCBA EBADGGG HECCCCC AEFCFFE FFCCGDC CBBBEHH ABCEFGH ABCDEGH GGGGBAA ABDEFGH ABEEFGG
823,GGGFCBA HGEDCBA ACCDFGH AADEFGG FGGFEBA HGFDBBB BEFEDED GGFECCA EFHEBBB BCCCDGH AACDFGH CCCCCFH BBBEGGG BABEGGG FHGECBA
824,BFGFEDB HHEBCCB CBADGGG ABDEGHD HHFDCBA GHGDBBB ECFGGBB CGEECCD GHFBBBB FDCDFDC BBBFGGG ABDEEGH ABCDFGH AACEGGG DGFECBE
825,HGFDDBA ABEGGFF DABFFGG HHCBCCC ABDFGGF HDABEFE ABFDEFH HFCCDDB FBFFAFE CCBBDGH ABCEEGH ABCDDGH FFFGFAA ABDEFGH ABEFFGG
826,EGGFEBA EDCCCCH FABDFGG HEBCDDD HGFDCBA EBADGGG GGFEDAB DGFEDCC HEDDBCC CBCCCHH ABCDFGH ABCDEGH HCCCDDE ABCEFGH ABCEFGH
827,EGGFEBA HGEDDCA ABBHGFF BDFGHBB HGFDCBA BBBDGGG ADGGGDC HGEDCBA HGFDDBA CDDDAFH BBCCEHH HGBBBDG EEEFFFA ABDEFGH ABEFFGG
828,BBBCFHH HGEDCBA EDEFFFA ABCDEFH EFGGFCA HEABDEE EEFEGAC HFCEBCC AFFFFFA CBBCCHH ABCEFHH BBCDEGH FFFGFAA ABDEFGH ABEEFGG
829,EGGFEBA HGEDECA ABBHGFF BDFGHBB HGFDCBA AACFGGG ADFGGEB HFFECAB GDGFEEA CCDDBGH BBCCDGH HGDBBBD ABCDFGH ABDEFGH ABEFFGG
830,EGGFEBA GGEEECA ACEFFFG FFGHBAA HGFDBBA BBBDGGG EAAFGFG BBGGGFA BBBEHGG CCBCCHH ABCDEGH ABCDEGH ABCDFGH GGGGBAA ABEEFGG
831,EGGFEBA EECCCBH HGDCBBB FBACFGG EEDCCBH BBADGGG HGEECBA HGFDCBA GGGEBAB BBCCDGH ACFFFFF ABDEEFH HCCCDDD ABDEFGH ABEFFGG
832,EGGFEBA HGEEECA AAEFGGG EEGGGAA HGFDCBA AABFGGG EDEEECD AAGGGFE FFEEDFA CBBBEHH ABCDFGH ABCDEGH EEEFFFA ABDEFGH ABEEFGG
833,EGGFEBA HGEEECA ABEFFFF GGGEBBB HGFDCBA AACFGGG ABCDFGH ABCEFGH AAFGDFG ABCDDHH ABCEFHG HFCBBCD ABCEFGH HHCBCCC ABEFFGG
834,EGGFEBA DDCCCDH DABFFGG HEBCCDD HGFDBBA ADCEGGG ABCDEGH ABCDFGH ABCDFGH BBBEDGH EEFGGDA FBBBCFH ABCEFGH ABCEFGH ABEEFGG
835,DCCCCFH GHFECBA GGGEBBB ABEFFGG GGGFDBA FBACFGG HBBCDEE GFFFEAB BBFEBHH EDDCEGD HHFBBBB CCCCCFH ABCEFGH ABDEFGH ACEEGFC
836,HGEDDBA ABEGGFF DACFFGG HHCBCCC ABDFGGF HCABFFF FCADBFH EEDCAFH GHFACED CFDABFH ABCDEGH BBCCDGH HHCBBCC ABDEFGH ABEFFGG
