,0
210,FGFFDBA HGEDCBA HHCBCCC ABCEGGG GGGFDAA DHGCCCC FBCCHDD CCCCCFH FGCDDDD BCBCDGH ABCEFHF DFBBCGH ABCEFGH BCCCCFH CHGFDCA
211,EGGFEBA HGEDDCA DABFFGG HHCBCCC HGFDCBA ACBEGGG ABCDFGH ABCEFHH ABCDFGH EDDDAGG HHGDBBB BBCDEGH GGGDBBB ABDEFGH ABEFFGG
212,GGFFCBA GGFEEBA CBACFGH ABDEFGG FFFFFCA HHGDBBB CEGDBGB FGEFFCA HCCDDDD BCCCDGH BBBDFHH BBBEEGH AAEFFGG AACEGGG FHGECBA
213,FGGFCBA HGEDCBA GHCCCCC ABBEGGG GGGFDBA FHFCBBB BCECFHD AFDDDGF FBCHCED GEGEABF CBBBFHH CBCCDFH BBCCDFH AACEGGH CHGEDBA
214,FHGDBAB HGEDCBA HGCBCCC AACFGGG GGGFEBA GHDCCCC GFHEBBB AGGECCF CDEBBFH CCCCCGG CCGBFEF CCAEDFH ABCEFHG BBBBGHH EHGEDBA
215,EGGFEBA EDCCCCH EABEFGG HEBCDDD HGFDCBA ADDEFGF FFGGCBB DGBGFCC DCDHGAE HCBBCFG ABCDFGH FFFFFCA ABCEFGH ABDEFGH ABEFFGG
216,FGGFDBA HGEDCBA EHECCCC ABCCGHH GGGFDBA FEHDBBB ADEDFEG BFCGDFC BHEDDDD BBGEBFG BADEEGH CCBBDGH AEEEFFF ABCEGGG CHGFDCA
217,HGEDDBA ABEGGFF DACFFGG HFCCCCC ABFFGFF HDABEFF BAFCHFF EHDCCDD AAFGGFF GGDBADE AACDFHH BBCCEGH DEEFFFA ABCEFGH ABEFFGG
218,GGGFDBA HGFEDBA DBACFGH ABDEFGG FFFFEDA HHGDBBB DGABDGF FGFFFAA HFCCCCC BCCCDGH ABDEFGH BCCCCFH ABCDFGH HGFEDBA HGFECBA
219,EGGFECA HGEDECA ABEFFFG FGHEBBB HGFDBBA AABFGGG CCBCFGH AHFFEDC GHDCBCC CBCCCHH ABCDFGH ABCDEGH ABCDFGH ABDEFGH ABEEFGG
220,EGGFEBA DDCCCCH DACFFGG HEBCDDD DDCCBEH EBACGGG AACEFGH ABCEFGH ADDEGGD DEFDCHB HFCBBCD FFFFFCA ABCEFGH ABDEFGH ABEFFGG
221,HGEDDBA ABFGFFF CACFFGG FFGGFAA CBBBEHH HCABFFF ACCDFHG CDBBCHH FGGEBAE ECCBCGH ABCEFHH BBCCDGH ABCEFGH HFCCCCC ABEFFGG
222,EGGFEBA EDCCCCH HGDCBBB DGABEFF HGFDBBA ACDEGGG HGFDCBA HHECCBA HGCBCDB ECDBBGH BBBCFHH BBCCDGH EEEFFFA ABDEFGH ABDEFGH
223,HFFFDBA HGEDCBA HDABDEF AACEGGG FGGFEBA HHFCBBB BEBHDED HGFDBBB GGGECBB FGFCACF BBCCDHH ABDEFGH CCCDDDH BAEEHGE HGFECBA
224,EGGFEBA HGEEECA AAEFGGG FFGGBAA HGFDCBA AACFGGG ABCDFHH ABBDFHH ABCDGGG ABCDEHH BCEFGGA HDBBCDG ABCEFGH HFCCCCC ABEFFGG
225,GGGGDBA HGFEEBA DCABEGH ABDEFGG FFFFFCA HHGDBBB EBACEHG GGFGBAB DEFFFBC BCCCDGH AAFFEGG BCCCCGH ACFFFFF AACEGGG FHGEDBA
226,GGGFBCA GFEDDEA HHCABDE ACDEFGG CCCCDHC HHECCBB GHGBBCC CDCHEDD CCEGCCH DHBECDE CCBBGGF GDDBADH ABCEFGH AEEFFFF CHGFDCA
227,HGFEDBA ABEGGFF DABFFGG GHGBBBB AACFGGG HCABFFF DCFEGDB CDEBBDH GEDDEFA GDABEGG ABCDFHH BBCDEFH HBCCDDE ABDEFGH ABEFFGG
228,FFGEEDA DDDCHDC DFBABHH ABDEGGG HGCCCCC HHGCBBB BACDFGG DGABDGG BCDGGDD BECCCFH BBBBGHH ABCDFGH ABCEFGH ABCEFGH ABCEFGH
229,GGGFDBA HGEDCBA FHEBBCC ABCCGHH GGFFDBA EEHDBCC BGCGCBG AABGGGG EAFGGEA GBBEHCD BCGDEGD BDFCCEH ABCEFGH AEEFFFF DHGEDBA
230,GHGECBA HGEDCBA HECCCCD AAEFFGG FGGFEBA HGDCCCC BBBCFGH GBBCFFF BECGGEB GGGEBCA CDDDBHE CCCCCFH CCCDDDH AACEGGG FHGEDBA
231,CGFGDCA HGFFBAB DBBBFHH CCEFGGA HGFDCBA GHGDBBB CFHGBCC FFEFFEA CDDHDEC EDCCCCH AACGGGG ABCDEGH ABCDFGH AACEGGG DGFECBE
232,EGGFEBA DCCCCFH DACFFGG HEBCDDD DDCCBEH EBACGGG ABBDGGH ABCEFGH CCBCGFH FFFEEDA HBBBDFG ABCDEGH ABCEFGH ABDEFGH ABEFFGG
233,GGFFDBA GFEDDEA HHCABCE ABEFFGG EEEEDFB HHGDBBB HGCCDCB BACEHEG FBECCFF CCGFAEG ADBEFGH BBCEDGH ACFFFFF HGFEDBA HGFECBA
234,EGGFEBA HGEDDCA ABEFFFF GGHEBBB HGFDCBA AADFGGG ABCEFGH ABBDEHH ABDEGGH BCBCDHH EEFGFCA BBCCEFH EEEFFFA ABDEFGH ABEFFGG
235,GFFFDBA HGEDCBA HDCCCCC AAEFGGG GGGFEAA HGCCCCC HDEEEBB CCBFDEH HCHCCCC BCCCDGH EEFDAGD CBCFCEH BCCDDDH ADCDFGG EHGEDBA
236,EGGFEBA DDCCCCH FAADFGG HHBBCCC HGFDCBA AAEFGGG HGGBBBB HDACFEE FFEEDFA BBBCDHH ABCDFGH ABCDEGH EEEFFFA ABDEFGH ABEEFGG
237,CCCCCFH HHFECBA GGGDBBB ABEFGGG GGFFDBA GBACFGG CAGGCGD AECCGHE FFHDCBB EDEEBDH GGGCBBB DCBCCFH ABCEFGH ABDEFGH BCEEGFC
238,EGGFEBA HGEEECA ABEFFFG FGHEBBB HGFDBBA AADFGGG FEACFGC BCFFFED HGFBBDA CCBCCHH ABCDFGH ABCDEGH ABCEFGH ABDEFGH ABEEFGG
239,DGGFECA GGEEECA ACEFFFG FGHEBBB HGFDBBA AABFGGG BBBEGGG GGFFEAA GBBBFGF CCBCCHH ABCDFGH ABCDEGH ABCDFGH FFFFFCA ABDFEFH
240,GFFFDDA HGEDCBA GABDEFF AACFGGG GGGFEBA HGDCBBB HHDCBCB FGFFFAA FFGGFAA BBCDCHH ABDFFGH BBCCDFH AEEEFFF ABCEFGH ABCEFGH
241,EGGFEBA DDCCCCH FAADFGG HEBCDDD HGFDCBA AEDEFFF HFGABDD HHEECBA FFEEGAC DCCCAHH ABCDFGH ABCDEGH FFFGFAA ABDEFGH ABEEFGG
242,GGGFEBA GFEEDEA HHCACDE ADEEFGG DDDDCBH HHFCBBB ECFCAHE AFDCGFE GBFBGDD CFCEBGF BBBEDGH DEBDFDG ACFFFFF AACEGGG FHGEDBA
243,DGGFEBA HGEEECA FAADFGG HHBBCCC HGFDCBA AEDEFFF FFACFEF GEGHCBB EDCCBDH DCACCHH BBCDEHH ABCDEGH FFFGFAA ABDEFGH ABEEFGG
244,EGGFEBA EDCCCBH HGDCBBB EAADFGG EDCCBDH CBADGGG HGFDBBA HGEDDBA HEFEBAF BBBCFGH ADEDEGG ABDDFFH HCCCDDD ABDEFGH FGGFCBA
245,HFEDDBA ABEGGFF DABFFGG GHGBBBB AACFGGG HDABEEE CCCAEGH GHBBCDE EAEFFEE CCECBGH AACDFHH BBBDEGH ABCEFGH HCCCDDD ABEFFGG
246,GFFFDBA GFDCBBG HHCABCD ABEFFGG CCCCCGG GHGDABB HGCECCA BBFBGFG HFEBCCC BADFEDH CBCCDHH DBBCDGH ABCDFGH AACEGGG EHGEDBA
247,EGGFEBA DCCCCFH FAADFGG HDBCDDD CCCBCHH EBADGGG HFCCCBD FFDDDGA ECFFECC DCCEAGH ABCDEGH ABDDEGH HCCCDDE ABDEFGH ABEFFGG
248,GGGFDBA HGEDCBA DDHCCCC ABCDEHH GGFFDBA DDCGHBB BBBFFGG AEGGFAF EEFFFFA CCBCGGG ABCDEHH CDBCDFH ABCEFGH BBCCDFH HDDDCCB
249,EGGFEBA GGEEECA AAEFGGG EEGGGAA HGFDBBA BBBDGGG EAAFGFG FHCCBBF GHDDCBB BBBDDHH ABCDFHH ABCDEGH ABCDFGH FFFFFCA ACFDEFG
250,GGGGCBA HGEDCBA HBACEFG ABCEGGG FGGFEBA HHECBBB HGFDBCC CFABDFH CHHEBBB BFBBCHG BBCDEGH ABDEEGH ABCEFGH ACFFFFF HGFECBA
251,EGGFEBA HGEDDCA ABEFFFF GGHEBBB HGFDCBA AACFGGG ABDEFGH ABCEGGH ABCEFGH ABCDEHH BCEFGGA HCBBCDG ABCEFGH HFCCCCC ABEFFGG
252,EGGFEBA CCBBCHH DACFGGG AADEGGG DDCCBEH EBACGGG ABCEFGH AACFGFG EBADGGF GFDCEGA HFCBBCD ABCDEGH HEBCCDD ABDEFGH BFHGDBB
253,GGFFDBA HGEDCBA GABDEFG AACFGGG FGGFEBA HHECBBB HFFDBCC GGCCCDD EFFFFCA CCCDEHE BBCDEGH BCBCDFH BBCCDHH BDEHGDA HGFECBA
254,HGEDCBA ABFGGFF DABFFGG FGGGCAA BBBCFHH HDABDEE BBEGHCB BFEDFDC ADDDGDG ABCDDGH ABCDEHH BBBCEGH ABCEFGH HCCCDDD ABEFFGG
255,EGGFEBA EDCCCCH HGDCCBB ABDFGGG CCCBCHH DBADGGG HGDBBCC GEGFEBA ADCDDGH CCCCCFH HGDABDD EEFFFFA ABCEFGH ABDEFGH ABEFFGG
256,EGGFEBA CBBBGHG HGDCDDA ABDFGGG DCCBBGH CBADGGG HDBCDFC DCEFCBH FABEGGD BCCBDGH ABFFFGG ABCDDGH HHCBCCC ABDEFGH ABEFFGG
257,EGGFEBA EDCCCCH FABDFGG HEBCDDD HGFDCBA ADDEFFF HFEEABD DCFFFEB HGCBFDA BBEDBHH ABCDEGH ABCDFGH HHGBBBB ABDEFGH ABEFFGG
258,EGGFEBA HGEDDCA ADEFFFF FGHEBBB HGFDCBA AAEFGGG HEBBBDG CEHFBDB GGCFFCA BCBDDHG ABCDEGH ABCDEGH GGGGBAA ABDEFGH ABEFFGG
259,EGGFEBA EECCCBH HGDCBBB GBACFFF EEDCCBH CBADGGG HGECDCA HGFDBBA HGBABEF ABDDFGG ABEGFFG ABCDFFH GGGDBBB ABCEFGH ABDEFGH
260,HFEDDBA ABEGGFF DACFFGG HGBCCCC ABEGGFF HCACFFF EADFGGC CDCEGBG CDEGFAF BBCCDHH AACDFGH FFFFFDA ABCEFGH ABDEFGH ABEFFGG
261,GGFEDBA ABFGGFF DABFFGG FGGGBAA BBBDGHH HEABEEE BBBBGHG BFCGBDG CADDEHE BBBCFHH ABCDEHH ABCDEGH ABCEFGH HHCBCCC ABEEFGG
262,HEEEDCA CCBBCHH GFFGFAA ABDFGGG AFFFFDC DBADGGG HGFCBBB CBEEHEC HFEDDAC FCBBCFH FFGGEAA ECBCCFH ABCEFGH ABDEFGH BCEEGFC
263,EGGFEBA HGEDECA BBBHGFF BDFGHBB HGFDCBA BBBCFHH CGGGEBA HFFECBA HGFDDBA GECBBCH ABCDEGH ACEFFFG ABCDFGH HHDBBBC ABEEFGG
264,EGGFEBA HGEEECA AEEEFFF GHGBBBB HGFDCBA ABEFGGG GCCCCCG GGEEEDA AGGFECC CECCCHE ABCDFGH ABCDEGH EEEFFFA ABDEGGG GGGECBA
265,EGGFEBA CCCCCFH DACFFGG HBCDDEE HGFDCBA CBADGGG ABCDEGH BCBCEGH BBBCGGH ECBCBGH HHECBBB ABCDEFH HHGBBBC ABDEFGH ABDEFGH
266,GGGEDCA HGFEDCA BCBCEGH ABDEFGG FFFFFBA HHGDBBB CFAFEEE HHDDDCA ACEFFGG EFBBBFH ABDFFGG CBBDEFH AEEEFFF AACEGGG FHGECBA
267,HGFDDBA ABEGGFF DACFFGG HFCCCCC ABEGGFE GCACFGF DABFFGH HGFDDBA BBGGCGC BCEEBHF ABCDEHH GGGGBAA ABCEFGH ABCEFGH ABCEFGH
268,EGGFEBA HGEEECA ADHGEDD CEHFBCC HGFDBBA ABDFGGG HGFDCBA HGFDCBA HFDEEBA ACEDDGH BBCCEGH ACDDDGH ABCDFGH HCCCDDD ABDEFGH
269,HGFEDBA ABEGGFF DACFFGG HHCBCCC ABDGGGF HCABFFF CBCFGGC GBHCCED GGGDDBA CBBDDGH ABCDFGH EEFFFFA ABCEFGH ABDEFGH ABEFFGG
270,EGGFEBA FFDCCBH DACFFGG HHBBCCC FEDCBBH CBADGGG ABCDFGH ABCEFGH ABBFFFH DCEGBGC HGCBBCC ABCDDGH HBCCDDE ABDEFGH ABEFFGG
271,EGGFEBA DCCCCFH FAADFGG HDBCDDD HGFDCBA AEDEFFF HBDBEEE GHBBDDC HGFECBA GBBBBGG ABCDFGH ABCDEGH FFFGFAA ABDEFGH ABEEFGG
272,HFEDDBA ABEGGFF DACFFGG HBCDDDD ABFGGFD HCACFFF AACEGGH HFBBEFD BFHEBDC ACEFBHG ABDDFHH EEEFFFA ABCEFGH ABDEFGH ABEFFGG
273,EGGFEBA EDCCCCH HGDCBBB DGABEFF HGFDBBA ACDEGGG HGFECBA HGFDCBA HEBEEBC GFDCAEG BBCCEGH ABDEEFH ABCDFGH ABDEFGH ABEEFGG
274,EGGFEBA HGEDDCA ADHGEDD CEHFBCC HGFDCBA AACFGGG EGGGCAA HGFDCAA HGBDEBB CCBCCHH BBCCEHH HFCBBCF EEEFFFA ABDEFGH FGGFCBA
275,GFFFDBA FEDDCGC HHCABDE ABEFFGG GGGFEBA HEDCCCC BDEBDFH GCBGCGC DHDEFBB BBFBCGH DDBCEFF CFCCDDH BBBBGHH AACEGGG EHGEDBA
276,DGGFECA GGEEECA FAADEGG HHBBCCC HGFDBBA ADDEFFF HFGAAEE CGFFEBB BGGFAED CCBCCHH ABCDFGH ABCDEGH ABCDFGH HHCBCCC ABEEFGG
277,EGGFEBA HGEDDCA AEEFFFF GHGBBBB HGFDCBA ACEFGGG HFCCCBC HHEECBA GFGCFBB CCBCDHH ABCDFGH ABCDEGH GGGGBAA ABDEFGH ABEFFGG
278,BGGFECA HHEACCC BAAFGGG DEFGHBA HGFDCBA GHGDBBB DBBCDFH EFABDGH EFFDCAF FFFEDDB ABFFFFF ABCDEGH ABCDFGH AACEGGG DGFECBE
279,EGGFEBA DDCCCCH EADGFEE HHBBCCC EEDCCBH EBACGGG ABCDFHH ABCDFGH ABEEGGG DCEFCHB HFBBCDD ABCDEGH HBCCDDE ABDEFGH ABEFFGG
280,HGFDDBA ABEGGFF DACFFGG HFCCCCC AFGGFDA HCABEFF DABFGEG GGBFBCF GHBBECF CBCCDGH ABCEFGH BBCDEGH HHCBBCC ABDEFGH ABEFFGG
281,EGGFEBA EDCCCCH FABDFGG HDBCDDD EDDCCBH EBADGGG HGECBCC AAFFEGF GHEBCCA DDBCBGH ABCDFHH ABCDEGH HFBCCCD ABDEFGH ABEFFGG
282,CGGGECA HGFEEBA DCBBCGH ABCEFGH HEDCCCB GHGDBBB ABDFGHE CEBCCFH ABCEGGG EEEEFFB AEFEEFF ABCDEGH ABCDFGH AACEGGG DGFECBE
283,EGGFEBA HGEEECA ADEFFFF GHGBBBB HGFDBBA AAEFGGG ABCEFGH ABDEFGH ACDBDGH BBBDDHH ABCEFHG HGFCBBC ABCEFGH GGGEBBB ABEEFGG
284,EGGFEBA HGEDDCA ADEFFFF FGHEBBB HGFDCBA AAEFGGG EECDFFB BDDFCHD FEEHEBB CBBDEHG ABCDFGH ABCDEGH AACEFGH ABDEFGG GGGECBA
285,EGGFEBA HGEDDCA ABGGFEE BDGHDBB HGFDCBA AACFGGG HHFDCBA HFGEDBA HGFEBAB CDACDHH ABCDEHH ACEEDEH ABCDFGH ABDEFGH FGHFCBA
286,HFEFEBA HGEDCBA GABDEFG AACEGGG FGGFEBA HHECBBB HGFCDCA HDBCCDE GGGEBBB BCCCDGH BBBDEGH ACDEEGH ABCEFGH AEEFFFF FHGECBA
287,EGGFEBA DCCCCFH DACFFGG HEBCDDD DDCCBEH FBACGGG ABDEFGH ABCDFGH BGFDDEB FFFFEEA CABCEGH EEFFFFA ABCEFGH ABDEFGH ABEFFGG
288,GGGFDBA HGEDCBA EHECCCC ABCCGHH GGFFDBA EEEHGAA ABCEFGH GGBEEAD GCEAEFF BCBCDGH ABCEFGH CCCCCFH ABCDFGH AEEFFFF CHGFDBA
289,EGGFEBA HGEEECA ADHGEDD CEHFBCC HGFDBBA AACFGGG FGGFDAA HGDCCDA HGGDBBA AACEFGH ABCDEGH ABFFEFH ABCDFGH HFCCCCC FGGFCBA
290,EGGFEBA GGEEECA AEEEFFF GHGBBBB HGFDBBA CBADGGG DAEFFFF HEDDCCB AAGGGFE CEBBBHH ABCDFHH ABCDEGH ABCDFGH HHGBBBB ABEEFGG
291,HEEEDCA BBAFGGG HGGCBBB BBCDEFH FGGFEBA DBADGGG CGFGCBC DBAFEHG HDCHCCB EDDDCDH HGCCCCC BBCCDGH ABCEFGH ABCEFGH ABCEFGH
292,EGGFEBA HGEDDCA DACFFGG HHCBCCC HGFDCBA BBBEGGG ABCEFGH ABCEFGH ABCEFGH ABCDEHH BCEFGGA HCBBCEG ABCEFGH ABDEFGH ABEFFGG
293,HGFDDBA ABFGGFF DACFFGG HFCCCCC ABEGGFE HCABFFF GDBADGH CCHDCDG CGFGFAB BBDCEGH ABCEFHH BBBCEGH HFBCCCD ABDEFGH ABEFFGG
294,EGGFEBA DCCCCEH HGDCBCC GBACFGG DDCCBEH CBADGGG HGEDCBA HGFEDAA BCHGCCD ABCFEGH ABFFFFF ABCEEGH HHCBBCC ABDEFGH ABEFFGG
295,EGGFEBA HGEEECA ABEFFFG FGHEBBB HGFDCBA ACEFGGG GGFFBAA BCFFFED BFFEEFB BBDBEGH ABCDFGH ABCDFGH FFFFFCA ABDEFGH ABEEFGG
296,GFFFDBA HGEDCBA HGCCCCC AACFGGG GGFFEBA FHECCCC AFECFCG CADEHEE HCCCCCD CHDCCEF BCCCDFH BBBEGEH ABCEFGH AABGGGG EHGEDBA
297,DGGFECA HGEEECA DABDFGH GHGBBBB HGFDBBA ACEFFGG GBBCCGG EGGFBBB DDBGBFF CCBCCHH ABCDFHH ABCDEGH ABCDFGH HCCCDDD ABEEFGG
298,GGFFDBA HGEDCBA ABCDFGH AADEFGG FGGFEBA GGGFBBB HGFCDAA EFDEEFA ACEFFGG EEECACH ABDCDGH ABDEEGH ABCEFGH AEEFFFF ABCEFGH
299,EGGFEBA HGEDDCA ABEFFFF GGHEBBB HGFDCBA AACFGGG AACEFGH ABCDEGH AACEGGH ABCDDHH ABDEGHD HECBBCE ABCEFGH HFCCCCC ABEFFGG
300,GFFGECA HGFEEBA DCABEGH ABDEFGG GGGFEBA HGFDBBB DACEGHC CFABDFH HEDFCCC BBEFCFH AACFGGG BBCCDFH AAFFFGG AACEGGG FHGEDBA
301,EGGFEBA HGEDDCA ADEFFFF GHGBBBB HGFDCBA BBBEGGG ABCEFGH BABEFGH ACDDEFH BBBDDHH CCEGGFA HDBBCDG ABCEFGH HCCCDDD ABEFFGG
302,GHFEDBA HGEDCBA GHDBCCC ABBEGGG GGGFEBA DDDGHBB BFBDGDG DAEFFFF HCCCDDD BCBCDGH ABFHHCD EAFFBDH ABCDFGH ACFFFFF DHGEDBA
303,EGGFEBA HGEEECA ABGHFEE BDGHDBB HGFDBBA AADFGGG GGGECBA HFEEFBA GEEFFBA CCCBBGH ABCDEGH AHGECCE ABCDFGH HHCBCCC ABEEFGG
304,GFFGDCA HGFEEBA DCABEGH ABDEFGG FFFFFCA HHGDBBB CBBHEEE HEDEAFB EFFFAGB DDCBBFH AADEFGH DDBCBEH ABCDFGH AACEGGG FHGEDBA
305,GGGFDBA HGEDCBA HGCBCCC AACFGGG GGGFEBA EHFCCBB BDEBEEH HFGCCBB ACEFFGG ABDCFGH BCDBGFH DDBCCGH BBCCDHH AACEGGG EHGEDBA
306,EGGFEBA DCCCCFH HGDBBCC EABDFGG DDCCBEH CBADGGG HHFECBA HGEDEDA GGFCABF CBCCDGH ABBEGHG ABCDEGH HHCBBCC ABDEFGH ABEFFGG
307,HGEDCBA ABEGGFF DACFFGG HFCCCCC ABEGGFF HCABEFF AABFGGG GGABDFF CGDGCDC EEDABGH AACEFHH BBCDEGH GGGGBAA ABDEFGH ABEFFGG
308,EGGFEBA DCCCCEH HGDBBCC CACEGGG EEDCCBH CBADGGG HGFDCBA BGGBBFD HGFCBBB BBCDEHH AAEGGGF BBCDEGH HHGBBBB ABDEFGH ABEFFGG
309,EGGFEBA HGEDDCA ABEFFFF GGHEBBB HGFDCBA AACFGGG ABCEGGH ABDFFGH ABCDFGH ABDDDHH BCEFGGA HFCBBCE ABCDFGH HCCCCDD ABEFFGG
310,GGFEDBA ABEGGFF DABFFGG GGGEBBB BABEGGG HDABEEE EDBCEGG HEBGCEB ADEBFHF ECCBBFH ABCDFGH BBCDDGH ABCEFGH HCCCDDD ABEFFGG
311,EGGFEBA HGEEECA ABEFFFF GGHEBBB HGFDBBA ABEFGGG ABCDFHH ABCDGGG ACEEEFH ABBDEHH ABCEFHG HGFDBBB ABCEFGH GGGGBAA ABCEFGH
312,EGGFEBA EECCCBH HGDBBCC CACEGGG DDCCBEH CBADGGG HGEDCBB HGECBBD BGFEFDB BCCCCFH ADDCEGH FFFFFCA ABCEFGH ABDEFGH ABEFFGG
313,EGGFEBA GGEEECA FAADEGG HHBBCCC HGFDBBA ACEFFGG DDDBFFF HECBDDD HGFECAA EDEDAFG ABCDFGH ABCDEGH ABCDFGH GGGEBBB ABEEFGG
314,GFFFECA HGEDCBA DHECCCC ABCDGHH GGGFDBA DDDGHBB ABCHEGD DGGGFAB EEFFFBC BCBCCGH AACEFHG CCACEGH ABCDFGH ACFFFFF AGGFECB
315,EGGFEBA EEDCCBH HGDCBBB GCACEFF FEDCCBH BBADGGG HGDCCBB HGDCCCB ACDCGFG CCBBCGH GBBBCFH EFFFFFA ABCEFGH ABDEFGH FGGFCBA
316,GGGFDBA DDCCCGF HHCABDE ABEFFGG FFEECAG HGGDBBB GGCEGCA CBCFEFG EDFBFDE HDFEBEB ABFDDGH BCCCCGH AEEEFFF ABCEGGG DHGEDBA
317,HGGECAA HDCDDCB AADFFGG ABCEFGG HFEDCBB GHGDBBB BDEDDGF CFABDFH GDCEFBF ACDEEGH AACEEHH ACCEFGH ABCDFGH AACEGGG FHGEDBA
318,EGGFEBA BBBBGHG FAADFGG ABDFGGG DCCCBEH EBADGGG HHADDCC HFFGBAC HGFECBA CCBCCHH ABCDFGH ABCDEGH HHCBCCC ABDEFGH ABEEFGG
319,EGGFEBA HGEDDCA AAEFGGG FFGGBAA HGFDCBA ABBFGGG ABCEFGH ABCEFGH ABCDFGH ABDDEGH FGGGDAA BBCCDGH GGGEBBB ABDEFGH ABEFFGG
320,FGGEEBA HGEDCBA DDHDCCC ABCDEHH GGFFDBA DDDHGBB BECGFED DDEBDCH BCCCHFE EEABFFG BCDCFHE BDCBCGH ABCEFGH ACFFFFF BHGFDCA
321,EGGFEBA CCCCCFH DACFGGF HEBCDDD HGFDCBA ADDEFFF ABCEGGH ABCEFGH ACDDEGH CBCDCHH GGGFCAA BBCDEGH GGGGBAB ABDEFGH ABEFFGG
322,HEEEDCA CCBBGHF HGFFBAB BBCDEFH GGGFEBA DBADGGG CBBCFHH BDEDBEH GHCBCED DEDEFFB HHFBBBB EDCBBEH ABCEFGH ABDEFGG GGFEDBA
323,FGHECBA EDDCCBH HHCABDE ABEFFGG DDDDCCH HEECBCC BGEEECF HFCCCCC DHGECBB EAFGFDD EABFGGF DDDDAFH BBBEGGG AACEGGG EHGEDBA
324,HGFDDBA ABFGGFF DABFFGG FGGGCAA BBBCFHH HEABDDD BBBEGHG DFBGECD EEDADGG GCBBBGH ABDDEHH BBCDEGH ABCEFGH FFFGFAA ABEEFGG
325,GFGFDCA HGEEDDA BBBDFGH ABDEFGG FGGFEBA HFECBBB GEDFGBA HFBBCCD HFCCCCC BCCCDGH BBBDFHH CCCCCGH BBBEGGG AACEGGG FHGEDBA
326,GGGFDBA FFEEHBA EFCBCCH ABCDGGG GGGFDBA HECCCCC ABCEFHG HDCCCDD DDACGGG BCBCDGH DDFDCEF CBBCEGH BBBCGHH AACEGGG DHGEDBA
327,EGGFEBA HGEDDCA ABEFFFF GGHEBBB HGFDCBA ABDFGGG ABCEFGH ABCDFGH ABCDFHH BCCCCGH BBEFGHB HDBBCDF EEEFFFA ABDEFGH ABEFFGG
328,GFFFDBA HGEDCBB HHCABCD ABEFFGG GGGFEBA HGDCCCC HEDEBCC BCEEDEG FCEFAGD GBACGGD ACCDGGF BDCDBGH ACFFFFF AACEGGG FHGEDBA
329,EGGFEBA HGEEECA ADEFFFF GHGBBBB HGFDBBA AACFGGG ABCEFGH ABCDFGH ABDFGGF BBBEEHH ABCDFHH HHEDCBB ABCEFGH FFFGFAA ABEEFGG
330,EGGFEBA EDCCCCH HGDCBBB FBADFGG DDCCBEH CBADGGG HHECCBA HGFBBCB GGDADFD DCCBCGH ADFEEFG ABCDFGH DABDFGH ABDEFGH ABEFFGG
331,GGFEDBA ABEGGFF DACFFGG HFBCCCC AFGGFDB HCACFFF BCBDGHE DEDFHCC FFAFFEE DCCCBGH ABCDFHH EEEFFFA ABCEFGH ABDEFGH ABEFFGG
332,HGEDCBA ABEGGFF DABFFGG HHCBCCC ABDFGGF HDABEEE CAAEGGG GCBBBGH FFBFFFA CCBCCGH ABCDFGH BBCDDFH ABCEFGH HCCCDDD ABEFFGG
333,GGGEDBA ABFGGFF DABFFGG GHGBBBB AACFGGG HDABEFF FAFGFDC CFGFAEE BEFCCGF CCBCDHH ABCDEHH BBCDEFH GGGEBBB ABDEFGH ABEFFGG
334,HFFGDBA HGEEDCA CCACEGH ABDEFGG FGGFEBA HGFDBBB HFEFBBB HGDBDCA ACEFFGG BCCCDGH BBCCDGH AADEFGH ABCEFGH ACFFFFF ABCEFGH
335,EGGFEBA HGEEECA ABEFFFG FFGHBAA HGFDBBA AADFGGG EFDDEEB HFGCCBB EDCCBEH CCBCCHH ABCDFGH ABCDEGH ABCEFGH HFCCCCC ABEEFGG
336,EGGFEBA DDCCCCH FAADEGG HEBCDDD DCCCBEH EBADGGG HFDDDBC HHEDCBA HGFECAA CCBCCHH ABDDEGH ABCDEGH ABCDFGH HCCCDDD ABEEFGG
337,EGGFEBA DDCCCCH DACFFGG HFBCCDD EEDCCBH EBACGGG ABCEFGH ABDEFGH ABCDFGH DFBBCHH HHGEBAA ABCDEGH GGGDBBB ABDEFGH ABEFFGG
338,EGGFEBA HGEDECA AEEFFFF GHGBBBB HGFDCBA ABEFGGG GBAFFEF GGGFBAC HGFECBA FFBBBGH ABCDFGH ABCDEGH FFFGFAA ABDEFGH ABEFFGG
339,EGGFEBA DCCCCEH HGDBBCC EAADFGG FEDCBBH ABBEGGG HGFECBA HFEDCBB FDCABGH BBBDEFH AAEFGGG ABCCDGH HHGBBBB ABDEFGH ABEFFGG
340,EGGFEBA DDCCCEH HGDCBBC FBADFGG FEDCCBH BBADGGG HGFDCBA HGDCCBB HEDBAEG BBCCDFH ABEDFGH FFFFFCA ABCEFGH ABDEFGH ABEFFGG
341,DGGFEBA HGEEECA ABEFFFG FFGHBAA HGFDCBA ABEFGGG FFBFBEF GHDDCCB GFFEEDA CCBCCHH ABCDFGH ABCDEGH FFFFFCA ABDEFGH ABEEFGG
342,GGGEEBA ABEGGFF DABFFGG GHGBBBB AACFGGG HDABEFF ACGFFFD DEBBCFH GHGBBBB BBDBCGH ABCDDHH BBCDEFH GGGFBAB ABDEFGH ABEFFGG
343,HGFDDBA ABEGGFF DABFFGG GHGBBBB AACFGGG HDABEEE DBADGGG FFDDACG AFFFFFA BBBBEGH ABCDEHH BBCDEFH DEEFFGA AACEFGH ABEFFGG
344,HGEDDBA ABEFGFF DACFFGG HGCCCCC ABEGGFF HCACFFF CCBHEEE ACBFGGG EFFFEEA ACDEBGH ABCEFGH BBCDDFH HHGBBBB ABDEFGH ABEFFGG
345,EGGFEBA CBBBGHG FEFFFCA ABDFGGG CBBBGHG DBADGGG HDBDCCE BEHDCED DCBAGGG FFBADGG ABCDFGH HHCBBCC ABCEFGH ABDEFGH ABEFFGG
346,GGGFDBA HGEDCBA DHECCCC ABCDGHH GGFFDBA DDFHCCC ADBDGGG CAEFFFF ADFFBFF DBBBGEH BACDEHH CDBCCFH ABCEFGH ABDEGGG AGGFECB
347,EGGFEBA HGEDDCA FAADFGG HHBBCCC HGFDCBA EBADGGG HDDDDCC HGBDDCC HEBECDD DDABDGH ABCDFGH ABCDEGH HHGBBBB ABDEFGH ABEFFGG
348,DCCCCFH GHFECBA GGGDBBB ABDFGGG GGGFDBA FBACFGG ABGHFDE FCBAFGG DAAFGFF DDBBCGH HHGCBBB DCBCCFH ABCEFGH ABDEFGH ACEEGFC
349,GFEFEBA HGEDCBA HFABDEF ABCDGHH FGGFEBA GGFGDAA HGDEBBB HGECCCB HGEEEAA DDCBEGH BBBCEHH BBCDDFH BBBBGHH AACEGGG FHGEDBA
350,GGGEEBA HGEEDDA BBBDFGH ABDEFGG FGGFEBA HGFDBBB CEFBCEH CFABDFH HGEEEAA ADEDFDH ABEFFGG CCCCCGH AEEFFFF HGFEDBA HGFECBA
351,EGGFEBA CCBBDHH HGDBBCC ABDFGGG CBBBEHH DBADGGG HGEDCBA ECADFHF HFECADD ABCDEHH AAEFFGG BBCCDFH GGGDBBB ABDEFGH FGGFCBA
352,GGGFDBA DDFHCCC FEBABGH ABDEGGG EEDDHBB HGFCBBB CDBCEHE EGABDFG ACEFFFF CCCDEEH BADEEFH ABBEEGH AAEFFGG ABCEGGH AGGFECB
353,GEFGDCA HGEDCBA HFABDEF ABCDGHH FGGFEBA HGGCBBB HGEECCA GGFGBAB FGGGDAA ABGGCEG ABCDEHH CCCCCFH ABDEFGG CCCDDDH EAGGFEC
354,GFGGCBA HGEEDCA BBBDFGH ABDEFGG FGGFEBA HFECBBB CACDFGG FBCEGFC ACEFFGG BCCCDGH BBBCFHH CBBCEGH BBBBGHH GGGFDBA HGFECBA
355,EGGFEBA DCCCCFH HGDBBCC CACEGGG DCCBBGH DBADGGG HGEDCBA HGCCGCA HEEGDAB BBCDCGH ABBDFGH DBBDDEH ABCDFGH HCCCDDD ABEEFGG
356,EGGFEBA HGEDDCA FAADFGG HHBBCCC HGFDCBA AEDEFFF HDCECBE EBDHGCB EDHGDBB BBDCDHH ABCDEGH ABCDEGH GGGDBBB ABDEFGH ABEFFGG
357,HGEDDBA ABEGGFF DABFFGG GGGEBBB BABEGGG HDABEFE AAEGEGG DHGBCCC EFDAFEE CEBBBGH ABCDFHH BBCDEGH FFFGGBA ABDEFGH ABEFFGG
358,FHGDBBB EEDCCGD HHCACCD ABEFFGG GGGFDAA FHDCCCC EBGECCG BEGGGBB HCCCDGC BCBCDGH CCEEEBH DEBBCEH ABCEFGH AEEFFFF ABCEFGH
359,EGGFEBA CCCCCFH DABFFGG HBCDDEE EEDCCBH EBACGGG ABCDFGH ABCEFGH ABCDFGH ABCCDHH EFGGFBA HFBBBDF ABCEFGH HFCCCCC ABEEFGG
360,GGGEDBA ABEGGFF DABFFGG HHFBBBB AADFGGG HDABEEE DDFHCCC HGBBCCC FGGGBDA BCBECHH AACDFHH BBCCDFH ABCEFGH HHFBBBB ABEEFGG
361,GGGFDBA DDDCCGF HHCABCE ABEFFGG FFFEEEA HHGCBBB CBDGCDH BBGHDFC FBDHFAD FBCFBFE CBDDCGH CCCCCDH ABCDFGH AACEGGG EHGEDBA
362,EGGFEBA EECCCBH DACFFGG HFBCCDD HGFDCBA BBADGGH ABCEEHH AADEFGH BBAEFHH GGFFBBA HGFCBBB BBCDDFH HHGBBBB ABDEFGH ABEFFGG
363,GFFFDBA FFEDEFA HHCABDD ABCEFGG DDDDCBH HHFCBBB EBCBDFH AEGEEFD BEEAEGG FGDACGD AAEEFGG BBCDDFH AEEEFFF AACEGGG FHGEDBA
364,HGFFCBA HGEEDCA BCBCFGH ABDEFGG FGGFEBA HFECBBB DFGFDCA HEDDDEA DEFADFF BCCCDGH AACEGGG CCCCCFH AAFFFGG AACEGGG FHGEDBA
365,EGGFEBA CCCCCFH DACFFGG HBCDDEE DDCCBEH EBACGGG ABCDGGH ABBDEHH BDCEHGC EFEEEFA HFCBBCD BBCDEGH HEBCCDD ABDEFGH BFHGDBB
366,HGFDDBA ABFGGFF DABFFGG FGGGCAA BBBCFHH HDABEFE BBHEGFB GCGDBBF CDDDDCH BBEBCHH ABCEEGH BBCCEGH EEFFGEA ABDEFGH ABEFFGG
367,HEEEDCA DCCCCDH EDFFFEA AADEGGG ACGGFFE EBADGGG HGGCBBB FFCCADH GCDFGCA CCCCCHG FFFFFBA BCDCDFH ABCEFGH ABDEFGH ACEEGFC
368,GFFFDBA EDCCCCH HGCBCCD AAEFGGG GGGFDBA HEDCCCC BBBCGHH FFDADFF ACEFFFG EEEEAFG EAFEDEF GBBBCEH AABGGGG AACEGGG EHGEDBA
369,HEEEDBB CBBCHGE HGFEABB ABDFGGG DGGFEBA DBADGGG ABCCGHH CACGGDF FDDFGDA DCDEEHC GGGFBBB BCCCDFH ABCEFGH ABDEFGH BCEEGFC
370,EGGFEBA DCCCCFH FAADFGG HDBCDDD DCCCBFH EBADGGG HGCABDF AEFCFFE FEDDHBB DBDCBHH ABCDFHH ABCDEGH HHGBBBB ABDEFGH ABEEFGG
371,CFFFDCC HHCCCCB ADEFFFG CCDGHBC HFFDCBA HHGDBBB CAEGEDG ACFHCFD ADEGGCC DDDDCDH AEFFFFF ABCDEGH ABCDFGH AACEGGG DGFECBE
372,HEEEECA HGEDCBA HHCABCD ABBEGGG FGGFEBA DBADGGG HFDCCBB ACDGGED HGFDDAA EEEEFFA ABDEEGG CCCCCFH ABCEFGH ABDEFGH BCEEGFC
373,GGGEDBA ABEGGFF DACFFGG HHCBCCC ABDGGGF HDABEFE EAEGHCC DCGHGBA AFEGGCC BCCCBHH BBBEFHH BBCDEGH GGGGBAA ABDEFGH ABEFFGG
374,HEEEEDA GGFEDCA GHDABDE ABDEFGG FGGFEBA DBADGGG EDDDDHB HGFECBA EEEEEFA FFFFFBA ACDEEGG CCCCCFH ABCEFGH ABDEFGH BCEEGFC
375,EGGFEBA DDCCCCH FAADFGG HEBCDDD HGFDBBA AEDEFFF FBACGFG EECCHBG ECFFECC CCBCCHH ABCDFGH ABCDEGH ABCDFGH BACEFGH ABEEFGG
376,EGGFEBA HGEDDCA ABEFFFF GGHEBBB HGFDCBA AADFGGG ABCDFGH ABCEFGH ABCDFGH BBCDEHH FFGGEBA BBCDDGH FFFFFCA ABDEFGH ABEFFGG
377,CCCCCFH HGEDCBA GGGEBBB ABEFFGG GGFFDBA FBACGGG CADFFHD BEFFBGC FGGFADB FFFFFBA ABDEEGH CCCCCFH ABCEFGH ABDEFGH ACEEGFC
378,GGFEDBA ABFGGFF DABFFGG GGGEBBB BABEGHG HDABEFF FAFECEE FFBCFCG FFHEBBB BBBCEHH ABCDFHH BBCDEGH GGGEBBB ABDEFGH ABEFFGG
379,EGGFEBA HGEEECA AAEFGGG FFGGBAA HGFDCBA AACFGGG ABCEEGH ABDDFGH ABCDFGH ABCEFHH ABDFGHC HEBBBCF ABCEFGH HFCCCCC ABEFFGG
380,EGGFEBA HGEDDCA ADEFFFF GHGBBBB HGFDCBA ABEFGGG HEBBBCG EEEGBBF HHBDCCC BBDCEHG ABCDFGH ABCDEGH HCCCDDE ABDEFGH ABEFFGG
381,BBBDFHH HGEDCBA DABFFGG HBCCDDG ADGGFEC HEBBDDD EABEFDH GGBCCGC EBFFFFA DBCCDFH ABCDFGH BBBDDGH CCEFGGA ABCEFGH ABEEFGG
382,GFFFDCA HGEDCBA ABCEFGH AADEGGG FGGFEBA HFECCBB CFBFCFE CFABDFH HFCCCCC DDABDGH BBBCEHH BBCDDFH BBCCDHH ABCEGGG FHGEDBA
383,FFGGEBA HGEDCBA ABCEFGH AADEFGG FGGFEBA HFECBBB GCFHBCB EFDEFFA FFGGFAA ABEECGH BBBCFHH BCCCEFH BBBBGHH FCGGFCA HGFECBA
384,EGGFEBA HGEEECA FAADFGG HHBBCCC HGFDBBA CBADGGG HFEEBAD FCEEEEB GCCGGDA BCBDDHH ABCDFGH ABCDEGH ABCDFGH BACEFGH ABEEFGG
385,HFEDDBA ABFGFFF CACGFGG EEFGGCA DCBBDGH GCABFGG EABDFGG FGGBBCC AAFGGFF DDBCDFH AACDFHH BBCCDGH ABCEFGH HFCCCCC ABEEFGG
386,EGGFEBA HGEDDCA ABEFFFF GGHEBBB HGFDCBA AADFGGG ABCEFGH ABCEFGH AADFGGG EFEDAGD HGDBBCC BBCDEGH CABDFGH ABDEFGH ABEFFGG
387,EGGFEBA HGEDDCA DACFFGG HHCBCCC HGFDCBA BBADGGG ABCEFGH ABDEGGH ABDEGHG CBBCDHH HGDBBCC ABCDEGH HHCBCCC ABDEFGH ABEFFGG
388,GFGGEBA HGEDCBA ACCDFGH AADEFGG FGGFEBA HHECBBB HFFDCDA GHGDBBB DEFFFBC BCCCDGH BBCCDHH BBCCDFH BCCCCFH ABCDEGH ABCEFGH
389,EGGFEBA HGEDDCA ADEFFFF GHGBBBB HGFDCBA ACEFGGG ABCDFGH ABDEGGH ABCEFGH CCCCBGH HHGDBBA BBCDEGH HHGBBBC ABDEFGH ABEFFGG
390,CCCCDGH HGEDCBA DABFGGG EACDEEH ADGGGEC HEABDED BBCDEHH GHFCEAB DEAEEGF CCBCCGH AACDFHH BBCCEFH ABCEFGH HCCCDDD ABEEFGG
391,EGGFEBA HGEDDCA ADEFFFF GGGEBBB HGFDCBA AADFGGG ABCDFGH ABCEEGH ABCEFGH BBCCDHH GGGEBBA BBCDDGH GGGDBBB ABDEFGH ABEFFGG
392,EGGFEBA HGEDDCA ABEFFFF GGHEBBB HGFDCBA AACFGGG ABCEFGH ABCEFGH ABCEFGH CCEBBHH EEFGGDA ECBBCFH EEEFFFA ABDEFGH ABEFFGG
393,GGGFDBA HGEDCBA DHECCCC ABCDGHH GGFFDAA DDHECCC AAFGFGD AHEDDEE ACEFFFF CCCFGCG ABCDFGH CBCCDFH ABCEFGH ABCEGGG AGGFEDB
394,EGGFEBA HGEDDCA ADHGEDD CEHFBCC HGFDCBA AADFGGG EGHFDAA HFGDBBB FEEFEEA BBBDEHH ABBDFHH FCBBBFH FFFFFCA ABDEFGH ABEFFGG
395,BGGFDBC FEGGBBB BBAEGGG BCCDDHE HEFEDBA HHFCBBB ACFDFEG GFBCDEF ACEFFFF AAFFGGE AAFGGFG HGFDCBA HGFDCBA HGFECBA HGFECBA
396,GFGFDBA GGEEDDA BEBBEGH ABDEFGG FGGFEBA HGFDBBB HFEGBBB GHGDBBB HCCDDDD CCCCCFH ABDEFGH DCCCCDH ABCDFGH AACEGGG FHGEDBA
397,EGGFEBA DDCCCCH DABFFGG HFBCCDD HGFDBBA ADDEFFF ABBDFGH ABCEGGG AAEEGGG BBCDDHH DDFGGDA HGDBBCD ABCEFGH HHGBBBB ABDEFGH
398,EGGFEBA HGEEECA ABEFFFF GGHEBBB HGFDCBA BBBEGGG ABCEFGH ABCDFGH ABCEFGH ABCEEGH AACEFHH HGECBBB ABCEFGH HHGBBBB ABEEFGG
399,FGEFECA FFEEHAA EFCBCCH ABCDFHH DDDDHBB HHGDBBB HHBBCCC FFFFFCA CCDDDGG EEEEDAG ADCFEFG CCCCCFH AEEEFFF AACEGGG EHGEDBA
400,GGFFDBA HGEDCBA HGDABCD ABCDEHH FGGFEBA HHECBBB HGFEDBA GHGDBBB EFFFFCA GHBBBDG ABCDEHG ABCDFGH ABCEFGH BBBBGHH GGGECBA
401,EGGFEBA HGEEECA DABFFGG HHCBCCC HGFDBBA ADDEFFF ABCEFGH ABDEFGH ABDDFGH BBCCDHH DDFGGEA HGCBBCE ABCEFGH HHCBCCC ABEEFGG
402,DCCCCFH HHEDCBA FEFFFEA ABBCGHH GGGFDBA GBACFGG FBBCEGG CHEEFAD AFBFFEE ECBBCHH FFFFFBA BCCCDFH ABCEFGH ABDEFGH BCEEGFC
403,GGFFECA GGEEDDA ADBCEGH ABDEFGG GGGFEBA HGFDBBB ACEGHGB CFABDFH ACEFFGG CCCCCFH ACEFFGG CCCCCGH AEEEFFF AACEGGG FHGEDBA
404,EGGFEBA HGEDDCA AAEFGGG EFGGGAA HGFDCBA BBBCGGH ABCEFGH ABDEFGH ABDEGGG ABCDEGH DEFGGEA HDBBBEH ABCEFGH ABDEFGH ABEFFGG
405,HGEDDBA ABFGGFF DABFFGG FGGGCAA BBBCFHH HDABEFF AADFFGG HGBBCEC AFFFFEE BBBDEGH ABCDFGH BBCCDGH EEFFFEA ABDEFGH ABEFFGG
406,HFFEDBA HGEDCBA ACCDFGH AADEFGG FGGFEBA HGDCBBB HFFDCDA HHBBCCC ACEFFGG BCCCDGH BBBCEHH FDBBBEH BBBBGHH ABCEGGG FHGEDBA
407,HGFDDBA ABEGGFF DABFFGG GHGBBBB AACFGGG HEABDEE BCBEFHG EGGEBBC CHEDDCC BBBCDHH ABCDFHH BBCDEGH ABCEFGH GGGEBBB ABEEFGG
408,EGGFEBA HGEEECA AAEFGGG EEGGGAA HGFDBBA CCCBBHH ADBDFGG DGFFFCA AEDDDHD GBBCEGG ABCDFGH ABCDEGH ABCDFGH HHCBCCC ABEEFGG
409,BBBCFHH HGEDCBA FFFGFAA ABCEGHH FGGFDBA HCACEFF CACFEDH GHCEDBB CBGECEG CBACFGH ABCDEGH GGGGDAA ABCEFGH ABDEFGH ABEFFGG
410,EGGFEBA HGEEECA ABEFFFF GGHEBBB HGFDBBA AACFGGG ABCEFGH ABCEFGH ABBDFGH BBBDEHH ABCDFHH HHGDBBB ABCDFGH FFFGFAA ABEEFGG
411,EGGFEBA DDCCCCH DACFFGG HFBCCDD HGFDCBA BBADGGG ABCDFHH ABFHGEE ACCEGFG FDDBAFH HGDBBCC ABCDDGH HFBCCCD ABDEFGH ABEFFGG
412,FFGFEBA HGECBBB HHCABCE ABEFFGG FGGFEBA HEDCCCC HGEFBBB BBEEEFF CACGFGD HBBBFDF CCAEEHG CDBBEFH BBBEGGG AACEGGG FHGECBA
413,EGGFEBA EDCCCCH HGDCBBB FBACFGG HGFDCBA ABDFGGG GGGECAA HGFEDAA HGECFBA BCCBCHH BBBCEHH GECCBCH FFFFFCA ABDEFGH ABEFFGG
414,DGGFEBA GGEEECA ACEFFFG FGHEBBB HGFDBBA AAEFGGG HFADDDD GHEBBCD GAEFEDC CCBCCGH ABCDFGH ABCDEGH ABCDFGH GGGGBAA DGHGDBA
415,GFFFDBA HGEDCBA HGCBCCC AACFGGG FGFGEBA GGHCBBB GFECFCA DBAEFFG BCBGFCG BCFDFGD BBDDCFH DCBBCFH BBBEGGG FGGFDBA HGFECBA
416,EGGFEBA HGEDDCA ABEFFFG EFGHBAA HGFDCBA AABFGGG GBBBCGG HHEECBA HHCCBBE CCBCCHH ABCDEGH ABCDFGH GGGGBAA ABDEFGH ABEFFGG
417,HGFEDBA ABEGGFF DACFFGG HEBCCCC ACFGGFE HCACEFF GGCBCBG ACCEHFD CADDGFH FDCBBGH ABCDEHH ABDDFHF AACEFGH ABDEGGG HGFECBA
418,EGGFEBA HGEEECA DAADFGH GHGBBBB HGFDBBA ABEFGGG EBCDDFH HBEFEDC HGFECAA BBDDBHH ABCDFHH ABCDEGH ABCDFGH HFCCCCC ABEEFGG
