,0
0,BBBBBBDFFFF DDEEEEEFBAA AABEFEEDDEE AACFEDEDDDD DDCCBBBBCEF AABBDDDEEEF EEEFFDAAABB
1,EEEEEEDCBBA BAABBBDEFFF FFFFDBBBAAA FFDDECBAABB DDBDAABBEEF ABCDEECCCEF ACDDDDDDDEE
2,EEEEEEDBAAA DCAABBBDFFF DDDCCCCFCBB BCDEEBECDBC BBBBCEBDDDF BBDDFEACDBF AABBCDDEEEF
3,EEEEECBBAAE FEDDCCBABCC BBBBAADEFFF FFEDDCBCBAA FDBAABCDDEF ABCCDDEEEEE FCBBBCCCCDD
4,EFEEEDCBBAA BFECCBDEBCC CBBBBABEFFF FFFEDDCBBAA EDECBBAACDF AABDEEEDEEE FFFBBBBBBCC
5,EEEEEEDBAAA EBAABBBDFFF DDDDCCFEBBB DDDBCABDEFD BBBBCDBCFFF BCDBECDCACF AAABBEEEEEF
6,EEEEEEDBBBA AABBBBCEFFF FFFFECBBAAA FFEEDDCBBBA BCCACCDDDEF AABDEEDDDEF AACDDEEEEEE
7,EEEEEEDCBBA BAABBBDEFFF FFFFEDBBAAA EFEECBBBBBC DDEEABEEBAE AAABCDEEEFF AABBBBFFFFF
8,EFEEEDCBBAA BDEEEEEDAAA BBBBAADEFFF AABBDDDEEFF AABBCDCDEFF EEEFFECBAAA DDDEEEEEAAA
9,AABEEFEEDDC FEAAAACEEEF FFFEDCAABBB BAABBDDEEFF DBCCCCCCBDF FFEBBBBBBBB AABBCDEEEFF
10,EEEEECBBAAE FECCCCBACDD BAAABEEEEFF FFEEDCCBAAA FEDBBBCBBBF AACDDDEEEEE FFCBBBCCCCC
11,EEEEEEDBAAA FDBBBBCCDDD EEEDDCCFBAA AABBCBEEEEF BBBBBBFFDCF AABCCDDDDEF AABBBCDFFFF
12,EFEEEDCBBAA AADEEEEEFCA DCCBBBBADFF AABCCDEEEFF AABCCCDDEFF DEEEFFDAAAA EEEEEEFBAAA
13,BBBBBBDFFFF DDEEEEEFBAA AABEEEEDEEE AADEDCECEDC BBBBBBCCDEF AABBCDDEEFF EEEFFDAAABB
14,EEEEEEDCAAA AAACCCDEEFF FEEEDDDCAAA AABCDDEEEEF CAACDDDDDEF AAAEEEEEEEE AAABCDEEFFF
15,DEEDDCCBBAF EEEFFCAABCC BBAAAEEEEFF EBDCBEFCBCA DCBBDFACAEF DEEEEEEEDAA AABBCDEEEFF
16,EFEEEDCBBAA EDEEEEFAAAA CBBBBAAEFFF AABBCDEEEFF AABCDEEEEEF FFFFDBAABBB FFFFCABBBBB
17,EFEEEDCBBAA ABFEDCDEECC CCBBBBBBEFF DFFFEDCBAAA FFEEEDBAABB AAABBCEEFFF EEEEEEEBAAA
18,EFEEEDCBBAA ACEEEEEFBAA CCBBBBBDFFF AABBCDDEEFF AABBCCCDEFF EEFFFDBAAAB EEEEEFDAAAA
19,EFEEEDCBBAA EDEEEEFAAAA BBBBAAEEFFF CEDDFDDCBBA DBCBCACCCEF AAABCDDEEFF FFFFCBBBBBB
20,BBBBBBDFFFF EDEEEEEAAAA AAEFEEDCDDD CABDECEFDCB DDEDDDCBABF DDDDDDDDDDA AABBCDEEEFF
21,DEDDDCBBBAF EDEEEFCAABB BAAACEEEEFF FCBCEFDBCAA DEEFBBCAADF AAABCDDEEFF FFBBBCCCCCC
22,EEEEEEDBAAA DBAABBCDEFF EEEEEEDBAAA EFFEDECAAAB EFFDDDDCAAC AABBBBDDEFF BBBBCCCCDDF
23,EEEEEEDCBBA ABABBBCEFFF FFFFECBBAAA FEFEEBCBAAA CCCCCBBBCFF BBBBBBBBCFF AACCDFFEEDB
24,EEEEEEDCBBA BAABBBCEFFF FFFFEBBBAAA CCBCEEFEEBA ABBBCCDDDEF AACDDDDDEEF AADDDEEEEEE
25,DDDDDCBBABF EEEEFFAABBB BBBAACEEFFF FCBBBBBDDED FEEFBBAAACE AABBCDDEEFF FBBBBCCCDDD
26,BBBBBBDFFEC FECAAABDEFF AACEEDDCEEE FFEDCDDBBAA BBCCCCCCCEF EBAABBCDEFF AABBCDEEEFF
27,EEEEEEDBBBA AABBBBCEFFF FFFFECBBAAA ACEFDFCBCCA EECEEBCABAF AACDEEDDDEF ADDDDDDDDDD
28,EFEEEDCBBAA AADEEEEEFCA CCBBBBBDFFF AABCCDDEEFF AABCDDDEEEF EFFFFCBAAAB EEFFFDAABBB
29,EEEEEEDCBBA AABBBBDEFFF FFFFECBBAAA FEFDCCDCCAA AFBBBCCCCEF AABDEEDDDEF AAAEEEEEEEE
30,EEEEEEDBBBA ABABBBCEFFF FFFFDBBBAAA EFEEFDCBBBA BCBBCCCCCFF BBBCCCCCCFF AAABCDEEFFF
31,BBBBBBDFFFF EDEEEEEDAAA AACEEEDDDDD DAABBDEFEED ACBCBBCEEEF AABBDDDEEFF FFFFABBBBBB
32,EEEEEEDBAAA CFBBBBCCDEE EEEEDCCDEAA ADDBBADEEFF DEEEBBCBDAF ABCBEDCCDDF AABBCCDDEFF
33,CDDCCCBBBBF EEEFFFAABBB BBAAAEEEEFF AABBCCEEEFF AABCDDDDDFF FFDBBBBBCCD FFBBBBCCCCC
34,EFEEEDCBBAA ACDEEEEFCBB BBBBBACEFFF ECCBCEEFFAA BBBBDDCBCEF AABBCDDEEFF FFFFBBBBBBB
35,BBBBBBDFFFF EDEEEEEAAAA ABEFEEDCDDD BDBEFFDEAAB AABEFFCCCCE AABCDDDEEFF FFEABBBCCCC
36,EEEEECBBAAE FECCCCBACDD BAAABEEEFFF FFEDCCCBBAA BACCDBACEFF ABCCDDEEEEF FBBBBCCCCDD
37,DEEDDDCBBBB BBAABBEEFFF EEEEEFBBBBB DCBAEABEEEE CABDDDDDDEF CCDEEDBACDE BBBBCCCCCFF
38,DDDDDCBBBBF EDEEEFCAABB BBAAACEEFFF FBDDCEDECBB DCDDBBBACDF AAABCDDEEFF EEFFFDAAABB
39,EEEEEDCBBAA EDEEEEFAAAA BBBBBACEFFF FBABBECDDDE DEEDBDBACDF AABBCDDEEFF FFFFCBBBBBB
40,EFEEEDCBBAA BDEEEEEDAAA BBBAAAEEFFF AABBCDDEEFF ABBABCDEEFF EEFFFDCBAAA EEEEEEFAAAA
41,EEEEEEDBAAA ABBBBBCEFFF FFFFEBBBAAA EFEEEBCBCAA ABBBBBBDFFF BBBBBBFFFFF AAABCDEEFFF
42,AAAABEFFEEE EEEFDAAABEE FFFEDCAABBB DCBCDFFECAA BDEDBBBBBEF FFFFBBBBBBB AABBCDEEEFF
43,EFEEEDCBBAA EDEEEEFAAAA BBAAADEEFFF AAABCDDEFFF AABDEEEEEDE FFDBBBBBBCD FFCBBBCCCCC
44,EEEEEEDCBBA BBABBBCEFFF FFFFECBBAAA DEFFEDCCAAA ECCCCCACCDF CCCCCCCCCCF AABBCDEEEFF
45,EEEEEEDBAAA CAABBBCDFFF EEEEEEDBAAA EFDEFDBAABB DEEEEEBAABE AAABBCDEFFF AABBBBDFFFF
46,BBBBBBDFFFF DCDDDDEEFAA AAACEEEEEEE AAACDDFEDEE DCCCABBBDEF AABBDDEEDEF BCCDDEEEEEA
47,DDDDDCBBABF FECBCCBACDD BBBBAAEEFFF FFFEDCBBBAA FFCABBCBCCF AACEDDDDEEF FFFCBBBBBBB
48,DDDDDCBBABF EEEEFFAABBB BAAAAEEEEFF FECABDBBEFE EDDDCBBABDF AABBCDDEEFF FABBCCDDDDD
49,BBBBBBDFFFF EDEEEEDAAAA ACEFEDCCCDD ACABEECDDFF ECDFECAAACF AABBDDDDEFF FAABCCDDDEE
50,EFEEEDCBBAA ACDDDEEFFBB CBBBBBBEFFF DDCCBBFFBCB FEEEDDCAABE AAABCDDEEFF FABBCCDDDDD
51,EFEEEDCBBBA ADDDEEEFBAA CBBBBBBCFFF DBCDFFEBBAC EDDDBACACEF AABBCDDEEFF AAABCDEEFFF
52,DDDDDCBBABF EEEEFFAABBB AAAAFEDDEEE FDCCBCBEEBA EDDDCBDABDF DDDDDDDDDDA AABBCDEEEFF
53,EEEEEEDBAAA EBAABBBDFFF EEDDDDFBAAA ABBCFEDEEDD ABBEDEBCECF BACBDCBDEFF AACDDEEEEEE
54,EFEEEDCBBAA ABFECCDEECC CCBBBBBBEFF DFFFEDCBAAA FFEDDBAAABD AAABBCEFFFF EEEEEEEDAAA
55,DDDCCCBAADF FEEEAAABCDD AEFEDCBBCDD FFEEBBAABCC CCABBDEEEED FFFEBBBBBBB AABBCDEEEFF
56,BBBBBBDFFFF EDEEEEECAAA AADFEEDCDDD AEEEEEEBBDB BCDFDDEBABF AABBDDDEEFF FFBABBCCCCC
57,EEEEEDCBAAE FECCCCBACDD BBBBAADEFFF FFEDDCBBBBA CBBBCCCCCEF DDDDDDDDDDA AABBCDEEEFF
58,EEEEEEDCBBA BBABBBCEFFF FFFFEDBBAAA EFDEFABABBC BBBBBBBDFFF BBBBBBDFFFF AAABCDEEFFF
59,BBBBBBCFFFF DCDDEEEEEAA AAACEEEEEEE AABCEEEEEEE AACDDCDCDFF AAABDDDEEEF EEEFFDAAABB
60,DDDDDCCBBBF EDEEEFDAAAA BBAAAEEEEFF AABBCDEEEFF BCEEEECCDDA FBAABCCCDEF FABBCCDDDEE
61,DDDDDCCBBBF EDEEEFDAAAA BBAAAEEEEFF AABBCDEEFFF DDDEEDDDDCA EDDDDDEEEAA AABBCDEEEFF
62,EEEEEEDBAAA ABBBBBCEFFF EEEEEEEBAAA FFFECBCBBAA FFBBBBBBCDF AAABDDEEEEF AABBBBFFFFF
63,DEDDDCBBBAF EDEEEFCAABB BBAAACEEFFF FCCCBCBBDED DDDCCBBABFF AAABCDDEEFF FFCBBBCCCCC
64,DDDDDCBBBBF EDEEEFCAABB BBBAAAEEFFF EBBCDBBEFEB DCCCBBCDBDF AABBCDDEEFF EEEEEEEDAAA
65,CCCCCCBBAFF EEEEFFAABBB BAAADEEEEFF FACDCDFDACB EEEEDDAAACE AABBCDDEEFF FFCBBBCCCCC
66,EEEEEEDBBAA BAABBBCEFFF FFFEEEBBAAA FFDEEBBBBBB DEEEEEAAABE AAABCCDEFFF AABBBBDFFFF
67,EFEEEDCBBAA ACDDDEEFFAB CCBBBBBCFFF DEECAEEDDCA CDABDCCBCEF AABBCDDEEFF EEEEEEEDAAA
68,EEEEEEDBAAA EBAABBBEFFF EEEEDDFBAAA DDDDACACFEC CEEFDBBBBCE ABEDCCCBDEE AABBBBFFFFF
69,EFEEEDCBBAA EDEEEEFAAAA BBBAAAEEFFF EEEEFCECAAA BBBBBDDCDFF AABBCDDEEFF EEEEFFAAAAA
70,EFEEEEDBAAA EBABBBBEFFF EEEEDDFCAAA BCADFCCECFD DECEBEEBCBB CCDDBBCBDCF BBBBCCCCCFF
71,EEEEEEDBBBA BBABBBCFFFF EFEEFCBBAAA ECBBBBCDCEF CEDDDCDCCDA AABCECCDDFF AAABCDEEFFF
72,DDDDCCBAAFF FECCCAABDEE BAAACEEEEFF FFEEDCCBAAA CCBBBBCCDDF CAAABCDEFFF AABBCDEEEFF
73,EEEEEDBAAAD EDEEEEFAAAA BBBBAAEEFFF AABBCDEEEFF AABCCDDDEFF EEFFFDCAAAA EEEEEEFAAAA
74,AAAAACEFFFF DDEEEEEFBAA AABEEEEDDEE AABEEFFCCDC CEDBBBBBBDF AABBDDDEEFF FFFFBBBBBBB
75,EFEEEDCBBAA EDEEEEFAAAA CBBBBBBEFFF ABABDDFEEED FCDCACBBBEF AABBCDDEEFF EEEEEEDAAAA
76,DEDDDCCBBAF EEEFFCAABCC AAAFEEDCEEE FEDFDABCCBB DDCCBAEDBDF DDDDDDDDDDA AABBCDEEEFF
77,DDDDDCCBBBF EDEEEEEAAAA BBAAAEEEEFF AABBCDEEEFF AABCEECCDEF FFDBBBBBBCD FFCBBBCCCCC
78,EEEEEECBAAA CFBBBBCCDEE DDDDCCCEFAA ACDFECABEEE BBBBBCFCCEE AABBCEDDDEF AABBBCEFFFF
79,EFEEEDCBBAA FFECCCDAABB BBBAABEEFFF FFFEDDCBAAA CBBBAACDEFF AABDDEEEEEE FFFBBBBBBCC
80,BBBBBBDFFFF CCDDDDEEFBA AAABEEEEEEE AAACDFFEEED CDCACACCCEF AABBDDDEEFF EEEEFFAAAAA
81,AAAABEFFEEE EEFCAAACDEE FFFEDCAABBB AACDCBEFEED CDCBBBBBEFF FFFBBBBBBBB AABBCDEEEFF
82,AAAABEFFEEE EEFEAAABDEE FFFEDCAABBB AAADDDEEFDD CDFCACBBCEF FFFEBBBBBBB AABBCDEEEFF
83,DDDDDCBBACF FEFFDAABCCC ADFEEDCBDDD FEEEDEBABAA EDDEDDDAABF FFFFEBBBBBB AABBCDEEEFF
84,BBBBBBDFFFF DCDDEEEEEAA AAACEEEEEEE BBBAACEFFED CCBDBBEDDBF AABBDDDEEEF EEFFFCAABBB
85,BBBBBBDFFFF DCDDDDEEFBA AAABEEEEEEE AABCEEEEEEE DEEDDBBAACF AABBDDDEEFF AABBCDEEEFF
86,BBBBBBCFFFF EDEEEEEBAAA ABDFEEDCDDD EFEDCEBAACB AACDDDCCDFF AABBCDDEEFF FFFABBBCCCC
87,EEEEECBBAAF FECCCCBACDD BBBAABDEFFF FFEDDCCBBAA FEDCBCAABEF AABDDDEEEEF FFBBBCCCCCC
88,EFEEEDCBBAA ADFDCCCEECC CCBBBBBBFFF FFFDDCBBBAA CCDCBABDEFF AAABCDEFEEF EEEEEFBAAAA
89,BBBBBBDFFFF DDEEEEEFBAA AABEEEEDDEE AACBBDCEFFF BDDDBDCCACF AABBDDDEEFF FFFABBBCCCC
90,CCCCCBBAFFD DDBABBBCDFF FFFECBAACDD FEAADEBDFDB EEDDCBCBBCE FDCCCCCCCCC AABBCDEEEFF
91,EFEEEDCBBAA BFECCBDDBCC CBBBBABEFFF FFFEDCCBAAA FFFDBCBAABC AAACEEEEEEE FFFFCBBBBBB
92,BBBBBBDFFFF DCDDEEEEEAA AAACEEEEEEE AABDEEECEEE BCCCCEABDEF AABBDDDEEEF EEEEFFAAAAA
93,AAAABEFFEEE EEEFEAAABDE FFFEDCAABBB BDBEFDEDCCA DCCBBCBBCEF FFFFEBBBBBB AABBCDEEEFF
94,DDDDDCBBABF EEEEFFAABBB BAAACEEEEFF FDECCBCEEBA DEEEDDBAABE AABBCDDEEFF FABBCCDDDDD
95,EFEEEDCBBAA ADEEEEEEAAA CBBBBAAEFFF AABBCDEEEFF AABCDCDEEEF EFFFEBAAABB EFFFFAABBBB
96,BBBBBBDFFFF EDEEEEEBAAA ABDFEEDCDDD AAABCCCEFFF EEBDBCAAEFE AABBDDDEEFF EFFFFBABBBB
97,EEEEEEDCBBA BAABBCDEFFF FFFFDBBBAAA DFEEEDDCAAA BCBBCEDBDEF BCCCCCCCCDF AAABCDEEFFF
98,EEEEEDCBBAA EDEEEEFAAAA BBBAACEEFFF AAABCDEEEFF AABBCEDCDEF FFEBBBBBBCD FFBBBBCCCCC
99,CCCCCBBBCFF FEEFFAABBCC BAAADEEDEFF FCBBBABEFEE FFCCBBBBBDF AAABCDDEEFF FFCBBBCCCCC
100,BBBBBBDFFFF DCDDDDEEFAA AAACEEEEEEE AABDCEFDDEE CEDCCCBABDF AABBDDDEEFF EEEFFDAAABB
101,EEEEEEDCCAA AAABDDDEEFF FFEEEDDCAAA BABCAEDCDDF BADCDCDDEDE AADDDDEEEEE AABBCDEEEFF
102,EEEEEEDCBAA BAAACCDEFFF FEEDDCCCBAA FEEDCCFCCAA EEDDEDDDCAA AABDDEEEEEE AABBCDEEEFF
103,CBBBBBACFFF EECAABBCCEF FFFECBAABDD FFDCBCBBBBB EEEEEEEEBAA AABCEDCCCEF AABBCDEEEFF
104,EEEEEEECAAA AABCCCDDEFF FFEEEDDCAAA EDDBBECACDE CBCCDDBBCDF AADDDDDEEEE AAABCDEEFFF
105,EEEEEEDBAAA BBABBBCEFFF EEEEEEDBAAA AABCCDEEEEE DDEEEEEACAD AABBBDDDEFF BBBBBBCCFFF
106,EEEEEEDCBBA BAABBBDEFFF FFFFCBBBAAA EFEEDBCBCCA BBCCCCCCCDF CCCCCCCCCCF AAABCDEEFFF
107,EEEEEDCBBAA EDEEEEFAAAA BBBAACEEFFF FBACBCEECDB FFEDBBBBACE EEEEEEDAAAA AABBCDEEEFF
108,EEEEEEDBAAA DBAABBBEFFF DDDDCCFBBBB AEBABCDDFFF DEAAABDEEEF BBAADDDDDEF AAABBEEEEEF
109,EEEEEEDBAAA CBAABBCDEFF EEEEEDDDBAA FFEECCCAAAB EEFEDAAABCF ABBBBBDEFFF ABBBBBBFFFF
110,DDDDDCCBBBF EDEEEECAAAB BAAABEEEEFF AAABCDEEFFF AACDEDCDEFD FCAABBCCDDE FBBBBCCDDDD
111,EFEEEDCBBBA ABEEEEEFEAA CCBBBBBBFFF AABBCDEEEFF AABBBCDDEFF BCDDEFFFCAA AAABCDEEFFF
112,EEEEEEDCBBA BBABBBCEFFF FFFFDBBBAAA DFDDEEFAAAB ABDCDECBBEF ABDEEDCCCEF ACDDDEDDDDD
113,DEDDDCCBBAF EDEEEFCAABB BAAADEEDEFF FCCCCBFFBBB DDEEDBAABDF AABBCDDEEFF AAABCDEEEFF
114,EFEEEDCBBAA AADDEEEFFBB CCBBBBBCFFF CCCCBCEFFEA BDBDDDCBAEF AABBCDDEEFF FFFFCBBBBBB
115,EEEEEEDCBAA AAABCDDEEFF FCCCCCCCCBC ABAACEDEEEF ECECCEEDBBB AAADEEEEEDD FFEEDDDCBAA
116,EFEEEDCBBAA ADDEEEFEABB CCBBBBBCFFF BADEDEFDCCB EEEEFBAAACE AABBCDDEEFF EEFFFDAAABB
117,AAADEFEEEDD FEFFCAABBCE FFFEDCBAABB BAABEEFFEDC CCBCECAACFF DDDDEEEEEAA AABBCDEEEFF
118,BBBBBBDFFFF EDEEEEEAAAA ABEFEEDCDDD CCCFFBABBCF DAACBBDDEDF AABBCDDEEFF FFBBBBCCCCC
119,EEEEEDCBBAA AFECBBCFCCC CBBBBBBDFFF FFFEDCCBAAA FFDCCCBCAAE AAACEEEEEEE FFFFCBBBBBB
120,EFEEEDCBBAA FFDBBBDABCC BBBBBABEFFF FFFEDCBBBAA FFEECCBABAC AAABDEEEEFF FFFCBBBBBBB
121,EFEEEDCBBAA ADDEEEFEABB BBBBBACEFFF FEDDCBACCBD FDCCBBBBBDF AABBCDDEEFF FFFFFABBBBB
122,DDDDDDEDAAA BBCCCCCCEFC FFFEEDCBAAA AABBCCCFFEF ACABDBDEEEF ABDDDDDDDEE AABBCDEEEFF
123,EFEEEDCBBAA ACEEEEEFBAA CCBBBBBDFFF AABBCDEEEFF AABCCDDDEFF EFFFEBAAAAB EFFFFBABBBB
124,EEEEEEDCBAA BAABBCDEFFF FFFECCBBBAA EFFECCBBBBB BBBBBCCCDEF AACDDDCDEEF ACDDDDDDDEE
125,EFEEEDCBBAA ABEEEEEFEAA CBBBBABEFFF AABBCDEEFFF AABBCCDDEFF EEFFFDCBAAA DDEEEEEDAAA
126,DDDCCCBBBBF EDEFFFAAABB BAAACEEEEFF AABBCDEEEFF CDDDDDDDDDA DDDDDDDDDDA AABBCDEEEFF
127,EFEEEDCBBAA EDEEEEFAAAA CBBBBACEFFF AAABCDEEFFF AAABCDDDEFF FFFFDBAAABB EEEFFDAABBB
128,EFEEEDCBBAA ADDEEEFEAAB CBBBBBBEFFF FCCCBEFFCAA CBBDBCBCDFF AABBCDDEEFF FFFFCBBBBBB
129,BBBBBBBCFFF FFDAABBCCDF FFFEDBAABCC AAABDEEDEEF BCCCABBBDFF FFCBCBBBBCC AABBCDEEEFF
130,EEEEEEDBAAA ABBBBBCEFFF FFFFEDBBAAA EEECEEEAAAB CDDEDBEAACE AADDEDCCCEF ACCCDDDDEEE
131,EEEEEEDCBAA BAABCCDEFFF FEEDDDDCAAA ECDEFFEABBA DBBBBCCCCEF AAAEEEEEEEE AAABCDEEFFF
132,DDDDDDCBBBF CBABBBBEFFF EEEDDDFBAAA CEACCCCCCFF BBBBCCCCDEF BBBBDFEBCEF AAABBEEEEEE
133,CCCCCBBADFF FEEAAABCCDF FFFEDBAABDD FDDECBBCCBA DDDDDDDDDBA AABCEDCCDEF AABBCDEEEFF
134,BBBBBBDFFFF EDEEEEDAAAA ACEFEDCBCDD AAACEFEEDED EECCCCBAADF DDDDDDDDDDA AABBCDEEEFF
135,CBBBBBBBFFF FFFAAABCCCF FFFEDBAABCC FFFDCCCBAAB DDDDEEAAAFE FFCBBBBBBBC AABBCDEEEFF
136,CCCCCBBBBFF FEFFAABBCCC AEFEDCBACDE AABCBDEEFFF FFEDCBBBBBB FFCBBBBBBBC AABBCDEEEFF
137,EFEEEDCBBAA ACDEEEEFCBB BBBBBACEFFF FCDCDECCCDA EDDDCBBABDF AAABCDDEEFF FFCBBBCCCCC
138,AAAABEFFEEE FEDAAABDEEE FFFEDCAABBB BACDFECBDEE CBBABDDFDEF FFBBCCBBBCC AABBCDEEEFF
139,CCCCCBBACFF FEEFFAABBCC AAADEEDDEEE FEDBADDEBBB EEEEDDDAABE DDDDDEEEEAA AABBCDEEEFF
140,EFEEEDCBBAA AADEEEEEFCA DCCCCBBBAFF AABCCDEEFFF AABBCDDDEFF DDEEEFECAAA DDDEEEEEBAA
141,DDDDDCBBABF EDEEEFCAABB BAAADEEDEFF FEEDAABCFCB EEEEEDCAABD EEEEEEEEAAA AABBCDEEEFF
142,EEEEEEDBAAA CFBBBBCCDEE EEDDDCCEFAA AABBDDDEEFF FDDDFDAABBE AAABDDDDDEF AAACDEEEEEE
143,BBBBBBBFFED DCABBBBCEFF FFFECBAABDD FFDEDCBBBBA DDDDDDDDDCB FCCCCCCCCCC AABBCDEEEFF
144,BBBBBBBBFFF FFEAABBCCDE FFFEDBAABCC FFDDEDBBAAA CCCCDDCBCEF FFEBBBBBBBB AABBCDEEEFF
145,EEEEEEDCBBA BAABBBCEFFF FFFFEDBBAAA FFEECBBBBBB BBCCCCDDDFE AAAABDEFFFF AABBBBDFFFF
146,EFEEEDCBBAA BDEEEEEDAAA BBBBAADEFFF AAABCDEEEFF AABBCDEEEFF FFFFDBAAABB EEEFFDAABBB
147,EEEEEEDBAAA CAABBCCDEFF EEEEEEDDAAA FECDDFBABBB ABBBCCCCDEF AAABCDEEEEF AAAABEEEEEE
148,EEEEEEDCAAA AAAACDDEFFF FFFFEBBBAAA FFFDEECBAAA BBBBBBBBEFF AABCDEDEEEF AAACEEEEEEE
149,EEEEEDCBBAA FFDCBBDABCC BBBAABEEFFF FFEDDCCBBAA ECBBABBEEFF DDDDDDDDDDA AABBCDEEEFF
150,DDDDDDCBBAF BBAABBCEFFF EEEDDDFBAAA CDBDCCAEFBE AAAADEEECFD EEEDBDAABCF AABBBBDFFFF
151,CDDCCCBBBBF EDEEEECAAAB BBAAAEEEEFF AAABCDDEEFF AABDEFEDCEF FFECBBBBBCC FFFABBBBCCC
152,EEEEEEDBAAA ECAABBBCFFF DDDDDDCFBAA CBBDDFABDEE DDDCDADEECC ABCBDFDBDCF AAAADEEEEEE
153,EEEEEEDCBBA BBAABBEEFFF EEEEFBBBBAA FDCACADECDD FBDBDBBFCCD ACCBCCBBDFF AACDDEEEEEE
154,EEEEEEDBAAA DBAABBBEFFF DDDDCFEBBBB AAACFEEEEEE BBDCFDBBCDF BCECBEABDEF AABBBCCDEFF
155,DDDDDCBBABF FEBBBCBACDD BBBAACEEFFF FFEDCCCBBBA ECDCDDABCED AAACEEEEEEF FFFFCBBBBBB
156,EFEEEDCBBAA EDEEEEFAAAA CCBBBBBBFFF AABCCDEEEFF AABBBCDEEFF DDEEFFECAAA CCDDDEEEEDA
157,BBBBBBBFFFF FDAABBBCDFF FFFEDCBAABB AABCCDEEEFF BBBBBCCDDFF AABBDDDEEFF AABBCDEEEFF
158,EFEEEDCBBAA EDEEEEFAAAA BBBBAAEEFFF FFBBCDCCBBC CECACCBBBEF AABBCDDEEFF FFFFCBBBBBB
159,EEEEEEDCBAA BAABBBDEFFF FFFFECBBAAA AABBEEFDDFE EFECCCBAADF AABCEEDEEEF AAAEEEEEEEE
160,EFEEEDCBBAA AADEEEEEFCA DCCBBBBADFF AAABCDDEEFF AABBCDDDEFF EEEFFDBBAAA EEEEFFBAAAA
161,EEEEEEDBBBA ABABBBCEFFF FFFFEDBBAAA DFEFCCDBBBB DFCBBBBBCDF AABDEEEDDEF AACDEEEEEEE
162,EEEEEEDCBBA ABABBBCEFFF FFFFECBBAAA FFEDECBBBBA ECBBBCCCDEF ABDDEDCCCDF ADDDDDDDDDC
163,DDDDDCCBBBF EDEEEEEAAAA BBAAACEEFFF AABBCCDEEFF AABBCEEDDEF FFFECBABBBC FFFFCABBBBB
164,EFEEEDCBBAA ABFECCDEECC CBBBBBBCFFF DFFFEDCBBAA CAABCEFEEDF AAABEFEEEEE FFFFFABBBBB
165,BBBBBBDFFFF DCDDEEEEEAA AAACEEEEEEE AABCDDFEEDC CCDDDDBABEF AABBDDDEEEF CCDDDEEEEAA
166,BBBBBBBCFFE FECAABBCDEF FFFEDBAABDD FFFEECBAABA DBBBCBBDDFF FFCCCCBBBBC AABBCDEEEFF
167,EEEEEEDBAAA CAABBCCDEFF EEEEEEDCAAA EEEFEDCCAAA BCCDEDDDAAF AAABCDEEFFF AAABBDEFFFF
168,CCCCCCBBBFF EEFFFCAABBB AAAAEEEDEFF AABBCDDEEFF EEEDDDDDDCA FAAABCCDEEF AAABCDEEEFF
169,DDDDDCCBBBF EDEEEEFAAAA CBBBBAAEFFF AABCCDEEEFF AABBCDDEEFF FFFFEBAAABB EFFFFAABBBB
170,EFEEEDCBBAA AADEDCDEFDC CCCBBBBBDFF ACFFFEDDBBA FFEFDCBAAAC AAABCEFFEEE EEEEEEDAAAA
171,DDDDDCBBBAF EDEEEFCAABB AAAAFEEDEEE DEEBDEDFCAA FEEDCDBAACE AABBCDDEEFF FBBBBCCCDDD
172,EEEEEECBAAB BBAABBCFFFF EEEEEEBBAAA FDBEDCABEEC BCADEDDDFEA AABCEDDCDDF AACDEEEEEEE
173,EEEEEEDBAAA FCBBBBBCDEE EEEEDDCECAA AABCCDEEFFC DFEDBBABBDF AABBEDDDDEF AAABBEEEEEE
174,AAAABEFFFEE FEEAAAACEEE FFFEDCBAAAA BCDDCEBBFFC FEAABADBDEF AABBDDDDEEF AABBCDEEEFF
175,DDDDDCCBBBF EDEEFEDAAAA BBBAACEEFFF AAABCDEEEFF AACDEFECCDE FDAABBCCDDE FBBBBCCDDDD
176,EFEEEDCBBAA ABEEEEEFEAA CCBBBBBBFFF AABBCDDEEFF AABCCDDEEFF EEEFFECAAAA EEEEEEFAAAA
177,EFEEEDCBBAA BFECBBDEBCC CCBBBBBBEFF EFFEEDBBAAA FEECDCAABCC AAABCFEEEEE EEFFFDAAABB
178,EEEEECBBAAF FECBBCDABCC BBBAACEEFFF FFFEDCBBBAA ECDDCBAACEF AACEDDDEEEE FFFBBBBBBCC
179,EEEEEEDBAAA EBAABBBEEFF DDDDCCCFBBB ABFEEEEBBBB AABBBDEEEEF BACBFECCCCF AABBCCDDDFF
180,BBBBBBDFFFF DDEEEEEFBAA AABEEEEDEEE BAABDFEDEFD ACBACDDCDFF AABBCDDEEFF FFFFBABBBBB
181,BBBBBBDFFFF EDEEEEDAAAA ACEFEDCBCDD BACEDEFABED ABCBDCCDEEF EEEEEEEDAAA AABBCDEEEFF
182,BBBBBBDFFFF EDEEEEEBAAA AAEEEEDCDDD ABFFDCADDEB ABBCCDCCDFF AABBCDDEEFF DDEEEEEEAAA
183,EFEEEDCBBAA ACEEEEEFBAA CBBBBABEFFF AAABCDEEFFF AABCCCDEEFF EEEFFECBAAA DDDEEEEEAAA
184,EEEEEEDBAAA AABBBCCEFFF EEEEEEDBAAA FFDEEECBBAA ACCCDDEEFAE AAABCDEEEFF AAAACEEEEEE
185,EEEEEEDBAAA DBAABBCDEFF EEEEEEDBAAA FFEDEEBBBAA FFCBBBBBBDF ABBBBBCDEFF BBBBCCCCDDF
186,EFEEEDCBBAA ADDEEEFEAAB BBBBBACEFFF FEEBAEFBBBC CCBDDEDBBCF AABBCDDEEFF FFFFBBBBBBB
187,EEEEEEDBAAA DBAABBBEFFF EEEEEFBBAAA FCDDBBBBDEE FDBACEBDCDE ABBEFDDCDDE AACDDEEEEEE
188,BBBBBBDFFFF EDEEEEEAAAA ABEFEDDCCDD AABCDEDDEFD ACCDBABCEFF AABBDDDDEFF FFABBCCCCDD
189,BBBBBBDFFFF DCDDEEEEEAA AAACEEEEEEE AAADEEEFECE ACCCCECBCCF AABBCDDEEFF DDDEEEEEBAA
190,EFEEEDCBBBA ADDDEEEFBAA CCBBBBBBEFF AABCCCCEFEF EBDDDCCBDBE AABBCDDEEFF CDDDDEEEEDA
191,BBBBBBDFFFF EDEEEECAAAA ACFFEDCCCDD AFDBEDDDCCD CCDBBDDCACF AABBDDDDEFF FFFBBBBBCCC
192,BBBBBBDFFFF EDEEEEEBAAA AADFEEDCDDD BAADEFFDDCB BDCDDACCBEF AABBDDDEEFF FFFCABBBBCC
193,EFEEEDCBBAA FFCBBBDBBCC CBBBBBBEFFF FFFEECBBBAA EDCBBABCEFF AACFDCDDDEF FFFFCBBBBBB
194,EFEEEDCBBAA ACDEEEEFCBB CCBBBBBCFFF BBBEEEEEABC EEEEDDBAABE AABBCDDEEFF EEEEEEDAAAA
195,EEEEEEDBAAA DBABBBBEFFF EEEDDDFEAAA BBABBDCEFFE DDEEFEECAAA AAABCEECDEF AAABBDEFFFF
196,EFEEEDCBBAA ADEEEEEEAAA CBBBBACEFFF AABBCDDEEFF AABBCCDEEFF FFFEDBAABBB FFFFCABBBBB
197,EEEEEDCBBAA FFCBBBCBBCC BBBBAADEFFF FFEDCCCBBAA DEDDBABBCEF AADDDCDDEEF FCBBBCCCCDD
198,CBBBBBACFFF EECAABBCCEF FFFEDBAABDD FEADCDCCCBB EEECBBBBBDF FFBBCCBBBCC AABBCDEEEFF
199,DDDDDCBBABF EEEEFFAABBB BAAAAFEEEFF FBCDDACDBCC DEEEEBAAAEF AABBCDDEEFF FBBBBCCCDDD
200,EEEEEEDBAAA AABBBBCEFFF EFEEEECBAAA EFFEECDAAAA FEEEAABBBCF AAABDEEEEEF AAACEEEEEEE
201,EFEEEDCBBBA ADEEEEFEABB CBBBBBBEFFF BDEEDFACCCB DDDCCBBABEF AABBCDDEEFF CDDDDEEEEDA
202,EFEEEDCBBAA ABEEEEEFEAA CCBBBBBDFFF AABCCDDEEFF AAABCDDEEFF EEFFFDBAAAB EEEEEFDAAAA
203,DDDDDCBBABF FECCCCAACDD BBAAAEEEFFF FFEEDDCBAAA CCCBBBCCDEF DDDDDDEEEAA AABBCDEEEFF
204,EFEEEDCBBAA EDEEEEFAAAA BBBBAAEEFFF EDEDDFEAACB EBDDACBBBEF AAABCDDEEFF FFFFFABBBBB
205,DDDDDDCBBBD BBABBBCEFFF DDDDFEBBBBB FDDBDDDCADB BBBBBDFFFDE BEDCFBBCCCE ABBBBBCFFFF
206,EFEEEDCBBAA ABFECCDEFCC CCBBBBBBEFF FFFEDCBBBAA FFDCBBABCDE AAABCCDEFFF DDDDEEEEDAA
207,EEEEEEDCBAA BAAACCDEFFF FEDDDCCCBAA EFEEFDBBBBA ABCCCCDDDEF AAACEEEEEEE AABBCDEEEFF
208,EEEDDDCBBBC BBAABBCEFFF EEEEFCBBAAA FDDDCCEBBBC ABDDBEECCEF BCBBCEDBDEF AADDDDEEEEE
209,EFEEEDCBBBA AADDEEEFFBB CBBBBBBEFFF DAAAAFEEEEE EEEFBBAABCF AABBCDDEEFF CDDDDEEEEDA
210,EEEEEEDBAAA DDAABBBCFFF DDDDCCFFBBB CABECCCCCDF FCBBBCCCCDF AABCEBFCBEF AABBCCDDDEF
211,EFEEEDCBBAA EDEEEEFAAAA BBBAABEEFFF AAABCDDEEFF AABCDEEEEEF FFECBBBBBBC FFFABBBBCCC
212,EEEEEEDCBBA BAABBBCEFFF FFFFEBBBAAA DEECECDCCCA EBBBBBCCCEF AAACEEEEEEF AADDDEEEEEE
213,EEEEEEDBAAA FDBBBBBCDEE EEEDDDFDAAA ABBCDAEEDFF DBECDDEECAD AAACDDDDDEF AAAADEEEEEE
214,EEEEEEDBAAA EBABBBBDFFF EEDDDDFBAAA FEEABAEECCD DDCCFFBBBCE CDCEDDBADCF BBBBCCCCDFF
215,DEEDDCCBBAF EDEEEFCAABB BBBBAAEEFFF FEFCABEBDCB DCEECFDAACE DDDDDDDDDDA AABBCDEEEFF
216,EEEEEEDBAAA DFBBBBBCDEE EEEDDDCFAAA ABBBCDEEFED AEBBBBBFDDF AACCDDCCDFF ACCCDDEEEEE
217,BBBBBBDFFFF EEEEEEDAAAA ACEFEDCCCDD ABBECDFDDDD ABDDDEFDBAE AABBCDDEEFF EFFFFAABBBB
218,EEEEEEDCBAA BAABBBDEFFF FFFFECBBAAA EEDEFDCBCAA FBBBBBCCCDF AABCDDDDDEF AABCEFFEEDC
219,EFEEEDCBBAA ACDEEEEFCBB CCBBBBBCFFF BABEFEDDDCC EECBCBBBBEF AABBCDDEEFF EEFFFDAAABB
220,DDDDDCCBBBF EDEEEFCAAAB BAAACEEEEFF AABBCDDEEFF ADDFFCCDCDB EDDDDDDDDDA AABBCDEEEFF
221,BBBBBBDFFFF DCDDDDEEFAA AAABEEEEEEE AABDEDEDDEF EEDBAEBBADF AABBDDDEEFF EEEEEFDAAAA
222,EEEEECBBAAE FECBBBDBBCD BBBBAADEFFF FFEEDCCBAAA FECDDCBBACF AAACEEEEEEF FFFFFABBBBB
223,EEEEEEDBAAA CAABBBCDFFF EEEEEEDBAAA EEFEEECCAAA FFEDCCCCAAC AAABCDDEFFF AAAABEEEEEE
224,EFEEEDCBBAA ABEEEEEFEAA CCBBBBBDFFF AAABCDEEEFF AAACCDDEEFF EEFFFDBAAAB EEEEEFDAAAA
225,EEEEEEDCBBA BAABBBDEFFF FFFFEBBBAAA EDEEFECCBAA BCCCACDDDEF AACCDDDDDEF ACDDDDDDEEE
226,EEEEEEDBBBA BBAABBDEFFF DDDEFCCBBBB CDAAACEEFEE BBEBBEFCECD BBBEEEDDBBF AABBBBEFFFF
227,BBBBBBDFFFF EDEEEEEDAAA AACEEEDDDDD BCCDBCCDCCF DCCCCCDABEF AABBDDDEEFF FAABCCDDEEE
228,CCCCCCCCDFA BBAACCDEFFF FEDCCCCCBBB AAADEEEEEEE BBCDBBDCCDF AAACDDEEEEF AABBCDEEEFF
229,EEEEEEDBAAA DFBABBBCDFF DDDDDCCFBAA BCDBBDBCFFF CCFFCDBAECC CCDDEACDBCF AABBBBEFFFF
230,EEEEEEDBAAA EBAABBBEFFF EEEEEDFBAAA AAAEEFBBDEE ADEECDFFCBA CCCBFCBBBCF AAAABEEEEEE
231,EEEEEEDCBAA BAABCDDEFFC FFEEEDDCAAA DFFBCCDCDDA BBDCCCDCCCF AADEEEEEEEE AAABCDEEFFF
232,DDDDCCBBBBF EDEEEFCAAAB BAAACEEEEFF AAABCDDEEFF DDDDDDEDDCA DAABCCDDEFF AABBCDEEEFF
233,EEEEEEDBBBA BBAABBCFFFF FFFEFCBBAAA FEBDCBABDDD BBABCCDFEDF AABCDDCDEEF ACDDDEDDDDD
234,EFEEEDCBBAA ACEEEEEFBAA CBBBBABDFFF AABBCDEEEFF AABCCDEDEFF FFFFEBAABBB EFFFFAABBBB
235,EEEEEEDBAAA FBABBBBEEFF EEEEDDFBAAA DBCBBACCEDF FEDBBBCCCCE CDDAECBCCCF AAAABEEEEEE
236,DDDDDCBBBAF EDEEEEFAAAA CBBBBBBEFFF FFDDCDBABCB EEEDEAAABEF AABBCDDEEFF FFFFFABBBBB
237,AAAACFFEEEE FEDAAABDEEE FFFEDCAABBB ABDBCBEDEFE DEEDCCBCBBE FFEBBBBBBBB AABBCDEEEFF
238,EFEEEDCBBAA ACDEEEEFCBB CBBBBBBEFFF EDBEFACCDCC FFDCCBBABDF AABBCDDEEFF EEFFFDAAABB
239,EFEEEDCBBBA ACDEEEEFCBB CCBBBBBCFFF ABBEEFFEEBA CBACDCCBCEF AABBCDDEEFF CDDDDEEEEDA
240,EEEEEEDBAAA BAABBBCEFFF EEEEEEDBAAA FFDCDCBBBAA DDEDAABBCEF AABCDDDEEEF ACCCDDDDEEE
241,DEDDDCBBBAF EDEEEFCAABB BBBBAAEEFFF FFBACDDCCCB EDDEBCBBBCF AAABCDDEEFF FFFFBBBBBBB
242,EEEEEEDBBBA BBAABBEEFFF EEEEEEBBAAA CBBACAFDEFE DBBDCCDCDDE AABCEEDCEEE ACDDDDDDEEE
243,EFEEEDCBBAA EDEEEEFAAAA BBBBAAEEFFF EDBEEEDEDAA CBBBCDCACFF AAABCDDEEFF FFFFBBBBBBB
244,EEEEECBBAAE FECCCCBACDD BAAABEEEFFF FFEDCCBBBBA CBBBACCCEFF ABBBCDDEEFF FABBCCDDDDD
245,BBBBBBDFFFF EDEEEEEDAAA AACEEEDDDDD AAABDEEEEEE CBCCCCCDBDF AABBDDDDEFF EEEEFFAAAAA
246,EEEEEECBAAC CBAABBCEFFF EEEEFDBBBAB FDCCBABDCEE FCABBBBDEDF BAABFECCDEF AAABCDEEFFF
247,DDDDDCBBBBF EDEEEFCAABB AAAAFEEDEEE FBBBADDDCEC CDDDCCBBBCF AABBCDDEEFF FABBCCDDDDD
248,EEEEEEDBAAA CFEBBBCCCDD DDDDCCCBFCA AABCCCEFFEE EEEEEAAABDF AABCDDDCDEF AABBCDDDEEF
249,EFEEEDCBBBA AADDDDEFFCB CCBBBBBBEFF BACDDDFDCCE DCCBBBBBDFF AAABCDDEEFF CDDDDEEEEDA
250,EEEEEEDBAAA CAABBBCDFFF EEEEEEEBAAA FFFDECBAABB CFEBBBDCBFF AABBBCDEEFF AABBBBDFFFF
251,EFEEEDCBBAA ACEEEEEFBAA CCBBBBBDFFF AABBCDEEEFF AABBCDDEEFF EEFFFCAAAAB EEEEEFDAAAA
252,CCCCCCBBBFF EEFFFCAABBB BAAACEEEEFF AABBCEEEEFF DABFEEEBBDB FCAABBCCDEF FBBBBCCDDDD
253,EEEEEEDBAAA BABBBBCEFFF EEEEEEDBAAA FEECDECAAAB EFFFCABBBCD AAABCEEEEEF AAABEEEEEEE
254,BBBBBBDFFFF DCDDEEEEEAA AAACEEEEEEE BBDDBBEEEDD ABBCBCCDDFF AABBCDDDEFF EEEEFFAAAAA
255,EEEEDCBBAAF FEDCCAABCDD AAAAEEDDEFF FFDCDCBCBBA BBBBCCCCCEF DDDDDDDDDDA AABBCDEEEFF
256,CCCCCBBABFF FECCCAACEEE AAAADEEEEFF FEDEFCABBAB CABCDBCBCFF ABDDDDDEEEF FFBBBCCCCCC
257,DEDDDCCBBAF EDEEEFCAABB BBBBAAEEFFF FEDBCDADDCA FECECBACBCF AABBCDDEEFF FFCBBBCCCCC
258,EFEEEDCBBAA ACDDEEEFBAA CBBBBBBEFFF ECBBDDCFCCA EDDEBABACEF AAABCDDEEFF FFFCBBBBBBB
259,EEEEECBBAAE FFDCCCBABCC BBAAAEEEFFF FFEEDCCBAAA CBAABBCDEFF AADDDDDEEEF FFFBBBBBBCC
260,BBBBBBDFFFF EDEEEEDAAAA ACEFEDCBCDD BABCDBEEEEF CCFDBCBBBDF DDDDDDDDDDA AABBCDEEEFF
261,BBBBBBDFFFF DCDDEEEEEAA AAADEEEEEEE AAACCDEEFDF BACCEBBBCFF AABBDDDEEFF DEEEEFFAAAA
262,DCCCCCBBAFF FEFEAAABCDD AFFEDCBACDD FFDBBBBBCDB EEEEDEAAACE FFFEBBBBBBB AABBCDEEEFF
263,EFEEEDCBBAA AADEDCDEFDC CCCBBBBBDFF EFFFDCBBBAA FFEECBBBAAD AAABBCEFFFF EEEEEEEBAAA
264,EFEEEDCBBAA ADDEEEFEAAB BBBBBACEFFF DBBBBFFEEEB CDDDCCCBBFD AABBCDDEEFF FFFFFABBBBB
265,CDDCCCBBBBF EEEFFFAAABB BBBAACEEFFF AABBCDEEEFF AAACDEEDDEF FFCBBBBBCCD FFBBBBCCCCC
266,EEEEEEDCBBA BBABBBCEFFF FFFFDBBBAAA DEDEEEEBBBA CDDDDDDAABF AACDEDCDEEF ACCDDDDDDEE
267,BBBBBBDFFFF EDEEEEDAAAA ABFFEDCBCDD CADEEFEDCBA ABCBCBDFDFF DDEEEEEEDAA AABBCDEEEFF
268,EFEEEDCBBAA AEFDCCDFCCC CBBBBBBEFFF FFEDDCBBBAA FCCCAABDDEF AAABCEEEEEF EEEEEFAAAAA
269,BBBBBBDFFFF EDEEEEEBAAA AAEFEEDCDDD BACFDECECCD EECCBBBADDF DDDDDDDDDDA AABBCDEEEFF
270,EEEEEDCAAAC EDEEEEEAAAA BBAAAEEEEFF AAABCDEEFFF AACCDEDEEEE FDAABBCCDDE FABBCCDDDEE
271,DDDDDCBBBBF EDEEEFCAABB BBBBAAEEFFF FBBDDDFABCB EEEEDEAAACE AABBCDDEEFF FFFFBBBBBBB
272,BBBBBBDFFFF EEEFFFAAABB ADFFEDBABCC AADFFFDBBDB BEDBCABEDEF CCCDDDDDEEA AABBCDEEEFF
273,EEEEECBBAAF FECBBBDABCC BBBBAADEFFF FFFEDCCBBAA FEEEEDBBAAC AAABDEEEEEF EEFFFDAAABB
274,EFEEEDCBBAA AEFDCCDFCCC CBBBBBBCFFF FFFEDCBBBAA FDCDBBBBBDF AAABEFEEDEE FFFFFABBBBB
275,EEEDDDCBBBC BBAABBCFFFF EEEEDFCBAAA ADBBEFDCDDC DEDDBBBDBEF BCADDDEDCDF AAACEEEEEEE
276,EFEEEDCBBAA EDEEEEFAAAA BBBAAAEEFFF FFBADCDDDCA CDDBCCBBBEF AABBCDDEEFF EEEEEEEAAAA
277,EFEEEDCBBAA ADDEEEFEABB BBBBBACEFFF FBAAADFEEDD DECDBBBACEF AAABCDDEEFF FFFCBBBBBBB
278,EEEEEEDBAAA BACCDDEFFEA FFEEDDDCAAA EDEEFEBABBB DDDCBEEECBB ACDDDDDDDDE AAABCDEEFFF
279,DDDDDCCBBBF EDEEEEEAAAA BBAAAEEEEFF AAABCCDEEFF AACDEDDEEED FBAABCCCDEF FABBCCDDDEE
280,BBBBBBDFFFF EDEEEEDAAAA DFFFECBABBB AACDDEFCEBE ECABBCBBCEF AABBDDDEEEF FFABBCCCCDD
281,DEDDDCCBBAF EDEEEFCAABB BAAAAEEEEFF FEDBBCACCCD FFCCCBBABCF AABBCDDEEFF FBBBBCCCDDD
282,EEEEEEDCBAA BAAACCDEFFF FEDDDDDCBAA ABEFFBCBBCD AABDEEEEEED ADDDDDDDDDD AAABCDEEFFF
283,EFEEEDCBBAA BDEEEEEDAAA CBBBBABEFFF AABBCCEEFFF ABABCDDDEFF EEEFFECBAAA DDDEEEEEAAA
284,EEEEEDCBBAA ACDDEEEFBAA CBBBBBBEFFF EDEEEABCBCC DDFDABBADFF AAABCDDEEFF AAABCDEEEFF
285,EFEEEDCBBAA ABFECCDEFCC CBBBBBBDFFF FFEEDCBBBAA FFECBBBABDD AAABDEEEEEF EEFFFCAAABB
286,EEEEEEDBAAA BABBBBCEFFF EEEEEEDBAAA FFEEDCBAABB FFEBBBBBBCF AAABBCEEFFF AABBBBFFFFF
287,CDDCCCBBBBF EDEEEECAAAB BAAACEEDEFF AABBCDDEEFF DEDDDDDDDCA DDDDDDDDDDA AABBCDEEEFF
288,EEEEEEDBAAA DFBBBBBCDEE EEEDDCCCFAA AABCDEFDEDE CCABCCDDDEF AACCDDCCCEF AAABBBEFFFF
289,EFEEEDCBBAA AEFDCCDFCCC CBBBBBBCFFF FFFEDCBBABA FEDBBAABDEF AAABCDEFFEF EEEEEEDAAAA
290,EFEEEDCBBBA ADDEEEFEAAB BBAAACEEFFF ECFFFFBBAAA ABDDCCDBBEF AABBCDDEEFF EEEEEEEDAAA
291,CCCCBBBBFFF FEDAABBCDDF FFFEDBAABDD DEEDDCAACEF EDEDCCBBBCE FDCCCCCCCCC AABBCDEEEFF
292,EFEEEDCBBAA EDEEEEFAAAA CCBBBBBBFFF AABBCCDEFFF AABBCDDEEFF EEFFFCAAAAB EEEFFDAABBB
293,BBBBBBDFFFF EDEEEECAAAA ACFFEDCBCDD DAABEEDFDCF BFEEABBCCDF AABBDDDDEFF FBABBCCDDDD
294,DDDDDCBBABF FECCCCBABCC BAAACEEEEFF FFEDDDDBBAA BCEBBBBCEEF ABCCCCDEEEF FFBBBBCCCCC
295,EFEEEDCBBAA ACDEEEEFCBB BBBBBACEFFF FFEBAACDDDC DEEEFAABADE AAABCDDEEFF FFFFCBBBBBB
