,0
0,AAAAABCDDDD CCCCCCDDAAA AAACDDCCCCC AABDDCCCCCC CCBBBBBABCD AAABCCCCCDD DDDDDCAAAAA
1,DDDDCCCBBAA AAAAABCDDDD DDDDCBBAAAA DDCCDBAAAAB CCBCAAABCDD AABCDCBBBCD ABCCCCCCCCC
2,DDDDDCCAAAA CBAAAABCDDD CCCBBBBDBAA BBCCDBDBCAB BBBBBDBCCCD AACCDDABCAD AAABBCCCCCD
3,CCCCCBBAAAD DDCCBBBAABB BAAAAACDDDD DDDCCBBBAAA DCAAAABCCDD AABBCCCCCDD DBABBBBBBCC
4,DDDDDCBAAAA ADCBBBCCBBB BBAAAABCDDD DDDDCCBBAAA DCDBAAAABCD AAACCCCCCCD DDDAABBBBBB
5,DDDDDCCAAAA DBAAAABCDDD CCCCBBDDAAA CCCBBAACDDC AAABBCBBDDD BBCBDBCBABD AAAAADDDDDD
6,DDDDCCCBAAA AAAABBBDDDD DDDDDBBAAAA DDDDCCBAAAA ABBABBCCCDD AABCCCCCCDD AABCCCCCCCC
7,DDDDCCCBBAA AAAABBCDDDD DDDDDCBAAAA DDDDBABAABB CCCCAADDAAC AAAABCDDDDD AAAAAADDDDD
8,DDDDDCBAAAA ACCDDDDCAAA BBAAAACDDDD AAABCCCCDDD AAABBCBCDDD CDDDDDBAAAA CCCCCDDDAAA
9,AAACDDDCCCB DCAAAABCDDD DDDDCBAAABB BAAAACCDDDD CBBBBBBBBCD DDCBBBBBBBB AAABBCCDDDD
10,CCCCCBBAAAD DDBBBBAABCC AAAABCCCDDD DDDCCBBAAAA DCCABBBBABD AABCCCCCCCD DDBABBBBBBB
11,DDDDDCCAAAA DCBBBBBBCCC DCCCCBBDAAA AAABBBDDDDD AAAAABDDCBD AAABBCCCCCD AAAABBCDDDD
12,DDDDDCBAAAA AACCCCCDDBA CBBBBAAACDD AAABBCCCDDD AAABBBCCDDD CCDDDDCAAAA CCCDDDDAAAA
13,AAAAABCDDDD CCCCCCDDAAA AAACDCCCCCC AACDCBDBDCB BBBBBBBBCDD AAABBCCCDDD DDDDDCAAAAA
14,DDDDDCCBAAA AAABBBCCDDD DDCCCCCBAAA AAABCCDDDDD BAABCCCCCCD AAACCCCCCCC AAABBCCDDDD
15,CCCCCBBAAAD DCDDDBAABBB AAAAADCCDDD CBCBBCDBABA CBBACDABACD CCCCCCCCCAA AAABBCCDDDD
16,DDDDDCBAAAA CCDDDDDAAAA BBBAAAACDDD AAABBCCCDDD AAABCCDCCDD DDDDCAAAAAB DDDDBAAAAAB
17,DDDDDCBAAAA ABDCCBCDDBB BBBBAAABDDD CDDDCCBAAAA DDDDCCAAAAA AAAABBDDDDD CCCDDDDAAAA
18,DDDDDCBAAAA ABCCDDDDBAA BBBAAAACDDD AAABBCCCDDD AAABBBBCDDD DDDDDCAAAAA CCDDDDCAAAA
19,DDDDDCBAAAA CCCCDDDAAAA BAAAAADDDDD BCCCDCCBBAA CBBBBABBBDD AAAABCCCDDD DDDDBAAAAAA
20,AAAAABCDDDD CCDDDDDAAAA AACDDCCBCCC BABCDBDDCBB CCDCCCBBAAD CCCCCCCCCCA AAABBCCDDDD
21,CCCCCBBAAAD DCCDDDBAAAA AAAABDCCDDD DBBBDDCABAA CCCDBABAACD AAABBCCCDDD DDAABBBBBBB
22,DDDDDCCAAAA CBAAABBCCDD DDDDCCCBAAA CDDCCCBAAAA DDDCCCCBAAB AAAABBCCDDD AABBBBBBCCD
23,DDDDCCCBBAA AAAAABBDDDD DDDDDBBAAAA DDDDCABAAAA BBBBBABBBDD BBBBBBBBBDD AABBCDDDCCA
24,DDDDCCCBBAA AAAABBBDDDD DDDDCBBAAAA BBABCCDDDAA AABBBBCCCDD AABCCCCCCDD AACCCCCCCCC
25,CCCCCBBAABD DCDDDDAAABB AAAAABDCDDD DBBBABACCCC DDDDBAAAABD AAABBCCCDDD DBABBBBBCCC
26,BBBBBACDDCB DCBAAABCDDD AABDCCCBCDD DDCCBCCBAAA BBBBBBBBBCD DBAAABBCDDD AAABBCCDDDD
27,DDDDDCCBAAA AAAABBBDDDD DDDDDBBAAAA ABCDCDBBBBA CDBCDBBABAD AABCCCCCCCD ACCCCCCCCCC
28,DDDDDCBAAAA AACCCCCDDBA BBBAAAACDDD AAABBCCDDDD AAABCCCDDDD DDDDDBAAAAA DDDDDCAAAAA
29,DDDDCCCBBAA AAAABBCDDDD DDDDDBBAAAA DDDCBBCBBAA ADBBBBBBBCD AABCCCCCCCD AAACCCCCCCC
30,DDDDCCCBAAA AAAABBBDDDD DDDDCBBBAAA CDCCDCBBBBA BBABBBBBBDD BBBBBBBBBDD AAABBCCDDDD
31,AAAAABCDDDD CCCDDDDCAAA AABDDCCCCCC CAAAACCDDDC ABABBBBCDDD AAABCCCCCDD DDDDAAAABBB
32,DDDDDCCAAAA BDBABBBBCCC DDCCCBBCCAA ACCABACDDDD CCCCABBACAD AABBDCBBCCD AAABBBCCCDD
33,BCCBBBBAABD DCDDDDAAAAA AAAAADDCDDD AAABBBCDDDD AAABCCCCCDD DDCAAABBBBC DDBAABBBBBB
34,DDDDDCBAAAA ABCCCCDDBAA BBAAAABDDDD CBBBBCCDDAA BAAACCBBBDD AAABBCCCDDD DDDDAAAABBB
35,AAAAABCDDDD CCDDDDDAAAA AACDDCCBCCC BCBCDDCCAAA AABDDDBBBBC AAABCCCCDDD DDCAABBBBBB
36,CCCCCBBAAAD DDBBBBAABCC AAAAACCCDDD DDCCBBBBAAA BABBCAABDDD AABBCCCCCDD DBABBBBBBCC
37,CCCCCCBBABB BAAAAACDDDD CCCCCDBAAAA CBBACABDDDD BAACCCCCCCD BBCCDCBABCD AABBBBBBBDD
38,CCCCCBBAAAD DCCDDDBAAAA AAAAABDCDDD DACCBDCDBAA CBCCBBAABCD AAABBCCCDDD DDDDDCAAAAA
39,DDDDDCBAAAA CCCCDDDAAAA BBAAAABDDDD DAAABDBCCCC CDCCBCAABCD AAAABCCCDDD DDDDBAAAAAA
40,DDDDDCBAAAA ACCDDDDCAAA BAAAAACDDDD AAABBCCDDDD AAAAABCCDDD CDDDDCBAAAA CCCDDDDAAAA
41,DDDDDCCAAAA AAAABBBDDDD DDDDDBBAAAA DDCDDBBBBAA AABBBBBCDDD AAAAAADDDDD AAABBCCDDDD
42,AAAAADDDDDC DCDDCAAABCD DDDDCBAAABB CBABCDDDBAA BCCCBAAAADD DDDDBAAAAAA AAABBCCDDDD
43,DDDDDCBAAAA CCDDDDDAAAA AAAAACDCDDD AAABBCCCDDD AABCDCCCCCC DDCAAAABBBC DDBAABBBBBB
44,DDDDCCCBBAA AAAAABBDDDD DDDDDBBAAAA CDDDDCBBAAA CBBBBBABBCD BBBBBBBBBBD AAABBCCDDDD
45,DDDDDCCAAAA BAAABBBCDDD DDDDCCCBAAA DDCDDCAAAAB CCCCDDBAAAD AAAABBCDDDD AAAAABCDDDD
46,AAAAABCDDDD CBCCCCCDDAA AAABCDDCCCC AAABCCDDCDD CBBBABAACDD AAABCCCCCDD BBBCCCCDDCA
47,CCCCCBBAAAD DDBBBBAABCC BAAAAACDDDD DDDDCBBAAAA DDBAABBABBD AABDCCCCCCD DDDBAABBBBB
48,CCCCCBBAABD DCDDDDAAABB AAAAADCCDDD DCBAACABDDD CCCCBBAAACD AAABBCCCDDD DAABBBCCCCC
49,AAAAABCDDDD DCDDDDCAAAA ABDDDCBBBCC ABAACCBCCDD DBCDCBAAABD AAABCCCCCDD DAAABBCCCCC
50,DDDDDCBAAAA ABCCCCDDDAA BBBAAAACDDD CCBBABDDBBB DDDCCCBAAAC AAABBCCCDDD DAABBBCCCCC
51,DDDDDCBAAAA ACCCCCDDBAA BBBAAAABDDD CABCDDDAAAB CCCCAABABCD AAABBCCCDDD AAABBCCDDDD
52,CCCCCBBAABD DCDDDDAAABB AAAADDCCDDD DCBBBBBDCAA DCCCBBCAACD CCCCCCCCCCA AAABBCCDDDD
53,DDDDDCCAAAA CBAAAABCDDD CCCCCCDBAAA AAABDDCCDCC AABCCDABDBD AABACBBCCDD AABCCCCCCCC
54,DDDDDCBAAAA ABDCBBCDDBB BBBBAAABDDD CDDDDCBAAAA DDCCCBAAABC AAAABBCDDDD CCCCDDDCAAA
55,CCCBBBBAACD DDDDAAABBCC ADDDCBAABCC DDDDAAAAABB BBAAACCDDDC DDDDAAAAAAA AAABBCCDDDD
56,AAAAABCDDDD CCCDDDDBAAA AACDDCCBCCC ACCCCDDABCA ABCDCCCAABD AAABCCCCDDD DDAAABBBBBB
57,CCCCCCBAAAD DDBBBBAABCC BAAAAACCDDD DDDCCBBAAAA BAABBBBBBCD CCCCCCCCCCA AAABBCCDDDD
58,DDCCCCCBBAA AAAABBBDDDD DDDDDCBAAAA DDCDDAAAABB AAAAAABCDDD AAAAAACDDDD AAABBCCDDDD
59,AAAAABBDDDD CBCCCCCDCAA AAABDDCCCCC AAABCDCCDDD AABCCBCBCDD AAABCCCCDDD DDDDDCAAAAA
60,CCCCCBBAAAD CCDDDDCAAAA AAAAADDCDDD AAABBCCDDDD BBCCDDBBCCA DBAABBBBCCD DAABBBCCCCC
61,CCCCCBBAAAD CCDDDDCAAAA AAAAADDCDDD AAABBCCCDDD CCCCCCCCCBA CCCCCCCCCAA AAABBCCDDDD
62,DDDDDCCAAAA AAAABBBDDDD DDDDCCCBAAA DDDDBBBAAAA DDAAABBBBCD AAAACCCCDDD AAAAAADDDDD
63,CCCCCBBAAAD DCCDDDBAAAA AAAAABDCDDD DBBBBBAACDC CCCBBBAAADD AAABBCCCDDD DDBAABBBBBB
64,CCCCCBBAAAD DCCDDDBAAAA BAAAAADDDDD CABBCAADDDB CBBBBABCBCD AAABBCCCDDD CCCCDDDCAAA
65,BBBBBBBAADD DCDDDDAAABB AAAACDCCDDD DABCBCDCABB DDCCCCAAABD AAABBCCCDDD DDBAABBBBBB
66,DDDDDCCBAAA AAAABBBDDDD DDDDDCAAAAA DDCCDAAAAAB CCDDDDAAAAD AAAABBCDDDD AAAAABCDDDD
67,DDDDDCBAAAA ABCCCCDDDAA BBBAAAABDDD CCDBACCCCBA BCAACBBBBDD AAABBCCCDDD CCCCDDDCAAA
68,DDDDDCCAAAA DBAAAABDDDD DDDCCCDBAAA CCCCABABDDB BDDDCAAABBD AACCBBBBCDD AAAAABDDDDD
69,DDDDDCBAAAA CCCCDDDAAAA BAAAAADDDDD DDCCDBCBAAA BBAAACCBCDD AAABBCCCDDD DDDDDDAAAAA
70,DDDDDCCAAAA CBAAAABDDDD CCCCCCDBAAA ABACDBBCBDC CCBCBCDBBBA BBCCBABACBD AABBBBBBBDD
71,DDDDCCCBAAA BBAAAABDDDD DDDDDBBAAAA CBBBBBBCBDD BCCCCBCBBCA AAABDBBCCDD AAAABCCDDDD
72,CCCCBBAAADD DDBBBAABCCC AAAABDCCDDD DDDCCBBAAAA BBBBABBBCCD BAAABBCDDDD AAABBCCDDDD
73,DDDDDCBAAAC CCDDDDDAAAA BBAAAACDDDD AAABBCCDDDD AAABBCCCDDD DDDDDCBAAAA CCCDDDDAAAA
74,AAAAABDDDDD CCCCCCDDAAA AAACDDCCCCC AABCDDDBBCB BDCBBBAABCD AAABCCCCCDD DDDDAAAABBB
75,DDDDDCBAAAA CCCCDDDAAAA BBBAAAACDDD AAAACCDDDCC DBCBABBABCD AAABBCCCDDD CDDDDDCAAAA
76,CCCCCBBAAAD DCDDDBAABBB AAADDCCBCDC DCCDCAABBBA CCBBAACCACD CCCCCCCCCCA AAABBCCDDDD
77,CCCCCBBAAAD CCDDDDDAAAA AAAAADDCDDD AAABBCCDDDD AABBCDBBCCD DDCAAAABBBC DDBAABBBBBB
78,DDDDDCBAAAA BDBABBBBCCC CCCCBBBDDAA ABCDCBAACCD ABBBBBDBBCC AABBBCCCCDD AAAABBDDDDD
79,DDDDDCBAAAA DDCBBBCAABB BAAAABCDDDD DDDCCCBAAAA BABAAABCDDD AABCCCCDDDD DDDAABBBBBB
80,AAAAABCDDDD BBCCCCCDDAA AAABCDDCCDD AAABCDDCCCC BCBABABBBDD AAABCCCCDDD CDDDDDAAAAA
81,AAAAADDDDDC DCDBAAABCDD DDDDCBAAABB AABCBBDDDDC BCBABAABDDD DDDBBBBBBBB AAABBCCDDDD
82,AAAABCDDDDC DCDDAAAACDD DDDDCBAAABB AAACCCDCDCC BCDBABBBBDD DDDCAAAAAAB AAABBCCDDDD
83,CCCCCBBAABD DDDDCAAABBB ACDDCCBBCCC DDDDCCBABAA DCCCCCCAABD DDDDCAAAAAA AAABBCCDDDD
84,AAAAABCDDDD CBCCCCCDCAA AAABDDCCCCC ABBAABCDDDC BBBCAACCCBD AAABCCCCCDD DDDDDBAAAAA
85,AAAAABCDDDD CBCCCCCDDAA AAABDDCCCDD AAABDCCDDCC CDDCCBAAABD AAABCCCCCDD AAABBCCDDDD
86,AAAAABBDDDD CCDDDDDAAAA AACDDCCBCCC DDDCBCBAABA AABCCCBBCDD AAABBCCCDDD DDDAAABBBBB
87,CCCCCBBAAAD DDBBBBAABCC BAAAAACDDDD DDDCCBBAAAA DCCBBBAAACD AAACCCCCDDD DDAABBBBBBB
88,DDDDDCBAAAA ACDCBBBCDBB BBBBAAABDDD DDDCCBBAAAA BBCBAAACCDD AAAABCDDDDD DDDDDDAAAAA
89,AAAAABCDDDD CCCCCCDDAAA AAACDDCCCCC AABABCBDDDD BCCCACBBABD AAABCCCCDDD DDDAAABBBBB
90,BBBBBBAADDC CCBAAABBCDD DDDDBBAABCC DDAACCACDCB CCCCBBBBBBD DCBBBBBBBBB AAABBCCDDDD
91,DDDDDCBAAAA ADCBBBCCBBB BBAAAABCDDD DDDDCBBBAAA DDDCBBBAABB AAABCDDDCCD DDDDBAAAAAA
92,AAAAABCDDDD CBCCCCCDCAA AAABDDCCCCC AABCCDDBCCD BBBBBDAACCD AAABCCCCCDD CDDDDDAAAAA
93,AAAABDDDDDC DCDDDAAAACC DDDDCBAAABB ACBDDCDCBBA CBBBABBBBCD DDDDCAAAAAA AAABBCCDDDD
94,CCCCCBBAABD DCDDDDAAABB AAAABDCCDDD DCCBBABCCAA CDDCCCBAABD AAABBCCCDDD DAABBBCCCCC
95,DDDDDCBAAAA ACCDDDDCAAA BBBAAAACDDD AAABBCCCDDD AAABCBCDDDD DDDDCBAAAAB DDDDDAAAAAA
96,AAAAABCDDDD CCDDDDDAAAA AACDDCCBCCC AAAABBBCDDD CDACBBAACDC AAABCCCCDDD DDDDDAAAAAA
97,DDDDCCCBBAA AAAAABCDDDD DDDDCBBAAAA CDDDDCCBAAA BBAABCCACCD BBBBBBBBBCD AAAABCCDDDD
98,DDDDDCBAAAA CCDDDDDAAAA BAAAABDCDDD AAABBCCDDDD AAABBCCBCDD DDCBAAABBBC DDBAABBBBBB
99,BBBBBBAABDD DDDDDAAABBB AAAACDCCDDD DBBBAAADDDC DDBBBBAAACD AAABBCCCDDD DDBAABBBBBB
100,AAAAABCDDDD CBCCCCCDDAA AAABDDDCCDD AAACBDDCCDD BCCBBBBAACD AAABCCCCCDD DDDDDCAAAAA
101,DDDDCCCBBAA AAABCCCDDDD DDDCCCCBAAA BABBADCBCCD BACBCBCCDCD AACCCCCCCDD AAABBCCDDDD
102,DDDDDCCBBAA AAAABBCCDDD DDCCCBBBAAA DCDCBBDBBAA DDCCDCCCBAA AAACCCCCCDD AAABBCCDDDD
103,BBBBBAABDDD DDBAAAABBCD DDDDBBAABCC DDCBBBBBBAA CCCCCCCCAAA AABBCCBBBCD AAABBCCDDDD
104,DDDDDCCBAAA AABBBBCCCDD DDDDCCCBAAA DCCAACBABCD BBBBCCBBBCD AACCCCCCCCC AAABBCCDDDD
105,DDDDDCCAAAA BAAAABBDDDD DDDDDCCAAAA AAABBCDDDDD CCCCCCDABAC AAAABCCCDDD AAABBBBBDDD
106,DDDDCCCBBAA AAAAABCDDDD DDDDBBBBAAA DDDDCBBBBBA BBBBBBBBBCD BBBBBBBBBBD AAABBCCDDDD
107,DDDDDCBAAAA CCCDDDDAAAA AAAAABDCDDD DAABBBDCBCB DDCCABAAABD DDDDDDCAAAA AAABBCCDDDD
108,DDDDDCCAAAA CBAAAABDDDD CCCCBBDBAAA ACAAABCCDDD CCAAABCCCDD BAAACCCCCCD AAAAADDDDDD
109,DDDDDCCAAAA BAAABBBCDDD DDDDCCCCAAA DDCDBBBAAAA CDDDCAAAABD AAAABBCCDDD AAAABBBDDDD
110,CCCCCBBAAAD CCDDDDBAAAA AAAABDDCDDD AAABBCCDDDD AABCDCBCCDC DBAABBBBCCD DAAABBBCCCC
111,DDDDDCBAAAA AACCCCDDDAA BBBBAAABDDD AAABBCCDDDD AAABBBCCDDD BBCCDDDDBAA AAABBCCDDDD
112,DDDCCCCBBAA AAAAABBDDDD DDDDCBBBAAA CDCCDDDAAAA AACBCCBBBCD AACDCCBBBCD ABCCCCCCCCC
113,CCCCCBBAAAD DCCDDDBAAAA AAAACDCCDDD DBBBBBDDAAB CCDDCBAAACD AAABBCCCDDD AAABBCCDDDD
114,DDDDDCBAAAA AACCCCDDDAA BBBBAAABDDD BBBBABDDDDA BCACCCBBADD AAABBCCCDDD DDDDBAAAAAA
115,DDDDDCCBBAA AAAABCCCDDD DBBBBBBBBBB ABAABDCDDDD CBCBBDCCABA AAACDDDDCCC DDDCCCCBAAA
116,DDDDDCBAAAA ACCCCDDCAAA BBBBAAABDDD AACCCCDCBBB DDDCDAAAABD AAABBCCCDDD DDDDDCAAAAA
117,AAACDDDCCCC DDDDBAAAABC DDDDCBAAAAA AAAADCDDCCB BBBBCBAABDD CCCCCCCCCAA AAABBCCDDDD
118,AAAAABCDDDD CCDDDDDAAAA AACDDCCBCCC BBBDDBAABBD CAABABCCCCD AAABBCCCCDD DDAAABBBBBB
119,DDDDDCBAAAA ADCBBBBDBBB BBBAAAACDDD DDDDCBBAAAA DDCBBBBBAAD AAABDDCCCCD DDDDBAAAAAA
120,DDDDDCBAAAA DDCBBBCAABB BBAAAABDDDD DDDCCBBBAAA DDDDBBBAAAB AAAACCCDDDD DDDBAAABBBB
121,DDDDDCBAAAA ACCCCDDCAAA BBAAAABDDDD DCCCBAABBBC DCBBBBAAACD AAABBCCCDDD DDDDDAAAAAA
122,CCCCCCDCAAA BBBBBBBBDDB DDDDCCBBAAA AAABBBBDDDD ABAACBCCCDD ABCCCCCCCCC AAABBCCDDDD
123,DDDDDCBAAAA ABCCDDDDBAA BBBAAAACDDD AAABBCCDDDD AABBBCCCCDD DDDDDBAAAAA DDDDDAAAAAA
124,DDDDDCCBBAA AAAAABCDDDD DDDDBBBBAAA DDDCBBAAAAB BBBBBBBBCCD AABCCCBCCDD ABCCCCCCCCC
125,DDDDDCBAAAA AACCCCDDDAA BBAAAABDDDD AAAABCCDDDD AAABBBCCDDD CDDDDCBAAAA CCCCDDDCAAA
126,CCCBBBBAABD DCDDDDAAAAA AAAABDCCDDD AAABBCCDDDD BCCCCCCCCCA CCCCCCCCCCA AAABBCCDDDD
127,DDDDDCBAAAA CCDDDDDAAAA BBAAAABDDDD AAAABCCDDDD AAABBCCCCDD DDDDCAAAAAB DDDDDCAAAAA
128,DDDDDCBAAAA ACCCCDDCAAA BBBAAAADDDD DBBBBCDDBAA BBBCABABCDD AAAABCCCDDD DDDDBAAAAAA
129,BBBBBAABDDD DDCAAAABBCD DDDDCBAAABB AAABCCCCDDD ABBBABBBCDD DDBBBBBBBBB AAABBCCDDDD
130,DDDDDCCAAAA AAAABBBDDDD DDDDDCBAAAA DDDBCCDAAAA BCCCCADAABD AACCCCBBBCD ABBBCCCCCCC
131,DDDDDCCBBAA AAAABBCCDDD DDCCCCCBAAA DBCCDDDAAAA CBBBBBBBBCD AAACCCCCCCC AAABBCCDDDD
132,CCCCCCBBAAD BBAAAABDDDD CCCCCCDAAAA BCABBBBBBDD ABBBBBBBCDD ABBBCDDABCD AAAAADDDDDD
133,BBBBBBAACDD DDDAAAABBCD DDDDCBAABCC DCCCBABBBBA CCCCCCCCCBA AABBCCBBCCD AAABBCCDDDD
134,AAAAABCDDDD DCDDDDCAAAA ABDDDCBBBCC AAABCDDDCDC CDBBBBAAACD CCCCCCCCCCA AAABBCCDDDD
135,BBBBBBAADDD DDDAAAABBBD DDDDCBAAABB DDDCBBBBAAA CCCCCCAAADD DDBBBBBBBBB AAABBCCDDDD
136,BBBBBBAAADD DDDDAAABBBB ADDDCBAABCC AAABBCCDDDD DDDCBAAAAAA DDBBBBBBBBB AAABBCCDDDD
137,DDDDDCBAAAA ABCCCCDDBAA BBAAAABDDDD DBCBCCBBBCA CCCCBBAAACD AAABBCCDDDD DDBAABBBBBB
138,AAAAADDDDDC DDCAAABCDDD DDDDCBAAABB AABCDDBACCD BAAABCCDCCD DDBBBBBBBBB AAABBCCDDDD
139,BBBBBBAABDD DDDDDAAABBB AAACDCCCCDD DDCAACCDBAB DDCCCCCAAAC CCCCCCCCCAA AAABBCCDDDD
140,DDDDDCBAAAA AACCCCCDDBA CBBBBBBAADD AAABBCCDDDD AAABBCCCDDD CCCDDDDBAAA CCCCCDDDAAA
141,CCCCCBBAAAD DCCDDDBAAAA AAAACDCCDDD DDCCAABBDBB CDDDCCBAAAC CCCCCCCCAAA AAABBCCDDDD
142,DDDDDCCAAAA BDBABBBBCCC CCCCCBBCDAA AAABCCCCCDD DCCCDCAAABC AAABCCCCCCD AAABCCCDDDD
143,BBBBBABDDCC CBAAAABBCDD DDDDBBAABCC DDCCCBBBAAA CCCCCCCCCBA DBBBBBBBBBB AAABBCCDDDD
144,BBBBBBAADDD DDDAAAABBCC DDDDCBAAABB DDCCDCBBAAA BBBBCCBBBCD DDCBBBBBBBB AAABBCCDDDD
145,DDDDCCCBBAA AAAABBBDDDD DDDDDCBAAAA DDCDBABAABB ABBBBBCCCDD AAAABCCDDDD AAAAABCDDDD
146,DDDDDCBAAAA ACCDDDDCAAA BBAAAACDDDD AAABBCCDDDD AAABBCCCDDD DDDDCAAAAAB DDDDDCAAAAA
147,DDDDDCCAAAA BAAABBBCDDD DDDDCCCCAAA DDBCCDBAAAB ABBBBBBBCDD AAAABCCDDDD AAAAADDDDDD
148,DDDDDCCBAAA AAAABCCDDDD DDDDDBBAAAA DDDCCCBAAAA ABBBBBBBDDD AAABCCCCDDD AAABCCDDDDD
149,DDDDDCBAAAA DDCBBBCAABB AAAAABCCDDD DDDCCBBAAAA CBBAAABCCDD CCCCCCCCCCA AAABBCCDDDD
150,CCCCCCBAAAD BBAAAABDDDD CCCCCCDAAAA BCACBBADDBC AAAACDDDBDC CCDCBCAAABD AAAAABCDDDD
151,BCCBBBBAABD CCDDDDBAAAA AAAAADDCDDD AAABBCCDDDD AAACCDDCBCD DDDBAAABBBB DDDAABBBBBB
152,DDDDDCCAAAA CBAAAABBDDD CCCCCCBDAAA BBACCDAACCC CCCBCACCCBB AABACDCACBD AAAACDDDDDD
153,DDDCCCCBBAA BAAAAACDDDD DDDDDBBAAAA DCBABACCBCC DACACAADBBC ABBBBBBBCDD AABCCCCCCCC
154,DDDDDCCAAAA CAAAAABDDDD CCCCBDCBBAA AAABDCCCCCC AACBDCAABCD BBCBACABCCD AAABBBBCCDD
155,CCCCCBBAAAD DDBBBBAABCC AAAAABCCDDD DDCCBBBBAAA DBCBCCABBCC AAABCCCCCDD DDDDBAAAAAA
156,DDDDDCBAAAA CCDDDDDAAAA BBBBAAABDDD AAABBCCDDDD AAABBBCCDDD CCCDDDDBAAA BBCCCCCCDCA
157,AAAAAABDDDD DCAAAABBCDD DDDDCBAAAAA AAABBCCCDDD AAAABBBCCDD AAABCCCCDDD AAABBCCDDDD
158,DDDDDCBAAAA CCCCDDDAAAA BAAAAADDDDD DDBBBCBBBBB BCBABBBABCD AAABBCCDDDD DDDDBAAAAAA
159,DDDDDCCBBAA AAAAABCDDDD DDDDDBBAAAA AAABDDDCCDC DDDBBBAAACD AAABCCCCCDD AAACCCCCCCC
160,DDDDDCBAAAA AACCCCCDDBA CBBBBAAACDD AAABBCCCDDD AAABBCCCDDD CDDDDCBAAAA CDDDDDAAAAA
161,DDDDDCCBAAA AAAABBBDDDD DDDDDCBAAAA CDDDBBCAAAB CDBAABBBBCD AABCCDCCCDD AABCCCCCCCC
162,DDDDCCCBBAA AAAABBBDDDD DDDDDBBAAAA DDDCCBBAAAA CBBBBBBBCCD ABCCDCBBBCD ACCCCCCCCCB
163,CCCCCBBAAAD CCDDDDDAAAA BAAAABDDDDD AAABBBCCDDD AAABBCDCCDD DDDDBAAAABB DDDDBAAAAAB
164,DDDDDCBAAAA ABDCBBCDDBB BBBAAAABDDD CDDDDCBBAAA BAABBCDCDCD AAAACDDCCDD DDDDDAAAAAA
165,AAAAABCDDDD CBCCCCCDCAA AAABDDDCCCC AAABCCDDCCB BBCCCCAAACD AAABCCCCCDD BBCCCCDDDAA
166,BBBBBAABDDD DDBAAAABCCD DDDDCBAABCC DDDDDBAAAAA CAABBBBCCDD DDBBBBBBBBB AAABBCCDDDD
167,DDDDDCCAAAA BAAABBBCDDD DDDDCCCBAAA CCCDDCBBAAA BBBCDCCCAAD AAAABCCDDDD AAAAACDDDDD
168,BBBBBBBAADD DCDDDBAAABB AAAACDCCDDD AAABBCCCDDD CCCCCCCCCBA DAAABBBCCDD AAABBCCDDDD
169,CCCCCBBAAAD CCDDDDDAAAA BBBAAAACDDD AAABBCCCDDD AAABBCCCDDD DDDDCAAAAAB DDDDDAAAAAA
170,DDDDDCBAAAA AACDCBCDDCB BBBBBAAACDD ABDDDCCCBAA DDDDCBBAAAB AAAABCDDDDD DDDDDDCAAAA
171,CCCCCBBAAAD DCCDDDBAAAA AAAADDCCDDD CCCBCCCDBAA DDCCBCBAABD AAABBCCCDDD DBABBBBBCCC
172,DDDDDCBAAAB BBAAAABDDDD DDDDDCAAAAA DCBCCBABCCB ABACCCCCDDA AABBDCCBCCD AABCCCCCCCC
173,DDDDDCCAAAA DBAABBBBCCC DDDCCCBCBAA AAABBCCDDDB CDDCAAAABCD AAABDCCCCDD AAAAADDDDDD
174,AAAAACDDDDD DDDAAAABCDD DDDDCBBAAAA ABCCBCBADDB DCAABACBCCD AAABCCCCCDD AAABBCCDDDD
175,CCCCCBBAAAD CCDDDDCAAAA BAAAABDCDDD AAAABCCDDDD AABCCDDBBCC DCAAABBBCCD DAAABBBCCCC
176,DDDDDCBAAAA AACCCCDDDAA BBBBAAAADDD AAABBCCCDDD AAABBCCCDDD CDDDDDBAAAA CCCDDDDAAAA
177,DDDDDCBAAAA ADCBBBCCBBB BBBBAAABDDD DDDDCCBAAAA DCCBCBAAABB AAAABDDDCCD DDDDDCAAAAA
178,CCCCCBBAAAD DDBBBBCABBB AAAAABCCDDD DDDDCBBAAAA DBCCBAAABDD AABCCCCCDCD DDDAABBBBBB
179,DDDDDCCAAAA DAAAAABCDDD CCCCBBBDBAA AADDDDDBABB AABBBCDDDDD AABBDCBBBBD AAABBBCCCDD
180,AAAAABCDDDD CCCCCCDDAAA AAACDDCCCCC AAABCDDCCDC ABBABCCBCDD AAABBCCCDDD DDDDBAAAABB
181,AAAAABCDDDD CCDDDDCAAAA ABDDDCBBBCC BABDCCDABDC AABACBBCDCD CCCCDDDCAAA AAABBCCDDDD
182,AAAAABCDDDD CCDDDDDAAAA AACDDCCBCCC ABDDCBACCCB AAABBCBBCDD AAABBCCCDDD CCCCDDDCAAA
183,DDDDDCBAAAA ABCCDDDDBAA BBAAAABDDDD AAAABCCDDDD AABBBBCCDDD CDDDDCBBAAA CCCCCDDDAAA
184,DDDDDCCAAAA AAAABBBDDDD DDDDCCCBAAA DDCCDDBBAAA ABBBCCCCDAC AAAABCCDDDD AAAABDDDDDD
185,DDDDDCCAAAA CBAAABBCDDD DDDDCCCBAAA DDDCCCBBBAA DDBAAABBBCD AAAABBBCDDD AABBBBBBCCD
186,DDDDDCBAAAA ACCCDDDCAAA BBAAAABDDDD DCCBACDABBB BBBCCCCBBBD AAAABCCCDDD DDDDAAAABBB
187,DDDDDCCAAAA CBAAAABDDDD DDDDCDBAAAA DBCCAAAACDC DCBABDBCBCD ABACDCCBCCC AABCCCCCCCC
188,AAAAAACDDDD CCDDDDDAAAA ABDDDCCBBCC AAABCDCCCDC ABBCAABBDDD AAABCCCCCDD DDAABBBBBCC
189,AAAAABCDDDD CBCCCCCDCAA AAABDDDCCCC AAACCCDDCBC ABBBBDBBBBD AAABBCCCDDD CCCCCDDDAAA
190,DDDDDCBAAAA ACCCCCDDBAA BBBBBAAADDD AABBBBBDDDD DBCCCBBBCAD AAABBCCCDDD BCCCCCCCCCA
191,AAAAABCDDDD DCDDDDBAAAA ABDDDCBBBCC ADCACCCCBBC BBCBBCCBABD AAABCCCCCDD DDDAAABBBBB
192,AAAAABCDDDD CCDDDDDAAAA AACDDCCBCCC BAACDDDCCBA ACBCCABBBCD AAABCCCCDDD DDDBAABBBBB
193,DDDDDCBAAAA DDBBBBCAABB BBBAAAACDDD DDDDCBBAAAA CCBBAAABCDD AABDCBCCCCD DDDDBAAAAAA
194,DDDDDCBAAAA ABCCCCDDBAA BBBBAAABDDD BABDCDDDABB DDDCCCBAABD AAABBCCCDDD CDDDDDCAAAA
195,DDDDDCCAAAA CBAAAABDDDD CCCCCCDCAAA BBAABCBDDDC CCCCDDDBAAA AAAABDCBCDD AAAAACDDDDD
196,DDDDDCBAAAA ACCDDDDCAAA BBAAAABDDDD AAABBCCCDDD AAABBBCCDDD DDDDCAAAAAB DDDDBAAAAAB
197,DDDDDCBAAAA DDBBBBBAABB BAAAAACDDDD DDDCBBBBAAA CCCCAAAABDD AACCCBCCCDD DBABBBBBBCC
198,BBBBBAABDDD DDBAAAABBCD DDDDCBAABCC DCACBCBBBBA DDDBAAAABCD DDBBBBBBBBB AAABBCCDDDD
199,CCCCCBBAABD DCDDDDAAABB AAAAADCCDDD DBBCCABCABB CCCCCAAAACD AAABBCCCDDD DBABBBBBCCC
200,DDDDDCCAAAA AAAABBBDDDD DDDDDDBAAAA CDDDDBCAAAA DDDCAAAAABD AAABCCCCCDD AAABCCCDDDD
201,DDDDDCBAAAA ACCCDDDDAAA BBBAAAADDDD BCCDCDABBBB CCCBBBAAACD AAABBCCCDDD BCCCCCCCCCA
202,DDDDDCBAAAA AACCCCDDDAA BBBAAAACDDD AAABBCCCDDD AAAABCCCDDD DDDDDCAAAAA CCDDDDCAAAA
203,CCCCCBBAAAD DDBBBBAABCC AAAAACCCDDD DDDCCCBAAAA BBBAABBBCDD CCCCCCCCCAA AAABBCCDDDD
204,DDDDDCBAAAA CCCCDDDAAAA BAAAAADDDDD CCDCCDCAABB CBCCABBABCD AAABBCCCDDD DDDDDAAAAAA
205,CCCCCCBBABC BBAAAABDDDD CCCCDCBAAAA DCCACCCBACB AAAAACDDDCC BCCBDBABBBD AAAABBBDDDD
206,DDDDDCBAAAA AADCBBCDDBB BBBBAAABDDD DDDCCBBBAAA DDCBAAAABCC AAAABBCDDDD CCCCCCCCCAA
207,DDDDDCCBBAA AAAABBCCDDD DDCCCBBBAAA CDCCDCBABBA ABBBBBCCCDD AAABCCCCDDD AAABBCCDDDD
208,CCCCCCBBABB BBAAAABDDDD CCCCDBBAAAA DCCCBBCAAAB AACCBCCBBDD ABBBBDCACCD AACCCCCCCCC
209,DDDDDCBAAAA AACCCCDDDAA BBBAAAADDDD CAAAADCCDCC DDDDAAAAABD AAABBCCCDDD BCCCCCCCCCA
210,DDDDDCCAAAA CCAAAABBDDD CCCCBBDDAAA BAADBBBBBCD DBBBBBBBBCD AABBDBDBBDD AAABBBCCCCD
211,DDDDDCBAAAA CCDDDDDAAAA BAAAABDDDDD AAABBCCCDDD AAABCDCCCCD DDCBBAAABBB DDDAABBBBBB
212,DDDCCCCBBAA AAAABBBDDDD DDDDCBBAAAA CDDBDBCBBBA DABBBBBBBCD AAABCCCCDDD AACCCCCCCCC
213,DDDDDCCAAAA DCAABBBBCCD CCCCCCDCAAA ABBBCADCCDD CADBCCCDBAC AAABCCCCCDD AAAACDDDDDD
214,DDDDDCCBAAA DBAAAABCDDD CCCCCCDBAAA DDCAAACDBBC CCBBDDBBBBC BCBCCCAACBD AABBBBBBCDD
215,CCCCCBBAAAD DCCDDDBAAAA BAAAAADDDDD DCDBAACBCBA CBDCBDCAABD CCCCCCCCCCA AAABBCCDDDD
216,DDDDDCCAAAA CDAAAABBCDD CCCCCCBDAAA AAABBCDDDDC ACBBBBBDCCD AABBCCBBCDD ABBBCCCCCCD
217,AAAAABCDDDD DCDDDDCAAAA ABDDDCBBBCC AABDBCDCCCC ABCCCDDCAAD AAABBCCCCDD DDDDDAAAAAA
218,DDDDCCCBBAA AAAAABCDDDD DDDDDBBAAAA DDCDDCBBBAA DBAABBBBBCD AAABCCCCCDD AAABCDDDCCB
219,DDDDDCBAAAA ABCCCCDDBAA BBBBAAABDDD BAACDCCCCBB DDBBBAAAACD AAABBCCCDDD DDDDDCAAAAA
220,CCCCCBBAAAD CCDDDDBAAAA AAAABDCCDDD AAABBCCDDDD ACCDDBBCBCA CCCCCCCCCCA AAABBCCDDDD
221,AAAAABCDDDD CBCCCCCDDAA AAABDDDCCDD AAACDCCCCDD CDCAACBAACD AAABCCCCCDD CCDDDDCAAAA
222,CCCCCBBAAAD DDBBBBCABBC BAAAAACDDDD DDDCCBBAAAA DDBCCBAAABD AAABCCCCDDD DDDDDAAAAAA
223,DDDDDCCAAAA BAAAABBCDDD DDDDCCCBAAA CCDDDDBBAAA DDCCBBBBAAB AAAABCCDDDD AAAAADDDDDD
224,DDDDDCBAAAA AACCCCDDDAA BBBAAAACDDD AAABBCCCDDD AAABBCCCDDD DDDDDCAAAAA CCDDDDCAAAA
225,DDDDCCCBBAA AAAAABCDDDD DDDDCBBAAAA DCCDDCBBBAA ABBBABCCCDD AABBCCCCCDD ABCCCCCCCCC
226,DDDCCCCBAAA BAAAAACDDDD CCCCDBBBBBB BCAAABDCDCD AACABCDBDBC AABCDDCCABD AAAAABDDDDD
227,AAAAABCDDDD CCCDDDDCAAA AABDDCCCCCC BBBCABBCBBD CBBBBBCABDD AAABCCCCCDD DAABBBCCCCC
228,BBBBBBBBCDA AAAABBCDDDD DCCBBBBBAAA AAACCCDCCDD ABBCBBCBBCD AAABCCCCDDD AAABBCCDDDD
229,DDDDDCCAAAA CDAAAABBCDD CCCCCBBDAAA ABCBACABDDD BBDDBCAACBB BBCCDABCABD AAAAABDDDDD
230,DDDDDCCAAAA CBAAAABDDDD CCCCCCDAAAA AAACCDBBCCD ACCDBCDDBBA BBBADBBBBBD AAAAADDDDDD
231,DDDDDCCBAAA AAABBCCDDDB DDDCCCCBAAA CDDBBBCBCCA BBCBBBCBBBD AACCCCCCCCC AAABBCCDDDD
232,CCCCBBBAABD CCDDDDBAAAA AAAABDCCDDD AAABBCCCDDD CCCCCCCCCBA CAAABBCCDDD AAABBCCDDDD
233,DDDCCCCBAAA BBAAAABDDDD DDDDDBAAAAA DCBCBAABCCC BAAABBCDCCD AAABCCBCCDD ABCCCCCCCCC
234,DDDDDCBAAAA ABCCDDDDBAA BBBAAAACDDD AAABBCCCDDD AAABBCCCCDD DDDDCAAAAAB DDDDDAAAAAA
235,DDDDDCCAAAA DBAAAABCDDD CCCCCCDAAAA CBBBAABBDCD DDCBBBBBBBC BCCACBBBBBD AAAAADDDDDD
236,CCCCCBBAAAD CCCCDDDAAAA BBBAAAADDDD DDCCBCBABBB DCCCDAAAACD AAAABCCCDDD DDDDDAAAAAA
237,AAAABDDDDCC DDCAAABCDDD DDDDCBAAABB AACABACCCDD CDCCBBBBBAD DDCBBBBBBBB AAABBCCDDDD
238,DDDDDCBAAAA ABCCCCDDBAA BBBAAAACDDD CCADDABBCBB DDCBBBAAACD AAABBCCCDDD DDDDDCAAAAA
239,DDDDDCBAAAA ABCCCCDDBAA BBBAAAABDDD AABDDDDCCBA BAABCBBBBDD AAABBCCCDDD BCCCCCCCCCA
240,DDDDDCCAAAA BAAABBBCDDD DDDDDCCAAAA DDCBCBBBBAA CCCCAAABBCD AABBCCCCCDD ABBBCCCCCCD
241,CCCCCBBAAAD DCCDDDBAAAA BAAAAADDDDD DDAABCCBBBB CCCCABBAABD AAABBCCCDDD DDDDAAAABBB
242,DDDCCCCBAAA BAAAAACDDDD DDDDDDBAAAA BBBABADCCDD CAACBBCBCCD AABBCCCBCDD ABCCCCCCCCC
243,DDDDDCBAAAA CCCCDDDAAAA BAAAAADDDDD CCBCCDCCCAA BBBABCBABDD AAAABCCCDDD DDDDAAAABBB
244,CCCCCBBAAAD DDBBBBAABCC AAAAACCCDDD DDDCBBBAAAA BBBAABBBCDD AAAABCCDDDD DAABBBCCCCC
245,AAAAAACDDDD CCCDDDDCAAA AABDDCCCCCC AAAACDDDDDD BABBBBBCBCD AAABCCCCDDD CDDDDDAAAAA
246,DDDDCCBAAAB BBAAAABDDDD CCCCDCBBAAA DCBBBABCBDD DBAAAABCCCD AAABDCBBCDD AAAABCCDDDD
247,CCCCCBBAABD DCCDDDBAAAA AAAADDCCDDD DBAAACCCBCB BCCCBBBBBBD AAAABCCDDDD DAABBBCCCCC
248,DDDDDCCAAAA BDCBBBBBBCC CCCCBBBBDBA AAABBBCDDCD CCDDCAAAACD AAABCCCBCDD AAABBCCCCDD
249,DDDDDCBAAAA AACCCCCDDBA BBBBBAAADDD BABCCCDCBBC CBBBBAAACDD AAABBCCCDDD BCCCCCCCCCA
250,DDDDDCCAAAA BAAABBBCDDD DDDDCCCBAAA DDDCCBAAAAA BDCAAACBBDD AAAABBCDDDD AAAAABCDDDD
251,DDDDDCBAAAA ABCCDDDDBAA BBBAAAACDDD AAABBCCCDDD AAABBCCCDDD DDDDDBAAAAA CCDDDDCAAAA
252,BBBBBBBAADD DCDDDBAAABB AAAABDCCDDD AAABBCCDDDD CABDDCCBBCA DBAAABBBCCD DAAABBBCCCC
253,DDDDDCCAAAA AAAABBBCDDD DDDDCCCBAAA DDDBCCBAAAA DDDDBAAAABC AAAABCDCDDD AAAACDDDDDD
254,AAAAABCDDDD CBCCCCCDCAA AAABDDCCCCC AACCABCCDCC ABBBABBCCDD AAABBCCCDDD CDDDDDAAAAA
255,CCCCCBBAAAD DDCBBAABBCC AAAACDCCDDD DDCBCBBBBAA BBBBBBBBBCD CCCCCCCCCCA AAABBCCDDDD
256,BBBBBBAABDD DCBBBAABCDD AAAACDCCDDD DCCDDBAAAAB BABBCABBBDD AACCCCCCCDD DDAABBBBBBB
257,CCCCCBBAAAD DCCDDDBAAAA BAAAAADDDDD DDCBBCACCBA DDBCBAABABD AAAABCCCDDD DDBAABBBBBB
258,DDDDDCBAAAA ABCCCCDDBAA BBBAAAACDDD DBBBCCBDBBA DCCCBAAABDD AAABBCCCDDD DDDBAABBBBB
259,CCCCCBBAAAD DDCBBBBAABB AAAAACCCDDD DDCCCBBBAAA BBAABABCDDD AACCCCCCDDD DDDAABBBBBB
260,AAAAABCDDDD CCDDDDCAAAA ABDDDCBBBCC AABBCBCCDDD BBDCBBABACD CCCCCCCCCCA AAABBCCDDDD
261,AAAAABCDDDD CBCCCCCDCAA AAACDDCCCCC AAABBCDCDCD BABBDBBABDD AAABCCCCDDD CCCDDDDAAAA
262,CBBBBBBAADD DDDDAAABBCC ADDDCBAABCC DDCBABABBCA DDCCCCAAABD DDDDAAAAAAA AAABBCCDDDD
263,DDDDDCBAAAA AACDCBCDDCB BBBBBAAACDD DDDDCBBAAAA DDCCBBBAAAC AAAABBCDDDD CCDDDDDAAAA
264,DDDDDCBAAAA ACCCCDDCAAA BBAAAABDDDD CAAAADDDCCA BCCCBBBAADC AAABBCCCDDD DDDDDAAAAAA
265,BCCBBBBAABD DCDDDDAAAAA BAAAABDCDDD AAAABCCCDDD AAABCCCCCDD DDBAAABBBBC DDBAABBBBBB
266,DDDDDCCBBAA AAAABBBDDDD DDDDCBBBAAA CCCDCDDBAAA BCCCCCCAAAD AABCCCBCCDD ABBCCCCCCCC
267,AAAAABCDDDD DCDDDDCAAAA ABDDDCBBBCC BACCDDDCBBA AABABACDCDD CCCCCCCCCAA AAABBCCDDDD
268,DDDDDCBAAAA ADDCBBCDBBB BBAAAABCDDD DDDCCBBAAAA DBBBAABCCCD AAAABCDDDDD DDDDDDAAAAA
269,AAAAABCDDDD CCDDDDDAAAA AACDDCCBCCC AABDCCBDBBC CCBBAAAACCD CCCCCCCCCCA AAABBCCDDDD
270,DDDDDCBAAAB CCDDDDDAAAA AAAAACDCDDD AAABBCCDDDD AABBCDCCDCC DCAAABBBCCD DAABBBCCCCC
271,CCCCCBBAABD DCCDDDBAAAA BAAAAADDDDD DBBCCCDABBB DDCCCDAAABD AAAABCCCDDD DDDDAAAABBB
272,AAAAABCDDDD DCDDDDAAAAA ACDDDCBABBB AACDDDCAACB ACCABABCCCD BBBCCCCCCCA AAABBCCDDDD
273,CCCCCBBAAAD DDBBBBCABBB BAAAAACDDDD DDDCCBBBAAA DCDDCCAAAAB AAAACCDDDDD DDDDDCAAAAA
274,DDDDDCBAAAA ADDCBBCDBBB BBBAAAABDDD DDDDCBBAAAA DCBCBBBABCD AAABDDDCCCD DDDDDAAAAAA
275,CCCCCCBBABB BBAAAABDDDD CCCCCDBAAAA ACABDDCBCCB CCCCAAACACD BBACCCCCBCD AAABCCCDDDD
276,DDDDDCBAAAA CCCCDDDAAAA BAAAAADDDDD DDAACBCCCBA BCCABBBABCD AAABBCCCDDD CCCDDDDAAAA
277,DDDDDCBAAAA ACCCCDDCAAA BBAAAABDDDD DBAAACDDCCC CDBCAABABDD AAABBCCDDDD DDDBAABBBBB
278,DDDDDCCAAAA AABBCCCDDDA DDDCCCCBAAA DCCDDDAAAAA CCCBBCCCBAB ABCCCCCCCCC AAABBCCDDDD
279,CCCCCBBBAAD CCDDDDDAAAA AAAAADDCDDD AAABBBCCDDD AABCCCCCCDC DBAABBBBCCD DAABBBCCCCC
280,AAAAABCDDDD DCDDDDCAAAA CDDDCBAAAAA AABCCDDBCBD CBABBBBBBDD AAABCCCCDDD DDAABBBBBCC
281,CCCCCBBAAAD DCCDDDBAAAA AAAAADDCDDD DDCABBABBBC DDBBBABABBD AAABBCCDDDD DBABBBBBCCC
282,DDDDDCCBBAA AAAABBCCDDD DCCCCCCBAAA ABCDDBBBBBC AABCCCCCCCC ACCCCCCCCCC AAABBCCDDDD
283,DDDDDCBAAAA ACCDDDDCAAA BBAAAABDDDD AAABBBCDDDD AAAABCCCDDD CCDDDDBBAAA CCCCCDDDAAA
284,DDDDDCBAAAA ABCCCCDDBAA BBBAAAACDDD DCCDDABBBBB CCDCABAACDD AAABBCCCDDD AAABBCCDDDD
285,DDDDDCBAAAA ABDCBBCDDBB BBBAAAACDDD DDDCCBAAAAA DDDBABAAACC AAAACCDDDDD DDDDDBAAAAA
286,DDDDDCCAAAA BAAABBBCDDD DDDDCCCBAAA DDDDCBAAAAA DDDAAAAABBD AAAABBCDDDD AAAAAADDDDD
287,BCCBBBBAABD CCDDDDBAAAA AAAABDCCDDD AAABBCCCDDD CCCCCCCCCBA CCCCCCCCCCA AAABBCCDDDD
288,DDDDDCCAAAA CDAAABBBCDD CCCCCBBBDAA AAABCDDCDCC BBABBBCCCCD AABBCCBBBCD AAAAABDDDDD
289,DDDDDCBAAAA ADDCBBCDBBB BBBAAAABDDD DDDDCBBAAAA DDCBAAABCDD AAAABCDDDDD DDDDDDCAAAA
290,DDDDDCBAAAA ACCCCDDCAAA AAAAABDDDDD CBDDDDBAAAA AACCBBCBBCD AAABBCCCDDD CCCCDDDCAAA
291,BBBBBBAADDD DDCAAABBCCD DDDDCBAABCC CDCCCBAABCD DCDCBBBBBBC DCBBBBBBBBB AAABBCCDDDD
292,DDDDDCBAAAA CCDDDDDAAAA BBBBAAAADDD AAABBBCDDDD AAABBCCCDDD DDDDDBAAAAA DDDDDCAAAAA
293,AAAAABCDDDD DCDDDDBAAAA ABDDDCBBBCC CAAACCCDCBD ADDCAAABBCD AAABCCCCCDD DAAABBBCCCC
294,CCCCCBBAAAD DDBBBBAABBB AAAABCCCDDD DDDCCCCBBAA ABDABAABDDD AABBBBCCDDD DDAABBBBBBB
295,DDDDDCBAAAA ABCCCCDDBAA BBAAAABDDDD DDDBAABCCCB CDDCDAAAACD AAABBCCDDDD DDDDBAAAAAA
