,0
419,HGEDDBA ABEGGFF DACFFGG HHCBCCC ABDGGGF HCABFFF CFDBEGE CGBAEGG EAFECDH ECAEEGG ABCDFHH EEFFFFA ABCEFGH ABDEFGH ABEFFGG
420,EGGFEBA HGEDDCA ABEFFFG EFGHBAA HGFDCBA AAEFGGG HDDDDCC FACDCEH GFFEEDA BBBDEHH ABCDFGH ABCDEGH HFBCCCD ABDEFGH ABEFFGG
421,EGGFEBA HGEEECA AEEEFFF GHGBBBB HGFDBBA ABEFGGG FAFFGFA EECCCGG HGFECAA FBBBBGH ABCDFHH ABCDEGH ABCDFGH HFCCCCC ABEEFGG
422,HGFDDBA ABFGFFF DACFFGG FFGGFAA CBBBFHH HFABDDD AADEFHG CACGEFG HFDDADD CCBCCHH AACDFGH BBCDEGH ABCEFGH FFFGFAA ABEEFGG
423,EGGFEBA DCCCCFH FABDFGG HACDEEE CCCBCHH EBADGGG HDBBFCG CBAEHGF HGFECBA DCCCCHG ABCDFGH EEFFFFA ABCEFGH ABDEFGH ABEFFGG
424,HFEDDBA ABEGGFF DACFFGG HEBCCCC ACFGGFE HCABFFF GGCDAGD DBBGGFC GDEBEDD FHECABG ABCEFGH BBCCDGH GGGEBBB ABCEFGH ABCEFGH
425,EGGFEBA HGEEECA ADHFEDD BEHFCCC HGFDCBA AACEGGG GHFECBA HGFECBA FECBGFC EDEDAFH ABCDEGH ABCEEEH ABCDFGH HDCCCDD ABEFFGG
426,HGGEDBA HGDCBAE HHCBBCD ABEFFGG GGGFEBA HDDCCCC GEAGEBD HBBECGC CHEEAED BDEBDFH ABCFFFH CDACFGG AABGGGG AACEGGG FHGEDBA
427,GGGFEBA GFEEDDA HHCABDD ADEEFGG EEEEFFA HHGCBBB DGFBDBF CAEFFFG DHEBCEE EFFFAFC ABDDGHG CDBCCFH ACFFFFF AACEGGG FHGECBA
428,GEFGEBA HGEDCBA ACBDFGH ABDEFGG GGGGEAA HHGDBBB ABBEGGG HFDEECA DAEFFFF BBBCFHH BADDEHH BBBDGGG ABCDFGH AACEGGG FHGEDBA
429,HEEEDCA BBAFGGG HGGCBBB ABDEEFH GGFFEBA DBADGGG HGDDBBC HEEDDBA GCFADDG DDDDCEH GGGCBBB DCBCCFH ABCEFGH ABDEFGH BCEEGFC
430,GGFFECA HGEDCBA HFABDEF ABCDGHH FGFFEBA HGGCBBB HGDDBDB HHFBBBC FFCFDCC CCAEFFH BBCCDGH ACDDDFH ABCEFGH AACEGGG FHGEDBA
431,EGGFEBA HGEEECA AAGGFEE BDGHDBB HGFDBBA BBBDGGH EGGFFBA HFEDCBA HGFDCBA GEDBAEH ABCDFGH ABEFFGG ABCDFGH HHGBBBB ABEEFGG
432,BFGFEDA HGFEABB CCBBGGH ABDEGHD HGFCBBB GHGDBBB EABGEGC DHBCDEE BCCDFHD DEDCFHB BBBFGGG ABDEEGH ABCDFGH AACEGGG EGFECBE
433,EGGFEBA DCCCCFH DACFFGG HBCDEEE CCCBCHH EBADGGG ABBDFGH ABEFEFH ABEFHFE FFFFFDA HBBBCFG BBCDEGH ABCEFGH ABDEFGH ABEFFGG
434,EGGFEBA DDCCCCH DACFFGG HFBCCDD HGFDCBA BBADGGH ABCEFGH ABCDFHH ACDDDHG EFFEDFA HGCBBCD ABCDEGH CABDFGH ABDEFGH ABEFFGG
435,EGGFEBA HGEDDCA HHECBBB DGABEFF HGFDCBA ACDEGGG HGFDBBA GHFDCCA HGFCBBB DBBBCHH AACFGGG BBCDEGH GGGDBBB ABDEFGH FGGFCBA
436,EGGFEBA CCCCCFH DACFGGF HBCDDEE EEDCCBH FBACGGG ABCEFGH ABCDFGH CBDCEHF EHFBBFC HGECBBC BBCDDGH GGGDBBB ABDEFGH ABEFFGG
437,EGGFEBA GGEEECA ABEFFFF GGHEBBB HGFDBBA AACFGGG ABCEFGH ABCDFGH ABBDEHH ABCDEHH ABCEFHH HGEDCBA ABCEFGH EEEFFFA ABDEFGH
438,DCCCCFH GHFECBA GFGGCAA AACFGGG GGGFDBA GBACFGG BCCCEFH HGBBFCC BCEDGCH CCCCCGH FFFFFAA BCCCCFH ABCEFGH ABDEFGH BCEEGFC
439,GGGFDBA HGEDCBA GHCCCCC ABCEGGG GGGEDBA EEHEBBB BHCCDEE AAEFFGG FFGCACG HHBBBDF BBDECGH CCECBEH BBCDEEH ABCFGGG BGGFECB
440,EGGFEBA HGEEECA AEEEFFF GHGBBBB HGFDBBA AAEFGGG GCADGCG FHGCEBA BABHGFF CCBCCHH ABCDFGH ABCDEGH ABCDFGH HCCCDDD ABEEFGG
441,EGGFEBA HGEDDCA AAEFGGG FFGGBAA HGFDCBA BBBEGGG ABCEFGH ABCDFGH ABDEFGH ABDDDHH GGGGDAA CBBCDFH GGGGBAB ABDEFGH ABEFFGG
442,GEFGEBA HGEDCBA HCACDFF ABCEGGG FGGFEBA HGGCBBB HFABDFE FGEEFCA GGGEBBB BCCCDGH BBCDCFH ABDEFGH ABCEFGH AEFFFFF ABCEFGH
443,HEEEDCB BABGGGF HGGCBBB ABBDGGH GGGFEBA DBADGGG HFEBCCC DGGFACB GHECEBA FFFFFBA ACEEEGG CCCCCFH ABCEFGH ABDEFGH BCEEGFC
444,HGFDDBA ABEFGGF DACFFGG HGCCCCC ACEGGFF HCABFFF ABDEFGG BFBFGGC DHFEEBB BBBDDHH ABCDEHH ABCDEFH HHCBBCC ABDEFGH ABEFFGG
445,EGGFEBA DCCCCEH HGDBBCC CACEGGG EEDCCBH CBADGGG HGFDBBB HHFDBAB GFFBADG BBBCFGH ACGGFEE ABCDEGH HHCBCCC ABDEFGH FGGFCBA
446,EGGFEBA HGEEECA ACGGFED BDGHDBB HGFDBBA ABBEGGG EGHFDBA HHEDCBA HFEEDBA ABDEDGH ABCDEGH ABEFFFG ABCDFGH HHCBCCC ABEEFGG
447,EGGFECA DCCCCEH HGDCBBC GBACFFF EEDCCBH CBADGGG HGFDBBB HFFEDCA FABDDGG CDCCDEH ACFEFFG ABCDEFH HHCBBCC ABDEFGH FGGFCBA
448,HEEEDCA CBBBFHG GFGGCAA ABDFGGG DGGFEBA DBADGGG HEECCBB FFFEGCA HGFDDAA CCBBCHH GGGGBAA FDCBBEH ABCEFGH ABDEFGG GGFEDBA
449,GGFEDBA ABEGGFF DACFFGG HGCCCCC ABEGGFF HCABEFF GGCEADD GHFCEAA BDADGGG FGDFBDC ABCEFHH BBCDEGH GGGEBBB ABDEFGH ABEFFGG
450,EGGFEBA HGEDECA FAADFGG HHBBCCC HGFDCBA ACEFGGG EEDFGDA FEACFEE HGFECBA GCBBBGH ABCDFGH ABCDEGH FFFGFAA ABDEFGH ABEFFGG
451,GFGFDBA HGEDCBA ABCEFGH AADEFGG FGGFEBA HHECBBB HEECBCC EFDEFFA DFCCCCH ECBBCGH BBBDDGH BBBDEGH CCCDDDH ABCGHGC HGFECBA
452,EGGFEBA HGEDDCA AAEFGGG FFGGBAA HGFDCBA DDCBBGH ABCEFGH ABBDFHH ABCDFGH BBBCFHH ABCDFGH HHFCBBB ABCDFGH GGGEBBB ABEFFGG
453,EGGFEBA DDCCCCH DACFFGG HFBCCDD HGFDCBA BBADGGG BACDFGH AACEGGH ACCFFFG EBBCDHG HHFCBBB BBCDEGH HHGBBBC ABDEFGH ABEFFGG
454,EGGFEBA EDCCCCH FAADFGG HHBBCCC HGFDCBA EBADGGG GDBBFCG FFDGEBB BEGGEAE FBEBEDH ABCDFGH ABCEEGH GGGDBBB ABDEFGH ABEEFGG
455,HFEDCBA ABEGGFF DABFFGG HHCBCCC ABDFGGF HCACFFF FDGBFEB FBFCECG DBGFCEE EDCBBGH ABCEFGH BBCCDGH GGGGBAA ABDEFGH ABEFFGG
456,EGGFEBA DCCCCEH HGDBCBC AADFGGG BBBCGHH DBADGGG HGEDCBA HFGFCAA FCAEGEF CBBCDGH EEBBBFH FFFFFFA ABCEFGH ABDEFGH FGGFCBA
457,DDDCCCH AEFFFEE DABFFGG GGGGBAA BBBDGHH HDABEFE BBGBEGD BCEAFGG AFFFFEE CCBCCGH ABCDEGH BBCDDGH GGGGCAA ABDEFGH ABEFFGG
458,GGGFDBA GEDCBBH HHCABCD AAEFGGG FGGFEBA HHDCBCC AFGFDDD BAEHGDD HHFCBCA GGDAEEC DADDDHH DDCBCGH AAFFFGG AACEGGG FHGEDBA
459,GGGFDBA HGEDCBA HDCCCCC AACFGGG GGFFDBA GHDCCBB BCHEFGB BFGEGBB GDBBBEH EEDEADH BBBCEGH BCCDDFH ABCEFGH AEEEFFF AGGFECB
460,EGGFEBA CCCCCFH DACFFGG HBCDDEE EEDCCBH EBACGGG ABCDFGH ABCEFGH ABDEFGH CCBCCHH HHFDBBB BBCDEGH GGGDBBB ABDEFGH ABEFFGG
461,GGFEDBA ABEGGFF DACFFGG HHCBCCC ABDFGGF HCACFFF CBCDHFE BGDGEDB DBBDGHF FFBDBFG ABCDFHH BBCDEGH HHCBBCC ABDEFGH ABEFFGG
462,HFFFECA HGEDCBA EABDFGG AACEGGG FGGFEBA HHECBBB HEFABDD FHHCBBB ACEFFGG HDBBCEG BBCCDGH ACDDEGH ABCEFGH ADEEFGG FHGEDBA
463,EGGFEBA GGEEECA ABEFFFG FFGHBAA HGFDBBA ABEFGGG CCDDDDH AAFGGFE FEDDCBH CCBCCHH ABCDFHH ABCDEGH ABCDFGH HHGBBBB ABEEFGG
464,CGGFDCA HGFBBCB CBAEGGG BCEFGGA HGFDCBA GHGDBBB BDGHDCC DFABDGH ACEFFGE FEEBBDH AACGGGG ABCDEGH ABCDFGH AACEGGG DGFECBE
465,EGGFEBA HGEDDCA FABDFGG HDBCDDD CBBBGHG DBADGGG GFDABGD GGHBBBD BEGGEAE EEFEAEE ABCDFGH GGGEBBB ABCEFGH ABDEFGH ABEFFGG
466,GGFFEBA HGEDCBA HEABDFF ABCDGHH FGGFEBA HGGCBBB HFGCDAD HHFBBBC HFCCCCC DDCBEGF BBCDDGH ABDEFGH ABCEFGH ACFFFFF FHGECBA
467,EGGFEBA HGEEECA ABBHGFE BDFGHBB HGFDBBA BBBCFHH BGHGEBA HGFDCBA GGGFBAA HFEBAEF ABCDFGH AACEFGH ABCDFGH FFFFFCA ABEEFGG
468,GFFFDBA FEDCCBH HGCBCCD ABEFFGG GGGFEAA HEDCCCC FGCHCAC AFEEEFF BGDCDGC BBDDEGH ACDCFGH DDBCBGH ABCDFGH AACEGGG FHGEDBA
469,EGGFEBA HGEEECA ABGHFEE BDGHDBB HGFDBBA BBBEGGG DGHFDBA HEEEEBA HGEDCBB HFCBBCG ABCDEGH AEGFDEF ABCDFGH HHCBCCC FGGFCBA
470,GGFFECA HGEDCBA EABDFGH AACEGGG FGGFEBA HHECBBB HGGDBBB BBDEEFG HFCCCCC CACDEGH BADEEGH ABDDEGH ABCEFGH ACFFFFF FHGECBA
471,FGGFDBA HGEDCBA DDHDCCC ABCDFHH GGFFDBA DDFHCCC ABCDEHG CBEEEFF ACEFFFF FFHABDE BBBDEHH DBCCDEH ABCEFGH ADEEFFF AGGFEDB
472,DDDCCCH AGGFECB DACFFGG HHCBCCC ABDFGGF HCACFFF BBBEHEH HHDEBAD BBFHFCF EBBCCHH ABCEFGH FFFFFDA ABCEFGH ABDEFGH ABEFFGG
473,GFFEEBA HGFEEBA DCABEGH ABDEFGG FFFFEDA HHGDBBB EGCDFEA EFDEEFA ACEFFGG CCCCCFH AACFFGH CCCCDFH ACFFFFF ABCEFGH ABCEFGH
474,EGGFEBA DDCCCCH DACFFGG HFBCCDD HGFDCBA BBADGGG ABCEFGH ABCDFGH ABGCFEH EDBCCHG HHFCBBB BBCDEGH GGGDBBB ABDEFGH ABEFFGG
475,DGGGECA HHEBCCB BBAFFGG CDFGHBA HGFDCBA GHGDBBB ABDFGHE CFBBCFH HHBCCCE DEEEFFB AEEEEFF ABCDFGH ABCDFGH ABCEFGH ABCEFGH
476,HFEDDBA ABFGGFF CACFFGG EFFGGBA CCBBDHH HCACFFF ACDBFHG CCEDCDH EBFFAFF BBCCDGH ABCEEGH BBCCDGH ABCEFGH GGGGBAA ABEEFGG
477,EGGFEBA DDCCCCH DACFFGG HHBBCCC EDCCBDH EBACGGG AADEFGH AADEFGH BBAGGGE EFFFCFA HFBBCDD ABCDEGH ABCEFGH ABDEFGH ABEFFGG
478,HEEEDCA CCBBCHH FFFFGBA ABDFGGG AFFFFDC DBADGGG HGFDBBB GFDDDBF DFCCEDG FEBBBEH FFGGEAA FDCBBEH ABCEFGH ABDEFGG GGFEDBA
479,EGGFEBA DDCCCCH GAEGEDC HFBCCDD EEDCCBH EBACGGG BBCDFHH ACCDFGH ABDFFGH FDCBBGH FGGGEAA BBCCDFH HHGBBBB ABDEFGH ABEFFGG
480,EGGFEBA DDCCCCH DACFFGG HFBCCDD HGFDCBA BBADGGG BBBCFGH ABCFFGH BCCEEEH HFDCAFC HGEBBBC BBCCEFH HHCBCCC ABDEFGH ABEFFGG
481,DCCCCFH HHEECBA FEFFFDA ABBDGHH GGGFDBA GBACFGG CBBFEHE BBCHCEG HHECCBB DCBBCHG FFFFFBA BCDCDFH ABCEFGH ABDEFGH BCEEGFC
482,GGGFDBA HGEDCBA DHECCCC ABCDGHH GGFFDBA FEDDHBA AADDGGG CDBBFGG DAEFFFF BEDCBEH BADEDHH CCCBDFH BBBCGHH ABCEGGH AGGFECB
483,GFFFDBA EDDCCGE HHCABDD ABEFFGG GGGFEBA HEDCCCC ABCEFHG CCBBCHH HCCCDDD BCBCDGH BCBFEHE CCBDGDH BCCCDFH AACEGGG EHGEDBA
484,EGGFEBA HGEEECA AAEFGGG FFGGBAA HGFDBBA AACFGGG ABCEFGH ABDEFGH ABCEGGH BBCCEHH ABCDFGH HHECBBB ABCEFGH GGGGBAA ABEEFGG
485,EGGFEBA DCCCCFH FAADFGG HDBCDDD EDDCCCH EBADGGG HEGCBCB HGGDBBA HGDEBAD EBBBEGH ABCDFHH ABCDEGH GGGDBBB ABDEFGH ABEEFGG
486,GGGEDBA HGEDCBA HHCABDD ABEFFGG DDDDCCH HEDCCCC CCHDCCF AGEEEEE ACEFFFG BCCCDGH BAFCFGG CCCCDEH AABGGGG GGFEDBA HGFECBA
487,HGEDDBA ABEGGFF DACFFGG HHCBCCC ABDFGGF HCACFFF CBBDFHF FFGCCCC EEEGFDA DBDDAGH AACDEHH BBCCEGH DABDFGH ABDEFGH ABEFFGG
488,EGGFEBA CCBBCHH HGDBBCC AADFGGG EEDCCBH BBADGGG HGFDCBA HGEDBBB DGCDDBG BECBCGH ABCEGGG BBDDDFH GGGDBBB ABDEFGH ABEFFGG
489,GGGFCBA GFEEDEA EFCBCCH ABCEFGG EEEEEFA HHGCBBB GGGBDCC BDGBGFD CDEGFCE BFBEFFD ADGDCGF CCCDDCH ABCDEGH AACEGGG FHGEDBA
490,EGGFEBA HGEEDCA AHGEDCC CFHBCEE HGFDCBA ABDFGGG HGFDCBA HGFDCBA HGEFCAB BACDEHH BBCCEHH DDBCCFH FFFFFCA ABDEFGH ABEFFGG
491,HFFFDBA HGEDCBA HEABEFF ABCDGHH FGGFEBA GGGFBBB HGECBCB HGFDBBB FGGGBAA CCCDEHE ABDDDGH ABCEFGH ABCEFGH ACFFFFF ABCEFGH
492,GGFGDBA HGEEDCA BBBDFGH AADEGGG FGGFEBA HGDCBBB FHDEFAA HDBCCDE FGFDCEA AAFDFGF BBCCEHH BBBDEGH BCCCCFH BBBDGGG FHGECBA
493,GFFFDBA HGEDCBA HHCBCCC ABBEGGG GGGFDBA GGHCBBB ABDFHGC BAEFFFF GGGEBBB ACEEEGH BBCCFHH DBCCDEH BBBEGGG AACEGGG FHGEDBA
494,GFGFDBA HGEEDCA CCACEGH ABDEFGG FGGGEBA HGFDBBB EGBCECD GGFGBAB FFGGFAA CCCDEHE AACEFHH CCCBCFH AABGGGG HGFEDBA HGFECBA
495,GGFFEBA HGFEEBA DBACFGH ABDEFGG FGGFEBA HGFDBBB CFGACFE FGEEFCA FGGGBAA BCCCDGH AACEFGH CBCCCGH ACFFFFF HGFEDBA HGFECBA
496,GGFFDBA HGEDCBA HFABDEF ABCDGHH FGGFEBA HHFCBBB HGDEBBB HFEEBAE HCCDDDD EEEFFAE BBBCEHH CCCCCFH BBBBGHH ABCEGGG FHGEDBA
497,EGGFEBA EDCCCCH HGDCBBC FBACFGG HGFDCBA ABBEGGG GGGFDAA HGFECAA DFHECBA DCCCBHH AADGGFF ABCEFGH GGGDBBB ABDEFGG FGGFCBA
498,EGGFEBA EDCCCCH HGDCBBC FBACFGG EEDCCBH CBADGGG HFGECBA HFEEECA HGGEBAA BDBCDGH AACEGGG BBCDDGH HHGBBBB ABDEFGH ABEFFGG
499,EGGFEBA HGEEECA ABEFFFG FGHEBBB HGFDBBA CCBBGHH EBAEEGG GGFCAED GGDBEDC CCBCCHH ABCDFGH ABCDFGH ABCDFGH HHGBBBB ABEEFGG
500,GGGFDBA HGEDCBA GABDEFG AACEGGG GGGFEBA HHECBBB HFBCDBF HHBBCCC HFCCCCC BCCCDGH BBBCEHH CBBCEGH BCCCCFH BBCDFGH ABCEFGH
501,EGGFEBA GGEEECA HHECBBB DHABEFF HGFDBBA AACFGGG HGFECBA HGGFCBA FGGFCBA FHGCACD ABCDEGH ABEFFFG ABCDFGH FFFGFAA ABDFFGH
502,EGGFEBA DCCCCFH FAADFGG HACDEEE DCCCBFH EBADGGG HHDCCBC BDGGFCE HGFECBA GFABDFF ABCDFGH ABCDEGH HFBCCCD ABDEFGH ABEFFGG
503,HGFDDBA ABEGGFF DACFFGG HFCCCCC ABEGGFE HCACFFF BBEDFFG BDADFGH FFEABFG GFBBBFG BACEFGH EEEFFFA AACEFGH ABDEFGH ABEFFGG
504,GFFGCCA HGEEDDA BCBCFGH AADEFGG GGGFEBA HGFDBBB BCDBGGG HGFDBBB GGGCCCA BCGGEDC AACFGGG CCCCCFH AAFFFGG AACEGGG FHGEDBA
505,GGGGCBA FEDDCGC HHCABCE ABEFFGG GGFFDAA HEDCCCC AAFGFDG EFECACH FFFFFCA HCCCCEF CCBHFFC CCCCCFH BBBEGGG AACEGGG EHGEDBA
506,EGGFEBA HGEDDCA ABEFFFF GGHEBBB HGFDCBA AACFGGG ABDEEGH ABCEFGH ABCDFGH BCBDCHH HHFCBBB BBCDDGH HHGBBBB ABDEFGH ABEFFGG
507,GFGGEBA HGEDCBA CCABEGH AADEFGG FGGFEBA HFDCCBB GHFCBCB HHCBCCC FCAAFGG GGFAADF BBCCDGH ABCEFGH ABCEFGH ACFFFFF FHGECBA
508,GGFEDBA ABEGGFF DACFFGG HHCBCCC ABDFGGF HCABEFF CCBBGGG FADDGGC ECAEGHC DDECAGH ABCEFGH BBCCEGH GGGGBAA ABDEFGH ABEFFGG
509,EGGFEBA HGEDDCA AAEFGGG FFGGBAA HGFDCBA BBBCGHH ABCEFGH ABCEFGH ABCEFGH ABCDEGH AACEFHG HGCBBCD ABCEFGH HFCCCCC ABEFFGG
510,GEFGDBA HGFEDAA FCABEGH AACEFGG FGFFFAA HHGDBBB HFGDDAA CFABDFH GGGDDAA BBFFCDH ABDFFGG CCDDCEH AEEEFFF AACEGGG FHGEDBA
511,GFFGDBA HGEDCBA ADCDFGH AADFGGG FGGFEBA HGECBBB GHEFBBB HHCEBBC ACEFFGG BBDDEGH ABEFFGG DBCCDFH ACFFFFF AACEGGG FHGEDBA
512,EGGFEBA CCBBCHH FAADFGG ABDFGGG HGFDBBA DBADGGG HEEDCCC GGHBBBD ECFFECC ECBBBHG ABCDFGH ABCDEGH FFFGFAA ABDEFGH ABEEFGG
513,GGGFDBA EEDDEHA HHCABDE ACEEFGG FFFFFDA HHGDBBB GEFEBDB AADFFGF GCGBCED FBBCGGF CBBFDGG BBBDGGG ABCDFGH AACEGGG EHGEDBA
514,EGGFEBA HGEEECA AAEFGGG FFGGBAA HGFDCBA BBBBGHH ABCEFGH ABBDGHH ABBEGGH ABCEFGH ABCDFGH HHEBBBC ABCEFGH GGGEBBB ABEEFGG
515,HGEDDBA ABEGGFF DACFFGG HHCBCCC ABDGGGF HCACFFF DACBEHH DGHBBCE ECAGGFB BDECAGH ABCDFGH BBCCEFH HHCBBCC ABDEFGH ABEFFGG
516,EGGFEBA HGEDDCA DACFFGG HHCBCCC HGFDCBA BBADGGH BBBDFGH ABCEFGH AACEFGH BCCDCHH GHGDCBA BBCDEGH GGGGBAB ABDEFGH ABEFFGG
517,HFEDDBA ABFGGFF CACGFGG EEFGGCA DCCBBGH HEABEEE DABDFGG FFEGDAD DGBAFGD ACFFDFG ABCDEGH BBCCEGH ABCEFGH GGGGBAA ABEEFGG
518,GGGFDBA HGEDCBA HECCCCD AAEFGGG GGGFDAA DDHECCC BBHGDED CGGBCCG ACEFFFG BCBCDGH BCEDCDH EBDBCGH ABCEFGH ACFFFFF BHGFDCA
519,EGGFECA EDCCCBH HGDCBBB DGABEFF EEDCCBH CBADGGG HGECCBA HGFEDAA GHFECAB BBBDEGH AADFGGG ABCDFGH HHCBBCC ABDEFGH ABEFFGG
520,HFFFDBA HGEDCBA BCBCFGH AADEGGG FGGFEBA HGDCBBB HFEFBBB EGHEDAA GGGEBBB BBBBFHH BBBDCGH ABCEFGH ABCEFGH AABGGGG AGGFEDC
521,GGFEDBA ABEGGFF DACFFGG HFBCCCC ABFGGFE GBACFGG DCCADHH GEGGCCA FFGGBBB BBDBEHH ABCDEGH HHCBBCC ABCEFGH ABDEFGH ABEFFGG
522,HEEEDCA CCBBCHH FEFGFAA ABDFGGG AFGGFED EBADGGG GFHDABC AECCFFH FFFEEAD BBCDDGH FFGGEAA ECBCCEH ABCEFGH ABDEFGH FFFEECA
523,EGGFEBA CCCCCFH DABFFGG HEBCDDD HGFDCBA BBADGGG ABCEFGH ABCFFGH ABDEGHF CCBCCHH HHGDBBB BBCCDGH GGGDBBB ABDEFGH ABEFFGG
524,EGGFEBA BBBGHFE HGFEEAA ABDFGGG BBBDGGG DBADGGG HGFECBA FEABDDH HFFCBBD BBBCEHH BACDFHH GGGGBAA ABCEFGH ABDEFGH ABEFFGG
525,EGGFEBA CCCCCFH HADFEDC HEBCDDD DDCCBEH FBACGGG ABCDFGH ABCEFGH CADDEFH BDDBCGH GGGFCAA ABCDEGH HHCBCCC ABDEFGH ABEFFGG
526,EGGFEBA HGEEECA ADEFFFF GHGBBBB HGFDBBA ABEFFGG ABCEFGH BBBCEGH ABCEFGH CBCCCGH ABDEGHE HGFCBBC ABCEFGH HHGBBBB ABEEFGG
527,GFFFDBA HGEDCBA HFCBCCD AAEFGGG DDDDCCH HEDCCCC GHCCCBD CBGFHCB EBEHECC AABGGGF ABEDDHH DBBCEEH AABGGGG GGFEDBA HGFECBA
528,GGGFCBA HGEDCBA GABDEFG AACEGGG GGFFEBA HHECBBB EGBCEDD FGFFBDA ACEFFGG BBGCCFH ABBDFHH BCCCDFH AABGGGG BACEGGG FHGEDBA
529,GGFEDBA ABEGGFF DACFFGG HGCCCCC ABEGGFF HCACFFF HDCACFF EEGAFDD ACCFFGG DBAECGH ABCDFHH BBCDEFH HHEBBBC ABDEFGH ABEFFGG
530,GGGEDBA ABEGGFF DACFFGG HHCBCCC ABEGGFF HCACFFF ABEDDHG HGDFCBB FHFFADB EBBEEEH ABBEFGH BCBCDGH HHGBBBC ABDEFGH ABEFFGG
531,EGGFEBA HGEEECA HHECBBB DGABEFF HGFDCBA ABCEGGG HGEDCBA HGFDCBA EAEHGBB CCCCCFH ABBDGHG BBCCDGH FFFGFAA ABDEFGH ABEFFGG
532,EGGFECA HGEEECA ABGGFEE BDGHDBB HGFDBBA AACFGGG FHGEDBA HGECCBA HGDEEBA DCCBBHH ABCDFGH ACDFFFG ABCDFGH HHCBCCC ABDEFGH
533,EGGFEBA HGEEECA DABFFGG HHCBCCC HGFDCBA ACCEGGG ABCEFGH ABCEFGH ABCDFGH BBBCEHH DEFGGDA GCBBCEH ABCEFGH FABDEFG ABEEFGG
534,EGGFEBA HGEDDCA HHECBBB DHABEFF HGFDCBA AABFGGG CGHFEBA HGEDDBA GGGEBAB DCDBBGH BBBCEHH HEBBBDF FFFFFCA ABDEFGG FGGFCBA
535,GGGFDBA HGEDCBA GHCCCCC ABCEGGG GGFFDAA EEHDBBB BBCCDHH ADFFFFF FGBABGG HDDEBEC ABCDEHG BBCBEGH ABCEFGH ADEFFFF AGGFECB
536,GFFFEBA HGEDCBA HGCBCCC AACFGGG FGGFEAA DDFHCBB CACDDGH DGABDFH CCDDDDH HCCCCEF BBEFGGC AAFFFDH ABCEFGH ACFFFFF EHGEDBA
537,EGGFDAA DDDCCHE GFBBCDH ABDEGGG EHGCCCC HHFCBBB ABDFFGG FFDEFAF EFFDAGB CDDDCDH CCCCCEH ACDDEFH ABCEFGH ABCEGGH AGGFDCD
538,EGGFEBA HGEDDCA HHECBBB DHABEFF HGFDCBA ABDFGGG HGFECBA HHFCBCB FEFGGBA GFEBAEF ABBDFHH DCCCBEH FFFGFAA ABDEFGH ABEFFGG
539,HEEEDCA CCBBGHG HGFFCAA ABDFGGG ABGGFFE DBADGGG HGEDDAB DABEHEG ABHGFDC HFBDCEB FFFFFBA BCDCDFH ABCEFGH ABCEFGH ABDEGGG
540,EGGFECA GGEEECA AEEEFFF FGHEBBB HGFDBBA AABGGGG EBACGGG FFEDDFA HGFECAA CBBBFEH ABCDFGH ABCDEGH ABCDFGH FFFGFAA CFGHEBA
541,DGGFEBA GGEEECA HHECBBB DHABEFF HGFDBBA ACDFGGG HGFDCBA HGFEBBA GDCDDEE BACDEHH ABCDEGH ADHFBCE ABCDFGH GGGGBAA ADHGECB
542,FGGFDBA DDHCCCC DDBAFGH ABDEFGG GGHCBBB HHGDBBB CCEBFFF FFDFACG BEGGBFC EEHEEAC ABDDFGH BBCDEGH ABCEFGH ABCEGGG CHGFDBA
543,EGGFEBA GGEEECA AAEFGGG FFGGBAA HGFDBBA CCCAEHH ABCEFGH ABCEFGH ABCDFHH ABCDEHH ABCEFGH GHGEBAB BBBDFGH ABCEGGG HFCCCCC
544,EGGFEBA DCCCCEH HGDBBCC CACEGGG EEDCCBH CBADGGG HGFECBA HDDBDFB EFCHFDA CCACDGH ABEFFGG EEFFFFA ABCEFGH ABDEFGH ABDEFGH
545,HGFDDBA ABFGGFF DABFFGG FGGGCAA BBBCFHH HEABDEE AACGGGG DECCHGA BEGGGBB BBCDCGH ABCDEHH BCCCDFH ABCEFGH FFFFFBA ABEEFGG
546,GFFFDBA HGEDCBA HGCCCCC AACFGGG GGFFEBA FHECCCC DEFFFAE FCFFFCB ACEFFFG EEEEEBE EECAHEE DEBBCEH BCCCDFH AACEGGG EHGEDBA
547,EGGFEBA DDCCCCH DACFFGG HEBCCDD EDCCBDH EBACGGG ABCEFGH ACCCFHH BCBDEGH DCBCBHG HHFCBBB BBCDEGH HHCBBCC ABDEFGH ABEFFGG
548,DCCCCFH GHEECBA FEFFFEA ABBCGHH GGGFDBA GBACFGG CBBEHEE DHCBGDB ADGGFDC DBBCDGH FFFFFDA FCBCCEH ABCEFGH ABDEFGH BCEEGFC
549,HEEEECA GHFDCBA HHCABCD ABBEGGG FGGFEBA DBADGGG HFBBDDC HEBBFDE GGGFDAB EEEEFFA ABDEEGG CCCCCFH ABCEFGH ABDEFGH BCEEGFC
550,GFEGECA HGEDCBA HGCACDE ABCDFHH FGGFEBA GGFGCAA HGFEBBB HFEEEAA GDFECDD BCCCDGH AACGEGG BBCDEGH ABCEFGH CCCCCFH FGFGFBA
551,EGGFEBA HGEEECA ABEFFFG FFGHBAA HGFDBBA AADFGGG FBAFFFF HHBBBEE CGACFEE CCBCCGH ABCDFGH ABCDEGH ABCDFGH ABDEFGH ABEEFGG
552,HFEDDBA ABEGGFF DABFFGG GGGEBBB BABEGGG HDABEEE ACDEFGG CBADGGG FFGFCCA ABDEDHG ABCDFGH BBBDEFH DEEFFFA ABCEFGH ABEFFGG
553,HEEEDCA CCCCBGH FEFGGBA ABDEGGG ACGGFEE EBADGGG HFDACED BFEHEBD FEHGDAB ABDDCHH FFFFFBA BCDCDFH ABCEFGH ABDEFGH ACEEGFC
554,HEEEDCA DCCCBGH FEEFFEA ABDFGGG ABGGFFE DBADGGG HDADFDE HEDGCBA GDFDFCA BCCCCGH FFFFFDA GDCCCDG ABCEFGH ABDEFGG GGFEDBA
555,EGGFEBA HGEDDCA DACFFGG HHCBCCC HGFDCBA CBADGGG ABBDFGH ABDEFHH BBCEDGH DFDBAGH HHGDBBB BBCDEGH GGGDBBB ABDEFGH ABEFFGG
556,EGGFEBA DCCCCFH FAADFGG HDBCDDD DCCCBFH EBADGGG GGFBBCF CFFEGDA GCFEGBB HGBBBDE ABCDFGH ABCDEGH HCCCDDE ABDEFGH ABEFFGG
557,HGEDDBA ABEGGFF DACFFGG HHCBCCC ABDFGGF HCACFFF FEGCEFA BFGGGBB ABEEHDF GFABDEG ABDDFHH ABCDEGH HBCCDDE ABDEFGH ABEFFGG
558,EGGFEBA HGEDDCA AABGGGG EFFGGAA HGFDCBA BBBCGHH ABCEFGH ABCEFGG ABBEGGH BBCDDGH ABDEFHG HGDBBCD ABCEFGH HHDBBCC ABEFFGG
559,HGFDDBA ABFGGFF DABFFGG GHGBBBB AACFGGG HCABFFF EBCCCFH GDBEDAG HFBBCFE BCCCBHH ABCDFGH EEEFFFA ABCEFGH ABDEFGH ABEFFGG
560,EGGFEBA HGEDECA AHGEDCC CFHBCDD HGFDCBA ABDFGGG HGFECBA HGFECBA GCDDFBF EDBBCGH BBCCEGH HDDCBCG ABCDFGH ABDEFGH ABEEFGG
561,GEFGDCA HGEDCBA HEABDFF ABCDGHH FGGFEBA HGGCBBB HFEGBBB GCFGGAB ACEFFGG HHGBCCB BBCCEGH ABDEFGH ABCEFGH ACFFFFF FHGECBA
562,GGGEDBA ABEGGFF DABFFGG HHCBCCC ABDFGGF HCACEFF BDBEHDD FHDCBEB DCGGFBB AEGCBFH ABCEFGH BBCDEGH HHCBBCC ABDEFGH ABEFFGG
563,EGGFEBA EDCCCCH DACFFGG HHBBCCC EEDCCBH DBADGGG ABDEFGH ABCDFGH ADEEBGH FEEFFFA HECBCDD BBCDEGH HBCCDDE ABDEFGH ABEFFGG
564,EGGFEBA CCCCCFH FAADEGG HDBCDDD EDDCCCH EBADGGG HDCCCCC DACEFGG AEFCFFE CCBCCHH ABCDFGH ABCDEGH ABCDFGH HCCCDDD ABEEFGG
565,EGGFEBA CCCCCFH DABFFGG HEBCDDD FEDCCBH EBACGGG ABCEEGH ABCEFGH ABCDGGG BBCCCHH HHFCBBB BBCCDGH GGGEBBB ABDEFGH ABEFFGG
566,HGEDCBA ABEGGFF DABFFGG GHGBBBB AADFGGG HEABDEE ACEGFGD FGDDEBC EFBFFFA BCCCEGH ABCEFHH BBCCEGH ABCEFGH FFFFFDA AADEFGH
567,EGGFEBA DCCCCEH HGDBBCC DACEGGG DDCCBEH CBADGGG HGFDCBA HHFDBBA EDDBDHE CCCCDFH BDBBEGH ABCEEGH HCCCDDD ABDEFGH ABEFFGG
568,HGEDCBA ABEGGFF DACFFGG HHCBCCC ABDFGGF HCABEFF BADFGGF GGBABEF BCCCFHH FGBBBDG AACEFGH ABCDEFH GGGEBBB ABDEFGH ABEFFGG
569,EGGFEBA DCCCCFH FAADFGG HDBCDDD HGFDBBA ACEFFGG GCGDACG FFFHCBA GAEFEDC CCBCCHH ABCDFGH ABCDEGH ABCDFGH HCCCDDD ABEEFGG
570,HEEEEDA HGEDCCA GHCABDD ABDEFGG GGGFEBA DBADGGG CCCCCGH HFEDCBB FFEEEFA FFFFFBA ACEEEGG CCCCCFH ABCEFGH ABDEFGH BCEEGFC
571,EGGFEBA EDCCCCH FAADFGG HEBCDDD HGFDCBA ADDEFFF HFCCCBC EACCGEG ADGGFDD CCBCCHH ABCDEGH ABCDEGH GGGDBBB ABDEFGH ABEFFGG
572,HFFFBBB FEEDHBA HHCABDE ABCEGHG DDDDEHB HHGDBBB AAEDGGG DGABDFH HDFBCFB EEEEEGA CCECBHE BEFDCDH AADEFGH AAFFFGG EHGEDBA
573,GFEFEBA HGEDCBA HDABDEF ABCEGGG FGGFEBA HGGEBBB HGGECAA HHFBBBC ACEFFGG CDDDEHD BBCCEGH ABCDEGH ABCDFGH ACFFFFF ABCEFGH
574,GFFGDBA HGEDCBA GABDEFG AACEGGG FGGFEBA HHECBBB HEFACED FGDCFDA DEFFFFA AADEEGH BBBCEHH BCCCDFH BBCCDHH AACEGGG FHGEDBA
575,EGGFEBA DCCCCFH FABDFGG HACDEEE CCCBCHH EBADGGG HFCCCBC AFEEDCH HDDEDBB CCBCCHH ABCDFGH FFFFFCA ABCEFGH ABDEFGH ABEFFGG
576,GFFFDBA HGEDCBA HFBBCDE ABCDGHH FGGGEBA GGGFBBA HEDEBBB HGCCDBC FGGGBAA DECADGH BBDECHH BBBCEGH ABCEFGH ABDEGGH AAFFFFG
577,GFGECCA GFDCBBG HHCACDD ABEFFGG DDDDDGE HHFCCBA ECACEFH ADEHEDD HADEEEE HFDBCCC BBBFEFH DCCCAFH BCCCCFH BBBCFGH ABCEFGH
578,GFFGDBA HGEDCBA HFCACEF ABCDFHH FGGFEBA GGGGCAA HGFDBBA BCEFGGC ACEFFGG FFBBBDH BADEFGH ABDEFGH ABCEFGH AAFFGGG FHGECBA
579,GGGFDBA HGEDCBA GHCBBCC ABCEGGG GGGFDAA DDHECCC CCDBDHG ACFFFFF FGCDDDD BCBCDGH ACCDEGH EBECBEH ABCEFGH BBCCCHH CHGFDCA
580,EGGFEBA EEDCCBH HGDCBBB FBACFGG EEDCCBH BBADGGG HGGECBA GGGEBBA HGEEBAB CBBCEHH AAEFFGG ABDEDFH HFBCCCC ABDEFGH ABEFFGG
581,EGGFEBA DCCCCFH EDEFFFA ABDFGGG CCCBCHH EBADGGG ABCEFGH ABCEGGH CGHGBBB GGGGDAA BBCDEHH GGGGBAA ABCEFGH ABDEFGH ABDEFGH
582,GGGEDBA ABFGGFF CACFFGG FFGGGAA CBBBEHH HEABEEE BBBCEHH ABDEHFF DBBBEGH BDCBDHH ABCDEHH BBCDEGH ABCEFGH HGCCCCC ABEFFGG
583,GGGFDBA HGEDCBA DHECCCC ABCDGHH GGFFDBA DDHEBBC AEDEFFF EFGBBCG GHDCCCC CCBCCGH BABDEHH BDBCDFH ABCEFGH BCCDDEH AGGFECB
584,HGEDDBA ABFGGFF CACFFGG FFGGGAA CBBBEHH HDABEEE AABFGGG DEBBCGH DDGGFBB CCBCCHH ABCDEHH BBCDEGH ABCEFGH CABDFGH ABEFFGG
585,EGGFEBA BBBBGHH CACFGGG ABDFGGG CBBBFHH EBACGGG AACEFGH ABCDFHH DEFHFCA HHGDBBB AACDFGH HGCCCCC ABCEFGH ABDEFGH ABEFFGG
586,EGGFEBA HGEDDCA ADEFFFF GHGBBBB HGFDCBA BBBCGHH ABCEFGH ABDEFGH ABCEFGH ACCEFHG ABDFGHC HEBBBDF ABCEFGH HCCCDDD ABEFFGG
587,GGGFDBA HGEDCBA HFCBCCD AAEFGGG GGGFEBA EHFCBCC DEBGHDB CBDGFDG BFEGEBE BCCCDGH DBDDCEH CDBCEEH BCCCDFH BACFGGG EHGEDBA
588,HEEEDBB BBBCHGG GFGGBBB ABDEFFH GGFFEBA EBADGGG FBBBFGH FDGGCAC EGFEFAB DCCDCEH GGGCBBB DCBCCFH ABCEFGH ABDEFGH ACEEGFC
589,HEEEDCA DCCCBGH FEFFGBA ABDFGGG AGFFFDC DBADGGG HCDDDCC HGGEDAA GFGECBB DDDDCDH HCCDDDD CCCCCFH ABCEFGH ABDEFGH ACEEGFC
590,DGGFEBA GGEEECA ABEFFFG FFGHBAA HGFDBBA AAEFGGG BBEEFFF GGGACDD FEEGECA CBDBCHH ABCDFHH ABCDEGH ABCDFGH FFFFFCA ABDEFGH
591,GEFGDCA HGEEDCA BCBCFGH ABDEFGG GGGGDAA HHGDBBB ADGHCDC GHFCCBB FFHCCCC BBCBEGH ABEEDHH BBBBGHH ABCDFGH AACEGGG FHGEDBA
592,EGGFEBA HGEDDCA ABEFFFF GGHEBBB HGFDCBA AACFGGG ABCEFGH ABCFGGH ABCDFHH BCDDBHH CDFGGFA HCBBCEH ABCEFGH ABDEFGH ABEFFGG
593,GEFGECA HGEDCBA EABDFGG AACEGGG FGGFEBA HGDCBBB HDGDBCC HFBBCCD HEGBCCC EBDCFEF BBCDEFH ABDDEGH ABCEFGH AEEEFFF FHGECBA
594,EGGFEBA HGEDDCA AAGGFEE BDGHDBB HGFDCBA AACFGGG FGHFCBA HGCCDBB HGGDBBA BBDDCHH BBCCEGH HFCCBBF EEEFFFA ABDEFGH ABEFFGG
595,HGEDCBA ABEGGFF DACFFGG HGCCCCC ABEGGFE HCACFFF AEFDFCG BBGDFEF BBCHFEE DEACCHG AACEFHH BBBDEFH HFBCCCD ABDEFGH ABEFFGG
596,HGFEDBA ABEGGFF DACFFGG HFCCCCC ABEGGFF HCABFFF BBDBFFH GGEGDAA CCDDECH CCBCEGH ABCDFHH BBBDEGH HHGBBBC ABDEFGH ABEFFGG
597,EGGFEBA HGEEECA ABEFFFG FFGHBAA HGFDBBA AABFGGG EFEGCBC BEFFFFA EDCCBEH CBBBEHH ABCDFHH ABCDFGH ABCDFGH HCCCDDD ABEEFGG
598,HEEEDCB AABGGGF HGGBBBB BBCDDGH GGGFEBA EBADGGG GABCCGH GGGCBAB HFFEACD CCCCDGH HHCBBCC CCCCCFH ABCEFGH ABDEFGH ACEEGFC
599,EGGFEBA DCCCCEH HGDCCCC FBADFGG HGFDCBA BBBDGGG FFHFCBA BFHFFCA ABCFFGG CCCCCFH GFCAAFG EEFFFFA ABCEFGH ABDEFGH ABEFFGG
600,HFFFDBA HGFEDAA EBACEGH ABCEFHG FGFFEBA HGFDBBB FBEGHBB GHGDBBB BCFDEDG CDFBCEG BBBDFGH CCCCCFH BBCCDHH AADEGGG FHGECBA
601,EGGFEBA HGEEECA HHECBBB DHABEFF HGFDBBA ABDFGGG HGEEEBA HGFDCBA GGGEBCA CBACDGH BBCCEGH HEDBBCG ABCDFGH HCCCDDD ABDEFGH
602,EGGFEBA EDCCCCH FABDFGG HDBCDDD HGFDCBA EBADGGG HGEBDBB BBFGGGB DCGHGAA DCCCCHG ABCDFGH ABCDEGH AACEFGH ABDEFGH ABEFFGG
603,HGEDCBA ABFGGFF DACFFGG FFGGGAA CCBBEHH HFBBDDD BACDGHH FGDACEF CEDEFBF BBGGADF ABCDFHH BBCCDGH ABCEFGH FFFFFDA AADEFGH
604,GGFFDBA HGEDCBA HGCCCCC AACFGGG GGGGEBA FHECBCC ABDEFHG CBDDDEH GGGEBBB FGCCCEF EEDDDEE CBBBFGH ABCEFGH AEBDFGG EHGEDBA
605,HEEEDCA CCBBCHG HGEEDAA ABDFGGG AEFFFED DBADGGG BADDEFH CDCFBGG ABCDFGH AADFGGG GGGGBAA CBBCDFH ABCEFGH ABCEFGH ABDEGGG
606,CGFGDCB HHEBCCB BABFGGG CDEFFGA HGEDCBB GHGDBBB ABEFFDH DBCBFGG EACDFGG BECCFDH AACGGGG ABCDEGH ABCDFGH AACEGGG EGFECBE
607,EGGFEBA HGEEECA AAEFGGG EFFGGAA HGFDBBA BBBCGGG ABCEFGH ABCDFGH ABDEFGH ABCEEHH ABCDFHH HGEDBBB ABCEFGH GGGGBAA ABEEFGG
608,EGGFEBA BBBBGHG DACFGGF ABDFGGG CCCBBHH EBACGGG ABCEFGH ABCDFHH ABEFFFG BCCCDHG HGCBBCC BBCDEGH HFBCCCD ABDEFGH ABEFFGG
609,EGGFEBA EDCCCBH HGDCBBB FBACFGG DDCCBEH CBADGGG HGEECBA HGDDDBA GDEACEG BBCDDFH ABEEFGG ABCDFGH ABCEFGH ABDEFGH ABEFFGG
610,HGFDDBA ABEGGFF CACFFGG FFGGGAA CBBBEHH HCABFFF AACEGHG HEFDEBB DFFADEE CCCBCHH ABCDFHH BBCDEGH ABCEFGH ABCEGGH HFCCCCC
611,GFGGEBA HGEEDCA BCBCFGH ABDEFGG FFFFEDA HHGDBBB GHFEAAC GGFGBAB ACEFFGG BCCCDGH AACFFGG CCCCCFH ACFFFFF ABCEFGH ABCEFGH
612,EGGFEBA HGEDDCA AAGGFEE CDGHCBB HGFDCBA AACFGGG CGHEDBA HHECDBA HHECBBB BDCCBHH AAEGFFF BBCDEGH HHCBCCC ABDEFGH ABEFFGG
613,EGGFEBA DDCCCCH FAADFGG HHBBCCC HGFDBBA ACEFFGG EFCCCCH HHEDCBA HHCCBBE BBCDDHH ABCDFHH ABCDEGH ABCDFGH HCCCDDD GGGECBA
614,DGGFEBA GGEEECA AEHFEDD BEHFCCC HGFDBBA AACFGGG GHGECBA HHEDCBA HGCBAEE BDBDCHH ABCEFGH ABDEGHG ABCDFGH EEEFFFA ABFFGFE
615,EGGFEBA FEDCCBH HGDCBBB GBACFFF HGFDCBA ABBEGGG GGGECBA GFHDCBA HEBFDBD CBCDDFH ACFEEFG ABDFFEH HFBCCCC ABDEFGH FGGFCBA
616,GGGFDBA HGEDCBA HFABDEF ABCDGHH FGGFEBA HGGCBBB HGFDBCA HGCCDBC GGCGCBB CCCDEEH BABEFHH BBBDEGH ABCEFGH ABCEFGH EEBCBEH
617,EGGFEBA HGEEECA AAEFGGG FFGGBAA HGFDCBA AACFGGG ABCDFGH ABCDFGH AADFFGH BBBDFHH AACEFHG HFCBBCE ABCEFGH HHCBCCC ABEEFGG
618,EGGFEBA DCCCCFH FAADFGG HDBCDDD HGFDCBA EBADGGG HEBBFBF BFEEEGB GHCBBCE DBCCCHH ABCDFHH ABCDFGH HHCBCCC ABDEFGH ABEFFGG
619,GFFGDBA HGEDCBA CCABEGH AADFFGG FGGGEBA HGECBBB GHEEBBB HFBBCCD FGGGBAA DDDDDCH CBBCFGH ABCDFGH ABCEFGH BBCCCHH FHGECBA
620,EGGFEBA HGEEDCA BHGEDCC CFHADEE HGFDCBA AADFGGG GGGECAA GGGECAA HHFCACB CACCEGH BBCCEHH FCBBDDH EEEFFFA ABDEFGG FGGFCBA
621,HFEDDBA ABEFGFF DACFFGG HHCBCCC ABDGGGF HDABEFF BBBGGGF HHBDCBB BBGGGDC ABCDDGH ABCDFHH BBCCEGH FFFGFAA ABDEFGH ABEFFGG
622,EGGFEBA DDCCCCH DACFFGG HEBCCDD GFDCBBH CBADGGG ABCDFGH ABCDFGH GCBECCH ECCBBHG HHECBBB ABCDEGH HEBCCDD ABDEFGH BGHGDBB
623,EGGFEBA AAGGGFE GFGGBAA ABDFGGG BABGGGF EBACGGG ABDDEGH AAFGGFE BADEDGH ACGFBFE HHFCBBB EEEFFFA ABCEFGH ABDEFGH ABEFFGG
624,EGGFEBA HGEEDCA AHGEDCC CFHBCDD HGFDCBA AADFGGG GGFFEBA HGECBCB HGDDCBA FEBBBFH BBCCEGH GEBBBDH EEEFFFA ABDEFGH ABDEFGH
625,EGGFEBA HGEDDCA AEHGEDD CEHFBCC HGFDCBA AACFGGG DGGFFCA HHEDCBB GGGFBBA BCBCDHH BBCCEGH CEDCBDH EEEFFFA ABDEFGH ABEFFGG
626,EGGFEBA EDCCCCH HGDCBBB EBADFGG HGFDBBA ACDEGGG HGFDCAA GHFECBA FGHFBBA CBBCDHH BBCCEGH HDCBBCH ABCDFGH GABDEFF FGHFCBA
627,EGGFEBA HGEDDCA AHGEDCC CFHADEE HGFDCBA ABDFGGG FHGFCBA HGFECBA HFDBAGD BDBBCHH BBCCEHH CCCCCFH FFFFFCA ABDEFGH ABEFFGG
