,0
343,AABCD CBDBA BADCC DDCAA DCBAB ABCDD AACDD DDCBA DCAAB ABBDD ACCCC ABDBB
344,DDCAA DCABC AACDD CCCCA DCBBA ABCDD DDBAA DAACD AABCD ABDCB CCCCA BCBCB
345,ACCCC CDCBA ACDCC CDCCA AABDD DDCAA AABCD DCAAC ABDDB DBBBB AACDD AACDD
346,ABCDD DDCAA DDBAA AABCD ABCDD DDCBA AADBD ABCDD DDCBA DCBAA ABCDD ABCDD
347,CDCAA DDCBA DDCBA ABBCD ABCDC CBBDA CAACD ABCDC DDBBA DCCAA ACBBD AABDD
348,BCCAD BCDBA ACDCB CBABD BCDCA ABCDD DCBAA ABCDD ABBDC CDDBA ACDDA ABDDC
349,ABCCD DCDBA AADDC BABDD CACDC DABDB AABCD ADDCB BDDBA DCBBA BDDAA ACBBD
350,AABCD ABDDC AADDC DDCAA DBABC ABCDD DDBAA DCBAA ABBCD ABBCD DCBAA ACDCA
351,DDCAA ABDBC DCAAC ABCCD AABDD DDCBA AACDD DBABC AACDD DDBAA DDCBA DDABB
352,DDBAA CDBAB AABDD BABCD ABCDD CDDBA CABDC DBBCB DCCBA CCCBA BABDC BBCCC
353,ACCCD DBCCA BABDD AACCD ABCDD ACDDA DCAAC ABDCC BDDAB DDCAA ABCDC AACDC
354,DDCAA CCBCA DCBAB AABCD AACDD BABDD DBAAB ACCCC DDCBA DDBAA DCBBA ABCDC
355,DDAAB DADBB DCABC ABCDD DDCAA DAACD AACDD DDCBA BABCD ABCCD DCBAB ABCDC
356,DDCAA BCDBA ADCCC CDDAA DCBAC ABCDC DCBAA ABCCD ACCDB AACDD BAACD AACDD
357,CABAD BABCD DBBCA CDDAA DBABC AACDD DCBAA CBABD AABCD DCAAC BABDC DCABC
358,AABCD ACBDC DDCBA DDCBA AABDD ABCDD ABDCB DDCBA DDBAA ABCCD ABCCD CDDBA
359,CBACD DDCAA ADDBB CBACD CDAAD DBCDA DDBAB DCAAC CDCAA BCDCA ABDDB AACDC
360,DDCAA DCBAA AACDD AABCD ABDDC DDCBA DBBAD DAADC DDBAA BBDCA BBACD ABCCD
361,DCABB AADCC BACCD BCCBB ACBDD DBABC AABDD BADBC DCBDA DBBAC BCDAB CCCAB
362,DDBAB CDCAA AACDD CCDCA ADDBA BDDBA CCAAD BADDB DDCAA ABCDC DBACB AABDD
363,CDDBA DDBAB AACCD ADCDB DDBAA BABDD AACDC DDCAA DBABD ACBCD CDCBA AABCD
364,DDBAA DCBAB BCACD AACDD ABBDD BCDCA CCACC CDCAB ABDBD DCBAA DCCBA BCCCB
365,CCDAB DDBAA CCACA AABDD ABCDD BBCDB DCAAB ABCDD DDCBA DDCAA BBBCD ABDCC
366,ABBBD CBACD DDCAA BDDCA BABDD ABCDD ACDCA DDBAA CDDBA ABCDD BABDD CAADD
367,BDDAB BBCDA BACCD AACDD ABBCD ADCCB DCBBA ABDDC DDCAA ACDCB DDBAB ABBCD
368,CBADB AACDD DBDBA ADDBB DDBAA ABCDD DDCAA DCBAB AADDC BBCDA ABDCD DDCAA
369,DDCAA ADBBC AACDD DCCBA DCBAB ABCDD ACDCA DDCBA AABCD ABBDD DDAAB ABADD
370,ABCCD DCCBA DCBAA DCAAB AABDD AABDD CDCAA AABCD AACDD DBBBA DCCAA AACDD
371,DDBAA ABBDD AACDD CDCAA DDCBA AABCD ACDCA DCBAA ABCDD BABCD CBDBB DCBAA
372,DDCAA BBBCD BBACD AABDD ABCDD CCDAA AABCD DDCBA DCCAA DABAD BBBBD DDCBA
373,DDBAA DDBAC BABCD ABCDD ABCCD DCCBA CABDD DBBBA DDCAA CCBBB CCDBA DCBAB
374,ABCDD DDBAA DDBAA AABCD ABCDD DDCAA CDCAB ABCDD DDCBA DCBAA ABBCD ABCDD
375,CAADD DDAAB CDCAA ACDCA AACDC BAACD CAACD ABDCB DDACA DDCBA DBACD ACCBD
376,DDBAB BABCD AACCD DCCBA DCBAB ABCDD DDBAA BAACD ABCDD AABCD DCCBA DCCAA
377,AACDD BDDCA ADCBB CAACD ABCCD DDBAA ACDCA AADDC DCBAA AADDC BABCD CABDC
378,BDCAA DDBAA CDBAC BABDD AACDD DDAAB BDDBA BAADD DDBAA ACCDB DACCC AABDD
379,DCBAD ACCBD DDCBA DABBC AACDD AAADD DBABD ABDCC DDCBA DDCBA DDBBA ACCCB
380,ABDDC DDBAA ABACD DDBAA ABCDD CDDBA BDDAA ACDDB DDCAA AACDD DDBBA AABDD
381,ABCDD DDCAA ABCDD DDBAA AACDD BDDCA AACDD ACDCA DDCBA AABDD DDBAA ABCDD
382,AABDD BADCA CDCBA DDACA DCAAC ABCDD ABDDC DDCBA DBABD ABBCD AACCD DDBBA
383,CAADB ABCDC BABDC DBADA DBABD ABCDD DDBAA DCBAA ABCDD ABBDD BADBC DDCBA
384,BBACD DDCAA DCABB BCCBC ABCDD AABDD DCABC ACCCC DDCAA DCCCA CCADB ABCDA
385,DCBAD CDCAA DAACC ABBCD ABCDD BBDDA DBABD ACCCC DCDBA DCCBA DBABB ABBDD
386,AACCD CBCCA ABCDD DCCBA DDCBA ABCDD ADDBA DCCBA AABDD AACCD CBDBA DDCAA
387,CDDBA DDBBA DBABB AABDD ABCDD DDCBA AACDD BACDD DCCBA DDBAA ABBCD ABBCD
388,ABCBD ADDBB ACDCB DDCAA AABCD ABCCD ACDCA DDCBA DCBAA ABBDD BABCD BBDAB
389,ABDDB DBDBA DCAAD DDCAA ABBDD ABCDD ACDCB DDCAA DCAAB AACDD CDCBA ADACC
390,DDCAA ABBCD DCAAD ABDDC DCDBA DAACD CDDBA DCBAC AACDD DDCAA DCCAA DCBAA
391,ABBDD DCBBA DCBAA AABCD ADCBC ABBDD BAACD ABCCD DCCBA DCBBA BABCD ABCDD
392,CACCB DBBAD BABDD BABCD DCABC DDBAA DCCAA DDBAA ABCDC AACDC BAACD DCAAC
393,ABCDD DDCAA DDBAA AABCD ABCDD DDCBA AACCD ABCDD DDCBA DCBAA ABBCD ABCDD
394,DDBAA AABDD AADDC DCDBA DCBAA ABCDD DDBAA AACDD ABCDD DDCAA DCAAB BBCDB
395,DDBAA DCBAA BBACD AABDD ACCDC DDCBA BAADD AACCD DCCAA DCBBA CCABD AACDD
396,DDBAA ABBCD ABCCD AACDC DDCBA DDBAA AABDD DCBAA ABCCD CDDBA DCBAA BDBBC
397,ACCCD DDCBA DCBCA DDCBA AACDD AACDD CDCAA AABDD AABDD DBBDA DDAAA ABBDD
398,CDCAC DDCBA AACDD DDBAA ABCDC DAACD ABCDC DDBAA CDCBA ABCDD DDCAA ABDDB
399,ACCAD DDCAA BDDBA CAACD DDBAA ABBDD AACDD DDCAA DDCBA AACDD DBABD DDBAB
400,ACCDA BDDBA CDCBA ABDDC DBABD CDCBA CBACD DBABD CDCBA CABCD BABCD CAACD
401,AACDD ACDCD DCCBA DCCBA BABDD ABCDD DDCAA DDCBA CABCD ABCCD CADCB DCCBA
402,CDDBA DCBAA DCCAA AACCD ABCDD BCDDA DBABC AACDD CDCCA DCAAA DCBAB ABCDD
403,DDCAA BABCD CCCAB DBBAB AACDD AACCD DCAAB ABDDC DDCAA DCBAA BBACD BBCDA
404,DCDAA BDDAA ABDDB AABDD CABBD DCAAB CABDC ADCBC DDBAA DDBAB DDBAB DDBAB
405,ABBDD AACDC DDBAA ADDBA AACDD AACDD DCBAA CDDBA ABCDC BABCD CDDBA ABCDD
406,CCCCA DDBAB DCAAC BABCD AACDD DBABD DCAAB ABCDC ACDCA CDCAA BDDCA ABDCC
407,DCBAB AAACD ABCDD ADCDA DDCBA DCAAB ABDDB DCAAC ABCDD ACCCD DCCBA DDBAA
408,ABCBD CBACD DDBAA ADDBA ABCDD AABCD DDCAA BABBD DCAAD CDCBA ABCDD CABCD
409,AABDD ACDCA AABDD DCBAB DDBAB ABCDD ABDCB DCAAA DBAAC DDCAA CAACD DAACD
410,CCBBC DDBAA CAADC ABCCD AACCD CDCBA AABDD DDCAA DDBAA DCCAB BABCD CDBAA
411,DDBAA ADDBB ACBCD ACDCB DDCBA AABDD DCBAA ABCDD CDDBA DCCAA CCAAD BDDBA
412,ABCDD DDBAA DDBAA AABCD ABCDD DDCBA CDCAC ABCDD DDCBA DCBAA ABCCD ABCDD
413,BADDC DCABC CBABD DCABB CDCAA ACDAC ABCBD BABDD BAACD CAACD CAACD CAACD
414,ABCDD DDCAA DDBAA AABCD ABCDD DDCBA BCDAC ABCDD DDCBA DCBAA ABBCD ABCDD
415,DCCBA ADDCC ABBCD AACDD CDCBA DDCAA AABCD DDCAA DCBAB ACCCD ABDCC DBBBC
416,DCAAC ADDCB CABCD ADDCA DDBAA ABCDD BDDBA DCCBA AACDD ADDBA ABBCD DDCAA
417,ABCCD DDCAA DBCBA DDCAA AABCD ABBCD ACDCA BABDD AABDD DCBBA DDBAA ABBDD
418,ACDCC DCABA ABBBD DDBAA AACDD ABCDD CDDBA DDCBA DBABD CDDAA DDABB BADBD
419,ABCCD DAADC CAACD DACCA ABDDC ADDCA AACDD AACDD DDCBA DCBAB CDAAC CABDC
420,BCABD DDCAA DDCAA DDBAA AABCD AACDD DDBAA ABCDD ABCDD BCDCA DDABA ABCDC
421,ABCCD AABDD ABDDC DDCAA BAACD ABCDD AACDD DDCBA DDCAA AACDD BADCB DCCAA
422,ACDDB DBACB CDBAD AACDD ADDCA AACDD DCAAB ABDCC DDCAA ABCCD DCAAC BDBAD
423,AADDC DCCAA CDCBA DDCAA BABDD ABBCD BDDBA AACDD DDBAB DCBAA DDCBA AABCD
424,AACDD ABDDC ABDCC DDCBA DCBAA ABCDD AABCD ADDCB DDCBA DBABC ABBDD BDDBA
425,BABDB ACDCA ACDCB AACDC AABDD DCABB CABDC ADDCA AACDC BBACD DBAAC DDAAB
426,BBBBD DDBAA ACDCA BABCD DDBAA BABCD ACDBA DCBBA DCAAC CDDBA AABDD DDBAB
427,DDCAA AACDD CCDBA DDCBA CAACD ABCDD DDBAA DCBAA AACDD ADBBD AABCD DCCBA
428,CBBAD CDCBA DDCAA AABCD ABCDD BBDDA DCBAB AACDD CDCAA DDAAB CCABD AABDD
429,AABDD ACDCB CDCAA AACDD ABCDD DCCAA DCBAA ABCDD ABDCD BACDA DADBC DDCAA
430,CCBAD ABCDD BBCAD DCCBA DBABD ABCDD ACDCA DDCBA CBABD ABCDD AABDD DDCBA
431,ACCAD CCCAB DDABA DDBAA ABCDD ABCDD CDCAA DDCBA DCBAB AACDD DCBBA ABDAD
432,ABBDC DDBAA DDCAA DCBAB ABCCD BBACD CDDBA AACDD AABDD BCDDA CDBAB BACCD
433,DBABC AABDD CDBAA CAACD DCBAA DCBAA ABDDB DBABD ACACD DCCAB BABDD DDBAA
434,CABDB AACDC BAACD DAABD DBABB DCABA BACDC ACBCD CDBBA CDDBA ABDDB AACDD
435,AACDD DCABA BDDCA DCCAA AABDD ABCCD ABDCC CDDBA DDBAA AABCD ABCDC CDABB
436,ABCCD CDDBA AACDD DCAAB AACDD DCAAB ABDDC DCAAD CDDBA CDDAA AACDD AABDD
437,CBCDA ABCDD DCCAC DDBBA DDBAB ABCDD DDBAA DCBAB ABDCD BDDBA BDABD DCBAA
438,DDBAB CCCBB BABCD ABCCD ABBCD CBDDA CAADD DBBBA DCBAA ABBCD CCDCA CBCDA
439,ADDCA DBCBA AABDD DDBAA AABDD ABCDD CDCAA DDCBA DDBAA AABDD DDBAB AADBD
440,ABCDD DDCAA DDBAA AABCD ABCDD DDCBA BCCAC ABCDD DDCBA DCBAA AABCD ABCDD
441,DDBAA DCCAA BBBAD ABBDD ABBDD DDCAA CCBAD CACDC DDBAA CDCBA DCABC CDBCA
442,DDBAB DCBCA CDBCA DDCAA ABCCD ABCCD DBABB ACCCC DCCBA DDBBA ABCCD CCACC
443,BDBBA DCCAA DCBAB AABDD AACDD BBDDA BAACD ABCCD DCDBA DCBAA DBABD AABDD
444,CCCAB DDBAB DBCAC AACCD ABCDD CDBCA AABCD DCCAA DDCAA DCBBA AACDD CBDCA
445,BAADC AACDC BABDD CAACD DBAAC DBABC DBDAA ADDBB ACDCA AACDC AABDD BABCD
446,ABCCD DACCA BBDDA DDBAA ABCDD ACDCB ABDCC ACDCA DDCAA AACCD BDDAA DCDAA
447,ABDDC DDBAA CDBCA CCDCA AACDD CBABD BDDBA DABBB DDBAA ADBBD CCABD ABBDD
448,BDDAB DDBBA BABDD CDCAA DDBBA DCAAC AACDD DDBAA DCAAB AABDD DBABD ABACD
449,ABCDD CDDAA DDCBA DCBAA ABCDD BDDBA DDBAA ABDDB DDCAA AACDD ABCCD CDDBA
450,ABCDD DDBAA DCBAA AABCD ABCDD DDCBA CDCAC ABCDD DDCBA DCBAA ABCCD ABCDD
451,DDCAA AACCD AABCD DCCCA DDBAA ABCDD DDCAA DCBAC ABCDD BDCAB CCCCA CDCAB
452,DDBAB DCBCA DCBAB BADBD AABDD BBCDA DCBAB ABCCD DDCAA DDBBA BBBCD ABCDB
453,ABDDC DCBAA ACCCD ABBDD ABDDA DBCBA DDCAA AACDC ABBCD DDABD CAACD BABDD
454,ABCDC DBACB CDCBA AABDD AABCD DDBAA ACDBA AACDD DCCAB BABDD DAABD CDABD
455,CDBAC DCBAA DCABA AABDD ABCDD BBCDA DCAAB ABDCD DCDBA DCCAA ABCDB ABCCD
456,ABCDD DDCAA DDBAA AABDD ABCDD DDCAA BCDAC ABCDD DDCBA DCBAA ABBCD ABCDD
457,DDCAA CBBBD DABCC AABCD AACDD AABCD DCBAA ABCCD DDBAA DCBAA DDBBA CDBBB
458,ABCDD AACCD BCDDA DDBAA ABCDD ACDCB ACDBB BDDCA DDCAA AACDD ADDBA DCDBA
459,BAADC ABCDD CCDAB DDBBA DCAAB ABCDD BDDBA DDCBA BABDD ABBCD AADCC DDCAA
460,CBABD DBDAB CAACD DCBAB ACDCB DDAAC DBABB AACDC DDBAA ABCDC ACDCB BDDCA
461,DCABA AACDD DBBCA ACDCA DBACA DBABD ACDCA CAACD AACCD DDBAB BBDCA BABCD
462,DDCAA ABCDC CCDAA DDCBA BABCD ABCDD DDBAA DDCBA AABDD DDBAB DCABB CDDBA
463,DBADC BDBAC AACDC ABDDC BDDBA DDCAA DDBAB ACDCA AACDD DCBAB ABCDC AACDC
464,DDBAA CDADA DCABB ABCDD CDDBA DDCBA AABDD DDBAA AABDD BBBCD DCAAB DDBBA
465,DBBAC BABCD CDBAA ACDCB DCDAA ABCDD DCBAA AABDD AACDD DDAAB AABDC DCBAB
466,AACDD ACCDB CDCAA DDCAA BABDD ABCDD BDDBA DDCBA DCAAC AACDD ABDCD CDDAA
467,ABBDD DDCAA CDCBA DCBAC AACDD AABDD DCAAB AACDC DCBAC CCCDA BBCCC ABCDC
468,DDCAA DDBBA BCBCC ABCBD AACDD DCABB ABBCD ABCDD DDBAA DCCAA CDBBA AACDD
469,CDCBA DCBAA DCCDA ABBCD ABCDD DDBAB CDCAA ACDCB DDCBA DDABA ABCCD ABBCD
470,ABCDD DDBAA DCBAA AABDD ABDDC DDCBA BCCAD ABCDD DDCBA DCAAB ABBCD ABCDD
471,AABDC AACDD BCCAD DCBAB DCBAB ABCDD CDDBA DDCBA AACDD ABCDC ACDBC DCBAA
472,DDCAA BAACD ABCCD ABCDB DDCAA BABCD CDDBA BAACD ABCDD ACCAD DCBAA DCCAA
473,BCCAD DCAAC DDCAA ABDDC AABCD DDBAA AABDD DDCAA DCBBA BABDD DDCAA BCDCA
474,ABDCD CCDBA ABDDC DDBAB CDCBA ABDDA BAACD DDCAA DDCBA ABBDC AACDC AACDC
475,ACCCD ACDCA DDBAA ABBCD AACDD ABBCD DBABB ACCCD DDCBA DCBAA AACDC ACDDB
476,DDCBA DCBAA BDBAC ABBDD ABBDD AACDC DCAAB ABDDD CDDBA DCBAA DCCAA BCACC
477,ACDCA CDCBA BBADD ACCBD DCAAB CBABD ACDCA DCBBA DBABB ABCDD ACBBD AABCD
478,DDCAA DDBAA CAADD ABBDD ACCDC DCBBA DBABB ACDCC DCCBA DCBAA AABCD ABCDD
479,ABCDD DDBAA DDBAA AABCD ABCDD DDCBA CCCAC ABCDD DDCBA DCBAA ABBCD ABCDD
480,DDBAA DCABB BACDD AABDD ABCDC DDCBA BBACD DDBAA DDCBA AABDD ABCBD DCACB
481,DDCAA BBACD DDBAA CBCAD ABCDD ABDDB DCBAB ADCCC DDCBA DDABA BABDD DDBAA
482,DDBAA BACCD BABDC DCBBA DCBAA ABCDD DDCAA BAACD ABBDD DCBAA AADDB BDDCA
483,DDBAA BDDAA DCBAA AACDD DDCBA DAACD AACDC DDCAA BAADD ABBCD DAABC CDDBA
484,ABBCD ABBCD ACCDC DCBAA AACDD ABCCD DDCAA DDCBA DCAAC ABCDD DDCAA DDBBA
485,DDAAB AABDD ABCDD DDCBA DDCBA AABDD ABDDC DCCBA AACDD ACCCD DCCAA DDBAA
486,BCCDA DBACC CABDD ABDCC CCDDA CDCBA AABDD DDBAA CDDBA ABCCD DCAAC ACABD
487,BAADD DDBBA DDBAA DCBAC ABCDD AABDD CDCAA AABCD ABCDD DBABB DDBAA ABCCD
488,ABDDC DCCAA BAADD AADDB DCBAB DDCBA AABDD DDBAA DDCAA DDBAA ABCCD ABBCD
489,BDDBA DDBAA DCABB ABBDD AADDB DDCAA ABDDC BADCA DDBAA DCBAA ABBDD ABBDD
490,DDBAA DCACB DBABD AACDD ABCDD DCCBA BABDD CBADB DDCBA BACCD CCBBB CCBCB
491,ABCCD DCABA AACCD DDCAA CCDBA DDBAB ABDDC DCBAA DCCBA ABCDD ABBCD AACCD
492,DDCAA DDBAA BCAAD AABDD ABDCC DDCBA DBAAC DAACD DDCAA DCBBA ABBCD ABDCC
493,AACDC AACCD DCDBA CDBBA DDBAA ABCDD AABDD DDCAA DDCAA ABCCD CCACC DDCAA
494,CDCAA DDBAA DDBAA AABDD ABCDD DDCAA BAACD ABDCD CDDBA DCBBA DCCBA AABDD
495,DCAAB CACBD ACCCD AABCD ABBCD AADDC DCDAA DCCAA DDBAA ABDCC BABCD DDBAA
496,ADCBC CBDBA DDBAA DCCBA AACDD ABCDD DDBAA DCCBA BABCD ABCDD CAABD CCDCA
497,ACBAD DDCBA DDCAA CCDAA AABDD BCDCA ACDCA ADDCB DCBAA DBBAB BBABD AACCD
498,ABADD DBABD DDCBA AABDD DCAAC ABCDD DDBAA BDBAD BDDCA ABCDD BABCD DCAAC
499,ACDCB DDBAA AABDD DDCAA AACDD ABCDD CDCAA CDDBA DCAAB ABCDD DDBAA BABDD
